CVE,"Impact Score (1-10, 10 being the worst)",Keyword,Description,Last Modified,Link
CVE-2023-21722,3.6,.NET Framework,.NET Framework Denial of Service Vulnerability,2024-05-29T03:15:25.193,https://cve.circl.lu/cve/CVE-2023-21722
CVE-2023-24897,5.9,.NET Framework,".NET, .NET Framework, and Visual Studio Remote Code Execution Vulnerability",2024-05-29T02:15:18.930,https://cve.circl.lu/cve/CVE-2023-24897
CVE-2023-29331,3.6,.NET Framework,".NET, .NET Framework, and Visual Studio Denial of Service Vulnerability",2024-05-29T02:15:39.133,https://cve.circl.lu/cve/CVE-2023-29331
CVE-2023-36873,3.6,.NET Framework,.NET Framework Spoofing Vulnerability,2024-05-29T02:16:21.670,https://cve.circl.lu/cve/CVE-2023-36873
CVE-2023-36049,5.9,.NET Framework,".NET, .NET Framework, and Visual Studio Elevation of Privilege Vulnerability",2024-05-29T02:16:00.880,https://cve.circl.lu/cve/CVE-2023-36049
CVE-2024-30164,NA,AWS,"Amazon AWS Client VPN has a buffer overflow that could potentially allow a local actor to execute arbitrary commands with elevated permissions. This is resolved in 3.11.1 on Windows, 3.9.1 on macOS, and 3.12.1 on Linux. NOTE: although the macOS resolution is the same as for CVE-2024-30165, this vulnerability on macOS is not the same as CVE-2024-30165.",2024-05-29T13:02:09.280,https://cve.circl.lu/cve/CVE-2024-30164
CVE-2024-30165,NA,AWS,"Amazon AWS Client VPN before 3.9.1 on macOS has a buffer overflow that could potentially allow a local actor to execute arbitrary commands with elevated permissions, a different vulnerability than CVE-2024-30164.",2024-05-29T13:02:09.280,https://cve.circl.lu/cve/CVE-2024-30165
CVE-2023-23408,3.6,Apache,Azure Apache Ambari Spoofing Vulnerability,2024-05-29T04:15:18.130,https://cve.circl.lu/cve/CVE-2023-23408
CVE-2023-35393,3.6,Apache,Azure Apache Hive Spoofing Vulnerability,2024-05-29T02:15:52.557,https://cve.circl.lu/cve/CVE-2023-35393
CVE-2023-36877,3.6,Apache,Azure Apache Oozie Spoofing Vulnerability,2024-05-29T02:16:21.950,https://cve.circl.lu/cve/CVE-2023-36877
CVE-2023-36881,3.6,Apache,Azure Apache Ambari Spoofing Vulnerability,2024-05-29T02:16:22.107,https://cve.circl.lu/cve/CVE-2023-36881
CVE-2023-38188,3.6,Apache,Azure Apache Hadoop Spoofing Vulnerability,2024-05-29T02:16:29.860,https://cve.circl.lu/cve/CVE-2023-38188
CVE-2019-1172,1.4,Azure,"An information disclosure vulnerability exists in Azure Active Directory (AAD) Microsoft Account (MSA) during the login request session. An attacker who successfully exploited the vulnerability could take over a user's account.To exploit the vulnerability, an attacker would have to trick a user into browsing to a specially crafted website, allowing the attacker to steal the user's token.The security update addresses the vulnerability by correcting how MSA handles cookies.",2024-05-29T17:16:06.453,https://cve.circl.lu/cve/CVE-2019-1172
CVE-2019-1258,5.9,Azure,"An elevation of privilege vulnerability exists in Azure Active Directory Authentication Library On-Behalf-Of flow, in the way the library caches tokens. This vulnerability allows an authenticated attacker to perform actions in context of another user.The authenticated attacker can exploit this vulneraiblity by accessing a service configured for On-Behalf-Of flow that assigns incorrect tokens.This security update addresses the vulnerability by removing fallback cache look-up for On-Behalf-Of scenarios.",2024-05-29T17:16:16.327,https://cve.circl.lu/cve/CVE-2019-1258
CVE-2021-42306,5.2,Azure,"An information disclosure vulnerability manifests when a user or an application uploads unprotected private key data as part of an authentication certificate keyCredential  on an Azure AD Application or Service Principal (which is not recommended). This vulnerability allows a user or service in the tenant with application read access to read the private key data that was added to the application.Azure AD addressed this vulnerability by preventing disclosure of any private key values added to the application.Microsoft has identified services that could manifest this vulnerability, and steps that customers should take to be protected. Refer to the FAQ section for more information.For more details on this issue, please refer to the MSRC Blog Entry.",2024-05-28T21:15:29.680,https://cve.circl.lu/cve/CVE-2021-42306
CVE-2022-37968,6.0,Azure,"Microsoft has identified a vulnerability affecting the cluster connect feature of Azure Arc-enabled Kubernetes clusters. This vulnerability could allow an unauthenticated user to elevate their privileges and potentially gain administrative control over the Kubernetes cluster. Additionally, because Azure Stack Edge allows customers to deploy Kubernetes workloads on their devices via Azure Arc, Azure Stack Edge devices are also vulnerable to this vulnerability.",2024-05-29T14:15:13.743,https://cve.circl.lu/cve/CVE-2022-37968
CVE-2023-21531,5.9,Azure,Azure Service Fabric Container Elevation of Privilege Vulnerability,2024-05-29T03:15:14.077,https://cve.circl.lu/cve/CVE-2023-21531
CVE-2024-26583,3.6,Atom,"In the Linux kernel, the following vulnerability has been resolved:tls: fix race between async notify and socket closeThe submitting thread (one which called recvmsg/sendmsg)may exit as soon as the async crypto handler calls complete()so any code past that point risks touching already freed data.Try to avoid the locking and extra flags altogether.Have the main thread hold an extra reference, this waywe can depend solely on the atomic ref counter forsynchronization.Don't futz with reiniting the completion, either, we are nowtightly controlling when completion fires.",2024-05-25T15:15:08.700,https://cve.circl.lu/cve/CVE-2024-26583
CVE-2024-36887,NA,Atom,"In the Linux kernel, the following vulnerability has been resolved:e1000e: change usleep_range to udelay in PHY mdic accessThis is a partial revert of commit 6dbdd4de0362 (""e1000e: Workaroundfor sporadic MDI error on Meteor Lake systems""). The referenced commitused usleep_range inside the PHY access routines, which are sometimescalled from an atomic context. This can lead to a kernel panic in somescenarios, such as cable disconnection and reconnection on vPro systems.Solve this by changing the usleep_range calls back to udelay.",2024-05-30T18:18:58.870,https://cve.circl.lu/cve/CVE-2024-36887
CVE-2024-36897,NA,Atom,"In the Linux kernel, the following vulnerability has been resolved:drm/amd/display: Atom Integrated System Info v2_2 for DCN35New request from KMD/VBIOS in order to support new UMA carveoutmodel. This fixes a null dereference from accessingCtx->dc_bios->integrated_info while it was NULL.DAL parses through the BIOS and extracts the necessaryintegrated_info but was missing a case for the new BIOSversion 2.3.",2024-05-30T18:18:58.870,https://cve.circl.lu/cve/CVE-2024-36897
CVE-2024-36904,NA,Atom,"In the Linux kernel, the following vulnerability has been resolved:tcp: Use refcount_inc_not_zero() in tcp_twsk_unique().Anderson Nascimento reported a use-after-free splat in tcp_twsk_unique()with nice analysis.Since commit ec94c2696f0b (""tcp/dccp: avoid one atomic operation fortimewait hashdance""), inet_twsk_hashdance() sets TIME-WAIT socket'ssk_refcnt after putting it into ehash and releasing the bucket lock.Thus, there is a small race window where other threads could try toreuse the port during connect() and call sock_hold() in tcp_twsk_unique()for the TIME-WAIT socket with zero refcnt.If that happens, the refcnt taken by tcp_twsk_unique() is overwrittenand sock_put() will cause underflow, triggering a real use-after-freesomewhere else.To avoid the use-after-free, we need to use refcount_inc_not_zero() intcp_twsk_unique() and give up on reusing the port if it returns false.[0]:refcount_t: addition on 0; use-after-free.WARNING: CPU: 0 PID: 1039313 at lib/refcount.c:25 refcount_warn_saturate+0xe5/0x110CPU: 0 PID: 1039313 Comm: trigger Not tainted 6.8.6-200.fc39.x86_64 #1Hardware name: VMware, Inc. VMware20,1/440BX Desktop Reference Platform, BIOS VMW201.00V.21805430.B64.2305221830 05/22/2023RIP: 0010:refcount_warn_saturate+0xe5/0x110Code: 42 8e ff 0f 0b c3 cc cc cc cc 80 3d aa 13 ea 01 00 0f 85 5e ff ff ff 48 c7 c7 f8 8e b7 82 c6 05 96 13 ea 01 01 e8 7b 42 8e ff <0f> 0b c3 cc cc cc cc 48 c7 c7 50 8f b7 82 c6 05 7a 13 ea 01 01 e8RSP: 0018:ffffc90006b43b60 EFLAGS: 00010282RAX: 0000000000000000 RBX: ffff888009bb3ef0 RCX: 0000000000000027RDX: ffff88807be218c8 RSI: 0000000000000001 RDI: ffff88807be218c0RBP: 0000000000069d70 R08: 0000000000000000 R09: ffffc90006b439f0R10: ffffc90006b439e8 R11: 0000000000000003 R12: ffff8880029ede84R13: 0000000000004e20 R14: ffffffff84356dc0 R15: ffff888009bb3ef0FS:  00007f62c10926c0(0000) GS:ffff88807be00000(0000) knlGS:0000000000000000CS:  0010 DS: 0000 ES: 0000 CR0: 0000000080050033CR2: 0000000020ccb000 CR3: 000000004628c005 CR4: 0000000000f70ef0PKRU: 55555554Call Trace: <TASK> ? refcount_warn_saturate+0xe5/0x110 ? __warn+0x81/0x130 ? refcount_warn_saturate+0xe5/0x110 ? report_bug+0x171/0x1a0 ? refcount_warn_saturate+0xe5/0x110 ? handle_bug+0x3c/0x80 ? exc_invalid_op+0x17/0x70 ? asm_exc_invalid_op+0x1a/0x20 ? refcount_warn_saturate+0xe5/0x110 tcp_twsk_unique+0x186/0x190 __inet_check_established+0x176/0x2d0 __inet_hash_connect+0x74/0x7d0 ? __pfx___inet_check_established+0x10/0x10 tcp_v4_connect+0x278/0x530 __inet_stream_connect+0x10f/0x3d0 inet_stream_connect+0x3a/0x60 __sys_connect+0xa8/0xd0 __x64_sys_connect+0x18/0x20 do_syscall_64+0x83/0x170 entry_SYSCALL_64_after_hwframe+0x78/0x80RIP: 0033:0x7f62c11a885dCode: ff c3 66 2e 0f 1f 84 00 00 00 00 00 90 f3 0f 1e fa 48 89 f8 48 89 f7 48 89 d6 48 89 ca 4d 89 c2 4d 89 c8 4c 8b 4c 24 08 0f 05 <48> 3d 01 f0 ff ff 73 01 c3 48 8b 0d a3 45 0c 00 f7 d8 64 89 01 48RSP: 002b:00007f62c1091e58 EFLAGS: 00000296 ORIG_RAX: 000000000000002aRAX: ffffffffffffffda RBX: 0000000020ccb004 RCX: 00007f62c11a885dRDX: 0000000000000010 RSI: 0000000020ccb000 RDI: 0000000000000003RBP: 00007f62c1091e90 R08: 0000000000000000 R09: 0000000000000000R10: 0000000000000000 R11: 0000000000000296 R12: 00007f62c10926c0R13: ffffffffffffff88 R14: 0000000000000000 R15: 00007ffe237885b0 </TASK>",2024-05-30T18:18:58.870,https://cve.circl.lu/cve/CVE-2024-36904
CVE-2024-36937,NA,Atom,"In the Linux kernel, the following vulnerability has been resolved:xdp: use flags field to disambiguate broadcast redirectWhen redirecting a packet using XDP, the bpf_redirect_map() helper will setup the redirect destination information in struct bpf_redirect_info (usingthe __bpf_xdp_redirect_map() helper function), and the xdp_do_redirect()function will read this information after the XDP program returns and passthe frame on to the right redirect destination.When using the BPF_F_BROADCAST flag to do multicast redirect to a wholemap, __bpf_xdp_redirect_map() sets the 'map' pointer in structbpf_redirect_info to point to the destination map to be broadcast. Andxdp_do_redirect() reacts to the value of this map pointer to decide whetherit's dealing with a broadcast or a single-value redirect. However, if thedestination map is being destroyed before xdp_do_redirect() is called, themap pointer will be cleared out (by bpf_clear_redirect_map()) withoutwaiting for any XDP programs to stop running. This causes xdp_do_redirect()to think that the redirect was to a single target, but the target pointeris also NULL (since broadcast redirects don't have a single target), sothis causes a crash when a NULL pointer is passed to dev_map_enqueue().To fix this, change xdp_do_redirect() to react directly to the presence ofthe BPF_F_BROADCAST flag in the 'flags' value in struct bpf_redirect_infoto disambiguate between a single-target and a broadcast redirect. And onlyread the 'map' pointer if the broadcast flag is set, aborting if that hasbeen cleared out in the meantime. This prevents the crash, while keepingthe atomic (cmpxchg-based) clearing of the map pointer itself, and withoutadding any more checks in the non-broadcast fast path.",2024-05-30T18:18:58.870,https://cve.circl.lu/cve/CVE-2024-36937
CVE-2021-31957,3.6,ASP.NET,ASP.NET Core Denial of Service Vulnerability,2024-05-29T15:15:43.553,https://cve.circl.lu/cve/CVE-2021-31957
CVE-2023-33170,5.9,ASP.NET,ASP.NET and Visual Studio Security Feature Bypass Vulnerability,2024-05-29T03:15:47.190,https://cve.circl.lu/cve/CVE-2023-33170
CVE-2023-36899,5.9,ASP.NET,ASP.NET Elevation of Privilege Vulnerability,2024-05-29T02:16:24.887,https://cve.circl.lu/cve/CVE-2023-36899
CVE-2023-36038,3.6,ASP.NET,ASP.NET Core Denial of Service Vulnerability,2024-05-29T02:15:59.797,https://cve.circl.lu/cve/CVE-2023-36038
CVE-2023-21816,3.6,Active Directory,Windows Active Directory Domain Services API Denial of Service Vulnerability,2024-05-29T03:15:36.743,https://cve.circl.lu/cve/CVE-2023-21816
CVE-2023-35348,3.6,Active Directory,Active Directory Federation Service Security Feature Bypass Vulnerability,2024-05-29T03:15:55.950,https://cve.circl.lu/cve/CVE-2023-35348
CVE-2023-35350,5.9,Active Directory,Windows Active Directory Certificate Services (AD CS) Remote Code Execution Vulnerability,2024-05-29T03:15:56.063,https://cve.circl.lu/cve/CVE-2023-35350
CVE-2024-36110,5.3,Ansible,ansibleguy-webui is an open source WebUI for using Ansible. Multiple forms in versions < 0.0.21 allowed injection of HTML elements. These are returned to the user after executing job actions and thus evaluated by the browser. These issues have been addressed in version 0.0.21 (0.0.21.post2 on pypi). Users are advised to upgrade. There are no known workarounds for these issues.,2024-05-29T13:02:09.280,https://cve.circl.lu/cve/CVE-2024-36110
CVE-2024-4529,NA,CSRF,"The Business Card WordPress plugin through 1.0.0 does not have CSRF checks in some places, which could allow attackers to make logged in users perform unwanted actions such as deleting card categories via CSRF attacks",2024-05-28T12:39:28.377,https://cve.circl.lu/cve/CVE-2024-4529
CVE-2024-4530,NA,CSRF,"The Business Card WordPress plugin through 1.0.0 does not have CSRF checks in some places, which could allow attackers to make logged in users perform unwanted actions such as editing card categories via CSRF attacks",2024-05-28T12:39:28.377,https://cve.circl.lu/cve/CVE-2024-4530
CVE-2024-4531,NA,CSRF,"The Business Card WordPress plugin through 1.0.0 does not have CSRF checks in some places, which could allow attackers to make logged in users perform unwanted actions such as editing cards via CSRF attacks",2024-05-28T12:39:28.377,https://cve.circl.lu/cve/CVE-2024-4531
CVE-2024-4532,NA,CSRF,"The Business Card WordPress plugin through 1.0.0 does not have CSRF checks in some places, which could allow attackers to make logged in users perform unwanted actions such as deleting cards via CSRF attacks",2024-05-28T12:39:28.377,https://cve.circl.lu/cve/CVE-2024-4532
CVE-2024-4534,NA,CSRF,"The KKProgressbar2 Free  WordPress plugin through 1.1.4.2 does not have CSRF check in some places, and is missing sanitisation as well as escaping, which could allow attackers to make logged in admin add Stored XSS payloads via a CSRF attack",2024-05-28T12:39:28.377,https://cve.circl.lu/cve/CVE-2024-4534
CVE-2024-20360,5.9,Cisco,"A vulnerability in the web-based management interface of Cisco Firepower Management Center (FMC) Software could allow an authenticated, remote attacker to conduct SQL injection attacks on an affected system. This vulnerability exists because the web-based management interface does not adequately validate user input. An attacker could exploit this vulnerability by authenticating to the application and sending crafted SQL queries to an affected system. A successful exploit could allow the attacker to obtain any data from the database, execute arbitrary commands on the underlying operating system, and elevate privileges to root. To exploit this vulnerability, an attacker would need at least Read Only user credentials.",2024-05-28T14:29:13.403,https://cve.circl.lu/cve/CVE-2024-20360
CVE-2023-21540,3.6,Cryptograph,Windows Cryptographic Information Disclosure Vulnerability,2024-05-29T03:15:14.990,https://cve.circl.lu/cve/CVE-2023-21540
CVE-2023-21550,3.6,Cryptograph,Windows Cryptographic Information Disclosure Vulnerability,2024-05-29T03:15:16.130,https://cve.circl.lu/cve/CVE-2023-21550
CVE-2023-21551,5.9,Cryptograph,Microsoft Cryptographic Services Elevation of Privilege Vulnerability,2024-05-29T03:15:16.253,https://cve.circl.lu/cve/CVE-2023-21551
CVE-2023-21559,3.6,Cryptograph,Windows Cryptographic Information Disclosure Vulnerability,2024-05-29T03:15:17.110,https://cve.circl.lu/cve/CVE-2023-21559
CVE-2023-21561,5.9,Cryptograph,Microsoft Cryptographic Services Elevation of Privilege Vulnerability,2024-05-29T03:15:17.377,https://cve.circl.lu/cve/CVE-2023-21561
CVE-2023-30309,NA,D-Link,An issue discovered in D-Link DI-7003GV2 routers allows attackers to hijack TCP sessions which could lead to a denial of service.,2024-05-29T13:02:09.280,https://cve.circl.lu/cve/CVE-2023-30309
CVE-2019-1161,5.2,Defender,"An elevation of privilege vulnerability exists when the MpSigStub.exe for Defender allows file deletion in arbitrary locations.To exploit the vulnerability, an attacker would first have to log on to the system. An attacker could then run a specially crafted command that could exploit the vulnerability and delete protected files on an affected system once MpSigStub.exe ran again.The update addresses the vulnerability and blocks the arbitrary deletion.",2024-05-29T17:16:04.430,https://cve.circl.lu/cve/CVE-2019-1161
CVE-2023-23379,5.9,Defender,Microsoft Defender for IoT Elevation of Privilege Vulnerability,2024-05-29T03:15:38.690,https://cve.circl.lu/cve/CVE-2023-23379
CVE-2023-23389,5.2,Defender,Microsoft Defender Elevation of Privilege Vulnerability,2024-05-29T04:15:14.290,https://cve.circl.lu/cve/CVE-2023-23389
CVE-2023-24934,3.6,Defender,Microsoft Defender Security Feature Bypass Vulnerability,2024-05-29T02:15:22.290,https://cve.circl.lu/cve/CVE-2023-24934
CVE-2023-33156,5.9,Defender,Microsoft Defender Elevation of Privilege Vulnerability,2024-05-29T03:15:45.123,https://cve.circl.lu/cve/CVE-2023-33156
CVE-2024-28974,4.7,Dell,"Dell Data Protection Advisor, version(s) 19.9, contain(s) an Inadequate Encryption Strength vulnerability. A low privileged attacker with remote access could potentially exploit this vulnerability, leading to Denial of service.",2024-05-29T19:50:25.303,https://cve.circl.lu/cve/CVE-2024-28974
CVE-2024-36919,NA,Dell,"In the Linux kernel, the following vulnerability has been resolved:scsi: bnx2fc: Remove spin_lock_bh while releasing resources after uploadThe session resources are used by FW and driver when session is offloaded,once session is uploaded these resources are not used. The lock is notrequired as these fields won't be used any longer. The offload and uploadcalls are sequential, hence lock is not required.This will suppress following BUG_ON():[  449.843143] ------------[ cut here ]------------[  449.848302] kernel BUG at mm/vmalloc.c:2727![  449.853072] invalid opcode: 0000 [#1] PREEMPT SMP PTI[  449.858712] CPU: 5 PID: 1996 Comm: kworker/u24:2 Not tainted 5.14.0-118.el9.x86_64 #1Rebooting.[  449.867454] Hardware name: Dell Inc. PowerEdge R730/0WCJNT, BIOS 2.3.4 11/08/2016[  449.876966] Workqueue: fc_rport_eq fc_rport_work [libfc][  449.882910] RIP: 0010:vunmap+0x2e/0x30[  449.887098] Code: 00 65 8b 05 14 a2 f0 4a a9 00 ff ff 00 75 1b 55 48 89 fd e8 34 36 79 00 48 85 ed 74 0b 48 89 ef 31 f6 5d e9 14 fc ff ff 5d c3 <0f> 0b 0f 1f 44 00 00 41 57 41 56 49 89 ce 41 55 49 89 fd 41 54 41[  449.908054] RSP: 0018:ffffb83d878b3d68 EFLAGS: 00010206[  449.913887] RAX: 0000000080000201 RBX: ffff8f4355133550 RCX: 000000000d400005[  449.921843] RDX: 0000000000000001 RSI: 0000000000001000 RDI: ffffb83da53f5000[  449.929808] RBP: ffff8f4ac6675800 R08: ffffb83d878b3d30 R09: 00000000000efbdf[  449.937774] R10: 0000000000000003 R11: ffff8f434573e000 R12: 0000000000001000[  449.945736] R13: 0000000000001000 R14: ffffb83da53f5000 R15: ffff8f43d4ea3ae0[  449.953701] FS:  0000000000000000(0000) GS:ffff8f529fc80000(0000) knlGS:0000000000000000[  449.962732] CS:  0010 DS: 0000 ES: 0000 CR0: 0000000080050033[  449.969138] CR2: 00007f8cf993e150 CR3: 0000000efbe10003 CR4: 00000000003706e0[  449.977102] DR0: 0000000000000000 DR1: 0000000000000000 DR2: 0000000000000000[  449.985065] DR3: 0000000000000000 DR6: 00000000fffe0ff0 DR7: 0000000000000400[  449.993028] Call Trace:[  449.995756]  __iommu_dma_free+0x96/0x100[  450.000139]  bnx2fc_free_session_resc+0x67/0x240 [bnx2fc][  450.006171]  bnx2fc_upload_session+0xce/0x100 [bnx2fc][  450.011910]  bnx2fc_rport_event_handler+0x9f/0x240 [bnx2fc][  450.018136]  fc_rport_work+0x103/0x5b0 [libfc][  450.023103]  process_one_work+0x1e8/0x3c0[  450.027581]  worker_thread+0x50/0x3b0[  450.031669]  ? rescuer_thread+0x370/0x370[  450.036143]  kthread+0x149/0x170[  450.039744]  ? set_kthread_struct+0x40/0x40[  450.044411]  ret_from_fork+0x22/0x30[  450.048404] Modules linked in: vfat msdos fat xfs nfs_layout_nfsv41_files rpcsec_gss_krb5 auth_rpcgss nfsv4 dns_resolver dm_service_time qedf qed crc8 bnx2fc libfcoe libfc scsi_transport_fc intel_rapl_msr intel_rapl_common x86_pkg_temp_thermal intel_powerclamp dcdbas rapl intel_cstate intel_uncore mei_me pcspkr mei ipmi_ssif lpc_ich ipmi_si fuse zram ext4 mbcache jbd2 loop nfsv3 nfs_acl nfs lockd grace fscache netfs irdma ice sd_mod t10_pi sg ib_uverbs ib_core 8021q garp mrp stp llc mgag200 i2c_algo_bit drm_kms_helper syscopyarea sysfillrect sysimgblt mxm_wmi fb_sys_fops cec crct10dif_pclmul ahci crc32_pclmul bnx2x drm ghash_clmulni_intel libahci rfkill i40e libata megaraid_sas mdio wmi sunrpc lrw dm_crypt dm_round_robin dm_multipath dm_snapshot dm_bufio dm_mirror dm_region_hash dm_log dm_zero dm_mod linear raid10 raid456 async_raid6_recov async_memcpy async_pq async_xor async_tx raid6_pq libcrc32c crc32c_intel raid1 raid0 iscsi_ibft squashfs be2iscsi bnx2i cnic uio cxgb4i cxgb4 tls[  450.048497]  libcxgbi libcxgb qla4xxx iscsi_boot_sysfs iscsi_tcp libiscsi_tcp libiscsi scsi_transport_iscsi edd ipmi_devintf ipmi_msghandler[  450.159753] ---[ end trace 712de2c57c64abc8 ]---",2024-05-30T18:18:58.870,https://cve.circl.lu/cve/CVE-2024-36919
CVE-2024-35228,4.2,Django,"Wagtail is an open source content management system built on Django. Due to an improperly applied permission check in the `wagtail.contrib.settings` module, a user with access to the Wagtail admin and knowledge of the URL of the edit view for a settings model can access and update that setting, even when they have not been granted permission over the model. The vulnerability is not exploitable by an ordinary site visitor without access to the Wagtail admin. Patched versions have been released as Wagtail 6.0.5 and 6.1.2. Wagtail releases prior to 6.0 are unaffected. Users are advised to upgrade. Site owners who are unable to upgrade to a patched version can avoid the vulnerability in `ModelViewSet` by registering the model as a snippet instead. No workaround is available for `wagtail.contrib.settings`.",2024-05-31T13:01:46.727,https://cve.circl.lu/cve/CVE-2024-35228
CVE-2024-35140,5.2,Docker,IBM Security Verify Access Docker 10.0.0 through 10.0.6 could allow a local user to escalate their privileges due to improper certificate validation.  IBM X-Force ID:  292416.,2024-05-31T19:14:47.793,https://cve.circl.lu/cve/CVE-2024-35140
CVE-2024-35142,5.9,Docker,IBM Security Verify Access Docker 10.0.0 through 10.0.6 could allow a local user to escalate their privileges due to execution of unnecessary privileges.  IBM X-Force ID:  292418.,2024-05-31T19:14:47.793,https://cve.circl.lu/cve/CVE-2024-35142
CVE-2023-21570,2.7,Dynamics 365,Microsoft Dynamics 365 (on-premises) Cross-site Scripting Vulnerability,2024-05-29T03:15:18.180,https://cve.circl.lu/cve/CVE-2023-21570
CVE-2023-21571,2.7,Dynamics 365,Microsoft Dynamics 365 (on-premises) Cross-site Scripting Vulnerability,2024-05-29T03:15:18.300,https://cve.circl.lu/cve/CVE-2023-21571
CVE-2023-21807,4.7,Dynamics 365,Microsoft Dynamics 365 (on-premises) Cross-site Scripting Vulnerability,2024-05-29T03:15:35.470,https://cve.circl.lu/cve/CVE-2023-21807
CVE-2023-24891,2.7,Dynamics 365,Microsoft Dynamics 365 (on-premises) Cross-site Scripting Vulnerability,2024-05-29T04:15:36.913,https://cve.circl.lu/cve/CVE-2023-24891
CVE-2023-24919,2.7,Dynamics 365,Microsoft Dynamics 365 (on-premises) Cross-site Scripting Vulnerability,2024-05-29T04:15:39.107,https://cve.circl.lu/cve/CVE-2023-24919
CVE-2024-1023,3.6,Eclipse,"A vulnerability in the Eclipse Vert.x toolkit results in a memory leak due to using Netty FastThreadLocal data structures. Specifically, when the Vert.x HTTP client establishes connections to different hosts, triggering the memory leak. The leak can be accelerated with intimate runtime knowledge, allowing an attacker to exploit this vulnerability. For instance, a server accepting arbitrary internet addresses could serve as an attack vector by connecting to these addresses, thereby accelerating the memory leak.",2024-05-31T01:15:53.040,https://cve.circl.lu/cve/CVE-2024-1023
CVE-2024-1300,2.5,Eclipse,"A vulnerability in the Eclipse Vert.x toolkit causes a memory leak in TCP servers configured with TLS and SNI support. When processing an unknown SNI server name assigned the default certificate instead of a mapped certificate, the SSL context is erroneously cached in the server name map, leading to memory exhaustion. This flaw allows attackers to send TLS client hello messages with fake server names, triggering a JVM out-of-memory error.",2024-05-31T01:15:53.967,https://cve.circl.lu/cve/CVE-2024-1300
