CVE,"Impact Score (1-10, 10 being the worst)",Keyword,Description,Last Modified,Link
CVE-2024-3933,4.2,Eclipse,"In Eclipse OpenJ9 release versions prior to 0.44.0 and after 0.13.0, when running with JVM option -Xgc:concurrentScavenge, the sequence generated for System.arrayCopy on the IBM Z platform with hardware and software support for guarded storage [1], could allow access to a buffer with an incorrect length value when executing an arraycopy sequence while the Concurrent Scavenge Garbage Collection cycle is active and the source and destination memory regions for arraycopy overlap. This allows read and write to addresses beyond the end of the array range.",2024-05-28T12:39:28.377,https://cve.circl.lu/cve/CVE-2024-3933
CVE-2024-35229,1.4,Ethereum,"ZKsync Era is a layer 2 rollup that uses zero-knowledge proofs to scale Ethereum. Prior to version 1.3.10, there is a very specific pattern `f(a(),b()); check_if_a_executed_last()` in Yul that exposes a bug in evaluation order of Yul function arguments. This vulnerability has been fixed in version 1.3.10. As a workaround, update and redeploy affected contracts.",2024-05-28T12:39:28.377,https://cve.circl.lu/cve/CVE-2024-35229
CVE-2023-23396,3.6,Excel,Microsoft Excel Denial of Service Vulnerability,2024-05-29T04:15:15.510,https://cve.circl.lu/cve/CVE-2023-23396
CVE-2023-23399,5.9,Excel,Microsoft Excel Remote Code Execution Vulnerability,2024-05-29T04:15:15.930,https://cve.circl.lu/cve/CVE-2023-23399
CVE-2023-24953,5.9,Excel,Microsoft Excel Remote Code Execution Vulnerability,2024-05-29T02:15:25.040,https://cve.circl.lu/cve/CVE-2023-24953
CVE-2023-32029,5.9,Excel,Microsoft Excel Remote Code Execution Vulnerability,2024-05-29T02:15:47.480,https://cve.circl.lu/cve/CVE-2023-32029
CVE-2023-33133,5.9,Excel,Microsoft Excel Remote Code Execution Vulnerability,2024-05-29T02:15:48.327,https://cve.circl.lu/cve/CVE-2023-33133
CVE-2023-21547,3.6,Exchange,Internet Key Exchange (IKE) Protocol Denial of Service Vulnerability,2024-05-29T03:15:15.733,https://cve.circl.lu/cve/CVE-2023-21547
CVE-2023-21677,3.6,Exchange,Windows Internet Key Exchange (IKE) Extension Denial of Service Vulnerability,2024-05-29T03:15:18.890,https://cve.circl.lu/cve/CVE-2023-21677
CVE-2023-21683,3.6,Exchange,Windows Internet Key Exchange (IKE) Extension Denial of Service Vulnerability,2024-05-29T03:15:19.797,https://cve.circl.lu/cve/CVE-2023-21683
CVE-2023-21745,5.9,Exchange,Microsoft Exchange Server Spoofing Vulnerability,2024-05-29T03:15:28.170,https://cve.circl.lu/cve/CVE-2023-21745
CVE-2023-21758,3.6,Exchange,Windows Internet Key Exchange (IKE) Extension Denial of Service Vulnerability,2024-05-29T03:15:29.863,https://cve.circl.lu/cve/CVE-2023-21758
CVE-2019-0714,4.0,Exploit,"A denial of service vulnerability exists when Microsoft Hyper-V Network Switch on a host server fails to properly validate input from a privileged user on a guest operating system. An attacker who successfully exploited the vulnerability could cause the host server to crash.To exploit the vulnerability, an attacker who already has a privileged account on a guest operating system, running as a virtual machine, could run a specially crafted application that causes a host machine to crash.The update addresses the vulnerability by modifying how virtual machines access the Hyper-V Network Switch.",2024-05-29T17:15:52.720,https://cve.circl.lu/cve/CVE-2019-0714
CVE-2019-0715,4.0,Exploit,"A denial of service vulnerability exists when Microsoft Hyper-V Network Switch on a host server fails to properly validate input from a privileged user on a guest operating system. An attacker who successfully exploited the vulnerability could cause the host server to crash.To exploit the vulnerability, an attacker who already has a privileged account on a guest operating system, running as a virtual machine, could run a specially crafted application that causes a host machine to crash.The update addresses the vulnerability by modifying how virtual machines access the Hyper-V Network Switch.",2024-05-29T17:15:53.033,https://cve.circl.lu/cve/CVE-2019-0715
CVE-2019-0716,4.0,Exploit,"A denial of service vulnerability exists when Windows improperly handles objects in memory. An attacker who successfully exploited the vulnerability could cause a target system to stop responding.To exploit this vulnerability, an attacker would have to log on to an affected system and run a specially crafted application. The vulnerability would not allow an attacker to execute code or to elevate user rights directly, but it could be used to cause a target system to stop responding.The update addresses the vulnerability by correcting how Windows handles objects in memory.",2024-05-29T17:15:53.280,https://cve.circl.lu/cve/CVE-2019-0716
CVE-2019-0717,4.0,Exploit,"A denial of service vulnerability exists when Microsoft Hyper-V Network Switch on a host server fails to properly validate input from a privileged user on a guest operating system. An attacker who successfully exploited the vulnerability could cause the host server to crash.To exploit the vulnerability, an attacker who already has a privileged account on a guest operating system, running as a virtual machine, could run a specially crafted application that causes a host machine to crash.The update addresses the vulnerability by modifying how virtual machines access the Hyper-V Network Switch.",2024-05-29T17:15:53.527,https://cve.circl.lu/cve/CVE-2019-0717
CVE-2019-0718,4.0,Exploit,"A denial of service vulnerability exists when Microsoft Hyper-V Network Switch on a host server fails to properly validate input from a privileged user on a guest operating system. An attacker who successfully exploited the vulnerability could cause the host server to crash.To exploit the vulnerability, an attacker who already has a privileged account on a guest operating system, running as a virtual machine, could run a specially crafted application that causes a host machine to crash.The update addresses the vulnerability by modifying how virtual machines access the Hyper-V Network Switch.",2024-05-29T17:15:53.760,https://cve.circl.lu/cve/CVE-2019-0718
CVE-2024-21315,5.9,Endpoint,Microsoft Defender for Endpoint Protection Elevation of Privilege Vulnerability,2024-05-29T00:15:17.893,https://cve.circl.lu/cve/CVE-2024-21315
CVE-2024-1491,3.6,Endpoint,"The devices allow access to an unprotected endpoint that allows MPFS file system binary image upload without authentication. The MPFS2 file system module provides a light-weight read-only file system that can be stored in external EEPROM, external serial flash, or internal flash program memory. This file system serves as the basis for the HTTP2 web server module, but is also used by the SNMP module and is available to other applications that require basic read-only storage capabilities. This can be exploited to overwrite the flash program memory that holds the web server's main interfaces and execute arbitrary code.",2024-05-28T17:15:09.103,https://cve.circl.lu/cve/CVE-2024-1491
CVE-2024-34949,NA,Endpoint,"SQL injection vulnerability in Likeshop before 2.5.7 allows attackers to run abitrary SQL commands via the function OrderLogic::getOrderList function, exploited at the /admin/order/lists.html endpoint.",2024-05-30T16:15:10.217,https://cve.circl.lu/cve/CVE-2024-34949
CVE-2024-34029,1.4,Endpoint,"Mattermost versions 9.5.x <= 9.5.3, 9.7.x <= 9.7.1 and 8.1.x <= 8.1.12 fail to perform a proper authorization check in the /api/v4/groups/<group-id>/channels/<channel-id>/link endpoint which allows a user to learn the members of an AD/LDAP group that is linked to a team by adding the group to a channel, even if the user has no access to the team.",2024-05-28T12:39:28.377,https://cve.circl.lu/cve/CVE-2024-34029
CVE-2024-35238,3.6,Endpoint,"Minder by Stacklok is an open source software supply chain security platform. Minder prior to version 0.0.51 is vulnerable to a denial-of-service (DoS) attack which could allow an attacker to crash the Minder server and deny other users access to it. The root cause of the vulnerability is that Minders sigstore verifier reads an untrusted response entirely into memory without enforcing a limit on the response body. An attacker can exploit this by making Minder make a request to an attacker-controlled endpoint which returns a response with a large body which will crash the Minder server. Specifically, the point of failure is where Minder parses the response from the GitHub attestations endpoint in `getAttestationReply`. Here, Minder makes a request to the `orgs/$owner/attestations/$checksumref` GitHub endpoint (line 285) and then parses the response into the `AttestationReply` (line 295). The way Minder parses the response on line 295 makes it prone to DoS if the response is large enough. Essentially, the response needs to be larger than the machine has available memory.  Version 0.0.51 contains a patch for this issue.The content that is hosted at the `orgs/$owner/attestations/$checksumref` GitHub attestation endpoint is controlled by users including unauthenticated users to Minders threat model. However, a user will need to configure their own Minder settings to cause Minder to make Minder send a request to fetch the attestations. The user would need to know of a package whose attestations were configured in such a way that they would return a large response when fetching them. As such, the steps needed to carry out this attack would look as such:1. The attacker adds a package to ghcr.io with attestations that can be fetched via the `orgs/$owner/attestations/$checksumref` GitHub endpoint.2. The attacker registers on Minder and makes Minder fetch the attestations.3. Minder fetches attestations and crashes thereby being denied of service.",2024-05-28T12:39:28.377,https://cve.circl.lu/cve/CVE-2024-35238
CVE-2024-3400,6.0,Firewall,"A command injection as a result of arbitrary file creation vulnerability in the GlobalProtect feature of Palo Alto Networks PAN-OS software for specific PAN-OS versions and distinct feature configurations may enable an unauthenticated attacker to execute arbitrary code with root privileges on the firewall.Cloud NGFW, Panorama appliances, and Prisma Access are not impacted by this vulnerability.",2024-05-29T16:00:24.093,https://cve.circl.lu/cve/CVE-2024-3400
CVE-2023-43848,NA,Firewall,Incorrect access control in the firewall management function of web interface in Aten PE6208 2.3.228 and 2.4.232 allows remote authenticated users to alter local firewall settings of the device as if they were the administrator via HTTP POST request.,2024-05-29T13:02:09.280,https://cve.circl.lu/cve/CVE-2023-43848
CVE-2024-1100,NA,GIS,Improper Neutralization of Special Elements used in an SQL Command ('SQL Injection') vulnerability in Vadi Corporate Information Systems DIGIKENT GIS allows SQL Injection.This issue affects DIGIKENT GIS: through 2.23.5.,2024-05-30T13:15:41.297,https://cve.circl.lu/cve/CVE-2024-1100
CVE-2024-5218,2.7,Google,"The Reviews and Rating – Google Reviews plugin for WordPress is vulnerable to Stored Cross-Site Scripting via the plugin's file upload feature in all versions up to, and including, 5.2 due to insufficient input sanitization and output escaping. This makes it possible for authenticated attackers, with Author-level access and above, to inject arbitrary web scripts in pages that will execute whenever a user accesses an injected page.",2024-05-28T12:39:42.673,https://cve.circl.lu/cve/CVE-2024-5218
CVE-2024-5274,5.9,Google,Type Confusion in V8 in Google Chrome prior to 125.0.6422.112 allowed a remote attacker to execute arbitrary code inside a sandbox via a crafted HTML page. (Chromium security severity: High),2024-05-29T01:00:04.140,https://cve.circl.lu/cve/CVE-2024-5274
CVE-2024-36901,NA,Google,"In the Linux kernel, the following vulnerability has been resolved:ipv6: prevent NULL dereference in ip6_output()According to syzbot, there is a chance that ip6_dst_idev()returns NULL in ip6_output(). Most places in IPv6 stackdeal with a NULL idev just fine, but not here.syzbot reported:general protection fault, probably for non-canonical address 0xdffffc00000000bc: 0000 [#1] PREEMPT SMP KASAN PTIKASAN: null-ptr-deref in range [0x00000000000005e0-0x00000000000005e7]CPU: 0 PID: 9775 Comm: syz-executor.4 Not tainted 6.9.0-rc5-syzkaller-00157-g6a30653b604a #0Hardware name: Google Google Compute Engine/Google Compute Engine, BIOS Google 03/27/2024 RIP: 0010:ip6_output+0x231/0x3f0 net/ipv6/ip6_output.c:237Code: 3c 1e 00 49 89 df 74 08 4c 89 ef e8 19 58 db f7 48 8b 44 24 20 49 89 45 00 49 89 c5 48 8d 9d e0 05 00 00 48 89 d8 48 c1 e8 03 <42> 0f b6 04 38 84 c0 4c 8b 74 24 28 0f 85 61 01 00 00 8b 1b 31 ffRSP: 0018:ffffc9000927f0d8 EFLAGS: 00010202RAX: 00000000000000bc RBX: 00000000000005e0 RCX: 0000000000040000RDX: ffffc900131f9000 RSI: 0000000000004f47 RDI: 0000000000004f48RBP: 0000000000000000 R08: ffffffff8a1f0b9a R09: 1ffffffff1f51fadR10: dffffc0000000000 R11: fffffbfff1f51fae R12: ffff8880293ec8c0R13: ffff88805d7fc000 R14: 1ffff1100527d91a R15: dffffc0000000000FS:  00007f135c6856c0(0000) GS:ffff8880b9400000(0000) knlGS:0000000000000000CS:  0010 DS: 0000 ES: 0000 CR0: 0000000080050033CR2: 0000000020000080 CR3: 0000000064096000 CR4: 00000000003506f0DR0: 0000000000000000 DR1: 0000000000000000 DR2: 0000000000000000DR3: 0000000000000000 DR6: 00000000fffe0ff0 DR7: 0000000000000400Call Trace: <TASK>  NF_HOOK include/linux/netfilter.h:314 [inline]  ip6_xmit+0xefe/0x17f0 net/ipv6/ip6_output.c:358  sctp_v6_xmit+0x9f2/0x13f0 net/sctp/ipv6.c:248  sctp_packet_transmit+0x26ad/0x2ca0 net/sctp/output.c:653  sctp_packet_singleton+0x22c/0x320 net/sctp/outqueue.c:783  sctp_outq_flush_ctrl net/sctp/outqueue.c:914 [inline]  sctp_outq_flush+0x6d5/0x3e20 net/sctp/outqueue.c:1212  sctp_side_effects net/sctp/sm_sideeffect.c:1198 [inline]  sctp_do_sm+0x59cc/0x60c0 net/sctp/sm_sideeffect.c:1169  sctp_primitive_ASSOCIATE+0x95/0xc0 net/sctp/primitive.c:73  __sctp_connect+0x9cd/0xe30 net/sctp/socket.c:1234  sctp_connect net/sctp/socket.c:4819 [inline]  sctp_inet_connect+0x149/0x1f0 net/sctp/socket.c:4834  __sys_connect_file net/socket.c:2048 [inline]  __sys_connect+0x2df/0x310 net/socket.c:2065  __do_sys_connect net/socket.c:2075 [inline]  __se_sys_connect net/socket.c:2072 [inline]  __x64_sys_connect+0x7a/0x90 net/socket.c:2072  do_syscall_x64 arch/x86/entry/common.c:52 [inline]  do_syscall_64+0xf5/0x240 arch/x86/entry/common.c:83 entry_SYSCALL_64_after_hwframe+0x77/0x7f",2024-05-30T18:18:58.870,https://cve.circl.lu/cve/CVE-2024-36901
CVE-2024-36902,NA,Google,"In the Linux kernel, the following vulnerability has been resolved:ipv6: fib6_rules: avoid possible NULL dereference in fib6_rule_action()syzbot is able to trigger the following crash [1],caused by unsafe ip6_dst_idev() use.Indeed ip6_dst_idev() can return NULL, and must always be checked.[1]Oops: general protection fault, probably for non-canonical address 0xdffffc0000000000: 0000 [#1] PREEMPT SMP KASAN PTIKASAN: null-ptr-deref in range [0x0000000000000000-0x0000000000000007]CPU: 0 PID: 31648 Comm: syz-executor.0 Not tainted 6.9.0-rc4-next-20240417-syzkaller #0Hardware name: Google Google Compute Engine/Google Compute Engine, BIOS Google 03/27/2024 RIP: 0010:__fib6_rule_action net/ipv6/fib6_rules.c:237 [inline] RIP: 0010:fib6_rule_action+0x241/0x7b0 net/ipv6/fib6_rules.c:267Code: 02 00 00 49 8d 9f d8 00 00 00 48 89 d8 48 c1 e8 03 42 80 3c 20 00 74 08 48 89 df e8 f9 32 bf f7 48 8b 1b 48 89 d8 48 c1 e8 03 <42> 80 3c 20 00 74 08 48 89 df e8 e0 32 bf f7 4c 8b 03 48 89 ef 4cRSP: 0018:ffffc9000fc1f2f0 EFLAGS: 00010246RAX: 0000000000000000 RBX: 0000000000000000 RCX: 1a772f98c8186700RDX: 0000000000000003 RSI: ffffffff8bcac4e0 RDI: ffffffff8c1f9760RBP: ffff8880673fb980 R08: ffffffff8fac15ef R09: 1ffffffff1f582bdR10: dffffc0000000000 R11: fffffbfff1f582be R12: dffffc0000000000R13: 0000000000000080 R14: ffff888076509000 R15: ffff88807a029a00FS:  00007f55e82ca6c0(0000) GS:ffff8880b9400000(0000) knlGS:0000000000000000CS:  0010 DS: 0000 ES: 0000 CR0: 0000000080050033CR2: 0000001b31d23000 CR3: 0000000022b66000 CR4: 00000000003506f0DR0: 0000000000000000 DR1: 0000000000000000 DR2: 0000000000000000DR3: 0000000000000000 DR6: 00000000fffe0ff0 DR7: 0000000000000400Call Trace: <TASK>  fib_rules_lookup+0x62c/0xdb0 net/core/fib_rules.c:317  fib6_rule_lookup+0x1fd/0x790 net/ipv6/fib6_rules.c:108  ip6_route_output_flags_noref net/ipv6/route.c:2637 [inline]  ip6_route_output_flags+0x38e/0x610 net/ipv6/route.c:2649  ip6_route_output include/net/ip6_route.h:93 [inline]  ip6_dst_lookup_tail+0x189/0x11a0 net/ipv6/ip6_output.c:1120  ip6_dst_lookup_flow+0xb9/0x180 net/ipv6/ip6_output.c:1250  sctp_v6_get_dst+0x792/0x1e20 net/sctp/ipv6.c:326  sctp_transport_route+0x12c/0x2e0 net/sctp/transport.c:455  sctp_assoc_add_peer+0x614/0x15c0 net/sctp/associola.c:662  sctp_connect_new_asoc+0x31d/0x6c0 net/sctp/socket.c:1099  __sctp_connect+0x66d/0xe30 net/sctp/socket.c:1197  sctp_connect net/sctp/socket.c:4819 [inline]  sctp_inet_connect+0x149/0x1f0 net/sctp/socket.c:4834  __sys_connect_file net/socket.c:2048 [inline]  __sys_connect+0x2df/0x310 net/socket.c:2065  __do_sys_connect net/socket.c:2075 [inline]  __se_sys_connect net/socket.c:2072 [inline]  __x64_sys_connect+0x7a/0x90 net/socket.c:2072  do_syscall_x64 arch/x86/entry/common.c:52 [inline]  do_syscall_64+0xf5/0x240 arch/x86/entry/common.c:83 entry_SYSCALL_64_after_hwframe+0x77/0x7f",2024-05-30T18:18:58.870,https://cve.circl.lu/cve/CVE-2024-36902
CVE-2024-36905,NA,Google,"In the Linux kernel, the following vulnerability has been resolved:tcp: defer shutdown(SEND_SHUTDOWN) for TCP_SYN_RECV socketsTCP_SYN_RECV state is really special, it is only used bycross-syn connections, mostly used by fuzzers.In the following crash [1], syzbot managed to trigger a divideby zero in tcp_rcv_space_adjust()A socket makes the following state transitions,without ever calling tcp_init_transfer(),meaning tcp_init_buffer_space() is also not called.         TCP_CLOSEconnect()         TCP_SYN_SENT         TCP_SYN_RECVshutdown() -> tcp_shutdown(sk, SEND_SHUTDOWN)         TCP_FIN_WAIT1To fix this issue, change tcp_shutdown() to notperform a TCP_SYN_RECV -> TCP_FIN_WAIT1 transition,which makes no sense anyway.When tcp_rcv_state_process() later changes socket statefrom TCP_SYN_RECV to TCP_ESTABLISH, then look atsk->sk_shutdown to finally enter TCP_FIN_WAIT1 state,and send a FIN packet from a sane socket state.This means tcp_send_fin() can now be called from BHcontext, and must use GFP_ATOMIC allocations.[1]divide error: 0000 [#1] PREEMPT SMP KASAN NOPTICPU: 1 PID: 5084 Comm: syz-executor358 Not tainted 6.9.0-rc6-syzkaller-00022-g98369dccd2f8 #0Hardware name: Google Google Compute Engine/Google Compute Engine, BIOS Google 03/27/2024 RIP: 0010:tcp_rcv_space_adjust+0x2df/0x890 net/ipv4/tcp_input.c:767Code: e3 04 4c 01 eb 48 8b 44 24 38 0f b6 04 10 84 c0 49 89 d5 0f 85 a5 03 00 00 41 8b 8e c8 09 00 00 89 e8 29 c8 48 0f af c3 31 d2 <48> f7 f1 48 8d 1c 43 49 8d 96 76 08 00 00 48 89 d0 48 c1 e8 03 48RSP: 0018:ffffc900031ef3f0 EFLAGS: 00010246RAX: 0c677a10441f8f42 RBX: 000000004fb95e7e RCX: 0000000000000000RDX: 0000000000000000 RSI: 0000000000000000 RDI: 0000000000000000RBP: 0000000027d4b11f R08: ffffffff89e535a4 R09: 1ffffffff25e6ab7R10: dffffc0000000000 R11: ffffffff8135e920 R12: ffff88802a9f8d30R13: dffffc0000000000 R14: ffff88802a9f8d00 R15: 1ffff1100553f2daFS:  00005555775c0380(0000) GS:ffff8880b9500000(0000) knlGS:0000000000000000CS:  0010 DS: 0000 ES: 0000 CR0: 0000000080050033CR2: 00007f1155bf2304 CR3: 000000002b9f2000 CR4: 0000000000350ef0Call Trace: <TASK>  tcp_recvmsg_locked+0x106d/0x25a0 net/ipv4/tcp.c:2513  tcp_recvmsg+0x25d/0x920 net/ipv4/tcp.c:2578  inet6_recvmsg+0x16a/0x730 net/ipv6/af_inet6.c:680  sock_recvmsg_nosec net/socket.c:1046 [inline]  sock_recvmsg+0x109/0x280 net/socket.c:1068  ____sys_recvmsg+0x1db/0x470 net/socket.c:2803  ___sys_recvmsg net/socket.c:2845 [inline]  do_recvmmsg+0x474/0xae0 net/socket.c:2939  __sys_recvmmsg net/socket.c:3018 [inline]  __do_sys_recvmmsg net/socket.c:3041 [inline]  __se_sys_recvmmsg net/socket.c:3034 [inline]  __x64_sys_recvmmsg+0x199/0x250 net/socket.c:3034  do_syscall_x64 arch/x86/entry/common.c:52 [inline]  do_syscall_64+0xf5/0x240 arch/x86/entry/common.c:83 entry_SYSCALL_64_after_hwframe+0x77/0x7fRIP: 0033:0x7faeb6363db9Code: 28 00 00 00 75 05 48 83 c4 28 c3 e8 c1 17 00 00 90 48 89 f8 48 89 f7 48 89 d6 48 89 ca 4d 89 c2 4d 89 c8 4c 8b 4c 24 08 0f 05 <48> 3d 01 f0 ff ff 73 01 c3 48 c7 c1 b8 ff ff ff f7 d8 64 89 01 48RSP: 002b:00007ffcc1997168 EFLAGS: 00000246 ORIG_RAX: 000000000000012bRAX: ffffffffffffffda RBX: 0000000000000000 RCX: 00007faeb6363db9RDX: 0000000000000001 RSI: 0000000020000bc0 RDI: 0000000000000005RBP: 0000000000000000 R08: 0000000000000000 R09: 000000000000001cR10: 0000000000000122 R11: 0000000000000246 R12: 0000000000000000R13: 0000000000000000 R14: 0000000000000001 R15: 0000000000000001",2024-05-30T18:18:58.870,https://cve.circl.lu/cve/CVE-2024-36905
CVE-2024-35232,1.4,GitHub,"github.com/huandu/facebook is a Go package that fully supports the Facebook Graph API with file upload, batch request and marketing API. access_token can be exposed in error message on fail in HTTP request. This issue has been patched in version 2.7.2.",2024-05-28T12:39:42.673,https://cve.circl.lu/cve/CVE-2024-35232
CVE-2024-35221,1.4,GitHub,Rubygems.org is the Ruby community's gem hosting service. A Gem publisher can cause a Remote DoS when publishing a Gem. This is due to how Ruby reads the Manifest of Gem files when using Gem::Specification.from_yaml. from_yaml makes use of SafeYAML.load which allows YAML aliases inside the YAML-based metadata of a gem. YAML aliases allow for Denial of Service attacks with so-called `YAML-bombs` (comparable to Billion laughs attacks). This was patched. There is is no action required by users. This issue is also tracked as GHSL-2024-001 and was discovered by the GitHub security lab.,2024-05-30T13:15:41.297,https://cve.circl.lu/cve/CVE-2024-35221
CVE-2024-3924,2.7,GitHub,"A code injection vulnerability exists in the huggingface/text-generation-inference repository, specifically within the `autodocs.yml` workflow file. The vulnerability arises from the insecure handling of the `github.head_ref` user input, which is used to dynamically construct a command for installing a software package. An attacker can exploit this by forking the repository, creating a branch with a malicious payload as the name, and then opening a pull request to the base repository. Successful exploitation could lead to arbitrary code execution within the context of the GitHub Actions runner. This issue affects versions up to and including v2.0.0 and was fixed in version 2.0.0.",2024-05-30T18:19:11.743,https://cve.circl.lu/cve/CVE-2024-3924
CVE-2019-0720,6.0,Hyper-V,"A remote code execution vulnerability exists when Windows Hyper-V Network Switch on a host server fails to properly validate input from an authenticated user on a guest operating system. To exploit the vulnerability, an attacker could run a specially crafted application on a guest operating system that could cause the Hyper-V host operating system to execute arbitrary code.An attacker who successfully exploited the vulnerability could execute arbitrary code on the host operating system.The security update addresses the vulnerability by correcting how Windows Hyper-V Network Switch validates guest operating system network traffic.",2024-05-29T17:15:53.963,https://cve.circl.lu/cve/CVE-2019-0720
CVE-2023-37411,2.7,IBM,IBM Aspera Faspex 5.0.0 through 5.0.6 is vulnerable to cross-site scripting. This vulnerability allows users to embed arbitrary JavaScript code in the Web UI thus altering the intended functionality potentially leading to credentials disclosure within a trusted session.  IBM X-Force ID:  260139.,2024-05-28T12:39:28.377,https://cve.circl.lu/cve/CVE-2023-37411
CVE-2024-28793,2.7,IBM,"IBM Engineering Workflow Management 7.0.2 and 7.0.3 is vulnerable to stored cross-site scripting. Under certain configurations, this vulnerability allows users to embed arbitrary JavaScript code in the Web UI thus altering the intended functionality potentially leading to credentials disclosure within a trusted session.  IBM X-Force ID:  286830.",2024-05-28T12:39:28.377,https://cve.circl.lu/cve/CVE-2024-28793
CVE-2023-42005,5.9,IBM,"IBM Db2 on Cloud Pak for Data and Db2 Warehouse on Cloud Pak for Data 3.5, 4.0, 4.5, 4.6, 4.7, and 4.8 could allow a user with access to the Kubernetes pod, to make system calls compromising the security of containers. IBM X-Force ID: 265264.",2024-05-29T15:18:26.427,https://cve.circl.lu/cve/CVE-2023-42005
CVE-2022-43384,2.5,IBM,IBM Aspera Console 3.4.0 through 3.4.2 PL5 is vulnerable to cross-site scripting. This vulnerability allows users to embed arbitrary JavaScript code in the Web UI thus altering the intended functionality potentially leading to credentials disclosure within a trusted session.  IBM X-Force ID:  238645.,2024-05-30T13:15:41.297,https://cve.circl.lu/cve/CVE-2022-43384
