CVE,"Impact Score (1-10, 10 being the worst)",Keyword,Description,Last Modified,Link
CVE-2019-1125,4.0,Intel,"An information disclosure vulnerability exists when certain central processing units (CPU) speculatively access memory. An attacker who successfully exploited the vulnerability could read privileged data across trust boundaries.To exploit this vulnerability, an attacker would have to log on to an affected system and run a specially crafted application. The vulnerability would not allow an attacker to elevate user rights directly, but it could be used to obtain information that could be used to try to compromise the affected system further.On January 3, 2018, Microsoft released an advisory and security updates related to a newly-discovered class of hardware vulnerabilities (known as Spectre) involving speculative execution side channels that affect AMD, ARM, and Intel CPUs to varying degrees. This vulnerability, released on August 6, 2019, is a variant of the Spectre Variant 1 speculative execution side channel vulnerability and has been assigned CVE-2019-1125.Microsoft released a security update on July 9, 2019 that addresses the vulnerability through a software change that mitigates how the CPU speculatively accesses memory. Note that this vulnerability does not require a microcode update from your device OEM.",2024-05-29T17:15:57.430,https://cve.circl.lu/cve/CVE-2019-1125
CVE-2021-43890,5.9,Intel,"We have investigated reports of a spoofing vulnerability in AppX installer that affects Microsoft Windows. Microsoft is aware of attacks that attempt to exploit this vulnerability by using specially crafted packages that include the malware family known as Emotet/Trickbot/Bazaloader.An attacker could craft a malicious attachment to be used in phishing campaigns. The attacker would then have to convince the user to open the specially crafted attachment. Users whose accounts are configured to have fewer user rights on the system could be less impacted than users who operate with administrative user rights.Please see the Security Updates table for the link to the updated app. Alternatively you can download and install the Installer using the links provided in the FAQ section.Please see the Mitigations and Workaround sections for important information about steps you can take to protect your system from this vulnerability.December 27 2023 Update:In recent months, Microsoft Threat Intelligence has seen an increase in activity from threat actors leveraging social engineering and phishing techniques to target Windows OS users and utilizing the ms-appinstaller URI scheme.To address this increase in activity, we have updated the App Installer to disable the ms-appinstaller protocol by default and recommend other potential mitigations.",2024-05-29T15:15:50.500,https://cve.circl.lu/cve/CVE-2021-43890
CVE-2022-2513,3.6,Intel,"A vulnerability exists in the Intelligent Electronic Device (IED) Connectivity Package (ConnPack) credential storage function in Hitachi Energy’s PCM600 product included in the versions listed below, where IEDs credentials are stored in a cleartext format in the PCM600 database and logs files. An attacker having get access to the exported backup file can exploit the vulnerability and obtain user credentials of the IEDs. Additionally, an attacker with administrator access to the PCM600 host machine can obtain other user credentials by analyzing database log files. The credentials may be used to perform unauthorized modifications such as loading incorrect configurations, reboot the IEDs or cause a denial-of-service on the IEDs.",2024-05-28T11:15:10.083,https://cve.circl.lu/cve/CVE-2022-2513
CVE-2023-22843,2.7,Intel,"An authenticated attacker with administrative access to the appliance can inject malicious JavaScript code inside the definition of a Threat Intelligence rule, that will later be executed by another legitimate user viewing the details of such a rule.An attacker may be able to perform unauthorized actions on behalf of legitimate users. JavaScript injection was possible in the content for Yara rules, while limited HTML injection has been proven for packet and STYX rules.The injected code will be executed in the context of the authenticated victim's session.",2024-05-28T13:15:08.937,https://cve.circl.lu/cve/CVE-2023-22843
CVE-2023-29245,5.2,Intel,"A SQL Injection vulnerability in Nozomi Networks Guardian and CMC, due to improper input validation in certain fields used in the Asset Intelligence functionality of our IDS, may allow an unauthenticated attacker to execute arbitrary SQL statements on the DBMS used by the web application by sending specially crafted malicious network packets.Malicious users with extensive knowledge on the underlying system may be able to extract arbitrary information from the DBMS in an uncontrolled way, or to alter its structure and data.",2024-05-28T13:15:09.717,https://cve.circl.lu/cve/CVE-2023-29245
CVE-2023-5253,3.6,IoT,"A missing authentication check in the WebSocket channel used for the Check Point IoT integration in Nozomi Networks Guardian and CMC, may allow an unauthenticated attacker to obtain assets data without authentication.Malicious unauthenticated users with knowledge on the underlying system may be able to extract asset information.",2024-05-28T13:15:10.223,https://cve.circl.lu/cve/CVE-2023-5253
CVE-2022-41678,5.9,Java,"Once an user is authenticated on Jolokia, he can potentially trigger arbitrary code execution. In details, in ActiveMQ configurations, jetty allowsorg.jolokia.http.AgentServlet to handler request to /api/jolokiaorg.jolokia.http.HttpRequestHandler#handlePostRequest is able tocreate JmxRequest through JSONObject. And calls toorg.jolokia.http.HttpRequestHandler#executeRequest.Into deeper calling stacks,org.jolokia.handler.ExecHandler#doHandleRequest can be invokedthrough refection. This could lead to RCE through viavarious mbeans. One example is unrestricted deserialization in jdk.management.jfr.FlightRecorderMXBeanImpl which exists on Java version above 11.1 Call newRecording.2 Call setConfiguration. And a webshell data hides in it.3 Call startRecording.4 Call copyTo method. The webshell will be written to a .jsp file.The mitigation is to restrict (by default) the actions authorized on Jolokia, or disable Jolokia.A more restrictive Jolokia configuration has been defined in default ActiveMQ distribution. We encourage users to upgrade to ActiveMQ distributions version including updated Jolokia configuration: 5.16.6, 5.17.4, 5.18.0, 6.0.0.",2024-05-31T09:15:09.367,https://cve.circl.lu/cve/CVE-2022-41678
CVE-2024-5351,3.4,Java,A vulnerability was found in anji-plus AJ-Report up to 1.4.1. It has been declared as critical. Affected by this vulnerability is the function getValueFromJs of the component Javascript Handler. The manipulation leads to deserialization. The attack can be launched remotely. The exploit has been disclosed to the public and may be used. The associated identifier of this vulnerability is VDB-266263.,2024-05-28T12:39:42.673,https://cve.circl.lu/cve/CVE-2024-5351
CVE-2024-5405,3.4,Java,"A vulnerability had been discovered in WinNMP 19.02 consisting of an XSS attack via /tools/redis.php page in the k, hash, key and p parameters. This vulnerability could allow a remote user to submit a specially crafted JavaScript payload for an authenticated user to retrieve their session details.",2024-05-28T12:39:28.377,https://cve.circl.lu/cve/CVE-2024-5405
CVE-2024-36362,3.6,JetBrains,"In JetBrains TeamCity before 2022.04.7, 2022.10.6, 2023.05.6, 2023.11.5, 2024.03.2 path traversal allowing to read files from server was possible",2024-05-31T14:15:09.370,https://cve.circl.lu/cve/CVE-2024-36362
CVE-2024-36363,2.5,JetBrains,"In JetBrains TeamCity before 2022.04.7, 2022.10.6, 2023.05.6, 2023.11.5 several Stored XSS in code inspection reports were possible",2024-05-31T14:15:09.563,https://cve.circl.lu/cve/CVE-2024-36363
CVE-2024-36364,3.6,JetBrains,"In JetBrains TeamCity before 2022.04.7, 2022.10.6, 2023.05.6, 2023.11.5 improper access control in Pull Requests and Commit status publisher build features was possible",2024-05-31T14:15:09.660,https://cve.circl.lu/cve/CVE-2024-36364
CVE-2024-36365,5.2,JetBrains,"In JetBrains TeamCity before 2022.04.7, 2022.10.6, 2023.05.6, 2023.11.5, 2024.03.2 a third-party agent could impersonate a cloud agent",2024-05-31T14:15:09.753,https://cve.circl.lu/cve/CVE-2024-36365
CVE-2024-36366,2.5,JetBrains,"In JetBrains TeamCity before 2022.04.7, 2022.10.6, 2023.05.6, 2023.11.5 an XSS could be executed via certain report grouping and filtering operations",2024-05-31T14:15:09.853,https://cve.circl.lu/cve/CVE-2024-36366
CVE-2024-21401,5.9,Jira,Microsoft Entra Jira Single-Sign-On Plugin Elevation of Privilege Vulnerability,2024-05-29T00:15:33.247,https://cve.circl.lu/cve/CVE-2024-21401
CVE-2024-36114,4.7,JDK,"Aircompressor is a library with ports of the Snappy, LZO, LZ4, and Zstandard compression algorithms to Java. All decompressor implementations of Aircompressor (LZ4, LZO, Snappy, Zstandard) can crash the JVM for certain input, and in some cases also leak the content of other memory of the Java process (which could contain sensitive information). When decompressing certain data, the decompressors try to access memory outside the bounds of the given byte arrays or byte buffers. Because Aircompressor uses the JDK class `sun.misc.Unsafe` to speed up memory access, no additional bounds checks are performed and this has similar security consequences as out-of-bounds access in C or C++, namely it can lead to non-deterministic behavior or crash the JVM. Users should update to Aircompressor 0.27 or newer where these issues have been fixed. When decompressing data from untrusted users, this can be exploited for a denial-of-service attack by crashing the JVM, or to leak other sensitive information from the Java process. There are no known workarounds for this issue.",2024-05-30T13:15:41.297,https://cve.circl.lu/cve/CVE-2024-36114
CVE-2023-29332,5.9,Kubernetes,Microsoft Azure Kubernetes Service Elevation of Privilege Vulnerability,2024-05-29T03:15:39.263,https://cve.circl.lu/cve/CVE-2023-29332
CVE-2024-21376,6.0,Kubernetes,Microsoft Azure Kubernetes Service Confidential Container Remote Code Execution Vulnerability,2024-05-29T00:15:30.677,https://cve.circl.lu/cve/CVE-2024-21376
CVE-2024-21403,6.0,Kubernetes,Microsoft Azure Kubernetes Service Confidential Container Elevation of Privilege Vulnerability,2024-05-29T00:15:33.497,https://cve.circl.lu/cve/CVE-2024-21403
CVE-2024-35181,4.2,Kubernetes,"Meshery is an open source, cloud native manager that enables the design and management of Kubernetes-based infrastructure and applications. A SQL injection vulnerability in Meshery prior to version 0.7.22 may lead to arbitrary file write by using a SQL injection stacked queries payload, and the ATTACH DATABASE command. Additionally, attackers may be able to access and modify any data stored in the database, like performance profiles (which may contain session cookies), Meshery application data, or any Kubernetes configuration added to the system. The Meshery project exposes the function `GetMeshSyncResourcesKinds` at the API URL `/api/system/meshsync/resources/kinds`. The order query parameter is directly used to build a SQL query in `meshync_handler.go`. Version 0.7.22 fixes this issue.",2024-05-28T12:39:28.377,https://cve.circl.lu/cve/CVE-2024-35181
CVE-2019-1185,5.9,Linux,"An elevation of privilege vulnerability exists due to a stack corruption in Windows Subsystem for Linux. An attacker who successfully exploited the vulnerability could execute code with elevated permissions.To exploit the vulnerability, a locally authenticated attacker could run a specially crafted application.The security update addresses the vulnerability by correcting how Windows Subsystem for Linux handles objects in memory.",2024-05-29T17:16:09.763,https://cve.circl.lu/cve/CVE-2019-1185
CVE-2021-22543,5.9,Linux,An issue was discovered in Linux: KVM through Improper handling of VM_IO|VM_PFNMAP vmas in KVM can bypass RO checks and can lead to pages being freed while still accessible by the VMM and guest. This allows users with the ability to start and control a VM to read/write random pages of memory and can result in local privilege escalation.,2024-05-29T20:15:09.870,https://cve.circl.lu/cve/CVE-2021-22543
CVE-2023-36736,2.5,Linux,Microsoft Identity Linux Broker Remote Code Execution Vulnerability,2024-05-29T03:15:59.327,https://cve.circl.lu/cve/CVE-2023-36736
CVE-2024-20681,5.9,Linux,Windows Subsystem for Linux Elevation of Privilege Vulnerability,2024-05-29T00:15:14.167,https://cve.circl.lu/cve/CVE-2024-20681
CVE-2024-1086,5.9,Linux,"A use-after-free vulnerability in the Linux kernel's netfilter: nf_tables component can be exploited to achieve local privilege escalation.The nft_verdict_init() function allows positive values as drop error within the hook verdict, and hence the nf_hook_slow() function can cause a double free vulnerability when NF_DROP is issued with a drop error which resembles NF_ACCEPT.We recommend upgrading past commit f342de4e2f33e0e39165d8639387aa6c19dff660.",2024-05-31T01:00:03.283,https://cve.circl.lu/cve/CVE-2024-1086
CVE-2024-36885,NA,MSI,"In the Linux kernel, the following vulnerability has been resolved:drm/nouveau/firmware: Fix SG_DEBUG error with nvkm_firmware_ctor()Currently, enabling SG_DEBUG in the kernel will cause nouveau to hit aBUG() on startup:  kernel BUG at include/linux/scatterlist.h:187!  invalid opcode: 0000 [#1] PREEMPT SMP NOPTI  CPU: 7 PID: 930 Comm: (udev-worker) Not tainted 6.9.0-rc3Lyude-Test+ #30  Hardware name: MSI MS-7A39/A320M GAMING PRO (MS-7A39), BIOS 1.I0 01/22/2019  RIP: 0010:sg_init_one+0x85/0xa0  Code: 69 88 32 01 83 e1 03 f6 c3 03 75 20 a8 01 75 1e 48 09 cb 41 89 54  24 08 49 89 1c 24 41 89 6c 24 0c 5b 5d 41 5c e9 7b b9 88 00 <0f> 0b 0f 0b  0f 0b 48 8b 05 5e 46 9a 01 eb b2 66 66 2e 0f 1f 84 00  RSP: 0018:ffffa776017bf6a0 EFLAGS: 00010246  RAX: 0000000000000000 RBX: ffffa77600d87000 RCX: 000000000000002b  RDX: 0000000000000001 RSI: 0000000000000000 RDI: ffffa77680d87000  RBP: 000000000000e000 R08: 0000000000000000 R09: 0000000000000000  R10: ffff98f4c46aa508 R11: 0000000000000000 R12: ffff98f4c46aa508  R13: ffff98f4c46aa008 R14: ffffa77600d4a000 R15: ffffa77600d4a018  FS:  00007feeb5aae980(0000) GS:ffff98f5c4dc0000(0000) knlGS:0000000000000000  CS:  0010 DS: 0000 ES: 0000 CR0: 0000000080050033  CR2: 00007f22cb9a4520 CR3: 00000001043ba000 CR4: 00000000003506f0  Call Trace:   <TASK>   ? die+0x36/0x90   ? do_trap+0xdd/0x100   ? sg_init_one+0x85/0xa0   ? do_error_trap+0x65/0x80   ? sg_init_one+0x85/0xa0   ? exc_invalid_op+0x50/0x70   ? sg_init_one+0x85/0xa0   ? asm_exc_invalid_op+0x1a/0x20   ? sg_init_one+0x85/0xa0   nvkm_firmware_ctor+0x14a/0x250 [nouveau]   nvkm_falcon_fw_ctor+0x42/0x70 [nouveau]   ga102_gsp_booter_ctor+0xb4/0x1a0 [nouveau]   r535_gsp_oneinit+0xb3/0x15f0 [nouveau]   ? srso_return_thunk+0x5/0x5f   ? srso_return_thunk+0x5/0x5f   ? nvkm_udevice_new+0x95/0x140 [nouveau]   ? srso_return_thunk+0x5/0x5f   ? srso_return_thunk+0x5/0x5f   ? ktime_get+0x47/0xb0   ? srso_return_thunk+0x5/0x5f   nvkm_subdev_oneinit_+0x4f/0x120 [nouveau]   nvkm_subdev_init_+0x39/0x140 [nouveau]   ? srso_return_thunk+0x5/0x5f   nvkm_subdev_init+0x44/0x90 [nouveau]   nvkm_device_init+0x166/0x2e0 [nouveau]   nvkm_udevice_init+0x47/0x70 [nouveau]   nvkm_object_init+0x41/0x1c0 [nouveau]   nvkm_ioctl_new+0x16a/0x290 [nouveau]   ? __pfx_nvkm_client_child_new+0x10/0x10 [nouveau]   ? __pfx_nvkm_udevice_new+0x10/0x10 [nouveau]   nvkm_ioctl+0x126/0x290 [nouveau]   nvif_object_ctor+0x112/0x190 [nouveau]   nvif_device_ctor+0x23/0x60 [nouveau]   nouveau_cli_init+0x164/0x640 [nouveau]   nouveau_drm_device_init+0x97/0x9e0 [nouveau]   ? srso_return_thunk+0x5/0x5f   ? pci_update_current_state+0x72/0xb0   ? srso_return_thunk+0x5/0x5f   nouveau_drm_probe+0x12c/0x280 [nouveau]   ? srso_return_thunk+0x5/0x5f   local_pci_probe+0x45/0xa0   pci_device_probe+0xc7/0x270   really_probe+0xe6/0x3a0   __driver_probe_device+0x87/0x160   driver_probe_device+0x1f/0xc0   __driver_attach+0xec/0x1f0   ? __pfx___driver_attach+0x10/0x10   bus_for_each_dev+0x88/0xd0   bus_add_driver+0x116/0x220   driver_register+0x59/0x100   ? __pfx_nouveau_drm_init+0x10/0x10 [nouveau]   do_one_initcall+0x5b/0x320   do_init_module+0x60/0x250   init_module_from_file+0x86/0xc0   idempotent_init_module+0x120/0x2b0   __x64_sys_finit_module+0x5e/0xb0   do_syscall_64+0x83/0x160   ? srso_return_thunk+0x5/0x5f   entry_SYSCALL_64_after_hwframe+0x71/0x79  RIP: 0033:0x7feeb5cc20cd  Code: ff c3 66 2e 0f 1f 84 00 00 00 00 00 90 f3 0f 1e fa 48 89 f8 48 89  f7 48 89 d6 48 89 ca 4d 89 c2 4d 89 c8 4c 8b 4c 24 08 0f 05 <48> 3d 01 f0  ff ff 73 01 c3 48 8b 0d 1b cd 0c 00 f7 d8 64 89 01 48  RSP: 002b:00007ffcf220b2c8 EFLAGS: 00000246 ORIG_RAX: 0000000000000139  RAX: ffffffffffffffda RBX: 000055fdd2916aa0 RCX: 00007feeb5cc20cd  RDX: 0000000000000000 RSI: 000055fdd29161e0 RDI: 0000000000000035  RBP: 00007ffcf220b380 R08: 00007feeb5d8fb20 R09: 00007ffcf220b310  R10: 000055fdd2909dc0 R11: 0000000000000246 R12: 000055---truncated---",2024-05-30T18:18:58.870,https://cve.circl.lu/cve/CVE-2024-36885
CVE-2023-23417,5.9,Management,Windows Partition Management Driver Elevation of Privilege Vulnerability,2024-05-29T04:15:20.617,https://cve.circl.lu/cve/CVE-2023-23417
CVE-2023-33154,5.9,Management,Windows Partition Management Driver Elevation of Privilege Vulnerability,2024-05-29T03:15:44.803,https://cve.circl.lu/cve/CVE-2023-33154
CVE-2023-38186,5.9,Management,Windows Mobile Device Management Elevation of Privilege Vulnerability,2024-05-29T02:16:29.690,https://cve.circl.lu/cve/CVE-2023-38186
CVE-2023-36724,3.6,Management,Windows Power Management Service Information Disclosure Vulnerability,2024-05-29T02:16:17.097,https://cve.circl.lu/cve/CVE-2023-36724
CVE-2023-36043,4.0,Management,Open Management Infrastructure Information Disclosure Vulnerability,2024-05-29T02:16:00.370,https://cve.circl.lu/cve/CVE-2023-36043
CVE-2024-1402,1.4,Mattermost,"Mattermost fails to check if a custom emoji reaction exists when sending it to a post and to limit the amount of custom emojis allowed to be added in a post, allowing an attacker sending a huge amount of non-existent custom emojis in a post to crash the mobile app of a user seeing the post and to crash the server due to overloading when clients attempt to retrive the aforementioned post. ",2024-05-30T12:15:10.573,https://cve.circl.lu/cve/CVE-2024-1402
CVE-2024-29215,1.4,Mattermost,"Mattermost versions 9.5.x <= 9.5.3, 9.7.x <= 9.7.1, 9.6.x <= 9.6.1, 8.1.x <= 8.1.12 fail to enforce proper access control which allows a user to run a slash command in a channel they are not a member of via linking a playbook run to that channel and running a slash command as a playbook task command.",2024-05-28T12:39:42.673,https://cve.circl.lu/cve/CVE-2024-29215
CVE-2024-31859,1.4,Mattermost,"Mattermost versions 9.5.x <= 9.5.3, 9.6.x <= 9.6.1 and 8.1.x <= 8.1.12 fail to perform proper authorization checks which allows a member running a playbook in an existing channel to be promoted to a channel admin",2024-05-28T12:39:42.673,https://cve.circl.lu/cve/CVE-2024-31859
CVE-2024-32045,4.2,Mattermost,"Mattermost versions 9.5.x <= 9.5.3, 9.6.x <= 9.6.1, 8.1.x <= 8.1.12 fail to enforce proper access controls for channel and team membership when linking a playbook run to a channel which allows  members to link their runs to private channels they were not members of.",2024-05-28T12:39:28.377,https://cve.circl.lu/cve/CVE-2024-32045
CVE-2019-0723,4.0,Microsoft,"A denial of service vulnerability exists when Microsoft Hyper-V Network Switch on a host server fails to properly validate input from a privileged user on a guest operating system. An attacker who successfully exploited the vulnerability could cause the host server to crash.To exploit the vulnerability, an attacker who already has a privileged account on a guest operating system, running as a virtual machine, could run a specially crafted application that causes a host machine to crash.The update addresses the vulnerability by modifying how virtual machines access the Hyper-V Network Switch.",2024-05-29T17:15:54.233,https://cve.circl.lu/cve/CVE-2019-0723
CVE-2024-21512,4.2,MySQL,Versions of the package mysql2 before 3.9.8 are vulnerable to Prototype Pollution due to improper user input sanitization passed to fields and tables when using nestTables.,2024-05-29T13:02:09.280,https://cve.circl.lu/cve/CVE-2024-21512
CVE-2023-24930,5.9,MacOS,Microsoft OneDrive for MacOS Elevation of Privilege Vulnerability,2024-05-29T04:15:39.970,https://cve.circl.lu/cve/CVE-2023-24930
CVE-2023-5936,5.9,MacOS,"On Unix systems (Linux, MacOS), Arc uses a temporary file with unsafe privileges.By tampering with such file, a malicious local user in the system may be able to trigger arbitrary code execution with root privileges.",2024-05-28T13:15:10.503,https://cve.circl.lu/cve/CVE-2023-5936
CVE-2024-2451,5.9,MacOS,Improper fingerprint validation in the TeamViewer Client (Full & Host) prior Version 15.54 for Windows and macOS allows an attacker with administrative user rights to further elevate privileges via executable sideloading.,2024-05-28T17:11:55.903,https://cve.circl.lu/cve/CVE-2024-2451
CVE-2023-5935,5.9,Malware,"When configuring Arc (e.g. during the first setup), a local web interface is provided to ease the configuration process. Such web interface lacks authentication and may thus be abused by a local attacker or malware running on the machine itself.A malicious local user or process, during a window of opportunity when the local web interface is active, may be able to extract sensitive information or change Arc's configuration. This could also lead to arbitrary code execution if a malicious update package is installed.",2024-05-28T13:15:10.383,https://cve.circl.lu/cve/CVE-2023-5935
CVE-2024-33999,NA,MFA,"The referrer URL used by MFA required additional sanitizing, rather than being used directly.",2024-05-31T20:15:09.987,https://cve.circl.lu/cve/CVE-2024-33999
CVE-2024-34007,NA,MFA,The logout option within MFA did not include the necessary token to avoid the risk of users inadvertently being logged out via CSRF.,2024-05-31T21:15:09.647,https://cve.circl.lu/cve/CVE-2024-34007
CVE-2023-23382,3.6,Machine Learning,Azure Machine Learning Compute Instance Information Disclosure Vulnerability,2024-05-29T03:15:39.017,https://cve.circl.lu/cve/CVE-2023-23382
CVE-2023-28312,3.6,Machine Learning,Azure Machine Learning Information Disclosure Vulnerability,2024-05-29T02:15:38.023,https://cve.circl.lu/cve/CVE-2023-28312
CVE-2023-35625,3.6,Machine Learning,Azure Machine Learning Compute Instance for SDK Users Information Disclosure Vulnerability,2024-05-29T02:15:53.390,https://cve.circl.lu/cve/CVE-2023-35625
