CVE,"Impact Score (1-10, 10 being the worst)",Keyword,Description,Last Modified,Link
CVE-2024-21008,3.6,MySQL,Vulnerability in the MySQL Server product of Oracle MySQL (component: Server: Optimizer).  Supported versions that are affected are 8.0.36 and prior and  8.3.0 and prior. Difficult to exploit vulnerability allows high privileged attacker with network access via multiple protocols to compromise MySQL Server.  Successful attacks of this vulnerability can result in unauthorized ability to cause a hang or frequently repeatable crash (complete DOS) of MySQL Server. CVSS 3.1 Base Score 4.4 (Availability impacts).  CVSS Vector: (CVSS:3.1/AV:N/AC:H/PR:H/UI:N/S:U/C:N/I:N/A:H).,2024-04-17T12:48:31.863,https://cve.circl.lu/cve/CVE-2024-21008
CVE-2024-3736,1.4,Nginx,A vulnerability was found in cym1102 nginxWebUI up to 3.9.9. It has been declared as problematic. Affected by this vulnerability is the function upload of the file /adminPage/main/upload. The manipulation leads to unrestricted upload. The attack can be launched remotely. The exploit has been disclosed to the public and may be used. The associated identifier of this vulnerability is VDB-260575.,2024-04-15T13:15:31.997,https://cve.circl.lu/cve/CVE-2024-3736
CVE-2024-3737,3.4,Nginx,A vulnerability was found in cym1102 nginxWebUI up to 3.9.9. It has been rated as critical. Affected by this issue is the function findCountByQuery of the file /adminPage/www/addOver. The manipulation of the argument dir leads to path traversal. The attack may be launched remotely. The exploit has been disclosed to the public and may be used. The identifier of this vulnerability is VDB-260576.,2024-04-15T13:15:31.997,https://cve.circl.lu/cve/CVE-2024-3737
CVE-2024-3738,3.4,Nginx,A vulnerability classified as critical has been found in cym1102 nginxWebUI up to 3.9.9. This affects the function handlePath of the file /adminPage/conf/saveCmd. The manipulation of the argument nginxPath leads to improper certificate validation. It is possible to initiate the attack remotely. The exploit has been disclosed to the public and may be used. The identifier VDB-260577 was assigned to this vulnerability.,2024-04-15T13:15:31.997,https://cve.circl.lu/cve/CVE-2024-3738
CVE-2024-3739,3.4,Nginx,A vulnerability classified as critical was found in cym1102 nginxWebUI up to 3.9.9. This vulnerability affects unknown code of the file /adminPage/main/upload. The manipulation of the argument file leads to os command injection. The attack can be initiated remotely. The exploit has been disclosed to the public and may be used. VDB-260578 is the identifier assigned to this vulnerability.,2024-04-15T13:15:31.997,https://cve.circl.lu/cve/CVE-2024-3739
CVE-2024-3740,3.4,Nginx,"A vulnerability, which was classified as critical, has been found in cym1102 nginxWebUI up to 3.9.9. This issue affects the function exec of the file /adminPage/conf/reload. The manipulation of the argument nginxExe leads to deserialization. The attack may be initiated remotely. The exploit has been disclosed to the public and may be used. The associated identifier of this vulnerability is VDB-260579.",2024-04-15T13:15:31.997,https://cve.circl.lu/cve/CVE-2024-3740
CVE-2024-24750,3.6,Node.js,"Undici is an HTTP/1.1 client, written from scratch for Node.js. In affected versions calling `fetch(url)` and not consuming the incoming body ((or consuming it very slowing) will lead to a memory leak. This issue has been addressed in version 6.6.1. Users are advised to upgrade. Users unable to upgrade should make sure to always consume the incoming body.",2024-04-19T07:15:09.330,https://cve.circl.lu/cve/CVE-2024-24750
CVE-2024-24758,3.4,Node.js,"Undici is an HTTP/1.1 client, written from scratch for Node.js. Undici already cleared Authorization headers on cross-origin redirects, but did not clear `Proxy-Authentication` headers. This issue has been patched in versions 5.28.3 and 6.6.1. Users are advised to upgrade. There are no known workarounds for this vulnerability.",2024-04-19T07:15:09.500,https://cve.circl.lu/cve/CVE-2024-24758
CVE-2024-30261,1.4,Node.js,"Undici is an HTTP/1.1 client, written from scratch for Node.js. An attacker can alter the `integrity` option passed to `fetch()`, allowing `fetch()` to accept requests as valid even if they have been tampered. This vulnerability was patched in version(s) 5.28.4 and 6.11.1.",2024-04-19T23:15:11.137,https://cve.circl.lu/cve/CVE-2024-30261
CVE-2024-30260,3.4,Node.js,"Undici is an HTTP/1.1 client, written from scratch for Node.js. Undici cleared Authorization and Proxy-Authorization headers for `fetch()`, but did not clear them for `undici.request()`. This vulnerability was patched in version(s) 5.28.4 and 6.11.1.",2024-04-19T23:15:11.047,https://cve.circl.lu/cve/CVE-2024-30260
CVE-2024-27983,4.2,Node.js,An attacker can make the Node.js HTTP/2 server completely unavailable by sending a small amount of HTTP/2 frames packets with a few HTTP/2 frames inside. It is possible to leave some data in nghttp2 memory after reset when headers with HTTP/2 CONTINUATION frame are sent to the server and then a TCP connection is abruptly closed by the client triggering the Http2Session destructor while header frames are still being processed (and stored in memory) causing a race condition.,2024-04-20T02:15:06.660,https://cve.circl.lu/cve/CVE-2024-27983
CVE-2023-6536,3.6,NULL Pointer,"A flaw was found in the Linux kernel's NVMe driver. This issue may allow an unauthenticated malicious actor to send a set of crafted TCP packages when using NVMe over TCP, leading the NVMe driver to a NULL pointer dereference in the NVMe driver, causing kernel panic and a denial of service.",2024-04-15T14:15:07.447,https://cve.circl.lu/cve/CVE-2023-6536
CVE-2023-52454,3.6,NULL Pointer,"In the Linux kernel, the following vulnerability has been resolved:nvmet-tcp: Fix a kernel panic when host sends an invalid H2C PDU lengthIf the host sends an H2CData command with an invalid DATAL,the kernel may crash in nvmet_tcp_build_pdu_iovec().Unable to handle kernel NULL pointer dereference atvirtual address 0000000000000000lr : nvmet_tcp_io_work+0x6ac/0x718 [nvmet_tcp]Call trace:  process_one_work+0x174/0x3c8  worker_thread+0x2d0/0x3e8  kthread+0x104/0x110Fix the bug by raising a fatal error if DATAL isn't coherentwith the packet size.Also, the PDU length should never exceed the MAXH2CDATA parameter whichhas been communicated to the host in nvmet_tcp_handle_icreq().",2024-04-19T18:40:14.427,https://cve.circl.lu/cve/CVE-2023-52454
CVE-2023-52458,3.6,NULL Pointer,"In the Linux kernel, the following vulnerability has been resolved:block: add check that partition length needs to be aligned with block sizeBefore calling add partition or resize partition, there is no checkon whether the length is aligned with the logical block size.If the logical block size of the disk is larger than 512 bytes,then the partition size maybe not the multiple of the logical block size,and when the last sector is read, bio_truncate() will adjust the bio size,resulting in an IO error if the size of the read command is smaller thanthe logical block size.If integrity data is supported, this will alsoresult in a null pointer dereference when calling bio_integrity_free.",2024-04-19T18:49:28.773,https://cve.circl.lu/cve/CVE-2023-52458
CVE-2023-52459,3.6,NULL Pointer,"In the Linux kernel, the following vulnerability has been resolved:media: v4l: async: Fix duplicated list deletionThe list deletion call dropped here is already called from thehelper function in the line before. Having a second list_del()call results in either a warning (with CONFIG_DEBUG_LIST=y):list_del corruption, c46c8198->next is LIST_POISON1 (00000100)If CONFIG_DEBUG_LIST is disabled the operation results in akernel error due to NULL pointer dereference.",2024-04-19T18:49:47.087,https://cve.circl.lu/cve/CVE-2023-52459
CVE-2023-52463,3.6,NULL Pointer,"In the Linux kernel, the following vulnerability has been resolved:efivarfs: force RO when remounting if SetVariable is not supportedIf SetVariable at runtime is not supported by the firmware we never assigna callback for that function. At the same time mount the efivarfs asRO so no one can call that.  However, we never check the permission flagswhen someone remounts the filesystem as RW. As a result this leads to acrash looking like this:$ mount -o remount,rw /sys/firmware/efi/efivars$ efi-updatevar -f PK.auth PK[  303.279166] Unable to handle kernel NULL pointer dereference at virtual address 0000000000000000[  303.280482] Mem abort info:[  303.280854]   ESR = 0x0000000086000004[  303.281338]   EC = 0x21: IABT (current EL), IL = 32 bits[  303.282016]   SET = 0, FnV = 0[  303.282414]   EA = 0, S1PTW = 0[  303.282821]   FSC = 0x04: level 0 translation fault[  303.283771] user pgtable: 4k pages, 48-bit VAs, pgdp=000000004258c000[  303.284913] [0000000000000000] pgd=0000000000000000, p4d=0000000000000000[  303.286076] Internal error: Oops: 0000000086000004 [#1] PREEMPT SMP[  303.286936] Modules linked in: qrtr tpm_tis tpm_tis_core crct10dif_ce arm_smccc_trng rng_core drm fuse ip_tables x_tables ipv6[  303.288586] CPU: 1 PID: 755 Comm: efi-updatevar Not tainted 6.3.0-rc1-00108-gc7d0c4695c68 #1[  303.289748] Hardware name: Unknown Unknown Product/Unknown Product, BIOS 2023.04-00627-g88336918701d 04/01/2023[  303.291150] pstate: 60400005 (nZCv daif +PAN -UAO -TCO -DIT -SSBS BTYPE=--)[  303.292123] pc : 0x0[  303.292443] lr : efivar_set_variable_locked+0x74/0xec[  303.293156] sp : ffff800008673c10[  303.293619] x29: ffff800008673c10 x28: ffff0000037e8000 x27: 0000000000000000[  303.294592] x26: 0000000000000800 x25: ffff000002467400 x24: 0000000000000027[  303.295572] x23: ffffd49ea9832000 x22: ffff0000020c9800 x21: ffff000002467000[  303.296566] x20: 0000000000000001 x19: 00000000000007fc x18: 0000000000000000[  303.297531] x17: 0000000000000000 x16: 0000000000000000 x15: 0000aaaac807ab54[  303.298495] x14: ed37489f673633c0 x13: 71c45c606de13f80 x12: 47464259e219acf4[  303.299453] x11: ffff000002af7b01 x10: 0000000000000003 x9 : 0000000000000002[  303.300431] x8 : 0000000000000010 x7 : ffffd49ea8973230 x6 : 0000000000a85201[  303.301412] x5 : 0000000000000000 x4 : ffff0000020c9800 x3 : 00000000000007fc[  303.302370] x2 : 0000000000000027 x1 : ffff000002467400 x0 : ffff000002467000[  303.303341] Call trace:[  303.303679]  0x0[  303.303938]  efivar_entry_set_get_size+0x98/0x16c[  303.304585]  efivarfs_file_write+0xd0/0x1a4[  303.305148]  vfs_write+0xc4/0x2e4[  303.305601]  ksys_write+0x70/0x104[  303.306073]  __arm64_sys_write+0x1c/0x28[  303.306622]  invoke_syscall+0x48/0x114[  303.307156]  el0_svc_common.constprop.0+0x44/0xec[  303.307803]  do_el0_svc+0x38/0x98[  303.308268]  el0_svc+0x2c/0x84[  303.308702]  el0t_64_sync_handler+0xf4/0x120[  303.309293]  el0t_64_sync+0x190/0x194[  303.309794] Code: ???????? ???????? ???????? ???????? (????????)[  303.310612] ---[ end trace 0000000000000000 ]---Fix this by adding a .reconfigure() function to the fs operations whichwe can use to check the requested flags and deny anything that's not ROif the firmware doesn't implement SetVariable at runtime.",2024-04-17T20:05:08.550,https://cve.circl.lu/cve/CVE-2023-52463
CVE-2021-2102,4.7,Oracle,"Vulnerability in the Oracle Complex Maintenance, Repair, and Overhaul product of Oracle Supply Chain (component: Dialog Box). Supported versions that are affected are 11.5.10, 12.1 and 12.2. Easily exploitable vulnerability allows unauthenticated attacker with network access via HTTP to compromise Oracle Complex Maintenance, Repair, and Overhaul. Successful attacks require human interaction from a person other than the attacker and while the vulnerability is in Oracle Complex Maintenance, Repair, and Overhaul, attacks may significantly impact additional products. Successful attacks of this vulnerability can result in unauthorized access to critical data or complete access to all Oracle Complex Maintenance, Repair, and Overhaul accessible data as well as unauthorized update, insert or delete access to some of Oracle Complex Maintenance, Repair, and Overhaul accessible data. CVSS 3.1 Base Score 8.2 (Confidentiality and Integrity impacts). CVSS Vector: (CVSS:3.1/AV:N/AC:L/PR:N/UI:R/S:C/C:H/I:L/A:N).",2024-04-19T17:30:47.080,https://cve.circl.lu/cve/CVE-2021-2102
CVE-2021-2103,4.7,Oracle,"Vulnerability in the Oracle Complex Maintenance, Repair, and Overhaul product of Oracle Supply Chain (component: Dialog Box). Supported versions that are affected are 11.5.10, 12.1 and 12.2. Easily exploitable vulnerability allows unauthenticated attacker with network access via HTTP to compromise Oracle Complex Maintenance, Repair, and Overhaul. Successful attacks require human interaction from a person other than the attacker and while the vulnerability is in Oracle Complex Maintenance, Repair, and Overhaul, attacks may significantly impact additional products. Successful attacks of this vulnerability can result in unauthorized access to critical data or complete access to all Oracle Complex Maintenance, Repair, and Overhaul accessible data as well as unauthorized update, insert or delete access to some of Oracle Complex Maintenance, Repair, and Overhaul accessible data. CVSS 3.1 Base Score 8.2 (Confidentiality and Integrity impacts). CVSS Vector: (CVSS:3.1/AV:N/AC:L/PR:N/UI:R/S:C/C:H/I:L/A:N).",2024-04-19T17:30:47.080,https://cve.circl.lu/cve/CVE-2021-2103
CVE-2021-2104,4.7,Oracle,"Vulnerability in the Oracle Complex Maintenance, Repair, and Overhaul product of Oracle Supply Chain (component: Dialog Box). Supported versions that are affected are 11.5.10, 12.1 and 12.2. Easily exploitable vulnerability allows unauthenticated attacker with network access via HTTP to compromise Oracle Complex Maintenance, Repair, and Overhaul. Successful attacks require human interaction from a person other than the attacker and while the vulnerability is in Oracle Complex Maintenance, Repair, and Overhaul, attacks may significantly impact additional products. Successful attacks of this vulnerability can result in unauthorized access to critical data or complete access to all Oracle Complex Maintenance, Repair, and Overhaul accessible data as well as unauthorized update, insert or delete access to some of Oracle Complex Maintenance, Repair, and Overhaul accessible data. CVSS 3.1 Base Score 8.2 (Confidentiality and Integrity impacts). CVSS Vector: (CVSS:3.1/AV:N/AC:L/PR:N/UI:R/S:C/C:H/I:L/A:N).",2024-04-19T17:30:47.080,https://cve.circl.lu/cve/CVE-2021-2104
CVE-2024-20954,1.4,Oracle,"Vulnerability in the Oracle GraalVM for JDK, Oracle GraalVM Enterprise Edition product of Oracle Java SE (component: Compiler).  Supported versions that are affected are Oracle GraalVM for JDK: 17.0.10, 21.0.2, 22; Oracle GraalVM Enterprise Edition: 20.3.13 and  21.3.9. Difficult to exploit vulnerability allows unauthenticated attacker with network access via multiple protocols to compromise Oracle GraalVM for JDK, Oracle GraalVM Enterprise Edition.  Successful attacks of this vulnerability can result in  unauthorized read access to a subset of Oracle GraalVM for JDK, Oracle GraalVM Enterprise Edition accessible data. CVSS 3.1 Base Score 3.7 (Confidentiality impacts).  CVSS Vector: (CVSS:3.1/AV:N/AC:H/PR:N/UI:N/S:U/C:L/I:N/A:N).",2024-04-17T12:48:31.863,https://cve.circl.lu/cve/CVE-2024-20954
CVE-2024-20989,4.7,Oracle,"Vulnerability in the Oracle Hospitality Simphony product of Oracle Food and Beverage Applications (component: Simphony POS).  Supported versions that are affected are 19.1.0-19.5.4. Difficult to exploit vulnerability allows unauthenticated attacker with network access via HTTP to compromise Oracle Hospitality Simphony.  Successful attacks of this vulnerability can result in  unauthorized access to critical data or complete access to all Oracle Hospitality Simphony accessible data as well as  unauthorized update, insert or delete access to some of Oracle Hospitality Simphony accessible data and unauthorized ability to cause a partial denial of service (partial DOS) of Oracle Hospitality Simphony. CVSS 3.1 Base Score 7.0 (Confidentiality, Integrity and Availability impacts).  CVSS Vector: (CVSS:3.1/AV:N/AC:H/PR:N/UI:N/S:U/C:H/I:L/A:L).",2024-04-17T12:48:31.863,https://cve.circl.lu/cve/CVE-2024-20989
CVE-2020-1570,5.9,Office,"A remote code execution vulnerability exists in the way that the scripting engine handles objects in memory in Internet Explorer. The vulnerability could corrupt memory in such a way that an attacker could execute arbitrary code in the context of the current user. An attacker who successfully exploited the vulnerability could gain the same user rights as the current user. If the current user is logged on with administrative user rights, an attacker who successfully exploited the vulnerability could take control of an affected system. An attacker could then install programs; view, change, or delete data; or create new accounts with full user rights.In a web-based attack scenario, an attacker could host a specially crafted website that is designed to exploit the vulnerability through Internet Explorer and then convince a user to view the website. An attacker could also embed an ActiveX control marked &quot;safe for initialization&quot; in an application or Microsoft Office document that hosts the IE rendering engine. The attacker could also take advantage of compromised websites and websites that accept or host user-provided content or advertisements. These websites could contain specially crafted content that could exploit the vulnerability.The security update addresses the vulnerability by modifying how the scripting engine handles objects in memory.",2024-04-16T19:22:42.250,https://cve.circl.lu/cve/CVE-2020-1570
CVE-2024-3735,1.4,Office,A vulnerability was found in Smart Office up to 20240405. It has been classified as problematic. Affected is an unknown function of the file Main.aspx. The manipulation of the argument New Password/Confirm Password with the input 1 leads to weak password requirements. It is possible to launch the attack remotely. The complexity of an attack is rather high. The exploitability is told to be difficult. The exploit has been disclosed to the public and may be used. VDB-260574 is the identifier assigned to this vulnerability. NOTE: The vendor was contacted early about this disclosure but did not respond in any way.,2024-04-15T13:15:31.997,https://cve.circl.lu/cve/CVE-2024-3735
CVE-2024-22438,2.5,Office,A potential security vulnerability has been identified in Hewlett Packard Enterprise OfficeConnect 1820 Network switches. The vulnerability could be remotely exploited to allow execution of malicious code.,2024-04-15T13:15:31.997,https://cve.circl.lu/cve/CVE-2024-22438
CVE-2022-31629,3.6,PHP,"In PHP versions before 7.4.31, 8.0.24 and 8.1.11, the vulnerability enables network and same-site attackers to set a standard insecure cookie in the victim's browser which is treated as a `__Host-` or `__Secure-` cookie by PHP applications.",2024-04-19T23:15:08.937,https://cve.circl.lu/cve/CVE-2022-31629
CVE-2024-3706,3.6,PHP,  Information exposure vulnerability in OpenGnsys affecting version 1.1.1d (Espeto). This vulnerability allows an attacker to view a php backup file (controlaccess.php-LAST) where database credentials are stored.,2024-04-15T13:15:51.577,https://cve.circl.lu/cve/CVE-2024-3706
CVE-2024-3707,1.4,PHP,   Information exposure vulnerability in OpenGnsys affecting version 1.1.1d (Espeto). This vulnerability allows an attacker to enumerate all files in the web tree by accessing a php file.,2024-04-15T13:15:51.577,https://cve.circl.lu/cve/CVE-2024-3707
CVE-2024-3690,3.4,PHP,A vulnerability classified as critical was found in PHPGurukul Small CRM 3.0. Affected by this vulnerability is an unknown functionality of the component Change Password Handler. The manipulation leads to sql injection. The attack can be launched remotely. The exploit has been disclosed to the public and may be used. The associated identifier of this vulnerability is VDB-260479.,2024-04-15T13:15:51.577,https://cve.circl.lu/cve/CVE-2024-3690
CVE-2024-3691,3.4,PHP,"A vulnerability, which was classified as critical, has been found in PHPGurukul Small CRM 3.0. Affected by this issue is some unknown functionality of the component Registration Page. The manipulation leads to sql injection. The attack may be launched remotely. The exploit has been disclosed to the public and may be used. The identifier of this vulnerability is VDB-260480.",2024-04-15T13:15:51.577,https://cve.circl.lu/cve/CVE-2024-3691
CVE-2024-3400,6.0,Palo Alto,"A command injection as a result of arbitrary file creation vulnerability in the GlobalProtect feature of Palo Alto Networks PAN-OS software for specific PAN-OS versions and distinct feature configurations may enable an unauthenticated attacker to execute arbitrary code with root privileges on the firewall.Cloud NGFW, Panorama appliances, and Prisma Access are not impacted by this vulnerability.",2024-04-19T23:15:11.847,https://cve.circl.lu/cve/CVE-2024-3400
CVE-2023-6568,2.7,Python,"A reflected Cross-Site Scripting (XSS) vulnerability exists in the mlflow/mlflow repository, specifically within the handling of the Content-Type header in POST requests. An attacker can inject malicious JavaScript code into the Content-Type header, which is then improperly reflected back to the user without adequate sanitization or escaping, leading to arbitrary JavaScript execution in the context of the victim's browser. The vulnerability is present in the mlflow/server/auth/__init__.py file, where the user-supplied Content-Type header is directly injected into a Python formatted string and returned to the user, facilitating the XSS attack.",2024-04-16T12:15:08.957,https://cve.circl.lu/cve/CVE-2023-6568
CVE-2024-30726,NA,Python,"A shell injection vulnerability was discovered in ROS (Robot Operating System) Kinetic Kame in ROS_VERSION 1 and ROS_ PYTHON_VERSION 3, allows remote attackers to execute arbitrary code, escalate privileges, and obtain sensitive information due to the way ROS handles shell command execution in components like command interpreters or interfaces that process external inputs. NOTE: this is disputed by multiple third parties who believe there was not reasonable evidence to determine the existence of a vulnerability.",2024-04-17T02:15:11.627,https://cve.circl.lu/cve/CVE-2024-30726
CVE-2024-30727,NA,Python,"An issue was discovered in ROS Kinetic Kame in Kinetic Kame ROS_VERSION 1 and ROS_ PYTHON_VERSION 3, where the system transmits messages in plaintext, allowing attackers to obtain sensitive information via a man-in-the-middle attack. NOTE: this is disputed by multiple third parties who believe there was not reasonable evidence to determine the existence of a vulnerability.",2024-04-17T02:15:11.687,https://cve.circl.lu/cve/CVE-2024-30727
CVE-2024-30729,NA,Python,"An OS command injection vulnerability has been discovered in ROS Kinetic Kame in ROS_VERSION 1 and ROS_ PYTHON_VERSION 3, allows remote attackers to execute arbitrary code, escalate privileges, and obtain sensitive information via the External Command Execution Modules, System Call Handlers, and Interface Scripts. NOTE: this is disputed by multiple third parties who believe there was not reasonable evidence to determine the existence of a vulnerability.",2024-04-17T02:15:11.810,https://cve.circl.lu/cve/CVE-2024-30729
CVE-2024-30730,NA,Python,"An insecure logging vulnerability has been identified within ROS Kinetic Kame in ROS_VERSION 1 and ROS_ PYTHON_VERSION 3, allows attackers to obtain sensitive information via inadequate security measures implemented within the logging mechanisms of ROS. NOTE: this is disputed by multiple third parties who believe there was not reasonable evidence to determine the existence of a vulnerability.",2024-04-17T02:15:11.880,https://cve.circl.lu/cve/CVE-2024-30730
CVE-2023-0330,4.0,QEMU,A vulnerability in the lsi53c895a device affects the latest version of qemu. A DMA-MMIO reentrancy problem may lead to memory corruption bugs like stack overflow or use-after-free.,2024-04-19T14:15:07.850,https://cve.circl.lu/cve/CVE-2023-0330
CVE-2023-1544,4.0,QEMU,"A flaw was found in the QEMU implementation of VMWare's paravirtual RDMA device. This flaw allows a crafted guest driver to allocate and initialize a huge number of page tables to be used as a ring of descriptors for CQ and async events, potentially leading to an out-of-bounds read and crash of QEMU.",2024-04-19T14:15:08.210,https://cve.circl.lu/cve/CVE-2023-1544
CVE-2023-1386,5.9,QEMU,"A flaw was found in the 9p passthrough filesystem (9pfs) implementation in QEMU. When a local user in the guest writes an executable file with SUID or SGID, none of these privileged bits are correctly dropped. As a result, in rare circumstances, this flaw could be used by malicious users in the guest to elevate their privileges within the guest and help a host local user to elevate privileges on the host.",2024-04-17T18:15:15.650,https://cve.circl.lu/cve/CVE-2023-1386
CVE-2024-26327,NA,QEMU,"An issue was discovered in QEMU 7.1.0 through 8.2.1. register_vfs in hw/pci/pcie_sriov.c mishandles the situation where a guest writes NumVFs greater than TotalVFs, leading to a buffer overflow in VF implementations.",2024-04-19T07:15:09.703,https://cve.circl.lu/cve/CVE-2024-26327
CVE-2024-26328,NA,QEMU,"An issue was discovered in QEMU 7.1.0 through 8.2.1. register_vfs in hw/pci/pcie_sriov.c does not set NumVFs to PCI_SRIOV_TOTAL_VF, and thus interaction with hw/nvme/ctrl.c is mishandled.",2024-04-19T07:15:09.770,https://cve.circl.lu/cve/CVE-2024-26328
