CVE,"Impact Score (1-10, 10 being the worst)",Keyword,Description,Last Modified,Link
CVE-2023-26370,5.9,Adobe,Adobe Photoshop versions 23.5.5 (and earlier) and 24.7 (and earlier) are affected by an Access of Uninitialized Pointer vulnerability that could result in arbitrary code execution in the context of the current user. Exploitation of this issue requires user interaction in that a victim must open a malicious file.,2023-10-11T12:54:05.787,https://cve.circl.lu/cve/CVE-2023-26370
CVE-2023-38216,3.6,Adobe,Adobe Bridge versions 12.0.4 (and earlier) and 13.0.3 (and earlier) are affected by a Use After Free vulnerability that could lead to disclosure of sensitive memory. An attacker could leverage this vulnerability to bypass mitigations such as ASLR. Exploitation of this issue requires user interaction in that a victim must open a malicious file.,2023-10-13T18:45:34.290,https://cve.circl.lu/cve/CVE-2023-38216
CVE-2023-38217,3.6,Adobe,Adobe Bridge versions 12.0.4 (and earlier) and 13.0.3 (and earlier) are affected by an Out-of-bounds Read vulnerability that could lead to disclosure of sensitive memory. An attacker could leverage this vulnerability to bypass mitigations such as ASLR. Exploitation of this issue requires user interaction in that a victim must open a malicious file.,2023-10-11T12:54:05.787,https://cve.circl.lu/cve/CVE-2023-38217
CVE-2023-26366,4.0,Adobe,"Adobe Commerce versions 2.4.7-beta1 (and earlier), 2.4.6-p2 (and earlier), 2.4.5-p4 (and earlier) and 2.4.4-p5 (and earlier) are affected by a Server-Side Request Forgery (SSRF) vulnerability that could lead to arbitrary file system read. A high-privileged authenticated attacker can force the application to make arbitrary requests via injection of arbitrary URLs. Exploitation of this issue does not require user interaction, scope is changed due to the fact that an attacker can enforce file read outside the application's path boundary.",2023-10-13T12:47:20.137,https://cve.circl.lu/cve/CVE-2023-26366
CVE-2023-26367,3.6,Adobe,"Adobe Commerce versions 2.4.7-beta1 (and earlier), 2.4.6-p2 (and earlier), 2.4.5-p4 (and earlier) and 2.4.4-p5 (and earlier) are affected by an Improper Input Validation vulnerability that could lead to arbitrary file system read by an admin-privilege authenticated attacker. Exploitation of this issue does not require user interaction.",2023-10-13T12:47:20.137,https://cve.circl.lu/cve/CVE-2023-26367
CVE-2023-24998,3.6,Apache,"Apache Commons FileUpload before 1.5 does not limit the number of request parts to be processed resulting in the possibility of an attacker triggering a DoS with a malicious upload or series of uploads.Note that, like all of the file upload limits, the          new configuration option (FileUploadBase#setFileCountMax) is not          enabled by default and must be explicitly configured.",2023-10-13T16:15:10.930,https://cve.circl.lu/cve/CVE-2023-24998
CVE-2023-27524,5.9,Apache,Session Validation attacks in Apache Superset versions up to and including 2.0.1. Installations that have not altered the default configured SECRET_KEY according to installation instructions allow for an attacker to authenticate and access unauthorized resources. This does not affect Superset administrators who have changed the default value for SECRET_KEY config.,2023-10-13T16:15:11.073,https://cve.circl.lu/cve/CVE-2023-27524
CVE-2023-28709,3.6,Apache,"The fix for CVE-2023-24998 was incomplete for Apache Tomcat 11.0.0-M2 to 11.0.0-M4, 10.1.5 to 10.1.7, 9.0.71 to 9.0.73 and 8.5.85 to 8.5.87. If non-default HTTP       connector settings were used such that the maxParameterCount could be reached using query string parameters and a request was       submitted that supplied exactly maxParameterCount parameters in the query string, the limit for uploaded request parts could be bypassed with the potential for a denial of service to occur.",2023-10-11T07:15:10.407,https://cve.circl.lu/cve/CVE-2023-28709
CVE-2023-41080,2.7,Apache,"URL Redirection to Untrusted Site ('Open Redirect') vulnerability in FORM authentication feature Apache Tomcat.This issue affects Apache Tomcat: from 11.0.0-M1 through 11.0.0-M10, from 10.1.0-M1 through 10.0.12, from 9.0.0-M1 through 9.0.79 and from 8.5.0 through 8.5.92.The vulnerability is limited to the ROOT (default) web application.",2023-10-13T16:15:11.610,https://cve.circl.lu/cve/CVE-2023-41080
CVE-2023-40589,3.6,Apache,"FreeRDP is a free implementation of the Remote Desktop Protocol (RDP), released under the Apache license. In affected versions there is a Global-Buffer-Overflow in the ncrush_decompress function. Feeding crafted input into this function can trigger the overflow which has only been shown to cause a crash. This issue has been addressed in versions 2.11.0 and 3.0.0-beta3. Users are advised to upgrade. There are no known workarounds for this issue.",2023-10-13T01:08:04.113,https://cve.circl.lu/cve/CVE-2023-40589
CVE-2022-48564,3.6,Apple,read_ints in plistlib.py in Python through 3.9.1 is vulnerable to a potential DoS attack via CPU and RAM exhaustion when processing malformed Apple Property List files in binary format.,2023-10-11T23:15:10.140,https://cve.circl.lu/cve/CVE-2022-48564
CVE-2023-41991,3.6,Apple,"A certificate validation issue was addressed. This issue is fixed in macOS Ventura 13.6, iOS 16.7 and iPadOS 16.7. A malicious app may be able to bypass signature validation. Apple is aware of a report that this issue may have been actively exploited against versions of iOS before iOS 16.7.",2023-10-12T02:45:00.457,https://cve.circl.lu/cve/CVE-2023-41991
CVE-2023-41992,5.9,Apple,"The issue was addressed with improved checks. This issue is fixed in macOS Monterey 12.7, macOS Ventura 13.6, iOS 16.7 and iPadOS 16.7. A local attacker may be able to elevate their privileges. Apple is aware of a report that this issue may have been actively exploited against versions of iOS before iOS 16.7.",2023-10-12T02:44:38.967,https://cve.circl.lu/cve/CVE-2023-41992
CVE-2023-41993,5.9,Apple,"The issue was addressed with improved checks. This issue is fixed in Safari 17, iOS 16.7 and iPadOS 16.7, macOS Sonoma 14. Processing web content may lead to arbitrary code execution. Apple is aware of a report that this issue may have been actively exploited against versions of iOS before iOS 16.7.",2023-10-13T02:15:09.717,https://cve.circl.lu/cve/CVE-2023-41993
CVE-2023-40418,3.6,Apple,An authentication issue was addressed with improved state management. This issue is fixed in watchOS 10. An Apple Watch Ultra may not lock when using the Depth app.,2023-10-12T02:16:11.890,https://cve.circl.lu/cve/CVE-2023-40418
CVE-2023-22515,5.9,Atlassian,"Atlassian has been made aware of an issue reported by a handful of customers where external attackers may have exploited a previously unknown vulnerability in publicly accessible Confluence Data Center and Server instances to create unauthorized Confluence administrator accounts and access Confluence instances.Atlassian Cloud sites are not affected by this vulnerability. If your Confluence site is accessed via an atlassian.net domain, it is hosted by Atlassian and is not vulnerable to this issue. For more details, please review the linked advisory on this CVE.",2023-10-10T19:22:02.770,https://cve.circl.lu/cve/CVE-2023-22515
CVE-2023-36414,5.9,Azure,Azure Identity SDK Remote Code Execution Vulnerability,2023-10-13T17:11:51.533,https://cve.circl.lu/cve/CVE-2023-36414
CVE-2023-36415,5.9,Azure,Azure Identity SDK Remote Code Execution Vulnerability,2023-10-13T17:14:21.973,https://cve.circl.lu/cve/CVE-2023-36415
CVE-2023-36418,5.9,Azure,Azure RTOS GUIX Studio Remote Code Execution Vulnerability,2023-10-13T18:34:33.880,https://cve.circl.lu/cve/CVE-2023-36418
CVE-2023-36419,5.9,Azure,Azure HDInsight Apache Oozie Workflow Scheduler Elevation of Privilege Vulnerability,2023-10-13T18:31:30.537,https://cve.circl.lu/cve/CVE-2023-36419
CVE-2023-36561,3.4,Azure,Azure DevOps Server Elevation of Privilege Vulnerability,2023-10-13T18:57:59.683,https://cve.circl.lu/cve/CVE-2023-36561
CVE-2023-36722,3.6,Active Directory,Active Directory Domain Services Information Disclosure Vulnerability,2023-10-13T20:07:43.723,https://cve.circl.lu/cve/CVE-2023-36722
CVE-2023-4237,5.9,Ansible,"A flaw was found in the Ansible Automation Platform. When creating a new keypair, the ec2_key module prints out the private key directly to the standard output. This flaw allows an attacker to fetch those keys from the log files, compromising the system's confidentiality, integrity, and availability.",2023-10-10T18:51:53.670,https://cve.circl.lu/cve/CVE-2023-4237
CVE-2023-4380,3.4,Ansible,"A logic flaw exists in Ansible. Whenever a private project is created with incorrect credentials, they are logged in plaintext. This flaw allows an attacker to retrieve the credentials from the log, resulting in the loss of confidentiality, integrity, and availability.",2023-10-10T18:51:05.010,https://cve.circl.lu/cve/CVE-2023-4380
CVE-2023-33297,3.6,Bitcoin,"Bitcoin Core before 24.1, when debug mode is not used, allows attackers to cause a denial of service (e.g., CPU consumption) because draining the inventory-to-send queue is inefficient, as exploited in the wild in May 2023.",2023-10-12T16:15:12.003,https://cve.circl.lu/cve/CVE-2023-33297
CVE-2023-20231,5.9,Cisco,"A vulnerability in the web UI of Cisco IOS XE Software could allow an authenticated, remote attacker to perform an injection attack against an affected device. This vulnerability is due to insufficient input validation. An attacker could exploit this vulnerability by sending crafted input to the web UI. A successful exploit could allow the attacker to execute arbitrary Cisco IOS XE Software CLI commands with level 15 privileges. Note: This vulnerability is exploitable only if the attacker obtains the credentials for a Lobby Ambassador account. This account is not configured by default.",2023-10-12T13:30:05.050,https://cve.circl.lu/cve/CVE-2023-20231
CVE-2023-20268,1.4,Cisco,"A vulnerability in the packet processing functionality of Cisco access point (AP) software could allow an unauthenticated, adjacent attacker to exhaust resources on an affected device. This vulnerability is due to insufficient management of resources when handling certain types of traffic. An attacker could exploit this vulnerability by sending a series of specific wireless packets to an affected device. A successful exploit could allow the attacker to consume resources on an affected device. A sustained attack could lead to the disruption of the Control and Provisioning of Wireless Access Points (CAPWAP) tunnel and intermittent loss of wireless client traffic.",2023-10-10T13:35:15.353,https://cve.circl.lu/cve/CVE-2023-20268
CVE-2022-33160,3.6,Cryptograph,IBM Security Directory Suite 8.0.1 uses weaker than expected cryptographic algorithms that could allow an attacker to decrypt highly sensitive information.  IBM X-Force ID:  228568.,2023-10-10T19:33:22.613,https://cve.circl.lu/cve/CVE-2022-33160
CVE-2022-44757,2.5,Cryptograph,"BigFix Insights for Vulnerability Remediation (IVR) uses weak cryptography that can lead to credential exposure.  An attacker could gain access to sensitive information, modify data in unexpected ways, etc.",2023-10-11T12:54:12.883,https://cve.circl.lu/cve/CVE-2022-44757
CVE-2023-45063,1.4,ChatGPT,"Cross-Site Request Forgery (CSRF) vulnerability in ReCorp AI Content Writing Assistant (Content Writer, GPT 3 & 4, ChatGPT, Image Generator) All in One plugin <= 1.1.5 versions.",2023-10-12T16:08:32.337,https://cve.circl.lu/cve/CVE-2023-45063
CVE-2023-44828,3.6,D-Link,D-Link DIR-823G A1V1.0.2B05 was discovered to contain a buffer overflow via the CurrentPassword parameter in the CheckPasswdSettings function. This vulnerability allows attackers to cause a Denial of Service (DoS) via a crafted input.,2023-10-07T03:15:05.237,https://cve.circl.lu/cve/CVE-2023-44828
CVE-2023-44829,3.6,D-Link,D-Link DIR-823G A1V1.0.2B05 was discovered to contain a buffer overflow via the AdminPassword parameter in the SetDeviceSettings function. This vulnerability allows attackers to cause a Denial of Service (DoS) via a crafted input.,2023-10-07T03:15:25.163,https://cve.circl.lu/cve/CVE-2023-44829
CVE-2023-44830,3.6,D-Link,D-Link DIR-823G A1V1.0.2B05 was discovered to contain a buffer overflow via the EndTime parameter in the SetParentsControlInfo function. This vulnerability allows attackers to cause a Denial of Service (DoS) via a crafted input.,2023-10-07T03:18:38.277,https://cve.circl.lu/cve/CVE-2023-44830
CVE-2023-44831,3.6,D-Link,D-Link DIR-823G A1V1.0.2B05 was discovered to contain a buffer overflow via the Type parameter in the SetWLanRadioSettings function. This vulnerability allows attackers to cause a Denial of Service (DoS) via a crafted input.,2023-10-07T03:16:56.033,https://cve.circl.lu/cve/CVE-2023-44831
CVE-2023-44832,3.6,D-Link,D-Link DIR-823G A1V1.0.2B05 was discovered to contain a buffer overflow via the MacAddress parameter in the SetWanSettings function. This vulnerability allows attackers to cause a Denial of Service (DoS) via a crafted input.,2023-10-07T03:15:46.517,https://cve.circl.lu/cve/CVE-2023-44832
CVE-2023-39250,3.6,Dell,Dell Storage Integration Tools for VMware (DSITV) and Dell Storage vSphere Client Plugin (DSVCP) versions prior to 6.1.1 and Replay Manager for VMware (RMSV) versions prior to 3.1.2 contain an information disclosure vulnerability. A local low-privileged malicious user could potentially exploit this vulnerability to retrieve an encryption key that could aid in further attacks. ,2023-10-11T06:15:09.597,https://cve.circl.lu/cve/CVE-2023-39250
CVE-2023-32485,5.9,Dell,Dell SmartFabric Storage Software version 1.3 and lower contain an improper input validation vulnerability. A remote unauthenticated attacker may exploit this vulnerability and escalate privileges up to the highest administration level. This is a critical severity vulnerability affecting user authentication. Dell recommends customers to upgrade at the earliest opportunity.,2023-10-07T03:19:10.777,https://cve.circl.lu/cve/CVE-2023-32485
CVE-2023-43079,5.9,Dell,"Dell OpenManage Server Administrator, versions 11.0.0.0 and prior, contains an Improper Access Control vulnerability. A local low-privileged malicious user could potentially exploit this vulnerability to execute arbitrary code in order to elevate privileges on the system. Exploitation may lead to a complete system compromise.",2023-10-13T12:47:20.137,https://cve.circl.lu/cve/CVE-2023-43079
CVE-2023-44384,1.4,Discourse,"Discourse-jira is a Discourse plugin allows Jira projects, issue types, fields and field options will be synced automatically. An administrator user can make an SSRF attack by setting the Jira URL to an arbitrary location and enabling the `discourse_jira_verbose_log` site setting. A moderator user could manipulate the request path to the Jira API, allowing them to perform arbitrary GET requests using the Jira API credentials, potentially with elevated permissions, used by the application. ",2023-10-11T17:49:49.353,https://cve.circl.lu/cve/CVE-2023-44384
CVE-2023-44181,3.6,DDoS,An Improperly Implemented Security Check for Standard vulnerability in storm control of Juniper Networks Junos OS QFX5k devices allows packets to be punted to ARP queue causing a l2 loop resulting in a DDOS violations and DDOS syslog.This issue is triggered when Storm control is enabled and ICMPv6 packets are present on device.This issue affects Juniper Networks:Junos OS  *  All versions prior to 20.2R3-S6 on QFX5k;  *  20.3 versions prior to 20.3R3-S5 on QFX5k;  *  20.4 versions prior to 20.4R3-S5 on QFX5k;  *  21.1 versions prior to 21.1R3-S4 on QFX5k;  *  21.2 versions prior to 21.2R3-S3 on QFX5k;  *  21.3 versions prior to 21.3R3-S2 on QFX5k;  *  21.4 versions prior to 21.4R3 on QFX5k;  *  22.1 versions prior to 22.1R3 on QFX5k;  *  22.2 versions prior to 22.2R2 on QFX5k.,2023-10-13T12:47:39.540,https://cve.circl.lu/cve/CVE-2023-44181
CVE-2023-36416,2.7,Dynamics 365,Microsoft Dynamics 365 (on-premises) Cross-site Scripting Vulnerability,2023-10-13T17:20:48.610,https://cve.circl.lu/cve/CVE-2023-36416
CVE-2023-36429,3.6,Dynamics 365,Microsoft Dynamics 365 (On-Premises) Information Disclosure Vulnerability,2023-10-13T17:57:33.853,https://cve.circl.lu/cve/CVE-2023-36429
CVE-2023-36433,3.6,Dynamics 365,Microsoft Dynamics 365 (On-Premises) Information Disclosure Vulnerability,2023-10-12T17:15:55.900,https://cve.circl.lu/cve/CVE-2023-36433
CVE-2023-36478,3.6,Eclipse,"Eclipse Jetty provides a web server and servlet container. In versions 11.0.0 through 11.0.15, 10.0.0 through 10.0.15, and 9.0.0 through 9.4.52, an integer overflow in `MetaDataBuilder.checkSize` allows for HTTP/2 HPACK header values toexceed their size limit. `MetaDataBuilder.java` determines if a header name or value exceeds the size limit, and throws an exception if the limit is exceeded. However, when length is very large and huffman is true, the multiplication by 4 in line 295will overflow, and length will become negative. `(_size+length)` will now be negative, and the check on line 296 will not be triggered. Furthermore, `MetaDataBuilder.checkSize` allows for user-entered HPACK header value sizes to be negative, potentially leading to a very large buffer allocation later on when the user-entered size is multiplied by 2. This means that if a user provides a negative length value (or, more precisely, a length value which, when multiplied by the 4/3 fudge factor, is negative), and this length value is a very large positive number when multiplied by 2, then the user can cause a very large buffer to be allocated on the server. Users of HTTP/2 can be impacted by a remote denial of service attack. The issue has been fixed in versions 11.0.16, 10.0.16, and 9.4.53. There are no known workarounds.",2023-10-10T17:52:17.703,https://cve.circl.lu/cve/CVE-2023-36478
CVE-2023-45130,3.6,Ethereum,"Frontier is Substrate's Ethereum compatibility layer. Prior to commit aea528198b3b226e0d20cce878551fd4c0e3d5d0, at the end of a contract execution, when opcode SUICIDE marks a contract to be deleted, the software uses `storage::remove_prefix` (now renamed to `storage::clear_prefix`) to remove all storages associated with it. This is a single IO primitive call passing the WebAssembly boundary. For large contracts, the call (without providing a `limit` parameter) can be slow. In addition, for parachains, all storages to be deleted will be part of the PoV, which easily exceed relay chain PoV size limit. On the other hand, Frontier's maintainers only charge a fixed cost for opcode SUICIDE. The maintainers consider the severity of this issue high, because an attacker can craft a contract with a lot of storage values on a parachain, and then call opcode SUICIDE on the contract. If the transaction makes into a parachain block, the parachain will then stall because the PoV size will exceed relay chain's limit. This is especially an issue for XCM transactions, because they can't be skipped. Commit aea528198b3b226e0d20cce878551fd4c0e3d5d0 contains a patch for this issue. For parachains, it's recommended to issue an emergency runtime upgrade as soon as possible. For standalone chains, the impact is less severe because the issue mainly affects PoV sizes. It's recommended to issue a normal runtime upgrade as soon as possible. There are no known workarounds.",2023-10-13T13:46:47.010,https://cve.circl.lu/cve/CVE-2023-45130
CVE-2023-36726,5.9,Exchange,Windows Internet Key Exchange (IKE) Extension Elevation of Privilege  Vulnerability,2023-10-13T19:58:57.183,https://cve.circl.lu/cve/CVE-2023-36726
CVE-2023-36778,5.9,Exchange,Microsoft Exchange Server Remote Code Execution Vulnerability,2023-10-12T22:22:11.657,https://cve.circl.lu/cve/CVE-2023-36778
CVE-2018-4858,5.9,Exploit,"A vulnerability has been identified in IEC 61850 system configurator (All versions < V5.80), DIGSI 5 (affected as IEC 61850 system configurator is incorporated) (All versions < V7.80), DIGSI 4 (All versions < V4.93), SICAM PAS/PQS (All versions < V8.11), SICAM PQ Analyzer (All versions < V3.11), SICAM SCC (All versions < V9.02 HF3). A service of the affected products listening on all of the host's network interfaces on either port 4884/TCP, 5885/TCP, or port 5886/TCP could allow an attacker to either exfiltrate limited data from the system or to execute code with Microsoft Windows user permissions. Successful exploitation requires an attacker to be able to send a specially crafted network request to the vulnerable service and a user interacting with the service's client application on the host. In order to execute arbitrary code with Microsoft Windows user permissions, an attacker must be able to plant the code in advance on the host by other means. The vulnerability has limited impact to confidentiality and integrity of the affected system. At the time of advisory publication no public exploitation of this security vulnerability was known. Siemens confirms the security vulnerability and provides mitigations to resolve the security issue.",2023-10-13T16:45:10.723,https://cve.circl.lu/cve/CVE-2018-4858
CVE-2019-0053,5.9,Exploit,"Insufficient validation of environment variables in the telnet client supplied in Junos OS can lead to stack-based buffer overflows, which can be exploited to bypass veriexec restrictions on Junos OS. A stack-based overflow is present in the handling of environment variables when connecting via the telnet client to remote telnet servers. This issue only affects the telnet client — accessible from the CLI or shell — in Junos OS. Inbound telnet services are not affected by this issue. This issue affects: Juniper Networks Junos OS: 12.3 versions prior to 12.3R12-S13; 12.3X48 versions prior to 12.3X48-D80; 14.1X53 versions prior to 14.1X53-D130, 14.1X53-D49; 15.1 versions prior to 15.1F6-S12, 15.1R7-S4; 15.1X49 versions prior to 15.1X49-D170; 15.1X53 versions prior to 15.1X53-D237, 15.1X53-D496, 15.1X53-D591, 15.1X53-D69; 16.1 versions prior to 16.1R3-S11, 16.1R7-S4; 16.2 versions prior to 16.2R2-S9; 17.1 versions prior to 17.1R3; 17.2 versions prior to 17.2R1-S8, 17.2R2-S7, 17.2R3-S1; 17.3 versions prior to 17.3R3-S4; 17.4 versions prior to 17.4R1-S6, 17.4R2-S3, 17.4R3; 18.1 versions prior to 18.1R2-S4, 18.1R3-S3; 18.2 versions prior to 18.2R1-S5, 18.2R2-S2, 18.2R3; 18.2X75 versions prior to 18.2X75-D40; 18.3 versions prior to 18.3R1-S3, 18.3R2; 18.4 versions prior to 18.4R1-S2, 18.4R2.",2023-10-08T14:15:11.083,https://cve.circl.lu/cve/CVE-2019-0053
CVE-2022-22988,5.2,Exploit,File and directory permissions have been corrected to prevent unintended users from modifying or accessing resources. It would be more difficult for an authenticated attacker to now traverse through the files and directories. This can only be exploited once an attacker has already found a way to get authenticated access to the device. ,2023-10-12T21:15:11.057,https://cve.circl.lu/cve/CVE-2022-22988
CVE-2022-22989,5.9,Exploit,My Cloud OS 5 was vulnerable to a pre-authenticated stack overflow vulnerability on the FTP service that could be exploited by unauthenticated attackers on the network. Addressed the vulnerability by adding defenses against stack overflow issues.,2023-10-12T21:15:11.200,https://cve.circl.lu/cve/CVE-2022-22989
CVE-2022-24282,5.9,Exploit,"A vulnerability has been identified in SINEC NMS (All versions >= V1.0.3 < V2.0), SINEC NMS (All versions < V1.0.3), SINEMA Server V14 (All versions). The affected system allows to upload JSON objects that are deserialized to Java objects. Due to insecure deserialization of user-supplied content by the affected software, a privileged attacker could exploit this vulnerability by sending a maliciously crafted serialized Java object. This could allow the attacker to execute arbitrary code on the device with root privileges.",2023-10-10T11:15:10.177,https://cve.circl.lu/cve/CVE-2022-24282
CVE-2022-25319,1.4,Endpoint,An issue was discovered in Cerebrate through 1.4. Endpoints could be open even when not enabled.,2023-10-10T22:15:10.363,https://cve.circl.lu/cve/CVE-2022-25319
CVE-2022-34180,3.6,Endpoint,"Jenkins Embeddable Build Status Plugin 2.0.3 and earlier does not correctly perform the ViewStatus permission check in the HTTP endpoint it provides for ""unprotected"" status badge access, allowing attackers without any permissions to obtain the build status badge icon for any attacker-specified job and/or build.",2023-10-10T22:15:11.043,https://cve.circl.lu/cve/CVE-2022-34180
CVE-2022-41230,1.4,Endpoint,"Jenkins Build-Publisher Plugin 1.22 and earlier does not perform a permission check in an HTTP endpoint, allowing attackers with Overall/Read permission to obtain names and URLs of Jenkins servers that the plugin is configured to publish builds to, as well as builds pending for publication to those Jenkins servers.",2023-10-10T22:15:11.177,https://cve.circl.lu/cve/CVE-2022-41230
CVE-2023-40577,2.7,Endpoint,Alertmanager handles alerts sent by client applications such as the Prometheus server. An attacker with the permission to perform POST requests on the /api/v1/alerts endpoint could be able to execute arbitrary JavaScript code on the users of Prometheus Alertmanager. This issue has been fixed in Alertmanager version 0.2.51.,2023-10-08T12:15:36.140,https://cve.circl.lu/cve/CVE-2023-40577
CVE-2023-4802,2.7,Endpoint,A reflected cross-site scripting vulnerability in the UpdateInstalledSoftware endpoint of the Insider Threat Management (ITM) Server's web console could be used by an authenticated administrator to run arbitrary javascript within another web console administrator's browser. All versions prior to 7.14.3.69 are affected.,2023-10-13T22:15:10.537,https://cve.circl.lu/cve/CVE-2023-4802
