CVE,"Impact Score (1-10, 10 being the worst)",Keyword,Description,Last Modified,Link
CVE-2024-3158,NA,Google,Use after free in Bookmarks in Google Chrome prior to 123.0.6312.105 allowed a remote attacker to potentially exploit heap corruption via a crafted HTML page. (Chromium security severity: High),2024-04-19T23:15:11.643,https://cve.circl.lu/cve/CVE-2024-3158
CVE-2024-3159,NA,Google,Out of bounds memory access in V8 in Google Chrome prior to 123.0.6312.105 allowed a remote attacker to perform arbitrary read/write via a crafted HTML page. (Chromium security severity: High),2024-04-19T23:15:11.687,https://cve.circl.lu/cve/CVE-2024-3159
CVE-2024-3157,NA,Google,Out of bounds memory access in Compositing in Google Chrome prior to 123.0.6312.122 allowed a remote attacker who had compromised the GPU process to potentially perform a sandbox escape via specific UI gestures. (Chromium security severity: High),2024-04-19T23:15:11.593,https://cve.circl.lu/cve/CVE-2024-3157
CVE-2024-3515,NA,Google,Use after free in Dawn in Google Chrome prior to 123.0.6312.122 allowed a remote attacker to potentially exploit heap corruption via a crafted HTML page. (Chromium security severity: High),2024-04-19T23:15:11.963,https://cve.circl.lu/cve/CVE-2024-3515
CVE-2024-31451,1.4,GPT,DocsGPT is a GPT-powered chat for documentation. DocsGPT is vulnerable to unauthenticated limited file write in routes.py. This vulnerability is fixed in 0.8.1.,2024-04-19T17:15:54.780,https://cve.circl.lu/cve/CVE-2024-31451
CVE-2024-1394,3.6,GitHub,"A memory leak flaw was found in Golang in the RSA encrypting/decrypting code, which might lead to a resource exhaustion vulnerability using attacker-controlled inputs​. The memory leak happens in github.com/golang-fips/openssl/openssl/rsa.go#L113. The objects leaked are pkey​ and ctx​. That function uses named return parameters to free pkey​ and ctx​ if there is an error initializing the context or setting the different properties. All return statements related to error cases follow the ""return nil, nil, fail(...)"" pattern, meaning that pkey​ and ctx​ will be nil inside the deferred function that should free them.",2024-04-16T13:15:11.050,https://cve.circl.lu/cve/CVE-2024-1394
CVE-2024-1540,4.7,GitHub,"A command injection vulnerability exists in the deploy+test-visual.yml workflow of the gradio-app/gradio repository, due to improper neutralization of special elements used in a command. This vulnerability allows attackers to execute unauthorized commands, potentially leading to unauthorized modification of the base repository or secrets exfiltration. The issue arises from the unsafe handling of GitHub context information within a `run` operation, where expressions inside `${{ }}` are evaluated and substituted before script execution. Remediation involves setting untrusted input values to intermediate environment variables to prevent direct influence on script generation.",2024-04-16T12:15:09.617,https://cve.circl.lu/cve/CVE-2024-1540
CVE-2024-3470,5.2,GitHub,An Improper Privilege Management vulnerability was identified in GitHub Enterprise Server that allowed an attacker to use a deploy key pertaining to an organization to bypass an organization ruleset. An attacker would require access to a valid deploy key for a repository in the organization as well as repository administrator access. This vulnerability affected versions of GitHub Enterprise Server 3.11 to 3.12 and was fixed in versions 3.11.8 and 3.12.2. This vulnerability was reported via the GitHub Bug Bounty program.,2024-04-19T16:19:49.043,https://cve.circl.lu/cve/CVE-2024-3470
CVE-2024-3646,6.0,GitHub,"A command injection vulnerability was identified in GitHub Enterprise Server that allowed an attacker with an editor role in the Management Console to gain admin SSH access to the instance when configuring the chat integration. Exploitation of this vulnerability required access to the GitHub Enterprise Server instance and access to the Management Console with the editor role. This vulnerability affected all versions of GitHub Enterprise Server prior to 3.12 and was fixed in versions 3.12.2, 3.11.8, 3.10.10, and 3.9.13. This vulnerability was reported via the GitHub Bug Bounty program.",2024-04-19T16:19:49.043,https://cve.circl.lu/cve/CVE-2024-3646
CVE-2024-3684,6.0,GitHub,"A server side request forgery vulnerability was identified in GitHub Enterprise Server that allowed an attacker with an editor role in the Management Console to gain admin access to the appliance when configuring the Artifacts & Logs and Migrations Storage. Exploitation of this vulnerability required access to the GitHub Enterprise Server instance and access to the Management Console with the editor role. This vulnerability affected all versions of GitHub Enterprise Server prior to 3.12 and was fixed in versions 3.12.2, 3.11.8, 3.10.10, and 3.9.13. This vulnerability was reported via the GitHub Bug Bounty program.",2024-04-19T16:19:49.043,https://cve.circl.lu/cve/CVE-2024-3684
CVE-2024-22437,5.9,HPE,A potential security vulnerability has been identified in VSS Provider and CAPI Proxy software for certain HPE MSA storage products. This vulnerability could be exploited to gain elevated privilege on the system.,2024-04-15T13:15:31.997,https://cve.circl.lu/cve/CVE-2024-22437
CVE-2024-22439,4.7,HPE,A potential security vulnerability has been identified in HPE FlexFabric and FlexNetwork series products. This vulnerability could be exploited to gain privileged access to switches resulting in information disclosure.,2024-04-15T13:15:31.997,https://cve.circl.lu/cve/CVE-2024-22439
CVE-2024-22440,4.0,HPE,A potential security vulnerability has been identified in HPE Compute Scale-up Server 3200 server. This vulnerability could cause disclosure of sensitive information in log files.,2024-04-17T12:48:07.510,https://cve.circl.lu/cve/CVE-2024-22440
CVE-2024-26854,NA,HPE,"In the Linux kernel, the following vulnerability has been resolved:ice: fix uninitialized dplls mutex usageThe pf->dplls.lock mutex is initialized too late, after its first use.Move it to the top of ice_dpll_init.Note that the ""err_exit"" error path destroys the mutex. And the mutex isthe last thing destroyed in ice_dpll_deinit.This fixes the following warning with CONFIG_DEBUG_MUTEXES: ice 0000:10:00.0: The DDP package was successfully loaded: ICE OS Default Package version 1.3.36.0 ice 0000:10:00.0: 252.048 Gb/s available PCIe bandwidth (16.0 GT/s PCIe x16 link) ice 0000:10:00.0: PTP init successful ------------[ cut here ]------------ DEBUG_LOCKS_WARN_ON(lock->magic != lock) WARNING: CPU: 0 PID: 410 at kernel/locking/mutex.c:587 __mutex_lock+0x773/0xd40 Modules linked in: crct10dif_pclmul crc32_pclmul crc32c_intel polyval_clmulni polyval_generic ice(+) nvme nvme_c> CPU: 0 PID: 410 Comm: kworker/0:4 Not tainted 6.8.0-rc5+ #3 Hardware name: HPE ProLiant DL110 Gen10 Plus/ProLiant DL110 Gen10 Plus, BIOS U56 10/19/2023 Workqueue: events work_for_cpu_fn RIP: 0010:__mutex_lock+0x773/0xd40 Code: c0 0f 84 1d f9 ff ff 44 8b 35 0d 9c 69 01 45 85 f6 0f 85 0d f9 ff ff 48 c7 c6 12 a2 a9 85 48 c7 c7 12 f1 a> RSP: 0018:ff7eb1a3417a7ae0 EFLAGS: 00010286 RAX: 0000000000000000 RBX: 0000000000000002 RCX: 0000000000000000 RDX: 0000000000000002 RSI: ffffffff85ac2bff RDI: 00000000ffffffff RBP: ff7eb1a3417a7b80 R08: 0000000000000000 R09: 00000000ffffbfff R10: ff7eb1a3417a7978 R11: ff32b80f7fd2e568 R12: 0000000000000000 R13: 0000000000000000 R14: 0000000000000000 R15: ff32b7f02c50e0d8 FS:  0000000000000000(0000) GS:ff32b80efe800000(0000) knlGS:0000000000000000 CS:  0010 DS: 0000 ES: 0000 CR0: 0000000080050033 CR2: 000055b5852cc000 CR3: 000000003c43a004 CR4: 0000000000771ef0 DR0: 0000000000000000 DR1: 0000000000000000 DR2: 0000000000000000 DR3: 0000000000000000 DR6: 00000000fffe0ff0 DR7: 0000000000000400 PKRU: 55555554 Call Trace:  <TASK>  ? __warn+0x84/0x170  ? __mutex_lock+0x773/0xd40  ? report_bug+0x1c7/0x1d0  ? prb_read_valid+0x1b/0x30  ? handle_bug+0x42/0x70  ? exc_invalid_op+0x18/0x70  ? asm_exc_invalid_op+0x1a/0x20  ? __mutex_lock+0x773/0xd40  ? rcu_is_watching+0x11/0x50  ? __kmalloc_node_track_caller+0x346/0x490  ? ice_dpll_lock_status_get+0x28/0x50 [ice]  ? __pfx_ice_dpll_lock_status_get+0x10/0x10 [ice]  ? ice_dpll_lock_status_get+0x28/0x50 [ice]  ice_dpll_lock_status_get+0x28/0x50 [ice]  dpll_device_get_one+0x14f/0x2e0  dpll_device_event_send+0x7d/0x150  dpll_device_register+0x124/0x180  ice_dpll_init_dpll+0x7b/0xd0 [ice]  ice_dpll_init+0x224/0xa40 [ice]  ? _dev_info+0x70/0x90  ice_load+0x468/0x690 [ice]  ice_probe+0x75b/0xa10 [ice]  ? _raw_spin_unlock_irqrestore+0x4f/0x80  ? process_one_work+0x1a3/0x500  local_pci_probe+0x47/0xa0  work_for_cpu_fn+0x17/0x30  process_one_work+0x20d/0x500  worker_thread+0x1df/0x3e0  ? __pfx_worker_thread+0x10/0x10  kthread+0x103/0x140  ? __pfx_kthread+0x10/0x10  ret_from_fork+0x31/0x50  ? __pfx_kthread+0x10/0x10  ret_from_fork_asm+0x1b/0x30  </TASK> irq event stamp: 125197 hardirqs last  enabled at (125197): [<ffffffff8416409d>] finish_task_switch.isra.0+0x12d/0x3d0 hardirqs last disabled at (125196): [<ffffffff85134044>] __schedule+0xea4/0x19f0 softirqs last  enabled at (105334): [<ffffffff84e1e65a>] napi_get_frags_check+0x1a/0x60 softirqs last disabled at (105332): [<ffffffff84e1e65a>] napi_get_frags_check+0x1a/0x60 ---[ end trace 0000000000000000 ]---",2024-04-17T12:48:07.510,https://cve.circl.lu/cve/CVE-2024-26854
CVE-2024-3817,5.9,HashiCorp,HashiCorp’s go-getter library is vulnerable to argument injection when executing Git to discover remote branches. This vulnerability does not affect the go-getter/v2 branch and package.,2024-04-18T13:04:28.900,https://cve.circl.lu/cve/CVE-2024-3817
CVE-2022-38710,1.4,IBM,IBM Robotic Process Automation 21.0.1 and 21.0.2 could disclose sensitive version information that could aid in further attacks against the system. IBM X-Force ID: 234292.,2024-04-18T04:15:08.367,https://cve.circl.lu/cve/CVE-2022-38710
CVE-2023-47714,2.7,IBM,"IBM Sterling File Gateway 6.0.0.0 through 6.0.3.9, 6.1.0.0 through 6.1.2.3, and 6.2.0.0 is vulnerable to cross-site scripting. This vulnerability allows users to embed arbitrary JavaScript code in the Web UI thus altering the intended functionality potentially leading to credentials disclosure within a trusted session.  IBM X-Force ID:  271531.",2024-04-15T13:15:51.577,https://cve.circl.lu/cve/CVE-2023-47714
CVE-2024-27261,5.9,IBM,"IBM Storage Defender - Resiliency Service 2.0.0 through 2.0.2 could allow a privileged user to install a potentially dangerous tar file, which could give them access to subsequent systems where the package was installed.  IBM X-Force ID:  283986.",2024-04-15T13:15:51.577,https://cve.circl.lu/cve/CVE-2024-27261
CVE-2024-22334,3.6,IBM,"IBM UrbanCode Deploy (UCD) 7.0 through 7.0.5.20, 7.1 through 7.1.2.16, 7.2 through 7.2.3.9, 7.3 through 7.3.2.4 and IBM DevOps Deploy  8.0 through 8.0.0.1 could be vulnerable to incomplete revocation of permissions when deleting a custom security resource type. When deleting a custom security type, associated permissions of objects using that type may not be fully revoked. This could lead to incorrect reporting of permission configuration and unexpected privileges being retained.  IBM X-Force ID:  279974.",2024-04-15T13:15:51.577,https://cve.circl.lu/cve/CVE-2024-22334
CVE-2024-22339,1.4,IBM,"IBM UrbanCode Deploy (UCD) 7.0 through 7.0.5.20, 7.1 through 7.1.2.16, 7.2 through 7.2.3.9, 7.3 through 7.3.2.4 and IBM DevOps Deploy  8.0 through 8.0.0.1 is vulnerable to a sensitive information due to insufficient obfuscation of sensitive values from some log files.  IBM X-Force ID:  279979.",2024-04-15T13:15:31.997,https://cve.circl.lu/cve/CVE-2024-22339
CVE-2024-26593,5.2,Intel,"In the Linux kernel, the following vulnerability has been resolved:i2c: i801: Fix block process call transactionsAccording to the Intel datasheets, software must reset the blockbuffer index twice for block process call transactions: once beforewriting the outgoing data to the buffer, and once again beforereading the incoming data from the buffer.The driver is currently missing the second reset, causing the wrongportion of the block buffer to be read.",2024-04-19T17:58:44.667,https://cve.circl.lu/cve/CVE-2024-26593
CVE-2024-3720,3.4,Intel,A vulnerability has been found in Tianwell Fire Intelligent Command Platform 1.1.1.1 and classified as critical. This vulnerability affects unknown code of the file /mfsNotice/page of the component API Interface. The manipulation of the argument gsdwid leads to sql injection. The attack can be initiated remotely. The exploit has been disclosed to the public and may be used. The identifier of this vulnerability is VDB-260572.,2024-04-15T13:15:31.997,https://cve.circl.lu/cve/CVE-2024-3720
CVE-2024-21001,2.7,Intel,"Vulnerability in the Oracle Business Intelligence Enterprise Edition product of Oracle Analytics (component: BI Platform Security).   The supported version that is affected is 7.0.0.0.0. Easily exploitable vulnerability allows low privileged attacker with network access via HTTP to compromise Oracle Business Intelligence Enterprise Edition.  Successful attacks require human interaction from a person other than the attacker and while the vulnerability is in Oracle Business Intelligence Enterprise Edition, attacks may significantly impact additional products (scope change). Successful attacks of this vulnerability can result in  unauthorized update, insert or delete access to some of Oracle Business Intelligence Enterprise Edition accessible data as well as  unauthorized read access to a subset of Oracle Business Intelligence Enterprise Edition accessible data. CVSS 3.1 Base Score 5.4 (Confidentiality and Integrity impacts).  CVSS Vector: (CVSS:3.1/AV:N/AC:L/PR:L/UI:R/S:C/C:L/I:L/A:N).",2024-04-17T12:48:31.863,https://cve.circl.lu/cve/CVE-2024-21001
CVE-2024-21064,2.7,Intel,"Vulnerability in the Oracle Business Intelligence Enterprise Edition product of Oracle Analytics (component: Analytics Web Answers).  Supported versions that are affected are 7.0.0.0.0 and  12.2.1.4.0. Easily exploitable vulnerability allows low privileged attacker with network access via HTTP to compromise Oracle Business Intelligence Enterprise Edition.  Successful attacks require human interaction from a person other than the attacker and while the vulnerability is in Oracle Business Intelligence Enterprise Edition, attacks may significantly impact additional products (scope change). Successful attacks of this vulnerability can result in  unauthorized update, insert or delete access to some of Oracle Business Intelligence Enterprise Edition accessible data as well as  unauthorized read access to a subset of Oracle Business Intelligence Enterprise Edition accessible data. CVSS 3.1 Base Score 5.4 (Confidentiality and Integrity impacts).  CVSS Vector: (CVSS:3.1/AV:N/AC:L/PR:L/UI:R/S:C/C:L/I:L/A:N).",2024-04-17T12:48:31.863,https://cve.circl.lu/cve/CVE-2024-21064
CVE-2024-21099,1.4,Intel,Vulnerability in the Oracle Business Intelligence Enterprise Edition product of Oracle Analytics (component: Data Visualization).   The supported version that is affected is 7.0.0.0.0. Easily exploitable vulnerability allows low privileged attacker with network access via HTTP to compromise Oracle Business Intelligence Enterprise Edition.  Successful attacks of this vulnerability can result in  unauthorized read access to a subset of Oracle Business Intelligence Enterprise Edition accessible data. CVSS 3.1 Base Score 4.3 (Confidentiality impacts).  CVSS Vector: (CVSS:3.1/AV:N/AC:L/PR:L/UI:N/S:U/C:L/I:N/A:N).,2024-04-17T12:48:31.863,https://cve.circl.lu/cve/CVE-2024-21099
CVE-2021-41434,2.7,Java,A stored Cross-Site Scripting (XSS) vulnerability exists in version 1.0 of the Expense Management System application that allows for arbitrary execution of JavaScript commands through index.php.,2024-04-17T16:21:04.383,https://cve.circl.lu/cve/CVE-2021-41434
CVE-2023-6568,2.7,Java,"A reflected Cross-Site Scripting (XSS) vulnerability exists in the mlflow/mlflow repository, specifically within the handling of the Content-Type header in POST requests. An attacker can inject malicious JavaScript code into the Content-Type header, which is then improperly reflected back to the user without adequate sanitization or escaping, leading to arbitrary JavaScript execution in the context of the victim's browser. The vulnerability is present in the mlflow/server/auth/__init__.py file, where the user-supplied Content-Type header is directly injected into a Python formatted string and returned to the user, facilitating the XSS attack.",2024-04-16T12:15:08.957,https://cve.circl.lu/cve/CVE-2023-6568
CVE-2024-25698,2.7,Java,"There is a reflected cross site scripting vulnerability in the home application in Esri Portal for ArcGIS 11.1 and below on Windows and Linux that allows a remote, unauthenticated attacker to create a crafted link which when clicked could potentially execute arbitrary JavaScript code in the victim’s browser.",2024-04-19T23:15:10.093,https://cve.circl.lu/cve/CVE-2024-25698
CVE-2024-25708,2.7,Java,"There is a stored Cross-site Scripting vulnerability in Esri Portal for ArcGIS Enterprise Web App Builder versions 10.8.1 – 10.9.1 that may allow a remote, authenticated attacker to create a crafted link which when clicked could potentially execute arbitrary JavaScript code in the victim’s browser.  The privileges required to execute this attack are high. ",2024-04-19T23:15:10.237,https://cve.circl.lu/cve/CVE-2024-25708
CVE-2024-25709,2.7,Java,"There is a stored Cross-site Scripting vulnerability in Esri Portal for ArcGIS versions 10.8.1 – 1121 that may allow a remote, authenticated attacker to create a crafted link that can be saved as a new location when moving an existing item which will potentially execute arbitrary JavaScript code in the victim’s browser.  The privileges required to execute this attack are high. ",2024-04-19T23:15:10.307,https://cve.circl.lu/cve/CVE-2024-25709
CVE-2024-3825,1.4,Jenkins,Versions of the BlazeMeter Jenkins plugin prior to 4.22 contain a flaw which results in credential enumeration,2024-04-17T15:31:50.160,https://cve.circl.lu/cve/CVE-2024-3825
CVE-2024-21590,3.6,Juniper,"An Improper Input Validation vulnerability in Juniper Tunnel Driver (jtd) and ICMP module of Juniper Networks Junos OS Evolved allows an unauthenticated attacker within the MPLS administrative domain to send specifically crafted packets to the Routing Engine (RE) to cause a Denial of Service (DoS). When specifically crafted transit MPLS IPv4 packets are received by the Packet Forwarding Engine (PFE), these packets are internally forwarded to the RE. Continued receipt of these packets may create a sustained Denial of Service (DoS) condition.This issue affects Juniper Networks Junos OS:  *  All versions before 21.2R3-S8-EVO;  *  from 21.4-EVO before 21.4R3-S6-EVO;  *  from 22.2-EVO before 22.2R3-S4-EVO;  *  from 22.3-EVO before 22.3R3-S3-EVO;  *  from 22.4-EVO before 22.4R3-EVO;  *  from 23.2-EVO before 23.2R2-EVO.  *  from 23.4-EVO before 23.4R1-S1-EVO.",2024-04-15T13:15:51.577,https://cve.circl.lu/cve/CVE-2024-21590
CVE-2024-21593,3.6,Juniper,"An Improper Check or Handling of Exceptional Conditions vulnerability in the Packet Forwarding Engine (PFE) of Juniper Networks Junos OS and Junos OS Evolved allows an unauthenticated, adjacent attacker to cause a Denial of Service (DoS).If an attacker sends a specific MPLS packet, which upon processing, causes an internal loop, that leads to a PFE crash and restart. Continued receipt of these packets leads to a sustained Denial of Service (DoS) condition. Circuit cross-connect (CCC) needs to be configured on the device for it to be affected by this issue.This issue only affects MX Series with MPC10, MPC11, LC9600, and MX304.This issue affects:Juniper Networks Junos OS21.4 versions from 21.4R3 earlier than 21.4R3-S5;22.2 versions from 22.2R2 earlier than 22.2R3-S2;22.3 versions from 22.3R1 earlier than 22.3R2-S2;22.3 versions from 22.3R3 earlier than 22.3R3-S122.4 versions from 22.4R1 earlier than 22.4R2-S2, 22.4R3;23.2 versions earlier than 23.2R1-S1, 23.2R2.",2024-04-15T13:15:51.577,https://cve.circl.lu/cve/CVE-2024-21593
CVE-2024-21598,3.6,Juniper,"An Improper Validation of Syntactic Correctness of Input vulnerability in the Routing Protocol Daemon (rpd) of Juniper Networks Junos OS and Junos OS Evolved allows a network-based, unauthenticated attacker to cause a Denial of Service (DoS).If a BGP update is received over an established BGP session which contains a tunnel encapsulation attribute with a specifically malformed TLV, rpd will crash and restart.This issue affects Juniper NetworksJunos OS:  *  20.4 versions 20.4R1 and later versions earlier than 20.4R3-S9;  *  21.2 versions earlier than 21.2R3-S7;  *  21.3 versions earlier than 21.3R3-S5;  *  21.4 versions earlier than 21.4R3-S5;  *  22.1 versions earlier than 22.1R3-S4;  *  22.2 versions earlier than 22.2R3-S3;  *  22.3 versions earlier than 22.3R3-S1;  *  22.4 versions earlier than 22.4R3;  *  23.2 versions earlier than 23.2R1-S2, 23.2R2;Junos OS Evolved:  *  20.4-EVO versions 20.4R1-EVO and later versions earlier than 20.4R3-S9-EVO;  *  21.2-EVO versions earlier than 21.2R3-S7-EVO;  *  21.3-EVO versions earlier than 21.3R3-S5-EVO;  *  21.4-EVO versions earlier than 21.4R3-S5-EVO;  *  22.1-EVO versions earlier than 22.1R3-S4-EVO;  *  22.2-EVO versions earlier than 22.2R3-S3-EVO;  *  22.3-EVO versions earlier than 22.3R3-S1-EVO;  *  22.4-EVO versions earlier than 22.4R3-EVO;  *  23.2-EVO versions earlier than 23.2R1-S2-EVO, 23.2R2-EVO;This issue does not affect Juniper Networks  *  Junos OS versions earlier than 20.4R1;  *  Junos OS Evolved versions earlier than 20.4R1-EVO.This is a related but separate issue than the one described in JSA79095.",2024-04-16T18:15:12.357,https://cve.circl.lu/cve/CVE-2024-21598
CVE-2024-21605,3.6,Juniper,"An Exposure of Resource to Wrong Sphere vulnerability in the Packet Forwarding Engine (PFE) of Juniper Networks Junos OS on SRX 300 Series allows an unauthenticated, adjacent attacker to cause a Denial of Service (DoS).Specific valid link-local traffic is not blocked on ports in STP blocked state but is instead sent to the control plane of the device. This leads to excessive resource consumption and in turn severe impact on all control and management protocols of the device.This issue affects Juniper Networks Junos OS:  *  21.2 version 21.2R3-S3 and later versions earlier than 21.2R3-S6;  *  22.1 version 22.1R3 and later versions earlier than 22.1R3-S4;  *  22.2 version 22.2R2and later versions earlier than 22.2R3-S2;  *  22.3 version 22.3R2 and later versions earlier than 22.3R3-S1;  *  22.4 versions earlier than 22.4R2-S2, 22.4R3;  *  23.2 versions earlier than 23.2R1-S1, 23.2R2.This issue does not affect Juniper Networks Junos OS 21.4R1 and later versions of 21.4.",2024-04-15T13:15:51.577,https://cve.circl.lu/cve/CVE-2024-21605
CVE-2024-21609,3.6,Juniper,"A Missing Release of Memory after Effective Lifetime vulnerability in the IKE daemon (iked) of Juniper Networks Junos OS on MX Series with SPC3, and SRX Series allows an administratively adjacent attacker which is able to successfully establish IPsec tunnels to cause a Denial of Service (DoS).If specific values for the IPsec parameters local-ip, remote-ip, remote ike-id, and traffic selectors are sent from the peer, a memory leak occurs during every IPsec SA rekey which is carried out with a specific message sequence. This will eventually result in an iked process crash and restart.The iked process memory consumption can be checked using the below command:  user@host> show system processes extensive | grep iked           PID   USERNAME     PRI  NICE    SIZE    RES    STATE    C   TIME  WCPU COMMAND           56903 root         31    0      4016M  2543M   CPU0     0   2:10  10.50% ikedThis issue affects Juniper Networks Junos OS:  *  All versions earlier than 20.4R3-S9;  *  21.2 versions earlier than 21.2R3-S7;  *  21.3 versions earlier than 21.3R3-S5;  *  21.4 versions earlier than 21.4R3-S4;  *  22.1 versions earlier than 22.1R3-S3;  *  22.2 versions earlier than 22.2R3-S2;  *  22.3 versions earlier than 22.3R3;  *  22.4 versions earlier than 22.4R3;  *  23.2 versions earlier than 23.2R1-S2, 23.2R2.",2024-04-15T13:15:51.577,https://cve.circl.lu/cve/CVE-2024-21609
CVE-2021-41434,2.7,JavaScript,A stored Cross-Site Scripting (XSS) vulnerability exists in version 1.0 of the Expense Management System application that allows for arbitrary execution of JavaScript commands through index.php.,2024-04-17T16:21:04.383,https://cve.circl.lu/cve/CVE-2021-41434
CVE-2023-6568,2.7,JavaScript,"A reflected Cross-Site Scripting (XSS) vulnerability exists in the mlflow/mlflow repository, specifically within the handling of the Content-Type header in POST requests. An attacker can inject malicious JavaScript code into the Content-Type header, which is then improperly reflected back to the user without adequate sanitization or escaping, leading to arbitrary JavaScript execution in the context of the victim's browser. The vulnerability is present in the mlflow/server/auth/__init__.py file, where the user-supplied Content-Type header is directly injected into a Python formatted string and returned to the user, facilitating the XSS attack.",2024-04-16T12:15:08.957,https://cve.circl.lu/cve/CVE-2023-6568
CVE-2024-25698,2.7,JavaScript,"There is a reflected cross site scripting vulnerability in the home application in Esri Portal for ArcGIS 11.1 and below on Windows and Linux that allows a remote, unauthenticated attacker to create a crafted link which when clicked could potentially execute arbitrary JavaScript code in the victim’s browser.",2024-04-19T23:15:10.093,https://cve.circl.lu/cve/CVE-2024-25698
