CVE,Impact Score,Description,Last Modified
CVE-2022-31606,5.9,"NVIDIA GPU Display Driver for Windows contains a vulnerability in the kernel mode layer (nvlddmkm.sys) handler for DxgkDdiEscape, where a failure to properly validate data might allow an attacker with basic user capabilities to cause an out-of-bounds access in kernel mode, which could lead to denial of service, information disclosure, escalation of privileges, or data tampering.",2022-11-20T02:44:25.263
CVE-2022-31607,5.9,"NVIDIA GPU Display Driver for Linux contains a vulnerability in the kernel mode layer (nvidia.ko), where a local user with basic capabilities can cause improper input validation, which may lead to denial of service, escalation of privileges, data tampering, and limited information disclosure.",2022-11-20T02:44:25.263
CVE-2022-31608,5.9,"NVIDIA GPU Display Driver for Linux contains a vulnerability in an optional D-Bus configuration file, where a local user with basic capabilities can impact protected D-Bus endpoints, which may lead to code execution, denial of service, escalation of privileges, information disclosure, and data tampering.",2022-11-20T02:44:25.263
CVE-2022-31610,5.9,"NVIDIA GPU Display Driver for Windows contains a vulnerability in the kernel mode layer (nvlddmkm.sys), where a local user with basic capabilities can cause an out-of-bounds write, which may lead to code execution, denial of service, escalation of privileges, information disclosure, or data tampering.",2022-11-20T02:44:25.263
CVE-2019-15505,5.9,drivers/media/usb/dvb-usb/technisat-usb2.c in the Linux kernel through 5.2.9 has an out-of-bounds read via crafted USB device traffic (which may be remote via usbip or usbredir).,2022-11-16T14:09:15.170
CVE-2022-41906,5.8,"OpenSearch Notifications is a notifications plugin for OpenSearch that enables other plugins to send notifications via Email, Slack, Amazon Chime, Custom web-hook etc channels. A potential SSRF issue in OpenSearch Notifications Plugin 2.2.0 and below could allow an existing privileged user to enumerate listening services or interact with configured resources via HTTP requests exceeding the Notification plugin's intended scope. OpenSearch 2.2.1+ contains the fix for this issue. There are currently no recommended workarounds.",2022-11-16T17:08:30.367
CVE-2020-1968,1.4,The Raccoon attack exploits a flaw in the TLS specification which can lead to an attacker being able to compute the pre-master secret in connections which have used a Diffie-Hellman (DH) based ciphersuite. In such a case this would result in the attacker being able to eavesdrop on all encrypted communications sent over that TLS connection. The attack can only be exploited if an implementation re-uses a DH secret across multiple TLS connections. Note that this issue only impacts DH ciphersuites and not ECDH ciphersuites. This issue affects OpenSSL 1.0.2 which is out of support and no longer receiving public updates. OpenSSL 1.1.1 is not vulnerable to this issue. Fixed in OpenSSL 1.0.2w (Affected 1.0.2-1.0.2v).,2022-11-21T19:48:16.117
CVE-2021-24444,2.7,"The TaxoPress â€“ Create and Manage Taxonomies, Tags, Categories WordPress plugin before 3.0.7.2 does not sanitise its Taxonomy description field, allowing high privilege users to set JavaScript payload in them even when the unfiltered_html capability is disallowed, leading to an authenticated Stored Cross-Site Scripting issue.",2022-11-16T16:40:03.787
CVE-2022-1203,1.4,"The Content Mask WordPress plugin before 1.8.4.1 does not have authorisation and CSRF checks in various AJAX actions, as well as does not validate the option to be updated to ensure it belongs to the plugin. As a result, any authenticated user, such as subscriber could modify arbitrary blog options",2022-11-16T17:23:21.230
CVE-2022-1566,2.7,"The Quotes llama WordPress plugin before 1.0.0 does not sanitise and escape Quotes, which could allow high privilege users such as admin to perform Cross-Site Scripting attacks even when unfiltered_html is disallowed. The attack could also be performed by tricking an admin to import a malicious CSV file",2022-11-16T16:52:54.440
CVE-2022-38139,5.9,Multiple Cross-Site Request Forgery (CSRF) vulnerabilities in RD Station plugin <= 5.2.0 at WordPress.,2022-11-22T16:15:10.083
CVE-2022-2449,3.6,"The reSmush.it : the only free Image Optimizer & compress plugin WordPress plugin before 0.4.4 does not perform CSRF checks for any of its AJAX actions, allowing an attackers to trick logged in users to perform various actions on their behalf on the site.",2022-11-16T19:00:07.810
CVE-2019-15604,3.6,"Improper Certificate Validation in Node.js 10, 12, and 13 causes the process to abort when sending a crafted X.509 certificate",2022-11-16T03:02:05.827
CVE-2019-15605,5.9,"HTTP request smuggling in Node.js 10, 12, and 13 causes malicious payload delivery when transfer-encoding is malformed",2022-11-16T02:55:02.077
CVE-2022-41940,5.5,"Engine.IO is the implementation of transport-based cross-browser/cross-device bi-directional communication layer for Socket.IO. A specially crafted HTTP request can trigger an uncaught exception on the Engine.IO server, thus killing the Node.js process. This impacts all the users of the engine.io package, including those who uses depending packages like socket.io. There is no known workaround except upgrading to a safe version. There are patches for this issue released in versions 3.6.1 and 6.2.1.",2022-11-22T13:44:38.967
CVE-2017-1000509,2.7,Dolibarr version 6.0.2 contains a Cross Site Scripting (XSS) vulnerability in Product details that can result in execution of javascript code.,2022-11-17T17:21:59.260
CVE-2019-19206,2.7,Dolibarr CRM/ERP 10.0.3 allows viewimage.php?file= Stored XSS due to JavaScript execution in an SVG image for a profile picture.,2022-11-17T17:21:59.260
CVE-2020-12137,2.7,"GNU Mailman 2.x before 2.1.30 uses the .obj extension for scrubbed application/octet-stream MIME parts. This behavior may contribute to XSS attacks against list-archive visitors, because an HTTP reply from an archive web server may lack a MIME type, and a web browser may perform MIME sniffing, conclude that the MIME type should have been text/html, and execute JavaScript code.",2022-11-16T03:14:49.593
CVE-2020-7729,5.9,The package grunt before 1.3.0 are vulnerable to Arbitrary Code Execution due to the default usage of the function load() instead of its secure replacement safeLoad() of the package js-yaml inside grunt.file.readYAML.,2022-11-16T14:05:18.333
CVE-2020-26117,5.2,"In rfb/CSecurityTLS.cxx and rfb/CSecurityTLS.java in TigerVNC before 1.11.0, viewers mishandle TLS certificate exceptions. They store the certificates as authorities, meaning that the owner of a certificate could impersonate any server after a client had added an exception.",2022-11-16T14:13:22.957
CVE-2020-10717,4.0,"A potential DoS flaw was found in the virtio-fs shared file system daemon (virtiofsd) implementation of the QEMU version >= v5.0. Virtio-fs is meant to share a host file system directory with a guest via virtio-fs device. If the guest opens the maximum number of file descriptors under the shared directory, a denial of service may occur. This flaw allows a guest user/process to cause this denial of service on the host.",2022-11-16T03:25:22.003
CVE-2020-13659,1.4,address_space_map in exec.c in QEMU 4.2.0 can trigger a NULL pointer dereference related to BounceBuffer.,2022-11-16T03:37:32.817
CVE-2020-10761,1.4,An assertion failure issue was found in the Network Block Device(NBD) Server in all QEMU versions before QEMU 5.0.1. This flaw occurs when an nbd-client sends a spec-compliant request that is near the boundary of maximum permitted request length. A remote nbd-client could use this flaw to crash the qemu-nbd server resulting in a denial of service.,2022-11-16T03:41:52.557
CVE-2020-14364,3.7,"An out-of-bounds read/write access flaw was found in the USB emulator of the QEMU in versions before 5.2.0. This issue occurs while processing USB packets from a guest when USBDevice 'setup_len' exceeds its 'data_buf[4096]' in the do_token_in, do_token_out routines. This flaw allows a guest user to crash the QEMU process, resulting in a denial of service, or the potential execution of arbitrary code with the privileges of the QEMU process on the host.",2022-11-16T14:06:11.863
CVE-2020-25596,3.6,"An issue was discovered in Xen through 4.14.x. x86 PV guest kernels can experience denial of service via SYSENTER. The SYSENTER instruction leaves various state sanitization activities to software. One of Xen's sanitization paths injects a #GP fault, and incorrectly delivers it twice to the guest. This causes the guest kernel to observe a kernel-privilege #GP fault (typically fatal) rather than a user-privilege #GP fault (usually converted into SIGSEGV/etc.). Malicious or buggy userspace can crash the guest kernel, resulting in a VM Denial of Service. All versions of Xen from 3.2 onwards are vulnerable. Only x86 systems are vulnerable. ARM platforms are not vulnerable. Only x86 systems that support the SYSENTER instruction in 64bit mode are vulnerable. This is believed to be Intel, Centaur, and Shanghai CPUs. AMD and Hygon CPUs are not believed to be vulnerable. Only x86 PV guests can exploit the vulnerability. x86 PVH / HVM guests cannot exploit the vulnerability.",2022-11-21T14:24:57.713
CVE-2022-33746,4.0,P2M pool freeing may take excessively long The P2M pool backing second level address translation for guests may be of significant size. Therefore its freeing may take more time than is reasonable without intermediate preemption checks. Such checking for the need to preempt was so far missing.,2022-11-17T03:15:09.650
CVE-2022-33747,1.4,"Arm: unbounded memory consumption for 2nd-level page tables Certain actions require e.g. removing pages from a guest's P2M (Physical-to-Machine) mapping. When large pages are in use to map guest pages in the 2nd-stage page tables, such a removal operation may incur a memory allocation (to replace a large mapping with individual smaller ones). These memory allocations are taken from the global memory pool. A malicious guest might be able to cause the global memory pool to be exhausted by manipulating its own P2M mappings.",2022-11-17T03:15:12.647
CVE-2022-33748,4.0,"lock order inversion in transitive grant copy handling As part of XSA-226 a missing cleanup call was inserted on an error handling path. While doing so, locking requirements were not paid attention to. As a result two cooperating guests granting each other transitive grants can cause locks to be acquired nested within one another, but in respectively opposite order. With suitable timing between the involved grant copy operations this may result in the locking up of a CPU.",2022-11-17T03:15:12.970
CVE-2022-42309,6.0,"Xenstore: Guests can crash xenstored Due to a bug in the fix of XSA-115 a malicious guest can cause xenstored to use a wrong pointer during node creation in an error path, resulting in a crash of xenstored or a memory corruption in xenstored causing further damage. Entering the error path can be controlled by the guest e.g. by exceeding the quota value of maximum nodes per domain.",2022-11-17T03:15:13.650
CVE-2022-3647,3.6,"** DISPUTED ** A vulnerability, which was classified as problematic, was found in Redis. Affected is the function sigsegvHandler of the file debug.c of the component Crash Report. The manipulation leads to denial of service. The real existence of this vulnerability is still doubted at the moment. The name of the patch is 0bf90d944313919eb8e63d3588bf63a367f020a3. It is recommended to apply a patch to fix this issue. VDB-211962 is the identifier assigned to this vulnerability. NOTE: The vendor claims that this is not a DoS because it applies to the crash logging mechanism which is triggered after a crash has occurred.",2022-11-19T07:15:09.270
CVE-2022-39389,2.5,"Lightning Network Daemon (lnd) is an implementation of a lightning bitcoin overlay network node. All lnd nodes before version `v0.15.4` are vulnerable to a block parsing bug that can cause a node to enter a degraded state once encountered. In this degraded state, nodes can continue to make payments and forward HTLCs, and close out channels. Opening channels is prohibited, and also on chain transaction events will be undetected. This can cause loss of funds if a CSV expiry is researched during a breach attempt or a CLTV delta expires forgetting the funds in the HTLC. A patch is available in `lnd` version 0.15.4. Users are advised to upgrade. Users unable to upgrade may use the `lncli updatechanpolicy` RPC call to increase their CLTV value to a very high amount or increase their fee policies. This will prevent nodes from routing through your node, meaning that no pending HTLCs can be present.",2022-11-22T16:49:51.403
CVE-2022-44186,N/A,Netgear R7000P V1.3.1.64 is vulnerable to Buffer Overflow in /usr/sbin/httpd via parameter wan_dns1_pri.,2022-11-22T14:33:22.600
CVE-2022-44187,N/A,Netgear R7000P V1.3.0.8 is vulnerable to Buffer Overflow via wan_dns1_pri.,2022-11-22T14:33:22.600
CVE-2022-44188,N/A,Netgear R7000P V1.3.0.8 is vulnerable to Buffer Overflow in /usr/sbin/httpd via parameter enable_band_steering.,2022-11-22T14:33:22.600
CVE-2022-44190,N/A,Netgear R7000P V1.3.1.64 is vulnerable to Buffer Overflow via parameter enable_band_steering.,2022-11-22T14:33:22.600
CVE-2022-44191,N/A,Netgear R7000P V1.3.1.64 is vulnerable to Buffer Overflow via parameters KEY1 and KEY2.,2022-11-22T14:33:22.600
CVE-2018-20432,5.9,"D-Link COVR-2600R and COVR-3902 Kit before 1.01b05Beta01 use hardcoded credentials for telnet connection, which allows unauthenticated attackers to gain privileged access to the router, and to extract sensitive data or modify the configuration.",2022-11-16T14:48:56.517
CVE-2022-36785,3.6,"D-Link â€“ G integrated Access Device4 Information Disclosure & Authorization Bypass. *Information Disclosure â€“ file contains a URL with private IP at line 15 ""login.asp"" A. The window.location.href = http://192.168.1.1/setupWizard.asp"" http://192.168.1.1/setupWizard.asp"" ; ""admin"" â€“ contains default username value ""login.asp"" B. While accessing the web interface, the login form at *Authorization Bypass â€“ URL by ""setupWizard.asp' while it blocks direct access to â€“ the web interface does not properly validate user identity variables values located at the client side, it is available to access it without a ""login_glag"" and ""login_status"" checking browser and to read the admin user credentials for the web interface.",2022-11-22T17:09:29.637
CVE-2022-44204,5.9,D-Link DIR3060 DIR3060A1_FW111B04.bin is vulnerable to Buffer Overflow.,2022-11-21T20:33:16.807
CVE-2022-44201,N/A,D-Link DIR823G 1.02B05 is vulnerable to Commad Injection.,2022-11-22T15:32:26.680
CVE-2022-44202,N/A,D-Link DIR878 1.02B04 and 1.02B05 are vulnerable to Buffer Overflow.,2022-11-22T15:32:26.680
CVE-2022-40602,5.9,A flaw in the Zyxel LTE3301-M209 firmware verisons prior to V1.00(ABLG.6)C0 could allow a remote attacker to access the device using an improper pre-configured password if the remote administration feature has been enabled by an authenticated administrator.,2022-11-22T13:44:35.607
CVE-2020-7016,3.6,Kibana versions before 6.8.11 and 7.8.1 contain a denial of service (DoS) flaw in Timelion. An attacker can construct a URL that when viewed by a Kibana user can lead to the Kibana process consuming large amounts of CPU and becoming unresponsive.,2022-11-16T03:54:40.627
CVE-2022-41918,5.9,"OpenSearch is a community-driven, open source fork of Elasticsearch and Kibana. There is an issue with the implementation of fine-grained access control rules (document-level security, field-level security and field masking) where they are not correctly applied to the indices that back data streams potentially leading to incorrect access authorization. OpenSearch 1.3.7 and 2.4.0 contain a fix for this issue. Users are advised to update. There are no known workarounds for this issue.",2022-11-18T20:14:11.777
CVE-2022-41917,1.4,"OpenSearch is a community-driven, open source fork of Elasticsearch and Kibana. OpenSearch allows users to specify a local file when defining text analyzers to process data for text analysis. An issue in the implementation of this feature allows certain specially crafted queries to return a response containing the first line of text from arbitrary files. The list of potentially impacted files is limited to text files with read permissions allowed in the Java Security Manager policy configuration. OpenSearch version 1.3.7 and 2.4.0 contain a fix for this issue. Users are advised to upgrade. There are no known workarounds for this issue.",2022-11-18T20:36:31.683
CVE-2021-22141,2.7,"An open redirect flaw was found in Kibana versions before 7.13.0 and 6.8.16. If a logged in user visits a maliciously crafted URL, it could result in Kibana redirecting the user to an arbitrary website.",2022-11-22T21:13:59.430
CVE-2021-37936,2.7,"It was discovered that Kibana was not sanitizing document fields containing HTML snippets. Using this vulnerability, an attacker with the ability to write documents to an elasticsearch index could inject HTML. When the Discover app highlighted a search term containing the HTML, it would be rendered for the user.",2022-11-22T20:28:23.230
CVE-2022-45063,5.9,"xterm before 375 allows code execution via font ops, e.g., because an OSC 50 response may have Ctrl-g and therefore lead to command execution within the vi line-editing mode of Zsh. NOTE: font ops are not allowed in the xterm default configurations of some Linux distributions.",2022-11-22T06:15:51.050
CVE-2011-4329,2.9,"Multiple cross-site scripting (XSS) vulnerabilities in Dolibarr 3.1.0 allow remote attackers to inject arbitrary web script or HTML via (1) the username parameter in a setup action to admin/company.php, or the PATH_INFO to (2) admin/security_other.php, (3) admin/events.php, or (4) admin/user.php.",2022-11-17T17:21:59.260
CVE-2011-4802,6.4,"Multiple SQL injection vulnerabilities in Dolibarr 3.1.0 RC and probably earlier allow remote authenticated users to execute arbitrary SQL commands via the (1) sortfield, (2) sortorder, and (3) sall parameters to user/index.php and (b) user/group/index.php; the id parameter to (4) info.php, (5) perms.php, (6) param_ihm.php, (7) note.php, and (8) fiche.php in user/; and (9) rowid parameter to admin/boxes.php.",2022-11-17T17:21:59.260
CVE-2011-4814,2.9,"Multiple cross-site scripting (XSS) vulnerabilities in Dolibarr 3.1.0 RC and probably earlier allow remote attackers to inject arbitrary web script or HTML via the PATH_INFO to (1) index.php, (2) admin/boxes.php, (3) comm/clients.php, (4) commande/index.php; and the optioncss parameter to (5) admin/ihm.php and (6) user/home.php.",2022-11-17T17:21:59.260
CVE-2012-1225,6.4,Multiple SQL injection vulnerabilities in Dolibarr CMS 3.2.0 Alpha and earlier allow remote authenticated users to execute arbitrary SQL commands via the (1) memberslist parameter (aka Member List) in list.php or (2) rowid parameter to adherents/fiche.php.,2022-11-17T17:21:59.260
CVE-2012-1226,6.4,Multiple directory traversal vulnerabilities in Dolibarr CMS 3.2.0 Alpha allow remote attackers to read arbitrary files and possibly execute arbitrary code via a .. (dot dot) in the (1) file parameter to document.php or (2) backtopage parameter in a create action to comm/action/fiche.php.,2022-11-17T17:21:59.260
CVE-2013-0881,2.9,"Google Chrome before 25.0.1364.97 on Windows and Linux, and before 25.0.1364.99 on Mac OS X, allows remote attackers to cause a denial of service (incorrect read operation) via crafted data in the Matroska container format.",2022-11-18T17:52:19.527
CVE-2013-0882,6.4,"Google Chrome before 25.0.1364.97 on Windows and Linux, and before 25.0.1364.99 on Mac OS X, allows remote attackers to cause a denial of service (incorrect memory access) or possibly have unspecified other impact via a large number of SVG parameters.",2022-11-18T17:55:13.750
CVE-2013-0883,2.9,"Skia, as used in Google Chrome before 25.0.1364.97 on Windows and Linux, and before 25.0.1364.99 on Mac OS X, allows remote attackers to cause a denial of service (incorrect read operation) via unspecified vectors.",2022-11-18T17:55:38.703
CVE-2013-0884,6.4,"Google Chrome before 25.0.1364.97 on Windows and Linux, and before 25.0.1364.99 on Mac OS X, does not properly load Native Client (aka NaCl) code, which has unspecified impact and attack vectors.",2022-11-18T19:59:24.583
CVE-2013-0885,6.4,"Google Chrome before 25.0.1364.97 on Windows and Linux, and before 25.0.1364.99 on Mac OS X, does not properly restrict API privileges during interaction with the Chrome Web Store, which has unspecified impact and attack vectors.",2022-11-18T19:59:08.363
CVE-2022-2214,5.9,A vulnerability was found in SourceCodester Library Management System 1.0. It has been rated as critical. Affected by this issue is some unknown functionality of the file /librarian/bookdetails.php. The manipulation of the argument id with the input ' AND (SELECT 9198 FROM (SELECT(SLEEP(5)))iqZA)-- PbtB leads to sql injection. The attack may be launched remotely. The exploit has been disclosed to the public and may be used.,2022-11-16T17:00:45.357
CVE-2022-41905,2.7,"WsgiDAV is a generic and extendable WebDAV server based on WSGI. Implementations using this library with directory browsing enabled may be susceptible to Cross Site Scripting (XSS) attacks. This issue has been patched, users can upgrade to version 4.1.0. As a workaround, set `dir_browser.enable = False` in the configuration.",2022-11-16T18:10:41.607
CVE-2022-40843,3.6,The Tenda AC1200 V-W15Ev2 V15.11.0.10(1576) router is vulnerable to improper authorization / improper session management that allows the router login page to be bypassed. This leads to authenticated attackers having the ability to read the routers syslog.log file which contains the MD5 password of the Administrator's user account.,2022-11-18T17:10:30.560
CVE-2022-40845,3.6,"The Tenda AC1200 Router model W15Ev2 V15.11.0.10(1576) is affected by a password exposure vulnerability. When combined with the improper authorization/improper session management vulnerability, an attacker with access to the router may be able to expose sensitive information which they're not explicitly authorized to have.",2022-11-18T21:33:15.620
CVE-2022-40847,5.9,"In Tenda AC1200 Router model W15Ev2 V15.11.0.10(1576), there exists a command injection vulnerability in the function formSetFixTools. This vulnerability allows attackers to run arbitrary commands on the server via the hostname parameter.",2022-11-18T21:33:33.703
CVE-2022-20918,3.6,"A vulnerability in the Simple Network Management Protocol (SNMP) access controls for Cisco FirePOWER Software for Adaptive Security Appliance (ASA) FirePOWER module, Cisco Firepower Management Center (FMC) Software, and Cisco Next-Generation Intrusion Prevention System (NGIPS) Software could allow an unauthenticated, remote attacker to perform an SNMP GET request using a default credential. This vulnerability is due to the presence of a default credential for SNMP version 1 (SNMPv1) and SNMP version 2 (SNMPv2). An attacker could exploit this vulnerability by sending an SNMPv1 or SNMPv2 GET request to an affected device. A successful exploit could allow the attacker to retrieve sensitive information from the device using the default credential. This attack will only be successful if SNMP is configured, and the attacker can only perform SNMP GET requests; write access using SNMP is not allowed.",2022-11-22T00:48:02.307
CVE-2022-20924,3.6,"A vulnerability in the Simple Network Management Protocol (SNMP) feature of Cisco Adaptive Security Appliance (ASA) Software and Cisco Firepower Threat Defense (FTD) Software could allow an authenticated, remote attacker to cause a denial of service (DoS) condition on an affected device. This vulnerability is due to insufficient input validation. An attacker could exploit this vulnerability by sending a crafted SNMP request to an affected device. A successful exploit could allow the attacker to cause the affected device to reload, resulting in a DoS condition.",2022-11-22T14:36:16.027
CVE-2022-0222,3.6,"A CWE-269: Improper Privilege Management vulnerability exists that could cause a denial of service of the Ethernet communication of the controller when sending a specific request over SNMP. Affected products: Modicon M340 CPUs(BMXP34* versions prior to V3.40), Modicon M340 X80 Ethernet Communication modules:BMXNOE0100 (H), BMXNOE0110 (H), BMXNOR0200H RTU(BMXNOE* all versions)(BMXNOR* versions prior to v1.7 IR24)",2022-11-22T13:44:35.607
CVE-2021-31608,1.4,Proofpoint Enterprise Protection before 18.8.0 allows a Bypass of a Security Control.,2022-11-21T19:44:09.880
CVE-2022-31160,2.7,"jQuery UI is a curated set of user interface interactions, effects, widgets, and themes built on top of jQuery. Versions prior to 1.13.2 are potentially vulnerable to cross-site scripting. Initializing a checkboxradio widget on an input enclosed within a label makes that parent label contents considered as the input label. Calling `.checkboxradio( ""refresh"" )` on such a widget and the initial HTML contained encoded HTML entities will make them erroneously get decoded. This can lead to potentially executing JavaScript code. The bug has been patched in jQuery UI 1.13.2. To remediate the issue, someone who can change the initial HTML can wrap all the non-input contents of the `label` in a `span`.",2022-11-21T03:15:13.987
