CVE,"Impact Score (1-10, 10 being the worst)",Keyword,Description,Last Modified,Link
CVE-2023-25132,5.9,MacOS,"Unrestricted upload of file with dangerous type vulnerability in default.cmd file in PowerPanel Business Local/Remote for Windows v4.8.6 and earlier, PowerPanel Business Management for Windows v4.8.6 and earlier, PowerPanel Business Local/Remote for Linux 32bit v4.8.6 and earlier, PowerPanel Business Local/Remote for Linux 64bit v4.8.6 and earlier, PowerPanel Business Management for Linux 32bit v4.8.6 and earlier, PowerPanel Business Management for Linux 64bit v4.8.6 and earlier, PowerPanel Business Local/Remote for MacOS v4.8.6 and earlier, and PowerPanel Business Management for MacOS v4.8.6 and earlier allows remote attackers to execute operation system commands via unspecified vectors.",2023-05-02T20:19:38.180,https://cve.circl.lu/cve/CVE-2023-25132
CVE-2023-25133,5.9,MacOS,"Improper privilege management vulnerability in default.cmd file in PowerPanel Business Local/Remote for Windows v4.8.6 and earlier, PowerPanel Business Management for Windows v4.8.6 and earlier, PowerPanel Business Local/Remote for Linux 32bit v4.8.6 and earlier, PowerPanel Business Local/Remote for Linux 64bit v4.8.6 and earlier, PowerPanel Business Management for Linux 32bit v4.8.6 and earlier, PowerPanel Business Management for Linux 64bit v4.8.6 and earlier, PowerPanel Business Local/Remote for MacOS v4.8.6 and earlier, and PowerPanel Business Management for MacOS v4.8.6 and earlier allows remote attackers to execute operation system commands via unspecified vectors.",2023-05-02T20:24:58.830,https://cve.circl.lu/cve/CVE-2023-25133
CVE-2023-26567,5.2,MariaDB,"Sangoma FreePBX 1805 through 2302 (when obtained as a ,.ISO file) places AMPDBUSER, AMPDBPASS, AMPMGRUSER, and AMPMGRPASS in the list of global variables. This exposes cleartext authentication credentials for the Asterisk Database (MariaDB/MySQL) and Asterisk Manager Interface. For example, an attacker can make a /ari/asterisk/variable?variable=AMPDBPASS API call.",2023-05-05T15:10:19.097,https://cve.circl.lu/cve/CVE-2023-26567
CVE-2022-40722,4.0,MFA,"A misconfiguration of RSA padding implemented in the PingID Adapter for PingFederate to support Offline MFA with PingID mobile authenticators is vulnerable to pre-computed dictionary attacks, leading to a bypass of offline MFA.",2023-05-04T19:46:42.447,https://cve.circl.lu/cve/CVE-2022-40722
CVE-2022-40723,3.6,MFA,"The PingID RADIUS PCV adapter for PingFederate, which supports RADIUS authentication with PingID MFA, is vulnerable to MFA bypass under certain configurations.",2023-05-04T19:48:57.540,https://cve.circl.lu/cve/CVE-2022-40723
CVE-2023-26987,3.6,MFA,An issue discovered in Konga 0.14.9 allows remote attackers to manipulate user accounts regardless of privilege via crafted POST request.,2023-05-06T03:10:43.743,https://cve.circl.lu/cve/CVE-2023-26987
CVE-2023-30444,3.6,Machine Learning,"IBM Watson Machine Learning on Cloud Pak for Data 4.0 and 4.5 is vulnerable to server-side request forgery (SSRF). This may allow an authenticated attacker to send unauthorized requests from the system, potentially leading to network enumeration or facilitating other attacks.  IBM X-Force ID:  253350.",2023-05-04T20:05:05.557,https://cve.circl.lu/cve/CVE-2023-30444
CVE-2022-46871,5.9,Mozilla,An out of date library (libusrsctp) contained vulnerabilities that could potentially be exploited. This vulnerability affects Firefox < 108.,2023-05-03T12:16:31.377,https://cve.circl.lu/cve/CVE-2022-46871
CVE-2022-46872,4.0,Mozilla,"An attacker who compromised a content process could have partially escaped the sandbox to read arbitrary files via clipboard-related IPC messages.<br>*This bug only affects Thunderbird for Linux. Other operating systems are unaffected.*. This vulnerability affects Firefox < 108, Firefox ESR < 102.6, and Thunderbird < 102.6.",2023-05-03T12:16:31.793,https://cve.circl.lu/cve/CVE-2022-46872
CVE-2022-46873,5.9,Mozilla,"Because Firefox did not implement the <code>unsafe-hashes</code> CSP directive, an attacker who was able to inject markup into a page otherwise protected by a Content Security Policy may have been able to inject executable script. This would be severely constrained by the specified Content Security Policy of the document. This vulnerability affects Firefox < 108.",2023-05-03T11:15:12.397,https://cve.circl.lu/cve/CVE-2022-46873
CVE-2022-46874,5.9,Mozilla,"A file with a long filename could have had its filename truncated to remove the valid extension, leaving a malicious extension in its place. This could potentially led to user confusion and the execution of malicious code.<br/>*Note*: This issue was originally included in the advisories for Thunderbird 102.6, but a patch (specific to Thunderbird) was omitted, resulting in it actually being fixed in Thunderbird 102.6.1. This vulnerability affects Firefox < 108, Thunderbird < 102.6.1, Thunderbird < 102.6, and Firefox ESR < 102.6.",2023-05-03T12:16:32.060,https://cve.circl.lu/cve/CVE-2022-46874
CVE-2022-46875,3.6,Mozilla,"The executable file warning was not presented when downloading .atloc and .ftploc files, which can run commands on a user's computer. <br>*Note: This issue only affected Mac OS operating systems. Other operating systems are unaffected.*. This vulnerability affects Firefox < 108, Firefox ESR < 102.6, and Thunderbird < 102.6.",2023-05-03T12:16:32.707,https://cve.circl.lu/cve/CVE-2022-46875
CVE-2023-0184,5.9,NVIDIA,"NVIDIA GPU Display Driver for Windows and Linux contains a vulnerability in the kernel mode layer handler which may lead to denial of service, escalation of privileges, information disclosure, and data tampering.",2023-05-02T14:24:17.237,https://cve.circl.lu/cve/CVE-2023-0184
CVE-2023-0190,3.6,NVIDIA,"NVIDIA GPU Display Driver for Linux contains a vulnerability in the kernel mode layer, where a NULL pointer dereference may lead to denial of service.",2023-05-02T14:24:38.437,https://cve.circl.lu/cve/CVE-2023-0190
CVE-2023-0199,4.2,NVIDIA,"NVIDIA GPU Display Driver for Windows and Linux contains a vulnerability in the kernel mode layer handler, where an out-of-bounds write can lead to denial of service and data tampering.",2023-05-02T14:25:09.480,https://cve.circl.lu/cve/CVE-2023-0199
CVE-2023-0202,5.9,NVIDIA,"NVIDIA DGX A100 SBIOS contains a vulnerability where an attacker may modify arbitrary memory of SMRAM by exploiting the GenericSio and LegacySmmSredir SMM APIs. A successful exploit of this vulnerability may lead to denial of service, escalation of privileges, and information disclosure.",2023-05-02T15:16:40.460,https://cve.circl.lu/cve/CVE-2023-0202
CVE-2023-0203,4.0,NVIDIA,"NVIDIA ConnectX-5, ConnectX-6, and ConnectX6-DX contain a vulnerability in the NIC firmware, where an unprivileged user can exploit insufficient granularity of access control, which may lead to denial of service.",2023-05-02T13:53:49.337,https://cve.circl.lu/cve/CVE-2023-0203
CVE-2020-8597,5.9,Netgear,eap.c in pppd in ppp 2.4.2 through 2.4.8 has an rhostname buffer overflow in the eap_request and eap_response functions.,2023-05-05T17:48:17.840,https://cve.circl.lu/cve/CVE-2020-8597
CVE-2023-30280,5.9,Netgear,"Buffer Overflow vulnerability found in Netgear R6900 v.1.0.2.26, R6700v3 v.1.0.4.128, R6700 v.1.0.0.26 allows a remote attacker to execute arbitrary code and cause a denial ofservice via the getInputData parameter of the fwSchedule.cgi page.",2023-05-08T16:54:48.227,https://cve.circl.lu/cve/CVE-2023-30280
CVE-2023-2380,3.6,Netgear,"A vulnerability, which was classified as problematic, was found in Netgear SRX5308 up to 4.3.5-3. Affected is an unknown function. The manipulation leads to denial of service. It is possible to launch the attack remotely. The exploit has been disclosed to the public and may be used. VDB-227658 is the identifier assigned to this vulnerability. NOTE: The vendor was contacted early about this disclosure but did not respond in any way.",2023-05-05T18:16:55.040,https://cve.circl.lu/cve/CVE-2023-2380
CVE-2023-2381,2.7,Netgear,A vulnerability has been found in Netgear SRX5308 up to 4.3.5-3 and classified as problematic. Affected by this vulnerability is an unknown functionality of the file scgi-bin/platform.cgi?page=bandwidth_profile.htm of the component Web Management Interface. The manipulation of the argument BandWidthProfile.ProfileName leads to cross site scripting. The attack can be launched remotely. The exploit has been disclosed to the public and may be used. The associated identifier of this vulnerability is VDB-227659. NOTE: The vendor was contacted early about this disclosure but did not respond in any way.,2023-05-05T18:16:29.463,https://cve.circl.lu/cve/CVE-2023-2381
CVE-2023-2382,2.7,Netgear,A vulnerability was found in Netgear SRX5308 up to 4.3.5-3 and classified as problematic. Affected by this issue is some unknown functionality of the file scgi-bin/platform.cgi?page=firewall_logs_email.htm of the component Web Management Interface. The manipulation of the argument sysLogInfo.serverName leads to cross site scripting. The attack may be launched remotely. The exploit has been disclosed to the public and may be used. The identifier of this vulnerability is VDB-227660. NOTE: The vendor was contacted early about this disclosure but did not respond in any way.,2023-05-05T18:16:05.950,https://cve.circl.lu/cve/CVE-2023-2382
CVE-2023-28847,3.6,Nextcloud,"Nextcloud Server is the file server software for Nextcloud, a self-hosted productivity platform. In Nextcloud Server 24.0.0 prior to 24.0.11 and 25.0.0 prior to 25.0.5; as well as Nextcloud Server Enterprise 23.0.0 prior to 23.0.12.6, 24.0.0 prior to 24.0.11, and 25.0.0 prior to 25.0.5; an attacker is not restricted in verifying passwords of share links so they can just start brute forcing the password. Nextcloud Server 24.0.11 and 25.0.5 and Nextcloud Enterprise Server 23.0.12.6, 24.0.11, and 25.0.5 contain a fix for this issue. No known workarounds are available.",2023-05-04T19:19:34.863,https://cve.circl.lu/cve/CVE-2023-28847
CVE-2023-29778,NA,Nginx,GL.iNET MT3000 4.1.0 Release 2 is vulnerable to OS Command Injection via /usr/lib/oui-httpd/rpc/logread.,2023-05-03T10:33:50.897,https://cve.circl.lu/cve/CVE-2023-29778
CVE-2023-28656,5.2,Nginx,NGINX Management Suite may allow an authenticated attacker to gain access to configuration objects outside of their assigned environment.  Note: Software versions which have reached End of Technical Support (EoTS) are not evaluated.,2023-05-03T15:23:46.587,https://cve.circl.lu/cve/CVE-2023-28656
CVE-2023-28724,5.2,Nginx,NGINX Management Suite default file permissions are set such that an authenticated attacker may be able to modify sensitive files on NGINX Instance Manager and NGINX API Connectivity Manager.  Note: Software versions which have reached End of Technical Support (EoTS) are not evaluated.,2023-05-03T15:23:46.587,https://cve.circl.lu/cve/CVE-2023-28724
CVE-2023-23920,3.6,Node.js,"An untrusted search path vulnerability exists in Node.js. <19.6.1, <18.14.1, <16.19.1, and <14.21.3 that could allow an attacker to search and potentially load ICU data when running with elevated privileges.",2023-05-03T04:15:09.413,https://cve.circl.lu/cve/CVE-2023-23920
CVE-2023-27848,5.9,NPM,broccoli-compass v0.2.4 was discovered to contain a remote code execution (RCE) vulnerability via the child_process function.,2023-05-03T15:29:21.517,https://cve.circl.lu/cve/CVE-2023-27848
CVE-2023-27849,5.9,NPM,rails-routes-to-json v1.0.0 was discovered to contain a remote code execution (RCE) vulnerability via the child_process function.,2023-05-03T18:49:02.067,https://cve.circl.lu/cve/CVE-2023-27849
CVE-2023-29566,5.9,NPM,huedawn-tesseract 0.3.3 and dawnsparks-node-tesseract 0.4.0 to 0.4.1 was discovered to contain a remote code execution (RCE) vulnerability via the child_process function.,2023-05-03T19:45:48.853,https://cve.circl.lu/cve/CVE-2023-29566
CVE-2023-31484,5.9,NPM,CPAN.pm before 2.35 does not verify TLS certificates when downloading distributions over HTTPS.,2023-05-08T17:11:13.023,https://cve.circl.lu/cve/CVE-2023-31484
CVE-2020-23930,3.6,NULL Pointer,An issue was discovered in gpac through 20200801. A NULL pointer dereference exists in the function nhmldump_send_header located in write_nhml.c. It allows an attacker to cause Denial of Service.,2023-05-05T19:45:30.473,https://cve.circl.lu/cve/CVE-2020-23930
CVE-2021-32269,3.6,NULL Pointer,An issue was discovered in gpac through 20200801. A NULL pointer dereference exists in the function ilst_item_box_dump located in box_dump.c. It allows an attacker to cause Denial of Service.,2023-05-05T19:45:33.843,https://cve.circl.lu/cve/CVE-2021-32269
CVE-2021-32270,3.6,NULL Pointer,An issue was discovered in gpac through 20200801. A NULL pointer dereference exists in the function vwid_box_del located in box_code_base.c. It allows an attacker to cause Denial of Service.,2023-05-05T19:44:14.497,https://cve.circl.lu/cve/CVE-2021-32270
CVE-2022-24249,3.6,NULL Pointer,"A Null Pointer Dereference vulnerability exists in GPAC 1.1.0 via the xtra_box_write function in /box_code_base.c, which causes a Denial of Service. This vulnerability was fixed in commit 71f9871.",2023-05-03T16:48:21.923,https://cve.circl.lu/cve/CVE-2022-24249
CVE-2022-1620,3.6,NULL Pointer,NULL Pointer Dereference in function vim_regexec_string at regexp.c:2729 in GitHub repository vim/vim prior to 8.2.4901. NULL Pointer Dereference in function vim_regexec_string at regexp.c:2729 allows attackers to cause a denial of service (application crash) via a crafted input.,2023-05-03T12:15:20.290,https://cve.circl.lu/cve/CVE-2022-1620
CVE-2023-2193,5.2,OAuth,"Mattermost fails to invalidate existing authorization codes when deauthorizing an OAuth2 app, allowing an attacker possessing an authorization code to generate an access token.",2023-05-02T18:13:54.933,https://cve.circl.lu/cve/CVE-2023-2193
CVE-2023-1255,3.6,OpenSSL,"Issue summary: The AES-XTS cipher decryption implementation for 64 bit ARMplatform contains a bug that could cause it to read past the input buffer,leading to a crash.Impact summary: Applications that use the AES-XTS algorithm on the 64 bit ARMplatform can crash in rare circumstances. The AES-XTS algorithm is usuallyused for disk encryption.The AES-XTS cipher decryption implementation for 64 bit ARM platform will readpast the end of the ciphertext buffer if the ciphertext size is 4 mod 5 in 16byte blocks, e.g. 144 bytes or 1024 bytes. If the memory after the ciphertextbuffer is unmapped, this will trigger a crash which results in a denial ofservice.If an attacker can control the size and location of the ciphertext bufferbeing decrypted by an application using AES-XTS on 64 bit ARM, theapplication is affected. This is fairly unlikely making this issuea Low severity one.",2023-05-02T16:42:01.440,https://cve.circl.lu/cve/CVE-2023-1255
CVE-2020-2978,1.4,Oracle,"Vulnerability in the Oracle Database - Enterprise Edition component of Oracle Database Server. Supported versions that are affected are 12.1.0.2, 12.2.0.1, 18c and 19c. Easily exploitable vulnerability allows high privileged attacker having DBA role account privilege with network access via Oracle Net to compromise Oracle Database - Enterprise Edition. While the vulnerability is in Oracle Database - Enterprise Edition, attacks may significantly impact additional products. Successful attacks of this vulnerability can result in unauthorized update, insert or delete access to some of Oracle Database - Enterprise Edition accessible data. CVSS 3.1 Base Score 4.1 (Integrity impacts). CVSS Vector: (CVSS:3.1/AV:N/AC:L/PR:H/UI:N/S:C/C:N/I:L/A:N).",2023-05-05T19:15:14.877,https://cve.circl.lu/cve/CVE-2020-2978
CVE-2021-28363,2.5,Oracle,The urllib3 library 1.26.x before 1.26.4 for Python omits SSL certificate validation in some cases involving HTTPS to HTTPS proxies. The initial connection to the HTTPS proxy (if an SSLContext isn't given via proxy_config) doesn't verify the hostname of the certificate. This means certificates for different servers that still validate properly with the default urllib3 SSLContext will be silently accepted.,2023-05-03T11:15:10.133,https://cve.circl.lu/cve/CVE-2021-28363
CVE-2021-29921,5.9,Oracle,"In Python before 3,9,5, the ipaddress library mishandles leading zero characters in the octets of an IP address string. This (in some situations) allows attackers to bypass access control that is based on IP addresses.",2023-05-03T11:15:10.457,https://cve.circl.lu/cve/CVE-2021-29921
CVE-2022-0391,3.6,Oracle,"A flaw was found in Python, specifically within the urllib.parse module. This module helps break Uniform Resource Locator (URL) strings into components. The issue involves how the urlparse method does not sanitize input and allows characters like '\r' and '\n' in the URL path. This flaw allows an attacker to input a crafted URL, leading to injection attacks. This flaw affects Python versions prior to 3.10.0b1, 3.9.5, 3.8.11, 3.7.11 and 3.6.14.",2023-05-03T11:15:11.047,https://cve.circl.lu/cve/CVE-2022-0391
CVE-2022-1154,5.9,Oracle,Use after free in utf_ptr2char in GitHub repository vim/vim prior to 8.2.4646.,2023-05-03T12:15:16.557,https://cve.circl.lu/cve/CVE-2022-1154
CVE-2023-25292,2.7,Office,"Reflected Cross Site Scripting (XSS) in Intermesh BV Group-Office version 6.6.145, allows attackers to gain escalated privileges and gain sensitive information via the GO_LANGUAGE cookie.",2023-05-05T20:18:47.160,https://cve.circl.lu/cve/CVE-2023-25292
CVE-2023-2523,3.4,Office,A vulnerability was found in Weaver E-Office 9.5. It has been rated as critical. Affected by this issue is some unknown functionality of the file App/Ajax/ajax.php?action=mobile_upload_save. The manipulation of the argument upload_quwan leads to unrestricted upload. The attack may be launched remotely. The exploit has been disclosed to the public and may be used. VDB-228014 is the identifier assigned to this vulnerability. NOTE: The vendor was contacted early about this disclosure but did not respond in any way.,2023-05-04T18:45:32.047,https://cve.circl.lu/cve/CVE-2023-2523
CVE-2023-1651,NA,OpenAI,"The AI ChatBot WordPress plugin before 4.4.9 does not have authorisation and CSRF in the AJAX action responsible to update the OpenAI settings, allowing any authenticated users, such as subscriber to update them. Furthermore, due to the lack of escaping of the settings, this could also lead to Stored XSS",2023-05-08T14:17:23.197,https://cve.circl.lu/cve/CVE-2023-1651
CVE-2023-30840,5.5,Orchestrator,"Fluid is an open source Kubernetes-native distributed dataset orchestrator and accelerator for data-intensive applications. Starting in version 0.7.0 and prior to version 0.8.6, if a malicious user gains control of a Kubernetes node running fluid csi pod (controlled by the `csi-nodeplugin-fluid` node-daemonset), they can leverage the fluid-csi service account to modify specs of all the nodes in the cluster. However, since this service account lacks `list node` permissions, the attacker may need to use other techniques to identify vulnerable nodes.Once the attacker identifies and modifies the node specs, they can manipulate system-level-privileged components to access all secrets in the cluster or execute pods on other nodes. This allows them to elevate privileges beyond the compromised node and potentially gain full privileged access to the whole cluster.To exploit this vulnerability, the attacker can make all other nodes unschedulable (for example, patch node with taints) and wait for system-critical components with high privilege to appear on the compromised node. However, this attack requires two prerequisites: a compromised node and identifying all vulnerable nodes through other means.Version 0.8.6 contains a patch for this issue. As a workaround, delete the `csi-nodeplugin-fluid` daemonset in `fluid-system` namespace and avoid using CSI mode to mount FUSE file systems. Alternatively, using sidecar mode to mount FUSE file systems is recommended.",2023-05-08T18:15:14.187,https://cve.circl.lu/cve/CVE-2023-30840
CVE-2015-5122,10.0,PHP,"Use-after-free vulnerability in the DisplayObject class in the ActionScript 3 (AS3) implementation in Adobe Flash Player 13.x through 13.0.0.302 on Windows and OS X, 14.x through 18.0.0.203 on Windows and OS X, 11.x through 11.2.202.481 on Linux, and 12.x through 18.0.0.204 on Linux Chrome installations allows remote attackers to execute arbitrary code or cause a denial of service (memory corruption) via crafted Flash content that leverages improper handling of the opaqueBackground property, as exploited in the wild in July 2015.",2023-05-08T13:29:02.290,https://cve.circl.lu/cve/CVE-2015-5122
CVE-2023-29197,3.6,PHP,"guzzlehttp/psr7 is a PSR-7 HTTP message library implementation in PHP. Affected versions are subject to improper header parsing. An attacker could sneak in a newline (\n) into both the header names and values. While the specification states that \r\n\r\n is used to terminate the header list, many servers in the wild will also accept \n\n. This is a follow-up to CVE-2022-24775 where the fix was incomplete. The issue has been patched in versions 1.9.1 and 2.4.5. There are no known workarounds for this vulnerability. Users are advised to upgrade.",2023-05-03T18:12:55.620,https://cve.circl.lu/cve/CVE-2023-29197
CVE-2023-30076,5.9,PHP,Sourcecodester Judging Management System v1.0 is vulnerable to SQL Injection via /php-jms/print_judges.php?print_judges.php=&se_name=&sub_event_id=.,2023-05-02T01:10:15.547,https://cve.circl.lu/cve/CVE-2023-30076
CVE-2023-2209,3.6,PHP,"A vulnerability, which was classified as critical, was found in Campcodes Coffee Shop POS System 1.0. Affected is an unknown function of the file /admin/sales/view_details.php. The manipulation of the argument id leads to sql injection. It is possible to launch the attack remotely. The exploit has been disclosed to the public and may be used. VDB-226974 is the identifier assigned to this vulnerability.",2023-05-02T14:33:57.820,https://cve.circl.lu/cve/CVE-2023-2209
CVE-2023-2210,3.6,PHP,A vulnerability has been found in Campcodes Coffee Shop POS System 1.0 and classified as critical. Affected by this vulnerability is an unknown functionality of the file /admin/categories/view_category.php. The manipulation of the argument id leads to sql injection. The attack can be launched remotely. The exploit has been disclosed to the public and may be used. The associated identifier of this vulnerability is VDB-226975.,2023-05-02T13:36:03.597,https://cve.circl.lu/cve/CVE-2023-2210
CVE-2021-28363,2.5,Python,The urllib3 library 1.26.x before 1.26.4 for Python omits SSL certificate validation in some cases involving HTTPS to HTTPS proxies. The initial connection to the HTTPS proxy (if an SSLContext isn't given via proxy_config) doesn't verify the hostname of the certificate. This means certificates for different servers that still validate properly with the default urllib3 SSLContext will be silently accepted.,2023-05-03T11:15:10.133,https://cve.circl.lu/cve/CVE-2021-28363
CVE-2021-29921,5.9,Python,"In Python before 3,9,5, the ipaddress library mishandles leading zero characters in the octets of an IP address string. This (in some situations) allows attackers to bypass access control that is based on IP addresses.",2023-05-03T11:15:10.457,https://cve.circl.lu/cve/CVE-2021-29921
CVE-2022-0391,3.6,Python,"A flaw was found in Python, specifically within the urllib.parse module. This module helps break Uniform Resource Locator (URL) strings into components. The issue involves how the urlparse method does not sanitize input and allows characters like '\r' and '\n' in the URL path. This flaw allows an attacker to input a crafted URL, leading to injection attacks. This flaw affects Python versions prior to 3.10.0b1, 3.9.5, 3.8.11, 3.7.11 and 3.6.14.",2023-05-03T11:15:11.047,https://cve.circl.lu/cve/CVE-2022-0391
CVE-2021-3654,2.7,Python,"A vulnerability was found in openstack-nova's console proxy, noVNC. By crafting a malicious URL, noVNC could be made to redirect to any desired URL.",2023-05-03T11:15:10.790,https://cve.circl.lu/cve/CVE-2021-3654
CVE-2015-20107,4.7,Python,"In Python (aka CPython) up to 3.10.8, the mailcap module does not add escape characters into commands discovered in the system mailcap file. This may allow attackers to inject shell commands into applications that call mailcap.findmatch with untrusted input (if they lack validation of user-provided filenames or arguments). The fix is also back-ported to 3.7, 3.8, 3.9",2023-05-03T11:15:09.227,https://cve.circl.lu/cve/CVE-2015-20107
CVE-2023-30859,2.7,Phishing,"Triton is a Minecraft plugin for Spigot and BungeeCord that helps you translate your Minecraft server. The CustomPayload packet allows you to execute commands on the spigot/bukkit console. When you enable bungee mode in the config it will enable the bungee bridge and the server will begin to broadcast the 'triton:main' plugin channel. Using this plugin channel you are able to send a payload packet containing a byte (2) and a string (any spigot command). This could be used to make yourself a server operator and be used to extract other user information through phishing (pretending to be an admin), many servers use essentials so the /geoip command could be available to them, etc. This could also be modified to allow you to set the servers language, set another players language, etc. This issue affects those who have bungee enabled in config. This issue has been fixed in version 3.8.4.",2023-05-01T20:07:36.203,https://cve.circl.lu/cve/CVE-2023-30859
