CVE,"Impact Score (1-10, 10 being the worst)",Keyword,Description,Last Modified,Link
CVE-2013-0422,10.0,Java,"Multiple vulnerabilities in Oracle Java 7 before Update 11 allow remote attackers to execute arbitrary code by (1) using the public getMBeanInstantiator method in the JmxMBeanServer class to obtain a reference to a private MBeanInstantiator object, then retrieving arbitrary Class references using the findClass method, and (2) using the Reflection API with recursion in a way that bypasses a security check by the java.lang.invoke.MethodHandles.Lookup.checkSecurityManager method due to the inability of the sun.reflect.Reflection.getCallerClass method to skip frames related to the new reflection API, as exploited in the wild in January 2013, as demonstrated by Blackhole and Nuclear Pack, and a different vulnerability than CVE-2012-4681 and CVE-2012-3174. NOTE: some parties have mapped the recursive Reflection API issue to CVE-2012-3174, but CVE-2012-3174 is for a different vulnerability whose details are not public as of 20130114.  CVE-2013-0422 covers both the JMX/MBean and Reflection API issues.  NOTE: it was originally reported that Java 6 was also vulnerable, but the reporter has retracted this claim, stating that Java 6 is not exploitable because the relevant code is called in a way that does not bypass security checks.  NOTE: as of 20130114, a reliable third party has claimed that the findClass/MBeanInstantiator vector was not fixed in Oracle Java 7 Update 11.  If there is still a vulnerable condition, then a separate CVE identifier might be created for the unfixed issue.",2024-04-26T16:07:03.190,https://cve.circl.lu/cve/CVE-2013-0422
CVE-2013-0431,2.9,Java,"Unspecified vulnerability in the Java Runtime Environment (JRE) component in Oracle Java SE 7 through Update 11, and OpenJDK 7, allows user-assisted remote attackers to bypass the Java security sandbox via unspecified vectors related to JMX, aka ""Issue 52,"" a different vulnerability than CVE-2013-1490.",2024-04-26T16:07:43.020,https://cve.circl.lu/cve/CVE-2013-0431
CVE-2013-2423,2.9,Java,"Unspecified vulnerability in the Java Runtime Environment (JRE) component in Oracle Java SE 7 Update 17 and earlier, and OpenJDK 7, allows remote attackers to affect integrity via unknown vectors related to HotSpot.  NOTE: the previous information is from the April 2013 CPU. Oracle has not commented on claims from the original researcher that this vulnerability allows remote attackers to bypass permission checks by the MethodHandles method and modify arbitrary public final fields using reflection and type confusion, as demonstrated using integer and double fields to disable the security manager.",2024-04-26T16:07:25.617,https://cve.circl.lu/cve/CVE-2013-2423
CVE-2024-4026,2.5,JavaScript,"Cross-Site Scripting (XSS) vulnerability in the Holded application. This vulnerability could allow an attacker to store a JavaScript payload within all editable parameters within the 'General' and 'Team ID' functionalities, which could result in a session takeover.",2024-04-22T13:28:34.007,https://cve.circl.lu/cve/CVE-2024-4026
CVE-2023-47731,2.7,JavaScript,IBM QRadar Suite Software 1.10.12.0 through 1.10.19.0 and IBM Cloud Pak for Security 1.10.0.0 through 1.10.11.0 is vulnerable to stored cross-site scripting. This vulnerability allows users to embed arbitrary JavaScript code in the Web UI thus altering the intended functionality potentially leading to credentials disclosure within a trusted session.  IBM X-Force ID:  272203.,2024-04-24T13:39:42.883,https://cve.circl.lu/cve/CVE-2023-47731
CVE-2024-32869,1.4,JavaScript,"Hono is a Web application framework that provides support for any JavaScript runtime. Prior to version 4.2.7, when using serveStatic with deno, it is possible to traverse the directory where `main.ts` is located. This can result in retrieval of unexpected files. Version 4.2.7 contains a patch for the issue.",2024-04-24T13:39:42.883,https://cve.circl.lu/cve/CVE-2024-32869
CVE-2024-4174,2.5,JavaScript,Cross-Site Scripting (XSS) vulnerability in Hyperion Web Server affecting version 2.0.15. This vulnerability could allow an attacker to execute malicious Javascript code on the client by injecting that code into the URL.,2024-04-25T13:18:02.660,https://cve.circl.lu/cve/CVE-2024-4174
CVE-2023-6717,5.5,JavaScript,"A flaw was found in the SAML client registration in Keycloak that could allow an administrator to register malicious JavaScript URIs as Assertion Consumer Service POST Binding URLs (ACS), posing a Cross-Site Scripting (XSS) risk. This issue may allow a malicious admin in one realm or a client with registration access to target users in different realms or applications, executing arbitrary JavaScript in their contexts upon form submission. This can enable unauthorized access and harmful actions, compromising the confidentiality, integrity, and availability of the complete KC instance.",2024-04-25T17:24:59.967,https://cve.circl.lu/cve/CVE-2023-6717
CVE-2024-21011,1.4,JDK,"Vulnerability in the Oracle Java SE, Oracle GraalVM for JDK, Oracle GraalVM Enterprise Edition product of Oracle Java SE (component: Hotspot).  Supported versions that are affected are Oracle Java SE: 8u401, 8u401-perf, 11.0.22, 17.0.10, 21.0.2, 22; Oracle GraalVM for JDK: 17.0.10, 21.0.2, 22;   Oracle GraalVM Enterprise Edition: 20.3.13 and  21.3.9. Difficult to exploit vulnerability allows unauthenticated attacker with network access via multiple protocols to compromise Oracle Java SE, Oracle GraalVM for JDK, Oracle GraalVM Enterprise Edition.  Successful attacks of this vulnerability can result in unauthorized ability to cause a partial denial of service (partial DOS) of Oracle Java SE, Oracle GraalVM for JDK, Oracle GraalVM Enterprise Edition. Note: This vulnerability can be exploited by using APIs in the specified Component, e.g., through a web service which supplies data to the APIs. This vulnerability also applies to Java deployments, typically in clients running sandboxed Java Web Start applications or sandboxed Java applets, that load and run untrusted code (e.g., code that comes from the internet) and rely on the Java sandbox for security. CVSS 3.1 Base Score 3.7 (Availability impacts).  CVSS Vector: (CVSS:3.1/AV:N/AC:H/PR:N/UI:N/S:U/C:N/I:N/A:L).",2024-04-26T09:15:10.240,https://cve.circl.lu/cve/CVE-2024-21011
CVE-2024-21012,1.4,JDK,"Vulnerability in the Oracle Java SE, Oracle GraalVM for JDK, Oracle GraalVM Enterprise Edition product of Oracle Java SE (component: Networking).  Supported versions that are affected are Oracle Java SE: 11.0.22, 17.0.10, 21.0.2, 22; Oracle GraalVM for JDK: 17.0.10, 21.0.2, 22; Oracle GraalVM Enterprise Edition: 20.3.13 and  21.3.9. Difficult to exploit vulnerability allows unauthenticated attacker with network access via multiple protocols to compromise Oracle Java SE, Oracle GraalVM for JDK, Oracle GraalVM Enterprise Edition.  Successful attacks of this vulnerability can result in  unauthorized update, insert or delete access to some of Oracle Java SE, Oracle GraalVM for JDK, Oracle GraalVM Enterprise Edition accessible data. Note: This vulnerability applies to Java deployments, typically in clients running sandboxed Java Web Start applications or sandboxed Java applets, that load and run untrusted code (e.g., code that comes from the internet) and rely on the Java sandbox for security. This vulnerability does not apply to Java deployments, typically in servers, that load and run only trusted code (e.g., code installed by an administrator). CVSS 3.1 Base Score 3.7 (Integrity impacts).  CVSS Vector: (CVSS:3.1/AV:N/AC:H/PR:N/UI:N/S:U/C:N/I:L/A:N).",2024-04-26T09:15:10.307,https://cve.circl.lu/cve/CVE-2024-21012
CVE-2024-21068,1.4,JDK,"Vulnerability in the Oracle Java SE, Oracle GraalVM for JDK, Oracle GraalVM Enterprise Edition product of Oracle Java SE (component: Hotspot).  Supported versions that are affected are Oracle Java SE: 8u401-perf, 11.0.22, 17.0.10, 21.0.2, 22; Oracle GraalVM for JDK: 17.0.10, 21.0.2 and  22; Oracle GraalVM Enterprise Edition: 21.3.9. Difficult to exploit vulnerability allows unauthenticated attacker with network access via multiple protocols to compromise Oracle Java SE, Oracle GraalVM for JDK, Oracle GraalVM Enterprise Edition.  Successful attacks of this vulnerability can result in  unauthorized update, insert or delete access to some of Oracle Java SE, Oracle GraalVM for JDK, Oracle GraalVM Enterprise Edition accessible data. Note: This vulnerability can be exploited by using APIs in the specified Component, e.g., through a web service which supplies data to the APIs. This vulnerability also applies to Java deployments, typically in clients running sandboxed Java Web Start applications or sandboxed Java applets, that load and run untrusted code (e.g., code that comes from the internet) and rely on the Java sandbox for security. CVSS 3.1 Base Score 3.7 (Integrity impacts).  CVSS Vector: (CVSS:3.1/AV:N/AC:H/PR:N/UI:N/S:U/C:N/I:L/A:N).",2024-04-26T09:15:11.273,https://cve.circl.lu/cve/CVE-2024-21068
CVE-2024-21094,1.4,JDK,"Vulnerability in the Oracle Java SE, Oracle GraalVM for JDK, Oracle GraalVM Enterprise Edition product of Oracle Java SE (component: Hotspot).  Supported versions that are affected are Oracle Java SE: 8u401, 8u401-perf, 11.0.22, 17.0.10, 21.0.2, 22; Oracle GraalVM for JDK: 17.0.10, 21.0.2, 22; Oracle GraalVM Enterprise Edition: 20.3.13 and  21.3.9. Difficult to exploit vulnerability allows unauthenticated attacker with network access via multiple protocols to compromise Oracle Java SE, Oracle GraalVM for JDK, Oracle GraalVM Enterprise Edition.  Successful attacks of this vulnerability can result in  unauthorized update, insert or delete access to some of Oracle Java SE, Oracle GraalVM for JDK, Oracle GraalVM Enterprise Edition accessible data. Note: This vulnerability can be exploited by using APIs in the specified Component, e.g., through a web service which supplies data to the APIs. This vulnerability also applies to Java deployments, typically in clients running sandboxed Java Web Start applications or sandboxed Java applets, that load and run untrusted code (e.g., code that comes from the internet) and rely on the Java sandbox for security. CVSS 3.1 Base Score 3.7 (Integrity impacts).  CVSS Vector: (CVSS:3.1/AV:N/AC:H/PR:N/UI:N/S:U/C:N/I:L/A:N).",2024-04-26T09:15:11.613,https://cve.circl.lu/cve/CVE-2024-21094
CVE-2024-3177,1.4,Kubernetes,"A security issue was discovered in Kubernetes where users may be able to launch containers that bypass the mountable secrets policy enforced by the ServiceAccount admission plugin when using containers, init containers, and ephemeral containers with the envFrom field populated. The policy ensures pods running with a service account may only reference secrets specified in the service account’s secrets field. Kubernetes clusters are only affected if the ServiceAccount admission plugin and the kubernetes.io/enforce-mountable-secrets annotation are used together with containers, init containers, and ephemeral containers with the envFrom field populated.",2024-04-25T06:16:00.237,https://cve.circl.lu/cve/CVE-2024-3177
CVE-2023-38297,NA,Lenovo,"An issue was discovered in a third-party com.factory.mmigroup component, shipped on devices from multiple device manufacturers. Certain software builds for various Android devices contain a vulnerable pre-installed app with a package name of com.factory.mmigroup (versionCode='3', versionName='2.1) that allows local third-party apps to perform various actions, due to inadequate access control, in its context (system user), but the functionalities exposed depend on the specific device. The following capabilities are exposed to zero-permission, third-party apps on the following devices: arbitrary AT command execution via AT command injection (T-Mobile Revvl 6 Pro 5G, T-Mobile Revvl V+ 5G, and Boost Mobile Celero 5G); programmatic factory reset (Samsung Galaxy A03S, T-Mobile Revvl 6 Pro 5G, T-Mobile Revvl V+ 5G, Boost Mobile Celero, Realme C25Y, and Lenovo Tab M8 HD), leaking IMEI (Samsung Galaxy A03S, T-Mobile Revvl 6 Pro 5G, T-Mobile Revvl V+ 5G, Boost Mobile Celero, and Realme C25Y); leaking serial number (Samsung Galaxy A03s, T-Mobile Revvl 6 Pro 5G, T-Mobile Revvl V+ 5G, Boost Mobile Celero, Realme C25Y, and Lenovo Tab M8 HD); powering off the device (Realme C25Y, Samsung Galaxy A03S, and T-Mobile Revvl 6 Pro 5G); and programmatically enabling/disabling airplane mode (Samsung Galaxy A03S, T-Mobile Revvl 6 Pro 5G, T-Mobile Revvl V+ 5G, Boost Mobile Celero, and Realme C25Y); and enabling Wi-Fi, Bluetooth, and GPS (Samsung Galaxy A03S, T-Mobile Revvl 6 Pro 5G, T-Mobile Revvl V+ 5G, Boost Mobile Celero, and Realme C25Y). No permissions or special privileges are necessary to exploit the vulnerabilities in the com.factory.mmigroup app. No user interaction is required beyond installing and running a third-party app. The software build fingerprints for each confirmed vulnerable device are as follows: Boost Mobile Celero 5G (Celero5G/Jupiter/Jupiter:11/RP1A.200720.011/SW_S98119AA1_V067:user/release-keys, Celero5G/Jupiter/Jupiter:11/RP1A.200720.011/SW_S98119AA1_V064:user/release-keys, Celero5G/Jupiter/Jupiter:11/RP1A.200720.011/SW_S98119AA1_V061:user/release-keys, and Celero5G/Jupiter/Jupiter:11/RP1A.200720.011/SW_S98119AA1_V052:user/release-keys); Samsung Galaxy A03S (samsung/a03sutfn/a03su:13/TP1A.220624.014/S134DLUDU6CWB6:user/release-keys and samsung/a03sutfn/a03su:12/SP1A.210812.016/S134DLUDS5BWA1:user/release-keys); Lenovo Tab M8 HD (Lenovo/LenovoTB-8505F/8505F:10/QP1A.190711.020/S300637_220706_BMP:user/release-keys and Lenovo/LenovoTB-8505F/8505F:10/QP1A.190711.020/S300448_220114_BMP:user/release-keys); T-Mobile Revvl 6 Pro 5G (T-Mobile/Augusta/Augusta:12/SP1A.210812.016/SW_S98121AA1_V070:user/release-keys and T-Mobile/Augusta/Augusta:12/SP1A.210812.016/SW_S98121AA1_V066:user/release-keys); T-Mobile Revvl V+ 5G (T-Mobile/Sprout/Sprout:11/RP1A.200720.011/SW_S98115AA1_V077:user/release-keys and T-Mobile/Sprout/Sprout:11/RP1A.200720.011/SW_S98115AA1_V060:user/release-keys); and Realme C25Y (realme/RMX3269/RED8F6:11/RP1A.201005.001/1675861640000:user/release-keys, realme/RMX3269/RED8F6:11/RP1A.201005.001/1664031768000:user/release-keys, realme/RMX3269/RED8F6:11/RP1A.201005.001/1652814687000:user/release-keys, and realme/RMX3269/RED8F6:11/RP1A.201005.001/1635785712000:user/release-keys). This malicious app sends a broadcast Intent to com.factory.mmigroup/.MMIGroupReceiver. This causes the com.factory.mmigroup app to dynamically register for various action strings. The malicious app can then send these strings, allowing it to perform various behaviors that the com.factory.mmigroup app exposes. The actual behaviors exposed by the com.factory.mmigroup app depend on device model and chipset. The com.factory.mmigroup app executes as the ""system"" user, allowing it to interact with the baseband processor and perform various other sensitive actions.",2024-04-22T19:24:06.727,https://cve.circl.lu/cve/CVE-2023-38297
CVE-2013-6381,10.0,Linux,Buffer overflow in the qeth_snmp_command function in drivers/s390/net/qeth_core_main.c in the Linux kernel through 3.12.1 allows local users to cause a denial of service or possibly have unspecified other impact via an SNMP ioctl call with a length value that is incompatible with the command-buffer size.,2024-04-26T16:10:07.460,https://cve.circl.lu/cve/CVE-2013-6381
CVE-2017-18017,5.9,Linux,"The tcpmss_mangle_packet function in net/netfilter/xt_TCPMSS.c in the Linux kernel before 4.11, and 4.9.x before 4.9.36, allows remote attackers to cause a denial of service (use-after-free and memory corruption) or possibly have unspecified other impact by leveraging the presence of xt_TCPMSS in an iptables action.",2024-04-24T13:40:09.260,https://cve.circl.lu/cve/CVE-2017-18017
CVE-2019-3900,4.0,Linux,"An infinite loop issue was found in the vhost_net kernel module in Linux Kernel up to and including v5.1-rc6, while handling incoming packets in handle_rx(). It could occur if one end sends packets faster than the other end can process them. A guest user, maybe remote one, could use this flaw to stall the vhost_net kernel thread, resulting in a DoS scenario.",2024-04-26T16:08:45.680,https://cve.circl.lu/cve/CVE-2019-3900
CVE-2021-38201,3.6,Linux,net/sunrpc/xdr.c in the Linux kernel before 5.13.4 allows remote attackers to cause a denial of service (xdr_set_page_base slab-out-of-bounds access) by performing many NFS 4.2 READ_PLUS operations.,2024-04-23T18:57:47.143,https://cve.circl.lu/cve/CVE-2021-38201
CVE-2023-3812,5.9,Linux,An out-of-bounds memory access flaw was found in the Linux kernel’s TUN/TAP device driver functionality in how a user generates a malicious (too big) networking packet when napi frags is enabled. This flaw allows a local user to crash or potentially escalate their privileges on the system.,2024-04-25T13:15:51.013,https://cve.circl.lu/cve/CVE-2023-3812
CVE-2024-32878,5.5,Llama,"Llama.cpp is LLM inference in C/C++. There is a use of uninitialized heap variable vulnerability in gguf_init_from_file, the code will free this uninitialized variable later. In a simple POC, it will directly cause a crash. If the file is carefully constructed, it may be possible to control this uninitialized value and cause arbitrary address free problems. This may further lead to be exploited. Causes llama.cpp to crash (DoS) and may even lead to arbitrary code execution (RCE). This vulnerability has been patched in commit b2740.",2024-04-26T21:15:49.260,https://cve.circl.lu/cve/CVE-2024-32878
CVE-2024-28240,5.9,MSI,"The GLPI Agent is a generic management agent. A vulnerability that only affects GLPI-Agent installed on windows via MSI packaging can allow a local user to cause denial of agent service by replacing GLPI server url with a wrong url or disabling the service. Additionally, in the case the Deploy task is installed, a local malicious user can trigger privilege escalation configuring a malicious server providing its own deploy task payload. GLPI-Agent 1.7.2 contains a patch for this issue. As a workaround, edit GLPI-Agent related key under `HKEY_LOCAL_MACHINE\SOFTWARE\Microsoft\Windows\CurrentVersion\Uninstall` and add `SystemComponent` DWORD value setting it to `1` to hide GLPI-Agent from installed applications.",2024-04-25T17:24:59.967,https://cve.circl.lu/cve/CVE-2024-28240
CVE-2022-30007,5.9,Management,"GXCMS V1.5 has a file upload vulnerability in the background. The vulnerability is the template management page. You can edit any template content and then rename to PHP suffix file, after calling PHP file can control the server.",2024-04-23T20:15:07.160,https://cve.circl.lu/cve/CVE-2022-30007
CVE-2024-24558,2.7,Management,"TanStack Query supplies asynchronous state management, server-state utilities and data fetching for the web.  The `@tanstack/react-query-next-experimental` NPM package is vulnerable to a cross-site scripting vulnerability. To exploit this, an attacker would need to either inject malicious input or arrange to have malicious input be returned from an endpoint. To fix this issue, please update to version 5.18.0 or later.",2024-04-23T19:52:49.107,https://cve.circl.lu/cve/CVE-2024-24558
CVE-2024-28323,NA,Management,"The bwdates-report-result.php file in Phpgurukul User Registration & Login and User Management System 3.1 contains a potential security vulnerability related to user input validation. The script retrieves user-provided date inputs without proper validation, making it susceptible to SQL injection attacks.",2024-04-24T02:15:45.820,https://cve.circl.lu/cve/CVE-2024-28323
CVE-2024-27930,3.6,Management,"GLPI is a Free Asset and IT Management Software package, Data center management, ITIL Service Desk, licenses tracking and software auditing. An authenticated user can access sensitive fields data from items on which he has read access. This issue has been patched in version 10.0.13.",2024-04-24T15:15:46.380,https://cve.circl.lu/cve/CVE-2024-27930
CVE-2024-27937,3.6,Management,"GLPI is a Free Asset and IT Management Software package, Data center management, ITIL Service Desk, licenses tracking and software auditing. An authenticated user can obtain the email address of all GLPI users. This issue has been patched in version 10.0.13.",2024-04-24T15:15:46.487,https://cve.circl.lu/cve/CVE-2024-27937
CVE-2024-22091,1.4,Mattermost,"Mattermost versions 8.1.x <= 8.1.10, 9.6.x <= 9.6.0, 9.5.x <= 9.5.2 and 8.1.x <= 8.1.11 fail to limit the size of a request path that includes user inputs which allows an attacker to cause excessive resource consumption, possibly leading to a DoS via sending large request paths",2024-04-26T12:58:17.720,https://cve.circl.lu/cve/CVE-2024-22091
CVE-2024-32046,1.4,Mattermost,"Mattermost versions 9.6.x <= 9.6.0, 9.5.x <= 9.5.2, 9.4.x <= 9.4.4 and 8.1.x <= 8.1.11 fail to remove detailed error messages in API requests even if the developer mode is off which allows an attacker to get information about the server such as the full path were files are stored",2024-04-26T12:58:17.720,https://cve.circl.lu/cve/CVE-2024-32046
CVE-2024-4182,1.4,Mattermost,"Mattermost versions 9.6.0, 9.5.x before 9.5.3, 9.4.x before 9.4.5, and 8.1.x before 8.1.12 fail to handle JSON parsing errors in custom status values, which allows an authenticated attacker to crash other users' web clients via a malformed custom status.",2024-04-26T12:58:17.720,https://cve.circl.lu/cve/CVE-2024-4182
CVE-2024-4183,1.4,Mattermost,"Mattermost versions 8.1.x before 8.1.12, 9.6.x before 9.6.1, 9.5.x before 9.5.3, 9.4.x before 9.4.5 fail to limit the number of active sessions, which allows an authenticated attacker to crash the server via repeated requests to the getSessions API after flooding the sessions table.",2024-04-26T12:58:17.720,https://cve.circl.lu/cve/CVE-2024-4183
CVE-2024-4195,1.4,Mattermost,"Mattermost versions 9.6.0, 9.5.x before 9.5.3, and 8.1.x before 8.1.12 fail to fully validate role changes, which allows an attacker authenticated as a team admin to promote guests to team admins via crafted HTTP requests.",2024-04-26T12:58:17.720,https://cve.circl.lu/cve/CVE-2024-4195
CVE-2023-38817,5.9,Microsoft,"An issue in Inspect Element Ltd Echo.ac v.5.2.1.0 allows a local attacker to gain privileges via a crafted command to the echo_driver.sys component. NOTE: the vendor's position is that the reported ability for user-mode applications to execute code as NT AUTHORITY\SYSTEM was ""deactivated by Microsoft itself.""",2024-04-24T19:15:46.587,https://cve.circl.lu/cve/CVE-2023-38817
CVE-2024-29053,5.9,Microsoft,Microsoft Defender for IoT Remote Code Execution Vulnerability,2024-04-26T15:58:55.843,https://cve.circl.lu/cve/CVE-2024-29053
CVE-2024-29054,5.9,Microsoft,Microsoft Defender for IoT Elevation of Privilege Vulnerability,2024-04-26T15:59:00.880,https://cve.circl.lu/cve/CVE-2024-29054
CVE-2024-29055,5.9,Microsoft,Microsoft Defender for IoT Elevation of Privilege Vulnerability,2024-04-26T15:58:48.473,https://cve.circl.lu/cve/CVE-2024-29055
CVE-2024-3371,5.5,MongoDB,"MongoDB Compass may accept and use insufficiently validated input from an untrusted external source. This may cause unintended application behavior, including data disclosure and enabling attackers to impersonate users. This issue affects MongoDB Compass versions 1.35.0 to 1.42.0.",2024-04-26T15:15:49.357,https://cve.circl.lu/cve/CVE-2024-3371
CVE-2024-20993,3.6,MySQL,Vulnerability in the MySQL Server product of Oracle MySQL (component: Server: Optimizer).  Supported versions that are affected are 8.0.35 and prior and  8.2.0 and prior. Easily exploitable vulnerability allows high privileged attacker with network access via multiple protocols to compromise MySQL Server.  Successful attacks of this vulnerability can result in unauthorized ability to cause a hang or frequently repeatable crash (complete DOS) of MySQL Server. CVSS 3.1 Base Score 4.9 (Availability impacts).  CVSS Vector: (CVSS:3.1/AV:N/AC:L/PR:H/UI:N/S:U/C:N/I:N/A:H).,2024-04-26T09:15:09.417,https://cve.circl.lu/cve/CVE-2024-20993
CVE-2024-20994,3.6,MySQL,Vulnerability in the MySQL Server product of Oracle MySQL (component: Server: Information Schema).  Supported versions that are affected are 8.0.36 and prior and  8.3.0 and prior. Difficult to exploit vulnerability allows low privileged attacker with network access via multiple protocols to compromise MySQL Server.  Successful attacks of this vulnerability can result in unauthorized ability to cause a hang or frequently repeatable crash (complete DOS) of MySQL Server. CVSS 3.1 Base Score 5.3 (Availability impacts).  CVSS Vector: (CVSS:3.1/AV:N/AC:H/PR:L/UI:N/S:U/C:N/I:N/A:H).,2024-04-26T09:15:09.500,https://cve.circl.lu/cve/CVE-2024-20994
CVE-2024-20998,3.6,MySQL,Vulnerability in the MySQL Server product of Oracle MySQL (component: Server: Optimizer).  Supported versions that are affected are 8.0.36 and prior and  8.3.0 and prior. Easily exploitable vulnerability allows high privileged attacker with network access via multiple protocols to compromise MySQL Server.  Successful attacks of this vulnerability can result in unauthorized ability to cause a hang or frequently repeatable crash (complete DOS) of MySQL Server. CVSS 3.1 Base Score 4.9 (Availability impacts).  CVSS Vector: (CVSS:3.1/AV:N/AC:L/PR:H/UI:N/S:U/C:N/I:N/A:H).,2024-04-26T09:15:09.567,https://cve.circl.lu/cve/CVE-2024-20998
