CVE,Impact Score,Description,Last Modified
CVE-2020-13948,5.9,"While investigating a bug report on Apache Superset, it was determined that an authenticated user could craft requests via a number of templated text fields in the product that would allow arbitrary access to Pythonâ€™s `os` package in the web application process in versions < 0.37.1. It was thus possible for an authenticated user to list and access files, environment variables, and process information. Additionally it was possible to set environment variables for the current process, create and update files in folders writable by the web process, and execute arbitrary programs accessible by the web process. All other operations available to the `os` package in Python were also available, even if not explicitly enumerated in this CVE.",2022-11-21T13:55:26.917
CVE-2021-34552,5.9,Pillow through 8.2.0 and PIL (aka Python Imaging Library) through 1.1.7 allow an attacker to pass controlled parameters directly into a convert function to trigger a buffer overflow in Convert.c.,2022-11-22T06:15:28.330
CVE-2021-23437,3.6,The package pillow 5.2.0 and before 8.3.2 are vulnerable to Regular Expression Denial of Service (ReDoS) via the getrgb function.,2022-11-22T06:15:25.450
CVE-2022-22815,2.5,path_getbbox in path.c in Pillow before 9.0.0 improperly initializes ImagePath.Path.,2022-11-22T06:15:32.463
CVE-2022-22816,2.5,path_getbbox in path.c in Pillow before 9.0.0 has a buffer over-read during initialization of ImagePath.Path.,2022-11-22T06:15:34.040
CVE-2022-30945,6.0,Jenkins Pipeline: Groovy Plugin 2689.v434009a_31b_f1 and earlier allows loading any Groovy source files on the classpath of Jenkins and Jenkins plugins in sandboxed pipelines.,2022-11-16T18:31:32.747
CVE-2022-38666,3.6,Jenkins NS-ND Integration Performance Publisher Plugin 4.8.0.146 and earlier unconditionally disables SSL/TLS certificate and hostname validation for several features.,2022-11-18T21:28:44.973
CVE-2022-45379,3.6,"Jenkins Script Security Plugin 1189.vb_a_b_7c8fd5fde and earlier stores whole-script approvals as the SHA-1 hash of the script, making it vulnerable to collision attacks.",2022-11-18T20:26:54.673
CVE-2022-45380,2.7,"Jenkins JUnit Plugin 1159.v0b_396e1e07dd and earlier converts HTTP(S) URLs in test report output to clickable links in an unsafe manner, resulting in a stored cross-site scripting (XSS) vulnerability exploitable by attackers with Item/Configure permission.",2022-11-18T20:21:06.733
CVE-2022-45381,5.2,"Jenkins Pipeline Utility Steps Plugin 2.13.1 and earlier does not restrict the set of enabled prefix interpolators and bundles versions of Apache Commons Configuration library that enable the 'file:' prefix interpolator by default, allowing attackers able to configure Pipelines to read arbitrary files from the Jenkins controller file system.",2022-11-18T19:54:50.040
CVE-2022-41883,4.7,"TensorFlow is an open source platform for machine learning. When ops that have specified input sizes receive a differing number of inputs, the executor will crash. We have patched the issue in GitHub commit f5381e0e10b5a61344109c1b7c174c68110f7629. The fix will be included in TensorFlow 2.11. We will also cherrypick this commit on TensorFlow 2.10.1, 2.9.3, and TensorFlow 2.8.4, as these are also affected and still in supported range.",2022-11-18T23:15:26.460
CVE-2022-41880,5.2,"TensorFlow is an open source platform for machine learning. When the `BaseCandidateSamplerOp` function receives a value in `true_classes` larger than `range_max`, a heap oob read occurs. We have patched the issue in GitHub commit b389f5c944cadfdfe599b3f1e4026e036f30d2d4. The fix will be included in TensorFlow 2.11. We will also cherrypick this commit on TensorFlow 2.10.1, 2.9.3, and TensorFlow 2.8.4, as these are also affected and still in supported range.",2022-11-22T21:52:03.947
CVE-2022-41884,3.6,"TensorFlow is an open source platform for machine learning. If a numpy array is created with a shape such that one element is zero and the others sum to a large number, an error will be raised. We have patched the issue in GitHub commit 2b56169c16e375c521a3bc8ea658811cc0793784. The fix will be included in TensorFlow 2.11. We will also cherrypick this commit on TensorFlow 2.10.1, 2.9.3, and TensorFlow 2.8.4, as these are also affected and still in supported range.",2022-11-22T21:53:09.703
CVE-2022-41885,3.6,"TensorFlow is an open source platform for machine learning. When `tf.raw_ops.FusedResizeAndPadConv2D` is given a large tensor shape, it overflows. We have patched the issue in GitHub commit d66e1d568275e6a2947de97dca7a102a211e01ce. The fix will be included in TensorFlow 2.11. We will also cherrypick this commit on TensorFlow 2.10.1, 2.9.3, and TensorFlow 2.8.4, as these are also affected and still in supported range.",2022-11-20T02:44:25.263
CVE-2022-41886,3.6,"TensorFlow is an open source platform for machine learning. When `tf.raw_ops.ImageProjectiveTransformV2` is given a large output shape, it overflows. We have patched the issue in GitHub commit 8faa6ea692985dbe6ce10e1a3168e0bd60a723ba. The fix will be included in TensorFlow 2.11. We will also cherrypick this commit on TensorFlow 2.10.1, 2.9.3, and TensorFlow 2.8.4, as these are also affected and still in supported range.",2022-11-22T21:54:58.020
CVE-2022-37197,N/A,IOBit IOTransfer V4 is vulnerable to Unquoted Service Path.,2022-11-18T21:44:52.793
CVE-2021-24444,2.7,"The TaxoPress â€“ Create and Manage Taxonomies, Tags, Categories WordPress plugin before 3.0.7.2 does not sanitise its Taxonomy description field, allowing high privilege users to set JavaScript payload in them even when the unfiltered_html capability is disallowed, leading to an authenticated Stored Cross-Site Scripting issue.",2022-11-16T16:40:03.787
CVE-2022-24882,3.6,"FreeRDP is a free implementation of the Remote Desktop Protocol (RDP). In versions prior to 2.7.0, NT LAN Manager (NTLM) authentication does not properly abort when someone provides and empty password value. This issue affects FreeRDP based RDP Server implementations. RDP clients are not affected. The vulnerability is patched in FreeRDP 2.7.0. There are currently no known workarounds.",2022-11-16T19:54:13.070
CVE-2022-24883,5.9,"FreeRDP is a free implementation of the Remote Desktop Protocol (RDP). Prior to version 2.7.0, server side authentication against a `SAM` file might be successful for invalid credentials if the server has configured an invalid `SAM` file path. FreeRDP based clients are not affected. RDP server implementations using FreeRDP to authenticate against a `SAM` file are affected. Version 2.7.0 contains a fix for this issue. As a workaround, use custom authentication via `HashCallback` and/or ensure the `SAM` database path configured is valid and the application has file handles left.",2022-11-16T19:56:24.430
CVE-2022-1203,1.4,"The Content Mask WordPress plugin before 1.8.4.1 does not have authorisation and CSRF checks in various AJAX actions, as well as does not validate the option to be updated to ensure it belongs to the plugin. As a result, any authenticated user, such as subscriber could modify arbitrary blog options",2022-11-16T17:23:21.230
CVE-2022-1566,2.7,"The Quotes llama WordPress plugin before 1.0.0 does not sanitise and escape Quotes, which could allow high privilege users such as admin to perform Cross-Site Scripting attacks even when unfiltered_html is disallowed. The attack could also be performed by tricking an admin to import a malicious CSV file",2022-11-16T16:52:54.440
CVE-2022-30321,4.7,"go-getter up to 1.5.11 and 2.0.2 allowed arbitrary host access via go-getter path traversal, symlink processing, and command injection flaws. Fixed in 1.6.1 and 2.1.0.",2022-11-21T16:33:34.177
CVE-2022-30322,4.7,go-getter up to 1.5.11 and 2.0.2 allowed asymmetric resource exhaustion when go-getter processed malicious HTTP responses. Fixed in 1.6.1 and 2.1.0.,2022-11-21T16:38:35.633
CVE-2022-30323,4.7,go-getter up to 1.5.11 and 2.0.2 panicked when processing password-protected ZIP files. Fixed in 1.6.1 and 2.1.0.,2022-11-21T16:42:56.387
CVE-2022-3920,3.6,HashiCorp Consul and Consul Enterprise 1.13.0 up to 1.13.3 do not filter cluster filtering's imported nodes and services for HTTP or RPC endpoints used by the UI. Fixed in 1.14.0.,2022-11-18T20:21:33.360
CVE-2022-42123,3.6,"A Zip slip vulnerability in the Elasticsearch Connector in Liferay Portal 7.3.3 through 7.4.3.18, and Liferay DXP 7.3 before update 6, and 7.4 before update 19 allows attackers to create or overwrite existing files on the filesystem via the installation of a malicious Elasticsearch Sidecar plugin.",2022-11-18T15:50:40.687
CVE-2022-41918,5.9,"OpenSearch is a community-driven, open source fork of Elasticsearch and Kibana. There is an issue with the implementation of fine-grained access control rules (document-level security, field-level security and field masking) where they are not correctly applied to the indices that back data streams potentially leading to incorrect access authorization. OpenSearch 1.3.7 and 2.4.0 contain a fix for this issue. Users are advised to update. There are no known workarounds for this issue.",2022-11-18T20:14:11.777
CVE-2022-41917,1.4,"OpenSearch is a community-driven, open source fork of Elasticsearch and Kibana. OpenSearch allows users to specify a local file when defining text analyzers to process data for text analysis. An issue in the implementation of this feature allows certain specially crafted queries to return a response containing the first line of text from arbitrary files. The list of potentially impacted files is limited to text files with read permissions allowed in the Java Security Manager policy configuration. OpenSearch version 1.3.7 and 2.4.0 contain a fix for this issue. Users are advised to upgrade. There are no known workarounds for this issue.",2022-11-18T20:36:31.683
CVE-2021-37936,2.7,"It was discovered that Kibana was not sanitizing document fields containing HTML snippets. Using this vulnerability, an attacker with the ability to write documents to an elasticsearch index could inject HTML. When the Discover app highlighted a search term containing the HTML, it would be rendered for the user.",2022-11-22T20:28:23.230
CVE-2011-4329,2.9,"Multiple cross-site scripting (XSS) vulnerabilities in Dolibarr 3.1.0 allow remote attackers to inject arbitrary web script or HTML via (1) the username parameter in a setup action to admin/company.php, or the PATH_INFO to (2) admin/security_other.php, (3) admin/events.php, or (4) admin/user.php.",2022-11-17T17:21:59.260
CVE-2011-4802,6.4,"Multiple SQL injection vulnerabilities in Dolibarr 3.1.0 RC and probably earlier allow remote authenticated users to execute arbitrary SQL commands via the (1) sortfield, (2) sortorder, and (3) sall parameters to user/index.php and (b) user/group/index.php; the id parameter to (4) info.php, (5) perms.php, (6) param_ihm.php, (7) note.php, and (8) fiche.php in user/; and (9) rowid parameter to admin/boxes.php.",2022-11-17T17:21:59.260
CVE-2011-4814,2.9,"Multiple cross-site scripting (XSS) vulnerabilities in Dolibarr 3.1.0 RC and probably earlier allow remote attackers to inject arbitrary web script or HTML via the PATH_INFO to (1) index.php, (2) admin/boxes.php, (3) comm/clients.php, (4) commande/index.php; and the optioncss parameter to (5) admin/ihm.php and (6) user/home.php.",2022-11-17T17:21:59.260
CVE-2012-1225,6.4,Multiple SQL injection vulnerabilities in Dolibarr CMS 3.2.0 Alpha and earlier allow remote authenticated users to execute arbitrary SQL commands via the (1) memberslist parameter (aka Member List) in list.php or (2) rowid parameter to adherents/fiche.php.,2022-11-17T17:21:59.260
CVE-2012-1226,6.4,Multiple directory traversal vulnerabilities in Dolibarr CMS 3.2.0 Alpha allow remote attackers to read arbitrary files and possibly execute arbitrary code via a .. (dot dot) in the (1) file parameter to document.php or (2) backtopage parameter in a create action to comm/action/fiche.php.,2022-11-17T17:21:59.260
CVE-2020-24609,2.7,"TechKshetra Info Solutions Pvt. Ltd Savsoft Quiz 5.5 and earlier has XSS which can result in an attacker injecting the XSS payload in the User Registration section and each time the admin visits the manage user section from the admin panel, the XSS triggers and the attacker can steal the cookie via crafted payload.",2022-11-21T13:52:06.723
CVE-2022-0414,1.4,Business Logic Errors in Packagist dolibarr/dolibarr prior to 16.0.,2022-11-17T17:44:03.530
CVE-2022-23608,5.9,"PJSIP is a free and open source multimedia communication library written in C language implementing standard based protocols such as SIP, SDP, RTP, STUN, TURN, and ICE. In versions up to and including 2.11.1 when in a dialog set (or forking) scenario, a hash key shared by multiple UAC dialogs can potentially be prematurely freed when one of the dialogs is destroyed . The issue may cause a dialog set to be registered in the hash table multiple times (with different hash keys) leading to undefined behavior such as dialog list collision which eventually leading to endless loop. A patch is available in commit db3235953baa56d2fb0e276ca510fefca751643f which will be included in the next release. There are no known workarounds for this issue.",2022-11-18T16:15:16.047
CVE-2022-41343,3.6,"registerFont in FontMetrics.php in Dompdf before 2.0.1 allows remote file inclusion because a URI validation failure does not halt font registration, as demonstrated by a @font-face rule.",2022-11-21T19:28:10.920
CVE-2022-40797,5.9,"Roxy Fileman 1.4.6 allows Remote Code Execution via a .phar upload, because the default FORBIDDEN_UPLOADS value in conf.json only blocks .php, .php4, and .php5 files. (Visiting any .phar file invokes the PHP interpreter in some realistic web-server configurations.)",2022-11-21T18:15:14.900
CVE-2020-0971,5.9,"A remote code execution vulnerability exists in Microsoft SharePoint when the software fails to check the source markup of an application package, aka 'Microsoft SharePoint Remote Code Execution Vulnerability'. This CVE ID is unique from CVE-2020-0920, CVE-2020-0929, CVE-2020-0931, CVE-2020-0932, CVE-2020-0974.",2022-11-21T20:32:43.127
CVE-2022-38167,2.7,The Nintex Workflow plugin 5.2.2.30 for SharePoint allows XSS.,2022-11-17T20:25:27.510
CVE-2020-1349,5.9,"A remote code execution vulnerability exists in Microsoft Outlook software when it fails to properly handle objects in memory, aka 'Microsoft Outlook Remote Code Execution Vulnerability'.",2022-11-21T18:15:11.813
CVE-2020-1493,3.6,"An information disclosure vulnerability exists when attaching files to Outlook messages, aka 'Microsoft Outlook Information Disclosure Vulnerability'.",2022-11-21T18:15:12.707
CVE-2020-16947,5.9,"A remote code execution vulnerability exists in Microsoft Outlook software when the software fails to properly handle objects in memory, aka 'Microsoft Outlook Remote Code Execution Vulnerability'.",2022-11-21T18:15:10.390
CVE-2017-7888,5.9,"Dolibarr ERP/CRM 4.0.4 stores passwords with the MD5 algorithm, which makes brute-force attacks easier.",2022-11-17T17:21:59.260
CVE-2017-8879,5.9,"Dolibarr ERP/CRM 4.0.4 allows password changes without supplying the current password, which makes it easier for physically proximate attackers to obtain access via an unattended workstation.",2022-11-17T17:21:59.260
CVE-2019-1010054,5.9,"Dolibarr 7.0.0 is affected by: Cross Site Request Forgery (CSRF). The impact is: allow malitious html to change user password, disable users and disable password encryptation. The component is: Function User password change, user disable and password encryptation. The attack vector is: admin access malitious urls.",2022-11-17T17:21:59.260
CVE-2020-7996,2.7,htdocs/user/passwordforgotten.php in Dolibarr 10.0.6 allows XSS via the Referer HTTP header.,2022-11-17T17:21:59.260
CVE-2020-10804,5.9,"In phpMyAdmin 4.x before 4.9.5 and 5.x before 5.0.2, a SQL injection vulnerability was found in retrieval of the current username (in libraries/classes/Server/Privileges.php and libraries/classes/UserPassword.php). A malicious user with access to the server could create a crafted username, and then trick the victim into performing specific actions with that user account (such as editing its privileges).",2022-11-16T03:04:01.157
CVE-2022-41106,5.9,Microsoft Excel Remote Code Execution Vulnerability. This CVE ID is unique from CVE-2022-41063.,2022-11-15T23:15:20.320
CVE-2022-44830,N/A,"Sourcecodester Event Registration App v1.0 was discovered to contain multiple CSV injection vulnerabilities via the First Name, Contact and Remarks fields. These vulnerabilities allow attackers to execute arbitrary code via a crafted excel file.",2022-11-21T18:44:25.977
CVE-2022-20928,1.4,"A vulnerability in the authentication and authorization flows for VPN connections in Cisco Adaptive Security Appliance (ASA) Software and Firepower Threat Defense (FTD) Software could allow an unauthenticated, remote attacker to establish a connection as a different user. This vulnerability is due to a flaw in the authorization verifications during the VPN authentication flow. An attacker could exploit this vulnerability by sending a crafted packet during a VPN authentication. The attacker must have valid credentials to establish a VPN connection. A successful exploit could allow the attacker to establish a VPN connection with access privileges from a different user.",2022-11-21T15:08:38.440
CVE-2022-44196,N/A,Netgear R7000P V1.3.0.8 is vulnerable to Buffer Overflow via parameter openvpn_push1.,2022-11-22T14:33:22.600
CVE-2022-44197,N/A,Netgear R7000P V1.3.0.8 is vulnerable to Buffer Overflow via parameter openvpn_server_ip.,2022-11-22T14:33:22.600
CVE-2022-44198,N/A,Netgear R7000P V1.3.1.64 is vulnerable to Buffer Overflow via parameter openvpn_push1.,2022-11-22T14:33:22.600
CVE-2022-44199,N/A,Netgear R7000P V1.3.1.64 is vulnerable to Buffer Overflow via parameter openvpn_server_ip.,2022-11-22T14:33:22.600
CVE-2020-2722,2.5,"Vulnerability in the Oracle FLEXCUBE Investor Servicing product of Oracle Financial Services Applications (component: Infrastructure). Supported versions that are affected are 12.1.0-12.4.0 and 14.0.0-14.1.0. Easily exploitable vulnerability allows unauthenticated attacker with network access via HTTP to compromise Oracle FLEXCUBE Investor Servicing. Successful attacks require human interaction from a person other than the attacker. Successful attacks of this vulnerability can result in unauthorized update, insert or delete access to some of Oracle FLEXCUBE Investor Servicing accessible data as well as unauthorized read access to a subset of Oracle FLEXCUBE Investor Servicing accessible data. CVSS 3.0 Base Score 5.4 (Confidentiality and Integrity impacts). CVSS Vector: (CVSS:3.0/AV:N/AC:L/PR:N/UI:R/S:U/C:L/I:L/A:N).",2022-11-21T19:28:31.073
CVE-2019-15604,3.6,"Improper Certificate Validation in Node.js 10, 12, and 13 causes the process to abort when sending a crafted X.509 certificate",2022-11-16T03:02:05.827
CVE-2019-15605,5.9,"HTTP request smuggling in Node.js 10, 12, and 13 causes malicious payload delivery when transfer-encoding is malformed",2022-11-16T02:55:02.077
CVE-2020-2801,5.9,"Vulnerability in the Oracle WebLogic Server product of Oracle Fusion Middleware (component: Core). Supported versions that are affected are 10.3.6.0.0, 12.1.3.0.0, 12.2.1.3.0 and 12.2.1.4.0. Easily exploitable vulnerability allows unauthenticated attacker with network access via IIOP, T3 to compromise Oracle WebLogic Server. Successful attacks of this vulnerability can result in takeover of Oracle WebLogic Server. Note: The patch for this issue will address the vulnerability only if the WLS instance is using JDK 1.7.0_191 or later, or JDK 1.8.0_181 or later. CVSS 3.0 Base Score 9.8 (Confidentiality, Integrity and Availability impacts). CVSS Vector: (CVSS:3.0/AV:N/AC:L/PR:N/UI:N/S:U/C:H/I:H/A:H).",2022-11-21T19:52:13.337
CVE-2020-13249,5.9,"libmariadb/mariadb_lib.c in MariaDB Connector/C before 3.1.8 does not properly validate the content of an OK packet received from a server. NOTE: although mariadb_lib.c was originally based on code shipped for MySQL, this issue does not affect any MySQL components supported by Oracle.",2022-11-16T03:42:36.947
CVE-2019-18901,3.6,"A UNIX Symbolic Link (Symlink) Following vulnerability in the mysql-systemd-helper of the mariadb packaging of SUSE Linux Enterprise Server 12, SUSE Linux Enterprise Server 15 allows local attackers to change the permissions of arbitrary files to 0640. This issue affects: SUSE Linux Enterprise Server 12 mariadb versions prior to 10.2.31-3.25.1. SUSE Linux Enterprise Server 15 mariadb versions prior to 10.2.31-3.26.1.",2022-11-16T03:34:24.513
CVE-2020-13249,5.9,"libmariadb/mariadb_lib.c in MariaDB Connector/C before 3.1.8 does not properly validate the content of an OK packet received from a server. NOTE: although mariadb_lib.c was originally based on code shipped for MySQL, this issue does not affect any MySQL components supported by Oracle.",2022-11-16T03:42:36.947
CVE-2022-39135,5.9,"In Apache Calcite prior to version 1.32.0 the SQL operators EXISTS_NODE, EXTRACT_XML, XML_TRANSFORM and EXTRACT_VALUE do not restrict XML External Entity references in their configuration, which makes them vulnerable to a potential XML External Entity (XXE) attack. Therefore any client exposing these operators, typically by using Oracle dialect (the first three) or MySQL dialect (the last one), is affected by this vulnerability (the extent of it will depend on the user under which the application is running). From Apache Calcite 1.32.0 onwards, Document Type Declarations and XML External Entity resolution are disabled on the impacted operators.",2022-11-21T22:15:12.397
CVE-2022-45136,5.9,** UNSUPPORTED WHEN ASSIGNED ** Apache Jena SDB 3.17.0 and earlier is vulnerable to a JDBC Deserialisation attack if the attacker is able to control the JDBC URL used or cause the underlying database server to return malicious data. The mySQL JDBC driver in particular is known to be vulnerable to this class of attack. As a result an application using Apache Jena SDB can be subject to RCE when connected to a malicious database server. Apache Jena SDB has been EOL since December 2020 and users should migrate to alternative options e.g. Apache Jena TDB 2.,2022-11-17T23:14:56.637
CVE-2022-4051,5.9,A vulnerability has been found in Hostel Searching Project and classified as critical. This vulnerability affects unknown code of the file view-property.php. The manipulation of the argument property_id leads to sql injection. The attack can be initiated remotely. The exploit has been disclosed to the public and may be used. The identifier of this vulnerability is VDB-213844.,2022-11-21T15:04:05.393
CVE-2022-25667,3.6,Information disclosure in kernel due to improper handling of ICMP requests in Snapdragon Wired Infrastructure and Networking,2022-11-18T04:50:59.587
CVE-2022-25671,3.6,Denial of service in MODEM due to reachable assertion in Snapdragon Mobile,2022-11-18T04:51:26.617
CVE-2022-25674,5.9,"Cryptographic issues in WLAN during the group key handshake of the WPA/WPA2 protocol in Snapdragon Consumer IOT, Snapdragon Industrial IOT, Snapdragon Voice & Music",2022-11-18T04:52:14.597
CVE-2022-25676,3.6,"Information disclosure in video due to buffer over-read while parsing avi files in Snapdragon Auto, Snapdragon Compute, Snapdragon Consumer IOT, Snapdragon Industrial IOT, Snapdragon Mobile, Snapdragon Wearables",2022-11-18T04:57:19.477
CVE-2022-25679,3.6,"Denial of service in video due to improper access control in broadcast receivers in Snapdragon Compute, Snapdragon Consumer IOT, Snapdragon Industrial IOT, Snapdragon Mobile, Snapdragon Wearables",2022-11-17T21:52:30.007
CVE-2022-41906,5.8,"OpenSearch Notifications is a notifications plugin for OpenSearch that enables other plugins to send notifications via Email, Slack, Amazon Chime, Custom web-hook etc channels. A potential SSRF issue in OpenSearch Notifications Plugin 2.2.0 and below could allow an existing privileged user to enumerate listening services or interact with configured resources via HTTP requests exceeding the Notification plugin's intended scope. OpenSearch 2.2.1+ contains the fix for this issue. There are currently no recommended workarounds.",2022-11-16T17:08:30.367
CVE-2022-39368,4.2,"Eclipse Californium is a Java implementation of RFC7252 - Constrained Application Protocol for IoT Cloud services. In versions prior to 3.7.0, and 2.7.4, Californium is vulnerable to a Denial of Service. Failing handshakes don't cleanup counters for throttling, causing the threshold to be reached without being released again. This results in permanently dropping records. The issue was reported for certificate based handshakes, but may also affect PSK based handshakes. It generally affects client and server as well. This issue is patched in version 3.7.0 and 2.7.4. There are no known workarounds. main: commit 726bac57659410da463dcf404b3e79a7312ac0b9 2.7.x: commit 5648a0c27c2c2667c98419254557a14bac2b1f3f",2022-11-17T21:39:50.133
CVE-2020-15917,5.9,common/session.c in Claws Mail before 3.17.6 has a protocol violation because suffix data after STARTTLS is mishandled.,2022-11-16T03:52:32.720
CVE-2021-38370,3.6,"In Alpine before 2.25, untagged responses from an IMAP server are accepted before STARTTLS.",2022-11-21T19:27:05.177
CVE-2020-15917,5.9,common/session.c in Claws Mail before 3.17.6 has a protocol violation because suffix data after STARTTLS is mishandled.,2022-11-16T03:52:32.720
CVE-2020-16150,3.6,A Lucky 13 timing side channel in mbedtls_ssl_decrypt_buf in library/ssl_msg.c in Trusted Firmware Mbed TLS through 2.23.0 allows an attacker to recover secret key information. This affects CBC mode because of a computed time difference based on a padding length.,2022-11-16T15:08:44.973
