CVE,"Impact Score (1-10, 10 being the worst)",Keyword,Description,Last Modified,Link
CVE-2024-28056,NA,AWS,"Amazon AWS Amplify CLI before 12.10.1 incorrectly configures the role trust policy of IAM roles associated with Amplify projects. When the Authentication component is removed from an Amplify project, a Condition property is removed but ""Effect"":""Allow"" remains present, and consequently sts:AssumeRoleWithWebIdentity would be available to threat actors with no conditions. Thus, if Amplify CLI had been used to remove the Authentication component from a project built between August 2019 and January 2024, an ""assume role"" may have occurred, and may have been leveraged to obtain unauthorized access to an organization's AWS resources. NOTE: the problem could only occur if an authorized AWS user removed an Authentication component. (The vulnerability did not give a threat actor the ability to remove an Authentication component.) However, in realistic situations, an authorized AWS user may have removed an Authentication component, e.g., if the objective were to stop using built-in Cognito resources, or move to a completely different identity provider.",2024-04-15T19:12:25.887,https://cve.circl.lu/cve/CVE-2024-28056
CVE-2024-31869,NA,Airflow,"Airflow versions 2.7.0 through 2.8.4 have a vulnerability that allows an authenticated user to see sensitive provider configuration via the ""configuration"" UI page when ""non-sensitive-only"" was set as ""webserver.expose_config"" configuration (The celery provider is the only community provider currently that has sensitive configurations). You should migrate to Airflow 2.9 or change your ""expose_config"" configuration to False as a workaround. This is similar, but different to  CVE-2023-46288 https://github.com/advisories/GHSA-9qqg-mh7c-chfq  which concerned API, not UI configuration page.",2024-04-18T13:04:28.900,https://cve.circl.lu/cve/CVE-2024-31869
CVE-2024-29733,NA,Airflow,"Improper Certificate Validation vulnerability in Apache Airflow FTP Provider.The FTP hook lacks complete certificate validation in FTP_TLS connections, which can potentially be leveraged. Implementing proper certificate validation by passing context=ssl.create_default_context() during FTP_TLS instantiation is used as mitigation to validate the certificates properly.This issue affects Apache Airflow FTP Provider: before 3.7.0.Users are recommended to upgrade to version 3.7.0, which fixes the issue.",2024-04-21T18:15:45.043,https://cve.circl.lu/cve/CVE-2024-29733
CVE-2024-28056,NA,Amazon,"Amazon AWS Amplify CLI before 12.10.1 incorrectly configures the role trust policy of IAM roles associated with Amplify projects. When the Authentication component is removed from an Amplify project, a Condition property is removed but ""Effect"":""Allow"" remains present, and consequently sts:AssumeRoleWithWebIdentity would be available to threat actors with no conditions. Thus, if Amplify CLI had been used to remove the Authentication component from a project built between August 2019 and January 2024, an ""assume role"" may have occurred, and may have been leveraged to obtain unauthorized access to an organization's AWS resources. NOTE: the problem could only occur if an authorized AWS user removed an Authentication component. (The vulnerability did not give a threat actor the ability to remove an Authentication component.) However, in realistic situations, an authorized AWS user may have removed an Authentication component, e.g., if the objective were to stop using built-in Cognito resources, or move to a completely different identity provider.",2024-04-15T19:12:25.887,https://cve.circl.lu/cve/CVE-2024-28056
CVE-2023-38709,NA,Apache,Faulty input validation in the core of Apache allows malicious or exploitable backend/content generators to split HTTP responses.This issue affects Apache HTTP Server: through 2.4.58.,2024-04-19T23:15:09.090,https://cve.circl.lu/cve/CVE-2023-38709
CVE-2024-24795,NA,Apache,"HTTP Response splitting in multiple modules in Apache HTTP Server allows an attacker that can inject malicious response headers into backend applications to cause an HTTP desynchronization attack.Users are recommended to upgrade to version 2.4.59, which fixes this issue.",2024-04-19T23:15:09.567,https://cve.circl.lu/cve/CVE-2024-24795
CVE-2024-31309,NA,Apache,"HTTP/2 CONTINUATION DoS attack can cause Apache Traffic Server to consume more resources on the server.  Version from 8.0.0 through 8.1.9, from 9.0.0 through 9.2.3 are affected.Users can set a new setting (proxy.config.http2.max_continuation_frames_per_minute) to limit the number of CONTINUATION frames per minute.  ATS does have a fixed amount of memory a request can use and ATS adheres to these limits in previous releases.Users are recommended to upgrade to versions 8.1.10 or 9.2.4 which fixes the issue.",2024-04-19T23:15:11.460,https://cve.circl.lu/cve/CVE-2024-31309
CVE-2024-31391,NA,Apache,"Insertion of Sensitive Information into Log File vulnerability in the Apache Solr Operator.This issue affects all versions of the Apache Solr Operator from 0.3.0 through 0.8.0.When asked to bootstrap Solr security, the operator will enable basic authentication and create several accounts for accessing Solr: including the ""solr"" and ""admin"" accounts for use by end-users, and a ""k8s-oper"" account which the operator uses for its own requests to Solr.One common source of these operator requests is healthchecks: liveness, readiness, and startup probes are all used to determine Solr's health and ability to receive traffic.By default, the operator configures the Solr APIs used for these probes to be exempt from authentication, but users may specifically request that authentication be required on probe endpoints as well.Whenever one of these probes would fail, if authentication was in use, the Solr Operator would create a Kubernetes ""event"" containing the username and password of the ""k8s-oper"" account.Within the affected version range, this vulnerability affects any solrcloud resource which (1) bootstrapped security through use of the `.solrOptions.security.authenticationType=basic` option, and (2) required authentication be used on probes by setting `.solrOptions.security.probesRequireAuth=true`.Users are recommended to upgrade to Solr Operator version 0.8.1, which fixes this issue by ensuring that probes no longer print the credentials used for Solr requests.  Users may also mitigate the vulnerability by disabling authentication on their healthcheck probes using the setting `.solrOptions.security.probesRequireAuth=false`.",2024-04-15T13:15:51.577,https://cve.circl.lu/cve/CVE-2024-31391
CVE-2024-29217,NA,Apache,"Improper Neutralization of Input During Web Page Generation ('Cross-site Scripting') vulnerability in Apache Answer.This issue affects Apache Answer: before 1.3.0.XSS attack when user changes personal website. A logged-in user, when modifying their personal website, can input malicious code in the website to create such an attack.Users are recommended to upgrade to version [1.3.0], which fixes the issue.",2024-04-21T16:15:47.617,https://cve.circl.lu/cve/CVE-2024-29217
CVE-2024-21002,1.4,Apple,"Vulnerability in the Oracle Java SE, Oracle GraalVM Enterprise Edition product of Oracle Java SE (component: JavaFX).  Supported versions that are affected are Oracle Java SE: 8u401; Oracle GraalVM Enterprise Edition: 20.3.13 and  21.3.9. Difficult to exploit vulnerability allows unauthenticated attacker with logon to the infrastructure where Oracle Java SE, Oracle GraalVM Enterprise Edition executes to compromise Oracle Java SE, Oracle GraalVM Enterprise Edition.  Successful attacks require human interaction from a person other than the attacker. Successful attacks of this vulnerability can result in  unauthorized update, insert or delete access to some of Oracle Java SE, Oracle GraalVM Enterprise Edition accessible data. Note: This vulnerability applies to Java deployments, typically in clients running sandboxed Java Web Start applications or sandboxed Java applets, that load and run untrusted code (e.g., code that comes from the internet) and rely on the Java sandbox for security. This vulnerability does not apply to Java deployments, typically in servers, that load and run only trusted code (e.g., code installed by an administrator). CVSS 3.1 Base Score 2.5 (Integrity impacts).  CVSS Vector: (CVSS:3.1/AV:L/AC:H/PR:N/UI:R/S:U/C:N/I:L/A:N).",2024-04-17T12:48:31.863,https://cve.circl.lu/cve/CVE-2024-21002
CVE-2024-21003,1.4,Apple,"Vulnerability in the Oracle Java SE, Oracle GraalVM Enterprise Edition product of Oracle Java SE (component: JavaFX).  Supported versions that are affected are Oracle Java SE: 8u401; Oracle GraalVM Enterprise Edition: 20.3.13 and  21.3.9. Difficult to exploit vulnerability allows unauthenticated attacker with network access via multiple protocols to compromise Oracle Java SE, Oracle GraalVM Enterprise Edition.  Successful attacks require human interaction from a person other than the attacker. Successful attacks of this vulnerability can result in  unauthorized update, insert or delete access to some of Oracle Java SE, Oracle GraalVM Enterprise Edition accessible data. Note: This vulnerability applies to Java deployments, typically in clients running sandboxed Java Web Start applications or sandboxed Java applets, that load and run untrusted code (e.g., code that comes from the internet) and rely on the Java sandbox for security. This vulnerability does not apply to Java deployments, typically in servers, that load and run only trusted code (e.g., code installed by an administrator). CVSS 3.1 Base Score 3.1 (Integrity impacts).  CVSS Vector: (CVSS:3.1/AV:N/AC:H/PR:N/UI:R/S:U/C:N/I:L/A:N).",2024-04-17T12:48:31.863,https://cve.circl.lu/cve/CVE-2024-21003
CVE-2024-21004,1.4,Apple,"Vulnerability in the Oracle Java SE, Oracle GraalVM Enterprise Edition product of Oracle Java SE (component: JavaFX).  Supported versions that are affected are Oracle Java SE: 8u401; Oracle GraalVM Enterprise Edition: 20.3.13 and  21.3.9. Difficult to exploit vulnerability allows unauthenticated attacker with logon to the infrastructure where Oracle Java SE, Oracle GraalVM Enterprise Edition executes to compromise Oracle Java SE, Oracle GraalVM Enterprise Edition.  Successful attacks require human interaction from a person other than the attacker. Successful attacks of this vulnerability can result in  unauthorized update, insert or delete access to some of Oracle Java SE, Oracle GraalVM Enterprise Edition accessible data. Note: This vulnerability applies to Java deployments, typically in clients running sandboxed Java Web Start applications or sandboxed Java applets, that load and run untrusted code (e.g., code that comes from the internet) and rely on the Java sandbox for security. This vulnerability does not apply to Java deployments, typically in servers, that load and run only trusted code (e.g., code installed by an administrator). CVSS 3.1 Base Score 2.5 (Integrity impacts).  CVSS Vector: (CVSS:3.1/AV:L/AC:H/PR:N/UI:R/S:U/C:N/I:L/A:N).",2024-04-17T12:48:31.863,https://cve.circl.lu/cve/CVE-2024-21004
CVE-2024-21005,1.4,Apple,"Vulnerability in the Oracle Java SE, Oracle GraalVM Enterprise Edition product of Oracle Java SE (component: JavaFX).  Supported versions that are affected are Oracle Java SE: 8u401; Oracle GraalVM Enterprise Edition: 20.3.13 and  21.3.9. Difficult to exploit vulnerability allows unauthenticated attacker with network access via multiple protocols to compromise Oracle Java SE, Oracle GraalVM Enterprise Edition.  Successful attacks require human interaction from a person other than the attacker. Successful attacks of this vulnerability can result in  unauthorized update, insert or delete access to some of Oracle Java SE, Oracle GraalVM Enterprise Edition accessible data. Note: This vulnerability applies to Java deployments, typically in clients running sandboxed Java Web Start applications or sandboxed Java applets, that load and run untrusted code (e.g., code that comes from the internet) and rely on the Java sandbox for security. This vulnerability does not apply to Java deployments, typically in servers, that load and run only trusted code (e.g., code installed by an administrator). CVSS 3.1 Base Score 3.1 (Integrity impacts).  CVSS Vector: (CVSS:3.1/AV:N/AC:H/PR:N/UI:R/S:U/C:N/I:L/A:N).",2024-04-17T12:48:31.863,https://cve.circl.lu/cve/CVE-2024-21005
CVE-2024-21011,1.4,Apple,"Vulnerability in the Oracle Java SE, Oracle GraalVM for JDK, Oracle GraalVM Enterprise Edition product of Oracle Java SE (component: Hotspot).  Supported versions that are affected are Oracle Java SE: 8u401, 8u401-perf, 11.0.22, 17.0.10, 21.0.2, 22; Oracle GraalVM for JDK: 17.0.10, 21.0.2, 22;   Oracle GraalVM Enterprise Edition: 20.3.13 and  21.3.9. Difficult to exploit vulnerability allows unauthenticated attacker with network access via multiple protocols to compromise Oracle Java SE, Oracle GraalVM for JDK, Oracle GraalVM Enterprise Edition.  Successful attacks of this vulnerability can result in unauthorized ability to cause a partial denial of service (partial DOS) of Oracle Java SE, Oracle GraalVM for JDK, Oracle GraalVM Enterprise Edition. Note: This vulnerability can be exploited by using APIs in the specified Component, e.g., through a web service which supplies data to the APIs. This vulnerability also applies to Java deployments, typically in clients running sandboxed Java Web Start applications or sandboxed Java applets, that load and run untrusted code (e.g., code that comes from the internet) and rely on the Java sandbox for security. CVSS 3.1 Base Score 3.7 (Availability impacts).  CVSS Vector: (CVSS:3.1/AV:N/AC:H/PR:N/UI:N/S:U/C:N/I:N/A:L).",2024-04-17T12:48:31.863,https://cve.circl.lu/cve/CVE-2024-21011
CVE-2024-29035,1.4,ASP.NET,Umbraco is an ASP.NET CMS. Failing webhooks logs are available when solution is not in debug mode. Those logs can contain information that is critical. This vulnerability is fixed in 13.1.1.,2024-04-17T15:31:50.160,https://cve.circl.lu/cve/CVE-2024-29035
CVE-2024-3781,6.0,Active Directory,Command injection vulnerability in the operating system. Improper neutralisation of special elements in Active Directory integration allows the intended command to be modified when sent to a downstream component in WBSAirback 21.02.04.,2024-04-15T19:12:25.887,https://cve.circl.lu/cve/CVE-2024-3781
CVE-2023-40146,5.9,BusyBox,A privilege escalation vulnerability exists in the /bin/login functionality of Peplink Smart Reader v1.2.0 (in QEMU). A specially crafted command line argument can lead to a limited-shell escape and elevated capabilities. An attacker can authenticate with hard-coded credentials and execute unblocked default busybox functionality to trigger this vulnerability.,2024-04-17T17:15:12.513,https://cve.circl.lu/cve/CVE-2023-40146
CVE-2023-28335,5.9,CSRF,The link to reset all templates of a database activity did not include the necessary token to prevent a CSRF risk.,2024-04-19T14:15:09.407,https://cve.circl.lu/cve/CVE-2023-28335
CVE-2024-3135,3.6,CSRF,"A Cross-Site Request Forgery (CSRF) vulnerability exists in the mudler/localai application, allowing attackers to craft malicious webpages that, when visited by a victim, perform unauthorized actions on the victim's local LocalAI instance without their consent. This vulnerability enables attackers to exhaust system resources, consume credits, and fill disk space by making numerous resource-intensive API calls, such as generating images or uploading files. The vulnerability stems from the application's acceptance of simple request content-types without requiring CSRF tokens or implementing other CSRF mitigation measures. Successful exploitation does not require network access to the vulnerable LocalAI environment.",2024-04-16T12:15:10.367,https://cve.circl.lu/cve/CVE-2024-3135
CVE-2024-1306,NA,CSRF,"The Smart Forms  WordPress plugin before 2.6.94 does not have CSRF checks in some places, which could allow attackers to make logged-in users perform unwanted actions via CSRF attacks, such as editing entries, and we consider it a medium risk.",2024-04-15T13:15:31.997,https://cve.circl.lu/cve/CVE-2024-1306
CVE-2024-1755,NA,CSRF,"The NPS computy WordPress plugin through 2.7.5 does not have CSRF checks in some places, which could allow attackers to make logged in users perform unwanted actions via CSRF attacks",2024-04-15T13:15:31.997,https://cve.circl.lu/cve/CVE-2024-1755
CVE-2024-2739,NA,CSRF,"The Advanced Search WordPress plugin through 1.1.6 does not have CSRF checks in some places, which could allow attackers to make logged in users perform unwanted actions via CSRF attacks",2024-04-15T13:15:31.997,https://cve.circl.lu/cve/CVE-2024-2739
CVE-2024-28834,3.6,Cryptograph,"A flaw was found in GnuTLS. The Minerva attack is a cryptographic vulnerability that exploits deterministic behavior in systems like GnuTLS, leading to side-channel leaks. In specific scenarios, such as when using the GNUTLS_PRIVKEY_FLAG_REPRODUCIBLE flag, it can result in a noticeable step in nonce size from 513 to 512 bits, exposing a potential timing side-channel.",2024-04-18T05:15:48.167,https://cve.circl.lu/cve/CVE-2024-28834
CVE-2024-30407,5.9,Cryptograph,"The Use of a Hard-coded Cryptographic Key vulnerability in Juniper Networks Juniper Cloud Native Router (JCNR) and containerized routing Protocol Deamon (cRPD) products allows an attacker to perform Person-in-the-Middle (PitM) attacks which results in complete compromise of the container. Due to hardcoded SSH host keys being present on the container, a PitM attacker can intercept SSH traffic without being detected. This issue affects Juniper Networks JCNR:  *  All versions before 23.4.This issue affects Juniper Networks cRPD:  *  All versions before 23.4R1.",2024-04-15T13:15:51.577,https://cve.circl.lu/cve/CVE-2024-30407
CVE-2024-29090,4.0,ChatGPT,Server-Side Request Forgery (SSRF) vulnerability in Jordy Meow AI Engine: ChatGPT Chatbot.This issue affects AI Engine: ChatGPT Chatbot: from n/a through 2.1.4.,2024-04-15T22:15:08.450,https://cve.circl.lu/cve/CVE-2024-29090
CVE-2023-51409,6.0,ChatGPT,Unrestricted Upload of File with Dangerous Type vulnerability in Jordy Meow AI Engine: ChatGPT Chatbot.This issue affects AI Engine: ChatGPT Chatbot: from n/a through 1.9.98.,2024-04-15T13:15:51.577,https://cve.circl.lu/cve/CVE-2023-51409
CVE-2024-3690,3.4,CRM,A vulnerability classified as critical was found in PHPGurukul Small CRM 3.0. Affected by this vulnerability is an unknown functionality of the component Change Password Handler. The manipulation leads to sql injection. The attack can be launched remotely. The exploit has been disclosed to the public and may be used. The associated identifier of this vulnerability is VDB-260479.,2024-04-15T13:15:51.577,https://cve.circl.lu/cve/CVE-2024-3690
CVE-2024-3691,3.4,CRM,"A vulnerability, which was classified as critical, has been found in PHPGurukul Small CRM 3.0. Affected by this issue is some unknown functionality of the component Registration Page. The manipulation leads to sql injection. The attack may be launched remotely. The exploit has been disclosed to the public and may be used. The identifier of this vulnerability is VDB-260480.",2024-04-15T13:15:51.577,https://cve.circl.lu/cve/CVE-2024-3691
CVE-2024-21086,1.4,CRM,"Vulnerability in the Oracle CRM Technical Foundation product of Oracle E-Business Suite (component: Preferences).  Supported versions that are affected are 12.2.3-12.2.13. Easily exploitable vulnerability allows unauthenticated attacker with network access via HTTP to compromise Oracle CRM Technical Foundation.  Successful attacks require human interaction from a person other than the attacker. Successful attacks of this vulnerability can result in  unauthorized update, insert or delete access to some of Oracle CRM Technical Foundation accessible data. CVSS 3.1 Base Score 4.3 (Integrity impacts).  CVSS Vector: (CVSS:3.1/AV:N/AC:L/PR:N/UI:R/S:U/C:N/I:L/A:N).",2024-04-17T12:48:31.863,https://cve.circl.lu/cve/CVE-2024-21086
CVE-2024-31503,NA,CRM,"Incorrect access control in Dolibarr ERP CRM versions 19.0.0 and before, allows authenticated attackers to steal victim users' session cookies and CSRF protection tokens via user interaction with a crafted web page, leading to account takeover.",2024-04-17T12:48:07.510,https://cve.circl.lu/cve/CVE-2024-31503
CVE-2024-26841,NA,CRM,"In the Linux kernel, the following vulnerability has been resolved:LoongArch: Update cpu_sibling_map when disabling nonboot CPUsUpdate cpu_sibling_map when disabling nonboot CPUs by defining & callingclear_cpu_sibling_map(), otherwise we get such errors on SMT systems:jump label: negative count!WARNING: CPU: 6 PID: 45 at kernel/jump_label.c:263 __static_key_slow_dec_cpuslocked+0xec/0x100CPU: 6 PID: 45 Comm: cpuhp/6 Not tainted 6.8.0-rc5+ #1340pc 90000000004c302c ra 90000000004c302c tp 90000001005bc000 sp 90000001005bfd20a0 000000000000001b a1 900000000224c278 a2 90000001005bfb58 a3 900000000224c280a4 900000000224c278 a5 90000001005bfb50 a6 0000000000000001 a7 0000000000000001t0 ce87a4763eb5234a t1 ce87a4763eb5234a t2 0000000000000000 t3 0000000000000000t4 0000000000000006 t5 0000000000000000 t6 0000000000000064 t7 0000000000001964t8 000000000009ebf6 u0 9000000001f2a068 s9 0000000000000000 s0 900000000246a2d8s1 ffffffffffffffff s2 ffffffffffffffff s3 90000000021518c0 s4 0000000000000040s5 9000000002151058 s6 9000000009828e40 s7 00000000000000b4 s8 0000000000000006   ra: 90000000004c302c __static_key_slow_dec_cpuslocked+0xec/0x100  ERA: 90000000004c302c __static_key_slow_dec_cpuslocked+0xec/0x100 CRMD: 000000b0 (PLV0 -IE -DA +PG DACF=CC DACM=CC -WE) PRMD: 00000004 (PPLV0 +PIE -PWE) EUEN: 00000000 (-FPE -SXE -ASXE -BTE) ECFG: 00071c1c (LIE=2-4,10-12 VS=7)ESTAT: 000c0000 [BRK] (IS= ECode=12 EsubCode=0) PRID: 0014d000 (Loongson-64bit, Loongson-3A6000-HV)CPU: 6 PID: 45 Comm: cpuhp/6 Not tainted 6.8.0-rc5+ #1340Stack : 0000000000000000 900000000203f258 900000000179afc8 90000001005bc000        90000001005bf980 0000000000000000 90000001005bf988 9000000001fe0be0        900000000224c280 900000000224c278 90000001005bf8c0 0000000000000001        0000000000000001 ce87a4763eb5234a 0000000007f38000 90000001003f8cc0        0000000000000000 0000000000000006 0000000000000000 4c206e6f73676e6f        6f4c203a656d616e 000000000009ec99 0000000007f38000 0000000000000000        900000000214b000 9000000001fe0be0 0000000000000004 0000000000000000        0000000000000107 0000000000000009 ffffffffffafdabe 00000000000000b4        0000000000000006 90000000004c302c 9000000000224528 00005555939a0c7c        00000000000000b0 0000000000000004 0000000000000000 0000000000071c1c        ...Call Trace:[<9000000000224528>] show_stack+0x48/0x1a0[<900000000179afc8>] dump_stack_lvl+0x78/0xa0[<9000000000263ed0>] __warn+0x90/0x1a0[<90000000017419b8>] report_bug+0x1b8/0x280[<900000000179c564>] do_bp+0x264/0x420[<90000000004c302c>] __static_key_slow_dec_cpuslocked+0xec/0x100[<90000000002b4d7c>] sched_cpu_deactivate+0x2fc/0x300[<9000000000266498>] cpuhp_invoke_callback+0x178/0x8a0[<9000000000267f70>] cpuhp_thread_fun+0xf0/0x240[<90000000002a117c>] smpboot_thread_fn+0x1dc/0x2e0[<900000000029a720>] kthread+0x140/0x160[<9000000000222288>] ret_from_kernel_thread+0xc/0xa4",2024-04-17T12:48:07.510,https://cve.circl.lu/cve/CVE-2024-26841
CVE-2024-3272,5.9,D-Link,"** UNSUPPORTED WHEN ASSIGNED ** A vulnerability, which was classified as very critical, has been found in D-Link DNS-320L, DNS-325, DNS-327L and DNS-340L up to 20240403. This issue affects some unknown processing of the file /cgi-bin/nas_sharing.cgi of the component HTTP GET Request Handler. The manipulation of the argument user with the input messagebus leads to hard-coded credentials. The attack may be initiated remotely. The exploit has been disclosed to the public and may be used. The associated identifier of this vulnerability is VDB-259283. NOTE: This vulnerability only affects products that are no longer supported by the maintainer. NOTE: Vendor was contacted early and confirmed immediately that the product is end-of-life. It should be retired and replaced.",2024-04-15T20:14:55.570,https://cve.circl.lu/cve/CVE-2024-3272
CVE-2024-3273,5.9,D-Link,"** UNSUPPORTED WHEN ASSIGNED ** A vulnerability, which was classified as critical, was found in D-Link DNS-320L, DNS-325, DNS-327L and DNS-340L up to 20240403. Affected is an unknown function of the file /cgi-bin/nas_sharing.cgi of the component HTTP GET Request Handler. The manipulation of the argument system leads to command injection. It is possible to launch the attack remotely. The exploit has been disclosed to the public and may be used. The identifier of this vulnerability is VDB-259284. NOTE: This vulnerability only affects products that are no longer supported by the maintainer. NOTE: Vendor was contacted early and confirmed immediately that the product is end-of-life. It should be retired and replaced.",2024-04-15T20:13:57.290,https://cve.circl.lu/cve/CVE-2024-3273
CVE-2024-27261,5.9,Defender,"IBM Storage Defender - Resiliency Service 2.0.0 through 2.0.2 could allow a privileged user to install a potentially dangerous tar file, which could give them access to subsequent systems where the package was installed.  IBM X-Force ID:  283986.",2024-04-15T13:15:51.577,https://cve.circl.lu/cve/CVE-2024-27261
CVE-2024-0157,3.6,Dell,"Dell Storage Resource Manager, 4.9.0.0 and below, contain(s) a Session Fixation Vulnerability in SRM Windows Host Agent. An adjacent network unauthenticated attacker could potentially exploit this vulnerability, leading to the hijack of a targeted user's application session.",2024-04-15T13:15:51.577,https://cve.circl.lu/cve/CVE-2024-0157
