CVE,"Impact Score (1-10, 10 being the worst)",Keyword,Description,Last Modified,Link
CVE-2023-44189,2.7,Juniper,"An Origin Validation vulnerability in MAC address validation of Juniper Networks Junos OS Evolved on PTX10003 Series allows a network-adjacent attacker to bypass MAC address checking, allowing MAC addresses not intended to reach the adjacent LAN to be forwarded to the downstream network. Due to this issue, the router will start forwarding traffic if a valid route is present in forwarding-table, causing a loop and congestion in the downstream layer-2 domain connected to the device.This issue affects Juniper Networks Junos OS Evolved on PTX10003 Series:  *  All versions prior to 21.4R3-S4-EVO;  *  22.1 versions prior to 22.1R3-S3-EVO;  *  22.2 version 22.2R1-EVO and later versions;  *  22.3 versions prior to 22.3R2-S2-EVO, 22.3R3-S1-EVO;  *  22.4 versions prior to 22.4R2-S1-EVO, 22.4R3-EVO;  *  23.2 versions prior to 23.2R2-EVO.",2023-10-12T12:59:39.183,https://cve.circl.lu/cve/CVE-2023-44189
CVE-2023-5113,2.7,JQuery,Certain HP Enterprise LaserJet and HP LaserJet Managed Printers are potentially vulnerable to denial of service due to WS-Print request and potential injections of Cross Site Scripting via jQuery-UI.,2023-10-11T17:41:34.833,https://cve.circl.lu/cve/CVE-2023-5113
CVE-2023-44384,1.4,Jira,"Discourse-jira is a Discourse plugin allows Jira projects, issue types, fields and field options will be synced automatically. An administrator user can make an SSRF attack by setting the Jira URL to an arbitrary location and enabling the `discourse_jira_verbose_log` site setting. A moderator user could manipulate the request path to the Jira API, allowing them to perform arbitrary GET requests using the Jira API credentials, potentially with elevated permissions, used by the application. ",2023-10-11T17:49:49.353,https://cve.circl.lu/cve/CVE-2023-44384
CVE-2022-29532,2.7,JavaScript,"An issue was discovered in MISP before 2.4.158. There is XSS in the cerebrate view if one administrator puts a javascript: URL in the URL field, and another administrator clicks on it.",2023-10-10T22:15:10.890,https://cve.circl.lu/cve/CVE-2022-29532
CVE-2023-39000,2.7,JavaScript,A reflected cross-site scripting (XSS) vulnerability in the component /ui/diagnostics/log/core/ of OPNsense Community Edition before 23.7 and Business Edition before 23.4.2 allows attackers to inject arbitrary JavaScript via the URL path.,2023-10-10T23:15:10.240,https://cve.circl.lu/cve/CVE-2023-39000
CVE-2023-40577,2.7,JavaScript,Alertmanager handles alerts sent by client applications such as the Prometheus server. An attacker with the permission to perform POST requests on the /api/v1/alerts endpoint could be able to execute arbitrary JavaScript code on the users of Prometheus Alertmanager. This issue has been fixed in Alertmanager version 0.2.51.,2023-10-08T12:15:36.140,https://cve.circl.lu/cve/CVE-2023-40577
CVE-2023-39366,2.7,JavaScript,"Cacti is an open source operational monitoring and fault management framework. Affected versions are subject to a Stored Cross-Site-Scripting (XSS) Vulnerability allows an authenticated user to poison data stored in the _cacti_'s database. These data will be viewed by administrative _cacti_ accounts and execute JavaScript code in the victim's browser at view-time. The `data_sources.php` script displays the data source management information (e.g. data source path, polling configuration etc.) for different data visualizations of the _cacti_ app. CENSUS found that an adversary that is able to configure a malicious Device name, can deploy a stored XSS attack against any user of the same (or broader) privileges. A user that possesses the _General Administration>Sites/Devices/Data_ permissions can configure the device names in _cacti_. This configuration occurs through `http://<HOST>/cacti/host.php`, while the rendered malicious payload is exhibited at `http://<HOST>/cacti/data_sources.php`. This vulnerability has been addressed in version 1.2.25. Users are advised to upgrade. Users unable to update should manually filter HTML output.",2023-10-13T04:15:13.003,https://cve.circl.lu/cve/CVE-2023-39366
CVE-2023-39510,2.7,JavaScript,"Cacti is an open source operational monitoring and fault management framework. Affected versions are subject to a Stored Cross-Site-Scripting (XSS) Vulnerability allows an authenticated user to poison data stored in the _cacti_'s database. These data will be viewed by administrative _cacti_ accounts and execute JavaScript code in the victim's browser at view-time. The`reports_admin.php` script displays reporting information about graphs, devices, data sources etc.CENSUS found that an adversary that is able to configure a malicious Device name, can deploy a stored XSS attack against any user of the same (or broader) privileges. A user that possesses the _General Administration>Sites/Devices/Data_ permissions can configure the device names in _cacti_. This configuration occurs through `http://<HOST>/cacti/host.php`, while the rendered malicious payload is exhibited at `http://<HOST>/cacti/reports_admin.php` when the a graph with the maliciously altered device name is linked to the report. This vulnerability has been addressed in version 1.2.25. Users are advised to upgrade. Users unable to update should manually filter HTML output.",2023-10-13T04:15:13.100,https://cve.circl.lu/cve/CVE-2023-39510
CVE-2022-27211,3.6,Kubernetes,"A missing permission check in Jenkins Kubernetes Continuous Deploy Plugin 2.3.1 and earlier allows attackers with Overall/Read permission to connect to an attacker-specified SSH server using attacker-specified credentials IDs obtained through another method, capturing credentials stored in Jenkins.",2023-10-10T22:15:10.507,https://cve.circl.lu/cve/CVE-2022-27211
CVE-2023-44392,6.0,Kubernetes,"Garden provides automation for Kubernetes development and testing. Prior tov ersions 0.13.17 and 0.12.65, Garden has a dependency on the cryo library, which is vulnerable to code injection due to an insecure implementation of deserialization. Garden stores serialized objects using cryo in the Kubernetes `ConfigMap` resources prefixed with `test-result` and `run-result` to cache Garden test and run results. These `ConfigMaps` are stored either in the `garden-system` namespace or the configured user namespace. When a user invokes the command `garden test` or `garden run` objects stored in the `ConfigMap` are retrieved and deserialized. This can be used by an attacker with access to the Kubernetes cluster to store malicious objects in the `ConfigMap`, which can trigger a remote code execution on the users machine when cryo deserializes the object. In order to exploit this vulnerability, an attacker must have access to the Kubernetes cluster used to deploy garden remote environments. Further, a user must actively invoke either a `garden test` or `garden run` which has previously cached results. The issue has been patched in Garden versions `0.13.17` (Bonsai) and `0.12.65` (Acorn). Only Garden versions prior to these are vulnerable. No known workarounds are available.",2023-10-10T12:16:32.703,https://cve.circl.lu/cve/CVE-2023-44392
CVE-2022-3431,5.9,Lenovo,A potential vulnerability in a driver used during manufacturing process on some consumer Lenovo Notebook devices that was mistakenly not deactivated may allow an attacker with elevated privileges to modify secure boot setting by modifying an NVRAM variable.,2023-10-10T12:16:32.703,https://cve.circl.lu/cve/CVE-2022-3431
CVE-2011-4330,10.0,Linux,Stack-based buffer overflow in the hfs_mac2asc function in fs/hfs/trans.c in the Linux kernel 2.6 allows local users to cause a denial of service (crash) and possibly execute arbitrary code via an HFS image with a crafted len field.,2023-10-12T14:13:03.737,https://cve.circl.lu/cve/CVE-2011-4330
CVE-2012-2123,10.0,Linux,"The cap_bprm_set_creds function in security/commoncap.c in the Linux kernel before 3.3.3 does not properly handle the use of file system capabilities (aka fcaps) for implementing a privileged executable file, which allows local users to bypass intended personality restrictions via a crafted application, as demonstrated by an attack that uses a parent process to disable ASLR.",2023-10-12T14:12:18.073,https://cve.circl.lu/cve/CVE-2012-2123
CVE-2012-2136,10.0,Linux,"The sock_alloc_send_pskb function in net/core/sock.c in the Linux kernel before 3.4.5 does not properly validate a certain length value, which allows local users to cause a denial of service (heap-based buffer overflow and system crash) or possibly gain privileges by leveraging access to a TUN/TAP device.",2023-10-12T14:12:02.680,https://cve.circl.lu/cve/CVE-2012-2136
CVE-2015-8104,6.9,Linux,"The KVM subsystem in the Linux kernel through 4.2.6, and Xen 4.3.x through 4.6.x, allows guest OS users to cause a denial of service (host OS panic or hang) by triggering many #DB (aka Debug) exceptions, related to svm.c.",2023-10-10T15:15:09.550,https://cve.circl.lu/cve/CVE-2015-8104
CVE-2020-11884,5.9,Linux,"In the Linux kernel 4.19 through 5.6.7 on the s390 platform, code execution may occur because of a race condition, as demonstrated by code in enable_sacf_uaccess in arch/s390/lib/uaccess.c that fails to protect against a concurrent page table upgrade, aka CID-3f777e19d171. A crash could also occur.",2023-10-12T13:31:56.897,https://cve.circl.lu/cve/CVE-2020-11884
CVE-2021-27860,5.9,Management,"A vulnerability in the web management interface of FatPipe WARP, IPVPN, and MPVPN software prior to versions 10.1.2r60p92 and 10.2.2r44p1 allows a remote, unauthenticated attacker to upload a file to any location on the filesystem. The FatPipe advisory identifier for this vulnerability is FPSA006.",2023-10-13T16:15:10.283,https://cve.circl.lu/cve/CVE-2021-27860
CVE-2021-46784,3.6,Management,"In Squid 3.x through 3.5.28, 4.x through 4.17, and 5.x before 5.6, due to improper buffer management, a Denial of Service can occur when processing long Gopher server responses.",2023-10-13T21:15:51.373,https://cve.circl.lu/cve/CVE-2021-46784
CVE-2023-3269,5.9,Management,"A vulnerability exists in the memory management subsystem of the Linux kernel. The lock handling for accessing and updating virtual memory areas (VMAs) is incorrect, leading to use-after-free problems. This issue can be successfully exploited to execute arbitrary kernel code, escalate containers, and gain root privileges.",2023-10-10T16:18:27.987,https://cve.circl.lu/cve/CVE-2023-3269
CVE-2023-39359,5.9,Management,"Cacti is an open source operational monitoring and fault management framework. An authenticated SQL injection vulnerability was discovered which allows authenticated users to perform privilege escalation and remote code execution. The vulnerability resides in the `graphs.php` file. When dealing with the cases of ajax_hosts and ajax_hosts_noany, if the `site_id` parameter is greater than 0, it is directly reflected in the WHERE clause of the SQL statement. This creates an SQL injection vulnerability. This issue has been addressed in version 1.2.25. Users are advised to upgrade. There are no known workarounds for this vulnerability.",2023-10-13T04:15:12.317,https://cve.circl.lu/cve/CVE-2023-39359
CVE-2023-39360,2.7,Management,"Cacti is an open source operational monitoring and fault management framework.Affected versions are subject to a Stored Cross-Site-Scripting (XSS) Vulnerability allows an authenticated user to poison data. The vulnerability is found in `graphs_new.php`. Several validations are performed, but the `returnto` parameter is directly passed to `form_save_button`. In order to bypass this validation, returnto must contain `host.php`. This vulnerability has been addressed in version 1.2.25. Users are advised to upgrade. Users unable to update should manually filter HTML output.",2023-10-13T04:15:12.443,https://cve.circl.lu/cve/CVE-2023-39360
CVE-2023-5330,3.6,Mattermost,Mattermost fails to enforce a limit for the size of the cache entry for  OpenGraph data allowing an attacker to send a specially crafted request to the /api/v4/opengraph filling the cache and turning the server unavailable.,2023-10-12T18:31:55.587,https://cve.circl.lu/cve/CVE-2023-5330
CVE-2023-5331,1.4,Mattermost,"Mattermost fails to properly check the creator of an attached file when adding the file to a draft post, potentially exposing unauthorized file information.",2023-10-12T18:31:39.367,https://cve.circl.lu/cve/CVE-2023-5331
CVE-2023-5333,3.6,Mattermost,Mattermost fails to deduplicate input IDs allowing a simple user to cause the application to consume excessive resources and possibly crash by sending a specially crafted request to /api/v4/users/ids with multiple identical IDs. ,2023-10-12T18:35:58.290,https://cve.circl.lu/cve/CVE-2023-5333
CVE-2018-4858,5.9,Microsoft,"A vulnerability has been identified in IEC 61850 system configurator (All versions < V5.80), DIGSI 5 (affected as IEC 61850 system configurator is incorporated) (All versions < V7.80), DIGSI 4 (All versions < V4.93), SICAM PAS/PQS (All versions < V8.11), SICAM PQ Analyzer (All versions < V3.11), SICAM SCC (All versions < V9.02 HF3). A service of the affected products listening on all of the host's network interfaces on either port 4884/TCP, 5885/TCP, or port 5886/TCP could allow an attacker to either exfiltrate limited data from the system or to execute code with Microsoft Windows user permissions. Successful exploitation requires an attacker to be able to send a specially crafted network request to the vulnerable service and a user interacting with the service's client application on the host. In order to execute arbitrary code with Microsoft Windows user permissions, an attacker must be able to plant the code in advance on the host by other means. The vulnerability has limited impact to confidentiality and integrity of the affected system. At the time of advisory publication no public exploitation of this security vulnerability was known. Siemens confirms the security vulnerability and provides mitigations to resolve the security issue.",2023-10-13T16:45:10.723,https://cve.circl.lu/cve/CVE-2018-4858
CVE-2023-35349,5.9,Microsoft,Microsoft Message Queuing Remote Code Execution Vulnerability,2023-10-12T17:14:18.920,https://cve.circl.lu/cve/CVE-2023-35349
CVE-2023-36416,2.7,Microsoft,Microsoft Dynamics 365 (on-premises) Cross-site Scripting Vulnerability,2023-10-13T17:20:48.610,https://cve.circl.lu/cve/CVE-2023-36416
CVE-2023-36417,5.9,Microsoft,Microsoft SQL OLE DB Remote Code Execution Vulnerability,2023-10-13T21:15:51.493,https://cve.circl.lu/cve/CVE-2023-36417
CVE-2023-36420,5.9,Microsoft,Microsoft ODBC Driver for SQL Server Remote Code Execution Vulnerability,2023-10-13T18:01:16.057,https://cve.circl.lu/cve/CVE-2023-36420
CVE-2023-40442,1.4,MacOS,"A privacy issue was addressed with improved private data redaction for log entries. This issue is fixed in macOS Big Sur 11.7.9, iOS 15.7.8 and iPadOS 15.7.8, macOS Monterey 12.6.8. An app may be able to read sensitive location information.",2023-10-13T02:04:25.183,https://cve.circl.lu/cve/CVE-2023-40442
CVE-2023-41991,3.6,MacOS,"A certificate validation issue was addressed. This issue is fixed in macOS Ventura 13.6, iOS 16.7 and iPadOS 16.7. A malicious app may be able to bypass signature validation. Apple is aware of a report that this issue may have been actively exploited against versions of iOS before iOS 16.7.",2023-10-12T02:45:00.457,https://cve.circl.lu/cve/CVE-2023-41991
CVE-2023-41992,5.9,MacOS,"The issue was addressed with improved checks. This issue is fixed in macOS Monterey 12.7, macOS Ventura 13.6, iOS 16.7 and iPadOS 16.7. A local attacker may be able to elevate their privileges. Apple is aware of a report that this issue may have been actively exploited against versions of iOS before iOS 16.7.",2023-10-12T02:44:38.967,https://cve.circl.lu/cve/CVE-2023-41992
CVE-2023-41993,5.9,MacOS,"The issue was addressed with improved checks. This issue is fixed in Safari 17, iOS 16.7 and iPadOS 16.7, macOS Sonoma 14. Processing web content may lead to arbitrary code execution. Apple is aware of a report that this issue may have been actively exploited against versions of iOS before iOS 16.7.",2023-10-13T02:15:09.717,https://cve.circl.lu/cve/CVE-2023-41993
CVE-2023-35990,1.4,MacOS,"The issue was addressed with improved checks. This issue is fixed in iOS 17 and iPadOS 17, watchOS 10, iOS 16.7 and iPadOS 16.7, macOS Sonoma 14. An app may be able to identify what other apps a user has installed.",2023-10-12T02:12:41.530,https://cve.circl.lu/cve/CVE-2023-35990
CVE-2023-5157,3.6,MariaDB,A vulnerability was found in MariaDB. An OpenVAS port scan on ports 3306 and 4567 allows a malicious remote client to cause a denial of service.,2023-10-13T01:15:55.990,https://cve.circl.lu/cve/CVE-2023-5157
CVE-2023-39364,2.7,Malware,"Cacti is an open source operational monitoring and fault management framework. In Cacti 1.2.24, users with console access can be redirected to an arbitrary website after a change password performed via a specifically crafted URL. The `auth_changepassword.php` file accepts `ref` as a URL parameter and reflects it in the form used to perform the change password. It's value is used to perform a redirect via `header` PHP function. A user can be tricked in performing the change password operation, e.g., via a phishing message, and then interacting with the malicious website where the redirection has been performed, e.g., downloading malwares, providing credentials, etc. This issue has been addressed in version 1.2.25. Users are advised to upgrade. There are no known workarounds for this vulnerability.",2023-10-13T04:15:12.777,https://cve.circl.lu/cve/CVE-2023-39364
CVE-2023-37939,1.4,Malware,"An exposure of sensitive information to an unauthorized actor vulnerability [CWE-200] in FortiClient for Windows 7.2.0, 7.0 all versions, 6.4 all versions, 6.2 all versions, Linux 7.2.0, 7.0 all versions, 6.4 all versions, 6.2 all versions and Mac 7.2.0 through 7.2.1, 7.0 all versions, 6.4 all versions, 6.2 all versions, may allow a local authenticated attacker with no Administrative privileges to retrieve the list of files or folders excluded from malware scanning.",2023-10-12T20:21:29.103,https://cve.circl.lu/cve/CVE-2023-37939
CVE-2023-42808,2.7,Mozilla,"Common Voice is the web app for Mozilla Common Voice, a platform for collecting speech donations in order to create public domain datasets for training voice recognition-related tools. Version 1.88.2 is vulnerable to reflected Cross-Site Scripting given that user-controlled data flows to a path expression (path of a network request). This issue may lead to reflected Cross-Site Scripting (XSS) in the context of Common Voice’s server origin. As of time of publication, it is unknown whether any patches or workarounds exist.",2023-10-10T18:31:06.820,https://cve.circl.lu/cve/CVE-2023-42808
CVE-2021-1052,5.9,NVIDIA,"NVIDIA GPU Display Driver for Windows and Linux, all versions, contains a vulnerability in the kernel mode layer (nvlddmkm.sys) handler for DxgkDdiEscape or IOCTL in which user-mode clients can access legacy privileged APIs, which may lead to denial of service, escalation of privileges, and information disclosure.",2023-10-13T01:31:57.123,https://cve.circl.lu/cve/CVE-2021-1052
CVE-2021-1053,3.6,NVIDIA,"NVIDIA GPU Display Driver for Windows and Linux, all versions, contains a vulnerability in the kernel mode layer (nvlddmkm.sys) handler for DxgkDdiEscape or IOCTL in which improper validation of a user pointer may lead to denial of service.",2023-10-13T01:36:20.580,https://cve.circl.lu/cve/CVE-2021-1053
CVE-2021-1056,5.2,NVIDIA,"NVIDIA GPU Display Driver for Linux, all versions, contains a vulnerability in the kernel mode layer (nvidia.ko) in which it does not completely honor operating system file system permissions to provide GPU device-level isolation, which may lead to denial of service or information disclosure.",2023-10-13T01:34:52.057,https://cve.circl.lu/cve/CVE-2021-1056
CVE-2021-1076,5.9,NVIDIA,"NVIDIA GPU Display Driver for Windows and Linux, all versions, contains a vulnerability in the kernel mode layer (nvlddmkm.sys or nvidia.ko) where improper access control may lead to denial of service, information disclosure, or data corruption.",2023-10-13T01:25:30.713,https://cve.circl.lu/cve/CVE-2021-1076
CVE-2021-1077,3.6,NVIDIA,"NVIDIA GPU Display Driver for Windows and Linux, R450 and R460 driver branch, contains a vulnerability where the software uses a reference count to manage a resource that is incorrectly updated, which may lead to denial of service.",2023-10-13T01:38:09.807,https://cve.circl.lu/cve/CVE-2021-1077
CVE-2023-39960,1.4,Nextcloud,"Nextcloud Server provides data storage for Nextcloud, an open source cloud platform. In Nextcloud Server starting with 25.0.0 and prior to 25.09 and 26.04; as well as Nextcloud Enterprise Server starting with 22.0.0 and prior to 22.2.10.14, 23.0.12.9, 24.0.12.5, 25.0.9, and 26.0.4; missing protection allows an attacker to brute force passwords on the WebDAV API. Nextcloud Server 25.0.9 and 26.0.4 and Nextcloud Enterprise Server 22.2.10.14, 23.0.12.9, 24.0.12.5, 25.0.9, and 26.0.4 contain patches for this issue. No known workarounds are available.",2023-10-13T13:46:47.010,https://cve.circl.lu/cve/CVE-2023-39960
CVE-2023-45132,5.2,Nginx,"NAXSI is an open-source maintenance web application firewall (WAF) for NGINX. An issue present starting in version 1.3 and prior to version 1.6 allows someone to bypass the WAF when a malicious `X-Forwarded-For` IP matches `IgnoreIP` `IgnoreCIDR` rules. This old code was arranged to allow older NGINX versions to also support `IgnoreIP` `IgnoreCIDR` when multiple reverse proxies were present. The issue is patched in version 1.6. As a workaround, do not set any `IgnoreIP` `IgnoreCIDR` for older versions.",2023-10-11T22:13:59.567,https://cve.circl.lu/cve/CVE-2023-45132
CVE-2023-45143,3.4,Node.js,"Undici is an HTTP/1.1 client written from scratch for Node.js. Prior to version 5.26.2, Undici already cleared Authorization headers on cross-origin redirects, but did not clear `Cookie` headers. By design, `cookie` headers are forbidden request headers, disallowing them to be set in RequestInit.headers in browser environments. Since undici handles headers more liberally than the spec, there was a disconnect from the assumptions the spec made, and undici's implementation of fetch. As such this may lead to accidental leakage of cookie to a third-party site or a malicious attacker who can control the redirection target (ie. an open redirector) to leak the cookie to the third party site. This was patched in version 5.26.2. There are no known workarounds.",2023-10-12T19:42:47.127,https://cve.circl.lu/cve/CVE-2023-45143
CVE-2019-5638,5.8,Nexpose,"Rapid7 Nexpose versions 6.5.50 and prior suffer from insufficient session expiration when an administrator performs a security relevant edit on an existing, logged on user. For example, if a user's password is changed by an administrator due to an otherwise unrelated credential leak, that user account's current session is still valid after the password change, potentially allowing the attacker who originally compromised the credential to remain logged in and able to cause further damage.",2023-10-09T16:15:10.183,https://cve.circl.lu/cve/CVE-2019-5638
CVE-2019-5640,1.4,Nexpose,"Rapid7 Nexpose versions prior to 6.6.114 suffer from an information exposure issue whereby, when the user's session has ended due to inactivity, an attacker can use the inspect element browser feature to remove the login panel and view the details available in the last webpage visited by previous user",2023-10-10T11:15:10.007,https://cve.circl.lu/cve/CVE-2019-5640
CVE-2022-25852,3.6,NPM,"All versions of package pg-native; all versions of package libpq are vulnerable to Denial of Service (DoS) when the addons attempt to cast the second argument to an array and fail. This happens for every non-array argument passed. **Note:** pg-native is a mere binding to npm's libpq library, which in turn has the addons and bindings to the actual C libpq library. This means that problems found in pg-native may transitively impact npm's libpq.",2023-10-11T15:27:34.157,https://cve.circl.lu/cve/CVE-2022-25852
CVE-2021-44758,3.6,NULL Pointer,Heimdal before 7.7.1 allows attackers to cause a NULL pointer dereference in a SPNEGO acceptor via a preferred_mech_type of GSS_C_NO_OID and a nonzero initial_response value to send_accept.,2023-10-08T09:15:10.480,https://cve.circl.lu/cve/CVE-2021-44758
CVE-2021-40266,3.6,NULL Pointer,"FreeImage before 1.18.0, ReadPalette function in PluginTIFF.cpp is vulnerabile to null pointer dereference.",2023-10-07T04:15:10.633,https://cve.circl.lu/cve/CVE-2021-40266
CVE-2023-39351,3.6,NULL Pointer,"FreeRDP is a free implementation of the Remote Desktop Protocol (RDP), released under the Apache license. Affected versions of FreeRDP are subject to a Null Pointer Dereference leading a crash in the RemoteFX (rfx) handling.  Inside the `rfx_process_message_tileset` function, the program allocates tiles using `rfx_allocate_tiles` for the number of numTiles. If the initialization process of tiles is not completed for various reasons, tiles will have a NULL pointer. Which may be accessed in further processing and would cause a program crash. This issue has been addressed in versions 2.11.0 and 3.0.0-beta3. Users are advised to upgrade. There are no known workarounds for this vulnerability.",2023-10-07T21:15:15.470,https://cve.circl.lu/cve/CVE-2023-39351
