CVE,"Impact Score (1-10, 10 being the worst)",Keyword,Description,Last Modified,Link
CVE-2023-20860,3.6,.NET Framework,"Spring Framework running version 6.0.0 - 6.0.6 or 5.3.0 - 5.3.25 using ""**"" as a pattern in Spring Security configuration with the mvcRequestMatcher creates a mismatch in pattern matching between Spring Security and Spring MVC, and the potential for a security bypass.",2023-05-05T20:15:10.053,https://cve.circl.lu/cve/CVE-2023-20860
CVE-2021-37231,3.6,ADX,A stack-buffer-overflow occurs in Atomicparsley 20210124.204813.840499f through APar_readX() in src/util.cpp while parsing a crafted mp4 file because of the missing boundary check.,2023-05-03T11:15:10.593,https://cve.circl.lu/cve/CVE-2021-37231
CVE-2021-33974,5.9,AWS,"Qihoo 360 (https://www.360.cn/) Qihoo 360 Safeguard (https://www.360.cn/) Qihoo 360 Chrome (https://browser.360.cn/ee/) is affected by: Buffer Overflow. The impact is: execute arbitrary code (remote). The component is: This is a set of vulnerabilities affecting popular software, and the installation packages correspond to versions ""360 Safeguard(12.1.0.1004,12.1.0.1005,13.1.0.1001)"" , ""360 Total Security(10.8.0.1060,10.8.0.1213)"", ""360 Safe Browser & 360 Chrome(12. The attack vector is: On the browser vulnerability, just open a link to complete the vulnerability exploitation remotely; on the client software, you need to locally execute the vulnerability exploitation program, which of course can be achieved with the full chain of browser vulnerability. ¶¶ This is a set of the most serious vulnerabilities that exist on Qihoo 360's PC client multiple popular software, remote vulnerabilities can be accomplished by opening a link to arbitrary code execution on both security browsers, in conjunction with the exploitation of local vulnerabilities that allow spyware to persist without being scanned to permanently reside on the target PC computer (because local vulnerabilities target Qihoo 360 company's antivirus software kernel flaws); this set of remote and local vulnerabilities in perfect coordination, to achieve an information security fallacy, on Qihoo 360's antivirus software vulnerability, not only can not be scanned out of the virus, but will help the virus persistently control the target computer, while Qihoo 360 claims to be a secure browser, which exists in the kernel vulnerability but help the composition of the remote vulnerability.(Security expert ""Memory Corruptor"" have reported this set of vulnerabilities to the corresponding vendor, all vulnerabilities have been fixed and the vendor rewarded thousands of dollars to this security expert)",2023-05-01T19:18:49.340,https://cve.circl.lu/cve/CVE-2021-33974
CVE-2021-33971,5.9,AWS,"Qihoo 360 (https://www.360.cn/) Qihoo 360 Safeguard (https://www.360.cn/) Qihoo 360 Total Security (http://www.360totalsecurity.com/) is affected by: Buffer Overflow. The impact is: execute arbitrary code (local). The component is: This is a set of vulnerabilities affecting popular software, ""360 Safeguard(12.1.0.1004,12.1.0.1005,13.1.0.1001)"" , ""360 Total Security(10.8.0.1060,10.8.0.1213)"", ""360 Safe Browser & 360 Chrome(13.0.2170.0)"". The attack vector is: On the browser vulnerability, just open a link to complete the vulnerability exploitation remotely; on the client software, you need to locally execute the vulnerability exploitation program, which of course can be achieved with the full chain of browser vulnerability. ¶¶ This is a set of the most serious vulnerabilities that exist on Qihoo 360's PC client a variety of popular software, remote vulnerabilities can be completed by opening a link to arbitrary code execution on both security browsers, with the use of local vulnerabilities, not only help the vulnerability code constitutes an escalation of privileges, er can make the spyware persistent without being scanned permanently resides on the target PC computer (because local vulnerability against Qihoo 360 company's antivirus kernel flaws); this group of remote and local vulnerability of the perfect match, to achieve an information security fallacy, in Qihoo 360's antivirus vulnerability, not only can not be scanned out of the virus, but will help the virus persistently control the target computer, while Qihoo 360 claims to be a safe browser, which exists in the kernel vulnerability but helped the composition of the remote vulnerability. (Security expert ""Memory Corruptor"" have reported this set of vulnerabilities to the corresponding vendor, all vulnerabilities have been fixed and the vendor rewarded thousands of dollars to the security experts)",2023-05-04T13:42:40.960,https://cve.circl.lu/cve/CVE-2021-33971
CVE-2023-30549,5.9,AWS,"Apptainer is an open source container platform for Linux. There is an ext4 use-after-free flaw that is exploitable through versions of Apptainer < 1.1.0, installations that include apptainer-suid < 1.1.8, and all versions of Singularity in their default configurations on older operating systems where that CVE has not been patched. That includes Red Hat Enterprise Linux 7, Debian 10 buster (unless the linux-5.10 package is installed), Ubuntu 18.04 bionic and Ubuntu 20.04 focal. Use-after-free flaws in the kernel can be used to attack the kernel for denial of service and potentially for privilege escalation.Apptainer 1.1.8 includes a patch that by default disables mounting of extfs filesystem types in setuid-root mode, while continuing to allow mounting of extfs filesystems in non-setuid ""rootless"" mode using fuse2fs.Some workarounds are possible. Either do not install apptainer-suid (for versions 1.1.0 through 1.1.7) or set `allow setuid = no` in apptainer.conf (or singularity.conf for singularity versions).  This requires having unprivileged user namespaces enabled and except for apptainer 1.1.x versions will disallow mounting of sif files, extfs files, and squashfs files in addition to other, less significant impacts.  (Encrypted sif files are also not supported unprivileged in apptainer 1.1.x.). Alternatively, use the `limit containers` options in apptainer.conf/singularity.conf to limit sif files to trusted users, groups, and/or paths, and set `allow container extfs = no` to disallow mounting of extfs overlay files.  The latter option by itself does not disallow mounting of extfs overlay partitions inside SIF files, so that's why the former options are also needed.",2023-05-05T16:43:37.560,https://cve.circl.lu/cve/CVE-2023-30549
CVE-2023-27892,3.6,AWS,"Insufficient length checks in the ShapeShift KeepKey hardware wallet firmware before 7.7.0 allow a global buffer overflow via crafted messages. Flaws in cf_confirmExecTx() in ethereum_contracts.c can be used to reveal arbitrary microcontroller memory on the device screen or crash the device. With physical access to a PIN-unlocked device, attackers can extract the BIP39 mnemonic secret from the hardware wallet.",2023-05-03T10:33:46.147,https://cve.circl.lu/cve/CVE-2023-27892
CVE-2015-5122,10.0,Adobe,"Use-after-free vulnerability in the DisplayObject class in the ActionScript 3 (AS3) implementation in Adobe Flash Player 13.x through 13.0.0.302 on Windows and OS X, 14.x through 18.0.0.203 on Windows and OS X, 11.x through 11.2.202.481 on Linux, and 12.x through 18.0.0.204 on Linux Chrome installations allows remote attackers to execute arbitrary code or cause a denial of service (memory corruption) via crafted Flash content that leverages improper handling of the opaqueBackground property, as exploited in the wild in July 2015.",2023-05-08T13:29:02.290,https://cve.circl.lu/cve/CVE-2015-5122
CVE-2015-8652,5.9,Adobe,"Adobe Flash Player before 18.0.0.268 and 19.x and 20.x before 20.0.0.228 on Windows and OS X and before 11.2.202.554 on Linux, Adobe AIR before 20.0.0.204, Adobe AIR SDK before 20.0.0.204, and Adobe AIR SDK & Compiler before 20.0.0.204 allow attackers to execute arbitrary code or cause a denial of service (out-of-bounds read and memory corruption) via crafted MPEG-4 data, a different vulnerability than CVE-2015-8045, CVE-2015-8047, CVE-2015-8060, CVE-2015-8408, CVE-2015-8416, CVE-2015-8417, CVE-2015-8418, CVE-2015-8419, CVE-2015-8443, CVE-2015-8444, CVE-2015-8451, CVE-2015-8455, CVE-2015-8654, CVE-2015-8656, CVE-2015-8657, CVE-2015-8658, and CVE-2015-8820.",2023-05-08T13:29:02.290,https://cve.circl.lu/cve/CVE-2015-8652
CVE-2015-8653,5.9,Adobe,"Use-after-free vulnerability in Adobe Flash Player before 18.0.0.268 and 19.x and 20.x before 20.0.0.228 on Windows and OS X and before 11.2.202.554 on Linux, Adobe AIR before 20.0.0.204, Adobe AIR SDK before 20.0.0.204, and Adobe AIR SDK & Compiler before 20.0.0.204 allows attackers to execute arbitrary code via crafted MPEG-4 data, a different vulnerability than CVE-2015-8048, CVE-2015-8049, CVE-2015-8050, CVE-2015-8055, CVE-2015-8056, CVE-2015-8057, CVE-2015-8058, CVE-2015-8059, CVE-2015-8061, CVE-2015-8062, CVE-2015-8063, CVE-2015-8064, CVE-2015-8065, CVE-2015-8066, CVE-2015-8067, CVE-2015-8068, CVE-2015-8069, CVE-2015-8070, CVE-2015-8071, CVE-2015-8401, CVE-2015-8402, CVE-2015-8403, CVE-2015-8404, CVE-2015-8405, CVE-2015-8406, CVE-2015-8410, CVE-2015-8411, CVE-2015-8412, CVE-2015-8413, CVE-2015-8414, CVE-2015-8420, CVE-2015-8421, CVE-2015-8422, CVE-2015-8423, CVE-2015-8424, CVE-2015-8425, CVE-2015-8426, CVE-2015-8427, CVE-2015-8428, CVE-2015-8429, CVE-2015-8430, CVE-2015-8431, CVE-2015-8432, CVE-2015-8433, CVE-2015-8434, CVE-2015-8435, CVE-2015-8436, CVE-2015-8437, CVE-2015-8441, CVE-2015-8442, CVE-2015-8447, CVE-2015-8448, CVE-2015-8449, CVE-2015-8450, CVE-2015-8452, CVE-2015-8454, CVE-2015-8655, CVE-2015-8821, and CVE-2015-8822.",2023-05-08T13:29:02.290,https://cve.circl.lu/cve/CVE-2015-8653
CVE-2015-8654,5.9,Adobe,"Adobe Flash Player before 18.0.0.268 and 19.x and 20.x before 20.0.0.228 on Windows and OS X and before 11.2.202.554 on Linux, Adobe AIR before 20.0.0.204, Adobe AIR SDK before 20.0.0.204, and Adobe AIR SDK & Compiler before 20.0.0.204 allow attackers to execute arbitrary code or cause a denial of service (out-of-bounds read and memory corruption) via crafted MPEG-4 data, a different vulnerability than CVE-2015-8045, CVE-2015-8047, CVE-2015-8060, CVE-2015-8408, CVE-2015-8416, CVE-2015-8417, CVE-2015-8418, CVE-2015-8419, CVE-2015-8443, CVE-2015-8444, CVE-2015-8451, CVE-2015-8455, CVE-2015-8652, CVE-2015-8656, CVE-2015-8657, CVE-2015-8658, and CVE-2015-8820.",2023-05-08T13:29:02.290,https://cve.circl.lu/cve/CVE-2015-8654
CVE-2015-8655,5.9,Adobe,"Use-after-free vulnerability in Adobe Flash Player before 18.0.0.268 and 19.x and 20.x before 20.0.0.228 on Windows and OS X and before 11.2.202.554 on Linux, Adobe AIR before 20.0.0.204, Adobe AIR SDK before 20.0.0.204, and Adobe AIR SDK & Compiler before 20.0.0.204 allows attackers to execute arbitrary code via crafted MPEG-4 data, a different vulnerability than CVE-2015-8048, CVE-2015-8049, CVE-2015-8050, CVE-2015-8055, CVE-2015-8056, CVE-2015-8057, CVE-2015-8058, CVE-2015-8059, CVE-2015-8061, CVE-2015-8062, CVE-2015-8063, CVE-2015-8064, CVE-2015-8065, CVE-2015-8066, CVE-2015-8067, CVE-2015-8068, CVE-2015-8069, CVE-2015-8070, CVE-2015-8071, CVE-2015-8401, CVE-2015-8402, CVE-2015-8403, CVE-2015-8404, CVE-2015-8405, CVE-2015-8406, CVE-2015-8410, CVE-2015-8411, CVE-2015-8412, CVE-2015-8413, CVE-2015-8414, CVE-2015-8420, CVE-2015-8421, CVE-2015-8422, CVE-2015-8423, CVE-2015-8424, CVE-2015-8425, CVE-2015-8426, CVE-2015-8427, CVE-2015-8428, CVE-2015-8429, CVE-2015-8430, CVE-2015-8431, CVE-2015-8432, CVE-2015-8433, CVE-2015-8434, CVE-2015-8435, CVE-2015-8436, CVE-2015-8437, CVE-2015-8441, CVE-2015-8442, CVE-2015-8447, CVE-2015-8448, CVE-2015-8449, CVE-2015-8450, CVE-2015-8452, CVE-2015-8454, CVE-2015-8653, CVE-2015-8821, and CVE-2015-8822.",2023-05-08T13:29:02.290,https://cve.circl.lu/cve/CVE-2015-8655
CVE-2023-29247,NA,Airflow,Task instance details page in the UI is vulnerable to a stored XSS.This issue affects Apache Airflow: before 2.6.0.,2023-05-08T12:50:24.320,https://cve.circl.lu/cve/CVE-2023-29247
CVE-2023-25754,NA,Airflow,Privilege Context Switching Error vulnerability in Apache Software Foundation Apache Airflow.This issue affects Apache Airflow: before 2.6.0.,2023-05-08T15:15:10.830,https://cve.circl.lu/cve/CVE-2023-25754
CVE-2023-1383,2.5,Amazon,An Improper Enforcement of Behavioral Workflow vulnerability in the exchangeDeviceServices function on the amzn.dmgr service allowed an attacker to register services that are only locally accessible.This issue affects:Amazon Fire TV Stick 3rd gen versions prior to 6.2.9.5. Insignia TV with FireOS versions prior to 7.6.3.3.,2023-05-03T14:41:00.093,https://cve.circl.lu/cve/CVE-2023-1383
CVE-2023-1384,1.4,Amazon,"The setMediaSource function on the amzn.thin.pl service does not sanitize the ""source"" parameter allowing for arbitrary javascript code to be runThis issue affects:Amazon Fire TV Stick 3rd gen versions prior to 6.2.9.5.Insignia TV with FireOS versions prior to 7.6.3.3.",2023-05-03T14:41:00.093,https://cve.circl.lu/cve/CVE-2023-1384
CVE-2023-1385,4.2,Amazon,"Improper JPAKE implementation allows offline PIN brute-forcing due to the initialization of random values to a known value, which leads to unauthorized authentication to amzn.lightning services.This issue affects:Amazon Fire TV Stick 3rd gen versions prior to 6.2.9.5.Insignia TV with FireOS 7.6.3.3.",2023-05-03T14:41:00.093,https://cve.circl.lu/cve/CVE-2023-1385
CVE-2022-33891,5.9,Apache,"The Apache Spark UI offers the possibility to enable ACLs via the configuration option spark.acls.enable. With an authentication filter, this checks whether a user has access permissions to view or modify the application. If ACLs are enabled, a code path in HttpSecurityFilter can allow someone to perform impersonation by providing an arbitrary user name. A malicious user might then be able to reach a permission check function that will ultimately build a Unix shell command based on their input, and execute it. This will result in arbitrary shell command execution as the user Spark is currently running as. This affects Apache Spark versions 3.0.3 and earlier, versions 3.1.1 to 3.1.2, and versions 3.2.0 to 3.2.1.",2023-05-02T15:15:23.457,https://cve.circl.lu/cve/CVE-2022-33891
CVE-2022-34169,3.6,Apache,The Apache Xalan Java XSLT library is vulnerable to an integer truncation issue when processing malicious XSLT stylesheets. This can be used to corrupt Java class files generated by the internal XSLTC compiler and execute arbitrary Java bytecode. Users are recommended to update to version 2.7.3 or later. Note: Java runtimes (such as OpenJDK) include repackaged copies of Xalan.,2023-05-05T08:15:08.767,https://cve.circl.lu/cve/CVE-2022-34169
CVE-2022-22728,3.6,Apache,A flaw in Apache libapreq2 versions 2.16 and earlier could cause a buffer overflow while processing multipart form uploads. A remote attacker could send a request causing a process crash which could lead to a denial of service attack.,2023-05-03T12:15:39.470,https://cve.circl.lu/cve/CVE-2022-22728
CVE-2023-26464,3.6,Apache,"** UNSUPPORTED WHEN ASSIGNED **When using the Chainsaw or SocketAppender components with Log4j 1.x on JRE less than 1.7, an attacker that manages to cause a logging entry involving a specially-crafted (ie, deeply nested) hashmap or hashtable (depending on which logging component is in use) to be processed could exhaust the available memory in the virtual machine and achieve Denial of Service when the object is deserialized.This issue affects Apache Log4j before 2. Affected users are recommended to update to Log4j 2.x.NOTE: This vulnerability only affects products that are no longer supported by the maintainer.",2023-05-05T20:15:10.253,https://cve.circl.lu/cve/CVE-2023-26464
CVE-2022-46302,6.0,Apache,"Broad access controls could allow site users to directly interact with the system Apache installation when providing the reverse proxy configurations for Tribe29's Checkmk <= 2.1.0p6, Checkmk <= 2.0.0p27, and all versions of Checkmk 1.6.0 (EOL) allowing an attacker to perform remote code execution with root privileges on the underlying host.",2023-05-04T18:32:15.130,https://cve.circl.lu/cve/CVE-2022-46302
CVE-2022-27146,3.6,Apple,GPAC mp4box 1.1.0-DEV-rev1759-geb2d1e6dd-has a heap-buffer-overflow vulnerability in function gf_isom_apple_enum_tag.,2023-05-05T19:44:29.047,https://cve.circl.lu/cve/CVE-2022-27146
CVE-2022-1381,5.9,Apple,"global heap buffer overflow in skip_range in GitHub repository vim/vim prior to 8.2.4763. This vulnerability is capable of crashing software, Bypass Protection Mechanism, Modify Memory, and possible remote execution",2023-05-03T12:15:17.950,https://cve.circl.lu/cve/CVE-2022-1381
CVE-2022-1420,3.6,Apple,Use of Out-of-range Pointer Offset in GitHub repository vim/vim prior to 8.2.4774.,2023-05-03T12:15:18.083,https://cve.circl.lu/cve/CVE-2022-1420
CVE-2022-1616,5.9,Apple,"Use after free in append_command in GitHub repository vim/vim prior to 8.2.4895. This vulnerability is capable of crashing software, Bypass Protection Mechanism, Modify Memory, and possible remote execution",2023-05-03T12:15:19.217,https://cve.circl.lu/cve/CVE-2022-1616
CVE-2022-1619,5.9,Apple,"Heap-based Buffer Overflow in function cmdline_erase_chars in GitHub repository vim/vim prior to 8.2.4899. This vulnerabilities are capable of crashing software, modify memory, and possible remote execution",2023-05-03T12:15:19.350,https://cve.circl.lu/cve/CVE-2022-1619
CVE-2023-22779,5.9,Aruba,There are buffer overflow vulnerabilities in multiple underlying services that could lead to unauthenticated remote code execution by sending specially crafted packets destined to the PAPI (Aruba's access point management protocol) UDP port (8211). Successful exploitation of these vulnerabilities result in the ability to execute arbitrary code as a privileged user on the underlying operating system.,2023-05-08T16:35:01.700,https://cve.circl.lu/cve/CVE-2023-22779
CVE-2023-22780,5.9,Aruba,There are buffer overflow vulnerabilities in multiple underlying services that could lead to unauthenticated remote code execution by sending specially crafted packets destined to the PAPI (Aruba's access point management protocol) UDP port (8211). Successful exploitation of these vulnerabilities result in the ability to execute arbitrary code as a privileged user on the underlying operating system.,2023-05-08T16:35:01.700,https://cve.circl.lu/cve/CVE-2023-22780
CVE-2023-22781,5.9,Aruba,There are buffer overflow vulnerabilities in multiple underlying services that could lead to unauthenticated remote code execution by sending specially crafted packets destined to the PAPI (Aruba's access point management protocol) UDP port (8211). Successful exploitation of these vulnerabilities result in the ability to execute arbitrary code as a privileged user on the underlying operating system.,2023-05-08T16:35:01.700,https://cve.circl.lu/cve/CVE-2023-22781
CVE-2023-22782,5.9,Aruba,There are buffer overflow vulnerabilities in multiple underlying services that could lead to unauthenticated remote code execution by sending specially crafted packets destined to the PAPI (Aruba's access point management protocol) UDP port (8211). Successful exploitation of these vulnerabilities result in the ability to execute arbitrary code as a privileged user on the underlying operating system.,2023-05-08T16:35:01.700,https://cve.circl.lu/cve/CVE-2023-22782
CVE-2023-22783,5.9,Aruba,There are buffer overflow vulnerabilities in multiple underlying services that could lead to unauthenticated remote code execution by sending specially crafted packets destined to the PAPI (Aruba's access point management protocol) UDP port (8211). Successful exploitation of these vulnerabilities result in the ability to execute arbitrary code as a privileged user on the underlying operating system.,2023-05-08T16:35:01.700,https://cve.circl.lu/cve/CVE-2023-22783
CVE-2023-22503,1.4,Atlassian,"Affected versions of Atlassian Confluence Server and Data Center allow anonymous remote attackers to view the names of attachments and labels in a private Confluence space. This occurs via an Information Disclosure vulnerability in the macro preview feature.This vulnerability was reported by Rojan Rijal of the Tinder Security Engineering team.The affected versions are before version 7.13.15, from version 7.14.0 before 7.19.7, and from version 7.20.0 before 8.2.0.",2023-05-01T20:07:26.670,https://cve.circl.lu/cve/CVE-2023-22503
CVE-2023-28697,5.9,Azure,Moxa MiiNePort E1 has a vulnerability of insufficient access control. An unauthenticated remote user can exploit this vulnerability to perform arbitrary system operation or disrupt service.,2023-05-05T20:47:35.427,https://cve.circl.lu/cve/CVE-2023-28697
CVE-2021-37231,3.6,Atom,A stack-buffer-overflow occurs in Atomicparsley 20210124.204813.840499f through APar_readX() in src/util.cpp while parsing a crafted mp4 file because of the missing boundary check.,2023-05-03T11:15:10.593,https://cve.circl.lu/cve/CVE-2021-37231
CVE-2021-37232,5.9,Atom,A stack overflow vulnerability occurs in Atomicparsley 20210124.204813.840499f through APar_read64() in src/util.cpp due to the lack of buffer size of uint32_buffer while reading more bytes in APar_read64.,2023-05-03T11:15:10.707,https://cve.circl.lu/cve/CVE-2021-37232
CVE-2023-32235,NA,Active Directory,Ghost before 5.42.1 allows remote attackers to read arbitrary files within the active theme's folder via /assets/built%2F..%2F..%2F/ directory traversal. This occurs in frontend/web/middleware/static-theme.js.,2023-05-05T13:33:53.507,https://cve.circl.lu/cve/CVE-2023-32235
CVE-2022-4118,NA,Bitcoin,"The Bitcoin / AltCoin Payment Gateway for WooCommerce & Multivendor store / shop WordPress plugin through 1.7.1 does not properly sanitise and escape a parameter before using it in a SQL statement, leading to a SQL injection exploitable by authenticated users",2023-05-08T14:17:28.107,https://cve.circl.lu/cve/CVE-2022-4118
CVE-2023-27495,3.6,CSRF,"@fastify/csrf-protection is a plugin which helps protect Fastify servers against CSRF attacks. The CSRF protection enforced by the @fastify/csrf-protection library in combination with @fastify/cookie can be bypassed from network and same-site attackers under certain conditions. @fastify/csrf-protection supports an optional userInfo parameter that binds the CSRF token to the user. This parameter has been introduced to prevent cookie-tossing attacks as a fix for CVE-2021-29624. Whenever userInfo parameter is missing, or its value can be predicted for the target user account, network and same-site attackers can 1. fixate a _csrf cookie in the victim's browser, and 2. forge CSRF tokens that are valid for the victim's session. This allows attackers to bypass the CSRF protection mechanism. As a fix, @fastify/csrf-protection starting from version 6.3.0 (and v4.1.0) includes a server-defined secret hmacKey that cryptographically binds the CSRF token to the value of the _csrf cookie and the userInfo parameter, making tokens non-spoofable by attackers. This protection is effective as long as the userInfo parameter is unique for each user. This is patched in versions 6.3.0 and v4.1.0. Users are advised to upgrade. Users unable to upgrade may use a random, non-predictable userInfo parameter for each user as a mitigation.",2023-05-02T02:07:27.720,https://cve.circl.lu/cve/CVE-2023-27495
CVE-2023-2228,5.9,CSRF,Cross-Site Request Forgery (CSRF) in GitHub repository modoboa/modoboa prior to 2.1.0.,2023-05-03T14:55:49.147,https://cve.circl.lu/cve/CVE-2023-2228
CVE-2023-29020,3.6,CSRF,"@fastify/passport is a port of passport authentication library for the Fastify ecosystem. The CSRF (Cross-Site Request Forger) protection enforced by the `@fastify/csrf-protection` library, when combined with `@fastify/passport` in affected versions, can be bypassed by network and same-site attackers. `fastify/csrf-protection` implements the synchronizer token pattern (using plugins `@fastify/session` and `@fastify/secure-session`) by storing a random value used for CSRF token generation in the `_csrf` attribute of a user's session. The `@fastify/passport` library does not clear the session object upon authentication, preserving the `_csrf` attribute between pre-login and authenticated sessions. Consequently, CSRF tokens generated before authentication are still valid. Network and same-site attackers can thus obtain a CSRF token for their pre-session, fixate that pre-session in the victim's browser via cookie tossing, and then perform a CSRF attack after the victim authenticates. As a solution, newer versions of `@fastify/passport` include the configuration options: `clearSessionOnLogin (default: true)` and `clearSessionIgnoreFields (default: ['passport', 'session'])` to clear all the session attributes by default, preserving those explicitly defined in `clearSessionIgnoreFields`.",2023-05-03T14:42:00.337,https://cve.circl.lu/cve/CVE-2023-29020
CVE-2023-22686,5.9,CSRF,Cross-Site Request Forgery (CSRF) vulnerability in TriniTronic Nice PayPal Button Lite plugin <= 1.3.5 versions.,2023-05-02T17:16:41.387,https://cve.circl.lu/cve/CVE-2023-22686
CVE-2023-31061,5.9,CSRF,Repetier Server through 1.4.10 does not have CSRF protection.,2023-05-02T18:17:03.750,https://cve.circl.lu/cve/CVE-2023-31061
