CVE,"Impact Score (1-10, 10 being the worst)",Keyword,Description,Last Modified,Link
CVE-2022-22298,5.9,Fortinet,"A improper neutralization of special elements used in an os command ('os command injection') in Fortinet FortiIsolator version 1.0.0, FortiIsolator version 1.1.0, FortiIsolator version 1.2.0 through 1.2.2, FortiIsolator version 2.0.0 through 2.0.1, FortiIsolator version 2.1.0 through 2.1.2, FortiIsolator version 2.2.0, FortiIsolator version 2.3.0 through 2.3.4 allows attacker to execute arbitrary OS commands in the underlying shell via specially crafted input parameters.",2023-10-12T19:57:10.977,https://cve.circl.lu/cve/CVE-2022-22298
CVE-2023-25604,3.6,Fortinet,An insertion of sensitive information into log file vulnerability in Fortinet FortiGuest 1.0.0 allows a local attacker to access plaintext passwords in the RADIUS logs.,2023-10-12T20:23:02.177,https://cve.circl.lu/cve/CVE-2023-25604
CVE-2023-33301,1.4,Fortinet,An improper access control vulnerability in Fortinet FortiOS 7.2.0 - 7.2.4 and 7.4.0 allows an attacker to access a restricted resource from a non trusted host.,2023-10-13T15:44:04.660,https://cve.circl.lu/cve/CVE-2023-33301
CVE-2023-34985,5.9,Fortinet,A improper neutralization of special elements used in an os command ('os command injection') in Fortinet FortiWLM version 8.6.0 through 8.6.5 and 8.5.0 through 8.5.4 allows attacker to execute unauthorized code or commands via specifically crafted HTTP get request parameters.,2023-10-11T14:28:07.943,https://cve.circl.lu/cve/CVE-2023-34985
CVE-2023-34986,5.9,Fortinet,A improper neutralization of special elements used in an os command ('os command injection') in Fortinet FortiWLM version 8.6.0 through 8.6.5 and 8.5.0 through 8.5.4 allows attacker to execute unauthorized code or commands via specifically crafted HTTP get request parameters.,2023-10-11T14:01:04.407,https://cve.circl.lu/cve/CVE-2023-34986
CVE-2023-30802,1.4,Firewall,The Sangfor Next-Gen Application Firewall version NGAF8.0.17 is vulnerable to a source code disclosure vulnerability. A remote and unauthenticated attacker can obtain PHP source code by sending an HTTP request with an invalid Content-Length field.,2023-10-13T15:00:09.473,https://cve.circl.lu/cve/CVE-2023-30802
CVE-2023-30803,5.9,Firewall,The Sangfor Next-Gen Application Firewall version NGAF8.0.17 is vulnerable to an authentication bypass vulnerability. A remote and unauthenticated attacker can bypass authentication and access administrative functionality by sending HTTP requests using a crafted Y-forwarded-for header.,2023-10-13T14:59:30.843,https://cve.circl.lu/cve/CVE-2023-30803
CVE-2023-30804,3.6,Firewall,The Sangfor Next-Gen Application Firewall version NGAF8.0.17 is vulnerable to an authenticated file disclosure vulnerability. A remote and authenticated attacker can read arbitrary system files using the svpn_html/loadfile.php endpoint. This issue is exploitable by a remote and unauthenticated attacker when paired with CVE-2023-30803.,2023-10-13T14:58:48.373,https://cve.circl.lu/cve/CVE-2023-30804
CVE-2023-30805,5.9,Firewall,"The Sangfor Next-Gen Application Firewall version NGAF8.0.17 is vulnerable to an operating system command injection vulnerability. A remote and unauthenticated attacker can execute arbitrary commands by sending a crafted HTTP POST request to the /LogInOut.php endpoint. This is due to mishandling of shell meta-characters in the ""un"" parameter.",2023-10-13T14:57:34.343,https://cve.circl.lu/cve/CVE-2023-30805
CVE-2023-30806,5.9,Firewall,The Sangfor Next-Gen Application Firewall version NGAF8.0.17 is vulnerable to an operating system command injection vulnerability. A remote and unauthenticated attacker can execute arbitrary commands by sending a crafted HTTP POST request to the /cgi-bin/login.cgi endpoint. This is due to mishandling of shell meta-characters in the PHPSESSID cookie.,2023-10-13T15:00:30.383,https://cve.circl.lu/cve/CVE-2023-30806
CVE-2023-39325,NA,Golang,"A malicious HTTP/2 client which rapidly creates requests and immediately resets them can cause excessive server resource consumption. While the total number of requests is bounded by the http2.Server.MaxConcurrentStreams setting, resetting an in-progress request allows the attacker to create a new request while the existing one is still executing. With the fix applied, HTTP/2 servers now bound the number of simultaneously executing handler goroutines to the stream concurrency limit (MaxConcurrentStreams). New requests arriving when at the limit (which can only happen after the client has reset an existing, in-flight request) will be queued until a handler exits. If the request queue grows too large, the server will terminate the connection. This issue is also fixed in golang.org/x/net/http2 for users manually configuring HTTP/2. The default stream concurrency limit is 250 streams (requests) per HTTP/2 connection. This value may be adjusted using the golang.org/x/net/http2 package; see the Server.MaxConcurrentStreams setting and the ConfigureServer function.",2023-10-12T12:59:39.183,https://cve.circl.lu/cve/CVE-2023-39325
CVE-2023-4354,5.9,Google,Heap buffer overflow in Skia in Google Chrome prior to 116.0.5845.96 allowed a remote attacker who had compromised the renderer process to potentially exploit heap corruption via a crafted HTML page. (Chromium security severity: High),2023-10-12T02:56:56.870,https://cve.circl.lu/cve/CVE-2023-4354
CVE-2023-4355,5.9,Google,Out of bounds memory access in V8 in Google Chrome prior to 116.0.5845.96 allowed a remote attacker to potentially exploit heap corruption via a crafted HTML page. (Chromium security severity: High),2023-10-13T01:01:41.827,https://cve.circl.lu/cve/CVE-2023-4355
CVE-2023-4427,5.2,Google,Out of bounds memory access in V8 in Google Chrome prior to 116.0.5845.110 allowed a remote attacker to perform an out of bounds memory read via a crafted HTML page. (Chromium security severity: High),2023-10-13T01:12:47.790,https://cve.circl.lu/cve/CVE-2023-4427
CVE-2023-4431,5.2,Google,Out of bounds memory access in Fonts in Google Chrome prior to 116.0.5845.110 allowed a remote attacker to perform an out of bounds memory read via a crafted HTML page. (Chromium security severity: Medium),2023-10-13T01:13:53.427,https://cve.circl.lu/cve/CVE-2023-4431
CVE-2023-5186,5.9,Google,Use after free in Passwords in Google Chrome prior to 117.0.5938.132 allowed a remote attacker who convinced a user to engage in specific UI interaction to potentially exploit heap corruption via crafted UI interaction. (Chromium security severity: High),2023-10-12T02:46:12.913,https://cve.circl.lu/cve/CVE-2023-5186
CVE-2023-44387,4.0,Gradle,"Gradle is a build tool with a focus on build automation and support for multi-language development. When copying or archiving symlinked files, Gradle resolves them but applies the permissions of the symlink itself instead of the permissions of the linked file to the resulting file. This leads to files having too much permissions given that symlinks usually are world readable and writeable. While it is unlikely this results in a direct vulnerability for the impacted build, it may open up attack vectors depending on where build artifacts end up being copied to or un-archived. In versions 7.6.3, 8.4 and above, Gradle will now properly use the permissions of the file pointed at by the symlink to set permissions of the copied or archived file.",2023-10-11T17:46:10.753,https://cve.circl.lu/cve/CVE-2023-44387
CVE-2023-42445,3.6,Gradle,"Gradle is a build tool with a focus on build automation and support for multi-language development. In some cases, when Gradle parses XML files, resolving XML external entities is not disabled. Combined with an Out Of Band XXE attack (OOB-XXE), just parsing XML can lead to exfiltration of local text files to a remote server. Gradle parses XML files for several purposes. Most of the time, Gradle parses XML files it generated or were already present locally. Only Ivy XML descriptors and Maven POM files can be fetched from remote repositories and parsed by Gradle. In Gradle 7.6.3 and 8.4, resolving XML external entities has been disabled for all use cases to protect against this vulnerability. Gradle will now refuse to parse XML files that have XML external entities.",2023-10-11T17:26:44.153,https://cve.circl.lu/cve/CVE-2023-42445
CVE-2023-45063,1.4,GPT,"Cross-Site Request Forgery (CSRF) vulnerability in ReCorp AI Content Writing Assistant (Content Writer, GPT 3 & 4, ChatGPT, Image Generator) All in One plugin <= 1.1.5 versions.",2023-10-12T16:08:32.337,https://cve.circl.lu/cve/CVE-2023-45063
CVE-2022-4864,2.7,GitHub,Argument Injection in GitHub repository froxlor/froxlor prior to 2.0.0-beta1.,2023-10-11T15:24:48.003,https://cve.circl.lu/cve/CVE-2022-4864
CVE-2023-0028,2.7,GitHub,Cross-site Scripting (XSS) - Stored in GitHub repository linagora/twake prior to 2023.Q1.1200+.,2023-10-10T08:15:09.673,https://cve.circl.lu/cve/CVE-2023-0028
CVE-2023-0493,5.9,GitHub,Improper Neutralization of Equivalent Special Elements in GitHub repository btcpayserver/btcpayserver prior to 1.7.5.,2023-10-10T08:15:09.813,https://cve.circl.lu/cve/CVE-2023-0493
CVE-2023-0747,2.7,GitHub,Cross-site Scripting (XSS) - Stored in GitHub repository btcpayserver/btcpayserver prior to 1.7.6.,2023-10-10T08:15:09.930,https://cve.circl.lu/cve/CVE-2023-0747
CVE-2023-0748,2.7,GitHub,Open Redirect in GitHub repository btcpayserver/btcpayserver prior to 1.7.6.,2023-10-10T08:15:10.033,https://cve.circl.lu/cve/CVE-2023-0748
CVE-2023-30910,2.7,HPE,HPE MSA Controller prior to version IN210R004 could be remotely exploited to allow inconsistent interpretation of HTTP requests. ,2023-10-13T18:42:35.140,https://cve.circl.lu/cve/CVE-2023-30910
CVE-2023-30995,3.6,IBM,IBM Aspera Faspex 4.0 through 4.4.2 and 5.0 through 5.0.5 could allow a malicious actor to bypass IP whitelist restrictions using a specially crafted HTTP request.  IBM X-Force ID:  254268.,2023-10-10T20:15:09.650,https://cve.circl.lu/cve/CVE-2023-30995
CVE-2023-35897,5.9,IBM,"IBM Spectrum Protect Client and IBM Storage Protect for Virtual Environments 8.1.0.0 through 8.1.19.0 could allow a local user to execute arbitrary code on the system using a specially crafted file, caused by a DLL hijacking flaw.  IBM X-Force ID:  259246.",2023-10-11T17:21:04.143,https://cve.circl.lu/cve/CVE-2023-35897
CVE-2023-43058,5.9,IBM,IBM Robotic Process Automation 23.0.9 is vulnerable to privilege escalation that affects ownership of projects.  IBM X-Force ID:  247527.,2023-10-10T19:24:52.810,https://cve.circl.lu/cve/CVE-2023-43058
CVE-2022-34355,3.6,IBM,"IBM Jazz Foundation (IBM Engineering Lifecycle Management 6.0.6, 6.0.6.1, 7.0, 7.0.1, and 7.0.2) could disclose sensitive version information to a user that could be used in further attacks against the system.  IBM X-Force ID:  230498.",2023-10-10T20:41:30.020,https://cve.circl.lu/cve/CVE-2022-34355
CVE-2022-33160,3.6,IBM,IBM Security Directory Suite 8.0.1 uses weaker than expected cryptographic algorithms that could allow an attacker to decrypt highly sensitive information.  IBM X-Force ID:  228568.,2023-10-10T19:33:22.613,https://cve.circl.lu/cve/CVE-2022-33160
CVE-2023-22338,3.6,Intel,Out-of-bounds read in some Intel(R) oneVPL GPU software before version 22.6.5 may allow an authenticated user to potentially enable information disclosure via local access.,2023-10-12T03:15:09.490,https://cve.circl.lu/cve/CVE-2023-22338
CVE-2023-22840,3.6,Intel,Improper neutralization in software for the Intel(R) oneVPL GPU software before version 22.6.5 may allow an authenticated user to potentially enable denial of service via local access.,2023-10-12T03:15:09.590,https://cve.circl.lu/cve/CVE-2023-22840
CVE-2023-4828,2.5,Intel,"An improper check for an exceptional condition in the Insider Threat Management (ITM) Server could be used by an attacker to change the server's configuration of any already-registered agent so that the agent sends all future communications to an attacker-chosen URL. This could result in disclosure of sensitive data events from the agent about the personally identifiable information (PII) and intellectual property it monitors, and all such data could be altered or deleted before reaching the ITM Server. An attacker must first successfully obtain valid agent credentials and agent hostname. All versions prior to 7.14.3.69 are affected.",2023-10-13T22:15:10.717,https://cve.circl.lu/cve/CVE-2023-4828
CVE-2023-42474,2.7,Intel,"SAP BusinessObjects Web Intelligence - version 420, has a URL with parameter that could be vulnerable to XSS attack. The attacker could send a malicious link to a user that would possibly allow an attacker to retrieve the sensitive information.",2023-10-11T19:14:12.600,https://cve.circl.lu/cve/CVE-2023-42474
CVE-2023-5488,5.9,Intel,A vulnerability was found in Beijing Baichuo Smart S45F Multi-Service Secure Gateway Intelligent Management Platform up to 20230928. It has been rated as critical. Affected by this issue is some unknown functionality of the file /sysmanage/updatelib.php. The manipulation of the argument file_upload leads to unrestricted upload. The attack may be launched remotely. The exploit has been disclosed to the public and may be used. The identifier of this vulnerability is VDB-241640. NOTE: The vendor was contacted early about this disclosure but did not respond in any way.,2023-10-13T13:22:54.483,https://cve.circl.lu/cve/CVE-2023-5488
CVE-2022-44757,2.5,Insight,"BigFix Insights for Vulnerability Remediation (IVR) uses weak cryptography that can lead to credential exposure.  An attacker could gain access to sensitive information, modify data in unexpected ways, etc.",2023-10-11T12:54:12.883,https://cve.circl.lu/cve/CVE-2022-44757
CVE-2022-44758,2.5,Insight,BigFix Insights/IVR fixlet uses improper credential handling within certain fixlet content.  An attacker can gain access to information that is not explicitly authorized.,2023-10-11T12:54:12.883,https://cve.circl.lu/cve/CVE-2022-44758
CVE-2023-36843,3.6,Insight,"An Improper Handling of Inconsistent Special Elements vulnerability in the Junos Services Framework (jsf) module of Juniper Networks Junos OS allows an unauthenticated network based attacker to cause a crash in the Packet Forwarding Engine (pfe) and thereby resulting in a Denial of Service (DoS).Upon receiving malformed SSL traffic, the PFE crashes. A manual restart will be needed to recover the device.This issue only affects devices with Juniper Networks Advanced Threat Prevention (ATP) Cloud enabled with Encrypted Traffic Insights (configured via ‘security-metadata-streaming policy’).This issue affects Juniper Networks Junos OS:  *  All versions prior to 20.4R3-S8, 20.4R3-S9;  *  21.1 version 21.1R1 and later versions;  *  21.2 versions prior to 21.2R3-S6;  *  21.3 versions prior to 21.3R3-S5;  *  21.4 versions prior to 21.4R3-S5;  *  22.1 versions prior to 22.1R3-S4;  *  22.2 versions prior to 22.2R3-S2;  *  22.3 versions prior to 22.3R2-S2, 22.3R3;  *  22.4 versions prior to 22.4R2-S1, 22.4R3;",2023-10-13T12:47:48.873,https://cve.circl.lu/cve/CVE-2023-36843
CVE-2022-24282,5.9,Java,"A vulnerability has been identified in SINEC NMS (All versions >= V1.0.3 < V2.0), SINEC NMS (All versions < V1.0.3), SINEMA Server V14 (All versions). The affected system allows to upload JSON objects that are deserialized to Java objects. Due to insecure deserialization of user-supplied content by the affected software, a privileged attacker could exploit this vulnerability by sending a maliciously crafted serialized Java object. This could allow the attacker to execute arbitrary code on the device with root privileges.",2023-10-10T11:15:10.177,https://cve.circl.lu/cve/CVE-2022-24282
CVE-2022-29532,2.7,Java,"An issue was discovered in MISP before 2.4.158. There is XSS in the cerebrate view if one administrator puts a javascript: URL in the URL field, and another administrator clicks on it.",2023-10-10T22:15:10.890,https://cve.circl.lu/cve/CVE-2022-29532
CVE-2023-39000,2.7,Java,A reflected cross-site scripting (XSS) vulnerability in the component /ui/diagnostics/log/core/ of OPNsense Community Edition before 23.7 and Business Edition before 23.4.2 allows attackers to inject arbitrary JavaScript via the URL path.,2023-10-10T23:15:10.240,https://cve.circl.lu/cve/CVE-2023-39000
CVE-2023-40577,2.7,Java,Alertmanager handles alerts sent by client applications such as the Prometheus server. An attacker with the permission to perform POST requests on the /api/v1/alerts endpoint could be able to execute arbitrary JavaScript code on the users of Prometheus Alertmanager. This issue has been fixed in Alertmanager version 0.2.51.,2023-10-08T12:15:36.140,https://cve.circl.lu/cve/CVE-2023-40577
CVE-2023-39366,2.7,Java,"Cacti is an open source operational monitoring and fault management framework. Affected versions are subject to a Stored Cross-Site-Scripting (XSS) Vulnerability allows an authenticated user to poison data stored in the _cacti_'s database. These data will be viewed by administrative _cacti_ accounts and execute JavaScript code in the victim's browser at view-time. The `data_sources.php` script displays the data source management information (e.g. data source path, polling configuration etc.) for different data visualizations of the _cacti_ app. CENSUS found that an adversary that is able to configure a malicious Device name, can deploy a stored XSS attack against any user of the same (or broader) privileges. A user that possesses the _General Administration>Sites/Devices/Data_ permissions can configure the device names in _cacti_. This configuration occurs through `http://<HOST>/cacti/host.php`, while the rendered malicious payload is exhibited at `http://<HOST>/cacti/data_sources.php`. This vulnerability has been addressed in version 1.2.25. Users are advised to upgrade. Users unable to update should manually filter HTML output.",2023-10-13T04:15:13.003,https://cve.circl.lu/cve/CVE-2023-39366
CVE-2022-25187,3.6,Jenkins,Jenkins Support Core Plugin 2.79 and earlier does not redact some sensitive information in the support bundle.,2023-10-10T22:15:10.237,https://cve.circl.lu/cve/CVE-2022-25187
CVE-2022-27211,3.6,Jenkins,"A missing permission check in Jenkins Kubernetes Continuous Deploy Plugin 2.3.1 and earlier allows attackers with Overall/Read permission to connect to an attacker-specified SSH server using attacker-specified credentials IDs obtained through another method, capturing credentials stored in Jenkins.",2023-10-10T22:15:10.507,https://cve.circl.lu/cve/CVE-2022-27211
CVE-2022-34180,3.6,Jenkins,"Jenkins Embeddable Build Status Plugin 2.0.3 and earlier does not correctly perform the ViewStatus permission check in the HTTP endpoint it provides for ""unprotected"" status badge access, allowing attackers without any permissions to obtain the build status badge icon for any attacker-specified job and/or build.",2023-10-10T22:15:11.043,https://cve.circl.lu/cve/CVE-2022-34180
CVE-2022-41230,1.4,Jenkins,"Jenkins Build-Publisher Plugin 1.22 and earlier does not perform a permission check in an HTTP endpoint, allowing attackers with Overall/Read permission to obtain names and URLs of Jenkins servers that the plugin is configured to publish builds to, as well as builds pending for publication to those Jenkins servers.",2023-10-10T22:15:11.177,https://cve.circl.lu/cve/CVE-2022-41230
CVE-2023-45612,5.9,JetBrains,In JetBrains Ktor before 2.3.5 default configuration of ContentNegotiation with XML format was vulnerable to XXE,2023-10-12T17:53:41.813,https://cve.circl.lu/cve/CVE-2023-45612
CVE-2023-45613,5.2,JetBrains,In JetBrains Ktor before 2.3.5 server certificates were not verified,2023-10-12T17:54:21.100,https://cve.circl.lu/cve/CVE-2023-45613
CVE-2019-0053,5.9,Juniper,"Insufficient validation of environment variables in the telnet client supplied in Junos OS can lead to stack-based buffer overflows, which can be exploited to bypass veriexec restrictions on Junos OS. A stack-based overflow is present in the handling of environment variables when connecting via the telnet client to remote telnet servers. This issue only affects the telnet client — accessible from the CLI or shell — in Junos OS. Inbound telnet services are not affected by this issue. This issue affects: Juniper Networks Junos OS: 12.3 versions prior to 12.3R12-S13; 12.3X48 versions prior to 12.3X48-D80; 14.1X53 versions prior to 14.1X53-D130, 14.1X53-D49; 15.1 versions prior to 15.1F6-S12, 15.1R7-S4; 15.1X49 versions prior to 15.1X49-D170; 15.1X53 versions prior to 15.1X53-D237, 15.1X53-D496, 15.1X53-D591, 15.1X53-D69; 16.1 versions prior to 16.1R3-S11, 16.1R7-S4; 16.2 versions prior to 16.2R2-S9; 17.1 versions prior to 17.1R3; 17.2 versions prior to 17.2R1-S8, 17.2R2-S7, 17.2R3-S1; 17.3 versions prior to 17.3R3-S4; 17.4 versions prior to 17.4R1-S6, 17.4R2-S3, 17.4R3; 18.1 versions prior to 18.1R2-S4, 18.1R3-S3; 18.2 versions prior to 18.2R1-S5, 18.2R2-S2, 18.2R3; 18.2X75 versions prior to 18.2X75-D40; 18.3 versions prior to 18.3R1-S3, 18.3R2; 18.4 versions prior to 18.4R1-S2, 18.4R2.",2023-10-08T14:15:11.083,https://cve.circl.lu/cve/CVE-2019-0053
CVE-2023-44186,3.6,Juniper,"An Improper Handling of Exceptional Conditions vulnerability in AS PATH processing of Juniper Networks Junos OS and Junos OS Evolved allows an attacker to send a BGP update message with an AS PATH containing a large number of 4-byte ASes, leading to a Denial of Service (DoS). Continued receipt and processing of these BGP updates will create a sustained Denial of Service (DoS) condition.This issue is hit when the router has Non-Stop Routing (NSR) enabled, has a non-4-byte-AS capable BGP neighbor, receives a BGP update message with a prefix that includes a long AS PATH containing large number of 4-byte ASes, and has to advertise the prefix towards the non-4-byte-AS capable BGP neighbor.This issue affects:Juniper Networks Junos OS:  *  All versions prior to 20.4R3-S8;  *  21.1 versions 21.1R1 and later;  *  21.2 versions prior to 21.2R3-S6;  *  21.3 versions prior to 21.3R3-S5;  *  21.4 versions prior to 21.4R3-S5;  *  22.1 versions prior to 22.1R3-S4;  *  22.2 versions prior to 22.2R3-S2;  *  22.3 versions prior to 22.3R2-S2, 22.3R3-S1;  *  22.4 versions prior to 22.4R2-S1, 22.4R3;  *  23.2 versions prior to 23.2R2.Juniper Networks Junos OS Evolved  *  All versions prior to 20.4R3-S8-EVO;  *  21.1 versions 21.1R1-EVO and later;  *  21.2 versions prior to 21.2R3-S6-EVO;  *  21.3 versions prior to 21.3R3-S5-EVO;  *  21.4 versions prior to 21.4R3-S5-EVO;  *  22.1 versions prior to 22.1R3-S4-EVO;  *  22.2 versions prior to 22.2R3-S2-EVO;  *  22.3 versions prior to 22.3R2-S2-EVO, 22.3R3-S1-EVO;  *  22.4 versions prior to 22.4R2-S1-EVO, 22.4R3-EVO;  *  23.2 versions prior to 23.2R2-EVO.",2023-10-11T22:13:59.567,https://cve.circl.lu/cve/CVE-2023-44186
CVE-2023-44187,4.0,Juniper,"An Exposure of Sensitive Information vulnerability in the 'file copy' command of Junos OS Evolved allows a local, authenticated attacker with shell access to view passwords supplied on the CLI command-line. These credentials can then be used to provide unauthorized access to the remote system.This issue affects Juniper Networks Junos OS Evolved:  *  All versions prior to 20.4R3-S7-EVO;  *  21.1 versions 21.1R1-EVO and later;  *  21.2 versions prior to 21.2R3-S5-EVO;  *  21.3 versions prior to 21.3R3-S4-EVO;  *  21.4 versions prior to 21.4R3-S4-EVO;  *  22.1 versions prior to 22.1R3-S2-EVO;  *  22.2 versions prior to 22.2R2-EVO.",2023-10-11T22:13:59.567,https://cve.circl.lu/cve/CVE-2023-44187
CVE-2023-44188,3.6,Juniper,"A Time-of-check Time-of-use (TOCTOU) Race Condition vulnerability in telemetry processing of Juniper Networks Junos OS allows a network-based authenticated attacker to flood the system with multiple telemetry requests, causing the Junos Kernel Debugging Streaming Daemon (jkdsd) process to crash, leading to a Denial of Service (DoS). Continued receipt and processing of telemetry requests will repeatedly crash the jkdsd process and sustain the Denial of Service (DoS) condition.This issue is seen on all Junos platforms. The crash is triggered when multiple telemetry requests come from different collectors. As the load increases, the Dynamic Rendering Daemon (drend) decides to defer processing and continue later, which results in a timing issue accessing stale memory, causing the jkdsd process to crash and restart.This issue affects:Juniper Networks Junos OS:  *  20.4 versions prior to 20.4R3-S9;  *  21.1 versions 21.1R1 and later;  *  21.2 versions prior to 21.2R3-S6;  *  21.3 versions prior to 21.3R3-S5;  *  21.4 versions prior to 21.4R3-S5;  *  22.1 versions prior to 22.1R3-S4;  *  22.2 versions prior to 22.2R3-S2;  *  22.3 versions prior to 22.3R2-S1, 22.3R3-S1;  *  22.4 versions prior to 22.4R2-S2, 22.4R3;  *  23.1 versions prior to 23.1R2;  *  23.2 versions prior to 23.2R2.This issue does not affect Juniper Networks Junos OS versions prior to 19.4R1.",2023-10-11T22:13:59.567,https://cve.circl.lu/cve/CVE-2023-44188
