CVE,"Impact Score (1-10, 10 being the worst)",Keyword,Description,Last Modified,Link
CVE-2023-22916,5.2,Firewall,"The configuration parser of Zyxel ATP series firmware versions 5.10 through 5.35, USG FLEX series firmware versions 5.00 through 5.35, USG FLEX 50(W) firmware versions 5.10 through 5.35, USG20(W)-VPN firmware versions 5.10 through 5.35, and VPN series firmware versions 5.00 through 5.35, which fails to properly sanitize user input. A remote unauthenticated attacker could leverage the vulnerability to modify device configuration data, resulting in DoS conditions on an affected device if the attacker could trick an authorized administrator to switch the management mode to the cloud mode.",2023-05-04T19:35:46.887,https://cve.circl.lu/cve/CVE-2023-22916
CVE-2023-22917,3.6,Firewall,"A buffer overflow vulnerability in the “sdwan_iface_ipc” binary of Zyxel ATP series firmware versions 5.10 through 5.32, USG FLEX series firmware versions 5.00 through 5.32, USG FLEX 50(W) firmware versions 5.10 through 5.32, USG20(W)-VPN firmware versions 5.10 through 5.32, and VPN series firmware versions 5.00 through 5.35, which could allow a remote unauthenticated attacker to cause a core dump with a request error message on a vulnerable device by uploading a crafted configuration file.",2023-05-04T13:28:13.717,https://cve.circl.lu/cve/CVE-2023-22917
CVE-2023-25012,3.6,GIS,The Linux kernel through 6.1.9 has a Use-After-Free in bigben_remove in drivers/hid/hid-bigbenff.c via a crafted USB device because the LED controllers remain registered for too long.,2023-05-03T01:15:13.827,https://cve.circl.lu/cve/CVE-2023-25012
CVE-2023-26545,3.6,GIS,"In the Linux kernel before 6.1.13, there is a double free in net/mpls/af_mpls.c upon an allocation failure (for registering the sysctl table under a new location) during the renaming of a device.",2023-05-03T14:15:32.977,https://cve.circl.lu/cve/CVE-2023-26545
CVE-2022-4744,5.9,GIS,A double-free flaw was found in the Linux kernel’s TUN/TAP device driver functionality in how a user registers the device when the register_netdevice function fails (NETDEV_REGISTER notifier). This flaw allows a local user to crash or potentially escalate their privileges on the system.,2023-05-03T14:15:15.753,https://cve.circl.lu/cve/CVE-2022-4744
CVE-2023-1872,5.9,GIS,A use-after-free vulnerability in the Linux Kernel io_uring system can be exploited to achieve local privilege escalation.The io_file_get_fixed function lacks the presence of ctx->uring_lock which can lead to a Use-After-Free vulnerability due a race condition with fixed files getting unregistered.We recommend upgrading past commit da24142b1ef9fd5d36b76e36bab328a5b27523e8.,2023-05-03T01:15:12.613,https://cve.circl.lu/cve/CVE-2023-1872
CVE-2023-2243,5.9,GIS,A vulnerability was found in SourceCodester Complaint Management System 1.0 and classified as critical. Affected by this issue is some unknown functionality of the file users/registration.php of the component POST Parameter Handler. The manipulation of the argument fullname leads to sql injection. The attack may be launched remotely. The exploit has been disclosed to the public and may be used. The identifier of this vulnerability is VDB-227228.,2023-05-02T17:20:46.443,https://cve.circl.lu/cve/CVE-2023-2243
CVE-2022-42010,3.6,GitLab,"An issue was discovered in D-Bus before 1.12.24, 1.13.x and 1.14.x before 1.14.4, and 1.15.x before 1.15.2. An authenticated attacker can cause dbus-daemon and other programs that use libdbus to crash when receiving a message with certain invalid type signatures.",2023-05-03T12:16:28.727,https://cve.circl.lu/cve/CVE-2022-42010
CVE-2022-42011,3.6,GitLab,"An issue was discovered in D-Bus before 1.12.24, 1.13.x and 1.14.x before 1.14.4, and 1.15.x before 1.15.2. An authenticated attacker can cause dbus-daemon and other programs that use libdbus to crash when receiving a message where an array length is inconsistent with the size of the element type.",2023-05-03T12:16:29.280,https://cve.circl.lu/cve/CVE-2022-42011
CVE-2022-42012,3.6,GitLab,"An issue was discovered in D-Bus before 1.12.24, 1.13.x and 1.14.x before 1.14.4, and 1.15.x before 1.15.2. An authenticated attacker can cause dbus-daemon and other programs that use libdbus to crash by sending a message with attached file descriptors in an unexpected format.",2023-05-03T12:16:29.707,https://cve.circl.lu/cve/CVE-2022-42012
CVE-2022-45062,5.9,GitLab,"In Xfce xfce4-settings before 4.16.4 and 4.17.x before 4.17.1, there is an argument injection vulnerability in xfce4-mime-helper.",2023-05-03T11:15:12.067,https://cve.circl.lu/cve/CVE-2022-45062
CVE-2023-23589,2.5,GitLab,"The SafeSocks option in Tor before 0.4.7.13 has a logic error in which the unsafe SOCKS4 protocol can be used but not the safe SOCKS4a protocol, aka TROVE-2022-002.",2023-05-03T12:16:45.917,https://cve.circl.lu/cve/CVE-2023-23589
CVE-2023-26125,3.4,Golang,"Versions of the package github.com/gin-gonic/gin before 1.9.0 are vulnerable to Improper Input Validation by allowing an attacker to use a specially crafted request via the X-Forwarded-Prefix header, potentially leading to cache poisoning.**Note:** Although this issue does not pose a significant threat on its own it can serve as an input vector for other more impactful vulnerabilities. However, successful exploitation may depend on the server configuration and whether the header is used in the application logic.",2023-05-04T13:03:05.007,https://cve.circl.lu/cve/CVE-2023-26125
CVE-2016-0959,5.9,Google,"Use after free vulnerability in Adobe Flash Player Desktop Runtime before 20.0.0.267, Adobe Flash Player Extended Support Release before 18.0.0.324, Adobe Flash Player for Google Chrome before 20.0.0.267, Adobe Flash Player for Microsoft Edge and Internet Explorer 11 before 20.0.0.267, Adobe Flash Player for Internet Explorer 10 and 11 before 20.0.0.267, Adobe Flash Player for Linux before 11.2.202.559, AIR Desktop Runtime before 20.0.0.233, AIR SDK before 20.0.0.233, AIR SDK & Compiler before 20.0.0.233, AIR for Android before 20.0.0.233.",2023-05-08T13:29:02.290,https://cve.circl.lu/cve/CVE-2016-0959
CVE-2022-0108,3.6,Google,Inappropriate implementation in Navigation in Google Chrome prior to 97.0.4692.71 allowed a remote attacker to leak cross-origin data via a crafted HTML page.,2023-05-05T17:15:09.343,https://cve.circl.lu/cve/CVE-2022-0108
CVE-2022-3723,5.9,Google,Type confusion in V8 in Google Chrome prior to 107.0.5304.87 allowed a remote attacker to potentially exploit heap corruption via a crafted HTML page. (Chromium security severity: High),2023-05-03T12:16:26.557,https://cve.circl.lu/cve/CVE-2022-3723
CVE-2022-3445,5.9,Google,Use after free in Skia in Google Chrome prior to 106.0.5249.119 allowed a remote attacker to potentially exploit heap corruption via a crafted HTML page. (Chromium security severity: High),2023-05-03T12:16:23.537,https://cve.circl.lu/cve/CVE-2022-3445
CVE-2022-3446,5.9,Google,Heap buffer overflow in WebSQL in Google Chrome prior to 106.0.5249.119 allowed a remote attacker to potentially exploit heap corruption via a crafted HTML page. (Chromium security severity: High),2023-05-03T12:16:24.030,https://cve.circl.lu/cve/CVE-2022-3446
CVE-2023-30065,NA,GPT,MitraStar GPT-2741GNAC-N2 with firmware BR_g5.9_1.11(WVK.0)b32 was discovered to contain a remote code execution (RCE) vulnerability in the ping function.,2023-05-08T02:37:45.160,https://cve.circl.lu/cve/CVE-2023-30065
CVE-2020-8597,5.9,GitHub,eap.c in pppd in ppp 2.4.2 through 2.4.8 has an rhostname buffer overflow in the eap_request and eap_response functions.,2023-05-05T17:48:17.840,https://cve.circl.lu/cve/CVE-2020-8597
CVE-2021-28363,2.5,GitHub,The urllib3 library 1.26.x before 1.26.4 for Python omits SSL certificate validation in some cases involving HTTPS to HTTPS proxies. The initial connection to the HTTPS proxy (if an SSLContext isn't given via proxy_config) doesn't verify the hostname of the certificate. This means certificates for different servers that still validate properly with the default urllib3 SSLContext will be silently accepted.,2023-05-03T11:15:10.133,https://cve.circl.lu/cve/CVE-2021-28363
CVE-2020-23930,3.6,GitHub,An issue was discovered in gpac through 20200801. A NULL pointer dereference exists in the function nhmldump_send_header located in write_nhml.c. It allows an attacker to cause Denial of Service.,2023-05-05T19:45:30.473,https://cve.circl.lu/cve/CVE-2020-23930
CVE-2021-29921,5.9,GitHub,"In Python before 3,9,5, the ipaddress library mishandles leading zero characters in the octets of an IP address string. This (in some situations) allows attackers to bypass access control that is based on IP addresses.",2023-05-03T11:15:10.457,https://cve.circl.lu/cve/CVE-2021-29921
CVE-2021-37231,3.6,GitHub,A stack-buffer-overflow occurs in Atomicparsley 20210124.204813.840499f through APar_readX() in src/util.cpp while parsing a crafted mp4 file because of the missing boundary check.,2023-05-03T11:15:10.593,https://cve.circl.lu/cve/CVE-2021-37231
CVE-2015-5122,10.0,HPE,"Use-after-free vulnerability in the DisplayObject class in the ActionScript 3 (AS3) implementation in Adobe Flash Player 13.x through 13.0.0.302 on Windows and OS X, 14.x through 18.0.0.203 on Windows and OS X, 11.x through 11.2.202.481 on Linux, and 12.x through 18.0.0.204 on Linux Chrome installations allows remote attackers to execute arbitrary code or cause a denial of service (memory corruption) via crafted Flash content that leverages improper handling of the opaqueBackground property, as exploited in the wild in July 2015.",2023-05-08T13:29:02.290,https://cve.circl.lu/cve/CVE-2015-5122
CVE-2023-28086,3.6,HPE,An HPE OneView appliance dump may expose proxy credential settings,2023-05-04T14:56:37.440,https://cve.circl.lu/cve/CVE-2023-28086
CVE-2023-28087,3.6,HPE,An HPE OneView appliance dump may expose OneView user accounts,2023-05-04T14:53:25.137,https://cve.circl.lu/cve/CVE-2023-28087
CVE-2023-28088,5.9,HPE,An HPE OneView appliance dump may expose SAN switch administrative credentials,2023-05-04T14:30:04.933,https://cve.circl.lu/cve/CVE-2023-28088
CVE-2023-28089,5.2,HPE,An HPE OneView appliance dump may expose FTP credentials for c7000 Interconnect Modules,2023-05-04T14:27:34.107,https://cve.circl.lu/cve/CVE-2023-28089
CVE-2023-24999,5.2,HashiCorp,"HashiCorp Vault and Vault Enterprise’s approle auth method allowed any authenticated user with access to an approle destroy endpoint to destroy the secret ID of any other role by providing the secret ID accessor. This vulnerability is fixed in Vault 1.13.0, 1.12.4, 1.11.8, 1.10.11 and above.",2023-05-05T20:15:10.137,https://cve.circl.lu/cve/CVE-2023-24999
CVE-2023-2197,1.4,HashiCorp,HashiCorp Vault Enterprise 1.13.0 up to 1.13.1 is vulnerable to a padding oracle attack when using an HSM in conjunction with the CKM_AES_CBC_PAD or CKM_AES_CBC encryption mechanisms. An attacker with privileges to modify storage and restart Vault may be able to intercept or modify cipher text in order to derive Vault’s root key. Fixed in 1.13.2,2023-05-06T03:12:45.393,https://cve.circl.lu/cve/CVE-2023-2197
CVE-2022-36769,5.9,IBM,IBM Cloud Pak for Data 4.5 and 4.6 could allow a privileged user to upload malicious files of dangerous types that can be automatically processed within the product's environment. IBM X-Force ID: 232034.,2023-05-04T17:38:26.667,https://cve.circl.lu/cve/CVE-2022-36769
CVE-2022-41739,5.8,IBM,IBM Spectrum Scale (IBM Spectrum Scale Container Native Storage Access 5.1.2.1 through 5.1.6.0) could allow programs running inside the container to overcome isolation mechanism and gain additional capabilities or access sensitive information on the host. IBM X-Force ID: 237815.,2023-05-04T17:43:11.633,https://cve.circl.lu/cve/CVE-2022-41739
CVE-2023-26286,5.9,IBM,"IBM AIX 7.1, 7.2, 7.3, and VIOS 3.1 could allow a non-privileged local user to exploit a vulnerability in the AIX runtime services library to execute arbitrary commands.  IBM X-Force ID:  248421.",2023-05-03T20:37:43.290,https://cve.circl.lu/cve/CVE-2023-26286
CVE-2023-29257,5.9,IBM,"IBM Db2 for Linux, UNIX and Windows (includes Db2 Connect Server) 10.5, 11.1, and 11.5 is vulnerable to remote code execution as a database administrator of one database may execute code or read/write files from another database within the same instance.  IBM X-Force ID:  252011.",2023-05-04T19:39:08.163,https://cve.circl.lu/cve/CVE-2023-29257
CVE-2023-27559,3.6,IBM,"IBM Db2 for Linux, UNIX and Windows (includes Db2 Connect Server) 10.5, 11.1, and 11.5 is vulnerable to a denial of service as the server may crash when using a specially crafted subquery.  IBM X-Force ID:  249196.",2023-05-05T19:40:43.037,https://cve.circl.lu/cve/CVE-2023-27559
CVE-2022-2873,3.6,Intel,An out-of-bounds memory access flaw was found in the Linux kernel Intel’s iSMT SMBus host controller driver in the way a user triggers the I2C_SMBUS_BLOCK_DATA (with the ioctl I2C_SMBUS) with malicious input data. This flaw allows a local user to crash the system.,2023-05-03T14:15:10.653,https://cve.circl.lu/cve/CVE-2022-2873
CVE-2023-0698,5.9,Intel,Out of bounds read in WebRTC in Google Chrome prior to 110.0.5481.77 allowed a remote attacker to perform an out of bounds memory read via a crafted HTML page. (Chromium security severity: High),2023-05-04T20:15:09.503,https://cve.circl.lu/cve/CVE-2023-0698
CVE-2022-3707,3.6,Intel,"A double-free memory flaw was found in the Linux kernel. The Intel GVT-g graphics driver triggers VGA card system resource overload, causing a fail in the intel_gvt_dma_map_guest_page function. This issue could allow a local user to crash the system.",2023-05-03T14:15:14.110,https://cve.circl.lu/cve/CVE-2022-3707
CVE-2022-36788,5.9,Intel,A heap-based buffer overflow vulnerability exists in the TriangleMesh clone functionality of Slic3r libslic3r 1.3.0 and Master Commit b1a5500. A specially-crafted STL file can lead to a heap buffer overflow. An attacker can provide a malicious file to trigger this vulnerability.,2023-05-02T15:05:37.250,https://cve.circl.lu/cve/CVE-2022-36788
CVE-2023-2297,5.2,Intel,"The Profile Builder – User Profile & User Registration Forms plugin for WordPress is vulnerable to unauthorized password resets  in versions up to, and including 3.9.0. This is due to the plugin using native password reset functionality, with insufficient validation on the password reset function (wppb_front_end_password_recovery). The function uses the plaintext value of a password reset key instead of a hashed value which means it can easily be retrieved and subsequently used. An attacker can leverage CVE-2023-0814, or another vulnerability like SQL Injection in another plugin or theme installed on the site to successfully exploit this vulnerability.",2023-05-08T17:07:39.257,https://cve.circl.lu/cve/CVE-2023-2297
CVE-2023-24818,3.6,IoT,"RIOT-OS, an operating system that supports Internet of Things devices, contains a network stack with the ability to process 6LoWPAN frames. Prior to version 2022.10, an attacker can send a crafted frame to the device resulting in a NULL pointer dereference. During forwarding of a fragment an uninitialized entry in the reassembly buffer is used. The NULL pointer dereference triggers a hard fault exception resulting in denial of service. Version 2022.10 fixes this issue. As a workaround, disable support for fragmented IP datagrams or apply the patches manually.",2023-05-03T15:44:33.400,https://cve.circl.lu/cve/CVE-2023-24818
CVE-2023-24819,5.9,IoT,"RIOT-OS, an operating system that supports Internet of Things devices, contains a network stack with the ability to process 6LoWPAN frames. Prior to version 2022.10, an attacker can send a crafted frame to the device resulting in an out of bounds write in the packet buffer. The overflow can be used to corrupt other packets and the allocator metadata. Corrupting a pointer will easily lead to denial of service. While carefully manipulating the allocator metadata gives an attacker the possibility to write data to arbitrary locations and thus execute arbitrary code. Version 2022.10 fixes this issue. As a workaround, disable support for fragmented IP datagrams or apply the patches manually.",2023-05-03T16:12:07.527,https://cve.circl.lu/cve/CVE-2023-24819
CVE-2023-24820,3.6,IoT,"RIOT-OS, an operating system that supports Internet of Things devices, contains a network stack with the ability to process 6LoWPAN frames. An attacker can send a crafted frame to the device resulting in a large out of bounds write beyond the packet buffer. The write will create a hard fault exception after reaching the last page of RAM. The hard fault is not handled and the system will be stuck until reset. Thus the impact is denial of service. Version 2022.10 fixes this issue. As a workaround, apply the patch manually.",2023-05-03T16:27:55.537,https://cve.circl.lu/cve/CVE-2023-24820
CVE-2023-24821,3.6,IoT,"RIOT-OS, an operating system that supports Internet of Things devices, contains a network stack with the ability to process 6LoWPAN frames. Prior to version 2022.10, an attacker can send a crafted frame to the device resulting in a large out of bounds write beyond the packet buffer. The write will create a hard fault exception after reaching the last page of RAM. The hard fault is not handled and the system will be stuck until reset, thus the impact is denial of service. Version 2022.10 fixes this issue. As a workaround, disable support for fragmented IP datagrams or apply the patches manually.",2023-05-03T18:16:36.500,https://cve.circl.lu/cve/CVE-2023-24821
CVE-2023-24822,3.6,IoT,"RIOT-OS, an operating system that supports Internet of Things devices, contains a network stack with the ability to process 6LoWPAN frames. Prior to version 2022.10, an attacker can send a crafted frame to the device resulting in a NULL pointer dereference while encoding a 6LoWPAN IPHC header. The NULL pointer dereference causes a hard fault exception, leading to denial of service. Version 2022.10 fixes this issue. As a workaround, apply the patches manually.",2023-05-03T18:37:31.537,https://cve.circl.lu/cve/CVE-2023-24822
CVE-2023-2273,3.6,Insight,"Rapid7 Insight Agent token handler versions 3.2.6 and below, suffer from a Directory Traversal vulnerability whereby unsanitized input from a CLI argument flows into io.ioutil.WriteFile, where it is used as a path. This can result in a Path Traversal vulnerability and allow an attacker to write arbitrary files. This issue is remediated in version 3.3.0 via safe guards that reject inputs that attempt to do path traversal.",2023-05-04T17:52:05.037,https://cve.circl.lu/cve/CVE-2023-2273
CVE-2023-2534,4.7,Insight,"Improper Authorization vulnerability in OTRS AG OTRS 8 (Websocket API backend) allows any as Agent authenticated attacker to track user behaviour and to gain live insight into overall system usage. User IDs can easily be correlated with real names e. g. viaticket histories by any user. (Fuzzing for garnering other adjacent user/sensitive data). Subscribing to all possible push events could also lead to performance implications on the server side, depending on the size of the installationand the number of active users. (Flooding)This issue affects OTRS: from 8.0.X before 8.0.32.",2023-05-08T12:50:24.320,https://cve.circl.lu/cve/CVE-2023-2534
CVE-2022-26497,2.7,Java,"BigBlueButton Greenlight 2.11.1 allows XSS. A threat actor could have a username containing a JavaScript payload. The payload gets executed in the browser of the victim in the ""Share room access"" dialog if the victim has shared access to the particular room with the attacker previously.",2023-05-04T17:15:12.210,https://cve.circl.lu/cve/CVE-2022-26497
CVE-2022-34169,3.6,Java,The Apache Xalan Java XSLT library is vulnerable to an integer truncation issue when processing malicious XSLT stylesheets. This can be used to corrupt Java class files generated by the internal XSLTC compiler and execute arbitrary Java bytecode. Users are recommended to update to version 2.7.3 or later. Note: Java runtimes (such as OpenJDK) include repackaged copies of Xalan.,2023-05-05T08:15:08.767,https://cve.circl.lu/cve/CVE-2022-34169
CVE-2023-31085,3.6,Java,"An issue was discovered in drivers/mtd/ubi/cdev.c in the Linux kernel 6.2. There is a divide-by-zero error in do_div(sz,mtd->erasesize), used indirectly by ctrl_cdev_ioctl, when mtd->erasesize is 0.",2023-05-02T14:11:02.420,https://cve.circl.lu/cve/CVE-2023-31085
CVE-2023-30613,6.0,Java,"Kiwi TCMS, an open source test management system, allows users to upload attachments to test plans, test cases, etc. In versions of Kiwi TCMS prior to 12.2, there is no control over what kinds of files can be uploaded. Thus, a malicious actor may upload an `.exe` file or a file containing embedded JavaScript and trick others into clicking on these files, causing vulnerable browsers to execute malicious code on another computer.Kiwi TCMS v12.2 comes with functionality that allows administrators to configure additional upload validator functions which give them more control over what file types are accepted for upload. By default `.exe` are denied. Other files containing the `<script>` tag, regardless of their type are also denied b/c they are a path to XSS attacks. There are no known workarounds aside from upgrading.",2023-05-03T17:24:05.977,https://cve.circl.lu/cve/CVE-2023-30613
CVE-2023-22665,2.7,Java,"There is insufficient checking of user queries in Apache Jena versions 4.7.0 and earlier, when invoking custom scripts. It allows a remote user to execute arbitrary javascript via a SPARQL query.",2023-05-05T17:15:38.370,https://cve.circl.lu/cve/CVE-2023-22665
CVE-2022-48476,3.6,JetBrains,In JetBrains Ktor before 2.3.0 path traversal in the `resolveResource` method was possible,2023-05-02T19:21:10.690,https://cve.circl.lu/cve/CVE-2022-48476
CVE-2022-48477,5.9,JetBrains,In JetBrains Hub before 2023.1.15725 SSRF protection in Auth Module integration was missing,2023-05-02T19:22:47.650,https://cve.circl.lu/cve/CVE-2022-48477
CVE-2022-48481,5.9,JetBrains,In JetBrains Toolbox App before 1.28 a DYLIB injection on macOS was possible,2023-05-05T17:26:17.873,https://cve.circl.lu/cve/CVE-2022-48481
CVE-2023-28976,3.6,Juniper,"An Improper Check for Unusual or Exceptional Conditions vulnerability in the packet forwarding engine (pfe) of Juniper Networks Junos OS on MX Series allows an unauthenticated, network-based attacker to cause a Denial of Service (DoS). If specific traffic is received on MX Series and its rate exceeds the respective DDoS protection limit the ingress PFE will crash and restart. Continued receipt of this traffic will create a sustained DoS condition. This issue affects Juniper Networks Junos OS on MX Series: All versions prior to 19.1R3-S10; 19.2 versions prior to 19.2R3-S7; 19.3 versions prior to 19.3R3-S8; 19.4 versions prior to 19.4R3-S11; 20.2 versions prior to 20.2R3-S5; 20.4 versions prior to 20.4R3-S6; 21.1 versions prior to 21.1R3-S5; 21.2 versions prior to 21.2R3-S4; 21.3 versions prior to 21.3R3; 21.4 versions prior to 21.4R3; 22.1 versions prior to 22.1R2.",2023-05-02T19:45:00.223,https://cve.circl.lu/cve/CVE-2023-28976
CVE-2023-28978,1.4,Juniper,"An Insecure Default Initialization of Resource vulnerability in Juniper Networks Junos OS Evolved allows an unauthenticated, network based attacker to read certain confidential information. In the default configuration it is possible to read confidential information about locally configured (administrative) users of the affected system. This issue affects Juniper Networks Junos OS Evolved: All versions prior to 20.4R3-S7-EVO on pending commit???; 21.1-EVO versions prior to 21.1R3-S4-EVO on awaiting build; 21.4-EVO versions prior to 21.4R3-S1-EVO; 22.2-EVO versions prior to 22.2R3-EVO; 21.2-EVO versions prior to 21.2R3-S5-EVO on pending commit???; 21.3-EVO version 21.3R1-EVO and later versions; 22.1-EVO version 22.1R1-EVO and later versions; 22.2-EVO versions prior to 22.2R2-S1-EVO.",2023-05-02T19:36:27.620,https://cve.circl.lu/cve/CVE-2023-28978
CVE-2023-28979,1.4,Juniper,"An Improper Check for Unusual or Exceptional Conditions vulnerability in the kernel of Juniper Networks Junos OS allows an adjacent unauthenticated attacker to bypass an integrity check. In a 6PE scenario and if an additional integrity check is configured, it will fail to drop specific malformed IPv6 packets, and then these packets will be forwarded to other connected networks. This issue affects Juniper Networks Junos OS: All versions prior to 19.3R3-S7; 19.4 versions prior to 19.4R3-S9; 20.2 versions prior to 20.2R3-S7; 20.3 versions prior to 20.3R3-S5; 20.4 versions prior to 20.4R3-S4; 21.1 versions prior to 21.1R3-S3; 21.2 versions prior to 21.2R3-S2; 21.3 versions prior to 21.3R3-S1; 21.4 versions prior to 21.4R2-S1, 21.4R3; 22.1 versions prior to 22.1R2; 22.2 versions prior to 22.2R2.",2023-05-02T19:30:15.163,https://cve.circl.lu/cve/CVE-2023-28979
