CVE,"Impact Score (1-10, 10 being the worst)",Keyword,Description,Last Modified,Link
CVE-2024-32646,1.4,Python,"Vyper is a pythonic Smart Contract Language for the Ethereum virtual machine. In versions 0.3.10 and prior, using the `slice` builtin can result in a double eval vulnerability when the buffer argument is either `msg.data`, `self.code` or `<address>.code` and either the `start` or `length` arguments have side-effects. It can be easily triggered only with the versions `<0.3.4` as `0.3.4` introduced the unique symbol fence. No vulnerable production contracts were found. Additionally, double evaluation of side-effects should be easily discoverable in client tests. As such, the impact is low. As of time of publication, no fixed versions are available.",2024-04-26T12:58:17.720,https://cve.circl.lu/cve/CVE-2024-32646
CVE-2024-32647,1.4,Python,"Vyper is a pythonic Smart Contract Language for the Ethereum virtual machine. In versions 0.3.10 and prior, using the `create_from_blueprint` builtin can result in a double eval vulnerability when `raw_args=True` and the `args` argument has side-effects. It can be seen that the `_build_create_IR` function of the `create_from_blueprint` builtin doesn't cache the mentioned `args` argument to the stack. As such, it can be evaluated multiple times (instead of retrieving the value from the stack). No vulnerable production contracts were found. Additionally, double evaluation of side-effects should be easily discoverable in client tests. As such, the impact is low. As of time of publication, no fixed versions exist.",2024-04-26T12:58:17.720,https://cve.circl.lu/cve/CVE-2024-32647
CVE-2023-6683,3.6,QEMU,"A flaw was found in the QEMU built-in VNC server while processing ClientCutText messages. The qemu_clipboard_request() function can be reached before vnc_server_cut_text_caps() was called and had the chance to initialize the clipboard peer, leading to a NULL pointer dereference. This could allow a malicious authenticated VNC client to crash QEMU and trigger a denial of service.",2024-04-26T16:09:56.053,https://cve.circl.lu/cve/CVE-2023-6683
CVE-2024-32696,3.7,Quantum,Improper Neutralization of Input During Web Page Generation ('Cross-site Scripting') vulnerability in QuantumCloud Infographic Maker – iList allows Stored XSS.This issue affects Infographic Maker – iList: from n/a through 4.6.6.,2024-04-22T13:28:34.007,https://cve.circl.lu/cve/CVE-2024-32696
CVE-2024-3185,5.5,Rapid7, A key used in logging.json does not follow the least privilege principle by default and is exposed to local users in the Rapid7 Platform.  This allows an attacker with local access to a machine with the logging.json file to use that key to authenticate to the platform with high privileges.  This was fixed in the Rapid7 platform starting 3 April 2024 via the introduction of a restricted role and the removal of automatic API key generation on installation of an agent.,2024-04-23T12:52:09.397,https://cve.circl.lu/cve/CVE-2024-3185
CVE-2024-3625,5.2,Redis,"A flaw was found in Quay, where Quay's database is stored in plain text in mirror-registry on Jinja's config.yaml file. This issue leaves the possibility of a malicious actor with access to this file to gain access to Quay's Redis instance.",2024-04-26T12:58:17.720,https://cve.circl.lu/cve/CVE-2024-3625
CVE-2024-32039,5.9,Remote Desktop,"FreeRDP is a free implementation of the Remote Desktop Protocol. FreeRDP based clients using a version of FreeRDP prior to 3.5.0 or 2.11.6 are vulnerable to integer overflow and out-of-bounds write. Versions 3.5.0 and 2.11.6 patch the issue. As a workaround, do not use `/gfx` options (e.g. deactivate with `/bpp:32` or `/rfx` as it is on by default).",2024-04-23T12:52:26.253,https://cve.circl.lu/cve/CVE-2024-32039
CVE-2024-32040,5.9,Remote Desktop,"FreeRDP is a free implementation of the Remote Desktop Protocol. FreeRDP based clients that use a version of FreeRDP prior to 3.5.0 or 2.11.6 and have connections to servers using the `NSC` codec are vulnerable to integer underflow. Versions 3.5.0 and 2.11.6 patch the issue. As a workaround, do not use the NSC codec (e.g. use `-nsc`).",2024-04-23T12:52:26.253,https://cve.circl.lu/cve/CVE-2024-32040
CVE-2024-32041,5.9,Remote Desktop,"FreeRDP is a free implementation of the Remote Desktop Protocol. FreeRDP based clients that use a version of FreeRDP prior to 3.5.0 or 2.11.6 are vulnerable to out-of-bounds read. Versions 3.5.0 and 2.11.6 patch the issue. As a workaround, deactivate `/gfx` (on by default, set `/bpp` or `/rfx` options instead.",2024-04-23T12:52:26.253,https://cve.circl.lu/cve/CVE-2024-32041
CVE-2024-32458,5.9,Remote Desktop,"FreeRDP is a free implementation of the Remote Desktop Protocol. FreeRDP based clients that use a version of FreeRDP prior to 3.5.0 or 2.11.6 are vulnerable to out-of-bounds read. Versions 3.5.0 and 2.11.6 patch the issue. As a workaround, use `/gfx` or `/rfx` modes (on by default, require server side support).",2024-04-23T12:52:26.253,https://cve.circl.lu/cve/CVE-2024-32458
CVE-2024-32459,5.9,Remote Desktop,FreeRDP is a free implementation of the Remote Desktop Protocol. FreeRDP based clients and servers that use a version of FreeRDP prior to 3.5.0 or 2.11.6 are vulnerable to out-of-bounds read. Versions 3.5.0 and 2.11.6 patch the issue. No known workarounds are available.,2024-04-23T12:52:26.253,https://cve.circl.lu/cve/CVE-2024-32459
CVE-2024-21972,3.4,Radeon,An out of bounds write vulnerability in the AMD Radeon™ user mode driver for DirectX® 11 could allow an attacker with access to a malformed shader to potentially achieve arbitrary code execution.,2024-04-24T13:39:42.883,https://cve.circl.lu/cve/CVE-2024-21972
CVE-2024-21979,3.4,Radeon,An out of bounds write vulnerability in the AMD Radeon™ user mode driver for DirectX® 11 could allow an attacker with access to a malformed shader to potentially achieve arbitrary code execution.,2024-04-24T13:39:42.883,https://cve.circl.lu/cve/CVE-2024-21979
CVE-2023-4759,5.9,Repository,"Arbitrary File Overwrite in Eclipse JGit <= 6.6.0In Eclipse JGit, all versions <= 6.6.0.202305301015-r, a symbolic link present in a specially crafted git repository can be used to write a file to locations outside the working tree when this repository is cloned with JGit to a case-insensitive filesystem, or when a checkout from a clone of such a repository is performed on a case-insensitive filesystem.This can happen on checkout (DirCacheCheckout), merge (ResolveMerger via its WorkingTreeUpdater), pull (PullCommand using merge), and when applying a patch (PatchApplier). This can be exploited for remote code execution (RCE), for instance if the file written outside the working tree is a git filter that gets executed on a subsequent git command.The issue occurs only on case-insensitive filesystems, like the default filesystems on Windows and macOS. The user performing the clone or checkout must have the rights to create symbolic links for the problem to occur, and symbolic links must be enabled in the git configuration.Setting git configuration option core.symlinks = false before checking out avoids the problem.The issue was fixed in Eclipse JGit version 6.6.1.202309021850-r and 6.7.0.202309050840-r, available via  Maven Central https://repo1.maven.org/maven2/org/eclipse/jgit/  and  repo.eclipse.org https://repo.eclipse.org/content/repositories/jgit-releases/ . A backport is available in 5.13.3 starting from  5.13.3.202401111512-r.The JGit maintainers would like to thank RyotaK for finding and reporting this issue.",2024-04-26T16:09:44.783,https://cve.circl.lu/cve/CVE-2023-4759
CVE-2023-5752,1.4,Repository,"When installing a package from a Mercurial VCS URL  (ie ""pip install hg+..."") with pip prior to v23.3, the specified Mercurial revision could be used to inject arbitrary configuration options to the ""hg clone"" call (ie ""--config""). Controlling the Mercurial configuration can modify how and which repository is installed. This vulnerability does not affect users who aren't installing from Mercurial.",2024-04-21T03:15:44.820,https://cve.circl.lu/cve/CVE-2023-5752
CVE-2024-28976,6.0,Repository,"Dell Repository Manager, versions prior to 3.4.5, contains a Path Traversal vulnerability in API module. A local attacker with low privileges could potentially exploit this vulnerability to gain unauthorized write access to the files stored on the server filesystem with the privileges of the running web application.",2024-04-24T13:39:42.883,https://cve.circl.lu/cve/CVE-2024-28976
CVE-2024-28977,1.4,Repository,"Dell Repository Manager, versions 3.4.2 through 3.4.4,contains a Path Traversal vulnerability in logger module. A local attacker with low privileges could potentially exploit this vulnerability to gain unauthorized read access to the files stored on the server filesystem with the privileges of the running web application.",2024-04-24T13:39:42.883,https://cve.circl.lu/cve/CVE-2024-28977
CVE-2024-1139,4.0,Repository,A credentials leak vulnerability was found in the cluster monitoring operator in OCP.  This issue may allow a remote attacker who has basic login credentials to check the pod manifest to discover a repository pull secret.,2024-04-26T09:15:09.103,https://cve.circl.lu/cve/CVE-2024-1139
CVE-2013-0422,10.0,Repo,"Multiple vulnerabilities in Oracle Java 7 before Update 11 allow remote attackers to execute arbitrary code by (1) using the public getMBeanInstantiator method in the JmxMBeanServer class to obtain a reference to a private MBeanInstantiator object, then retrieving arbitrary Class references using the findClass method, and (2) using the Reflection API with recursion in a way that bypasses a security check by the java.lang.invoke.MethodHandles.Lookup.checkSecurityManager method due to the inability of the sun.reflect.Reflection.getCallerClass method to skip frames related to the new reflection API, as exploited in the wild in January 2013, as demonstrated by Blackhole and Nuclear Pack, and a different vulnerability than CVE-2012-4681 and CVE-2012-3174. NOTE: some parties have mapped the recursive Reflection API issue to CVE-2012-3174, but CVE-2012-3174 is for a different vulnerability whose details are not public as of 20130114.  CVE-2013-0422 covers both the JMX/MBean and Reflection API issues.  NOTE: it was originally reported that Java 6 was also vulnerable, but the reporter has retracted this claim, stating that Java 6 is not exploitable because the relevant code is called in a way that does not bypass security checks.  NOTE: as of 20130114, a reliable third party has claimed that the findClass/MBeanInstantiator vector was not fixed in Oracle Java 7 Update 11.  If there is still a vulnerable condition, then a separate CVE identifier might be created for the unfixed issue.",2024-04-26T16:07:03.190,https://cve.circl.lu/cve/CVE-2013-0422
CVE-2023-4759,5.9,Repo,"Arbitrary File Overwrite in Eclipse JGit <= 6.6.0In Eclipse JGit, all versions <= 6.6.0.202305301015-r, a symbolic link present in a specially crafted git repository can be used to write a file to locations outside the working tree when this repository is cloned with JGit to a case-insensitive filesystem, or when a checkout from a clone of such a repository is performed on a case-insensitive filesystem.This can happen on checkout (DirCacheCheckout), merge (ResolveMerger via its WorkingTreeUpdater), pull (PullCommand using merge), and when applying a patch (PatchApplier). This can be exploited for remote code execution (RCE), for instance if the file written outside the working tree is a git filter that gets executed on a subsequent git command.The issue occurs only on case-insensitive filesystems, like the default filesystems on Windows and macOS. The user performing the clone or checkout must have the rights to create symbolic links for the problem to occur, and symbolic links must be enabled in the git configuration.Setting git configuration option core.symlinks = false before checking out avoids the problem.The issue was fixed in Eclipse JGit version 6.6.1.202309021850-r and 6.7.0.202309050840-r, available via  Maven Central https://repo1.maven.org/maven2/org/eclipse/jgit/  and  repo.eclipse.org https://repo.eclipse.org/content/repositories/jgit-releases/ . A backport is available in 5.13.3 starting from  5.13.3.202401111512-r.The JGit maintainers would like to thank RyotaK for finding and reporting this issue.",2024-04-26T16:09:44.783,https://cve.circl.lu/cve/CVE-2023-4759
CVE-2023-41993,5.9,Repo,The issue was addressed with improved checks. This issue is fixed in macOS Sonoma 14. Processing web content may lead to arbitrary code execution. Apple is aware of a report that this issue may have been actively exploited against versions of iOS before iOS 16.7.,2024-04-26T09:15:07.533,https://cve.circl.lu/cve/CVE-2023-41993
CVE-2023-38817,5.9,Repo,"An issue in Inspect Element Ltd Echo.ac v.5.2.1.0 allows a local attacker to gain privileges via a crafted command to the echo_driver.sys component. NOTE: the vendor's position is that the reported ability for user-mode applications to execute code as NT AUTHORITY\SYSTEM was ""deactivated by Microsoft itself.""",2024-04-24T19:15:46.587,https://cve.circl.lu/cve/CVE-2023-38817
CVE-2023-5752,1.4,Repo,"When installing a package from a Mercurial VCS URL  (ie ""pip install hg+..."") with pip prior to v23.3, the specified Mercurial revision could be used to inject arbitrary configuration options to the ""hg clone"" call (ie ""--config""). Controlling the Mercurial configuration can modify how and which repository is installed. This vulnerability does not affect users who aren't installing from Mercurial.",2024-04-21T03:15:44.820,https://cve.circl.lu/cve/CVE-2023-5752
CVE-2013-6381,10.0,SNMP,Buffer overflow in the qeth_snmp_command function in drivers/s390/net/qeth_core_main.c in the Linux kernel through 3.12.1 allows local users to cause a denial of service or possibly have unspecified other impact via an SNMP ioctl call with a length value that is incompatible with the command-buffer size.,2024-04-26T16:10:07.460,https://cve.circl.lu/cve/CVE-2013-6381
CVE-2022-46966,5.9,SQL,Revenue Collection System v1.0 was discovered to contain a SQL injection vulnerability at step1.php.,2024-04-23T14:15:08.030,https://cve.circl.lu/cve/CVE-2022-46966
CVE-2023-33584,5.9,SQL,"Sourcecodester Enrollment System Project V1.0 is vulnerable to SQL Injection (SQLI) attacks, which allow an attacker to manipulate the SQL queries executed by the application. The application fails to properly validate user-supplied input in the username and password fields during the login process, enabling an attacker to inject malicious SQL code.",2024-04-22T21:15:48.840,https://cve.circl.lu/cve/CVE-2023-33584
CVE-2022-46337,5.9,SQL,"A cleverly devised username might bypass LDAP authentication checks. In LDAP-authenticated Derby installations, this could let an attacker fill up the disk by creating junk Derby databases. In LDAP-authenticated Derby installations, this could also allow the attacker to execute malware which was visible to and executable by the account which booted the Derby server. In LDAP-protected databases which weren't also protected by SQL GRANT/REVOKE authorization, this vulnerability could also let an attacker view and corrupt sensitive data and run sensitive database functions and procedures.Mitigation:Users should upgrade to Java 21 and Derby 10.17.1.0.Alternatively, users who wish to remain on older Java versions should build their own Derby distribution from one of the release families to which the fix was backported: 10.16, 10.15, and 10.14. Those are the releases which correspond, respectively, with Java LTS versions 17, 11, and 8.",2024-04-26T16:08:12.950,https://cve.circl.lu/cve/CVE-2022-46337
CVE-2024-28323,NA,SQL,"The bwdates-report-result.php file in Phpgurukul User Registration & Login and User Management System 3.1 contains a potential security vulnerability related to user input validation. The script retrieves user-provided date inputs without proper validation, making it susceptible to SQL injection attacks.",2024-04-24T02:15:45.820,https://cve.circl.lu/cve/CVE-2024-28323
CVE-2024-30974,NA,SQL,SQL Injection vulnerability in autoexpress v.1.3.0 allows attackers to run arbitrary SQL commands via the carId parameter.,2024-04-22T13:28:50.310,https://cve.circl.lu/cve/CVE-2024-30974
CVE-2024-0853,1.4,SSL,"curl inadvertently kept the SSL session ID for connections in its cache even when the verify status (*OCSP stapling*) test failed. A subsequent transfer tothe same hostname could then succeed if the session ID cache was still fresh, which then skipped the verify status check.",2024-04-26T09:15:09.023,https://cve.circl.lu/cve/CVE-2024-0853
CVE-2023-6237,NA,SSL,"Issue summary: Checking excessively long invalid RSA public keys may takea long time.Impact summary: Applications that use the function EVP_PKEY_public_check()to check RSA public keys may experience long delays. Where the key thatis being checked has been obtained from an untrusted source this may leadto a Denial of Service.When function EVP_PKEY_public_check() is called on RSA public keys,a computation is done to confirm that the RSA modulus, n, is composite.For valid RSA keys, n is a product of two or more large primes and thiscomputation completes quickly. However, if n is an overly large prime,then this computation would take a long time.An application that calls EVP_PKEY_public_check() and supplies an RSA keyobtained from an untrusted source could be vulnerable to a Denial of Serviceattack.The function EVP_PKEY_public_check() is not called from other OpenSSLfunctions however it is called from the OpenSSL pkey command lineapplication. For that reason that application is also vulnerable if usedwith the '-pubin' and '-check' options on untrusted data.The OpenSSL SSL/TLS implementation is not affected by this issue.The OpenSSL 3.0 and 3.1 FIPS providers are affected by this issue.",2024-04-25T13:18:13.537,https://cve.circl.lu/cve/CVE-2023-6237
CVE-2024-32881,5.9,Slack,"Danswer is the AI Assistant connected to company's docs, apps, and people. Danswer is vulnerable to unauthorized access to GET/SET of Slack Bot Tokens. Anyone with network access can steal slack bot tokens and set them. This implies full compromise of the customer's slack bot, leading to internal Slack access. This issue was patched in version 3.63.",2024-04-26T21:15:49.450,https://cve.circl.lu/cve/CVE-2024-32881
CVE-2024-29003,5.3,Solarwinds,The SolarWinds Platform was susceptible to a XSS vulnerability that affects the maps section of the user interface. This vulnerability requires authentication and requires user interaction. ,2024-04-23T15:15:49.640,https://cve.circl.lu/cve/CVE-2024-29003
CVE-2020-14323,3.6,Samba,"A null pointer dereference flaw was found in samba's Winbind service in versions before 4.11.15, before 4.12.9 and before 4.13.1. A local user could use this flaw to crash the winbind service causing denial of service.",2024-04-22T16:15:11.780,https://cve.circl.lu/cve/CVE-2020-14323
CVE-2020-14383,3.6,Samba,"A flaw was found in samba's DNS server. An authenticated user could use this flaw to the RPC server to crash. This RPC server, which also serves protocols other than dnsserver, will be restarted after a short delay, but it is easy for an authenticated non administrative attacker to crash it again as soon as it returns. The Samba DNS server itself will continue to operate, but many RPC services will not.",2024-04-22T16:15:11.937,https://cve.circl.lu/cve/CVE-2020-14383
CVE-2020-14318,1.4,Samba,A flaw was found in the way samba handled file and directory permissions. An authenticated user could use this flaw to gain access to certain file and directory information which otherwise would be unavailable to the attacker.,2024-04-22T16:15:11.597,https://cve.circl.lu/cve/CVE-2020-14318
CVE-2022-32742,1.4,Samba,"A flaw was found in Samba. Some SMB1 write requests were not correctly range-checked to ensure the client had sent enough data to fulfill the write, allowing server memory contents to be written into the file (or printer) instead of client-supplied data. The client cannot control the area of the server memory written to the file (or printer).",2024-04-22T16:15:12.257,https://cve.circl.lu/cve/CVE-2022-32742
CVE-2022-3437,3.6,Samba,"A heap-based buffer overflow vulnerability was found in Samba within the GSSAPI unwrap_des() and unwrap_des3() routines of Heimdal. The DES and Triple-DES decryption routines in the Heimdal GSSAPI library allow a length-limited write buffer overflow on malloc() allocated memory when presented with a maliciously small packet. This flaw allows a remote user to send specially crafted malicious data to the application, possibly resulting in a denial of service (DoS) attack.",2024-04-22T16:15:12.370,https://cve.circl.lu/cve/CVE-2022-3437
CVE-2019-17069,3.6,SSH,PuTTY before 0.73 might allow remote SSH-1 servers to cause a denial of service by accessing freed memory locations via an SSH1_MSG_DISCONNECT message.,2024-04-25T22:15:07.590,https://cve.circl.lu/cve/CVE-2019-17069
CVE-2021-36367,5.2,SSH,"PuTTY through 0.75 proceeds with establishing an SSH session even if it has never sent a substantive authentication response. This makes it easier for an attacker-controlled SSH server to present a later spoofed authentication prompt (that the attacker can use to capture credential data, and use that data for purposes that are undesired by the client user).",2024-04-25T22:15:07.883,https://cve.circl.lu/cve/CVE-2021-36367
CVE-2022-40735,3.6,SSH,"The Diffie-Hellman Key Agreement Protocol allows use of long exponents that arguably make certain calculations unnecessarily expensive, because the 1996 van Oorschot and Wiener paper found that ""(appropriately) short exponents"" can be used when there are adequate subgroup constraints, and these short exponents can lead to less expensive calculations than for long exponents. This issue is different from CVE-2002-20001 because it is based on an observation about exponent size, rather than an observation about numbers that are not public keys. The specific situations in which calculation expense would constitute a server-side vulnerability depend on the protocol (e.g., TLS, SSH, or IKE) and the DHE implementation details. In general, there might be an availability concern because of server-side resource consumption from DHE modular-exponentiation calculations. Finally, it is possible for an attacker to exploit this vulnerability and CVE-2002-20001 together.",2024-04-23T07:15:42.550,https://cve.circl.lu/cve/CVE-2022-40735
CVE-2023-48795,3.6,SSH,"The SSH transport protocol with certain OpenSSH extensions, found in OpenSSH before 9.6 and other products, allows remote attackers to bypass integrity checks such that some packets are omitted (from the extension negotiation message), and a client and server may consequently end up with a connection for which some security features have been downgraded or disabled, aka a Terrapin attack. This occurs because the SSH Binary Packet Protocol (BPP), implemented by these extensions, mishandles the handshake phase and mishandles use of sequence numbers. For example, there is an effective attack against SSH's use of ChaCha20-Poly1305 (and CBC with Encrypt-then-MAC). The bypass occurs in chacha20-poly1305@openssh.com and (if CBC is used) the -etm@openssh.com MAC algorithms. This also affects Maverick Synergy Java SSH API before 3.1.0-SNAPSHOT, Dropbear through 2022.83, Ssh before 5.1.1 in Erlang/OTP, PuTTY before 0.80, AsyncSSH before 2.14.2, golang.org/x/crypto before 0.17.0, libssh before 0.10.6, libssh2 through 1.11.0, Thorn Tech SFTP Gateway before 3.4.6, Tera Term before 5.1, Paramiko before 3.4.0, jsch before 0.2.15, SFTPGo before 2.5.6, Netgate pfSense Plus through 23.09.1, Netgate pfSense CE through 2.7.2, HPN-SSH through 18.2.0, ProFTPD before 1.3.8b (and before 1.3.9rc2), ORYX CycloneSSH before 2.3.4, NetSarang XShell 7 before Build 0144, CrushFTP before 10.6.0, ConnectBot SSH library before 2.2.22, Apache MINA sshd through 2.11.0, sshj through 0.37.0, TinySSH through 20230101, trilead-ssh2 6401, LANCOM LCOS and LANconfig, FileZilla before 3.66.4, Nova before 11.8, PKIX-SSH before 14.4, SecureCRT before 9.4.3, Transmit5 before 5.10.4, Win32-OpenSSH before 9.5.0.0p1-Beta, WinSCP before 6.2.2, Bitvise SSH Server before 9.32, Bitvise SSH Client before 9.33, KiTTY through 0.76.1.13, the net-ssh gem 7.2.0 for Ruby, the mscdex ssh2 module before 1.15.0 for Node.js, the thrussh library before 0.35.1 for Rust, and the Russh crate before 0.40.2 for Rust.",2024-04-25T22:15:08.130,https://cve.circl.lu/cve/CVE-2023-48795
