CVE,Impact Score,Description,Last Modified
CVE-2014-3991,2.9,"Multiple cross-site scripting (XSS) vulnerabilities in Dolibarr ERP/CRM 3.5.3 allow remote attackers to inject arbitrary web script or HTML via the (1) dol_use_jmobile, (2) dol_optimize_smallscreen, (3) dol_no_mouse_hover, (4) dol_hide_topmenu, (5) dol_hide_leftmenu, (6) mainmenu, or (7) leftmenu parameter to index.php; the (8) dol_use_jmobile, (9) dol_optimize_smallscreen, (10) dol_no_mouse_hover, (11) dol_hide_topmenu, or (12) dol_hide_leftmenu parameter to user/index.php; the (13) dol_use_jmobile, (14) dol_optimize_smallscreen, (15) dol_no_mouse_hover, (16) dol_hide_topmenu, or (17) dol_hide_leftmenu parameter to user/logout.php; the (18) email, (19) firstname, (20) job, (21) lastname, or (22) login parameter in an update action in a ""User Card"" to user/fiche.php; or the (23) modulepart or (24) file parameter to viewimage.php.",2022-11-17T17:21:59.260
CVE-2014-3992,6.4,Multiple SQL injection vulnerabilities in Dolibarr ERP/CRM 3.5.3 allow remote authenticated users to execute arbitrary SQL commands via the (1) entity parameter in an update action to user/fiche.php or (2) sortorder parameter to user/group/index.php.,2022-11-17T17:21:59.260
CVE-2017-7886,5.9,Dolibarr ERP/CRM 4.0.4 has SQL Injection in doli/theme/eldy/style.css.php via the lang parameter.,2022-11-17T17:21:59.260
CVE-2022-38890,3.6,Nginx NJS v0.7.7 was discovered to contain a segmentation violation via njs_utf8_next at src/njs_utf8.h,2022-11-21T18:17:15.827
CVE-2022-41741,5.9,"NGINX Open Source before versions 1.23.2 and 1.22.1, NGINX Open Source Subscription before versions R2 P1 and R1 P1, and NGINX Plus before versions R27 P1 and R26 P1 have a vulnerability in the module ngx_http_mp4_module that might allow a local attacker to corrupt NGINX worker memory, resulting in its termination or potential other impact using a specially crafted audio or video file. The issue affects only NGINX products that are built with the ngx_http_mp4_module, when the mp4 directive is used in the configuration file. Further, the attack is possible only if an attacker can trigger processing of a specially crafted audio or video file with the module ngx_http_mp4_module.",2022-11-16T08:15:09.610
CVE-2022-41742,5.2,"NGINX Open Source before versions 1.23.2 and 1.22.1, NGINX Open Source Subscription before versions R2 P1 and R1 P1, and NGINX Plus before versions R27 P1 and R26 P1 have a vulnerability in the module ngx_http_mp4_module that might allow a local attacker to cause a worker process crash, or might result in worker process memory disclosure by using a specially crafted audio or video file. The issue affects only NGINX products that are built with the module ngx_http_mp4_module, when the mp4 directive is used in the configuration file. Further, the attack is possible only if an attacker can trigger processing of a specially crafted audio or video file with the module ngx_http_mp4_module.",2022-11-16T18:43:08.350
CVE-2022-43284,3.6,Nginx NJS v0.7.2 to v0.7.4 was discovered to contain a segmentation violation via njs_scope_valid_value at njs_scope.h.,2022-11-16T18:58:39.627
CVE-2022-32268,5.9,"StarWind SAN and NAS v0.2 build 1914 allow remote code execution. A flaw was found in REST API in StarWind Stack. REST command, which allows changing the hostname, doesnâ€™t check a new hostname parameter. It goes directly to bash as part of a script. An attacker with non-root user access can inject arbitrary data into the command that will be executed with root privileges.",2022-11-16T16:56:12.613
CVE-2021-41313,1.4,Affected versions of Atlassian Jira Server and Data Center allow authenticated but non-admin remote attackers to edit email batch configurations via an Improper Authorization vulnerability in the /secure/admin/ConfigureBatching!default.jspa endpoint. The affected versions are before version 8.20.7.,2022-11-16T16:47:19.750
CVE-2022-42977,3.6,"The Netic User Export add-on before 1.3.5 for Atlassian Confluence has the functionality to generate a list of users in the application, and export it. During export, the HTTP request has a fileName parameter that accepts any file on the system (e.g., an SSH private key) to be downloaded.",2022-11-17T04:52:12.963
CVE-2022-42978,3.6,"In the Netic User Export add-on before 1.3.5 for Atlassian Confluence, authorization is mishandled. An unauthenticated attacker could access files on the remote system.",2022-11-17T04:59:09.643
CVE-2022-43781,5.9,There is a command injection vulnerability using environment variables in Bitbucket Server and Data Center. An attacker with permission to control their username can exploit this issue to execute arbitrary code on the system. This vulnerability can be unauthenticated if the Bitbucket Server and Data Center instance has enabled â€œAllow public signupâ€.,2022-11-18T18:51:28.923
CVE-2022-43782,5.9,"Affected versions of Atlassian Crowd allow an attacker to authenticate as the crowd application via security misconfiguration and subsequent ability to call privileged endpoints in Crowd's REST API under the {{usermanagement}} path. This vulnerability can only be exploited by IPs specified under the crowd application allowlist in the Remote Addresses configuration, which is {{none}} by default. The affected versions are all versions 3.x.x, versions 4.x.x before version 4.4.4, and versions 5.x.x before 5.0.3",2022-11-18T18:51:03.103
CVE-2022-41882,5.9,"The Nextcloud Desktop Client is a tool to synchronize files from Nextcloud Server with your computer. In version 3.6.0, if a user received a malicious file share and has it synced locally or the virtual filesystem enabled and clicked a nc://open/ link it will open the default editor for the file type of the shared file, which on Windows can also sometimes mean that a file depending on the type, e.g. ""vbs"", is being executed. It is recommended that the Nextcloud Desktop client is upgraded to version 3.6.1. As a workaround, users can block the Nextcloud Desktop client 3.6.0 by setting the `minimum.supported.desktop.version` system config to `3.6.1` on the server, so new files designed to use this attack vector are not downloaded anymore. Already existing files can still be used. Another workaround would be to enforce shares to be accepted by setting the `sharing.force_share_accept` system config to `true` on the server, so new files designed to use this attack vector are not downloaded anymore. Already existing shares can still be abused.",2022-11-16T16:40:15.513
CVE-2019-14907,3.6,"All samba versions 4.9.x before 4.9.18, 4.10.x before 4.10.12 and 4.11.x before 4.11.5 have an issue where if it is set with ""log level = 3"" (or above) then the string obtained from the client, after a failed character conversion, is printed. Such strings can be provided during the NTLMSSP authentication exchange. In the Samba AD DC in particular, this may cause a long-lived process(such as the RPC server) to terminate. (In the file server case, the most likely target, smbd, operates as process-per-client and so a crash there is harmless).",2022-11-16T03:07:29.893
CVE-2020-14342,5.9,"It was found that cifs-utils' mount.cifs was invoking a shell when requesting the Samba password, which could be used to inject arbitrary commands. An attacker able to invoke mount.cifs with special permission, such as via sudo rules, could use this flaw to escalate their privileges.",2022-11-16T15:09:33.500
CVE-2016-4273,5.9,"Adobe Flash Player before 18.0.0.382 and 19.x through 23.x before 23.0.0.185 on Windows and OS X and before 11.2.202.637 on Linux allows attackers to execute arbitrary code or cause a denial of service (memory corruption) via unspecified vectors, a different vulnerability than CVE-2016-6982, CVE-2016-6983, CVE-2016-6984, CVE-2016-6985, CVE-2016-6986, CVE-2016-6989, and CVE-2016-6990.",2022-11-18T16:37:56.737
CVE-2016-6981,5.9,"Use-after-free vulnerability in Adobe Flash Player before 18.0.0.382 and 19.x through 23.x before 23.0.0.185 on Windows and OS X and before 11.2.202.637 on Linux allows attackers to execute arbitrary code via unspecified vectors, a different vulnerability than CVE-2016-6987.",2022-11-18T16:25:36.233
CVE-2016-6982,5.9,"Adobe Flash Player before 18.0.0.382 and 19.x through 23.x before 23.0.0.185 on Windows and OS X and before 11.2.202.637 on Linux allows attackers to execute arbitrary code or cause a denial of service (memory corruption) via unspecified vectors, a different vulnerability than CVE-2016-4273, CVE-2016-6983, CVE-2016-6984, CVE-2016-6985, CVE-2016-6986, CVE-2016-6989, and CVE-2016-6990.",2022-11-18T16:39:05.427
CVE-2016-6983,5.9,"Adobe Flash Player before 18.0.0.382 and 19.x through 23.x before 23.0.0.185 on Windows and OS X and before 11.2.202.637 on Linux allows attackers to execute arbitrary code or cause a denial of service (memory corruption) via unspecified vectors, a different vulnerability than CVE-2016-4273, CVE-2016-6982, CVE-2016-6984, CVE-2016-6985, CVE-2016-6986, CVE-2016-6989, and CVE-2016-6990.",2022-11-18T16:39:02.620
CVE-2016-6984,5.9,"Adobe Flash Player before 18.0.0.382 and 19.x through 23.x before 23.0.0.185 on Windows and OS X and before 11.2.202.637 on Linux allows attackers to execute arbitrary code or cause a denial of service (memory corruption) via unspecified vectors, a different vulnerability than CVE-2016-4273, CVE-2016-6982, CVE-2016-6983, CVE-2016-6985, CVE-2016-6986, CVE-2016-6989, and CVE-2016-6990.",2022-11-18T17:37:57.573
CVE-2020-10713,6.0,"A flaw was found in grub2, prior to version 2.06. An attacker may use the GRUB 2 flaw to hijack and tamper the GRUB verification process. This flaw also allows the bypass of Secure Boot protections. In order to load an untrusted or modified kernel, an attacker would first need to establish access to the system such as gaining physical access, obtain the ability to alter a pxe-boot network, or have remote access to a networked system with root access. With this access, an attacker could then craft a string to cause a buffer overflow by injecting a malicious payload that leads to arbitrary code execution within GRUB. The highest threat from this vulnerability is to data confidentiality and integrity as well as system availability.",2022-11-16T04:06:00.473
CVE-2021-27853,1.4,Layer 2 network filtering capabilities such as IPv6 RA guard or ARP inspection can be bypassed using combinations of VLAN 0 headers and LLC/SNAP headers.,2022-11-16T17:26:33.420
CVE-2022-20826,5.9,A vulnerability in the secure boot implementation of Cisco Secure Firewalls 3100 Series that are running Cisco Adaptive Security Appliance (ASA) Software or Cisco Firepower Threat Defense (FTD) Software could allow an unauthenticated attacker with physical access to the device to bypass the secure boot functionality. This vulnerability is due to a logic error in the boot process. An attacker could exploit this vulnerability by injecting malicious code into a specific memory location during the boot process of an affected device. A successful exploit could allow the attacker to execute persistent code at boot time and break the chain of trust.,2022-11-18T18:16:39.773
CVE-2022-20831,2.7,"Multiple vulnerabilities in the web-based management interface of Cisco Firepower Management Center (FMC) Software could allow an authenticated, remote attacker to conduct a stored cross-site scripting (XSS) attack against a user of the interface of an affected device. These vulnerabilities are due to insufficient validation of user-supplied input by the web-based management interface. An attacker could exploit these vulnerabilities by inserting crafted input into various data fields in an affected interface. A successful exploit could allow the attacker to execute arbitrary script code in the context of the interface, or access sensitive, browser-based information. In some cases, it is also possible to cause a temporary availability impact to portions of the FMC Dashboard.",2022-11-18T15:53:43.580
CVE-2022-20832,2.7,"Multiple vulnerabilities in the web-based management interface of Cisco Firepower Management Center (FMC) Software could allow an authenticated, remote attacker to conduct a stored cross-site scripting (XSS) attack against a user of the interface of an affected device. These vulnerabilities are due to insufficient validation of user-supplied input by the web-based management interface. An attacker could exploit these vulnerabilities by inserting crafted input into various data fields in an affected interface. A successful exploit could allow the attacker to execute arbitrary script code in the context of the interface, or access sensitive, browser-based information. In some cases, it is also possible to cause a temporary availability impact to portions of the FMC Dashboard.",2022-11-18T18:13:04.983
CVE-2013-0881,2.9,"Google Chrome before 25.0.1364.97 on Windows and Linux, and before 25.0.1364.99 on Mac OS X, allows remote attackers to cause a denial of service (incorrect read operation) via crafted data in the Matroska container format.",2022-11-18T17:52:19.527
CVE-2013-0882,6.4,"Google Chrome before 25.0.1364.97 on Windows and Linux, and before 25.0.1364.99 on Mac OS X, allows remote attackers to cause a denial of service (incorrect memory access) or possibly have unspecified other impact via a large number of SVG parameters.",2022-11-18T17:55:13.750
CVE-2013-0883,2.9,"Skia, as used in Google Chrome before 25.0.1364.97 on Windows and Linux, and before 25.0.1364.99 on Mac OS X, allows remote attackers to cause a denial of service (incorrect read operation) via unspecified vectors.",2022-11-18T17:55:38.703
CVE-2013-0884,6.4,"Google Chrome before 25.0.1364.97 on Windows and Linux, and before 25.0.1364.99 on Mac OS X, does not properly load Native Client (aka NaCl) code, which has unspecified impact and attack vectors.",2022-11-18T19:59:24.583
CVE-2013-0885,6.4,"Google Chrome before 25.0.1364.97 on Windows and Linux, and before 25.0.1364.99 on Mac OS X, does not properly restrict API privileges during interaction with the Chrome Web Store, which has unspecified impact and attack vectors.",2022-11-18T19:59:08.363
CVE-2011-4329,2.9,"Multiple cross-site scripting (XSS) vulnerabilities in Dolibarr 3.1.0 allow remote attackers to inject arbitrary web script or HTML via (1) the username parameter in a setup action to admin/company.php, or the PATH_INFO to (2) admin/security_other.php, (3) admin/events.php, or (4) admin/user.php.",2022-11-17T17:21:59.260
CVE-2011-4802,6.4,"Multiple SQL injection vulnerabilities in Dolibarr 3.1.0 RC and probably earlier allow remote authenticated users to execute arbitrary SQL commands via the (1) sortfield, (2) sortorder, and (3) sall parameters to user/index.php and (b) user/group/index.php; the id parameter to (4) info.php, (5) perms.php, (6) param_ihm.php, (7) note.php, and (8) fiche.php in user/; and (9) rowid parameter to admin/boxes.php.",2022-11-17T17:21:59.260
CVE-2011-4814,2.9,"Multiple cross-site scripting (XSS) vulnerabilities in Dolibarr 3.1.0 RC and probably earlier allow remote attackers to inject arbitrary web script or HTML via the PATH_INFO to (1) index.php, (2) admin/boxes.php, (3) comm/clients.php, (4) commande/index.php; and the optioncss parameter to (5) admin/ihm.php and (6) user/home.php.",2022-11-17T17:21:59.260
CVE-2012-1226,6.4,Multiple directory traversal vulnerabilities in Dolibarr CMS 3.2.0 Alpha allow remote attackers to read arbitrary files and possibly execute arbitrary code via a .. (dot dot) in the (1) file parameter to document.php or (2) backtopage parameter in a create action to comm/action/fiche.php.,2022-11-17T17:21:59.260
CVE-2017-17897,5.9,SQL injection vulnerability in comm/multiprix.php in Dolibarr ERP/CRM version 6.0.4 allows remote attackers to execute arbitrary SQL commands via the id parameter.,2022-11-17T17:21:59.260
CVE-2020-12867,3.6,"A NULL pointer dereference in sanei_epson_net_read in SANE Backends before 1.0.30 allows a malicious device connected to the same local network as the victim to cause a denial of service, aka GHSL-2020-075.",2022-11-16T03:45:24.270
CVE-2020-13285,2.7,"For GitLab before 13.0.12, 13.1.6, 13.2.3 a cross-site scripting (XSS) vulnerability exists in the issue reference number tooltip.",2022-11-16T04:08:01.323
CVE-2022-22844,3.6,LibTIFF 4.3.0 has an out-of-bounds read in _TIFFmemcpy in tif_unix.c in certain situations involving a custom tag and 0x0200 as the second word of the DE field.,2022-11-16T19:07:38.983
CVE-2022-0561,3.6,"Null source pointer passed as an argument to memcpy() function within TIFFFetchStripThing() in tif_dirread.c in libtiff versions from 3.9.0 to 4.3.0 could lead to Denial of Service via crafted TIFF file. For users that compile libtiff from sources, the fix is available with commit eecb0712.",2022-11-16T19:12:23.427
CVE-2022-0562,3.6,"Null source pointer passed as an argument to memcpy() function within TIFFReadDirectory() in tif_dirread.c in libtiff versions from 4.0 to 4.3.0 could lead to Denial of Service via crafted TIFF file. For users that compile libtiff from sources, a fix is available with commit 561599c.",2022-11-16T19:13:39.440
CVE-2018-11770,2.5,"From version 1.3.0 onward, Apache Spark's standalone master exposes a REST API for job submission, in addition to the submission mechanism used by spark-submit. In standalone, the config property 'spark.authenticate.secret' establishes a shared secret for authenticating requests to submit jobs via spark-submit. However, the REST API does not use this or any other authentication mechanism, and this is not adequately documented. In this case, a user would be able to run a driver program without authenticating, but not launch executors, using the REST API. This REST API is also used by Mesos, when set up to run in cluster mode (i.e., when also running MesosClusterDispatcher), for job submission. Future versions of Spark will improve documentation on these points, and prohibit setting 'spark.authenticate.secret' when running the REST APIs, to make this clear. Future versions will also disable the REST API by default in the standalone master by changing the default value of 'spark.master.rest.enabled' to 'false'.",2022-11-22T11:15:17.787
CVE-2018-11804,3.6,"Spark's Apache Maven-based build includes a convenience script, 'build/mvn', that downloads and runs a zinc server to speed up compilation. It has been included in release branches since 1.3.x, up to and including master. This server will accept connections from external hosts by default. A specially-crafted request to the zinc server could cause it to reveal information in files readable to the developer account running the build. Note that this issue does not affect end users of Spark, only developers building Spark from source code.",2022-11-22T11:15:28.240
CVE-2020-6096,5.9,"An exploitable signed comparison vulnerability exists in the ARMv7 memcpy() implementation of GNU glibc 2.30.9000. Calling memcpy() (on ARMv7 targets that utilize the GNU glibc implementation) with a negative value for the 'num' parameter results in a signed comparison vulnerability. If an attacker underflows the 'num' parameter to memcpy(), this vulnerability could lead to undefined behavior such as writing to out-of-bounds memory and potentially remote code execution. Furthermore, this memcpy() implementation allows for program execution to continue in scenarios where a segmentation fault or crash should have occurred. The dangers occur in that subsequent execution and iterations of this code will be executed with this corrupted data.",2022-11-21T19:39:51.000
CVE-2020-13948,5.9,"While investigating a bug report on Apache Superset, it was determined that an authenticated user could craft requests via a number of templated text fields in the product that would allow arbitrary access to Pythonâ€™s `os` package in the web application process in versions < 0.37.1. It was thus possible for an authenticated user to list and access files, environment variables, and process information. Additionally it was possible to set environment variables for the current process, create and update files in folders writable by the web process, and execute arbitrary programs accessible by the web process. All other operations available to the `os` package in Python were also available, even if not explicitly enumerated in this CVE.",2022-11-21T13:55:26.917
CVE-2021-20294,5.9,"A flaw was found in binutils readelf 2.35 program. An attacker who is able to convince a victim using readelf to read a crafted file could trigger a stack buffer overflow, out-of-bounds write of arbitrary data supplied by the attacker. The highest impact of this flaw is to confidentiality, integrity, and availability.",2022-11-16T03:23:31.520
CVE-2022-32854,3.6,"This issue was addressed with improved checks. This issue is fixed in iOS 15.7 and iPadOS 15.7, iOS 16, macOS Big Sur 11.7. An app may be able to bypass Privacy preferences.",2022-11-16T17:21:32.300
CVE-2022-32827,3.6,"A memory corruption issue was addressed with improved state management. This issue is fixed in iOS 16, macOS Ventura 13. An app may be able to cause a denial-of-service.",2022-11-18T16:15:17.777
CVE-2022-28764,1.4,"The Zoom Client for Meetings (for Android, iOS, Linux, macOS, and Windows) before version 5.12.6 is susceptible to a local information exposure vulnerability. A failure to clear data from a local SQL database after a meeting ends and the usage of an insufficiently secure per-device key encrypting that database results in a local malicious user being able to obtain meeting information such as in-meeting chat for the previous meeting attended from that local user account.",2022-11-17T22:03:14.767
CVE-2022-28768,5.9,The Zoom Client for Meetings Installer for macOS (Standard and for IT Admin) before version 5.12.6 contains a local privilege escalation vulnerability. A local low-privileged user could exploit this vulnerability during the install process to escalate their privileges to root.,2022-11-22T17:12:19.050
CVE-2011-4329,2.9,"Multiple cross-site scripting (XSS) vulnerabilities in Dolibarr 3.1.0 allow remote attackers to inject arbitrary web script or HTML via (1) the username parameter in a setup action to admin/company.php, or the PATH_INFO to (2) admin/security_other.php, (3) admin/events.php, or (4) admin/user.php.",2022-11-17T17:21:59.260
CVE-2011-4802,6.4,"Multiple SQL injection vulnerabilities in Dolibarr 3.1.0 RC and probably earlier allow remote authenticated users to execute arbitrary SQL commands via the (1) sortfield, (2) sortorder, and (3) sall parameters to user/index.php and (b) user/group/index.php; the id parameter to (4) info.php, (5) perms.php, (6) param_ihm.php, (7) note.php, and (8) fiche.php in user/; and (9) rowid parameter to admin/boxes.php.",2022-11-17T17:21:59.260
CVE-2011-4814,2.9,"Multiple cross-site scripting (XSS) vulnerabilities in Dolibarr 3.1.0 RC and probably earlier allow remote attackers to inject arbitrary web script or HTML via the PATH_INFO to (1) index.php, (2) admin/boxes.php, (3) comm/clients.php, (4) commande/index.php; and the optioncss parameter to (5) admin/ihm.php and (6) user/home.php.",2022-11-17T17:21:59.260
CVE-2012-1225,6.4,Multiple SQL injection vulnerabilities in Dolibarr CMS 3.2.0 Alpha and earlier allow remote authenticated users to execute arbitrary SQL commands via the (1) memberslist parameter (aka Member List) in list.php or (2) rowid parameter to adherents/fiche.php.,2022-11-17T17:21:59.260
CVE-2012-1226,6.4,Multiple directory traversal vulnerabilities in Dolibarr CMS 3.2.0 Alpha allow remote attackers to read arbitrary files and possibly execute arbitrary code via a .. (dot dot) in the (1) file parameter to document.php or (2) backtopage parameter in a create action to comm/action/fiche.php.,2022-11-17T17:21:59.260
CVE-2022-28764,1.4,"The Zoom Client for Meetings (for Android, iOS, Linux, macOS, and Windows) before version 5.12.6 is susceptible to a local information exposure vulnerability. A failure to clear data from a local SQL database after a meeting ends and the usage of an insufficiently secure per-device key encrypting that database results in a local malicious user being able to obtain meeting information such as in-meeting chat for the previous meeting attended from that local user account.",2022-11-17T22:03:14.767
CVE-2022-28766,5.9,Windows 32-bit versions of the Zoom Client for Meetings before 5.12.6 and Zoom Rooms for Conference Room before version 5.12.6 are susceptible to a DLL injection vulnerability. A local low-privileged user could exploit this vulnerability to run arbitrary code in the context of the Zoom client.,2022-11-22T16:14:12.610
CVE-2022-28768,5.9,The Zoom Client for Meetings Installer for macOS (Standard and for IT Admin) before version 5.12.6 contains a local privilege escalation vulnerability. A local low-privileged user could exploit this vulnerability during the install process to escalate their privileges to root.,2022-11-22T17:12:19.050
CVE-2022-36924,5.9,The Zoom Rooms Installer for Windows prior to 5.12.6 contains a local privilege escalation vulnerability. A local low-privileged user could exploit this vulnerability during the install process to escalate their privileges to the SYSTEM user.,2022-11-22T00:41:50.917
CVE-2022-34666,3.6,"NVIDIA GPU Display Driver for Windows and Linux contains a vulnerability in the kernel mode layer, where a local user with basic capabilities can cause a null-pointer dereference, which may lead to denial of service.",2022-11-19T00:15:27.867
