CVE,"Impact Score (1-10, 10 being the worst)",Keyword,Description,Last Modified,Link
CVE-2023-38276,3.6,IBM,IBM Cognos Dashboards on Cloud Pak for Data 4.7.0 exposes sensitive information in environment variables which could aid in further attacks against the system.  IBM X-Force ID:  260736.,2023-10-27T19:32:30.057,https://cve.circl.lu/cve/CVE-2023-38276
CVE-2023-38735,3.6,IBM,"IBM Cognos Dashboards on Cloud Pak for Data 4.7.0 could allow a remote attacker to bypass security restrictions, caused by a reverse tabnabbing flaw. An attacker could exploit this vulnerability and redirect a victim to a phishing site.  IBM X-Force ID:  262482.",2023-10-27T19:32:01.610,https://cve.circl.lu/cve/CVE-2023-38735
CVE-2023-38722,2.7,IBM,"IBM Sterling Partner Engagement Manager 6.1.2, 6.2.0, and 6.2.2 is vulnerable to stored cross-site scripting. This vulnerability allows users to embed arbitrary JavaScript code in the Web UI thus altering the intended functionality potentially leading to credentials disclosure within a trusted session.  IBM X-Force ID:  262174.",2023-10-28T03:32:31.233,https://cve.circl.lu/cve/CVE-2023-38722
CVE-2023-43045,3.6,IBM,"IBM Sterling Partner Engagement Manager 6.1.2, 6.2.0, and 6.2.2 could allow a remote user to perform unauthorized actions due to improper authentication.  IBM X-Force ID:  266896.",2023-10-28T03:33:35.547,https://cve.circl.lu/cve/CVE-2023-43045
CVE-2023-1638,3.6,IOBit,A vulnerability was found in IObit Malware Fighter 9.4.0.776. It has been rated as problematic. Affected by this issue is the function 0x8001E024/0x8001E040 in the library ImfRegistryFilter.sys of the component IOCTL Handler. The manipulation leads to denial of service. Attacking locally is a requirement. The exploit has been disclosed to the public and may be used. VDB-224018 is the identifier assigned to this vulnerability.,2023-10-30T19:26:23.940,https://cve.circl.lu/cve/CVE-2023-1638
CVE-2023-1639,3.6,IOBit,A vulnerability classified as problematic has been found in IObit Malware Fighter 9.4.0.776. This affects the function 0x8001E04C in the library ImfRegistryFilter.sys of the component IOCTL Handler. The manipulation leads to denial of service. It is possible to launch the attack on the local host. The exploit has been disclosed to the public and may be used. The associated identifier of this vulnerability is VDB-224019.,2023-10-30T19:26:18.397,https://cve.circl.lu/cve/CVE-2023-1639
CVE-2023-1640,3.6,IOBit,A vulnerability classified as problematic was found in IObit Malware Fighter 9.4.0.776. This vulnerability affects the function 0x222010 in the library ObCallbackProcess.sys of the component IOCTL Handler. The manipulation leads to denial of service. The attack needs to be approached locally. The exploit has been disclosed to the public and may be used. The identifier of this vulnerability is VDB-224020.,2023-10-30T19:26:10.607,https://cve.circl.lu/cve/CVE-2023-1640
CVE-2023-1641,3.6,IOBit,"A vulnerability, which was classified as problematic, has been found in IObit Malware Fighter 9.4.0.776. This issue affects the function 0x222018 in the library ObCallbackProcess.sys of the component IOCTL Handler. The manipulation leads to denial of service. An attack has to be approached locally. The exploit has been disclosed to the public and may be used. The identifier VDB-224021 was assigned to this vulnerability.",2023-10-30T19:26:05.373,https://cve.circl.lu/cve/CVE-2023-1641
CVE-2023-1642,3.6,IOBit,"A vulnerability, which was classified as problematic, was found in IObit Malware Fighter 9.4.0.776. Affected is the function 0x222034/0x222038/0x22203C/0x222040 in the library ObCallbackProcess.sys of the component IOCTL Handler. The manipulation leads to denial of service. Local access is required to approach this attack. The exploit has been disclosed to the public and may be used. VDB-224022 is the identifier assigned to this vulnerability.",2023-10-30T18:24:11.717,https://cve.circl.lu/cve/CVE-2023-1642
CVE-2023-4571,6.0,Intel,"In Splunk IT Service Intelligence (ITSI) versions below below 4.13.3, 4.15.3, or 4.17.1, a malicious actor can inject American National Standards Institute (ANSI) escape codes into Splunk ITSI log files that, when a vulnerable terminal application reads them, can run malicious code in the vulnerable application. This attack requires a user to use a terminal application that translates ANSI escape codes to read the malicious log file locally in the vulnerable terminal. The vulnerability also requires additional user interaction to succeed. The vulnerability does not directly affect Splunk ITSI. The indirect impact on Splunk ITSI can vary significantly depending on the permissions in the vulnerable terminal application, as well as where and how the user reads the malicious log file. For example, users can copy the malicious file from Splunk ITSI and read it on their local machine.",2023-10-31T17:15:23.357,https://cve.circl.lu/cve/CVE-2023-4571
CVE-2023-45813,3.6,Intel,Torbot is an open source tor network intelligence tool. In affected versions the `torbot.modules.validators.validate_link function` uses the python-validators URL validation regex. This particular regular expression has an exponential complexity which allows an attacker to cause an application crash using a well-crafted argument. An attacker can use a well-crafted URL argument to exploit the vulnerability in the regular expression and cause a Denial of Service on the system. The validators file has been removed in version 4.0.0. Users are advised to upgrade. There are no known workarounds for this vulnerability.,2023-10-30T13:37:36.380,https://cve.circl.lu/cve/CVE-2023-45813
CVE-2023-26219,5.9,Intel,"The Hawk Console and Hawk Agent components of TIBCO Software Inc.'s TIBCO Hawk, TIBCO Hawk Distribution for TIBCO Silver Fabric, TIBCO Operational Intelligence Hawk RedTail, and TIBCO Runtime Agent contain a vulnerability that theoretically allows an attacker with access to the Hawk Console’s and Agent’s log to obtain credentials used to access associated EMS servers. Affected releases are TIBCO Software Inc.'s TIBCO Hawk: versions 6.2.2 and below, TIBCO Hawk Distribution for TIBCO Silver Fabric: versions 6.2.2 and below, TIBCO Operational Intelligence Hawk RedTail: versions 7.2.1 and below, and TIBCO Runtime Agent: versions 5.12.2 and below.",2023-11-02T13:37:04.960,https://cve.circl.lu/cve/CVE-2023-26219
CVE-2023-46248,6.0,Intel,"Cody is an artificial intelligence (AI) coding assistant. The Cody AI VSCode extension versions 0.10.0 through 0.14.0 are vulnerable to Remote Code Execution under certain conditions. An attacker in control of a malicious repository could modify the Cody configuration file `.vscode/cody.json` and overwrite Cody commands. If a user with the extension installed opens this malicious repository and runs a Cody command such as /explain or /doc, this could allow arbitrary code execution on the user's machine. The vulnerability is rated as critical severity, but with low exploitability. It requires the user to have a malicious repository loaded and execute the overwritten command in VS Code. The issue is exploitable regardless of the user blocking code execution on a repository through VS Code Workspace Trust. The issue was found during a regular 3rd party penetration test. The maintainers of Cody do not have evidence of open source repositories having malicious `.vscode/cody.json` files to exploit this vulnerability. The issue is fixed in version 0.14.1 of the Cody VSCode extension. In case users can't promptly upgrade, they should not open any untrusted repositories with the Cody extension loaded.",2023-10-31T17:07:44.967,https://cve.circl.lu/cve/CVE-2023-46248
CVE-2023-46129,3.6,IoT,"NATS.io is a high performance open source pub-sub distributed communication technology, built for the cloud, on-premise, IoT, and edge computing. The cryptographic key handling library, nkeys, recently gained support for encryption, not just for signing/authentication. This is used in nats-server 2.10 (Sep 2023) and newer for authentication callouts. In nkeys versions 0.4.0 through 0.4.5, corresponding with NATS server versions 2.10.0 through 2.10.3, the nkeys library's `xkeys` encryption handling logic mistakenly passed an array by value into an internal function, where the function mutated that buffer to populate the encryption key to use. As a result, all encryption was actually to an all-zeros key. This affects encryption only, not signing.  FIXME: FILL IN IMPACT ON NATS-SERVER AUTH CALLOUT SECURITY. nkeys Go library 0.4.6, corresponding with NATS Server 2.10.4, has a patch for this issue. No known workarounds are available. For any application handling auth callouts in Go, if using the nkeys library, update the dependency, recompile and deploy that in lockstep.",2023-10-31T18:15:08.653,https://cve.circl.lu/cve/CVE-2023-46129
CVE-2023-3972,5.9,Insight,"A vulnerability was found in insights-client. This security issue occurs because of insecure file operations or unsafe handling of temporary files and directories that lead to local privilege escalation. Before the insights-client has been registered on the system by root, an unprivileged local user or attacker could create the /var/tmp/insights-client directory (owning the directory with read, write, and execute permissions) on the system. After the insights-client is registered by root, an attacker could then control the directory content that insights are using by putting malicious scripts into it and executing arbitrary code as root (trivially bypassing SELinux protections because insights processes are allowed to disable SELinux system-wide).",2023-11-02T14:15:11.350,https://cve.circl.lu/cve/CVE-2023-3972
CVE-2022-23631,5.9,Java,superjson is a program to allow JavaScript expressions to be serialized to a superset of JSON. In versions prior to 1.8.1 superjson allows input to run arbitrary code on any server using superjson input without prior authentication or knowledge. The only requirement is that the server implements at least one endpoint which uses superjson during request processing. This has been patched in superjson 1.8.1. Users are advised to update. There are no known workarounds for this issue.,2023-10-31T23:15:08.257,https://cve.circl.lu/cve/CVE-2022-23631
CVE-2022-29532,2.7,Java,"An issue was discovered in MISP before 2.4.158. There is XSS in the cerebrate view if one administrator puts a javascript: URL in the URL field, and another administrator clicks on it.",2023-10-30T22:15:09.463,https://cve.circl.lu/cve/CVE-2022-29532
CVE-2022-36899,4.2,Java,"Jenkins Compuware ISPW Operations Plugin 1.0.8 and earlier does not restrict execution of a controller/agent message to agents, allowing attackers able to control agent processes to retrieve Java system properties.",2023-11-02T21:05:45.437,https://cve.circl.lu/cve/CVE-2022-36899
CVE-2022-36900,4.2,Java,"Jenkins Compuware zAdviser API Plugin 1.0.3 and earlier does not restrict execution of a controller/agent message to agents, allowing attackers able to control agent processes to retrieve Java system properties.",2023-11-02T21:05:53.617,https://cve.circl.lu/cve/CVE-2022-36900
CVE-2022-2941,2.7,Java,"The WP-UserOnline plugin for WordPress has multiple Stored Cross-Site Scripting vulnerabilities in versions up to, and including 2.88.0. This is due to the fact that all fields in the ""Naming Conventions"" section do not properly sanitize user input, nor escape it on output. This makes it possible for authenticated attackers, with administrative privileges, to inject JavaScript code into the setting that will execute whenever a user accesses the injected page. This only affects multi-site installations and installations where unfiltered_html has been disabled.",2023-11-02T02:15:45.410,https://cve.circl.lu/cve/CVE-2022-2941
CVE-2019-10401,2.7,Jenkins,"In Jenkins 2.196 and earlier, LTS 2.176.3 and earlier, the f:expandableTextBox form control interpreted its content as HTML when expanded, resulting in a stored XSS vulnerability exploitable by users with permission to define its contents (typically Job/Configure).",2023-11-02T21:06:38.500,https://cve.circl.lu/cve/CVE-2019-10401
CVE-2019-10402,2.7,Jenkins,"In Jenkins 2.196 and earlier, LTS 2.176.3 and earlier, the f:combobox form control interpreted its item labels as HTML, resulting in a stored XSS vulnerability exploitable by users with permission to define its contents.",2023-11-02T21:06:42.280,https://cve.circl.lu/cve/CVE-2019-10402
CVE-2019-10403,2.7,Jenkins,"Jenkins 2.196 and earlier, LTS 2.176.3 and earlier did not escape the SCM tag name on the tooltip for SCM tag actions, resulting in a stored XSS vulnerability exploitable by users able to control SCM tag names for these actions.",2023-11-02T21:06:46.090,https://cve.circl.lu/cve/CVE-2019-10403
CVE-2019-10404,2.7,Jenkins,"Jenkins 2.196 and earlier, LTS 2.176.3 and earlier did not escape the reason why a queue items is blcoked in tooltips, resulting in a stored XSS vulnerability exploitable by users able to control parts of the reason a queue item is blocked, such as label expressions not matching any idle executors.",2023-11-02T21:30:17.540,https://cve.circl.lu/cve/CVE-2019-10404
CVE-2019-10405,2.5,Jenkins,"Jenkins 2.196 and earlier, LTS 2.176.3 and earlier printed the value of the ""Cookie"" HTTP request header on the /whoAmI/ URL, allowing attackers exploiting another XSS vulnerability to obtain the HTTP session cookie despite it being marked HttpOnly.",2023-11-02T21:30:24.780,https://cve.circl.lu/cve/CVE-2019-10405
CVE-2023-5430,5.9,JQuery,"The Jquery news ticker plugin for WordPress is vulnerable to SQL Injection via the plugin's shortcode in versions up to, and including, 3.0 due to insufficient escaping on the user supplied parameter and lack of sufficient preparation on the existing SQL query. This makes it possible for authenticated attackers with subscriber-level and above permissions to append additional SQL queries into already existing queries that can be used to extract sensitive information from the database.",2023-10-31T12:58:31.637,https://cve.circl.lu/cve/CVE-2023-5430
CVE-2023-5464,5.9,JQuery,"The Jquery accordion slideshow plugin for WordPress is vulnerable to SQL Injection via the plugin's shortcode in versions up to, and including, 8.1 due to insufficient escaping on the user supplied parameter and lack of sufficient preparation on the existing SQL query. This makes it possible for authenticated attackers with subscriber-level and above permissions to append additional SQL queries into already existing queries that can be used to extract sensitive information from the database.",2023-10-31T12:58:27.687,https://cve.circl.lu/cve/CVE-2023-5464
CVE-2022-23631,5.9,JavaScript,superjson is a program to allow JavaScript expressions to be serialized to a superset of JSON. In versions prior to 1.8.1 superjson allows input to run arbitrary code on any server using superjson input without prior authentication or knowledge. The only requirement is that the server implements at least one endpoint which uses superjson during request processing. This has been patched in superjson 1.8.1. Users are advised to update. There are no known workarounds for this issue.,2023-10-31T23:15:08.257,https://cve.circl.lu/cve/CVE-2022-23631
CVE-2022-29532,2.7,JavaScript,"An issue was discovered in MISP before 2.4.158. There is XSS in the cerebrate view if one administrator puts a javascript: URL in the URL field, and another administrator clicks on it.",2023-10-30T22:15:09.463,https://cve.circl.lu/cve/CVE-2022-29532
CVE-2022-2941,2.7,JavaScript,"The WP-UserOnline plugin for WordPress has multiple Stored Cross-Site Scripting vulnerabilities in versions up to, and including 2.88.0. This is due to the fact that all fields in the ""Naming Conventions"" section do not properly sanitize user input, nor escape it on output. This makes it possible for authenticated attackers, with administrative privileges, to inject JavaScript code into the setting that will execute whenever a user accesses the injected page. This only affects multi-site installations and installations where unfiltered_html has been disabled.",2023-11-02T02:15:45.410,https://cve.circl.lu/cve/CVE-2022-2941
CVE-2023-33186,2.7,JavaScript,"Zulip is an open-source team collaboration tool with unique topic-based threading that combines the best of email and chat to make remote work productive and delightful. The main development branch of Zulip Server from May 2, 2023 and later, including beta versions 7.0-beta1 and 7.0-beta2, is vulnerable to a cross-site scripting vulnerability in tooltips on the message feed. An attacker who can send messages could maliciously craft a topic for the message, such that a victim who hovers the tooltip for that topic in their message feed triggers execution of JavaScript code controlled by the attacker.",2023-11-02T17:15:11.357,https://cve.circl.lu/cve/CVE-2023-33186
CVE-2023-5631,2.7,JavaScript,"Roundcube before 1.4.15, 1.5.x before 1.5.5, and 1.6.x before 1.6.4 allows stored XSS via an HTML e-mail message with a crafted SVG document because of program/lib/Roundcube/rcube_washtml.php behavior. This could allow a remote attackerto load arbitrary JavaScript code.",2023-11-01T15:15:08.873,https://cve.circl.lu/cve/CVE-2023-5631
CVE-2023-22025,1.4,JDK,"Vulnerability in the Oracle Java SE, Oracle GraalVM Enterprise Edition, Oracle GraalVM for JDK product of Oracle Java SE (component: Hotspot).  Supported versions that are affected are Oracle Java SE: 8u381-perf, 17.0.8, 21; Oracle GraalVM for JDK: 17.0.8 and  21. Difficult to exploit vulnerability allows unauthenticated attacker with network access via multiple protocols to compromise Oracle Java SE, Oracle GraalVM Enterprise Edition, Oracle GraalVM for JDK.  Successful attacks of this vulnerability can result in  unauthorized update, insert or delete access to some of Oracle Java SE, Oracle GraalVM Enterprise Edition, Oracle GraalVM for JDK accessible data. Note: This vulnerability can be exploited by using APIs in the specified Component, e.g., through a web service which supplies data to the APIs. This vulnerability also applies to Java deployments, typically in clients running sandboxed Java Web Start applications or sandboxed Java applets, that load and run untrusted code (e.g., code that comes from the internet) and rely on the Java sandbox for security. CVSS 3.1 Base Score 3.7 (Integrity impacts).  CVSS Vector: (CVSS:3.1/AV:N/AC:H/PR:N/UI:N/S:U/C:N/I:L/A:N).",2023-10-27T15:15:09.823,https://cve.circl.lu/cve/CVE-2023-22025
CVE-2023-22081,1.4,JDK,"Vulnerability in the Oracle Java SE, Oracle GraalVM for JDK product of Oracle Java SE (component: JSSE).  Supported versions that are affected are Oracle Java SE: 8u381, 8u381-perf, 11.0.20, 17.0.8, 21; Oracle GraalVM for JDK: 17.0.8 and  21. Easily exploitable vulnerability allows unauthenticated attacker with network access via HTTPS to compromise Oracle Java SE, Oracle GraalVM for JDK.  Successful attacks of this vulnerability can result in unauthorized ability to cause a partial denial of service (partial DOS) of Oracle Java SE, Oracle GraalVM for JDK. Note: This vulnerability applies to Java deployments, typically in clients running sandboxed Java Web Start applications or sandboxed Java applets, that load and run untrusted code (e.g., code that comes from the internet) and rely on the Java sandbox for security. This vulnerability does not apply to Java deployments, typically in servers, that load and run only trusted code (e.g., code installed by an administrator). CVSS 3.1 Base Score 5.3 (Availability impacts).  CVSS Vector: (CVSS:3.1/AV:N/AC:L/PR:N/UI:N/S:U/C:N/I:N/A:L).",2023-10-29T10:15:08.243,https://cve.circl.lu/cve/CVE-2023-22081
CVE-2023-40029,5.8,Kubernetes,"Argo CD is a declarative continuous deployment for Kubernetes. Argo CD Cluster secrets might be managed declaratively using Argo CD / kubectl apply. As a result, the full secret body is stored in`kubectl.kubernetes.io/last-applied-configuration` annotation. pull request #7139 introduced the ability to manage cluster labels and annotations. Since clusters are stored as secrets it also exposes the `kubectl.kubernetes.io/last-applied-configuration` annotation which includes full secret body. In order to view the cluster annotations via the Argo CD API, the user must have `clusters, get` RBAC access. **Note:** In many cases, cluster secrets do not contain any actually-secret information. But sometimes, as in bearer-token auth, the contents might be very sensitive. The bug has been patched in versions 2.8.3, 2.7.14, and 2.6.15. Users are advised to upgrade. Users unable to upgrade should update/deploy cluster secret with `server-side-apply` flag which does not use or rely on `kubectl.kubernetes.io/last-applied-configuration` annotation. Note: annotation for existing secrets will require manual removal.",2023-10-27T14:31:09.933,https://cve.circl.lu/cve/CVE-2023-40029
CVE-2023-3676,5.9,Kubernetes,A security issue was discovered in Kubernetes where a user that can create pods on Windows nodes may be able to escalate to admin privileges on those nodes. Kubernetes clusters are only affected if they include Windows nodes.,2023-11-01T12:51:21.720,https://cve.circl.lu/cve/CVE-2023-3676
CVE-2023-3955,5.9,Kubernetes,A security issue was discovered in Kubernetes where a user that can create pods on Windows nodes may be able to escalate to admin privileges on those nodes. Kubernetes clusters are only affected if they include Windows nodes.,2023-11-01T12:51:21.720,https://cve.circl.lu/cve/CVE-2023-3955
CVE-2023-5408,6.0,Kubernetes,A privilege escalation flaw was found in the node restriction admission plugin of the kubernetes api server of OpenShift. A remote attacker who modifies the node role label could steer workloads from the control plane and etcd nodes onto different worker nodes and gain broader access to the cluster.,2023-11-02T12:54:30.570,https://cve.circl.lu/cve/CVE-2023-5408
CVE-2022-0353,3.6,Lenovo,A denial of service vulnerability was reported in the Lenovo HardwareScanPlugin versions prior to 1.3.1.2 and Lenovo Diagnostics versions prior to 4.45 that could allow a local user with administrative access to trigger a system crash.,2023-10-30T18:18:25.037,https://cve.circl.lu/cve/CVE-2022-0353
CVE-2022-3698,3.6,Lenovo,A denial of service vulnerability was reported in the Lenovo HardwareScanPlugin versions prior to 1.3.1.2 and Lenovo Diagnostics versions prior to 4.45 that could allow a local user with administrative access to trigger a system crash.,2023-10-30T18:11:34.410,https://cve.circl.lu/cve/CVE-2022-3698
CVE-2022-3699,5.9,Lenovo,A privilege escalation vulnerability was reported in the Lenovo HardwareScanPlugin prior to version 1.3.1.2 and Lenovo Diagnostics prior to version 4.45 that could allow a local user to execute code with elevated privileges.,2023-10-30T18:11:51.657,https://cve.circl.lu/cve/CVE-2022-3699
CVE-2022-34886,5.9,Lenovo,"A remote code execution vulnerability was found in the firmware used in some Lenovo printers, which can be caused by a remote user pushing an illegal string to the server-side interface via a script, resulting in a stack overflow.",2023-10-29T01:44:42.707,https://cve.circl.lu/cve/CVE-2022-34886
CVE-2022-34887,1.4,Lenovo,"Standard users can directly operate and set printer configuration information , such as IP, in some Lenovo Printers without having to authenticate with the administrator password.",2023-10-29T01:44:42.707,https://cve.circl.lu/cve/CVE-2022-34887
CVE-2013-1763,10.0,Linux,Array index error in the __sock_diag_rcv_msg function in net/core/sock_diag.c in the Linux kernel before 3.7.10 allows local users to gain privileges via a large family value in a Netlink message.,2023-11-01T15:32:25.673,https://cve.circl.lu/cve/CVE-2013-1763
CVE-2015-8816,5.9,Linux,"The hub_activate function in drivers/usb/core/hub.c in the Linux kernel before 4.3.5 does not properly maintain a hub-interface data structure, which allows physically proximate attackers to cause a denial of service (invalid memory access and system crash) or possibly have unspecified other impact by unplugging a USB hub device.",2023-11-01T14:51:48.467,https://cve.circl.lu/cve/CVE-2015-8816
CVE-2023-31084,3.6,Linux,"An issue was discovered in drivers/media/dvb-core/dvb_frontend.c in the Linux kernel 6.2. There is a blocking operation when a task is in !TASK_RUNNING. In dvb_frontend_get_event, wait_event_interruptible is called; the condition is dvb_frontend_test_event(fepriv,events). In dvb_frontend_test_event, down(&fepriv->sem) is called. However, wait_event_interruptible would put the process to sleep, and down(&fepriv->sem) may block the process.",2023-11-02T01:41:00.627,https://cve.circl.lu/cve/CVE-2023-31084
CVE-2023-3111,5.9,Linux,A use after free vulnerability was found in prepare_to_relocate in fs/btrfs/relocation.c in btrfs in the Linux Kernel. This possible flaw can be triggered by calling btrfs_ioctl_balance() before calling btrfs_ioctl_defrag().,2023-10-29T02:42:56.190,https://cve.circl.lu/cve/CVE-2023-3111
CVE-2023-3141,5.2,Linux,"A use-after-free flaw was found in r592_remove in drivers/memstick/host/r592.c in media access in the Linux Kernel. This flaw allows a local attacker to crash the system at device disconnect, possibly leading to a kernel information leak.",2023-10-29T02:42:59.993,https://cve.circl.lu/cve/CVE-2023-3141
CVE-2023-44219,NA,MSI,A local privilege escalation vulnerability in SonicWall Directory Services Connector Windows MSI client 4.1.21 and earlier versions allows a local low-privileged user to gain system privileges through running the recovery feature.,2023-10-27T12:41:08.827,https://cve.circl.lu/cve/CVE-2023-44219
