CVE,"Impact Score (1-10, 10 being the worst)",Keyword,Description,Last Modified,Link
CVE-2023-1894,NA,Puppet,A Regular Expression Denial of Service (ReDoS) issue was discovered in Puppet Server 7.9.2 certificate validation. An issue related to specifically crafted certificate names significantly slowed down server operations.,2023-05-05T13:33:53.507,https://cve.circl.lu/cve/CVE-2023-1894
CVE-2020-2978,1.4,RDP,"Vulnerability in the Oracle Database - Enterprise Edition component of Oracle Database Server. Supported versions that are affected are 12.1.0.2, 12.2.0.1, 18c and 19c. Easily exploitable vulnerability allows high privileged attacker having DBA role account privilege with network access via Oracle Net to compromise Oracle Database - Enterprise Edition. While the vulnerability is in Oracle Database - Enterprise Edition, attacks may significantly impact additional products. Successful attacks of this vulnerability can result in unauthorized update, insert or delete access to some of Oracle Database - Enterprise Edition accessible data. CVSS 3.1 Base Score 4.1 (Integrity impacts). CVSS Vector: (CVSS:3.1/AV:N/AC:L/PR:H/UI:N/S:C/C:N/I:L/A:N).",2023-05-05T19:15:14.877,https://cve.circl.lu/cve/CVE-2020-2978
CVE-2022-31214,5.9,RDP,"A Privilege Context Switching issue was discovered in join.c in Firejail 0.9.68. By crafting a bogus Firejail container that is accepted by the Firejail setuid-root program as a join target, a local attacker can enter an environment in which the Linux user namespace is still the initial user namespace, the NO_NEW_PRIVS prctl is not activated, and the entered mount namespace is under the attacker's control. In this way, the filesystem layout can be adjusted to gain root privileges through execution of available setuid-root binaries such as su or sudo.",2023-05-03T12:16:11.207,https://cve.circl.lu/cve/CVE-2022-31214
CVE-2022-1113,2.7,RDP,"The Flower Delivery by Florist One WordPress plugin through 3.7 does not sanitise and escape some of its settings, which could allow high privilege users such as admin to perform Stored Cross-Site Scripting attacks when the unfiltered_html capability is disallowed (for example in multisite setups)",2023-05-02T10:15:08.983,https://cve.circl.lu/cve/CVE-2022-1113
CVE-2022-4471,2.7,RDP,"The YARPP WordPress plugin before 5.30.3 does not validate and escape some of its shortcode attributes before outputting them back in a page/post where the shortcode is embed, which could allow users with the contributor role and above to perform Stored Cross-Site Scripting attacks",2023-05-02T10:15:09.250,https://cve.circl.lu/cve/CVE-2022-4471
CVE-2023-22686,5.9,RDP,Cross-Site Request Forgery (CSRF) vulnerability in TriniTronic Nice PayPal Button Lite plugin <= 1.3.5 versions.,2023-05-02T17:16:41.387,https://cve.circl.lu/cve/CVE-2023-22686
CVE-2015-5122,10.0,Rapid7,"Use-after-free vulnerability in the DisplayObject class in the ActionScript 3 (AS3) implementation in Adobe Flash Player 13.x through 13.0.0.302 on Windows and OS X, 14.x through 18.0.0.203 on Windows and OS X, 11.x through 11.2.202.481 on Linux, and 12.x through 18.0.0.204 on Linux Chrome installations allows remote attackers to execute arbitrary code or cause a denial of service (memory corruption) via crafted Flash content that leverages improper handling of the opaqueBackground property, as exploited in the wild in July 2015.",2023-05-08T13:29:02.290,https://cve.circl.lu/cve/CVE-2015-5122
CVE-2023-2226,1.4,Rapid7,"Due to insufficient validation in the PE and OLE parsers in Rapid7's Velociraptor versions earlier than 0.6.8 allows attacker to crash Velociraptor during parsing of maliciously malformed files. For this attack to succeed, the attacker needs to be able to introduce malicious files to the system at the same time that Velociraptor attempts to collect any artifacts that attempt to parse PE files, Authenticode signatures, or OLE files. After crashing, the Velociraptor service will restart and it will still be possible to collect other artifacts.",2023-05-03T14:51:43.173,https://cve.circl.lu/cve/CVE-2023-2226
CVE-2023-2273,3.6,Rapid7,"Rapid7 Insight Agent token handler versions 3.2.6 and below, suffer from a Directory Traversal vulnerability whereby unsanitized input from a CLI argument flows into io.ioutil.WriteFile, where it is used as a path. This can result in a Path Traversal vulnerability and allow an attacker to write arbitrary files. This issue is remediated in version 3.3.0 via safe guards that reject inputs that attempt to do path traversal.",2023-05-04T17:52:05.037,https://cve.circl.lu/cve/CVE-2023-2273
CVE-2015-5122,10.0,Red Hat,"Use-after-free vulnerability in the DisplayObject class in the ActionScript 3 (AS3) implementation in Adobe Flash Player 13.x through 13.0.0.302 on Windows and OS X, 14.x through 18.0.0.203 on Windows and OS X, 11.x through 11.2.202.481 on Linux, and 12.x through 18.0.0.204 on Linux Chrome installations allows remote attackers to execute arbitrary code or cause a denial of service (memory corruption) via crafted Flash content that leverages improper handling of the opaqueBackground property, as exploited in the wild in July 2015.",2023-05-08T13:29:02.290,https://cve.circl.lu/cve/CVE-2015-5122
CVE-2016-0959,5.9,Red Hat,"Use after free vulnerability in Adobe Flash Player Desktop Runtime before 20.0.0.267, Adobe Flash Player Extended Support Release before 18.0.0.324, Adobe Flash Player for Google Chrome before 20.0.0.267, Adobe Flash Player for Microsoft Edge and Internet Explorer 11 before 20.0.0.267, Adobe Flash Player for Internet Explorer 10 and 11 before 20.0.0.267, Adobe Flash Player for Linux before 11.2.202.559, AIR Desktop Runtime before 20.0.0.233, AIR SDK before 20.0.0.233, AIR SDK & Compiler before 20.0.0.233, AIR for Android before 20.0.0.233.",2023-05-08T13:29:02.290,https://cve.circl.lu/cve/CVE-2016-0959
CVE-2019-13616,5.2,Red Hat,SDL (Simple DirectMedia Layer) through 1.2.15 and 2.x through 2.0.9 has a heap-based buffer over-read in BlitNtoN in video/SDL_blit_N.c when called from SDL_SoftBlit in video/SDL_blit.c.,2023-05-03T12:15:14.047,https://cve.circl.lu/cve/CVE-2019-13616
CVE-2020-8597,5.9,Red Hat,eap.c in pppd in ppp 2.4.2 through 2.4.8 has an rhostname buffer overflow in the eap_request and eap_response functions.,2023-05-05T17:48:17.840,https://cve.circl.lu/cve/CVE-2020-8597
CVE-2020-35492,5.9,Red Hat,"A flaw was found in cairo's image-compositor.c in all versions prior to 1.17.4. This flaw allows an attacker who can provide a crafted input file to cairo's image-compositor (for example, by convincing a user to open a file in an application using cairo, or if an application uses cairo on untrusted input) to cause a stack buffer overflow -> out-of-bounds WRITE. The highest impact from this vulnerability is to confidentiality, integrity, as well as system availability.",2023-05-03T12:15:15.287,https://cve.circl.lu/cve/CVE-2020-35492
CVE-2022-0108,3.6,Remote Desktop,Inappropriate implementation in Navigation in Google Chrome prior to 97.0.4692.71 allowed a remote attacker to leak cross-origin data via a crafted HTML page.,2023-05-05T17:15:09.343,https://cve.circl.lu/cve/CVE-2022-0108
CVE-2022-3723,5.9,Remote Desktop,Type confusion in V8 in Google Chrome prior to 107.0.5304.87 allowed a remote attacker to potentially exploit heap corruption via a crafted HTML page. (Chromium security severity: High),2023-05-03T12:16:26.557,https://cve.circl.lu/cve/CVE-2022-3723
CVE-2022-3445,5.9,Remote Desktop,Use after free in Skia in Google Chrome prior to 106.0.5249.119 allowed a remote attacker to potentially exploit heap corruption via a crafted HTML page. (Chromium security severity: High),2023-05-03T12:16:23.537,https://cve.circl.lu/cve/CVE-2022-3445
CVE-2022-3446,5.9,Remote Desktop,Heap buffer overflow in WebSQL in Google Chrome prior to 106.0.5249.119 allowed a remote attacker to potentially exploit heap corruption via a crafted HTML page. (Chromium security severity: High),2023-05-03T12:16:24.030,https://cve.circl.lu/cve/CVE-2022-3446
CVE-2022-3447,1.4,Remote Desktop,Inappropriate implementation in Custom Tabs in Google Chrome on Android prior to 106.0.5249.119 allowed a remote attacker to spoof the contents of the Omnibox (URL bar) via a crafted HTML page. (Chromium security severity: High),2023-05-03T12:16:24.360,https://cve.circl.lu/cve/CVE-2022-3447
CVE-2022-1154,5.9,Repository,Use after free in utf_ptr2char in GitHub repository vim/vim prior to 8.2.4646.,2023-05-03T12:15:16.557,https://cve.circl.lu/cve/CVE-2022-1154
CVE-2022-1160,5.9,Repository,heap buffer overflow in get_one_sourceline in GitHub repository vim/vim prior to 8.2.4647.,2023-05-03T12:15:16.690,https://cve.circl.lu/cve/CVE-2022-1160
CVE-2022-1381,5.9,Repository,"global heap buffer overflow in skip_range in GitHub repository vim/vim prior to 8.2.4763. This vulnerability is capable of crashing software, Bypass Protection Mechanism, Modify Memory, and possible remote execution",2023-05-03T12:15:17.950,https://cve.circl.lu/cve/CVE-2022-1381
CVE-2022-1420,3.6,Repository,Use of Out-of-range Pointer Offset in GitHub repository vim/vim prior to 8.2.4774.,2023-05-03T12:15:18.083,https://cve.circl.lu/cve/CVE-2022-1420
CVE-2022-1616,5.9,Repository,"Use after free in append_command in GitHub repository vim/vim prior to 8.2.4895. This vulnerability is capable of crashing software, Bypass Protection Mechanism, Modify Memory, and possible remote execution",2023-05-03T12:15:19.217,https://cve.circl.lu/cve/CVE-2022-1616
CVE-2022-1154,5.9,Repo,Use after free in utf_ptr2char in GitHub repository vim/vim prior to 8.2.4646.,2023-05-03T12:15:16.557,https://cve.circl.lu/cve/CVE-2022-1154
CVE-2022-1160,5.9,Repo,heap buffer overflow in get_one_sourceline in GitHub repository vim/vim prior to 8.2.4647.,2023-05-03T12:15:16.690,https://cve.circl.lu/cve/CVE-2022-1160
CVE-2022-1381,5.9,Repo,"global heap buffer overflow in skip_range in GitHub repository vim/vim prior to 8.2.4763. This vulnerability is capable of crashing software, Bypass Protection Mechanism, Modify Memory, and possible remote execution",2023-05-03T12:15:17.950,https://cve.circl.lu/cve/CVE-2022-1381
CVE-2022-1420,3.6,Repo,Use of Out-of-range Pointer Offset in GitHub repository vim/vim prior to 8.2.4774.,2023-05-03T12:15:18.083,https://cve.circl.lu/cve/CVE-2022-1420
CVE-2022-1616,5.9,Repo,"Use after free in append_command in GitHub repository vim/vim prior to 8.2.4895. This vulnerability is capable of crashing software, Bypass Protection Mechanism, Modify Memory, and possible remote execution",2023-05-03T12:15:19.217,https://cve.circl.lu/cve/CVE-2022-1616
CVE-2023-29856,NA,SAP,"** UNSUPPORTED WHEN ASSIGNED ** D-Link DIR-868L Hardware version A1, firmware version 1.12 is vulnerable to Buffer Overflow. The vulnerability is in scandir.sgi binary.",2023-05-03T10:33:50.897,https://cve.circl.lu/cve/CVE-2023-29856
CVE-2023-22577,3.6,SNMP,Within White Rabbit Switch it's possible as an unauthenticated user to retrieve sensitive information such as password hashes and the SNMP community strings.,2023-05-02T19:13:08.980,https://cve.circl.lu/cve/CVE-2023-22577
CVE-2023-28090,3.6,SNMP,An HPE OneView appliance dump may expose SNMPv3 read credentials,2023-05-04T14:16:23.857,https://cve.circl.lu/cve/CVE-2023-28090
CVE-2022-3446,5.9,SQL,Heap buffer overflow in WebSQL in Google Chrome prior to 106.0.5249.119 allowed a remote attacker to potentially exploit heap corruption via a crafted HTML page. (Chromium security severity: High),2023-05-03T12:16:24.030,https://cve.circl.lu/cve/CVE-2022-3446
CVE-2023-22950,3.6,SQL,"An issue was discovered in TigerGraph Enterprise Free Edition 3.x. Data loading jobs in gsql_server, created by any user with designer permissions, can read sensitive data from arbitrary locations.",2023-05-04T13:31:57.710,https://cve.circl.lu/cve/CVE-2023-22950
CVE-2023-2137,5.9,SQL,Heap buffer overflow in sqlite in Google Chrome prior to 112.0.5615.137 allowed a remote attacker to potentially exploit heap corruption via a crafted HTML page. (Chromium security severity: Medium),2023-05-02T03:15:08.717,https://cve.circl.lu/cve/CVE-2023-2137
CVE-2023-30076,5.9,SQL,Sourcecodester Judging Management System v1.0 is vulnerable to SQL Injection via /php-jms/print_judges.php?print_judges.php=&se_name=&sub_event_id=.,2023-05-02T01:10:15.547,https://cve.circl.lu/cve/CVE-2023-30076
CVE-2023-2209,3.6,SQL,"A vulnerability, which was classified as critical, was found in Campcodes Coffee Shop POS System 1.0. Affected is an unknown function of the file /admin/sales/view_details.php. The manipulation of the argument id leads to sql injection. It is possible to launch the attack remotely. The exploit has been disclosed to the public and may be used. VDB-226974 is the identifier assigned to this vulnerability.",2023-05-02T14:33:57.820,https://cve.circl.lu/cve/CVE-2023-2209
CVE-2021-28363,2.5,SSL,The urllib3 library 1.26.x before 1.26.4 for Python omits SSL certificate validation in some cases involving HTTPS to HTTPS proxies. The initial connection to the HTTPS proxy (if an SSLContext isn't given via proxy_config) doesn't verify the hostname of the certificate. This means certificates for different servers that still validate properly with the default urllib3 SSLContext will be silently accepted.,2023-05-03T11:15:10.133,https://cve.circl.lu/cve/CVE-2021-28363
CVE-2022-45197,3.6,SSL,"Slixmpp before 1.8.3 lacks SSL Certificate hostname validation in XMLStream, allowing an attacker to pose as any server in the eyes of Slixmpp.",2023-05-03T12:16:31.023,https://cve.circl.lu/cve/CVE-2022-45197
CVE-2023-1255,3.6,SSL,"Issue summary: The AES-XTS cipher decryption implementation for 64 bit ARMplatform contains a bug that could cause it to read past the input buffer,leading to a crash.Impact summary: Applications that use the AES-XTS algorithm on the 64 bit ARMplatform can crash in rare circumstances. The AES-XTS algorithm is usuallyused for disk encryption.The AES-XTS cipher decryption implementation for 64 bit ARM platform will readpast the end of the ciphertext buffer if the ciphertext size is 4 mod 5 in 16byte blocks, e.g. 144 bytes or 1024 bytes. If the memory after the ciphertextbuffer is unmapped, this will trigger a crash which results in a denial ofservice.If an attacker can control the size and location of the ciphertext bufferbeing decrypted by an application using AES-XTS on 64 bit ARM, theapplication is affected. This is fairly unlikely making this issuea Low severity one.",2023-05-02T16:42:01.440,https://cve.circl.lu/cve/CVE-2023-1255
CVE-2023-31486,5.9,SSL,"HTTP::Tiny 0.082, a Perl core module since 5.13.9 and available standalone on CPAN, has an insecure default TLS configuration where users must opt in to verify certificates.",2023-05-08T17:06:34.067,https://cve.circl.lu/cve/CVE-2023-31486
CVE-2023-24594,1.4,SSL,"When an SSL profile is configured on a Virtual Server, undisclosed traffic can cause an increase in CPU or SSL accelerator resource utilization.  Note: Software versions which have reached End of Technical Support (EoTS) are not evaluated.",2023-05-03T15:23:46.587,https://cve.circl.lu/cve/CVE-2023-24594
CVE-2023-32290,NA,STARTTLS,The myMail app through 14.30 for iOS sends cleartext credentials in a situation where STARTTLS is expected by a server.,2023-05-08T02:37:45.160,https://cve.circl.lu/cve/CVE-2023-32290
CVE-2014-5461,2.9,SUSE,Buffer overflow in the vararg functions in ldo.c in Lua 5.1 through 5.2.x before 5.2.3 allows context-dependent attackers to cause a denial of service (crash) via a small number of arguments to a function with a large number of fixed arguments.,2023-05-03T12:15:13.397,https://cve.circl.lu/cve/CVE-2014-5461
CVE-2015-5122,10.0,SUSE,"Use-after-free vulnerability in the DisplayObject class in the ActionScript 3 (AS3) implementation in Adobe Flash Player 13.x through 13.0.0.302 on Windows and OS X, 14.x through 18.0.0.203 on Windows and OS X, 11.x through 11.2.202.481 on Linux, and 12.x through 18.0.0.204 on Linux Chrome installations allows remote attackers to execute arbitrary code or cause a denial of service (memory corruption) via crafted Flash content that leverages improper handling of the opaqueBackground property, as exploited in the wild in July 2015.",2023-05-08T13:29:02.290,https://cve.circl.lu/cve/CVE-2015-5122
CVE-2019-7572,5.9,SUSE,SDL (Simple DirectMedia Layer) through 1.2.15 and 2.x through 2.0.9 has a buffer over-read in IMA_ADPCM_nibble in audio/SDL_wave.c.,2023-05-03T12:15:14.227,https://cve.circl.lu/cve/CVE-2019-7572
CVE-2019-7573,5.9,SUSE,SDL (Simple DirectMedia Layer) through 1.2.15 and 2.x through 2.0.9 has a heap-based buffer over-read in InitMS_ADPCM in audio/SDL_wave.c (inside the wNumCoef loop).,2023-05-03T12:15:14.377,https://cve.circl.lu/cve/CVE-2019-7573
CVE-2019-7574,5.9,SUSE,SDL (Simple DirectMedia Layer) through 1.2.15 and 2.x through 2.0.9 has a heap-based buffer over-read in IMA_ADPCM_decode in audio/SDL_wave.c.,2023-05-03T12:15:14.483,https://cve.circl.lu/cve/CVE-2019-7574
CVE-2022-36963,5.9,Solarwinds,The SolarWinds Platform was susceptible to the Command Injection Vulnerability. This vulnerability allows a remote adversary with a valid SolarWinds Platform admin account to execute arbitrary commands.,2023-05-02T17:09:42.237,https://cve.circl.lu/cve/CVE-2022-36963
CVE-2022-47505,5.9,Solarwinds,The SolarWinds Platform was susceptible to the Local Privilege Escalation Vulnerability. This vulnerability allows a local adversary with a valid system user account to escalate local privileges.,2023-05-02T17:10:35.553,https://cve.circl.lu/cve/CVE-2022-47505
CVE-2022-47509,2.7,Solarwinds,The SolarWinds Platform was susceptible to the Incorrect Input Neutralization Vulnerability. This vulnerability allows a remote adversary with a valid SolarWinds Platform account to append URL parameters to inject HTML.,2023-05-02T20:11:21.690,https://cve.circl.lu/cve/CVE-2022-47509
CVE-2023-23837,3.6,Solarwinds,No exception handling vulnerability which revealed sensitive or excessive information to users.,2023-05-04T19:30:04.907,https://cve.circl.lu/cve/CVE-2023-23837
CVE-2023-23838,3.6,Solarwinds,Directory traversal and file enumeration vulnerability which allowed users to enumerate to different folders of the server.,2023-05-04T19:32:26.440,https://cve.circl.lu/cve/CVE-2023-23838
CVE-2021-33974,5.9,Spyware,"Qihoo 360 (https://www.360.cn/) Qihoo 360 Safeguard (https://www.360.cn/) Qihoo 360 Chrome (https://browser.360.cn/ee/) is affected by: Buffer Overflow. The impact is: execute arbitrary code (remote). The component is: This is a set of vulnerabilities affecting popular software, and the installation packages correspond to versions ""360 Safeguard(12.1.0.1004,12.1.0.1005,13.1.0.1001)"" , ""360 Total Security(10.8.0.1060,10.8.0.1213)"", ""360 Safe Browser & 360 Chrome(12. The attack vector is: On the browser vulnerability, just open a link to complete the vulnerability exploitation remotely; on the client software, you need to locally execute the vulnerability exploitation program, which of course can be achieved with the full chain of browser vulnerability. ¶¶ This is a set of the most serious vulnerabilities that exist on Qihoo 360's PC client multiple popular software, remote vulnerabilities can be accomplished by opening a link to arbitrary code execution on both security browsers, in conjunction with the exploitation of local vulnerabilities that allow spyware to persist without being scanned to permanently reside on the target PC computer (because local vulnerabilities target Qihoo 360 company's antivirus software kernel flaws); this set of remote and local vulnerabilities in perfect coordination, to achieve an information security fallacy, on Qihoo 360's antivirus software vulnerability, not only can not be scanned out of the virus, but will help the virus persistently control the target computer, while Qihoo 360 claims to be a secure browser, which exists in the kernel vulnerability but help the composition of the remote vulnerability.(Security expert ""Memory Corruptor"" have reported this set of vulnerabilities to the corresponding vendor, all vulnerabilities have been fixed and the vendor rewarded thousands of dollars to this security expert)",2023-05-01T19:18:49.340,https://cve.circl.lu/cve/CVE-2021-33974
CVE-2021-33971,5.9,Spyware,"Qihoo 360 (https://www.360.cn/) Qihoo 360 Safeguard (https://www.360.cn/) Qihoo 360 Total Security (http://www.360totalsecurity.com/) is affected by: Buffer Overflow. The impact is: execute arbitrary code (local). The component is: This is a set of vulnerabilities affecting popular software, ""360 Safeguard(12.1.0.1004,12.1.0.1005,13.1.0.1001)"" , ""360 Total Security(10.8.0.1060,10.8.0.1213)"", ""360 Safe Browser & 360 Chrome(13.0.2170.0)"". The attack vector is: On the browser vulnerability, just open a link to complete the vulnerability exploitation remotely; on the client software, you need to locally execute the vulnerability exploitation program, which of course can be achieved with the full chain of browser vulnerability. ¶¶ This is a set of the most serious vulnerabilities that exist on Qihoo 360's PC client a variety of popular software, remote vulnerabilities can be completed by opening a link to arbitrary code execution on both security browsers, with the use of local vulnerabilities, not only help the vulnerability code constitutes an escalation of privileges, er can make the spyware persistent without being scanned permanently resides on the target PC computer (because local vulnerability against Qihoo 360 company's antivirus kernel flaws); this group of remote and local vulnerability of the perfect match, to achieve an information security fallacy, in Qihoo 360's antivirus vulnerability, not only can not be scanned out of the virus, but will help the virus persistently control the target computer, while Qihoo 360 claims to be a safe browser, which exists in the kernel vulnerability but helped the composition of the remote vulnerability. (Security expert ""Memory Corruptor"" have reported this set of vulnerabilities to the corresponding vendor, all vulnerabilities have been fixed and the vendor rewarded thousands of dollars to the security experts)",2023-05-04T13:42:40.960,https://cve.circl.lu/cve/CVE-2021-33971
CVE-2023-25437,5.9,SIP,"An issue was discovered in vTech VCS754 version 1.1.1.A before 1.1.1.H, allows attackers to gain escalated privileges and gain sensitive information due to cleartext passwords passed in the raw HTML.",2023-05-05T18:10:34.587,https://cve.circl.lu/cve/CVE-2023-25437
CVE-2023-2384,2.7,SIP,A vulnerability was found in Netgear SRX5308 up to 4.3.5-3. It has been declared as problematic. This vulnerability affects unknown code of the file scgi-bin/platform.cgi?page=dmz_setup.htm of the component Web Management Interface. The manipulation of the argument dhcp.SecDnsIPByte2 leads to cross site scripting. The attack can be initiated remotely. The exploit has been disclosed to the public and may be used. VDB-227662 is the identifier assigned to this vulnerability. NOTE: The vendor was contacted early about this disclosure but did not respond in any way.,2023-05-05T18:18:08.037,https://cve.circl.lu/cve/CVE-2023-2384
CVE-2023-22948,3.6,SSH,"An issue was discovered in TigerGraph Enterprise Free Edition 3.x. There is unsecured read access to an SSH private key. Any code that runs as the tigergraph user is able to read the SSH private key. With this, an attacker is granted password-less SSH access to all machines in the TigerGraph cluster.",2023-05-04T13:32:19.617,https://cve.circl.lu/cve/CVE-2023-22948
CVE-2023-29007,5.9,SSH,"Git is a revision control system. Prior to versions 2.30.9, 2.31.8, 2.32.7, 2.33.8, 2.34.8, 2.35.8, 2.36.6, 2.37.7, 2.38.5, 2.39.3, and 2.40.1, a specially crafted `.gitmodules` file with submodule URLs that are longer than 1024 characters can used to exploit a bug in `config.c::git_config_copy_or_rename_section_in_file()`. This bug can be used to inject arbitrary configuration into a user's `$GIT_DIR/config` when attempting to remove the configuration section associated with that submodule. When the attacker injects configuration values which specify executables to run (such as `core.pager`, `core.editor`, `core.sshCommand`, etc.) this can lead to a remote code execution. A fix A fix is available in versions 2.30.9, 2.31.8, 2.32.7, 2.33.8, 2.34.8, 2.35.8, 2.36.6, 2.37.7, 2.38.5, 2.39.3, and 2.40.1. As a workaround, avoid running `git submodule deinit` on untrusted repositories or without prior inspection of any submodule sections in `$GIT_DIR/config`.",2023-05-04T21:19:21.177,https://cve.circl.lu/cve/CVE-2023-29007
CVE-2023-29011,5.9,SSH,"Git for Windows, the Windows port of Git, ships with an executable called `connect.exe`, which implements a SOCKS5 proxy that can be used to connect e.g. to SSH servers via proxies when certain ports are blocked for outgoing connections. The location of `connect.exe`'s config file is hard-coded as `/etc/connectrc` which will typically be interpreted as `C:\etc\connectrc`. Since `C:\etc` can be created by any authenticated user, this makes `connect.exe` susceptible to malicious files being placed there by other users on the same multi-user machine. The problem has been patched in Git for Windows v2.40.1. As a workaround, create the folder `etc` on all drives where Git commands are run, and remove read/write access from those folders. Alternatively, watch out for malicious `<drive>:\etc\connectrc` files on multi-user machines.",2023-05-04T21:18:43.457,https://cve.circl.lu/cve/CVE-2023-29011
