CVE,"Impact Score (1-10, 10 being the worst)",Keyword,Description,Last Modified,Link
CVE-2023-4759,5.9,Eclipse,"Arbitrary File Overwrite in Eclipse JGit <= 6.6.0In Eclipse JGit, all versions <= 6.6.0.202305301015-r, a symbolic link present in a specially crafted git repository can be used to write a file to locations outside the working tree when this repository is cloned with JGit to a case-insensitive filesystem, or when a checkout from a clone of such a repository is performed on a case-insensitive filesystem.This can happen on checkout (DirCacheCheckout), merge (ResolveMerger via its WorkingTreeUpdater), pull (PullCommand using merge), and when applying a patch (PatchApplier). This can be exploited for remote code execution (RCE), for instance if the file written outside the working tree is a git filter that gets executed on a subsequent git command.The issue occurs only on case-insensitive filesystems, like the default filesystems on Windows and macOS. The user performing the clone or checkout must have the rights to create symbolic links for the problem to occur, and symbolic links must be enabled in the git configuration.Setting git configuration option core.symlinks = false before checking out avoids the problem.The issue was fixed in Eclipse JGit version 6.6.1.202309021850-r and 6.7.0.202309050840-r, available via  Maven Central https://repo1.maven.org/maven2/org/eclipse/jgit/  and  repo.eclipse.org https://repo.eclipse.org/content/repositories/jgit-releases/ . A backport is available in 5.13.3 starting from  5.13.3.202401111512-r.The JGit maintainers would like to thank RyotaK for finding and reporting this issue.",2024-04-26T16:09:44.783,https://cve.circl.lu/cve/CVE-2023-4759
CVE-2024-0740,5.9,Eclipse,Eclipse Target Management: Terminal and Remote System Explorer (RSE) version <= 4.5.400 has a remote code execution vulnerability that does not require authentication. The fixed version is included in Eclipse IDE 2024-03,2024-04-26T12:58:17.720,https://cve.circl.lu/cve/CVE-2024-0740
CVE-2024-32481,1.4,Ethereum,"Vyper is a pythonic Smart Contract Language for the Ethereum virtual machine. Starting in version 0.3.8 and prior to version 0.4.0b1, when looping over a `range` of the form `range(start, start + N)`, if `start` is negative, the execution will always revert. This issue is caused by an incorrect assertion inserted by the code generation of the range `stmt.parse_For_range()`. The issue arises when `start` is signed, instead of using `sle`, `le` is used and `start` is interpreted as an unsigned integer for the comparison. If it is a negative number, its 255th bit is set to `1` and is hence interpreted as a very large unsigned integer making the assertion always fail. Any contract having a `range(start, start + N)` where `start` is a signed integer with the possibility for `start` to be negative is affected. If a call goes through the loop while supplying a negative `start` the execution will revert. Version 0.4.0b1 fixes the issue.",2024-04-25T17:24:59.967,https://cve.circl.lu/cve/CVE-2024-32481
CVE-2024-32645,1.4,Ethereum,"Vyper is a pythonic Smart Contract Language for the Ethereum virtual machine. In versions 0.3.10 and prior, incorrect values can be logged when `raw_log` builtin is called with memory or storage arguments to be used as topics. A contract search was performed and no vulnerable contracts were found in production. The `build_IR` function of the `RawLog` class fails to properly unwrap the variables provided as topics. Consequently, incorrect values are logged as topics. As of time of publication, no fixed version is available.",2024-04-26T12:58:17.720,https://cve.circl.lu/cve/CVE-2024-32645
CVE-2024-32646,1.4,Ethereum,"Vyper is a pythonic Smart Contract Language for the Ethereum virtual machine. In versions 0.3.10 and prior, using the `slice` builtin can result in a double eval vulnerability when the buffer argument is either `msg.data`, `self.code` or `<address>.code` and either the `start` or `length` arguments have side-effects. It can be easily triggered only with the versions `<0.3.4` as `0.3.4` introduced the unique symbol fence. No vulnerable production contracts were found. Additionally, double evaluation of side-effects should be easily discoverable in client tests. As such, the impact is low. As of time of publication, no fixed versions are available.",2024-04-26T12:58:17.720,https://cve.circl.lu/cve/CVE-2024-32646
CVE-2024-32647,1.4,Ethereum,"Vyper is a pythonic Smart Contract Language for the Ethereum virtual machine. In versions 0.3.10 and prior, using the `create_from_blueprint` builtin can result in a double eval vulnerability when `raw_args=True` and the `args` argument has side-effects. It can be seen that the `_build_create_IR` function of the `create_from_blueprint` builtin doesn't cache the mentioned `args` argument to the stack. As such, it can be evaluated multiple times (instead of retrieving the value from the stack). No vulnerable production contracts were found. Additionally, double evaluation of side-effects should be easily discoverable in client tests. As such, the impact is low. As of time of publication, no fixed versions exist.",2024-04-26T12:58:17.720,https://cve.circl.lu/cve/CVE-2024-32647
CVE-2024-32648,1.4,Ethereum,"Vyper is a pythonic Smart Contract Language for the Ethereum virtual machine. Prior to version 0.3.0, default functions don't respect nonreentrancy keys and the lock isn't emitted. No vulnerable production contracts were found. Additionally, using a lock on a `default` function is a very sparsely used pattern. As such, the impact is low. Version 0.3.0 contains a patch for the issue.",2024-04-26T12:58:17.720,https://cve.circl.lu/cve/CVE-2024-32648
CVE-2013-0422,10.0,Exploit,"Multiple vulnerabilities in Oracle Java 7 before Update 11 allow remote attackers to execute arbitrary code by (1) using the public getMBeanInstantiator method in the JmxMBeanServer class to obtain a reference to a private MBeanInstantiator object, then retrieving arbitrary Class references using the findClass method, and (2) using the Reflection API with recursion in a way that bypasses a security check by the java.lang.invoke.MethodHandles.Lookup.checkSecurityManager method due to the inability of the sun.reflect.Reflection.getCallerClass method to skip frames related to the new reflection API, as exploited in the wild in January 2013, as demonstrated by Blackhole and Nuclear Pack, and a different vulnerability than CVE-2012-4681 and CVE-2012-3174. NOTE: some parties have mapped the recursive Reflection API issue to CVE-2012-3174, but CVE-2012-3174 is for a different vulnerability whose details are not public as of 20130114.  CVE-2013-0422 covers both the JMX/MBean and Reflection API issues.  NOTE: it was originally reported that Java 6 was also vulnerable, but the reporter has retracted this claim, stating that Java 6 is not exploitable because the relevant code is called in a way that does not bypass security checks.  NOTE: as of 20130114, a reliable third party has claimed that the findClass/MBeanInstantiator vector was not fixed in Oracle Java 7 Update 11.  If there is still a vulnerable condition, then a separate CVE identifier might be created for the unfixed issue.",2024-04-26T16:07:03.190,https://cve.circl.lu/cve/CVE-2013-0422
CVE-2022-40735,3.6,Exploit,"The Diffie-Hellman Key Agreement Protocol allows use of long exponents that arguably make certain calculations unnecessarily expensive, because the 1996 van Oorschot and Wiener paper found that ""(appropriately) short exponents"" can be used when there are adequate subgroup constraints, and these short exponents can lead to less expensive calculations than for long exponents. This issue is different from CVE-2002-20001 because it is based on an observation about exponent size, rather than an observation about numbers that are not public keys. The specific situations in which calculation expense would constitute a server-side vulnerability depend on the protocol (e.g., TLS, SSH, or IKE) and the DHE implementation details. In general, there might be an availability concern because of server-side resource consumption from DHE modular-exponentiation calculations. Finally, it is possible for an attacker to exploit this vulnerability and CVE-2002-20001 together.",2024-04-23T07:15:42.550,https://cve.circl.lu/cve/CVE-2022-40735
CVE-2022-26579,5.2,Exploit,PAX A930 device with PayDroid_7.1.1_Virgo_V04.3.26T1_20210419 can allow a root privileged attacker to install unsigned packages. The attacker must have shell access to the device and gain root privileges in order to exploit this vulnerability.,2024-04-23T14:15:07.533,https://cve.circl.lu/cve/CVE-2022-26579
CVE-2022-26580,5.9,Exploit,PAX A930 device with PayDroid_7.1.1_Virgo_V04.3.26T1_20210419 can allow the execution of specific command injections on selected binaries in the ADB daemon shell service. The attacker must have physical USB access to the device in order to exploit this vulnerability.,2024-04-23T14:15:07.720,https://cve.circl.lu/cve/CVE-2022-26580
CVE-2022-26581,5.9,Exploit,PAX A930 device with PayDroid_7.1.1_Virgo_V04.3.26T1_20210419 can allow an unauthorized attacker to perform privileged actions through the execution of specific binaries listed in ADB daemon. The attacker must have physical USB access to the device in order to exploit this vulnerability.,2024-04-23T14:15:07.827,https://cve.circl.lu/cve/CVE-2022-26581
CVE-2024-24558,2.7,Endpoint,"TanStack Query supplies asynchronous state management, server-state utilities and data fetching for the web.  The `@tanstack/react-query-next-experimental` NPM package is vulnerable to a cross-site scripting vulnerability. To exploit this, an attacker would need to either inject malicious input or arrange to have malicious input be returned from an endpoint. To fix this issue, please update to version 5.18.0 or later.",2024-04-23T19:52:49.107,https://cve.circl.lu/cve/CVE-2024-24558
CVE-2023-45288,NA,Endpoint,"An attacker may cause an HTTP/2 endpoint to read arbitrary amounts of header data by sending an excessive number of CONTINUATION frames. Maintaining HPACK state requires parsing and processing all HEADERS and CONTINUATION frames on a connection. When a request's headers exceed MaxHeaderBytes, no memory is allocated to store the excess headers, but they are still parsed. This permits an attacker to cause an HTTP/2 endpoint to read arbitrary amounts of header data, all associated with a request which is going to be rejected. These headers can include Huffman-encoded data which is significantly more expensive for the receiver to decode than for an attacker to send. The fix sets a limit on the amount of excess header frames we will process before closing a connection.",2024-04-25T06:15:52.357,https://cve.circl.lu/cve/CVE-2023-45288
CVE-2024-31450,1.4,Endpoint,"Owncast is an open source, self-hosted, decentralized, single user live video streaming and chat server. The Owncast application exposes an administrator API at the URL /api/admin. The emoji/delete endpoint of said API allows administrators to delete custom emojis, which are saved on disk. The parameter name is taken from the JSON request and directly appended to the filepath that points to the emoji to delete. By using path traversal sequences (../), attackers with administrative privileges can exploit this endpoint to delete arbitrary files on the system, outside of the emoji directory. This vulnerability is fixed in 0.1.3.",2024-04-22T13:28:50.310,https://cve.circl.lu/cve/CVE-2024-31450
CVE-2024-31994,4.0,Endpoint,"Mealie is a self hosted recipe manager and meal planner. Prior to 1.4.0, an attacker can point the image request to an arbitrarily large file. Mealie will attempt to retrieve this file in whole. If it can be retrieved, it may be stored on the file system in whole (leading to possible disk consumption), however the more likely scenario given resource limitations is that the container will OOM during file retrieval if the target file size is greater than the allocated memory of the container. At best this can be used to force the container to infinitely restart due to OOM (if so configured in `docker-compose.yml), or at worst this can be used to force the Mealie container to crash and remain offline. In the event that the file can be retrieved, the lack of rate limiting on this endpoint also permits an attacker to generate ongoing requests to any target of their choice, potentially contributing to an external-facing DoS attack. This vulnerability is fixed in 1.4.0.",2024-04-22T13:28:43.747,https://cve.circl.lu/cve/CVE-2024-31994
CVE-2024-28722,NA,Endpoint,"Cross Site Scripting vulnerability in Innovaphone myPBX v.14r1, v.13r3, v.12r2 allows a remote attacker to execute arbitrary code via the query parameter to the /CMD0/xml_modes.xml endpoint",2024-04-22T13:28:43.747,https://cve.circl.lu/cve/CVE-2024-28722
CVE-2024-3400,6.0,Firewall,"A command injection as a result of arbitrary file creation vulnerability in the GlobalProtect feature of Palo Alto Networks PAN-OS software for specific PAN-OS versions and distinct feature configurations may enable an unauthenticated attacker to execute arbitrary code with root privileges on the firewall.Cloud NGFW, Panorama appliances, and Prisma Access are not impacted by this vulnerability.",2024-04-23T19:57:25.207,https://cve.circl.lu/cve/CVE-2024-3400
CVE-2024-22144,6.0,Firewall,Improper Control of Generation of Code ('Code Injection') vulnerability in Eli Scheetz Anti-Malware Security and Brute-Force Firewall gotmls allows Code Injection.This issue affects Anti-Malware Security and Brute-Force Firewall: from n/a through 4.21.96.,2024-04-25T13:18:13.537,https://cve.circl.lu/cve/CVE-2024-22144
CVE-2024-1347,1.4,GitLab,"An issue has been discovered in GitLab CE/EE affecting all versions before 16.9.6, all versions starting from 16.10 before 16.10.4, all versions starting from 16.11 before 16.11.1. Under certain conditions, an attacker through a crafted email address may be able to bypass domain based restrictions on an instance or a group.",2024-04-25T13:18:02.660,https://cve.circl.lu/cve/CVE-2024-1347
CVE-2024-2434,4.7,GitLab,"An issue has been discovered in GitLab affecting all versions of GitLab CE/EE  16.9 prior to 16.9.6, 16.10 prior to 16.10.4, and 16.11 prior to 16.11.1 where path traversal could lead to DoS and restricted file read.",2024-04-25T13:18:02.660,https://cve.circl.lu/cve/CVE-2024-2434
CVE-2024-2829,3.6,GitLab,"An issue has been discovered in GitLab CE/EE affecting all versions starting from 12.5 before 16.9.6, all versions starting from 16.10 before 16.10.4, all versions starting from 16.11 before 16.11.1. A crafted wildcard filter in FileFinder may lead to a denial of service.",2024-04-25T13:18:02.660,https://cve.circl.lu/cve/CVE-2024-2829
CVE-2024-4006,1.4,GitLab,"An issue has been discovered in GitLab CE/EE affecting all versions starting from 16.7 before 16.9.6, all versions starting from 16.10 before 16.10.4, all versions starting from 16.11 before 16.11.1 where personal access scopes were not honored by GraphQL subscriptions",2024-04-25T17:25:05.903,https://cve.circl.lu/cve/CVE-2024-4006
CVE-2024-4024,5.2,GitLab,"An issue has been discovered in GitLab CE/EE affecting all versions starting from 7.8 before 16.9.6, all versions starting from 16.10 before 16.10.4, all versions starting from 16.11 before 16.11.1. Under certain conditions, an attacker with their Bitbucket account credentials may be able to take over a GitLab account linked to another user's Bitbucket account, if Bitbucket is used as an OAuth 2.0 provider on GitLab.",2024-04-25T17:25:05.903,https://cve.circl.lu/cve/CVE-2024-4024
CVE-2023-48795,3.6,Golang,"The SSH transport protocol with certain OpenSSH extensions, found in OpenSSH before 9.6 and other products, allows remote attackers to bypass integrity checks such that some packets are omitted (from the extension negotiation message), and a client and server may consequently end up with a connection for which some security features have been downgraded or disabled, aka a Terrapin attack. This occurs because the SSH Binary Packet Protocol (BPP), implemented by these extensions, mishandles the handshake phase and mishandles use of sequence numbers. For example, there is an effective attack against SSH's use of ChaCha20-Poly1305 (and CBC with Encrypt-then-MAC). The bypass occurs in chacha20-poly1305@openssh.com and (if CBC is used) the -etm@openssh.com MAC algorithms. This also affects Maverick Synergy Java SSH API before 3.1.0-SNAPSHOT, Dropbear through 2022.83, Ssh before 5.1.1 in Erlang/OTP, PuTTY before 0.80, AsyncSSH before 2.14.2, golang.org/x/crypto before 0.17.0, libssh before 0.10.6, libssh2 through 1.11.0, Thorn Tech SFTP Gateway before 3.4.6, Tera Term before 5.1, Paramiko before 3.4.0, jsch before 0.2.15, SFTPGo before 2.5.6, Netgate pfSense Plus through 23.09.1, Netgate pfSense CE through 2.7.2, HPN-SSH through 18.2.0, ProFTPD before 1.3.8b (and before 1.3.9rc2), ORYX CycloneSSH before 2.3.4, NetSarang XShell 7 before Build 0144, CrushFTP before 10.6.0, ConnectBot SSH library before 2.2.22, Apache MINA sshd through 2.11.0, sshj through 0.37.0, TinySSH through 20230101, trilead-ssh2 6401, LANCOM LCOS and LANconfig, FileZilla before 3.66.4, Nova before 11.8, PKIX-SSH before 14.4, SecureCRT before 9.4.3, Transmit5 before 5.10.4, Win32-OpenSSH before 9.5.0.0p1-Beta, WinSCP before 6.2.2, Bitvise SSH Server before 9.32, Bitvise SSH Client before 9.33, KiTTY through 0.76.1.13, the net-ssh gem 7.2.0 for Ruby, the mscdex ssh2 module before 1.15.0 for Node.js, the thrussh library before 0.35.1 for Rust, and the Russh crate before 0.40.2 for Rust.",2024-04-25T22:15:08.130,https://cve.circl.lu/cve/CVE-2023-48795
CVE-2024-1394,3.6,Golang,"A memory leak flaw was found in Golang in the RSA encrypting/decrypting code, which might lead to a resource exhaustion vulnerability using attacker-controlled inputs​. The memory leak happens in github.com/golang-fips/openssl/openssl/rsa.go#L113. The objects leaked are pkey​ and ctx​. That function uses named return parameters to free pkey​ and ctx​ if there is an error initializing the context or setting the different properties. All return statements related to error cases follow the ""return nil, nil, fail(...)"" pattern, meaning that pkey​ and ctx​ will be nil inside the deferred function that should free them.",2024-04-27T01:15:06.083,https://cve.circl.lu/cve/CVE-2024-1394
CVE-2024-3156,5.9,Google,Inappropriate implementation in V8 in Google Chrome prior to 123.0.6312.105 allowed a remote attacker to potentially perform out of bounds memory access via a crafted HTML page. (Chromium security severity: High),2024-04-26T16:00:34.653,https://cve.circl.lu/cve/CVE-2024-3156
CVE-2024-3158,5.9,Google,Use after free in Bookmarks in Google Chrome prior to 123.0.6312.105 allowed a remote attacker to potentially exploit heap corruption via a crafted HTML page. (Chromium security severity: High),2024-04-26T16:00:15.540,https://cve.circl.lu/cve/CVE-2024-3158
CVE-2024-3159,5.9,Google,Out of bounds memory access in V8 in Google Chrome prior to 123.0.6312.105 allowed a remote attacker to perform arbitrary read/write via a crafted HTML page. (Chromium security severity: High),2024-04-26T15:59:59.020,https://cve.circl.lu/cve/CVE-2024-3159
CVE-2024-3832,NA,Google,Object corruption in V8 in Google Chrome prior to 124.0.6367.60 allowed a remote attacker to potentially exploit object corruption via a crafted HTML page. (Chromium security severity: High),2024-04-23T18:15:15.187,https://cve.circl.lu/cve/CVE-2024-3832
CVE-2024-3833,NA,Google,Object corruption in WebAssembly in Google Chrome prior to 124.0.6367.60 allowed a remote attacker to potentially exploit object corruption via a crafted HTML page. (Chromium security severity: High),2024-04-23T18:15:15.247,https://cve.circl.lu/cve/CVE-2024-3833
CVE-2024-1394,3.6,GitHub,"A memory leak flaw was found in Golang in the RSA encrypting/decrypting code, which might lead to a resource exhaustion vulnerability using attacker-controlled inputs​. The memory leak happens in github.com/golang-fips/openssl/openssl/rsa.go#L113. The objects leaked are pkey​ and ctx​. That function uses named return parameters to free pkey​ and ctx​ if there is an error initializing the context or setting the different properties. All return statements related to error cases follow the ""return nil, nil, fail(...)"" pattern, meaning that pkey​ and ctx​ will be nil inside the deferred function that should free them.",2024-04-27T01:15:06.083,https://cve.circl.lu/cve/CVE-2024-1394
CVE-2024-33851,NA,GitHub,"phpecc, as used in paragonie/phpecc before 2.0.1, has a branch-based timing leak in Point addition. (This is related to phpecc/phpecc on GitHub, and the Matyas Danter ECC library.)",2024-04-27T22:15:08.050,https://cve.circl.lu/cve/CVE-2024-33851
CVE-2023-47731,2.7,IBM,IBM QRadar Suite Software 1.10.12.0 through 1.10.19.0 and IBM Cloud Pak for Security 1.10.0.0 through 1.10.11.0 is vulnerable to stored cross-site scripting. This vulnerability allows users to embed arbitrary JavaScript code in the Web UI thus altering the intended functionality potentially leading to credentials disclosure within a trusted session.  IBM X-Force ID:  272203.,2024-04-24T13:39:42.883,https://cve.circl.lu/cve/CVE-2023-47731
CVE-2024-25026,3.6,IBM,"IBM WebSphere Application Server 8.5, 9.0 and IBM WebSphere Application Server Liberty 17.0.0.3 through 24.0.0.4 are vulnerable to a denial of service, caused by sending a specially crafted request.  A remote attacker could exploit this vulnerability to cause the server to consume memory resources.  IBM X-Force ID:  281516.",2024-04-25T13:18:02.660,https://cve.circl.lu/cve/CVE-2024-25026
CVE-2024-25048,5.9,IBM,"IBM MQ Appliance 9.3 CD and LTS are vulnerable to a heap-based buffer overflow, caused by improper bounds checking. A remote authenticated attacker could overflow a buffer and execute arbitrary code on the system or cause the server to crash.  IBM X-Force ID:  283137.",2024-04-27T12:15:10.517,https://cve.circl.lu/cve/CVE-2024-25048
CVE-2024-22632,NA,Intel,Setor Informatica Sistema Inteligente para Laboratorios (S.I.L.) 388 was discovered to contain a remote code execution (RCE) vulnerability via the hmsg parameter. This vulnerability is triggered via a crafted POST request.,2024-04-26T12:58:17.720,https://cve.circl.lu/cve/CVE-2024-22632
CVE-2024-22633,NA,Intel,Setor Informatica Sistema Inteligente para Laboratorios (S.I.L.) 388 was discovered to contain a remote code execution (RCE) vulnerability via the hprinter parameter. This vulnerability is triggered via a crafted POST request.,2024-04-26T12:58:17.720,https://cve.circl.lu/cve/CVE-2024-22633
CVE-2024-29053,5.9,IoT,Microsoft Defender for IoT Remote Code Execution Vulnerability,2024-04-26T15:58:55.843,https://cve.circl.lu/cve/CVE-2024-29053
CVE-2024-29054,5.9,IoT,Microsoft Defender for IoT Elevation of Privilege Vulnerability,2024-04-26T15:59:00.880,https://cve.circl.lu/cve/CVE-2024-29054
CVE-2024-29055,5.9,IoT,Microsoft Defender for IoT Elevation of Privilege Vulnerability,2024-04-26T15:58:48.473,https://cve.circl.lu/cve/CVE-2024-29055
CVE-2023-52220,1.4,Insight,Missing Authorization vulnerability in MonsterInsights Google Analytics by Monster Insights.This issue affects Google Analytics by Monster Insights: from n/a through 8.21.0.,2024-04-25T13:18:13.537,https://cve.circl.lu/cve/CVE-2023-52220
CVE-2012-0507,10.0,Java,"Unspecified vulnerability in the Java Runtime Environment (JRE) component in Oracle Java SE 7 Update 2 and earlier, 6 Update 30 and earlier, and 5.0 Update 33 and earlier allows remote attackers to affect confidentiality, integrity, and availability via unknown vectors related to Concurrency.  NOTE: the previous information was obtained from the February 2012 Oracle CPU. Oracle has not commented on claims from a downstream vendor and third party researchers that this issue occurs because the AtomicReferenceArray class implementation does not ensure that the array is of the Object[] type, which allows attackers to cause a denial of service (JVM crash) or bypass Java sandbox restrictions.  NOTE: this issue was originally mapped to CVE-2011-3571, but that identifier was already assigned to a different issue.",2024-04-26T16:07:55.723,https://cve.circl.lu/cve/CVE-2012-0507
CVE-2012-5076,10.0,Java,"Unspecified vulnerability in the Java Runtime Environment (JRE) component in Oracle Java SE 7 Update 7 and earlier allows remote attackers to affect confidentiality, integrity, and availability, related to JAX-WS.",2024-04-26T16:07:14.687,https://cve.circl.lu/cve/CVE-2012-5076
