CVE,"Impact Score (1-10, 10 being the worst)",Keyword,Description,Last Modified,Link
CVE-2023-34085,1.4,AWS,"When an AWS DynamoDB table is used for user attribute storage, it is possible to retrieve the attributes of another user using a maliciously crafted request",2023-10-31T15:19:06.623,https://cve.circl.lu/cve/CVE-2023-34085
CVE-2023-44323,3.6,Adobe,Adobe Acrobat for Edge version 118.0.2088.46 (and earlier) is affected by a Use After Free vulnerability. An unauthenticated attacker could leverage this vulnerability to achieve an application denial-of-service in the context of the current user. Exploitation of this issue requires user interaction in that a victim must open a malicious file.,2023-10-30T15:28:31.260,https://cve.circl.lu/cve/CVE-2023-44323
CVE-2023-46288,1.4,Airflow,"Exposure of Sensitive Information to an Unauthorized Actor vulnerability in Apache Airflow.This issue affects Apache Airflow from 2.4.0 to 2.7.0.Sensitive configuration information has been exposed to authenticated users with the ability to read configuration via Airflow REST API for configuration even when the expose_config option is set to non-sensitive-only. The expose_config option is False by default. It is recommended to upgrade to a version that is not affected if you set expose_config to non-sensitive-only configuration. This is a different error than CVE-2023-45348 which allows authenticated user to retrieve individual configuration values in 2.7.* by specially crafting their request (solved in 2.7.2).Users are recommended to upgrade to version 2.7.2, which fixes the issue and additionally fixes CVE-2023-45348.",2023-10-28T03:24:55.857,https://cve.circl.lu/cve/CVE-2023-46288
CVE-2023-46215,NA,Airflow,"Insertion of Sensitive Information into Log File vulnerability in Apache Airflow Celery provider, Apache Airflow.Sensitive information logged as clear text when rediss, amqp, rpc protocols are used as Celery result backendNote: the vulnerability is about the information exposed in the logs not about accessing the logs.This issue affects Apache Airflow Celery provider: from 3.3.0 through 3.4.0; Apache Airflow: from 1.10.0 through 2.6.3.Users are recommended to upgrade Airflow Celery provider to version 3.4.1 and Apache Airlfow to version 2.7.0 which fixes the issue.",2023-10-29T01:44:12.570,https://cve.circl.lu/cve/CVE-2023-46215
CVE-2022-2541,5.9,Amazon,"The uContext for Amazon plugin for WordPress is vulnerable to Cross-Site Request Forgery to Cross-Site Scripting in versions up to, and including 3.9.1. This is due to missing nonce validation in the ~/app/sites/ajax/actions/keyword_save.php file that is called via the doAjax() function. This makes it possible for unauthenticated attackers to modify the plugin's settings and inject malicious web scripts via a forged request granted they can trick a site administrator into performing an action such as clicking on a link.",2023-11-02T02:20:53.223,https://cve.circl.lu/cve/CVE-2022-2541
CVE-2023-4482,2.7,Amazon,"The Auto Amazon Links plugin for WordPress is vulnerable to Stored Cross-Site Scripting via the style parameter in versions up to, and including, 5.3.1 due to insufficient input sanitization and output escaping. This makes it possible for authenticated attackers with contributor access to inject arbitrary web scripts in pages that will execute whenever a user accesses an injected page.",2023-10-27T17:39:57.883,https://cve.circl.lu/cve/CVE-2023-4482
CVE-2014-3577,4.9,Apache,"org.apache.http.conn.ssl.AbstractVerifier in Apache HttpComponents HttpClient before 4.3.5 and HttpAsyncClient before 4.0.2 does not properly verify that the server hostname matches a domain name in the subject's Common Name (CN) or subjectAltName field of the X.509 certificate, which allows man-in-the-middle attackers to spoof SSL servers via a ""CN="" string in a field in the distinguished name (DN) of a certificate, as demonstrated by the ""foo,CN=www.apache.org"" string in the O field.",2023-10-27T15:15:09.487,https://cve.circl.lu/cve/CVE-2014-3577
CVE-2009-1955,2.9,Apache,"The expat XML parser in the apr_xml_* interface in xml/apr_xml.c in Apache APR-util before 1.3.7, as used in the mod_dav and mod_dav_svn modules in the Apache HTTP Server, allows remote attackers to cause a denial of service (memory consumption) via a crafted XML document containing a large number of nested entity references, as demonstrated by a PROPFIND request, a similar issue to CVE-2003-1564.",2023-10-31T16:53:39.643,https://cve.circl.lu/cve/CVE-2009-1955
CVE-2010-0408,2.9,Apache,"The ap_proxy_ajp_request function in mod_proxy_ajp.c in mod_proxy_ajp in the Apache HTTP Server 2.2.x before 2.2.15 does not properly handle certain situations in which a client sends no request body, which allows remote attackers to cause a denial of service (backend server outage) via a crafted request, related to use of a 500 error code instead of the appropriate 400 error code.",2023-11-01T15:32:41.043,https://cve.circl.lu/cve/CVE-2010-0408
CVE-2010-1452,2.9,Apache,The (1) mod_cache and (2) mod_dav modules in the Apache HTTP Server 2.2.x before 2.2.16 allow remote attackers to cause a denial of service (process crash) via a request that lacks a path.,2023-11-01T15:32:37.607,https://cve.circl.lu/cve/CVE-2010-1452
CVE-2014-0231,2.9,Apache,"The mod_cgid module in the Apache HTTP Server before 2.4.10 does not have a timeout mechanism, which allows remote attackers to cause a denial of service (process hang) via a request to a CGI script that does not read from its stdin file descriptor.",2023-10-31T16:05:27.097,https://cve.circl.lu/cve/CVE-2014-0231
CVE-2022-23121,5.9,Apple,This vulnerability allows remote attackers to execute arbitrary code on affected installations of Netatalk. Authentication is not required to exploit this vulnerability. The specific flaw exists within the parse_entries function. The issue results from the lack of proper error handling when parsing AppleDouble entries. An attacker can leverage this vulnerability to execute code in the context of root. Was ZDI-CAN-15819.,2023-11-01T17:15:10.353,https://cve.circl.lu/cve/CVE-2022-23121
CVE-2023-22025,1.4,Apple,"Vulnerability in the Oracle Java SE, Oracle GraalVM Enterprise Edition, Oracle GraalVM for JDK product of Oracle Java SE (component: Hotspot).  Supported versions that are affected are Oracle Java SE: 8u381-perf, 17.0.8, 21; Oracle GraalVM for JDK: 17.0.8 and  21. Difficult to exploit vulnerability allows unauthenticated attacker with network access via multiple protocols to compromise Oracle Java SE, Oracle GraalVM Enterprise Edition, Oracle GraalVM for JDK.  Successful attacks of this vulnerability can result in  unauthorized update, insert or delete access to some of Oracle Java SE, Oracle GraalVM Enterprise Edition, Oracle GraalVM for JDK accessible data. Note: This vulnerability can be exploited by using APIs in the specified Component, e.g., through a web service which supplies data to the APIs. This vulnerability also applies to Java deployments, typically in clients running sandboxed Java Web Start applications or sandboxed Java applets, that load and run untrusted code (e.g., code that comes from the internet) and rely on the Java sandbox for security. CVSS 3.1 Base Score 3.7 (Integrity impacts).  CVSS Vector: (CVSS:3.1/AV:N/AC:H/PR:N/UI:N/S:U/C:N/I:L/A:N).",2023-10-27T15:15:09.823,https://cve.circl.lu/cve/CVE-2023-22025
CVE-2023-22067,1.4,Apple,"Vulnerability in Oracle Java SE (component: CORBA).  Supported versions that are affected are Oracle Java SE: 8u381 and  8u381-perf. Easily exploitable vulnerability allows unauthenticated attacker with network access via CORBA to compromise Oracle Java SE.  Successful attacks of this vulnerability can result in  unauthorized update, insert or delete access to some of Oracle Java SE accessible data. Note: This vulnerability can only be exploited by supplying data to APIs in the specified Component without using Untrusted Java Web Start applications or Untrusted Java applets, such as through a web service. CVSS 3.1 Base Score 5.3 (Integrity impacts).  CVSS Vector: (CVSS:3.1/AV:N/AC:L/PR:N/UI:N/S:U/C:N/I:L/A:N).",2023-10-28T03:15:08.010,https://cve.circl.lu/cve/CVE-2023-22067
CVE-2023-22081,1.4,Apple,"Vulnerability in the Oracle Java SE, Oracle GraalVM for JDK product of Oracle Java SE (component: JSSE).  Supported versions that are affected are Oracle Java SE: 8u381, 8u381-perf, 11.0.20, 17.0.8, 21; Oracle GraalVM for JDK: 17.0.8 and  21. Easily exploitable vulnerability allows unauthenticated attacker with network access via HTTPS to compromise Oracle Java SE, Oracle GraalVM for JDK.  Successful attacks of this vulnerability can result in unauthorized ability to cause a partial denial of service (partial DOS) of Oracle Java SE, Oracle GraalVM for JDK. Note: This vulnerability applies to Java deployments, typically in clients running sandboxed Java Web Start applications or sandboxed Java applets, that load and run untrusted code (e.g., code that comes from the internet) and rely on the Java sandbox for security. This vulnerability does not apply to Java deployments, typically in servers, that load and run only trusted code (e.g., code installed by an administrator). CVSS 3.1 Base Score 5.3 (Availability impacts).  CVSS Vector: (CVSS:3.1/AV:N/AC:L/PR:N/UI:N/S:U/C:N/I:N/A:L).",2023-10-29T10:15:08.243,https://cve.circl.lu/cve/CVE-2023-22081
CVE-2023-22518,5.2,Atlassian,"All versions of Confluence Data Center and Server are affected by this unexploited vulnerability. There is no impact to confidentiality as an attacker cannot exfiltrate any instance data.Atlassian Cloud sites are not affected by this vulnerability. If your Confluence site is accessed via an atlassian.net domain, it is hosted by Atlassian and is not vulnerable to this issue.",2023-10-31T15:35:00.293,https://cve.circl.lu/cve/CVE-2023-22518
CVE-2023-46248,6.0,Artificial Intelligence,"Cody is an artificial intelligence (AI) coding assistant. The Cody AI VSCode extension versions 0.10.0 through 0.14.0 are vulnerable to Remote Code Execution under certain conditions. An attacker in control of a malicious repository could modify the Cody configuration file `.vscode/cody.json` and overwrite Cody commands. If a user with the extension installed opens this malicious repository and runs a Cody command such as /explain or /doc, this could allow arbitrary code execution on the user's machine. The vulnerability is rated as critical severity, but with low exploitability. It requires the user to have a malicious repository loaded and execute the overwritten command in VS Code. The issue is exploitable regardless of the user blocking code execution on a repository through VS Code Workspace Trust. The issue was found during a regular 3rd party penetration test. The maintainers of Cody do not have evidence of open source repositories having malicious `.vscode/cody.json` files to exploit this vulnerability. The issue is fixed in version 0.14.1 of the Cody VSCode extension. In case users can't promptly upgrade, they should not open any untrusted repositories with the Cody extension loaded.",2023-10-31T17:07:44.967,https://cve.circl.lu/cve/CVE-2023-46248
CVE-2023-20042,4.0,AnyConnect,"A vulnerability in the AnyConnect SSL VPN feature of Cisco Adaptive Security Appliance (ASA) Software and Cisco Firepower Threat Defense (FTD) Software could allow an unauthenticated, remote attacker to cause a denial of service (DoS) condition on an affected device. This vulnerability is due to an implementation error within the SSL/TLS session handling process that can prevent the release of a session handler under specific conditions. An attacker could exploit this vulnerability by sending crafted SSL/TLS traffic to an affected device, increasing the probability of session handler leaks. A successful exploit could allow the attacker to eventually deplete the available session handler pool, preventing new sessions from being established and causing a DoS condition.",2023-11-01T18:17:43.887,https://cve.circl.lu/cve/CVE-2023-20042
CVE-2022-43407,5.9,CSRF,"Jenkins Pipeline: Input Step Plugin 451.vf1a_a_4f405289 and earlier does not restrict or sanitize the optionally specified ID of the 'input' step, which is used for the URLs that process user interactions for the given 'input' step (proceed or abort) and is not correctly encoded, allowing attackers able to configure Pipelines to have Jenkins build URLs from 'input' step IDs that would bypass the CSRF protection of any target URL in Jenkins when the 'input' step is interacted with.",2023-11-01T20:53:02.037,https://cve.circl.lu/cve/CVE-2022-43407
CVE-2022-43408,3.6,CSRF,"Jenkins Pipeline: Stage View Plugin 2.26 and earlier does not correctly encode the ID of 'input' steps when using it to generate URLs to proceed or abort Pipeline builds, allowing attackers able to configure Pipelines to specify 'input' step IDs resulting in URLs that would bypass the CSRF protection of any target URL in Jenkins.",2023-11-01T20:54:03.333,https://cve.circl.lu/cve/CVE-2022-43408
CVE-2023-45992,6.0,CSRF,"A vulnerability in the web-based interface of the RUCKUS Cloudpath product on version 5.12 build 5538 or before to could allow a remote, unauthenticated attacker to execute persistent XSS and CSRF attacks against a user of the admin management interface. A successful attack, combined with a certain admin activity, could allow the attacker to gain full admin privileges on the exploited system.",2023-10-31T21:15:08.720,https://cve.circl.lu/cve/CVE-2023-45992
CVE-2023-45670,5.9,CSRF,"Frigate is an open source network video recorder. Prior to version 0.13.0 Beta 3, the `config/save` and `config/set` endpoints of Frigate do not implement any CSRF protection. This makes it possible for a request sourced from another site to update the configuration of the Frigate server (e.g. via ""drive-by"" attack). Exploiting this vulnerability requires the attacker to both know very specific information about a user's Frigate server and requires an authenticated user to be tricked into clicking a specially crafted link to their Frigate instance. This vulnerability could exploited by an attacker under the following circumstances: Frigate publicly exposed to the internet (even with authentication); attacker knows the address of a user's Frigate instance; attacker crafts a specialized page which links to the user's Frigate instance; attacker finds a way to get an authenticated user to visit their specialized page and click the button/link. This issue can lead to arbitrary configuration updates for the Frigate server, resulting in denial of service and possible data exfiltration. Version 0.13.0 Beta 3 contains a patch.",2023-10-31T12:58:37.550,https://cve.circl.lu/cve/CVE-2023-45670
CVE-2023-4251,NA,CSRF,"The EventPrime WordPress plugin before 3.2.0 does not have CSRF checks when creating bookings, which could allow attackers to make logged in users create unwanted bookings via CSRF attacks.",2023-10-31T14:23:15.447,https://cve.circl.lu/cve/CVE-2023-4251
CVE-2022-20713,2.7,Cisco,"A vulnerability in the VPN web client services component of Cisco Adaptive Security Appliance (ASA) Software and Cisco Firepower Threat Defense (FTD) Software could allow an unauthenticated, remote attacker to conduct browser-based attacks against users of an affected device. This vulnerability is due to improper validation of input that is passed to the VPN web client services component before being returned to the browser that is in use. An attacker could exploit this vulnerability by persuading a user to visit a website that is designed to pass malicious requests to a device that is running Cisco ASA Software or Cisco FTD Software and has web services endpoints supporting VPN features enabled. A successful exploit could allow the attacker to reflect malicious input from the affected device to the browser that is in use and conduct browser-based attacks, including cross-site scripting attacks. The attacker could not directly impact the affected device.",2023-11-01T18:15:08.647,https://cve.circl.lu/cve/CVE-2022-20713
CVE-2023-20273,5.9,Cisco,"A vulnerability in the web UI feature of Cisco IOS XE Software could allow an authenticated, remote attacker to inject commands with the privileges of root. This vulnerability is due to insufficient input validation. An attacker could exploit this vulnerability by sending crafted input to the web UI. A successful exploit could allow the attacker to inject commands to the underlying operating system with root privileges.",2023-10-31T14:02:38.303,https://cve.circl.lu/cve/CVE-2023-20273
CVE-2023-20005,2.7,Cisco,"Multiple vulnerabilities in the web-based management interface of Cisco Firepower Management Center (FMC) Software could allow an unauthenticated, remote attacker to conduct a stored cross-site scripting (XSS) attack against a user of the interface of an affected device. These vulnerabilities are due to insufficient validation of user-supplied input by the web-based management interface. An attacker could exploit these vulnerabilities by inserting crafted input into various data fields in an affected interface. A successful exploit could allow the attacker to execute arbitrary script code in the context of the interface, or access sensitive, browser-based information. In some cases, it is also possible to cause a temporary availability impact to portions of the FMC Dashboard.",2023-11-01T17:16:31.677,https://cve.circl.lu/cve/CVE-2023-20005
CVE-2023-20041,2.7,Cisco,"Multiple vulnerabilities in the web-based management interface of Cisco Firepower Management Center (FMC) Software could allow an unauthenticated, remote attacker to conduct a stored cross-site scripting (XSS) attack against a user of the interface of an affected device. These vulnerabilities are due to insufficient validation of user-supplied input by the web-based management interface. An attacker could exploit these vulnerabilities by inserting crafted input into various data fields in an affected interface. A successful exploit could allow the attacker to execute arbitrary script code in the context of the interface, or access sensitive, browser-based information. In some cases, it is also possible to cause a temporary availability impact to portions of the FMC Dashboard.",2023-11-01T17:16:31.677,https://cve.circl.lu/cve/CVE-2023-20041
CVE-2023-20074,2.7,Cisco,"Multiple vulnerabilities in the web-based management interface of Cisco Firepower Management Center (FMC) Software could allow an unauthenticated, remote attacker to conduct a stored cross-site scripting (XSS) attack against a user of the interface of an affected device. These vulnerabilities are due to insufficient validation of user-supplied input by the web-based management interface. An attacker could exploit these vulnerabilities by inserting crafted input into various data fields in an affected interface. A successful exploit could allow the attacker to execute arbitrary script code in the context of the interface, or access sensitive, browser-based information. In some cases, it is also possible to cause a temporary availability impact to portions of the FMC Dashboard.",2023-11-01T17:16:31.677,https://cve.circl.lu/cve/CVE-2023-20074
CVE-2023-2650,3.6,Cryptograph,"Issue summary: Processing some specially crafted ASN.1 object identifiers ordata containing them may be very slow.Impact summary: Applications that use OBJ_obj2txt() directly, or use any ofthe OpenSSL subsystems OCSP, PKCS7/SMIME, CMS, CMP/CRMF or TS with no messagesize limit may experience notable to very long delays when processing thosemessages, which may lead to a Denial of Service.An OBJECT IDENTIFIER is composed of a series of numbers - sub-identifiers -most of which have no size limit.  OBJ_obj2txt() may be used to translatean ASN.1 OBJECT IDENTIFIER given in DER encoding form (using the OpenSSLtype ASN1_OBJECT) to its canonical numeric text form, which are thesub-identifiers of the OBJECT IDENTIFIER in decimal form, separated byperiods.When one of the sub-identifiers in the OBJECT IDENTIFIER is very large(these are sizes that are seen as absurdly large, taking up tens or hundredsof KiBs), the translation to a decimal number in text may take a very longtime.  The time complexity is O(n^2) with 'n' being the size of thesub-identifiers in bytes (*).With OpenSSL 3.0, support to fetch cryptographic algorithms using names /identifiers in string form was introduced.  This includes using OBJECTIDENTIFIERs in canonical numeric text form as identifiers for fetchingalgorithms.Such OBJECT IDENTIFIERs may be received through the ASN.1 structureAlgorithmIdentifier, which is commonly used in multiple protocols to specifywhat cryptographic algorithm should be used to sign or verify, encrypt ordecrypt, or digest passed data.Applications that call OBJ_obj2txt() directly with untrusted data areaffected, with any version of OpenSSL.  If the use is for the mere purposeof display, the severity is considered low.In OpenSSL 3.0 and newer, this affects the subsystems OCSP, PKCS7/SMIME,CMS, CMP/CRMF or TS.  It also impacts anything that processes X.509certificates, including simple things like verifying its signature.The impact on TLS is relatively low, because all versions of OpenSSL have a100KiB limit on the peer's certificate chain.  Additionally, this onlyimpacts clients, or servers that have explicitly enabled clientauthentication.In OpenSSL 1.1.1 and 1.0.2, this only affects displaying diverse objects,such as X.509 certificates.  This is assumed to not happen in such a waythat it would cause a Denial of Service, so these versions are considerednot affected by this issue in such a way that it would be cause for concern,and the severity is therefore considered low.",2023-10-27T15:15:13.057,https://cve.circl.lu/cve/CVE-2023-2650
CVE-2022-22466,5.9,Cryptograph,"IBM Security Verify Governance 10.0 contains hard-coded credentials, such as a password or cryptographic key, which it uses for its own inbound authentication, outbound communication to external components, or encryption of internal data.  IBM X-Force ID:  225222.",2023-10-28T03:24:44.390,https://cve.circl.lu/cve/CVE-2022-22466
CVE-2023-42492,5.9,Cryptograph, EisBaer Scada - CWE-321: Use of Hard-coded Cryptographic Key,2023-11-01T15:14:33.247,https://cve.circl.lu/cve/CVE-2023-42492
CVE-2023-46129,3.6,Cryptograph,"NATS.io is a high performance open source pub-sub distributed communication technology, built for the cloud, on-premise, IoT, and edge computing. The cryptographic key handling library, nkeys, recently gained support for encryption, not just for signing/authentication. This is used in nats-server 2.10 (Sep 2023) and newer for authentication callouts. In nkeys versions 0.4.0 through 0.4.5, corresponding with NATS server versions 2.10.0 through 2.10.3, the nkeys library's `xkeys` encryption handling logic mistakenly passed an array by value into an internal function, where the function mutated that buffer to populate the encryption key to use. As a result, all encryption was actually to an all-zeros key. This affects encryption only, not signing.  FIXME: FILL IN IMPACT ON NATS-SERVER AUTH CALLOUT SECURITY. nkeys Go library 0.4.6, corresponding with NATS Server 2.10.4, has a patch for this issue. No known workarounds are available. For any application handling auth callouts in Go, if using the nkeys library, update the dependency, recompile and deploy that in lockstep.",2023-10-31T18:15:08.653,https://cve.circl.lu/cve/CVE-2023-46129
CVE-2023-31579,NA,Cryptograph,Dromara Lamp-Cloud before v3.8.1 was discovered to use a hardcoded cryptographic key when creating and verifying a Json Web Token. This vulnerability allows attackers to authenticate to the application via a crafted JWT token.,2023-11-02T22:15:08.640,https://cve.circl.lu/cve/CVE-2023-31579
CVE-2023-45394,2.7,CRM,"Stored Cross-Site Scripting (XSS) vulnerability in the Company field in the ""Request a Quote"" Section of Small CRM v3.0 allows an attacker to store and execute malicious javascript code in the Admin panel which leads to Admin account takeover.",2023-10-30T15:29:24.470,https://cve.circl.lu/cve/CVE-2023-45394
CVE-2022-3342,5.9,CRM,"The Jetpack CRM plugin for WordPress is vulnerable to PHAR deserialization via the ‘zbscrmcsvimpf’ parameter in the 'zeroBSCRM_CSVImporterLitehtml_app' function in versions up to, and including, 5.3.1. While the function performs a nonce check, steps 2 and 3 of the check do not take any action upon a failed check. These steps then perform a 'file_exists' check on the value of 'zbscrmcsvimpf'. If a phar:// archive is supplied, its contents will be deserialized and an object injected in the execution stream. This allows an unauthenticated attacker to obtain object injection if they are able to upload a phar archive (for instance if the site supports image uploads) and then trick an administrator into performing an action, such as clicking a link.",2023-10-27T18:53:17.093,https://cve.circl.lu/cve/CVE-2022-3342
CVE-2023-31212,NA,CRM,"Improper Neutralization of Special Elements used in an SQL Command ('SQL Injection') vulnerability in CRM Perks Database for Contact Form 7, WPforms, Elementor forms contact-form-entries allows SQL Injection.This issue affects Database for Contact Form 7, WPforms, Elementor forms: from n/a through 1.3.0.",2023-10-31T15:35:00.293,https://cve.circl.lu/cve/CVE-2023-31212
CVE-2023-4197,5.9,CRM,"Improper input validation in Dolibarr ERP CRM <= v18.0.1 fails to strip certain PHP code from user-supplied input when creating a Website, allowing an attacker to inject and evaluate arbitrary PHP code.",2023-11-01T12:51:15.967,https://cve.circl.lu/cve/CVE-2023-4197
