CVE,"Impact Score (1-10, 10 being the worst)",Keyword,Description,Last Modified,Link
CVE-2024-26907,NA,Red Hat,"In the Linux kernel, the following vulnerability has been resolved:RDMA/mlx5: Fix fortify source warning while accessing Eth segment ------------[ cut here ]------------ memcpy: detected field-spanning write (size 56) of single field ""eseg->inline_hdr.start"" at /var/lib/dkms/mlnx-ofed-kernel/5.8/build/drivers/infiniband/hw/mlx5/wr.c:131 (size 2) WARNING: CPU: 0 PID: 293779 at /var/lib/dkms/mlnx-ofed-kernel/5.8/build/drivers/infiniband/hw/mlx5/wr.c:131 mlx5_ib_post_send+0x191b/0x1a60 [mlx5_ib] Modules linked in: 8021q garp mrp stp llc rdma_ucm(OE) rdma_cm(OE) iw_cm(OE) ib_ipoib(OE) ib_cm(OE) ib_umad(OE) mlx5_ib(OE) ib_uverbs(OE) ib_core(OE) mlx5_core(OE) pci_hyperv_intf mlxdevm(OE) mlx_compat(OE) tls mlxfw(OE) psample nft_fib_inet nft_fib_ipv4 nft_fib_ipv6 nft_fib nft_reject_inet nf_reject_ipv4 nf_reject_ipv6 nft_reject nft_ct nft_chain_nat nf_nat nf_conntrack nf_defrag_ipv6 nf_defrag_ipv4 ip_set nf_tables libcrc32c nfnetlink mst_pciconf(OE) knem(OE) vfio_pci vfio_pci_core vfio_iommu_type1 vfio iommufd irqbypass cuse nfsv3 nfs fscache netfs xfrm_user xfrm_algo ipmi_devintf ipmi_msghandler binfmt_misc crct10dif_pclmul crc32_pclmul polyval_clmulni polyval_generic ghash_clmulni_intel sha512_ssse3 snd_pcsp aesni_intel crypto_simd cryptd snd_pcm snd_timer joydev snd soundcore input_leds serio_raw evbug nfsd auth_rpcgss nfs_acl lockd grace sch_fq_codel sunrpc drm efi_pstore ip_tables x_tables autofs4 psmouse virtio_net net_failover failover floppy  [last unloaded: mlx_compat(OE)] CPU: 0 PID: 293779 Comm: ssh Tainted: G           OE      6.2.0-32-generic #32~22.04.1-Ubuntu Hardware name: Red Hat KVM, BIOS 0.5.1 01/01/2011 RIP: 0010:mlx5_ib_post_send+0x191b/0x1a60 [mlx5_ib] Code: 0c 01 00 a8 01 75 25 48 8b 75 a0 b9 02 00 00 00 48 c7 c2 10 5b fd c0 48 c7 c7 80 5b fd c0 c6 05 57 0c 03 00 01 e8 95 4d 93 da <0f> 0b 44 8b 4d b0 4c 8b 45 c8 48 8b 4d c0 e9 49 fb ff ff 41 0f b7 RSP: 0018:ffffb5b48478b570 EFLAGS: 00010046 RAX: 0000000000000000 RBX: 0000000000000001 RCX: 0000000000000000 RDX: 0000000000000000 RSI: 0000000000000000 RDI: 0000000000000000 RBP: ffffb5b48478b628 R08: 0000000000000000 R09: 0000000000000000 R10: 0000000000000000 R11: 0000000000000000 R12: ffffb5b48478b5e8 R13: ffff963a3c609b5e R14: ffff9639c3fbd800 R15: ffffb5b480475a80 FS:  00007fc03b444c80(0000) GS:ffff963a3dc00000(0000) knlGS:0000000000000000 CS:  0010 DS: 0000 ES: 0000 CR0: 0000000080050033 CR2: 0000556f46bdf000 CR3: 0000000006ac6003 CR4: 00000000003706f0 DR0: 0000000000000000 DR1: 0000000000000000 DR2: 0000000000000000 DR3: 0000000000000000 DR6: 00000000fffe0ff0 DR7: 0000000000000400 Call Trace:  <TASK>  ? show_regs+0x72/0x90  ? mlx5_ib_post_send+0x191b/0x1a60 [mlx5_ib]  ? __warn+0x8d/0x160  ? mlx5_ib_post_send+0x191b/0x1a60 [mlx5_ib]  ? report_bug+0x1bb/0x1d0  ? handle_bug+0x46/0x90  ? exc_invalid_op+0x19/0x80  ? asm_exc_invalid_op+0x1b/0x20  ? mlx5_ib_post_send+0x191b/0x1a60 [mlx5_ib]  mlx5_ib_post_send_nodrain+0xb/0x20 [mlx5_ib]  ipoib_send+0x2ec/0x770 [ib_ipoib]  ipoib_start_xmit+0x5a0/0x770 [ib_ipoib]  dev_hard_start_xmit+0x8e/0x1e0  ? validate_xmit_skb_list+0x4d/0x80  sch_direct_xmit+0x116/0x3a0  __dev_xmit_skb+0x1fd/0x580  __dev_queue_xmit+0x284/0x6b0  ? _raw_spin_unlock_irq+0xe/0x50  ? __flush_work.isra.0+0x20d/0x370  ? push_pseudo_header+0x17/0x40 [ib_ipoib]  neigh_connected_output+0xcd/0x110  ip_finish_output2+0x179/0x480  ? __smp_call_single_queue+0x61/0xa0  __ip_finish_output+0xc3/0x190  ip_finish_output+0x2e/0xf0  ip_output+0x78/0x110  ? __pfx_ip_finish_output+0x10/0x10  ip_local_out+0x64/0x70  __ip_queue_xmit+0x18a/0x460  ip_queue_xmit+0x15/0x30  __tcp_transmit_skb+0x914/0x9c0  tcp_write_xmit+0x334/0x8d0  tcp_push_one+0x3c/0x60  tcp_sendmsg_locked+0x2e1/0xac0  tcp_sendmsg+0x2d/0x50  inet_sendmsg+0x43/0x90  sock_sendmsg+0x68/0x80  sock_write_iter+0x93/0x100  vfs_write+0x326/0x3c0  ksys_write+0xbd/0xf0  ? do_syscall_64+0x69/0x90  __x64_sys_write+0x19/0x30  do_syscall_---truncated---",2024-04-17T12:48:07.510,https://cve.circl.lu/cve/CVE-2024-26907
CVE-2024-3803,3.4,Remote Desktop,A vulnerability classified as critical was found in Vesystem Cloud Desktop up to 20240408. This vulnerability affects unknown code of the file /Public/webuploader/0.1.5/server/fileupload.php. The manipulation of the argument file leads to unrestricted upload. The attack can be initiated remotely. The exploit has been disclosed to the public and may be used. The identifier of this vulnerability is VDB-260776. NOTE: The vendor was contacted early about this disclosure but did not respond in any way.,2024-04-16T13:24:07.103,https://cve.circl.lu/cve/CVE-2024-3803
CVE-2024-3804,3.4,Remote Desktop,"A vulnerability, which was classified as critical, has been found in Vesystem Cloud Desktop up to 20240408. This issue affects some unknown processing of the file /Public/webuploader/0.1.5/server/fileupload2.php. The manipulation of the argument file leads to unrestricted upload. The attack may be initiated remotely. The exploit has been disclosed to the public and may be used. The identifier VDB-260777 was assigned to this vulnerability. NOTE: The vendor was contacted early about this disclosure but did not respond in any way.",2024-04-16T13:24:07.103,https://cve.circl.lu/cve/CVE-2024-3804
CVE-2023-52470,3.6,Radeon,"In the Linux kernel, the following vulnerability has been resolved:drm/radeon: check the alloc_workqueue return value in radeon_crtc_init()check the alloc_workqueue return value in radeon_crtc_init()to avoid null-ptr-deref.",2024-04-17T18:46:07.810,https://cve.circl.lu/cve/CVE-2023-52470
CVE-2023-52644,NA,Radeon,"In the Linux kernel, the following vulnerability has been resolved:wifi: b43: Stop/wake correct queue in DMA Tx path when QoS is disabledWhen QoS is disabled, the queue priority value will not map to the correctieee80211 queue since there is only one queue. Stop/wake queue 0 when QoSis disabled to prevent trying to stop/wake a non-existent queue and failingto stop/wake the actual queue instantiated.Log of issue before change (with kernel parameter qos=0):    [  +5.112651] ------------[ cut here ]------------    [  +0.000005] WARNING: CPU: 7 PID: 25513 at net/mac80211/util.c:449 __ieee80211_wake_queue+0xd5/0x180 [mac80211]    [  +0.000067] Modules linked in: b43(O) snd_seq_dummy snd_hrtimer snd_seq snd_seq_device nft_chain_nat xt_MASQUERADE nf_nat xfrm_user xfrm_algo xt_addrtype overlay ccm af_packet amdgpu snd_hda_codec_cirrus snd_hda_codec_generic ledtrig_audio drm_exec amdxcp gpu_sched xt_conntrack nf_conntrack nf_defrag_ipv6 nf_defrag_ipv4 ip6t_rpfilter ipt_rpfilter xt_pkttype xt_LOG nf_log_syslog xt_tcpudp nft_compat nf_tables nfnetlink sch_fq_codel btusb uinput iTCO_wdt ctr btrtl intel_pmc_bxt i915 intel_rapl_msr mei_hdcp mei_pxp joydev at24 watchdog btintel atkbd libps2 serio radeon btbcm vivaldi_fmap btmtk intel_rapl_common snd_hda_codec_hdmi bluetooth uvcvideo nls_iso8859_1 applesmc nls_cp437 x86_pkg_temp_thermal snd_hda_intel intel_powerclamp vfat videobuf2_vmalloc coretemp fat snd_intel_dspcfg crc32_pclmul uvc polyval_clmulni snd_intel_sdw_acpi loop videobuf2_memops snd_hda_codec tun drm_suballoc_helper polyval_generic drm_ttm_helper drm_buddy tap ecdh_generic videobuf2_v4l2 gf128mul macvlan ttm ghash_clmulni_intel ecc tg3    [  +0.000044]  videodev bridge snd_hda_core rapl crc16 drm_display_helper cec mousedev snd_hwdep evdev intel_cstate bcm5974 hid_appleir videobuf2_common stp mac_hid libphy snd_pcm drm_kms_helper acpi_als mei_me intel_uncore llc mc snd_timer intel_gtt industrialio_triggered_buffer apple_mfi_fastcharge i2c_i801 mei snd lpc_ich agpgart ptp i2c_smbus thunderbolt apple_gmux i2c_algo_bit kfifo_buf video industrialio soundcore pps_core wmi tiny_power_button sbs sbshc button ac cordic bcma mac80211 cfg80211 ssb rfkill libarc4 kvm_intel kvm drm irqbypass fuse backlight firmware_class efi_pstore configfs efivarfs dmi_sysfs ip_tables x_tables autofs4 dm_crypt cbc encrypted_keys trusted asn1_encoder tee tpm rng_core input_leds hid_apple led_class hid_generic usbhid hid sd_mod t10_pi crc64_rocksoft crc64 crc_t10dif crct10dif_generic ahci libahci libata uhci_hcd ehci_pci ehci_hcd crct10dif_pclmul crct10dif_common sha512_ssse3 sha512_generic sha256_ssse3 sha1_ssse3 aesni_intel usbcore scsi_mod libaes crypto_simd cryptd scsi_common    [  +0.000055]  usb_common rtc_cmos btrfs blake2b_generic libcrc32c crc32c_generic crc32c_intel xor raid6_pq dm_snapshot dm_bufio dm_mod dax [last unloaded: b43(O)]    [  +0.000009] CPU: 7 PID: 25513 Comm: irq/17-b43 Tainted: G        W  O       6.6.7 #1-NixOS    [  +0.000003] Hardware name: Apple Inc. MacBookPro8,3/Mac-942459F5819B171B, BIOS 87.0.0.0.0 06/13/2019    [  +0.000001] RIP: 0010:__ieee80211_wake_queue+0xd5/0x180 [mac80211]    [  +0.000046] Code: 00 45 85 e4 0f 85 9b 00 00 00 48 8d bd 40 09 00 00 f0 48 0f ba ad 48 09 00 00 00 72 0f 5b 5d 41 5c 41 5d 41 5e e9 cb 6d 3c d0 <0f> 0b 5b 5d 41 5c 41 5d 41 5e c3 cc cc cc cc 48 8d b4 16 94 00 00    [  +0.000002] RSP: 0018:ffffc90003c77d60 EFLAGS: 00010097    [  +0.000001] RAX: 0000000000000001 RBX: 0000000000000002 RCX: 0000000000000000    [  +0.000001] RDX: 0000000000000000 RSI: 0000000000000002 RDI: ffff88820b924900    [  +0.000002] RBP: ffff88820b924900 R08: ffffc90003c77d90 R09: 000000000003bfd0    [  +0.000001] R10: ffff88820b924900 R11: ffffc90003c77c68 R12: 0000000000000000    [  +0.000001] R13: 0000000000000000 R14: ffffc90003c77d90 R15: ffffffffc0fa6f40    [  +0.000001] FS:  0000000000000000(0000) GS:ffff88846fb80000(0000) knlGS:0000000000000000    [  +0.000001] CS:  0010 DS: 0---truncated---",2024-04-17T12:48:07.510,https://cve.circl.lu/cve/CVE-2023-52644
CVE-2023-5752,1.4,Repository,"When installing a package from a Mercurial VCS URL  (ie ""pip install hg+..."") with pip prior to v23.3, the specified Mercurial revision could be used to inject arbitrary configuration options to the ""hg clone"" call (ie ""--config""). Controlling the Mercurial configuration can modify how and which repository is installed. This vulnerability does not affect users who aren't installing from Mercurial.",2024-04-21T03:15:44.820,https://cve.circl.lu/cve/CVE-2023-5752
CVE-2023-6568,2.7,Repository,"A reflected Cross-Site Scripting (XSS) vulnerability exists in the mlflow/mlflow repository, specifically within the handling of the Content-Type header in POST requests. An attacker can inject malicious JavaScript code into the Content-Type header, which is then improperly reflected back to the user without adequate sanitization or escaping, leading to arbitrary JavaScript execution in the context of the victim's browser. The vulnerability is present in the mlflow/server/auth/__init__.py file, where the user-supplied Content-Type header is directly injected into a Python formatted string and returned to the user, facilitating the XSS attack.",2024-04-16T12:15:08.957,https://cve.circl.lu/cve/CVE-2023-6568
CVE-2024-1455,3.6,Repository,"A vulnerability in the langchain-ai/langchain repository allows for a Billion Laughs Attack, a type of XML External Entity (XXE) exploitation. By nesting multiple layers of entities within an XML document, an attacker can cause the XML parser to consume excessive CPU and memory resources, leading to a denial of service (DoS). ",2024-04-16T12:15:09.230,https://cve.circl.lu/cve/CVE-2024-1455
CVE-2024-1540,4.7,Repository,"A command injection vulnerability exists in the deploy+test-visual.yml workflow of the gradio-app/gradio repository, due to improper neutralization of special elements used in a command. This vulnerability allows attackers to execute unauthorized commands, potentially leading to unauthorized modification of the base repository or secrets exfiltration. The issue arises from the unsafe handling of GitHub context information within a `run` operation, where expressions inside `${{ }}` are evaluated and substituted before script execution. Remediation involves setting untrusted input values to intermediate environment variables to prevent direct influence on script generation.",2024-04-16T12:15:09.617,https://cve.circl.lu/cve/CVE-2024-1540
CVE-2024-1729,3.6,Repository,"A timing attack vulnerability exists in the gradio-app/gradio repository, specifically within the login function in routes.py. The vulnerability arises from the use of a direct comparison operation (`app.auth[username] == password`) to validate user credentials, which can be exploited to guess passwords based on response times. Successful exploitation of this vulnerability could allow an attacker to bypass authentication mechanisms and gain unauthorized access.",2024-04-16T12:15:09.930,https://cve.circl.lu/cve/CVE-2024-1729
CVE-2023-1402,1.4,Repo,The course participation report required additional checks to prevent roles being displayed which the user did not have access to view.,2024-04-19T14:15:08.100,https://cve.circl.lu/cve/CVE-2023-1402
CVE-2023-28336,1.4,Repo,Insufficient filtering of grade report history made it possible for teachers to access the names of users they could not otherwise access.,2024-04-19T14:15:09.473,https://cve.circl.lu/cve/CVE-2023-28336
CVE-2021-41526,5.9,Repo,A vulnerability has been reported in the windows installer (MSI) built with InstallScript custom action. This vulnerability may allow privilege escalation when invoked ‘repair’ of the MSI which has an InstallScript custom action.,2024-04-19T15:15:49.727,https://cve.circl.lu/cve/CVE-2021-41526
CVE-2023-5752,1.4,Repo,"When installing a package from a Mercurial VCS URL  (ie ""pip install hg+..."") with pip prior to v23.3, the specified Mercurial revision could be used to inject arbitrary configuration options to the ""hg clone"" call (ie ""--config""). Controlling the Mercurial configuration can modify how and which repository is installed. This vulnerability does not affect users who aren't installing from Mercurial.",2024-04-21T03:15:44.820,https://cve.circl.lu/cve/CVE-2023-5752
CVE-2023-6568,2.7,Repo,"A reflected Cross-Site Scripting (XSS) vulnerability exists in the mlflow/mlflow repository, specifically within the handling of the Content-Type header in POST requests. An attacker can inject malicious JavaScript code into the Content-Type header, which is then improperly reflected back to the user without adequate sanitization or escaping, leading to arbitrary JavaScript execution in the context of the victim's browser. The vulnerability is present in the mlflow/server/auth/__init__.py file, where the user-supplied Content-Type header is directly injected into a Python formatted string and returned to the user, facilitating the XSS attack.",2024-04-16T12:15:08.957,https://cve.circl.lu/cve/CVE-2023-6568
CVE-2022-24805,3.6,SNMP,"net-snmp provides various tools relating to the Simple Network Management Protocol. Prior to version 5.9.2, a buffer overflow in the handling of the `INDEX` of             `NET-SNMP-VACM-MIB` can cause an out-of-bounds memory access. A user with read-only credentials can exploit the issue. Version 5.9.2 contains a patch. Users should use strong SNMPv3 credentials and avoid sharing the credentials. Those who must use SNMPv1 or SNMPv2c should use a complex community string and enhance the protection by restricting access to a given IP address range.",2024-04-17T12:48:31.863,https://cve.circl.lu/cve/CVE-2022-24805
CVE-2022-24806,3.6,SNMP,"net-snmp provides various tools relating to the Simple Network Management Protocol. Prior to version 5.9.2, a user with read-write credentials can exploit an Improper Input Validation vulnerability when SETing malformed OIDs in master agent and subagent simultaneously. Version 5.9.2 contains a patch. Users should use strong SNMPv3 credentials and avoid sharing the credentials. Those who must use SNMPv1 or SNMPv2c should use a complex community string and enhance the protection by restricting access to a given IP address range.",2024-04-17T12:48:31.863,https://cve.circl.lu/cve/CVE-2022-24806
CVE-2022-24807,3.6,SNMP,"net-snmp provides various tools relating to the Simple Network Management Protocol. Prior to version 5.9.2, a malformed OID in a SET request to `SNMP-VIEW-BASED-ACM-MIB::vacmAccessTable` can cause an out-of-bounds memory access. A user with read-write credentials can exploit the issue. Version 5.9.2 contains a patch. Users should use strong SNMPv3 credentials and avoid sharing the credentials. Those who must use SNMPv1 or SNMPv2c should use a complex community string and enhance the protection by restricting access to a given IP address range.",2024-04-17T12:48:31.863,https://cve.circl.lu/cve/CVE-2022-24807
CVE-2022-24808,3.6,SNMP,"net-snmp provides various tools relating to the Simple Network Management Protocol. Prior to version 5.9.2, a user with read-write credentials can use a malformed OID in a `SET` request to `NET-SNMP-AGENT-MIB::nsLogTable` to cause a NULL pointer dereference. Version 5.9.2 contains a patch. Users should use strong SNMPv3 credentials and avoid sharing the credentials. Those who must use SNMPv1 or SNMPv2c should use a complex community string and enhance the protection by restricting access to a given IP address range.",2024-04-17T12:48:31.863,https://cve.circl.lu/cve/CVE-2022-24808
CVE-2022-24809,3.6,SNMP,"net-snmp provides various tools relating to the Simple Network Management Protocol. Prior to version 5.9.2, a user with read-only credentials can use a malformed OID in a `GET-NEXT` to the `nsVacmAccessTable` to cause a NULL pointer dereference. Version 5.9.2 contains a patch. Users should use strong SNMPv3 credentials and avoid sharing the credentials. Those who must use SNMPv1 or SNMPv2c should use a complex community string and enhance the protection by restricting access to a given IP address range.",2024-04-17T12:48:31.863,https://cve.circl.lu/cve/CVE-2022-24809
CVE-2022-36754,5.9,SQL,Expense Management System v1.0 was discovered to contain a SQL injection vulnerability via the id parameter at /Home/debit_credit_p.,2024-04-17T16:21:04.383,https://cve.circl.lu/cve/CVE-2022-36754
CVE-2023-28329,5.9,SQL,Insufficient validation of profile field availability condition resulted in an SQL injection risk (by default only available to teachers and managers).,2024-04-19T14:15:08.937,https://cve.circl.lu/cve/CVE-2023-28329
CVE-2023-30944,3.4,SQL,The vulnerability was found Moodle which exists due to insufficient sanitization of user-supplied data in external Wiki method for listing pages. A remote attacker can send a specially crafted request to the affected application and execute limited SQL commands within the application database.,2024-04-19T14:15:09.787,https://cve.circl.lu/cve/CVE-2023-30944
CVE-2023-35132,3.4,SQL,"A limited SQL injection risk was identified on the Mnet SSO access control page. This flaw affects Moodle versions 4.2, 4.1 to 4.1.3, 4.0 to 4.0.8, 3.11 to 3.11.14, 3.9 to 3.9.21 and earlier unsupported versions.",2024-04-19T14:15:10.157,https://cve.circl.lu/cve/CVE-2023-35132
CVE-2024-1597,5.9,SQL,"pgjdbc, the PostgreSQL JDBC Driver, allows attacker to inject SQL if using PreferQueryMode=SIMPLE. Note this is not the default. In the default mode there is no vulnerability. A placeholder for a numeric value must be immediately preceded by a minus. There must be a second placeholder for a string value after the first placeholder; both must be on the same line. By constructing a matching string payload, the attacker can inject SQL to alter the query,bypassing the protections that parameterized queries bring against SQL Injection attacks. Versions before 42.7.2, 42.6.1, 42.5.5, 42.4.4, 42.3.9, and 42.2.28 are affected.",2024-04-19T07:15:09.047,https://cve.circl.lu/cve/CVE-2024-1597
CVE-2024-1300,2.5,SSL,"A vulnerability in the Eclipse Vert.x toolkit causes a memory leak in TCP servers configured with TLS and SNI support. When processing an unknown SNI server name assigned the default certificate instead of a mapped certificate, the SSL context is erroneously cached in the server name map, leading to memory exhaustion. This flaw allows attackers to send TLS client hello messages with fake server names, triggering a JVM out-of-memory error.",2024-04-18T17:15:48.453,https://cve.circl.lu/cve/CVE-2024-1300
CVE-2024-29952,3.6,SSL,"A vulnerability in Brocade SANnav before v2.3.1 and v2.3.0a could allow an authenticated user to print the Auth, Priv, and SSL key store passwords in unencrypted logs by manipulating command variables.",2024-04-18T13:04:28.900,https://cve.circl.lu/cve/CVE-2024-29952
CVE-2024-31229,2.7,SSL,Server-Side Request Forgery (SSRF) vulnerability in Really Simple Plugins Really Simple SSL.This issue affects Really Simple SSL: from n/a through 7.2.3.,2024-04-18T13:04:28.900,https://cve.circl.lu/cve/CVE-2024-31229
CVE-2024-28073,6.0,Solarwinds,SolarWinds Serv-U was found to be susceptible to a Directory Traversal Remote Code Vulnerability. This vulnerability requires a highly privileged account to be exploited.,2024-04-17T20:08:21.887,https://cve.circl.lu/cve/CVE-2024-28073
CVE-2024-28076,5.3,Solarwinds,The SolarWinds Platform was susceptible to a Arbitrary Open Redirection Vulnerability. A potential attacker can redirect to different domain when using URL parameter with relative entry in the correct format,2024-04-19T14:15:11.080,https://cve.circl.lu/cve/CVE-2024-28076
CVE-2024-29001,5.3,Solarwinds,A SolarWinds Platform SWQL Injection Vulnerability was identified in the user interface. This vulnerability requires authentication and user interaction to be exploited.  ,2024-04-18T13:04:28.900,https://cve.circl.lu/cve/CVE-2024-29001
CVE-2024-29003,5.3,Solarwinds,The SolarWinds Platform was susceptible to a XSS vulnerability that affects the maps section of the user interface. This vulnerability requires authentication and requires user interaction. ,2024-04-18T13:04:28.900,https://cve.circl.lu/cve/CVE-2024-29003
CVE-2024-31462,3.4,Stable Diffusion,"stable-diffusion-webui is a web interface for Stable Diffusion, implemented using Gradio library. Stable-diffusion-webui 1.7.0 is vulnerable to a limited file write affecting Windows systems. The create_ui method (Backup/Restore tab) in modules/ui_extensions.py takes user input into the config_save_name variable on line 653. This user input is later used in the save_config_state method and used to create a file path on line 65, which is afterwards opened for writing on line 67, which leads to a limited file write exploitable on Windows systems. This issue may lead to limited file write. It allows for writing json files anywhere on the server where the web server has access.",2024-04-15T13:15:31.997,https://cve.circl.lu/cve/CVE-2024-31462
CVE-2024-32022,5.2,Stable Diffusion,Kohya_ss is a GUI for Kohya's Stable Diffusion trainers. Kohya_ss  is vulnerable to command injection in basic_caption_gui.py. This vulnerability is fixed in 23.1.5.,2024-04-19T16:15:10.533,https://cve.circl.lu/cve/CVE-2024-32022
CVE-2024-32023,2.5,Stable Diffusion,Kohya_ss is a GUI for Kohya's Stable Diffusion trainers. Kohya_ss is vulnerable to a path injection in the `common_gui.py` `find_and_replace` function. This vulnerability is fixed in 23.1.5.,2024-04-19T16:15:10.607,https://cve.circl.lu/cve/CVE-2024-32023
CVE-2024-32024,2.5,Stable Diffusion,Kohya_ss is a GUI for Kohya's Stable Diffusion trainers. Kohya_ss is vulnerable to a path injection in the `common_gui.py` `add_pre_postfix` function. This vulnerability is fixed in 23.1.5.,2024-04-19T16:15:10.680,https://cve.circl.lu/cve/CVE-2024-32024
CVE-2024-32025,5.2,Stable Diffusion,Kohya_ss is a GUI for Kohya's Stable Diffusion trainers. Kohya_ss is vulnerable to a command injection in `group_images_gui.py`. This vulnerability is fixed in 23.1.5.,2024-04-19T17:15:54.903,https://cve.circl.lu/cve/CVE-2024-32025
CVE-2024-21610,1.4,SSH,"An Improper Handling of Exceptional Conditions vulnerability in the Class of Service daemon (cosd) of Juniper Networks Junos OS on MX Series allows an authenticated, network-based attacker with low privileges to cause a limited Denial of Service (DoS).In a scaled subscriber scenario when specific low privileged commands, received over NETCONF, SSH or telnet, are handled by cosd on behalf of mgd, the respective child management daemon (mgd) processes will get stuck. In case of (Netconf over) SSH this leads to stuck SSH sessions, so that when the connection-limit for SSH is reached new sessions can't be established anymore. A similar behavior will be seen for telnet etc.Stuck mgd processes can be monitored by executing the following command:  user@host> show system processes extensive | match mgd | match sbwaitThis issue affects Juniper Networks Junos OS on MX Series:All versions earlier than 20.4R3-S9;21.2 versions earlier than 21.2R3-S7;21.3 versions earlier than 21.3R3-S5;21.4 versions earlier than 21.4R3-S5;22.1 versions earlier than 22.1R3-S4;22.2 versions earlier than 22.2R3-S3;22.3 versions earlier than 22.3R3-S2;22.4 versions earlier than 22.4R3;23.2 versions earlier than 23.2R1-S2, 23.2R2.",2024-04-15T13:15:51.577,https://cve.circl.lu/cve/CVE-2024-21610
CVE-2024-30407,5.9,SSH,"The Use of a Hard-coded Cryptographic Key vulnerability in Juniper Networks Juniper Cloud Native Router (JCNR) and containerized routing Protocol Deamon (cRPD) products allows an attacker to perform Person-in-the-Middle (PitM) attacks which results in complete compromise of the container. Due to hardcoded SSH host keys being present on the container, a PitM attacker can intercept SSH traffic without being detected. This issue affects Juniper Networks JCNR:  *  All versions before 23.4.This issue affects Juniper Networks cRPD:  *  All versions before 23.4R1.",2024-04-15T13:15:51.577,https://cve.circl.lu/cve/CVE-2024-30407
