CVE,Impact Score,Description,Last Modified
CVE-2016-7867,5.9,"Adobe Flash Player versions 23.0.0.207 and earlier, 11.2.202.644 and earlier have an exploitable buffer overflow / underflow vulnerability in the RegExp class related to bookmarking in searches. Successful exploitation could lead to arbitrary code execution.",2022-11-16T22:05:38.480
CVE-2016-7868,5.9,"Adobe Flash Player versions 23.0.0.207 and earlier, 11.2.202.644 and earlier have an exploitable buffer overflow / underflow vulnerability in the RegExp class related to alternation functionality. Successful exploitation could lead to arbitrary code execution.",2022-11-16T22:05:43.367
CVE-2016-7869,5.9,"Adobe Flash Player versions 23.0.0.207 and earlier, 11.2.202.644 and earlier have an exploitable buffer overflow / underflow vulnerability in the RegExp class related to backtrack search functionality. Successful exploitation could lead to arbitrary code execution.",2022-11-16T22:03:06.923
CVE-2016-7870,5.9,"Adobe Flash Player versions 23.0.0.207 and earlier, 11.2.202.644 and earlier have an exploitable buffer overflow / underflow vulnerability in the RegExp class for specific search strategies. Successful exploitation could lead to arbitrary code execution.",2022-11-16T22:02:53.463
CVE-2016-7871,5.9,"Adobe Flash Player versions 23.0.0.207 and earlier, 11.2.202.644 and earlier have an exploitable memory corruption vulnerability in the Worker class. Successful exploitation could lead to arbitrary code execution.",2022-11-16T22:02:29.287
CVE-2013-0881,2.9,"Google Chrome before 25.0.1364.97 on Windows and Linux, and before 25.0.1364.99 on Mac OS X, allows remote attackers to cause a denial of service (incorrect read operation) via crafted data in the Matroska container format.",2022-11-18T17:52:19.527
CVE-2013-0882,6.4,"Google Chrome before 25.0.1364.97 on Windows and Linux, and before 25.0.1364.99 on Mac OS X, allows remote attackers to cause a denial of service (incorrect memory access) or possibly have unspecified other impact via a large number of SVG parameters.",2022-11-18T17:55:13.750
CVE-2013-0883,2.9,"Skia, as used in Google Chrome before 25.0.1364.97 on Windows and Linux, and before 25.0.1364.99 on Mac OS X, allows remote attackers to cause a denial of service (incorrect read operation) via unspecified vectors.",2022-11-18T17:55:38.703
CVE-2013-0884,6.4,"Google Chrome before 25.0.1364.97 on Windows and Linux, and before 25.0.1364.99 on Mac OS X, does not properly load Native Client (aka NaCl) code, which has unspecified impact and attack vectors.",2022-11-18T19:59:24.583
CVE-2013-0885,6.4,"Google Chrome before 25.0.1364.97 on Windows and Linux, and before 25.0.1364.99 on Mac OS X, does not properly restrict API privileges during interaction with the Chrome Web Store, which has unspecified impact and attack vectors.",2022-11-18T19:59:08.363
CVE-2013-0881,2.9,"Google Chrome before 25.0.1364.97 on Windows and Linux, and before 25.0.1364.99 on Mac OS X, allows remote attackers to cause a denial of service (incorrect read operation) via crafted data in the Matroska container format.",2022-11-18T17:52:19.527
CVE-2013-0882,6.4,"Google Chrome before 25.0.1364.97 on Windows and Linux, and before 25.0.1364.99 on Mac OS X, allows remote attackers to cause a denial of service (incorrect memory access) or possibly have unspecified other impact via a large number of SVG parameters.",2022-11-18T17:55:13.750
CVE-2013-0883,2.9,"Skia, as used in Google Chrome before 25.0.1364.97 on Windows and Linux, and before 25.0.1364.99 on Mac OS X, allows remote attackers to cause a denial of service (incorrect read operation) via unspecified vectors.",2022-11-18T17:55:38.703
CVE-2013-0884,6.4,"Google Chrome before 25.0.1364.97 on Windows and Linux, and before 25.0.1364.99 on Mac OS X, does not properly load Native Client (aka NaCl) code, which has unspecified impact and attack vectors.",2022-11-18T19:59:24.583
CVE-2013-0885,6.4,"Google Chrome before 25.0.1364.97 on Windows and Linux, and before 25.0.1364.99 on Mac OS X, does not properly restrict API privileges during interaction with the Chrome Web Store, which has unspecified impact and attack vectors.",2022-11-18T19:59:08.363
CVE-2016-4273,5.9,"Adobe Flash Player before 18.0.0.382 and 19.x through 23.x before 23.0.0.185 on Windows and OS X and before 11.2.202.637 on Linux allows attackers to execute arbitrary code or cause a denial of service (memory corruption) via unspecified vectors, a different vulnerability than CVE-2016-6982, CVE-2016-6983, CVE-2016-6984, CVE-2016-6985, CVE-2016-6986, CVE-2016-6989, and CVE-2016-6990.",2022-11-18T16:37:56.737
CVE-2016-6981,5.9,"Use-after-free vulnerability in Adobe Flash Player before 18.0.0.382 and 19.x through 23.x before 23.0.0.185 on Windows and OS X and before 11.2.202.637 on Linux allows attackers to execute arbitrary code via unspecified vectors, a different vulnerability than CVE-2016-6987.",2022-11-18T16:25:36.233
CVE-2016-6982,5.9,"Adobe Flash Player before 18.0.0.382 and 19.x through 23.x before 23.0.0.185 on Windows and OS X and before 11.2.202.637 on Linux allows attackers to execute arbitrary code or cause a denial of service (memory corruption) via unspecified vectors, a different vulnerability than CVE-2016-4273, CVE-2016-6983, CVE-2016-6984, CVE-2016-6985, CVE-2016-6986, CVE-2016-6989, and CVE-2016-6990.",2022-11-18T16:39:05.427
CVE-2016-6983,5.9,"Adobe Flash Player before 18.0.0.382 and 19.x through 23.x before 23.0.0.185 on Windows and OS X and before 11.2.202.637 on Linux allows attackers to execute arbitrary code or cause a denial of service (memory corruption) via unspecified vectors, a different vulnerability than CVE-2016-4273, CVE-2016-6982, CVE-2016-6984, CVE-2016-6985, CVE-2016-6986, CVE-2016-6989, and CVE-2016-6990.",2022-11-18T16:39:02.620
CVE-2016-6984,5.9,"Adobe Flash Player before 18.0.0.382 and 19.x through 23.x before 23.0.0.185 on Windows and OS X and before 11.2.202.637 on Linux allows attackers to execute arbitrary code or cause a denial of service (memory corruption) via unspecified vectors, a different vulnerability than CVE-2016-4273, CVE-2016-6982, CVE-2016-6983, CVE-2016-6985, CVE-2016-6986, CVE-2016-6989, and CVE-2016-6990.",2022-11-18T17:37:57.573
CVE-2018-25032,3.6,"zlib before 1.2.12 allows memory corruption when deflating (i.e., when compressing) if the input has many distant matches.",2022-11-21T19:28:58.670
CVE-2022-26744,5.9,A memory corruption issue was addressed with improved state management. This issue is fixed in iOS 15.5 and iPadOS 15.5. An application may be able to execute arbitrary code with kernel privileges.,2022-11-16T17:14:30.527
CVE-2022-37434,5.9,"zlib through 1.2.12 has a heap-based buffer over-read or buffer overflow in inflate in inflate.c via a large gzip header extra field. NOTE: only applications that call inflateGetHeader are affected. Some common applications bundle the affected zlib source code but may be unable to call inflateGetHeader (e.g., see the nodejs/node reference).",2022-11-16T17:24:40.950
CVE-2022-32854,3.6,"This issue was addressed with improved checks. This issue is fixed in iOS 15.7 and iPadOS 15.7, iOS 16, macOS Big Sur 11.7. An app may be able to bypass Privacy preferences.",2022-11-16T17:21:32.300
CVE-2022-39260,5.9,"Git is an open source, scalable, distributed revision control system. `git shell` is a restricted login shell that can be used to implement Git's push/pull functionality via SSH. In versions prior to 2.30.6, 2.31.5, 2.32.4, 2.33.5, 2.34.5, 2.35.5, 2.36.3, and 2.37.4, the function that splits the command arguments into an array improperly uses an `int` to represent the number of entries in the array, allowing a malicious actor to intentionally overflow the return value, leading to arbitrary heap writes. Because the resulting array is then passed to `execv()`, it is possible to leverage this attack to gain remote code execution on a victim machine. Note that a victim must first allow access to `git shell` as a login shell in order to be vulnerable to this attack. This problem is patched in versions 2.30.6, 2.31.5, 2.32.4, 2.33.5, 2.34.5, 2.35.5, 2.36.3, and 2.37.4 and users are advised to upgrade to the latest version. Disabling `git shell` access via remote logins is a viable short-term workaround.",2022-11-16T18:30:10.347
CVE-2020-10383,5.9,An issue was discovered in the MB CONNECT LINE mymbCONNECT24 and mbCONNECT24 software in all versions through 2.5.0. There is an unauthenticated remote code execution in the com_mb24sysapi module.,2022-11-21T20:12:54.230
CVE-2018-20432,5.9,"D-Link COVR-2600R and COVR-3902 Kit before 1.01b05Beta01 use hardcoded credentials for telnet connection, which allows unauthenticated attackers to gain privileged access to the router, and to extract sensitive data or modify the configuration.",2022-11-16T14:48:56.517
CVE-2019-18906,5.9,"A Improper Authentication vulnerability in cryptctl of SUSE Linux Enterprise Server for SAP 12-SP5, SUSE Manager Server 4.0 allows attackers with access to the hashed password to use it without having to crack it. This issue affects: SUSE Linux Enterprise Server for SAP 12-SP5 cryptctl versions prior to 2.4. SUSE Manager Server 4.0 cryptctl versions prior to 2.4.",2022-11-21T14:39:03.757
CVE-2012-1226,6.4,Multiple directory traversal vulnerabilities in Dolibarr CMS 3.2.0 Alpha allow remote attackers to read arbitrary files and possibly execute arbitrary code via a .. (dot dot) in the (1) file parameter to document.php or (2) backtopage parameter in a create action to comm/action/fiche.php.,2022-11-17T17:21:59.260
CVE-2013-2091,5.9,SQL injection vulnerability in Dolibarr ERP/CRM 3.3.1 allows remote attackers to execute arbitrary SQL commands via the 'pays' parameter in fiche.php.,2022-11-17T17:21:59.260
CVE-2013-2093,5.9,Dolibarr ERP/CRM 3.3.1 does not properly validate user input in viewimage.php and barcode.lib.php which allows remote attackers to execute arbitrary commands.,2022-11-17T17:21:59.260
CVE-2020-13249,5.9,"libmariadb/mariadb_lib.c in MariaDB Connector/C before 3.1.8 does not properly validate the content of an OK packet received from a server. NOTE: although mariadb_lib.c was originally based on code shipped for MySQL, this issue does not affect any MySQL components supported by Oracle.",2022-11-16T03:42:36.947
CVE-2022-34331,5.9,"After performing a sequence of Power FW950, FW1010 maintenance operations a SRIOV network adapter can be improperly configured leading to desired VEPA configuration being disabled. IBM X-Force ID: 229695.",2022-11-17T14:42:04.920
CVE-2020-10713,6.0,"A flaw was found in grub2, prior to version 2.06. An attacker may use the GRUB 2 flaw to hijack and tamper the GRUB verification process. This flaw also allows the bypass of Secure Boot protections. In order to load an untrusted or modified kernel, an attacker would first need to establish access to the system such as gaining physical access, obtain the ability to alter a pxe-boot network, or have remote access to a networked system with root access. With this access, an attacker could then craft a string to cause a buffer overflow by injecting a malicious payload that leads to arbitrary code execution within GRUB. The highest threat from this vulnerability is to data confidentiality and integrity as well as system availability.",2022-11-16T04:06:00.473
CVE-2022-31676,5.9,"VMware Tools (12.0.0, 11.x.y and 10.x.y) contains a local privilege escalation vulnerability. A malicious actor with local non-administrative access to the Guest OS can escalate privileges as a root user in the virtual machine.",2022-11-16T20:05:47.650
CVE-2022-38650,6.0,** UNSUPPORTED WHEN ASSIGNED ** A remote unauthenticated insecure deserialization vulnerability exists in VMware Hyperic Server 5.8.6. Exploitation of this vulnerability enables a malicious party to run arbitrary code or malware within Hyperic Server and the host operating system with the privileges of the Hyperic server process. NOTE: This vulnerability only affects products that are no longer supported by the maintainer.,2022-11-16T23:20:16.503
CVE-2022-38651,5.9,** UNSUPPORTED WHEN ASSIGNED ** A security filter misconfiguration exists in VMware Hyperic Server 5.8.6. Exploitation of this vulnerability enables a malicious party to bypass some authentication requirements when issuing requests to Hyperic Server. NOTE: This vulnerability only affects products that are no longer supported by the maintainer.,2022-11-16T23:19:37.720
CVE-2022-38652,6.0,** UNSUPPORTED WHEN ASSIGNED ** A remote insecure deserialization vulnerability exixsts in VMWare Hyperic Agent 5.8.6. Exploitation of this vulnerability enables a malicious authenticated user to run arbitrary code or malware within a Hyperic Agent instance and its host operating system with the privileges of the Hyperic Agent process (often SYSTEM on Windows platforms). NOTE: prior exploitation of CVE-2022-38650 results in the disclosure of the authentication material required to exploit this vulnerability. NOTE: This vulnerability only affects products that are no longer supported by the maintainer.,2022-11-16T23:19:12.740
CVE-2022-39395,6.0,"Vela is a Pipeline Automation (CI/CD) framework built on Linux container technology written in Golang. In Vela Server and Vela Worker prior to version 0.16.0 and Vela UI prior to version 0.17.0, some default configurations for Vela allow exploitation and container breakouts. Users should upgrade to Server 0.16.0, Worker 0.16.0, and UI 0.17.0 to fix the issue. After upgrading, Vela administrators will need to explicitly change the default settings to configure Vela as desired. Some of the fixes will interrupt existing workflows and will require Vela administrators to modify default settings. However, not applying the patch (or workarounds) will continue existing risk exposure. Some workarounds are available. Vela administrators can adjust the worker's `VELA_RUNTIME_PRIVILEGED_IMAGES` setting to be explicitly empty, leverage the `VELA_REPO_ALLOWLIST` setting on the server component to restrict access to a list of repositories that are allowed to be enabled, and/or audit enabled repositories and disable pull_requests if they are not needed.",2022-11-17T16:45:25.260
CVE-2022-0324,3.6,"There is a vulnerability in DHCPv6 packet parsing code that could be explored by remote attacker to craft a packet that could cause buffer overflow in a memcpy call, leading to out-of-bounds memory write that would cause dhcp6relay to crash. Dhcp6relay is a critical process and could cause dhcp relay docker to shutdown. Discovered by Eugene Lim of GovTech Singapore.",2022-11-17T23:16:03.347
CVE-2022-45385,3.6,A missing permission check in Jenkins CloudBees Docker Hub/Registry Notification Plugin 2.6.2 and earlier allows unauthenticated attackers to trigger builds of jobs corresponding to the attacker-specified repository.,2022-11-18T15:48:26.607
CVE-2022-41939,4.0,"knative.dev/func is is a client library and CLI enabling the development and deployment of Kubernetes functions. Developers using a malicious or compromised third-party buildpack could expose their registry credentials or local docker socket to a malicious `lifecycle` container. This issues has been patched in PR #1442, and is part of release 1.8.1. This issue only affects users who are using function buildpacks from third-parties; pinning the builder image to a specific content-hash with a valid `lifecycle` image will also mitigate the attack.",2022-11-20T02:44:25.263
CVE-2013-0881,2.9,"Google Chrome before 25.0.1364.97 on Windows and Linux, and before 25.0.1364.99 on Mac OS X, allows remote attackers to cause a denial of service (incorrect read operation) via crafted data in the Matroska container format.",2022-11-18T17:52:19.527
CVE-2013-0882,6.4,"Google Chrome before 25.0.1364.97 on Windows and Linux, and before 25.0.1364.99 on Mac OS X, allows remote attackers to cause a denial of service (incorrect memory access) or possibly have unspecified other impact via a large number of SVG parameters.",2022-11-18T17:55:13.750
CVE-2013-0883,2.9,"Skia, as used in Google Chrome before 25.0.1364.97 on Windows and Linux, and before 25.0.1364.99 on Mac OS X, allows remote attackers to cause a denial of service (incorrect read operation) via unspecified vectors.",2022-11-18T17:55:38.703
CVE-2013-0884,6.4,"Google Chrome before 25.0.1364.97 on Windows and Linux, and before 25.0.1364.99 on Mac OS X, does not properly load Native Client (aka NaCl) code, which has unspecified impact and attack vectors.",2022-11-18T19:59:24.583
CVE-2013-0885,6.4,"Google Chrome before 25.0.1364.97 on Windows and Linux, and before 25.0.1364.99 on Mac OS X, does not properly restrict API privileges during interaction with the Chrome Web Store, which has unspecified impact and attack vectors.",2022-11-18T19:59:08.363
CVE-2022-3061,3.6,"Found Linux Kernel flaw in the i740 driver. The Userspace program could pass any values to the driver through ioctl() interface. The driver doesn't check the value of 'pixclock', so it may cause a divide by zero error.",2022-11-21T19:45:15.827
CVE-2019-0185,3.6,"Insufficient access control in protected memory subsystem for SMM for 6th, 7th, 8th and 9th Generation Intel(R) Core(TM) Processor families; Intel(R) Xeon(R) Processor E3-1500 v5 and v6 families; Intel(R) Xeon(R) E-2100 and E-2200 Processor families with Intel(R) Processor Graphics may allow a privileged user to potentially enable information disclosure via local access.",2022-11-21T19:09:01.563
CVE-2020-6096,5.9,"An exploitable signed comparison vulnerability exists in the ARMv7 memcpy() implementation of GNU glibc 2.30.9000. Calling memcpy() (on ARMv7 targets that utilize the GNU glibc implementation) with a negative value for the 'num' parameter results in a signed comparison vulnerability. If an attacker underflows the 'num' parameter to memcpy(), this vulnerability could lead to undefined behavior such as writing to out-of-bounds memory and potentially remote code execution. Furthermore, this memcpy() implementation allows for program execution to continue in scenarios where a segmentation fault or crash should have occurred. The dangers occur in that subsequent execution and iterations of this code will be executed with this corrupted data.",2022-11-21T19:39:51.000
CVE-2019-11823,3.6,CRLF injection vulnerability in Network Center in Synology Router Manager (SRM) before 1.2.3-8017-2 allows remote attackers to cause a denial of service (out-of-bounds read and application crash) via crafted network traffic.,2022-11-16T03:16:00.553
CVE-2020-25596,3.6,"An issue was discovered in Xen through 4.14.x. x86 PV guest kernels can experience denial of service via SYSENTER. The SYSENTER instruction leaves various state sanitization activities to software. One of Xen's sanitization paths injects a #GP fault, and incorrectly delivers it twice to the guest. This causes the guest kernel to observe a kernel-privilege #GP fault (typically fatal) rather than a user-privilege #GP fault (usually converted into SIGSEGV/etc.). Malicious or buggy userspace can crash the guest kernel, resulting in a VM Denial of Service. All versions of Xen from 3.2 onwards are vulnerable. Only x86 systems are vulnerable. ARM platforms are not vulnerable. Only x86 systems that support the SYSENTER instruction in 64bit mode are vulnerable. This is believed to be Intel, Centaur, and Shanghai CPUs. AMD and Hygon CPUs are not believed to be vulnerable. Only x86 PV guests can exploit the vulnerability. x86 PVH / HVM guests cannot exploit the vulnerability.",2022-11-21T14:24:57.713
CVE-2020-27652,6.0,Algorithm downgrade vulnerability in QuickConnect in Synology DiskStation Manager (DSM) before 6.2.3-25426-2 allows man-in-the-middle attackers to spoof servers and obtain sensitive information via unspecified vectors.,2022-11-16T15:34:24.090
CVE-2020-25596,3.6,"An issue was discovered in Xen through 4.14.x. x86 PV guest kernels can experience denial of service via SYSENTER. The SYSENTER instruction leaves various state sanitization activities to software. One of Xen's sanitization paths injects a #GP fault, and incorrectly delivers it twice to the guest. This causes the guest kernel to observe a kernel-privilege #GP fault (typically fatal) rather than a user-privilege #GP fault (usually converted into SIGSEGV/etc.). Malicious or buggy userspace can crash the guest kernel, resulting in a VM Denial of Service. All versions of Xen from 3.2 onwards are vulnerable. Only x86 systems are vulnerable. ARM platforms are not vulnerable. Only x86 systems that support the SYSENTER instruction in 64bit mode are vulnerable. This is believed to be Intel, Centaur, and Shanghai CPUs. AMD and Hygon CPUs are not believed to be vulnerable. Only x86 PV guests can exploit the vulnerability. x86 PVH / HVM guests cannot exploit the vulnerability.",2022-11-21T14:24:57.713
CVE-2021-3634,3.6,"A flaw has been found in libssh in versions prior to 0.9.6. The SSH protocol keeps track of two shared secrets during the lifetime of the session. One of them is called secret_hash and the other session_id. Initially, both of them are the same, but after key re-exchange, previous session_id is kept and used as an input to new secret_hash. Historically, both of these buffers had shared length variable, which worked as long as these buffers were same. But the key re-exchange operation can also change the key exchange method, which can be based on hash of different size, eventually creating ""secret_hash"" of different size than the session_id has. This becomes an issue when the session_id memory is zeroed or when it is used again during second key re-exchange.",2022-11-16T03:31:13.740
CVE-2022-23831,3.6,Insufficient validation of the IOCTL input buffer in AMD ?Prof may allow an attacker to send an arbitrary buffer leading to a potential Windows kernel crash resulting in denial of service.,2022-11-16T23:22:04.780
CVE-2022-27673,3.6,Insufficient access controls in the AMD Link Android app may potentially result in information disclosure.,2022-11-16T23:21:54.327
CVE-2022-27674,3.6,Insufficient validation in the IOCTL input/output buffer in AMD ?Prof may allow an attacker to bypass bounds checks potentially leading to a Windows kernel crash resulting in denial of service.,2022-11-16T23:21:42.823
CVE-2020-14444,2.7,An issue was discovered in WSO2 Identity Server through 5.9.0 and WSO2 IS as Key Manager through 5.9.0. A potential Reflected Cross-Site Scripting (XSS) vulnerability has been identified in the Management Console Policy Administration user interface.,2022-11-16T03:57:54.037
CVE-2020-14445,2.7,An issue was discovered in WSO2 Identity Server through 5.9.0 and WSO2 IS as Key Manager through 5.9.0. A potential Reflected Cross-Site Scripting (XSS) vulnerability has been identified in the Management Console Basic Policy Editor user Interface.,2022-11-16T03:57:00.247
CVE-2020-6020,5.5,"Check Point Security Management's Internal CA web management before Jumbo HFAs R80.10 Take 278, R80.20 Take 160, R80.30 Take 210, and R80.40 Take 38, can be manipulated to run commands as a high privileged user or crash, due to weak input validation on inputs by a trusted management administrator.",2022-11-16T13:56:07.890
CVE-2020-11853,5.9,"Arbitrary code execution vulnerability affecting multiple Micro Focus products. 1.) Operation Bridge Manager affecting version: 2020.05, 2019.11, 2019.05, 2018.11, 2018.05, versions 10.6x and 10.1x and older versions. 2.) Application Performance Management affecting versions : 9.51, 9.50 and 9.40 with uCMDB 10.33 CUP 3 3.) Data Center Automation affected version 2019.11 4.) Operations Bridge (containerized) affecting versions: 2019.11, 2019.08, 2019.05, 2018.11, 2018.08, 2018.05, 2018.02, 2017.11 5.) Universal CMDB affecting version: 2020.05, 2019.11, 2019.05, 2019.02, 2018.11, 2018.08, 2018.05, 11, 10.33, 10.32, 10.31, 10.30 6.) Hybrid Cloud Management affecting version 2020.05 7.) Service Management Automation affecting version 2020.5 and 2020.02. The vulnerability could allow to execute arbitrary code.",2022-11-16T16:45:34.487
CVE-2021-33618,2.7,"Dolibarr ERP and CRM 13.0.2 allows XSS via object details, as demonstrated by > and < characters in the onpointermove attribute of a BODY element to the user-management feature.",2022-11-17T17:21:59.260
CVE-2011-4802,6.4,"Multiple SQL injection vulnerabilities in Dolibarr 3.1.0 RC and probably earlier allow remote authenticated users to execute arbitrary SQL commands via the (1) sortfield, (2) sortorder, and (3) sall parameters to user/index.php and (b) user/group/index.php; the id parameter to (4) info.php, (5) perms.php, (6) param_ihm.php, (7) note.php, and (8) fiche.php in user/; and (9) rowid parameter to admin/boxes.php.",2022-11-17T17:21:59.260
CVE-2012-1225,6.4,Multiple SQL injection vulnerabilities in Dolibarr CMS 3.2.0 Alpha and earlier allow remote authenticated users to execute arbitrary SQL commands via the (1) memberslist parameter (aka Member List) in list.php or (2) rowid parameter to adherents/fiche.php.,2022-11-17T17:21:59.260
