CVE,"Impact Score (1-10, 10 being the worst)",Keyword,Description,Last Modified,Link
CVE-2023-21933,3.6,Oracle,Vulnerability in the MySQL Server product of Oracle MySQL (component: Server: DDL).  Supported versions that are affected are 8.0.32 and prior. Easily exploitable vulnerability allows high privileged attacker with network access via multiple protocols to compromise MySQL Server.  Successful attacks of this vulnerability can result in unauthorized ability to cause a hang or frequently repeatable crash (complete DOS) of MySQL Server. CVSS 3.1 Base Score 4.9 (Availability impacts).  CVSS Vector: (CVSS:3.1/AV:N/AC:L/PR:H/UI:N/S:U/C:N/I:N/A:H).,2023-10-30T19:56:40.960,https://cve.circl.lu/cve/CVE-2023-21933
CVE-2023-21935,3.6,Oracle,Vulnerability in the MySQL Server product of Oracle MySQL (component: Server: Optimizer).  Supported versions that are affected are 8.0.32 and prior. Easily exploitable vulnerability allows high privileged attacker with network access via multiple protocols to compromise MySQL Server.  Successful attacks of this vulnerability can result in unauthorized ability to cause a hang or frequently repeatable crash (complete DOS) of MySQL Server. CVSS 3.1 Base Score 4.9 (Availability impacts).  CVSS Vector: (CVSS:3.1/AV:N/AC:L/PR:H/UI:N/S:U/C:N/I:N/A:H).,2023-10-30T19:56:26.043,https://cve.circl.lu/cve/CVE-2023-21935
CVE-2023-21940,3.6,Oracle,Vulnerability in the MySQL Server product of Oracle MySQL (component: Server: Components Services).  Supported versions that are affected are 8.0.32 and prior. Difficult to exploit vulnerability allows high privileged attacker with network access via multiple protocols to compromise MySQL Server.  Successful attacks of this vulnerability can result in unauthorized ability to cause a hang or frequently repeatable crash (complete DOS) of MySQL Server. CVSS 3.1 Base Score 4.4 (Availability impacts).  CVSS Vector: (CVSS:3.1/AV:N/AC:H/PR:H/UI:N/S:U/C:N/I:N/A:H).,2023-10-30T19:56:15.737,https://cve.circl.lu/cve/CVE-2023-21940
CVE-2021-39290,5.9,PHP,"Certain NetModule devices allow Limited Session Fixation via PHPSESSID. These models with firmware before 4.3.0.113, 4.4.0.111, and 4.5.0.105 are affected: NB800, NB1600, NB1601, NB1800, NB1810, NB2700, NB2710, NB2800, NB2810, NB3700, NB3701, NB3710, NB3711, NB3720, and NB3800.",2023-11-02T15:48:19.867,https://cve.circl.lu/cve/CVE-2021-39290
CVE-2021-4301,5.9,PHP,A vulnerability was found in slackero phpwcms up to 1.9.26 and classified as critical. Affected by this issue is some unknown functionality. The manipulation of the argument $phpwcms['db_prepend'] leads to sql injection. The attack may be launched remotely. Upgrading to version 1.9.27 is able to address this issue. The patch is identified as 77dafb6a8cc1015f0777daeb5792f43beef77a9d. It is recommended to upgrade the affected component. VDB-217418 is the identifier assigned to this vulnerability.,2023-10-30T19:58:39.067,https://cve.circl.lu/cve/CVE-2021-4301
CVE-2023-3823,3.6,PHP,"In PHP versions 8.0.* before 8.0.30, 8.1.* before 8.1.22, and 8.2.* before 8.2.8 various XML functions rely on libxml global state to track configuration variables, like whether external entities are loaded. This state is assumed to be unchanged unless the user explicitly changes it by calling appropriate function. However, since the state is process-global, other modules - such as ImageMagick - may also use this library within the same process, and change that global state for their internal purposes, and leave it in a state where external entities loading is enabled. This can lead to the situation where external XML is parsed with external entities loaded, which can lead to disclosure of any local files accessible to PHP. This vulnerable state may persist in the same process across many requests, until the process is shut down. ",2023-10-27T18:58:56.457,https://cve.circl.lu/cve/CVE-2023-3823
CVE-2023-3824,5.9,PHP,"In PHP version 8.0.* before 8.0.30,  8.1.* before 8.1.22, and 8.2.* before 8.2.8, when loading phar file, while reading PHAR directory entries, insufficient length checking may lead to a stack buffer overflow, leading potentially to memory corruption or RCE. ",2023-10-27T18:58:24.280,https://cve.circl.lu/cve/CVE-2023-3824
CVE-2023-4402,5.9,PHP,"The Essential Blocks plugin for WordPress is vulnerable to PHP Object Injection in versions up to, and including, 4.2.0 via deserialization of untrusted input in the get_products function. This allows unauthenticated attackers to inject a PHP Object. No POP chain is present in the vulnerable plugin. If a POP chain is present via an additional plugin or theme installed on the target system, it could allow the attacker to delete arbitrary files, retrieve sensitive data, or execute code.",2023-10-27T17:37:04.887,https://cve.circl.lu/cve/CVE-2023-4402
CVE-2018-25082,5.9,Python,A vulnerability was found in zwczou WeChat SDK Python 0.3.0 and classified as critical. This issue affects the function validate/to_xml. The manipulation leads to xml external entity reference. The attack may be initiated remotely. Upgrading to version 0.5.5 is able to address this issue. The patch is named e54abadc777715b6dcb545c13214d1dea63df6c9. It is recommended to upgrade the affected component. The associated identifier of this vulnerability is VDB-223403.,2023-10-30T20:00:38.257,https://cve.circl.lu/cve/CVE-2018-25082
CVE-2023-41105,3.6,Python,"An issue was discovered in Python 3.11 through 3.11.4. If a path containing '\0' bytes is passed to os.path.normpath(), the path will be truncated unexpectedly at the first '\0' byte. There are plausible cases in which an application would have rejected a filename for security reasons in Python 3.10.x or earlier, but that filename is no longer rejected in Python 3.11.x.",2023-11-01T15:02:01.477,https://cve.circl.lu/cve/CVE-2023-41105
CVE-2023-45813,3.6,Python,Torbot is an open source tor network intelligence tool. In affected versions the `torbot.modules.validators.validate_link function` uses the python-validators URL validation regex. This particular regular expression has an exponential complexity which allows an attacker to cause an application crash using a well-crafted argument. An attacker can use a well-crafted URL argument to exploit the vulnerability in the regular expression and cause a Denial of Service on the system. The validators file has been removed in version 4.0.0. Users are advised to upgrade. There are no known workarounds for this vulnerability.,2023-10-30T13:37:36.380,https://cve.circl.lu/cve/CVE-2023-45813
CVE-2023-45805,5.9,Python,"pdm is a Python package and dependency manager supporting the latest PEP standards. It's possible to craft a malicious `pdm.lock` file that could allow e.g. an insider or a malicious open source project to appear to depend on a trusted PyPI project, but actually install another project. A project `foo` can be targeted by creating the project `foo-2` and uploading the file `foo-2-2.tar.gz` to pypi.org. PyPI will see this as project `foo-2` version `2`, while PDM will see this as project `foo` version `2-2`. The version must only be `parseable as a version` and the filename must be a prefix of the project name, but it's not verified to match the version being installed. Version `2-2` is also not a valid normalized version per PEP 440. Matching the project name exactly (not just prefix) would fix the issue. When installing dependencies with PDM, what's actually installed could differ from what's listed in `pyproject.toml` (including arbitrary code execution on install). It could also be used for downgrade attacks by only changing the version. This issue has been addressed in commit `6853e2642df` which is included in release version `2.9.4`. Users are advised to upgrade. There are no known workarounds for this vulnerability.",2023-10-28T03:24:28.190,https://cve.circl.lu/cve/CVE-2023-45805
CVE-2023-46127,2.7,Python,Frappe is a full-stack web application framework that uses Python and MariaDB on the server side and an integrated client side library. A malicious Frappe user with desk access could create documents containing HTML payloads allowing HTML Injection. This vulnerability has been patched in version 14.49.0.,2023-10-31T12:17:17.793,https://cve.circl.lu/cve/CVE-2023-46127
CVE-2023-38735,3.6,Phishing,"IBM Cognos Dashboards on Cloud Pak for Data 4.7.0 could allow a remote attacker to bypass security restrictions, caused by a reverse tabnabbing flaw. An attacker could exploit this vulnerability and redirect a victim to a phishing site.  IBM X-Force ID:  262482.",2023-10-27T19:32:01.610,https://cve.circl.lu/cve/CVE-2023-38735
CVE-2023-36085,2.7,Phishing,"The sisqualWFM 7.1.319.103 thru 7.1.319.111 for Android, has a host header injection vulnerability in its ""/sisqualIdentityServer/core/"" endpoint. By modifying the HTTP Host header, an attacker can change webpage links and even redirect users to arbitrary or malicious locations. This can lead to phishing attacks, malware distribution, and unauthorized access to sensitive resources.",2023-10-31T15:22:17.323,https://cve.circl.lu/cve/CVE-2023-36085
CVE-2023-4393,2.5,Phishing,"HTML and SMTP injections on the registration page of LiquidFiles versions 3.7.13 and below, allow an attacker to perform more advanced phishing attacks against an organization.",2023-10-30T11:54:30.703,https://cve.circl.lu/cve/CVE-2023-4393
CVE-2023-5214,5.9,Puppet,"In Puppet Bolt versions prior to 3.27.4, a path to escalate privileges was identified.",2023-11-02T01:51:30.593,https://cve.circl.lu/cve/CVE-2023-5214
CVE-2023-4967,4.2,RDP,"Denial of Service in NetScaler ADC and NetScaler Gateway when configured as a Gateway (VPN virtual server, ICA Proxy, CVPN, RDP Proxy) or AAA Virtual Server",2023-10-29T01:44:42.707,https://cve.circl.lu/cve/CVE-2023-4967
CVE-2023-5625,1.4,Red Hat,"A regression was introduced in the Red Hat build of python-eventlet due to a change in the patch application strategy, resulting in a patch for CVE-2021-21419 not being applied for all builds of all products.",2023-11-01T16:16:34.600,https://cve.circl.lu/cve/CVE-2023-5625
CVE-2023-43119,5.9,Redis,"An Access Control issue discovered in Extreme Networks Switch Engine (EXOS) before 32.5.1.5, also fixed in 22.7, 31.7.2 allows attackers to gain escalated privileges using crafted telnet commands via Redis server.",2023-10-27T15:54:49.907,https://cve.circl.lu/cve/CVE-2023-43119
CVE-2023-45145,2.5,Redis,"Redis is an in-memory database that persists on disk. On startup, Redis begins listening on a Unix socket before adjusting its permissions to the user-provided configuration. If a permissive umask(2) is used, this creates a race condition that enables, during a short period of time, another process to establish an otherwise unauthorized connection. This problem has existed since Redis 2.6.0-RC1. This issue has been addressed in Redis versions 7.2.2, 7.0.14 and 6.2.14. Users are advised to upgrade. For users unable to upgrade, it is possible to work around the problem by disabling Unix sockets, starting Redis with a restrictive umask, or storing the Unix socket file in a protected directory.",2023-10-30T12:50:12.313,https://cve.circl.lu/cve/CVE-2023-45145
CVE-2023-46215,NA,Redis,"Insertion of Sensitive Information into Log File vulnerability in Apache Airflow Celery provider, Apache Airflow.Sensitive information logged as clear text when rediss, amqp, rpc protocols are used as Celery result backendNote: the vulnerability is about the information exposed in the logs not about accessing the logs.This issue affects Apache Airflow Celery provider: from 3.3.0 through 3.4.0; Apache Airflow: from 1.10.0 through 2.6.3.Users are recommended to upgrade Airflow Celery provider to version 3.4.1 and Apache Airlfow to version 2.7.0 which fixes the issue.",2023-10-29T01:44:12.570,https://cve.circl.lu/cve/CVE-2023-46215
CVE-2023-5765,NA,Remote Desktop,Improper access control in the password analyzer feature in Devolutions Remote Desktop Manager 2023.2.33 and earlier on Windows allows an attacker to bypass permissions via data source switching.,2023-11-01T18:17:40.607,https://cve.circl.lu/cve/CVE-2023-5765
CVE-2023-5766,NA,Remote Desktop,A remote code execution vulnerability in Remote Desktop Manager 2023.2.33 and earlier on Windows allows an attacker to remotely execute code from another windows user session on the same host via a specially crafted TCP packet.,2023-11-01T18:17:40.607,https://cve.circl.lu/cve/CVE-2023-5766
CVE-2023-20598,5.9,Radeon,An improper privilege management in the AMD Radeon™ Graphics driver may allow an authenticated attacker to craft an IOCTL request to gain I/O control over arbitrary hardware ports or physical addresses resulting in a potential arbitrary code execution.,2023-10-28T03:31:07.843,https://cve.circl.lu/cve/CVE-2023-20598
CVE-2020-2238,2.7,Repository,"Jenkins Git Parameter Plugin 0.9.12 and earlier does not escape the repository field on the 'Build with Parameters' page, resulting in a stored cross-site scripting (XSS) vulnerability exploitable by attackers with Job/Configure permission.",2023-11-02T21:40:31.353,https://cve.circl.lu/cve/CVE-2020-2238
CVE-2021-21618,2.7,Repository,"Jenkins Repository Connector Plugin 2.0.2 and earlier does not escape parameter names and descriptions for past builds, resulting in a stored cross-site scripting (XSS) vulnerability exploitable by attackers with Item/Configure permission.",2023-11-02T22:00:16.503,https://cve.circl.lu/cve/CVE-2021-21618
CVE-2021-43809,5.9,Repository,"`Bundler` is a package for managing application dependencies in Ruby. In `bundler` versions before 2.2.33, when working with untrusted and apparently harmless `Gemfile`'s, it is not expected that they lead to execution of external code, unless that's explicit in the ruby code inside the `Gemfile` itself. However, if the `Gemfile` includes `gem` entries that use the `git` option with invalid, but seemingly harmless, values with a leading dash, this can be false. To handle dependencies that come from a Git repository instead of a registry, Bundler uses various commands, such as `git clone`. These commands are being constructed using user input (e.g. the repository URL). When building the commands, Bundler versions before 2.2.33 correctly avoid Command Injection vulnerabilities by passing an array of arguments instead of a command string. However, there is the possibility that a user input starts with a dash (`-`) and is therefore treated as an optional argument instead of a positional one. This can lead to Code Execution because some of the commands have options that can be leveraged to run arbitrary executables. Since this value comes from the `Gemfile` file, it can contain any character, including a leading dash.To exploit this vulnerability, an attacker has to craft a directory containing a `Gemfile` file that declares a dependency that is located in a Git repository. This dependency has to have a Git URL in the form of `-u./payload`. This URL will be used to construct a Git clone command but will be interpreted as the upload-pack argument. Then this directory needs to be shared with the victim, who then needs to run a command that evaluates the Gemfile, such as `bundle lock`, inside.This vulnerability can lead to Arbitrary Code Execution, which could potentially lead to the takeover of the system. However, the exploitability is very low, because it requires a lot of user interaction. Bundler 2.2.33 has patched this problem by inserting `--` as an argument before any positional arguments to those Git commands that were affected by this issue. Regardless of whether users can upgrade or not, they should review any untrustred `Gemfile`'s before running any `bundler` commands that may read them, since they can contain arbitrary ruby code.",2023-10-27T12:57:25.907,https://cve.circl.lu/cve/CVE-2021-43809
CVE-2022-36903,1.4,Repository,A missing permission check in Jenkins Repository Connector Plugin 2.2.0 and earlier allows attackers with Overall/Read permission to enumerate credentials IDs of credentials stored in Jenkins.,2023-11-02T21:06:24.167,https://cve.circl.lu/cve/CVE-2022-36903
CVE-2022-36904,1.4,Repository,"Jenkins Repository Connector Plugin 2.2.0 and earlier does not perform a permission check in a method implementing form validation, allowing attackers with Overall/Read permission to check for the existence of an attacker-specified file path on the Jenkins controller file system.",2023-11-02T20:57:37.993,https://cve.circl.lu/cve/CVE-2022-36904
CVE-2020-2106,2.7,Repo,"Jenkins Code Coverage API Plugin 1.1.2 and earlier does not escape the filename of the coverage report used in its view, resulting in a stored XSS vulnerability exploitable by users able to change job configurations.",2023-11-02T21:26:47.237,https://cve.circl.lu/cve/CVE-2020-2106
CVE-2020-2173,2.7,Repo,"Jenkins Gatling Plugin 1.2.7 and earlier prevents Content-Security-Policy headers from being set for Gatling reports served by the plugin, resulting in an XSS vulnerability exploitable by users able to change report content.",2023-11-02T21:12:34.363,https://cve.circl.lu/cve/CVE-2020-2173
CVE-2020-2175,2.7,Repo,"Jenkins FitNesse Plugin 1.31 and earlier does not correctly escape report contents before showing them on the Jenkins UI, resulting in a stored cross-site scripting (XSS) vulnerability exploitable by users able to control the XML input files processed by the plugin.",2023-11-02T21:42:00.827,https://cve.circl.lu/cve/CVE-2020-2175
CVE-2020-2238,2.7,Repo,"Jenkins Git Parameter Plugin 0.9.12 and earlier does not escape the repository field on the 'Build with Parameters' page, resulting in a stored cross-site scripting (XSS) vulnerability exploitable by attackers with Job/Configure permission.",2023-11-02T21:40:31.353,https://cve.circl.lu/cve/CVE-2020-2238
CVE-2020-2246,2.7,Repo,"Jenkins Valgrind Plugin 0.28 and earlier does not escape content in Valgrind XML reports, resulting in a stored cross-site scripting (XSS) vulnerability exploitable by attackers able to control Valgrind XML report contents.",2023-11-02T21:33:24.990,https://cve.circl.lu/cve/CVE-2020-2246
CVE-2023-36920,2.7,SAP,"In SAP Enable Now - versions WPB_MANAGER 1.0, WPB_MANAGER_CE 10, WPB_MANAGER_HANA 10, ENABLE_NOW_CONSUMP_DEL 1704, the X-FRAME-OPTIONS response header is not implemented, allowing an unauthenticated attacker to attempt clickjacking, which could result in disclosure or modification of information.",2023-10-30T17:20:42.887,https://cve.circl.lu/cve/CVE-2023-36920
CVE-2020-15862,5.9,SNMP,Net-SNMP through 5.7.3 has Improper Privilege Management because SNMP WRITE access to the EXTEND MIB provides the ability to run arbitrary commands as root.,2023-10-31T19:30:58.390,https://cve.circl.lu/cve/CVE-2020-15862
CVE-2022-30011,5.9,SQL,"In HMS 1.0 when requesting appointment.php through POST, multiple parameters can lead to a SQL injection vulnerability.",2023-11-02T01:12:30.027,https://cve.circl.lu/cve/CVE-2022-30011
CVE-2022-41775,5.9,SQL,SQL Injection in Handler_CFG.ashx in Delta Electronics DIAEnergie versions prior to v1.9.02.001 allows an attacker to inject SQL queries via Network,2023-10-30T17:02:02.710,https://cve.circl.lu/cve/CVE-2022-41775
CVE-2022-43447,5.9,SQL,SQL Injection in AM_EBillAnalysis.aspx in Delta Electronics DIAEnergie versions prior to v1.9.02.001 allows an attacker to inject SQL queries via Network,2023-10-30T17:00:35.280,https://cve.circl.lu/cve/CVE-2022-43447
CVE-2022-43452,5.9,SQL,SQL Injection in FtyInfoSetting.aspx in Delta Electronics DIAEnergie versions prior to v1.9.02.001 allows an attacker to inject SQL queries via Network,2023-10-27T20:31:36.537,https://cve.circl.lu/cve/CVE-2022-43452
CVE-2022-43506,5.9,SQL,SQL Injection in HandlerTag_KID.ashxin Delta Electronics DIAEnergie versions prior to v1.9.02.001 allows an attacker to inject SQL queries via Network,2023-10-30T17:00:18.507,https://cve.circl.lu/cve/CVE-2022-43506
CVE-2014-3577,4.9,SSL,"org.apache.http.conn.ssl.AbstractVerifier in Apache HttpComponents HttpClient before 4.3.5 and HttpAsyncClient before 4.0.2 does not properly verify that the server hostname matches a domain name in the subject's Common Name (CN) or subjectAltName field of the X.509 certificate, which allows man-in-the-middle attackers to spoof SSL servers via a ""CN="" string in a field in the distinguished name (DN) of a certificate, as demonstrated by the ""foo,CN=www.apache.org"" string in the O field.",2023-10-27T15:15:09.487,https://cve.circl.lu/cve/CVE-2014-3577
CVE-2020-28972,3.6,SSL,"In SaltStack Salt before 3002.5, authentication to VMware vcenter, vsphere, and esxi servers (in the vmware.py files) does not always validate the SSL/TLS certificate.",2023-10-31T14:15:08.903,https://cve.circl.lu/cve/CVE-2020-28972
CVE-2020-35662,5.2,SSL,"In SaltStack Salt before 3002.5, when authenticating to services using certain modules, the SSL certificate is not always validated.",2023-10-31T14:15:09.000,https://cve.circl.lu/cve/CVE-2020-35662
CVE-2022-38666,3.6,SSL,Jenkins NS-ND Integration Performance Publisher Plugin 4.8.0.146 and earlier unconditionally disables SSL/TLS certificate and hostname validation for several features.,2023-11-02T20:53:11.360,https://cve.circl.lu/cve/CVE-2022-38666
CVE-2022-45391,3.6,SSL,Jenkins NS-ND Integration Performance Publisher Plugin 4.8.0.143 and earlier globally and unconditionally disables SSL/TLS certificate and hostname validation for the entire Jenkins controller JVM.,2023-11-01T20:00:33.640,https://cve.circl.lu/cve/CVE-2022-45391
CVE-2021-4301,5.9,Slack,A vulnerability was found in slackero phpwcms up to 1.9.26 and classified as critical. Affected by this issue is some unknown functionality. The manipulation of the argument $phpwcms['db_prepend'] leads to sql injection. The attack may be launched remotely. Upgrading to version 1.9.27 is able to address this issue. The patch is identified as 77dafb6a8cc1015f0777daeb5792f43beef77a9d. It is recommended to upgrade the affected component. VDB-217418 is the identifier assigned to this vulnerability.,2023-10-30T19:58:39.067,https://cve.circl.lu/cve/CVE-2021-4301
CVE-2023-46723,6.0,Slack,"lte-pic32-writer is a writer for PIC32 devices. In versions 0.0.1 and prior, those who use `sendto.txt` are vulnerable to attackers who known the IMEI reading the sendto.txt. The sendto.txt file can contain the SNS(such as slack and zulip) URL and API key. As of time of publication, a patch is not yet available. As workarounds, avoid using `sendto.txt` or use `.htaccess` to block access to `sendto.txt`.",2023-10-31T17:07:44.967,https://cve.circl.lu/cve/CVE-2023-46723
CVE-2023-23842,5.9,Solarwinds,The SolarWinds Network Configuration Manager was susceptible to the Directory Traversal Vulnerability. This vulnerability allows users with administrative access to SolarWinds Web Console to execute arbitrary commands.,2023-10-30T19:43:24.260,https://cve.circl.lu/cve/CVE-2023-23842
CVE-2023-33229,1.4,Solarwinds,The SolarWinds Platform was susceptible to the Incorrect Input Neutralization Vulnerability. This vulnerability allows a remote adversary with a valid SolarWinds Platform account to append URL parameters to inject passive HTML. ,2023-10-30T19:42:24.257,https://cve.circl.lu/cve/CVE-2023-33229
CVE-2023-3622,1.4,Solarwinds, Access Control Bypass Vulnerability in the SolarWinds Platform that allows an underprivileged user to read arbitrary resource ,2023-10-30T19:42:12.173,https://cve.circl.lu/cve/CVE-2023-3622
CVE-2023-33228,3.6,Solarwinds,The SolarWinds Network Configuration Manager was susceptible to the Exposure of Sensitive Information Vulnerability. This vulnerability allows users with administrative access to SolarWinds Web Console to obtain sensitive information.,2023-11-01T16:16:34.600,https://cve.circl.lu/cve/CVE-2023-33228
CVE-2023-40062,5.9,Solarwinds,"SolarWinds Platform Incomplete List of Disallowed Inputs Remote Code Execution Vulnerability. If executed, this vulnerability would allow a low-privileged user to execute commands with SYSTEM privileges.",2023-11-01T16:16:34.600,https://cve.circl.lu/cve/CVE-2023-40062
CVE-2023-5568,3.6,Samba,"A heap-based Buffer Overflow flaw was discovered in Samba. It could allow a remote, authenticated attacker to exploit this vulnerability to cause a denial of service.",2023-11-01T20:44:27.143,https://cve.circl.lu/cve/CVE-2023-5568
CVE-2023-1193,3.6,Samba,A use-after-free flaw was found in setup_async_work in the KSMBD implementation of the in-kernel samba server and CIFS in the Linux kernel. This issue could allow an attacker to crash the system by accessing freed work.,2023-11-02T12:54:36.497,https://cve.circl.lu/cve/CVE-2023-1193
CVE-2023-46315,3.6,Stable Diffusion,"The zanllp sd-webui-infinite-image-browsing (aka Infinite Image Browsing) extension before 977815a for stable-diffusion-webui (aka Stable Diffusion web UI), if Gradio authentication is enabled without secret key configuration, allows remote attackers to read any local file via /file?path= in the URL, as demonstrated by reading /proc/self/environ to discover credentials.",2023-10-30T19:09:47.337,https://cve.circl.lu/cve/CVE-2023-46315
CVE-2020-29583,5.9,SSH,Firmware version 4.60 of Zyxel USG devices contains an undocumented account (zyfwp) with an unchangeable password. The password for this account can be found in cleartext in the firmware. This account can be used by someone to login to the ssh server or web interface with admin privileges.,2023-10-28T01:15:51.480,https://cve.circl.lu/cve/CVE-2020-29583
CVE-2021-3197,5.9,SSH,"An issue was discovered in SaltStack Salt before 3002.5. The salt-api's ssh client is vulnerable to a shell injection by including ProxyCommand in an argument, or via ssh_options provided in an API request.",2023-10-31T14:15:10.833,https://cve.circl.lu/cve/CVE-2021-3197
