CVE,"Impact Score (1-10, 10 being the worst)",Keyword,Description,Last Modified,Link
CVE-2020-15862,5.9,Management,Net-SNMP through 5.7.3 has Improper Privilege Management because SNMP WRITE access to the EXTEND MIB provides the ability to run arbitrary commands as root.,2023-10-31T19:30:58.390,https://cve.circl.lu/cve/CVE-2020-15862
CVE-2022-29450,5.9,Management,Multiple Cross-Site Request Forgery (CSRF) vulnerabilities in Admin Management Xtended plugin <= 2.4.4 at WordPress.,2023-10-30T12:15:08.617,https://cve.circl.lu/cve/CVE-2022-29450
CVE-2023-0052,5.9,Management,"SAUTER Controls Nova 200–220 Series with firmware version 3.3-006 and prior and BACnetstac version 4.2.1 and prior allows the execution of commands without credentials. As Telnet and file transfer protocol (FTP) are the only protocols available for device management, an unauthorized user could access the system and modify the device configuration, which could result in the unauthorized user executing unrestricted malicious commands.",2023-10-30T17:01:10.477,https://cve.circl.lu/cve/CVE-2023-0052
CVE-2023-0053,3.6,Management,"SAUTER Controls Nova 200–220 Series with firmware version 3.3-006 and prior and BACnetstac version 4.2.1 and prior have only FTP and Telnet available for device management. Any sensitive information communicated through these protocols, such as credentials, is sent in cleartext. An attacker could obtain sensitive information such as user credentials to gain access to the system. ",2023-10-27T20:32:10.447,https://cve.circl.lu/cve/CVE-2023-0053
CVE-2023-3165,2.7,Management,A vulnerability was found in SourceCodester Life Insurance Management System 1.0. It has been declared as problematic. Affected by this vulnerability is an unknown functionality of the file insertNominee.php of the component POST Parameter Handler. The manipulation of the argument nominee_id leads to cross site scripting. The attack can be launched remotely. The exploit has been disclosed to the public and may be used. The identifier VDB-231109 was assigned to this vulnerability.,2023-11-01T16:58:02.590,https://cve.circl.lu/cve/CVE-2023-3165
CVE-2023-5875,1.4,Mattermost,Mattermost Desktop fails to correctly handle permissions or prompt the user for consent on certain sensitive ones allowing media exploitation from a malicious mattermost server,2023-11-02T12:54:30.570,https://cve.circl.lu/cve/CVE-2023-5875
CVE-2023-5876,1.4,Mattermost,"Mattermost fails to properly validate a RegExp built off the server URL path, allowing an attacker in control of an enrolled server to mount a Denial Of Service.",2023-11-02T12:54:30.570,https://cve.circl.lu/cve/CVE-2023-5876
CVE-2023-5920,1.4,Mattermost,"Mattermost Desktop for MacOS fails to utilize the secure keyboard input functionality provided by macOS, allowing for other processes to read the keyboard input.",2023-11-02T12:54:30.570,https://cve.circl.lu/cve/CVE-2023-5920
CVE-2023-36417,5.9,Microsoft,Microsoft SQL OLE DB Remote Code Execution Vulnerability,2023-11-02T02:08:56.640,https://cve.circl.lu/cve/CVE-2023-36417
CVE-2020-2217,2.7,MongoDB,"Jenkins Compatibility Action Storage Plugin 1.0 and earlier does not escape the content coming from the MongoDB in the testConnection form validation endpoint, resulting in a reflected cross-site scripting (XSS) vulnerability.",2023-11-02T21:41:34.180,https://cve.circl.lu/cve/CVE-2020-2217
CVE-2023-21920,3.6,MySQL,Vulnerability in the MySQL Server product of Oracle MySQL (component: Server: Optimizer).  Supported versions that are affected are 8.0.32 and prior. Easily exploitable vulnerability allows high privileged attacker with network access via multiple protocols to compromise MySQL Server.  Successful attacks of this vulnerability can result in unauthorized ability to cause a hang or frequently repeatable crash (complete DOS) of MySQL Server. CVSS 3.1 Base Score 4.9 (Availability impacts).  CVSS Vector: (CVSS:3.1/AV:N/AC:L/PR:H/UI:N/S:U/C:N/I:N/A:H).,2023-10-29T02:35:08.027,https://cve.circl.lu/cve/CVE-2023-21920
CVE-2023-21929,4.2,MySQL,"Vulnerability in the MySQL Server product of Oracle MySQL (component: Server: DDL).  Supported versions that are affected are 8.0.32 and prior. Easily exploitable vulnerability allows high privileged attacker with network access via multiple protocols to compromise MySQL Server.  Successful attacks of this vulnerability can result in unauthorized ability to cause a hang or frequently repeatable crash (complete DOS) of MySQL Server as well as  unauthorized update, insert or delete access to some of MySQL Server accessible data. CVSS 3.1 Base Score 5.5 (Integrity and Availability impacts).  CVSS Vector: (CVSS:3.1/AV:N/AC:L/PR:H/UI:N/S:U/C:N/I:L/A:H).",2023-10-30T19:56:53.337,https://cve.circl.lu/cve/CVE-2023-21929
CVE-2023-21933,3.6,MySQL,Vulnerability in the MySQL Server product of Oracle MySQL (component: Server: DDL).  Supported versions that are affected are 8.0.32 and prior. Easily exploitable vulnerability allows high privileged attacker with network access via multiple protocols to compromise MySQL Server.  Successful attacks of this vulnerability can result in unauthorized ability to cause a hang or frequently repeatable crash (complete DOS) of MySQL Server. CVSS 3.1 Base Score 4.9 (Availability impacts).  CVSS Vector: (CVSS:3.1/AV:N/AC:L/PR:H/UI:N/S:U/C:N/I:N/A:H).,2023-10-30T19:56:40.960,https://cve.circl.lu/cve/CVE-2023-21933
CVE-2023-21935,3.6,MySQL,Vulnerability in the MySQL Server product of Oracle MySQL (component: Server: Optimizer).  Supported versions that are affected are 8.0.32 and prior. Easily exploitable vulnerability allows high privileged attacker with network access via multiple protocols to compromise MySQL Server.  Successful attacks of this vulnerability can result in unauthorized ability to cause a hang or frequently repeatable crash (complete DOS) of MySQL Server. CVSS 3.1 Base Score 4.9 (Availability impacts).  CVSS Vector: (CVSS:3.1/AV:N/AC:L/PR:H/UI:N/S:U/C:N/I:N/A:H).,2023-10-30T19:56:26.043,https://cve.circl.lu/cve/CVE-2023-21935
CVE-2023-21940,3.6,MySQL,Vulnerability in the MySQL Server product of Oracle MySQL (component: Server: Components Services).  Supported versions that are affected are 8.0.32 and prior. Difficult to exploit vulnerability allows high privileged attacker with network access via multiple protocols to compromise MySQL Server.  Successful attacks of this vulnerability can result in unauthorized ability to cause a hang or frequently repeatable crash (complete DOS) of MySQL Server. CVSS 3.1 Base Score 4.4 (Availability impacts).  CVSS Vector: (CVSS:3.1/AV:N/AC:H/PR:H/UI:N/S:U/C:N/I:N/A:H).,2023-10-30T19:56:15.737,https://cve.circl.lu/cve/CVE-2023-21940
CVE-2023-36671,5.2,MacOS,"An issue was discovered in the Clario VPN client through 5.9.1.1662 for macOS. The VPN client insecurely configures the operating system such that all IP traffic to the VPN server's IP address is sent in plaintext outside the VPN tunnel even if this traffic is not generated by the VPN client. This allows an adversary to trick the victim into sending plaintext traffic to the VPN server's IP address and thereby deanonymize the victim. NOTE: the tunnelcrack.mathyvanhoef.com website uses this CVE ID to refer more generally to ""ServerIP attack for only traffic to the real IP address of the VPN server"" rather than to only Clario.",2023-10-31T09:15:08.210,https://cve.circl.lu/cve/CVE-2023-36671
CVE-2023-36672,3.6,MacOS,"An issue was discovered in the Clario VPN client through 5.9.1.1662 for macOS. The VPN client insecurely configures the operating system such that traffic to the local network is sent in plaintext outside the VPN tunnel even if the local network is using a non-RFC1918 IP subnet. This allows an adversary to trick the victim into sending arbitrary IP traffic in plaintext outside the VPN tunnel. NOTE: the tunnelcrack.mathyvanhoef.com website uses this CVE ID to refer more generally to ""LocalNet attack resulting in leakage of traffic in plaintext"" rather than to only Clario.",2023-10-31T09:15:08.277,https://cve.circl.lu/cve/CVE-2023-36672
CVE-2023-36673,5.2,MacOS,"An issue was discovered in Avira Phantom VPN through 2.23.1 for macOS. The VPN client insecurely configures the operating system such that all IP traffic to the VPN server's IP address is sent in plaintext outside the VPN tunnel, even if this traffic is not generated by the VPN client, while simultaneously using plaintext DNS to look up the VPN server's IP address. This allows an adversary to trick the victim into sending traffic to arbitrary IP addresses in plaintext outside the VPN tunnel. NOTE: the tunnelcrack.mathyvanhoef.com website uses this CVE ID to refer more generally to ""ServerIP attack, combined with DNS spoofing, that can leak traffic to an arbitrary IP address"" rather than to only Avira Phantom VPN.",2023-10-31T09:15:08.337,https://cve.circl.lu/cve/CVE-2023-36673
CVE-2023-38605,1.4,MacOS,This issue was addressed with improved redaction of sensitive information. This issue is fixed in macOS Ventura 13.5. An app may be able to determine a user’s current location.,2023-11-01T00:15:08.950,https://cve.circl.lu/cve/CVE-2023-38605
CVE-2023-40392,1.4,MacOS,A privacy issue was addressed with improved private data redaction for log entries. This issue is fixed in macOS Ventura 13.5. An app may be able to read sensitive location information.,2023-11-01T00:15:09.037,https://cve.circl.lu/cve/CVE-2023-40392
CVE-2023-46127,2.7,MariaDB,Frappe is a full-stack web application framework that uses Python and MariaDB on the server side and an integrated client side library. A malicious Frappe user with desk access could create documents containing HTML payloads allowing HTML Injection. This vulnerability has been patched in version 14.49.0.,2023-10-31T12:17:17.793,https://cve.circl.lu/cve/CVE-2023-46127
CVE-2023-1638,3.6,Malware,A vulnerability was found in IObit Malware Fighter 9.4.0.776. It has been rated as problematic. Affected by this issue is the function 0x8001E024/0x8001E040 in the library ImfRegistryFilter.sys of the component IOCTL Handler. The manipulation leads to denial of service. Attacking locally is a requirement. The exploit has been disclosed to the public and may be used. VDB-224018 is the identifier assigned to this vulnerability.,2023-10-30T19:26:23.940,https://cve.circl.lu/cve/CVE-2023-1638
CVE-2023-1639,3.6,Malware,A vulnerability classified as problematic has been found in IObit Malware Fighter 9.4.0.776. This affects the function 0x8001E04C in the library ImfRegistryFilter.sys of the component IOCTL Handler. The manipulation leads to denial of service. It is possible to launch the attack on the local host. The exploit has been disclosed to the public and may be used. The associated identifier of this vulnerability is VDB-224019.,2023-10-30T19:26:18.397,https://cve.circl.lu/cve/CVE-2023-1639
CVE-2023-1640,3.6,Malware,A vulnerability classified as problematic was found in IObit Malware Fighter 9.4.0.776. This vulnerability affects the function 0x222010 in the library ObCallbackProcess.sys of the component IOCTL Handler. The manipulation leads to denial of service. The attack needs to be approached locally. The exploit has been disclosed to the public and may be used. The identifier of this vulnerability is VDB-224020.,2023-10-30T19:26:10.607,https://cve.circl.lu/cve/CVE-2023-1640
CVE-2023-1641,3.6,Malware,"A vulnerability, which was classified as problematic, has been found in IObit Malware Fighter 9.4.0.776. This issue affects the function 0x222018 in the library ObCallbackProcess.sys of the component IOCTL Handler. The manipulation leads to denial of service. An attack has to be approached locally. The exploit has been disclosed to the public and may be used. The identifier VDB-224021 was assigned to this vulnerability.",2023-10-30T19:26:05.373,https://cve.circl.lu/cve/CVE-2023-1641
CVE-2023-1642,3.6,Malware,"A vulnerability, which was classified as problematic, was found in IObit Malware Fighter 9.4.0.776. Affected is the function 0x222034/0x222038/0x22203C/0x222040 in the library ObCallbackProcess.sys of the component IOCTL Handler. The manipulation leads to denial of service. Local access is required to approach this attack. The exploit has been disclosed to the public and may be used. VDB-224022 is the identifier assigned to this vulnerability.",2023-10-30T18:24:11.717,https://cve.circl.lu/cve/CVE-2023-1642
CVE-2023-39231,3.6,MFA,PingFederate using the PingOne MFA adapter allows a new MFA device to be paired without requiring second factor authentication from an existing registered device. A threat actor may be able to exploit this vulnerability to register their own MFA device if they have knowledge of a victim user's first factor credentials.,2023-10-31T18:47:42.620,https://cve.circl.lu/cve/CVE-2023-39231
CVE-2021-4311,5.9,MDM,A vulnerability classified as problematic was found in Talend Open Studio for MDM. This vulnerability affects unknown code of the component XML Handler. The manipulation leads to xml external entity reference. The patch is identified as 31d442b9fb1d518128fd18f6e4d54e06c3d67793. It is recommended to apply a patch to fix this issue. VDB-217666 is the identifier assigned to this vulnerability.,2023-10-30T19:59:20.767,https://cve.circl.lu/cve/CVE-2021-4311
CVE-2023-31016,5.9,NVIDIA,"NVIDIA GPU Display Driver for Windows contains a vulnerability where an uncontrolled search path element may allow an attacker to execute arbitrary code, which may lead to code execution, denial of service, escalation of privileges, information disclosure, or data tampering.",2023-11-02T19:15:40.947,https://cve.circl.lu/cve/CVE-2023-31016
CVE-2023-31017,5.9,NVIDIA,"NVIDIA GPU Display Driver for Windows contains a vulnerability where an attacker may be able to write arbitrary data to privileged locations by using reparse points. A successful exploit of this vulnerability may lead to code execution, denial of service, escalation of privileges, information disclosure, or data tampering.",2023-11-02T19:15:41.033,https://cve.circl.lu/cve/CVE-2023-31017
CVE-2023-31018,4.0,NVIDIA,"NVIDIA GPU Driver for Windows and Linux contains a vulnerability in the kernel mode layer, where an unprivileged regular user can cause a NULL-pointer dereference, which may lead to denial of service.",2023-11-02T19:15:41.103,https://cve.circl.lu/cve/CVE-2023-31018
CVE-2023-31019,5.9,NVIDIA,"NVIDIA GPU Display Driver for Windows contains a vulnerability in wksServicePlugin.dll, where the driver implementation does not restrict or incorrectly restricts access from the named pipe server to a connecting client, which may lead to potential impersonation to the client's secure context.",2023-11-02T19:15:41.180,https://cve.circl.lu/cve/CVE-2023-31019
CVE-2023-31020,4.2,NVIDIA,"NVIDIA GPU Display Driver for Windows contains a vulnerability in the kernel mode layer, where an unprivileged regular user can cause improper access control, which may lead to denial of service or data tampering.",2023-11-02T19:15:41.247,https://cve.circl.lu/cve/CVE-2023-31020
CVE-2023-5043,5.9,Nginx,Ingress nginx annotation injection causes arbitrary command execution.,2023-11-02T17:54:38.423,https://cve.circl.lu/cve/CVE-2023-5043
CVE-2023-5044,5.9,Nginx,Code injection via nginx.ingress.kubernetes.io/permanent-redirect annotation.,2023-11-02T17:45:26.790,https://cve.circl.lu/cve/CVE-2023-5044
CVE-2023-46119,3.6,Node.js,Parse Server is an open source backend that can be deployed to any infrastructure that can run Node.js. Parse Server crashes when uploading a file without extension. This vulnerability has been patched in versions 5.5.6 and 6.3.1.,2023-11-01T17:09:01.520,https://cve.circl.lu/cve/CVE-2023-46119
CVE-2023-39619,3.6,NPM,ReDos in NPMJS Node Email Check v.1.0.4 allows an attacker to cause a denial of service via a crafted string to the scpSyntax component.,2023-10-31T19:18:44.510,https://cve.circl.lu/cve/CVE-2023-39619
CVE-2015-8816,5.9,NULL Pointer,"The hub_activate function in drivers/usb/core/hub.c in the Linux kernel before 4.3.5 does not properly maintain a hub-interface data structure, which allows physically proximate attackers to cause a denial of service (invalid memory access and system crash) or possibly have unspecified other impact by unplugging a USB hub device.",2023-11-01T14:51:48.467,https://cve.circl.lu/cve/CVE-2015-8816
CVE-2019-9199,5.9,NULL Pointer,PoDoFo::Impose::PdfTranslator::setSource() in pdftranslator.cpp in PoDoFo 0.9.6 has a NULL pointer dereference that can (for example) be triggered by sending a crafted PDF file to the podofoimpose binary. It allows an attacker to cause Denial of Service (Segmentation fault) or possibly have unspecified other impact.,2023-10-27T21:15:08.017,https://cve.circl.lu/cve/CVE-2019-9199
CVE-2023-3772,3.6,NULL Pointer,"A flaw was found in the Linux kernel’s IP framework for transforming packets (XFRM subsystem). This issue may allow a malicious user with CAP_NET_ADMIN privileges to directly dereference a NULL pointer in xfrm_update_ae_params(), leading to a possible kernel crash and denial of service.",2023-10-29T02:43:04.247,https://cve.circl.lu/cve/CVE-2023-3772
CVE-2023-43898,3.6,NULL Pointer,Nothings stb 2.28 was discovered to contain a Null Pointer Dereference via the function stbi__convert_format. This vulnerability allows attackers to cause a Denial of Service (DoS) via a crafted pic file.,2023-10-27T21:15:09.450,https://cve.circl.lu/cve/CVE-2023-43898
CVE-2023-45664,5.9,NULL Pointer,"stb_image is a single file MIT licensed library for processing images. A crafted image file can trigger `stbi__load_gif_main_outofmem` attempt to double-free the out variable. This happens in `stbi__load_gif_main` because when the `layers * stride` value is zero the behavior is implementation defined, but common that realloc frees the old memory and returns null pointer. Since it attempts to double-free the memory a few lines below the first “free”, the issue can be potentially exploited only in a multi-threaded environment. In the worst case this may lead to code execution.",2023-10-27T21:47:45.230,https://cve.circl.lu/cve/CVE-2023-45664
CVE-2023-2650,3.6,OpenSSL,"Issue summary: Processing some specially crafted ASN.1 object identifiers ordata containing them may be very slow.Impact summary: Applications that use OBJ_obj2txt() directly, or use any ofthe OpenSSL subsystems OCSP, PKCS7/SMIME, CMS, CMP/CRMF or TS with no messagesize limit may experience notable to very long delays when processing thosemessages, which may lead to a Denial of Service.An OBJECT IDENTIFIER is composed of a series of numbers - sub-identifiers -most of which have no size limit.  OBJ_obj2txt() may be used to translatean ASN.1 OBJECT IDENTIFIER given in DER encoding form (using the OpenSSLtype ASN1_OBJECT) to its canonical numeric text form, which are thesub-identifiers of the OBJECT IDENTIFIER in decimal form, separated byperiods.When one of the sub-identifiers in the OBJECT IDENTIFIER is very large(these are sizes that are seen as absurdly large, taking up tens or hundredsof KiBs), the translation to a decimal number in text may take a very longtime.  The time complexity is O(n^2) with 'n' being the size of thesub-identifiers in bytes (*).With OpenSSL 3.0, support to fetch cryptographic algorithms using names /identifiers in string form was introduced.  This includes using OBJECTIDENTIFIERs in canonical numeric text form as identifiers for fetchingalgorithms.Such OBJECT IDENTIFIERs may be received through the ASN.1 structureAlgorithmIdentifier, which is commonly used in multiple protocols to specifywhat cryptographic algorithm should be used to sign or verify, encrypt ordecrypt, or digest passed data.Applications that call OBJ_obj2txt() directly with untrusted data areaffected, with any version of OpenSSL.  If the use is for the mere purposeof display, the severity is considered low.In OpenSSL 3.0 and newer, this affects the subsystems OCSP, PKCS7/SMIME,CMS, CMP/CRMF or TS.  It also impacts anything that processes X.509certificates, including simple things like verifying its signature.The impact on TLS is relatively low, because all versions of OpenSSL have a100KiB limit on the peer's certificate chain.  Additionally, this onlyimpacts clients, or servers that have explicitly enabled clientauthentication.In OpenSSL 1.1.1 and 1.0.2, this only affects displaying diverse objects,such as X.509 certificates.  This is assumed to not happen in such a waythat it would cause a Denial of Service, so these versions are considerednot affected by this issue in such a way that it would be cause for concern,and the severity is therefore considered low.",2023-10-27T15:15:13.057,https://cve.circl.lu/cve/CVE-2023-2650
CVE-2023-3817,1.4,OpenSSL,"Issue summary: Checking excessively long DH keys or parameters may be very slow.Impact summary: Applications that use the functions DH_check(), DH_check_ex()or EVP_PKEY_param_check() to check a DH key or DH parameters may experience longdelays. Where the key or parameters that are being checked have been obtainedfrom an untrusted source this may lead to a Denial of Service.The function DH_check() performs various checks on DH parameters. After fixingCVE-2023-3446 it was discovered that a large q parameter value can also triggeran overly long computation during some of these checks. A correct q value,if present, cannot be larger than the modulus p parameter, thus it isunnecessary to perform these checks if q is larger than p.An application that calls DH_check() and supplies a key or parameters obtainedfrom an untrusted source could be vulnerable to a Denial of Service attack.The function DH_check() is itself called by a number of other OpenSSL functions.An application calling any of those other functions may similarly be affected.The other functions affected by this are DH_check_ex() andEVP_PKEY_param_check().Also vulnerable are the OpenSSL dhparam and pkeyparam command line applicationswhen using the ""-check"" option.The OpenSSL SSL/TLS implementation is not affected by this issue.The OpenSSL 3.0 and 3.1 FIPS providers are not affected by this issue.",2023-10-27T15:15:13.733,https://cve.circl.lu/cve/CVE-2023-3817
CVE-2023-5363,NA,OpenSSL,"Issue summary: A bug has been identified in the processing of key andinitialisation vector (IV) lengths.  This can lead to potential truncationor overruns during the initialisation of some symmetric ciphers.Impact summary: A truncation in the IV can result in non-uniqueness,which could result in loss of confidentiality for some cipher modes.When calling EVP_EncryptInit_ex2(), EVP_DecryptInit_ex2() orEVP_CipherInit_ex2() the provided OSSL_PARAM array is processed afterthe key and IV have been established.  Any alterations to the key length,via the ""keylen"" parameter or the IV length, via the ""ivlen"" parameter,within the OSSL_PARAM array will not take effect as intended, potentiallycausing truncation or overreading of these values.  The following ciphersand cipher modes are impacted: RC2, RC4, RC5, CCM, GCM and OCB.For the CCM, GCM and OCB cipher modes, truncation of the IV can result inloss of confidentiality.  For example, when following NIST's SP 800-38Dsection 8.2.1 guidance for constructing a deterministic IV for AES inGCM mode, truncation of the counter portion could lead to IV reuse.Both truncations and overruns of the key and overruns of the IV willproduce incorrect results and could, in some cases, trigger a memoryexception.  However, these issues are not currently assessed as securitycritical.Changing the key and/or IV lengths is not considered to be a common operationand the vulnerable API was recently introduced. Furthermore it is likely thatapplication developers will have spotted this problem during testing sincedecryption would fail unless both peers in the communication were similarlyvulnerable. For these reasons we expect the probability of an application beingvulnerable to this to be quite low. However if an application is vulnerable thenthis issue is considered very serious. For these reasons we have assessed thisissue as Moderate severity overall.The OpenSSL SSL/TLS implementation is not affected by this issue.The OpenSSL 3.0 and 3.1 FIPS providers are not affected by this becausethe issue lies outside of the FIPS provider boundary.OpenSSL 3.1 and 3.0 are vulnerable to this issue.",2023-10-27T15:15:15.577,https://cve.circl.lu/cve/CVE-2023-5363
CVE-2023-21920,3.6,Oracle,Vulnerability in the MySQL Server product of Oracle MySQL (component: Server: Optimizer).  Supported versions that are affected are 8.0.32 and prior. Easily exploitable vulnerability allows high privileged attacker with network access via multiple protocols to compromise MySQL Server.  Successful attacks of this vulnerability can result in unauthorized ability to cause a hang or frequently repeatable crash (complete DOS) of MySQL Server. CVSS 3.1 Base Score 4.9 (Availability impacts).  CVSS Vector: (CVSS:3.1/AV:N/AC:L/PR:H/UI:N/S:U/C:N/I:N/A:H).,2023-10-29T02:35:08.027,https://cve.circl.lu/cve/CVE-2023-21920
CVE-2023-21929,4.2,Oracle,"Vulnerability in the MySQL Server product of Oracle MySQL (component: Server: DDL).  Supported versions that are affected are 8.0.32 and prior. Easily exploitable vulnerability allows high privileged attacker with network access via multiple protocols to compromise MySQL Server.  Successful attacks of this vulnerability can result in unauthorized ability to cause a hang or frequently repeatable crash (complete DOS) of MySQL Server as well as  unauthorized update, insert or delete access to some of MySQL Server accessible data. CVSS 3.1 Base Score 5.5 (Integrity and Availability impacts).  CVSS Vector: (CVSS:3.1/AV:N/AC:L/PR:H/UI:N/S:U/C:N/I:L/A:H).",2023-10-30T19:56:53.337,https://cve.circl.lu/cve/CVE-2023-21929
