CVE,"Impact Score (1-10, 10 being the worst)",Keyword,Description,Last Modified,Link
CVE-2024-29733,NA,Airflow,"Improper Certificate Validation vulnerability in Apache Airflow FTP Provider.The FTP hook lacks complete certificate validation in FTP_TLS connections, which can potentially be leveraged. Implementing proper certificate validation by passing context=ssl.create_default_context() during FTP_TLS instantiation is used as mitigation to validate the certificates properly.This issue affects Apache Airflow FTP Provider: before 3.7.0.Users are recommended to upgrade to version 3.7.0, which fixes the issue.",2024-04-22T13:28:43.747,https://cve.circl.lu/cve/CVE-2024-29733
CVE-2007-6420,2.9,Apache,Cross-site request forgery (CSRF) vulnerability in the balancer-manager in mod_proxy_balancer for Apache HTTP Server 2.2.x allows remote attackers to gain privileges via unspecified vectors.,2024-04-26T16:08:29.987,https://cve.circl.lu/cve/CVE-2007-6420
CVE-2023-48795,3.6,Apache,"The SSH transport protocol with certain OpenSSH extensions, found in OpenSSH before 9.6 and other products, allows remote attackers to bypass integrity checks such that some packets are omitted (from the extension negotiation message), and a client and server may consequently end up with a connection for which some security features have been downgraded or disabled, aka a Terrapin attack. This occurs because the SSH Binary Packet Protocol (BPP), implemented by these extensions, mishandles the handshake phase and mishandles use of sequence numbers. For example, there is an effective attack against SSH's use of ChaCha20-Poly1305 (and CBC with Encrypt-then-MAC). The bypass occurs in chacha20-poly1305@openssh.com and (if CBC is used) the -etm@openssh.com MAC algorithms. This also affects Maverick Synergy Java SSH API before 3.1.0-SNAPSHOT, Dropbear through 2022.83, Ssh before 5.1.1 in Erlang/OTP, PuTTY before 0.80, AsyncSSH before 2.14.2, golang.org/x/crypto before 0.17.0, libssh before 0.10.6, libssh2 through 1.11.0, Thorn Tech SFTP Gateway before 3.4.6, Tera Term before 5.1, Paramiko before 3.4.0, jsch before 0.2.15, SFTPGo before 2.5.6, Netgate pfSense Plus through 23.09.1, Netgate pfSense CE through 2.7.2, HPN-SSH through 18.2.0, ProFTPD before 1.3.8b (and before 1.3.9rc2), ORYX CycloneSSH before 2.3.4, NetSarang XShell 7 before Build 0144, CrushFTP before 10.6.0, ConnectBot SSH library before 2.2.22, Apache MINA sshd through 2.11.0, sshj through 0.37.0, TinySSH through 20230101, trilead-ssh2 6401, LANCOM LCOS and LANconfig, FileZilla before 3.66.4, Nova before 11.8, PKIX-SSH before 14.4, SecureCRT before 9.4.3, Transmit5 before 5.10.4, Win32-OpenSSH before 9.5.0.0p1-Beta, WinSCP before 6.2.2, Bitvise SSH Server before 9.32, Bitvise SSH Client before 9.33, KiTTY through 0.76.1.13, the net-ssh gem 7.2.0 for Ruby, the mscdex ssh2 module before 1.15.0 for Node.js, the thrussh library before 0.35.1 for Rust, and the Russh crate before 0.40.2 for Rust.",2024-04-25T22:15:08.130,https://cve.circl.lu/cve/CVE-2023-48795
CVE-2024-29217,NA,Apache,"Improper Neutralization of Input During Web Page Generation ('Cross-site Scripting') vulnerability in Apache Answer.This issue affects Apache Answer: before 1.3.0.XSS attack when user changes personal website. A logged-in user, when modifying their personal website, can input malicious code in the website to create such an attack.Users are recommended to upgrade to version [1.3.0], which fixes the issue.",2024-04-22T13:28:43.747,https://cve.circl.lu/cve/CVE-2024-29217
CVE-2024-29733,NA,Apache,"Improper Certificate Validation vulnerability in Apache Airflow FTP Provider.The FTP hook lacks complete certificate validation in FTP_TLS connections, which can potentially be leveraged. Implementing proper certificate validation by passing context=ssl.create_default_context() during FTP_TLS instantiation is used as mitigation to validate the certificates properly.This issue affects Apache Airflow FTP Provider: before 3.7.0.Users are recommended to upgrade to version 3.7.0, which fixes the issue.",2024-04-22T13:28:43.747,https://cve.circl.lu/cve/CVE-2024-29733
CVE-2024-27347,NA,Apache,"Server-Side Request Forgery (SSRF) vulnerability in Apache HugeGraph-Hubble.This issue affects Apache HugeGraph-Hubble: from 1.0.0 before 1.3.0.Users are recommended to upgrade to version 1.3.0, which fixes the issue.",2024-04-22T19:24:12.920,https://cve.circl.lu/cve/CVE-2024-27347
CVE-2023-41993,5.9,Apple,The issue was addressed with improved checks. This issue is fixed in macOS Sonoma 14. Processing web content may lead to arbitrary code execution. Apple is aware of a report that this issue may have been actively exploited against versions of iOS before iOS 16.7.,2024-04-26T09:15:07.533,https://cve.circl.lu/cve/CVE-2023-41993
CVE-2024-21002,1.4,Apple,"Vulnerability in the Oracle Java SE, Oracle GraalVM Enterprise Edition product of Oracle Java SE (component: JavaFX).  Supported versions that are affected are Oracle Java SE: 8u401; Oracle GraalVM Enterprise Edition: 20.3.13 and  21.3.9. Difficult to exploit vulnerability allows unauthenticated attacker with logon to the infrastructure where Oracle Java SE, Oracle GraalVM Enterprise Edition executes to compromise Oracle Java SE, Oracle GraalVM Enterprise Edition.  Successful attacks require human interaction from a person other than the attacker. Successful attacks of this vulnerability can result in  unauthorized update, insert or delete access to some of Oracle Java SE, Oracle GraalVM Enterprise Edition accessible data. Note: This vulnerability applies to Java deployments, typically in clients running sandboxed Java Web Start applications or sandboxed Java applets, that load and run untrusted code (e.g., code that comes from the internet) and rely on the Java sandbox for security. This vulnerability does not apply to Java deployments, typically in servers, that load and run only trusted code (e.g., code installed by an administrator). CVSS 3.1 Base Score 2.5 (Integrity impacts).  CVSS Vector: (CVSS:3.1/AV:L/AC:H/PR:N/UI:R/S:U/C:N/I:L/A:N).",2024-04-26T09:15:09.700,https://cve.circl.lu/cve/CVE-2024-21002
CVE-2024-21003,1.4,Apple,"Vulnerability in the Oracle Java SE, Oracle GraalVM Enterprise Edition product of Oracle Java SE (component: JavaFX).  Supported versions that are affected are Oracle Java SE: 8u401; Oracle GraalVM Enterprise Edition: 20.3.13 and  21.3.9. Difficult to exploit vulnerability allows unauthenticated attacker with network access via multiple protocols to compromise Oracle Java SE, Oracle GraalVM Enterprise Edition.  Successful attacks require human interaction from a person other than the attacker. Successful attacks of this vulnerability can result in  unauthorized update, insert or delete access to some of Oracle Java SE, Oracle GraalVM Enterprise Edition accessible data. Note: This vulnerability applies to Java deployments, typically in clients running sandboxed Java Web Start applications or sandboxed Java applets, that load and run untrusted code (e.g., code that comes from the internet) and rely on the Java sandbox for security. This vulnerability does not apply to Java deployments, typically in servers, that load and run only trusted code (e.g., code installed by an administrator). CVSS 3.1 Base Score 3.1 (Integrity impacts).  CVSS Vector: (CVSS:3.1/AV:N/AC:H/PR:N/UI:R/S:U/C:N/I:L/A:N).",2024-04-26T09:15:09.823,https://cve.circl.lu/cve/CVE-2024-21003
CVE-2024-21004,1.4,Apple,"Vulnerability in the Oracle Java SE, Oracle GraalVM Enterprise Edition product of Oracle Java SE (component: JavaFX).  Supported versions that are affected are Oracle Java SE: 8u401; Oracle GraalVM Enterprise Edition: 20.3.13 and  21.3.9. Difficult to exploit vulnerability allows unauthenticated attacker with logon to the infrastructure where Oracle Java SE, Oracle GraalVM Enterprise Edition executes to compromise Oracle Java SE, Oracle GraalVM Enterprise Edition.  Successful attacks require human interaction from a person other than the attacker. Successful attacks of this vulnerability can result in  unauthorized update, insert or delete access to some of Oracle Java SE, Oracle GraalVM Enterprise Edition accessible data. Note: This vulnerability applies to Java deployments, typically in clients running sandboxed Java Web Start applications or sandboxed Java applets, that load and run untrusted code (e.g., code that comes from the internet) and rely on the Java sandbox for security. This vulnerability does not apply to Java deployments, typically in servers, that load and run only trusted code (e.g., code installed by an administrator). CVSS 3.1 Base Score 2.5 (Integrity impacts).  CVSS Vector: (CVSS:3.1/AV:L/AC:H/PR:N/UI:R/S:U/C:N/I:L/A:N).",2024-04-26T09:15:09.933,https://cve.circl.lu/cve/CVE-2024-21004
CVE-2024-21005,1.4,Apple,"Vulnerability in the Oracle Java SE, Oracle GraalVM Enterprise Edition product of Oracle Java SE (component: JavaFX).  Supported versions that are affected are Oracle Java SE: 8u401; Oracle GraalVM Enterprise Edition: 20.3.13 and  21.3.9. Difficult to exploit vulnerability allows unauthenticated attacker with network access via multiple protocols to compromise Oracle Java SE, Oracle GraalVM Enterprise Edition.  Successful attacks require human interaction from a person other than the attacker. Successful attacks of this vulnerability can result in  unauthorized update, insert or delete access to some of Oracle Java SE, Oracle GraalVM Enterprise Edition accessible data. Note: This vulnerability applies to Java deployments, typically in clients running sandboxed Java Web Start applications or sandboxed Java applets, that load and run untrusted code (e.g., code that comes from the internet) and rely on the Java sandbox for security. This vulnerability does not apply to Java deployments, typically in servers, that load and run only trusted code (e.g., code installed by an administrator). CVSS 3.1 Base Score 3.1 (Integrity impacts).  CVSS Vector: (CVSS:3.1/AV:N/AC:H/PR:N/UI:R/S:U/C:N/I:L/A:N).",2024-04-26T09:15:10.030,https://cve.circl.lu/cve/CVE-2024-21005
CVE-2012-0507,10.0,Atom,"Unspecified vulnerability in the Java Runtime Environment (JRE) component in Oracle Java SE 7 Update 2 and earlier, 6 Update 30 and earlier, and 5.0 Update 33 and earlier allows remote attackers to affect confidentiality, integrity, and availability via unknown vectors related to Concurrency.  NOTE: the previous information was obtained from the February 2012 Oracle CPU. Oracle has not commented on claims from a downstream vendor and third party researchers that this issue occurs because the AtomicReferenceArray class implementation does not ensure that the array is of the Object[] type, which allows attackers to cause a denial of service (JVM crash) or bypass Java sandbox restrictions.  NOTE: this issue was originally mapped to CVE-2011-3571, but that identifier was already assigned to a different issue.",2024-04-26T16:07:55.723,https://cve.circl.lu/cve/CVE-2012-0507
CVE-2023-5189,3.6,Ansible,"A path traversal vulnerability exists in Ansible when extracting tarballs. An attacker could craft a malicious tarball so that when using the galaxy importer of Ansible Automation Hub, a symlink could be dropped on the disk, resulting in files being overwritten.",2024-04-25T15:16:02.810,https://cve.circl.lu/cve/CVE-2023-5189
CVE-2023-5764,5.9,Ansible,A template injection flaw was found in Ansible where a user's controller internal templating operations may remove the unsafe designation from template data. This issue could allow an attacker to use a specially crafted file to introduce templating injection when supplying templating data.,2024-04-25T16:15:08.903,https://cve.circl.lu/cve/CVE-2023-5764
CVE-2024-1657,5.2,Ansible,"A flaw was found in the ansible automation platform. An insecure WebSocket connection was being used in installation from the Ansible rulebook EDA server. An attacker that has access to any machine in the CIDR block could download all rulebook data from the WebSocket, resulting in loss of confidentiality and integrity of the system.",2024-04-25T17:24:59.967,https://cve.circl.lu/cve/CVE-2024-1657
CVE-2024-1756,NA,CSRF,"The WooCommerce Customers Manager WordPress plugin before 29.8 does not have authorisation and CSRF in an AJAX action, allowing any authenticated users, such as subscriber, to call it and retrieve the list of customer email addresses along with their id, first name and last name",2024-04-24T13:39:42.883,https://cve.circl.lu/cve/CVE-2024-1756
CVE-2024-2429,NA,CSRF,"The Salon booking system WordPress plugin through 9.6.5 does not have CSRF check in place when updating its settings, which could allow attackers to make a logged in admin change them via a CSRF attack",2024-04-26T12:58:17.720,https://cve.circl.lu/cve/CVE-2024-2429
CVE-2024-3058,NA,CSRF,"The ENL Newsletter WordPress plugin through 1.0.1 does not have CSRF check in some places, and is missing sanitisation as well as escaping, which could allow attackers to make logged in admin add Stored XSS payloads via a CSRF attack",2024-04-26T12:58:17.720,https://cve.circl.lu/cve/CVE-2024-3058
CVE-2024-3059,NA,CSRF,"The ENL Newsletter WordPress plugin through 1.0.1 does not have CSRF checks in some places, which could allow attackers to make logged in admins delete arbitrary Campaigns via a CSRF attack",2024-04-26T12:58:17.720,https://cve.circl.lu/cve/CVE-2024-3059
CVE-2024-3076,NA,CSRF,"The MM-email2image WordPress plugin through 0.2.5 does not have CSRF check in some places, and is missing sanitisation as well as escaping, which could allow attackers to make logged in admin add Stored XSS payloads via a CSRF attack",2024-04-26T15:32:22.523,https://cve.circl.lu/cve/CVE-2024-3076
CVE-2024-20353,4.0,Cisco,"A vulnerability in the management and VPN web servers for Cisco Adaptive Security Appliance (ASA) Software and Cisco Firepower Threat Defense (FTD) Software could allow an unauthenticated, remote attacker to cause the device to reload unexpectedly, resulting in a denial of service (DoS) condition. This vulnerability is due to incomplete error checking when parsing an HTTP header. An attacker could exploit this vulnerability by sending a crafted HTTP request to a targeted web server on a device. A successful exploit could allow the attacker to cause a DoS condition when the device reloads.",2024-04-26T15:22:27.803,https://cve.circl.lu/cve/CVE-2024-20353
CVE-2024-20359,5.2,Cisco,"A vulnerability in a legacy capability that allowed for the preloading of VPN clients and plug-ins and that has been available in Cisco Adaptive Security Appliance (ASA) Software and Cisco Firepower Threat Defense (FTD) Software could allow an authenticated, local attacker to execute arbitrary code with root-level privileges. Administrator-level privileges are required to exploit this vulnerability. This vulnerability is due to improper validation of a file when it is read from system flash memory. An attacker could exploit this vulnerability by copying a crafted file to the disk0: file system of an affected device. A successful exploit could allow the attacker to execute arbitrary code on the affected device after the next reload of the device, which could alter system behavior. Because the injected code could persist across device reboots, Cisco has raised the Security Impact Rating (SIR) of this advisory from Medium to High.",2024-04-26T15:25:02.773,https://cve.circl.lu/cve/CVE-2024-20359
CVE-2024-20295,6.0,Cisco,"A vulnerability in the CLI of the Cisco Integrated Management Controller (IMC) could allow an authenticated, local attacker to perform command injection attacks on the underlying operating system and elevate privileges to root. To exploit this vulnerability, the attacker must have read-only or higher privileges on an affected device. This vulnerability is due to insufficient validation of user-supplied input. An attacker could exploit this vulnerability by submitting a crafted CLI command. A successful exploit could allow the attacker to elevate privileges to root.",2024-04-25T13:18:20.370,https://cve.circl.lu/cve/CVE-2024-20295
CVE-2024-20356,5.8,Cisco,"A vulnerability in the web-based management interface of Cisco Integrated Management Controller (IMC) could allow an authenticated, remote attacker with Administrator-level privileges to perform command injection attacks on an affected system and elevate their privileges to root. This vulnerability is due to insufficient user input validation. An attacker could exploit this vulnerability by sending crafted commands to the web-based management interface of the affected software. A successful exploit could allow the attacker to elevate their privileges to root.",2024-04-25T13:18:20.370,https://cve.circl.lu/cve/CVE-2024-20356
CVE-2024-20358,5.2,Cisco,"A vulnerability in the Cisco Adaptive Security Appliance (ASA) restore functionality that is available in Cisco ASA Software and Cisco Firepower Threat Defense (FTD) Software could allow an authenticated, local attacker to execute arbitrary commands on the underlying operating system with root-level privileges. Administrator-level privileges are required to exploit this vulnerability. This vulnerability exists because the contents of a backup file are improperly sanitized at restore time. An attacker could exploit this vulnerability by restoring a crafted backup file to an affected device. A successful exploit could allow the attacker to execute arbitrary commands on the underlying Linux operating system as root.",2024-04-25T13:18:20.370,https://cve.circl.lu/cve/CVE-2024-20358
CVE-2022-2127,3.6,Cryptograph,"An out-of-bounds read vulnerability was found in Samba due to insufficient length checks in winbindd_pam_auth_crap.c. When performing NTLM authentication, the client replies to cryptographic challenges back to the server. These replies have variable lengths, and Winbind fails to check the lan manager response length. When Winbind is used for NTLM authentication, a maliciously crafted request can trigger an out-of-bounds read in Winbind, possibly resulting in a crash.",2024-04-22T16:15:12.070,https://cve.circl.lu/cve/CVE-2022-2127
CVE-2024-28834,3.6,Cryptograph,"A flaw was found in GnuTLS. The Minerva attack is a cryptographic vulnerability that exploits deterministic behavior in systems like GnuTLS, leading to side-channel leaks. In specific scenarios, such as when using the GNUTLS_PRIVKEY_FLAG_REPRODUCIBLE flag, it can result in a noticeable step in nonce size from 513 to 512 bits, exposing a potential timing side-channel.",2024-04-25T18:15:07.903,https://cve.circl.lu/cve/CVE-2024-28834
CVE-2024-28436,NA,D-Link,"Cross Site Scripting vulnerability in D-Link DAP products DAP-2230, DAP-2310, DAP-2330, DAP-2360, DAP-2553, DAP-2590, DAP-2690, DAP-2695, DAP-3520, DAP-3662 allows a remote attacker to execute arbitrary code via the reload parameter in the session_login.php component.",2024-04-22T19:24:06.727,https://cve.circl.lu/cve/CVE-2024-28436
CVE-2024-33342,NA,D-Link,"D-Link DIR-822+ V1.0.5 was found to contain a command injection in SetPlcNetworkpwd function of prog.cgi, which allows remote attackers to execute arbitrary commands via shell.",2024-04-26T19:59:19.793,https://cve.circl.lu/cve/CVE-2024-33342
CVE-2024-33343,NA,D-Link,"D-Link DIR-822+ V1.0.5 was found to contain a command injection in ChgSambaUserSettings function of prog.cgi, which allows remote attackers to execute arbitrary commands via shell.",2024-04-26T19:59:19.793,https://cve.circl.lu/cve/CVE-2024-33343
CVE-2024-33344,NA,D-Link,"D-Link DIR-822+ V1.0.5 was found to contain a command injection in ftext function of upload_firmware.cgi, which allows remote attackers to execute arbitrary commands via shell.",2024-04-26T19:59:19.793,https://cve.circl.lu/cve/CVE-2024-33344
CVE-2024-29053,5.9,Defender,Microsoft Defender for IoT Remote Code Execution Vulnerability,2024-04-26T15:58:55.843,https://cve.circl.lu/cve/CVE-2024-29053
CVE-2024-29054,5.9,Defender,Microsoft Defender for IoT Elevation of Privilege Vulnerability,2024-04-26T15:59:00.880,https://cve.circl.lu/cve/CVE-2024-29054
CVE-2024-29055,5.9,Defender,Microsoft Defender for IoT Elevation of Privilege Vulnerability,2024-04-26T15:58:48.473,https://cve.circl.lu/cve/CVE-2024-29055
CVE-2024-28963,3.6,Dell,Telemetry Dashboard v1.0.0.7 for Dell ThinOS 2402 contains a sensitive information disclosure vulnerability. An unauthenticated user with local access to the device could exploit this vulnerability to read sensitive proxy settings information.,2024-04-24T13:39:42.883,https://cve.circl.lu/cve/CVE-2024-28963
CVE-2024-28976,6.0,Dell,"Dell Repository Manager, versions prior to 3.4.5, contains a Path Traversal vulnerability in API module. A local attacker with low privileges could potentially exploit this vulnerability to gain unauthorized write access to the files stored on the server filesystem with the privileges of the running web application.",2024-04-24T13:39:42.883,https://cve.circl.lu/cve/CVE-2024-28976
CVE-2024-28977,1.4,Dell,"Dell Repository Manager, versions 3.4.2 through 3.4.4,contains a Path Traversal vulnerability in logger module. A local attacker with low privileges could potentially exploit this vulnerability to gain unauthorized read access to the files stored on the server filesystem with the privileges of the running web application.",2024-04-24T13:39:42.883,https://cve.circl.lu/cve/CVE-2024-28977
CVE-2024-29963,1.4,Docker,"Brocade SANnav OVA before v2.3.1, and v2.3.0a, contain hardcoded TLS keys used by Docker. Note: Brocade SANnav doesn't have access to remote Docker registries.",2024-04-26T23:15:05.857,https://cve.circl.lu/cve/CVE-2024-29963
CVE-2024-29964,3.6,Docker," Brocade SANnav versions before v2.3.0a do not correctly set permissions on files, including docker files. An unprivileged attacker who gains access to the server can read sensitive information from these files.",2024-04-26T00:15:08.383,https://cve.circl.lu/cve/CVE-2024-29964
CVE-2024-4159,1.4,Docker,"Brocade SANnav before v2.3.0a lacks protection mechanisms on port 2377/TCP and 7946/TCP, which could allow an unauthenticated attacker to sniff the SANnav Docker information.",2024-04-25T23:15:47.087,https://cve.circl.lu/cve/CVE-2024-4159
CVE-2024-2312,5.9,Debian,"GRUB2 does not call the module fini functions on exit, leading to Debian/Ubuntu's peimage GRUB2 module leaving UEFI system table hooks after exit. This lead to a use-after-free condition, and could possibly lead to secure boot bypass.",2024-04-26T09:15:12.073,https://cve.circl.lu/cve/CVE-2024-2312
CVE-2024-31992,3.6,Debian,"Mealie is a self hosted recipe manager and meal planner. Prior to 1.4.0, the safe_scrape_html function utilizes a user-controlled URL to issue a request to a remote server, however these requests are not rate-limited. While there are efforts to prevent DDoS by implementing a timeout on requests, it is possible for an attacker to issue a large number of requests to the server which will be handled in batches based on the configuration of the Mealie server. The chunking of responses is helpful for mitigating memory exhaustion on the Mealie server, however a single request to an arbitrarily large external file (e.g. a Debian ISO) is often sufficient to completely saturate a CPU core assigned to the Mealie container. Without rate limiting in place, it is possible to not only sustain traffic against an external target indefinitely, but also to exhaust the CPU resources assigned to the Mealie container. This vulnerability is fixed in 1.4.0.",2024-04-22T13:28:50.310,https://cve.circl.lu/cve/CVE-2024-31992
CVE-2024-31992,3.6,DDoS,"Mealie is a self hosted recipe manager and meal planner. Prior to 1.4.0, the safe_scrape_html function utilizes a user-controlled URL to issue a request to a remote server, however these requests are not rate-limited. While there are efforts to prevent DDoS by implementing a timeout on requests, it is possible for an attacker to issue a large number of requests to the server which will be handled in batches based on the configuration of the Mealie server. The chunking of responses is helpful for mitigating memory exhaustion on the Mealie server, however a single request to an arbitrarily large external file (e.g. a Debian ISO) is often sufficient to completely saturate a CPU core assigned to the Mealie container. Without rate limiting in place, it is possible to not only sustain traffic against an external target indefinitely, but also to exhaust the CPU resources assigned to the Mealie container. This vulnerability is fixed in 1.4.0.",2024-04-22T13:28:50.310,https://cve.circl.lu/cve/CVE-2024-31992
