CVE,"Impact Score (1-10, 10 being the worst)",Keyword,Description,Last Modified,Link
CVE-2023-41365,1.4,SAP,"SAP Business One (B1i) - version 10.0, allows an authorized attacker to retrieve the details stack trace of the fault message to conduct the XXE injection, which will lead to information disclosure. After successful exploitation, an attacker can cause limited impact on the confidentiality and no impact to the integrity and availability.",2023-10-11T19:10:23.687,https://cve.circl.lu/cve/CVE-2023-41365
CVE-2023-42474,2.7,SAP,"SAP BusinessObjects Web Intelligence - version 420, has a URL with parameter that could be vulnerable to XSS attack. The attacker could send a malicious link to a user that would possibly allow an attacker to retrieve the sensitive information.",2023-10-11T19:14:12.600,https://cve.circl.lu/cve/CVE-2023-42474
CVE-2023-42477,2.5,SAP,"SAP NetWeaver AS Java (GRMG Heartbeat application) - version 7.50, allows an attacker to send a crafted request from a vulnerable web application, causing limited impact on confidentiality and integrity of the application.",2023-10-10T12:16:32.703,https://cve.circl.lu/cve/CVE-2023-42477
CVE-2023-39362,5.9,SNMP,"Cacti is an open source operational monitoring and fault management framework. In Cacti 1.2.24, under certain conditions, an authenticated privileged user, can use a malicious string in the SNMP options of a Device, performing command injection and obtaining remote code execution on the underlying server. The `lib/snmp.php` file has a set of functions, with similar behavior, that accept in input some variables and place them into an `exec` call without a proper escape or validation. This issue has been addressed in version 1.2.25. Users are advised to upgrade. There are no known workarounds for this vulnerability.",2023-10-13T04:15:12.677,https://cve.circl.lu/cve/CVE-2023-39362
CVE-2023-35796,6.0,SNMP,A vulnerability has been identified in SINEMA Server V14 (All versions). The affected application improperly sanitizes certain SNMP configuration data retrieved from monitored devices. An attacker with access to a monitored device could perform a stored cross-site scripting (XSS) attack that may lead to arbitrary code execution with `SYSTEM` privileges on the application server. (ZDI-CAN-19823),2023-10-10T12:16:32.703,https://cve.circl.lu/cve/CVE-2023-35796
CVE-2023-44315,2.7,SNMP,A vulnerability has been identified in SINEC NMS (All versions < V2.0). The affected application improperly sanitizes certain SNMP configuration data retrieved from monitored devices. An attacker with access to a monitored device could prepare a stored cross-site scripting (XSS) attack that may lead to unintentional modification of application data by legitimate users.,2023-10-12T00:43:38.827,https://cve.circl.lu/cve/CVE-2023-44315
CVE-2022-3671,5.9,SQL,A vulnerability classified as critical was found in SourceCodester eLearning System 1.0. This vulnerability affects unknown code of the file /admin/students/manage.php. The manipulation of the argument id leads to sql injection. The attack can be initiated remotely. The exploit has been disclosed to the public and may be used. VDB-212014 is the identifier assigned to this vulnerability.,2023-10-08T09:15:10.677,https://cve.circl.lu/cve/CVE-2022-3671
CVE-2022-43724,5.9,SQL,"A vulnerability has been identified in SICAM PAS/PQS (All versions < V7.0). Affected software transmits the database credentials for the inbuilt SQL server in cleartext. In combination with the by default enabled xp_cmdshell feature unauthenticated remote attackers could execute custom OS commands. At the time of assigning the CVE, the affected firmware version of the component has already been superseded by succeeding mainline versions.",2023-10-13T16:45:10.723,https://cve.circl.lu/cve/CVE-2022-43724
CVE-2010-10003,5.9,SQL,A vulnerability classified as critical was found in gesellix titlelink on Joomla. Affected by this vulnerability is an unknown functionality of the file plugin_content_title.php. The manipulation of the argument phrase leads to sql injection. The patch is named b4604e523853965fa981a4e79aef4b554a535db0. It is recommended to apply a patch to fix this issue. The associated identifier of this vulnerability is VDB-217351.,2023-10-12T09:15:11.727,https://cve.circl.lu/cve/CVE-2010-10003
CVE-2013-10009,5.9,SQL,A vulnerability was found in DrAzraelTod pyChao and classified as critical. Affected by this issue is the function klauen/lesen of the file mod_fun/__init__.py. The manipulation leads to sql injection. The patch is identified as 9d8adbc07c384ba51c2583ce0819c9abb77dc648. It is recommended to apply a patch to fix this issue. VDB-217634 is the identifier assigned to this vulnerability.,2023-10-12T09:15:14.893,https://cve.circl.lu/cve/CVE-2013-10009
CVE-2010-10007,5.9,SQL,** UNSUPPPORTED WHEN ASSIGNED ** ** UNSUPPORTED WHEN ASSIGNED ** A vulnerability was found in lierdakil click-reminder. It has been rated as critical. This issue affects the function db_query of the file src/backend/include/BaseAction.php. The manipulation leads to sql injection. The identifier of the patch is 41213b660e8eb01b22c8074f06208f59a73ca8dc. It is recommended to apply a patch to fix this issue. The identifier VDB-218465 was assigned to this vulnerability. NOTE: This vulnerability only affects products that are no longer supported by the maintainer.,2023-10-12T09:15:12.210,https://cve.circl.lu/cve/CVE-2010-10007
CVE-2019-11324,3.6,SSL,"The urllib3 library before 1.24.2 for Python mishandles certain cases where the desired set of CA certificates is different from the OS store of CA certificates, which results in SSL connections succeeding in situations where a verification failure is the correct outcome. This is related to use of the ssl_context, ca_certs, or ca_certs_dir argument.",2023-10-08T14:15:11.823,https://cve.circl.lu/cve/CVE-2019-11324
CVE-2023-40217,1.4,SSL,"An issue was discovered in Python before 3.8.18, 3.9.x before 3.9.18, 3.10.x before 3.10.13, and 3.11.x before 3.11.5. It primarily affects servers (such as HTTP servers) that use TLS client authentication. If a TLS server-side socket is created, receives data into the socket buffer, and then is closed quickly, there is a brief window where the SSLSocket instance will detect the socket as ""not connected"" and won't initiate a handshake, but buffered data will still be readable from the socket buffer. This data will not be authenticated if the server-side TLS peer is expecting client certificate authentication, and is indistinguishable from valid TLS stream data. Data is limited in size to the amount that will fit in the buffer. (The TLS connection cannot directly be used for data exfiltration because the vulnerable code path requires that the connection be closed on initialization of the SSLSocket.)",2023-10-11T23:15:10.370,https://cve.circl.lu/cve/CVE-2023-40217
CVE-2023-41675,1.4,SSL,A use after free vulnerability [CWE-416] in FortiOS version 7.2.0 through 7.2.4 and version 7.0.0 through 7.0.10 and FortiProxy version 7.2.0 through 7.2.2 and version 7.0.0 through 7.0.8 may allow an unauthenticated remote attacker to crash the WAD process via multiple crafted packets reaching proxy policies or firewall policies with proxy mode alongside SSL deep packet inspection.,2023-10-13T16:32:57.720,https://cve.circl.lu/cve/CVE-2023-41675
CVE-2023-36843,3.6,SSL,"An Improper Handling of Inconsistent Special Elements vulnerability in the Junos Services Framework (jsf) module of Juniper Networks Junos OS allows an unauthenticated network based attacker to cause a crash in the Packet Forwarding Engine (pfe) and thereby resulting in a Denial of Service (DoS).Upon receiving malformed SSL traffic, the PFE crashes. A manual restart will be needed to recover the device.This issue only affects devices with Juniper Networks Advanced Threat Prevention (ATP) Cloud enabled with Encrypted Traffic Insights (configured via ‘security-metadata-streaming policy’).This issue affects Juniper Networks Junos OS:  *  All versions prior to 20.4R3-S8, 20.4R3-S9;  *  21.1 version 21.1R1 and later versions;  *  21.2 versions prior to 21.2R3-S6;  *  21.3 versions prior to 21.3R3-S5;  *  21.4 versions prior to 21.4R3-S5;  *  22.1 versions prior to 22.1R3-S4;  *  22.2 versions prior to 22.2R3-S2;  *  22.3 versions prior to 22.3R2-S2, 22.3R3;  *  22.4 versions prior to 22.4R2-S1, 22.4R3;",2023-10-13T12:47:48.873,https://cve.circl.lu/cve/CVE-2023-36843
CVE-2019-14870,2.5,Samba,"All Samba versions 4.x.x before 4.9.17, 4.10.x before 4.10.11 and 4.11.x before 4.11.3 have an issue, where the S4U (MS-SFU) Kerberos delegation model includes a feature allowing for a subset of clients to be opted out of constrained delegation in any way, either S4U2Self or regular Kerberos authentication, by forcing all tickets for these clients to be non-forwardable. In AD this is implemented by a user attribute delegation_not_allowed (aka not-delegated), which translates to disallow-forwardable. However the Samba AD DC does not do that for S4U2Self and does set the forwardable flag even if the impersonated client has the not-delegated flag set.",2023-10-08T09:15:10.253,https://cve.circl.lu/cve/CVE-2019-14870
CVE-2022-3437,3.6,Samba,"A heap-based buffer overflow vulnerability was found in Samba within the GSSAPI unwrap_des() and unwrap_des3() routines of Heimdal. The DES and Triple-DES decryption routines in the Heimdal GSSAPI library allow a length-limited write buffer overflow on malloc() allocated memory when presented with a maliciously small packet. This flaw allows a remote user to send specially crafted malicious data to the application, possibly resulting in a denial of service (DoS) attack.",2023-10-08T09:15:10.573,https://cve.circl.lu/cve/CVE-2022-3437
CVE-2022-34821,6.0,SIP,"A vulnerability has been identified in RUGGEDCOM RM1224 LTE(4G) EU (All versions < V7.2), RUGGEDCOM RM1224 LTE(4G) NAM (All versions < V7.2), SCALANCE M804PB (All versions < V7.2), SCALANCE M812-1 ADSL-Router (Annex A) (All versions < V7.2), SCALANCE M812-1 ADSL-Router (Annex B) (All versions < V7.2), SCALANCE M816-1 ADSL-Router (Annex A) (All versions < V7.2), SCALANCE M816-1 ADSL-Router (Annex B) (All versions < V7.2), SCALANCE M826-2 SHDSL-Router (All versions < V7.2), SCALANCE M874-2 (All versions < V7.2), SCALANCE M874-3 (All versions < V7.2), SCALANCE M876-3 (EVDO) (All versions < V7.2), SCALANCE M876-3 (ROK) (All versions < V7.2), SCALANCE M876-4 (All versions < V7.2), SCALANCE M876-4 (EU) (All versions < V7.2), SCALANCE M876-4 (NAM) (All versions < V7.2), SCALANCE MUM853-1 (EU) (All versions < V7.2), SCALANCE MUM856-1 (EU) (All versions < V7.2), SCALANCE MUM856-1 (RoW) (All versions < V7.2), SCALANCE S615 (All versions < V7.2), SCALANCE S615 EEC (All versions < V7.2), SCALANCE SC622-2C (All versions < V2.3), SCALANCE SC622-2C (All versions >= V2.3 < V3.0), SCALANCE SC626-2C (All versions < V2.3), SCALANCE SC626-2C (All versions >= V2.3 < V3.0), SCALANCE SC632-2C (All versions < V2.3), SCALANCE SC632-2C (All versions >= V2.3 < V3.0), SCALANCE SC636-2C (All versions < V2.3), SCALANCE SC636-2C (All versions >= V2.3 < V3.0), SCALANCE SC642-2C (All versions < V2.3), SCALANCE SC642-2C (All versions >= V2.3 < V3.0), SCALANCE SC646-2C (All versions < V2.3), SCALANCE SC646-2C (All versions >= V2.3 < V3.0), SCALANCE WAM763-1 (All versions), SCALANCE WAM766-1 (EU) (All versions), SCALANCE WAM766-1 (US) (All versions), SCALANCE WAM766-1 EEC (EU) (All versions), SCALANCE WAM766-1 EEC (US) (All versions), SCALANCE WUM763-1 (All versions), SCALANCE WUM763-1 (All versions), SCALANCE WUM766-1 (EU) (All versions), SCALANCE WUM766-1 (US) (All versions), SIMATIC CP 1242-7 V2 (All versions < V3.3.46), SIMATIC CP 1243-1 (All versions < V3.3.46), SIMATIC CP 1243-7 LTE EU (All versions < V3.3.46), SIMATIC CP 1243-7 LTE US (All versions < V3.3.46), SIMATIC CP 1243-8 IRC (All versions < V3.3.46), SIMATIC CP 1542SP-1 IRC (All versions >= V2.0 < V2.2.28), SIMATIC CP 1543-1 (All versions < V3.0.22), SIMATIC CP 1543SP-1 (All versions >= V2.0 < V2.2.28), SIPLUS ET 200SP CP 1542SP-1 IRC TX RAIL (All versions >= V2.0 < V2.2.28), SIPLUS ET 200SP CP 1543SP-1 ISEC (All versions >= V2.0 < V2.2.28), SIPLUS ET 200SP CP 1543SP-1 ISEC TX RAIL (All versions >= V2.0 < V2.2.28), SIPLUS NET CP 1242-7 V2 (All versions < V3.3.46), SIPLUS NET CP 1543-1 (All versions < V3.0.22), SIPLUS S7-1200 CP 1243-1 (All versions < V3.3.46), SIPLUS S7-1200 CP 1243-1 RAIL (All versions < V3.3.46). By injecting code to specific configuration options for OpenVPN, an attacker could execute arbitrary code with elevated privileges.",2023-10-10T11:15:10.703,https://cve.circl.lu/cve/CVE-2022-34821
CVE-2023-44198,1.4,SIP,"An Improper Check for Unusual or Exceptional Conditions vulnerability in the SIP ALG of Juniper Networks Junos OS on SRX Series and MX Series allows an unauthenticated network-based attacker to cause an integrity impact in connected networks.If the SIP ALG is configured and a device receives a specifically malformed SIP packet, the device prevents this packet from being forwarded, but any subsequently received retransmissions of the same packet are forwarded as if they were valid.This issue affects Juniper Networks Junos OS on SRX Series and MX Series:  *  20.4 versions prior to 20.4R3-S5;  *  21.1 versions prior to 21.1R3-S4;  *  21.2 versions prior to 21.2R3-S4;  *  21.3 versions prior to 21.3R3-S3;  *  21.4 versions prior to 21.4R3-S2;  *  22.1 versions prior to 22.1R2-S2, 22.1R3;  *  22.2 versions prior to 22.2R2-S1, 22.2R3;  *  22.3 versions prior to 22.3R1-S2, 22.3R2.This issue doesn't not affected releases prior to 20.4R1.",2023-10-13T12:47:39.540,https://cve.circl.lu/cve/CVE-2023-44198
CVE-2008-0590,10.0,SSH,Buffer overflow in Ipswitch WS_FTP Server with SSH 6.1.0.0 allows remote authenticated users to cause a denial of service (crash) and possibly execute arbitrary code via a long opendir command.,2023-10-11T14:45:44.747,https://cve.circl.lu/cve/CVE-2008-0590
CVE-2019-12143,1.4,SSH,A Directory Traversal issue was discovered in SSHServerAPI.dll in Progress ipswitch WS_FTP Server 2018 before 8.6.1. An attacker can supply a string using special patterns via the SCP protocol to disclose WS_FTP usernames as well as filenames.,2023-10-11T14:45:44.747,https://cve.circl.lu/cve/CVE-2019-12143
CVE-2022-27211,3.6,SSH,"A missing permission check in Jenkins Kubernetes Continuous Deploy Plugin 2.3.1 and earlier allows attackers with Overall/Read permission to connect to an attacker-specified SSH server using attacker-specified credentials IDs obtained through another method, capturing credentials stored in Jenkins.",2023-10-10T22:15:10.507,https://cve.circl.lu/cve/CVE-2022-27211
CVE-2022-46144,3.6,SSH,"A vulnerability has been identified in SCALANCE SC622-2C (All versions < V2.3), SCALANCE SC622-2C (All versions >= V2.3 < V3.0), SCALANCE SC626-2C (All versions < V2.3), SCALANCE SC626-2C (All versions >= V2.3 < V3.0), SCALANCE SC632-2C (All versions < V2.3), SCALANCE SC632-2C (All versions >= V2.3 < V3.0), SCALANCE SC636-2C (All versions < V2.3), SCALANCE SC636-2C (All versions >= V2.3 < V3.0), SCALANCE SC642-2C (All versions < V2.3), SCALANCE SC642-2C (All versions >= V2.3 < V3.0), SCALANCE SC646-2C (All versions < V2.3), SCALANCE SC646-2C (All versions >= V2.3 < V3.0). Affected devices do not properly process CLI commands after a user forcefully quitted the SSH connection. This could allow an authenticated attacker to make the CLI via SSH or serial  interface irresponsive.",2023-10-10T11:15:10.987,https://cve.circl.lu/cve/CVE-2022-46144
CVE-2023-27538,3.6,SSH,"An authentication bypass vulnerability exists in libcurl prior to v8.0.0 where it reuses a previously established SSH connection despite the fact that an SSH option was modified, which should have prevented reuse. libcurl maintains a pool of previously used connections to reuse them for subsequent transfers if the configurations match. However, two SSH settings were omitted from the configuration check, allowing them to match easily, potentially leading to the reuse of an inappropriate connection.",2023-10-11T11:15:11.977,https://cve.circl.lu/cve/CVE-2023-27538
CVE-2023-28321,3.6,TLS,"An improper certificate validation vulnerability exists in curl <v8.1.0 in the way it supports matching of wildcard patterns when listed as ""Subject Alternative Name"" in TLS server certificates. curl can be built to use its own name matching function for TLS rather than one provided by a TLS library. This private wildcard matching function would match IDN (International Domain Name) hosts incorrectly and could as a result accept patterns that otherwise should mismatch. IDN hostnames are converted to puny code before used for certificate checks. Puny coded names always start with `xn--` and should not be allowed to pattern match, but the wildcard check in curl could still check for `x*`, which would match even though the IDN name most likely contained nothing even resembling an `x`.",2023-10-11T15:15:09.543,https://cve.circl.lu/cve/CVE-2023-28321
CVE-2023-40217,1.4,TLS,"An issue was discovered in Python before 3.8.18, 3.9.x before 3.9.18, 3.10.x before 3.10.13, and 3.11.x before 3.11.5. It primarily affects servers (such as HTTP servers) that use TLS client authentication. If a TLS server-side socket is created, receives data into the socket buffer, and then is closed quickly, there is a brief window where the SSLSocket instance will detect the socket as ""not connected"" and won't initiate a handshake, but buffered data will still be readable from the socket buffer. This data will not be authenticated if the server-side TLS peer is expecting client certificate authentication, and is indistinguishable from valid TLS stream data. Data is limited in size to the amount that will fit in the buffer. (The TLS connection cannot directly be used for data exfiltration because the vulnerable code path requires that the connection be closed on initialization of the SSLSocket.)",2023-10-11T23:15:10.370,https://cve.circl.lu/cve/CVE-2023-40217
CVE-2023-4586,5.2,TLS,"A vulnerability was found in the Hot Rod client. This security issue occurs as the Hot Rod client does not enable hostname validation when using TLS, possibly resulting in a man-in-the-middle (MITM) attack.",2023-10-10T13:29:19.913,https://cve.circl.lu/cve/CVE-2023-4586
CVE-2023-43615,3.6,TLS,Mbed TLS 2.x before 2.28.5 and 3.x before 3.5.0 has a Buffer Overflow.,2023-10-13T04:15:13.840,https://cve.circl.lu/cve/CVE-2023-43615
CVE-2023-45199,5.9,TLS,Mbed TLS 3.2.x through 3.4.x before 3.5 has a Buffer Overflow that can lead to remote Code execution.,2023-10-12T18:19:39.860,https://cve.circl.lu/cve/CVE-2023-45199
CVE-2022-41352,5.9,Ubuntu,"An issue was discovered in Zimbra Collaboration (ZCS) 8.8.15 and 9.0. An attacker can upload arbitrary files through amavis via a cpio loophole (extraction to /opt/zimbra/jetty/webapps/zimbra/public) that can lead to incorrect access to any other user accounts. Zimbra recommends pax over cpio. Also, pax is in the prerequisites of Zimbra on Ubuntu; however, pax is no longer part of a default Red Hat installation after RHEL 6 (or CentOS 6). Once pax is installed, amavis automatically prefers it over cpio.",2023-10-10T00:15:10.297,https://cve.circl.lu/cve/CVE-2022-41352
CVE-2023-39250,3.6,VMware,Dell Storage Integration Tools for VMware (DSITV) and Dell Storage vSphere Client Plugin (DSVCP) versions prior to 6.1.1 and Replay Manager for VMware (RMSV) versions prior to 3.1.2 contain an information disclosure vulnerability. A local low-privileged malicious user could potentially exploit this vulnerability to retrieve an encryption key that could aid in further attacks. ,2023-10-11T06:15:09.597,https://cve.circl.lu/cve/CVE-2023-39250
CVE-2023-27312,2.5,VMware,SnapCenter Plugin for VMware vSphere versions 4.6 prior to 4.9 are susceptible to a vulnerability which may allow authenticated unprivileged users to modify email and snapshot name settings within the VMware vSphere user interface.,2023-10-12T19:42:47.127,https://cve.circl.lu/cve/CVE-2023-27312
CVE-2023-37935,3.6,VNC,"A use of GET request method with sensitive query strings vulnerability in Fortinet FortiOS 7.0.0 - 7.0.12, 7.2.0 - 7.2.5 and 7.4.0 allows an attacker to view plaintext passwords of remote services such as RDP or VNC, if the attacker is able to read the GET requests to those services.",2023-10-12T19:59:17.273,https://cve.circl.lu/cve/CVE-2023-37935
CVE-2023-22308,3.6,VPN,An integer underflow vulnerability exists in the vpnserver OvsProcessData functionality of SoftEther VPN 5.01.9674 and 5.02. A specially crafted network packet can lead to denial of service. An attacker can send a malicious packet to trigger this vulnerability.,2023-10-12T16:52:07.503,https://cve.circl.lu/cve/CVE-2023-22308
CVE-2023-22325,3.6,VPN,"A denial of service vulnerability exists in the DCRegister DDNS_RPC_MAX_RECV_SIZE functionality of SoftEther VPN 4.41-9782-beta, 5.01.9674 and 5.02. A specially crafted network packet can lead to denial of service. An attacker can perform a man-in-the-middle attack to trigger this vulnerability.",2023-10-12T16:52:07.503,https://cve.circl.lu/cve/CVE-2023-22325
CVE-2023-23581,3.6,VPN,A denial-of-service vulnerability exists in the vpnserver EnSafeHttpHeaderValueStr functionality of SoftEther VPN 5.01.9674 and 5.02. A specially crafted network packet can lead to denial of service.,2023-10-12T16:52:07.503,https://cve.circl.lu/cve/CVE-2023-23581
CVE-2023-25774,3.6,VPN,A denial-of-service vulnerability exists in the vpnserver ConnectionAccept() functionality of SoftEther VPN 5.02. A set of specially crafted network connections can lead to denial of service. An attacker can send a sequence of malicious packets to trigger this vulnerability.,2023-10-12T16:52:07.503,https://cve.circl.lu/cve/CVE-2023-25774
CVE-2023-27395,6.0,VPN,"A heap-based buffer overflow vulnerability exists in the vpnserver WpcParsePacket() functionality of SoftEther VPN 4.41-9782-beta, 5.01.9674 and 5.02. A specially crafted network packet can lead to arbitrary code execution. An attacker can perform a man-in-the-middle attack to trigger this vulnerability.",2023-10-12T18:15:09.987,https://cve.circl.lu/cve/CVE-2023-27395
CVE-2023-29338,5.2,Visual Studio,Visual Studio Code Spoofing Vulnerability,2023-10-12T19:15:11.897,https://cve.circl.lu/cve/CVE-2023-29338
CVE-2023-21884,3.6,VirtualBox,Vulnerability in the Oracle VM VirtualBox product of Oracle Virtualization (component: Core).  Supported versions that are affected are Prior to 6.1.42 and  prior to 7.0.6. Easily exploitable vulnerability allows high privileged attacker with logon to the infrastructure where Oracle VM VirtualBox executes to compromise Oracle VM VirtualBox.  Successful attacks of this vulnerability can result in unauthorized ability to cause a hang or frequently repeatable crash (complete DOS) of Oracle VM VirtualBox. CVSS 3.1 Base Score 4.4 (Availability impacts).  CVSS Vector: (CVSS:3.1/AV:L/AC:L/PR:H/UI:N/S:U/C:N/I:N/A:H).,2023-10-08T09:15:11.217,https://cve.circl.lu/cve/CVE-2023-21884
CVE-2023-21885,1.4,VirtualBox,"Vulnerability in the Oracle VM VirtualBox product of Oracle Virtualization (component: Core).  Supported versions that are affected are Prior to 6.1.42 and  prior to 7.0.6. Easily exploitable vulnerability allows low privileged attacker with logon to the infrastructure where Oracle VM VirtualBox executes to compromise Oracle VM VirtualBox.  While the vulnerability is in Oracle VM VirtualBox, attacks may significantly impact additional products (scope change).  Successful attacks of this vulnerability can result in  unauthorized read access to a subset of Oracle VM VirtualBox accessible data. Note: Applies to Windows only. CVSS 3.1 Base Score 3.8 (Confidentiality impacts).  CVSS Vector: (CVSS:3.1/AV:L/AC:L/PR:L/UI:N/S:C/C:L/I:N/A:N).",2023-10-08T09:15:11.323,https://cve.circl.lu/cve/CVE-2023-21885
CVE-2023-21886,5.9,VirtualBox,"Vulnerability in the Oracle VM VirtualBox product of Oracle Virtualization (component: Core).  Supported versions that are affected are Prior to 6.1.42 and  prior to 7.0.6. Difficult to exploit vulnerability allows unauthenticated attacker with network access via multiple protocols to compromise Oracle VM VirtualBox.  Successful attacks of this vulnerability can result in takeover of Oracle VM VirtualBox. CVSS 3.1 Base Score 8.1 (Confidentiality, Integrity and Availability impacts).  CVSS Vector: (CVSS:3.1/AV:N/AC:H/PR:N/UI:N/S:U/C:H/I:H/A:H).",2023-10-08T09:15:11.400,https://cve.circl.lu/cve/CVE-2023-21886
CVE-2023-21889,1.4,VirtualBox,"Vulnerability in the Oracle VM VirtualBox product of Oracle Virtualization (component: Core).  Supported versions that are affected are Prior to 6.1.42 and  prior to 7.0.6. Easily exploitable vulnerability allows low privileged attacker with logon to the infrastructure where Oracle VM VirtualBox executes to compromise Oracle VM VirtualBox.  While the vulnerability is in Oracle VM VirtualBox, attacks may significantly impact additional products (scope change).  Successful attacks of this vulnerability can result in  unauthorized read access to a subset of Oracle VM VirtualBox accessible data. CVSS 3.1 Base Score 3.8 (Confidentiality impacts).  CVSS Vector: (CVSS:3.1/AV:L/AC:L/PR:L/UI:N/S:C/C:L/I:N/A:N).",2023-10-08T09:15:11.483,https://cve.circl.lu/cve/CVE-2023-21889
