CVE,"Impact Score (1-10, 10 being the worst)",Keyword,Description,Last Modified,Link
CVE-2022-41741,5.9,Nginx,"NGINX Open Source before versions 1.23.2 and 1.22.1, NGINX Open Source Subscription before versions R2 P1 and R1 P1, and NGINX Plus before versions R27 P1 and R26 P1 have a vulnerability in the module ngx_http_mp4_module that might allow a local attacker to corrupt NGINX worker memory, resulting in its termination or potential other impact using a specially crafted audio or video file. The issue affects only NGINX products that are built with the ngx_http_mp4_module, when the mp4 directive is used in the configuration file. Further, the attack is possible only if an attacker can trigger processing of a specially crafted audio or video file with the module ngx_http_mp4_module.",2023-03-24T18:16:49.710,"<a href=""https://cve.circl.lu/cve/CVE-2022-41741"">Info Link</a>"
CVE-2023-27224,,Nginx,An issue found in NginxProxyManager v.2.9.19 allows an attacker to execute arbitrary code via a lua script to the configuration file.,2023-03-23T01:03:10.803,"<a href=""https://cve.circl.lu/cve/CVE-2023-27224"">Info Link</a>"
CVE-2023-28155,2.7,Node.js,"** UNSUPPORTED WHEN ASSIGNED ** The Request package through 2.88.1 for Node.js allows a bypass of SSRF mitigations via an attacker-controller server that does a cross-protocol redirect (HTTP to HTTPS, or HTTPS to HTTP). NOTE: This vulnerability only affects products that are no longer supported by the maintainer.",2023-03-22T19:32:40.640,"<a href=""https://cve.circl.lu/cve/CVE-2023-28155"">Info Link</a>"
CVE-2018-25083,,Node.js,The pullit package before 1.4.0 for Node.js allows OS Command Injection because eval is used on an attacker-supplied Git branch name.,2023-03-27T12:40:41.963,"<a href=""https://cve.circl.lu/cve/CVE-2018-25083"">Info Link</a>"
CVE-2022-3894,1.4,OAuth,"The WP OAuth Server (OAuth Authentication) WordPress plugin before 4.2.5 does not have CSRF check when deleting a client, and does not ensure that the object to be deleted is actually a client, which could allow attackers to make a logged in admin delete arbitrary client and post via a CSRF attack.",2023-03-24T03:46:52.327,"<a href=""https://cve.circl.lu/cve/CVE-2022-3894"">Info Link</a>"
CVE-2022-4148,1.4,OAuth,"The WP OAuth Server (OAuth Authentication) WordPress plugin before 4.2.5 has a flawed CSRF and authorisation check when deleting a client, which could allow any authenticated users, such as subscriber to delete arbitrary client.",2023-03-24T11:15:07.103,"<a href=""https://cve.circl.lu/cve/CVE-2022-4148"">Info Link</a>"
CVE-2023-1092,,OAuth,"The OAuth Single Sign On Free WordPress plugin before 6.24.2, OAuth Single Sign On Standard WordPress plugin before 28.4.9, OAuth Single Sign On Premium WordPress plugin before 38.4.9 and OAuth Single Sign On Enterprise WordPress plugin before 48.4.9 do not have CSRF checks when deleting Identity Providers (IdP), which could allow attackers to make logged in admins delete arbitrary IdP via a CSRF attack",2023-03-27T17:04:28.297,"<a href=""https://cve.circl.lu/cve/CVE-2023-1092"">Info Link</a>"
CVE-2023-1093,,OAuth,"The OAuth Single Sign On WordPress plugin before 6.24.2 does not have CSRF checks when discarding Identify providers (IdP), which could allow attackers to make logged in admins delete all IdP via a CSRF attack",2023-03-27T17:04:28.297,"<a href=""https://cve.circl.lu/cve/CVE-2023-1093"">Info Link</a>"
CVE-2023-0286,5.2,OpenSSL,"There is a type confusion vulnerability relating to X.400 address processing inside an X.509 GeneralName. X.400 addresses were parsed as an ASN1_STRING but the public structure definition for GENERAL_NAME incorrectly specified the type of the x400Address field as ASN1_TYPE. This field is subsequently interpreted by the OpenSSL function GENERAL_NAME_cmp as an ASN1_TYPE rather than an ASN1_STRING. When CRL checking is enabled (i.e. the application sets the X509_V_FLAG_CRL_CHECK flag), this vulnerability may allow an attacker to pass arbitrary pointers to a memcmp call, enabling them to read memory contents or enact a denial of service. In most cases, the attack requires the attacker to provide both the certificate chain and CRL, neither of which need to have a valid signature. If the attacker only controls one of these inputs, the other input must already contain an X.400 address as a CRL distribution point, which is uncommon. As such, this vulnerability is most likely to only affect applications which have implemented their own functionality for retrieving CRLs over a network.",2023-03-27T19:15:09.783,"<a href=""https://cve.circl.lu/cve/CVE-2023-0286"">Info Link</a>"
CVE-2023-0464,,OpenSSL,"A security vulnerability has been identified in all supported versions of OpenSSL related to the verification of X.509 certificate chains that include policy constraints. Attackers may be able to exploit this vulnerability by creating a malicious certificate chain that triggers exponential use of computational resources, leading to a denial-of-service (DoS) attack on affected systems. Policy processing is disabled by default but can be enabled by passing the `-policy' argument to the command line utilities or by calling the `X509_VERIFY_PARAM_set1_policies()' function.",2023-03-22T18:10:33.697,"<a href=""https://cve.circl.lu/cve/CVE-2023-0464"">Info Link</a>"
CVE-2021-25636,3.6,Office,"LibreOffice supports digital signatures of ODF documents and macros within documents, presenting visual aids that no alteration of the document occurred since the last signing and that the signature is valid. An Improper Certificate Validation vulnerability in LibreOffice allowed an attacker to create a digitally signed ODF document, by manipulating the documentsignatures.xml or macrosignatures.xml stream within the document to contain both ""X509Data"" and ""KeyValue"" children of the ""KeyInfo"" tag, which when opened caused LibreOffice to verify using the ""KeyValue"" but to report verification with the unrelated ""X509Data"" value. This issue affects: The Document Foundation LibreOffice 7.2 versions prior to 7.2.5.",2023-03-27T00:15:07.040,"<a href=""https://cve.circl.lu/cve/CVE-2021-25636"">Info Link</a>"
CVE-2022-26305,5.9,Office,"An Improper Certificate Validation vulnerability in LibreOffice existed where determining if a macro was signed by a trusted author was done by only matching the serial number and issuer string of the used certificate with that of a trusted certificate. This is not sufficient to verify that the macro was actually signed with the certificate. An adversary could therefore create an arbitrary certificate with a serial number and an issuer string identical to a trusted certificate which LibreOffice would present as belonging to the trusted author, potentially leading to the user to execute arbitrary code contained in macros improperly trusted. This issue affects: The Document Foundation LibreOffice 7.2 versions prior to 7.2.7; 7.3 versions prior to 7.3.1.",2023-03-26T23:15:07.447,"<a href=""https://cve.circl.lu/cve/CVE-2022-26305"">Info Link</a>"
CVE-2022-26306,3.6,Office,LibreOffice supports the storage of passwords for web connections in the user’s configuration database. The stored passwords are encrypted with a single master key provided by the user. A flaw in LibreOffice existed where the required initialization vector for encryption was always the same which weakens the security of the encryption making them vulnerable if an attacker has access to the user's configuration data. This issue affects: The Document Foundation LibreOffice 7.2 versions prior to 7.2.7; 7.3 versions prior to 7.3.1.,2023-03-26T23:15:07.530,"<a href=""https://cve.circl.lu/cve/CVE-2022-26306"">Info Link</a>"
CVE-2023-24882,3.6,OneDrive,Microsoft OneDrive for Android Information Disclosure Vulnerability,2023-03-21T15:51:41.623,"<a href=""https://cve.circl.lu/cve/CVE-2023-24882"">Info Link</a>"
CVE-2023-24890,3.6,OneDrive,Microsoft OneDrive for iOS Security Feature Bypass Vulnerability,2023-03-21T18:11:09.133,"<a href=""https://cve.circl.lu/cve/CVE-2023-24890"">Info Link</a>"
CVE-2023-28531,5.9,OpenSSH,ssh-add in OpenSSH before 9.3 adds smartcard keys to ssh-agent without the intended per-hop destination constraints.,2023-03-23T14:07:41.757,"<a href=""https://cve.circl.lu/cve/CVE-2023-28531"">Info Link</a>"
CVE-2021-3293,1.4,PHP,"emlog v5.3.1 has full path disclosure vulnerability in t/index.php, which allows an attacker to see the path to the webroot/file.",2023-03-20T20:31:47.667,"<a href=""https://cve.circl.lu/cve/CVE-2021-3293"">Info Link</a>"
CVE-2020-28871,5.9,PHP,Remote code execution in Monitorr v1.7.6m in upload.php allows an unauthorized person to execute arbitrary code on the server-side via an insecure file upload.,2023-03-23T17:15:13.497,"<a href=""https://cve.circl.lu/cve/CVE-2020-28871"">Info Link</a>"
CVE-2021-46360,5.9,PHP,Authenticated remote code execution (RCE) in Composr-CMS 10.0.39 and earlier allows remote attackers to execute arbitrary code via uploading a PHP shell through /adminzone/index.php?page=admin-commandr.,2023-03-27T18:15:10.817,"<a href=""https://cve.circl.lu/cve/CVE-2021-46360"">Info Link</a>"
CVE-2022-26521,5.9,PHP,"Abantecart through 1.3.2 allows remote authenticated administrators to execute arbitrary code by uploading an executable file, because the Catalog>Media Manager>Images settings can be changed by an administrator (e.g., by configuring .php to be a valid image file type).",2023-03-27T18:15:10.977,"<a href=""https://cve.circl.lu/cve/CVE-2022-26521"">Info Link</a>"
CVE-2022-26982,5.9,PHP,SimpleMachinesForum 2.1.1 and earlier allows remote authenticated administrators to execute arbitrary code by inserting a vulnerable php code because the themes can be modified by an administrator.,2023-03-27T18:15:11.077,"<a href=""https://cve.circl.lu/cve/CVE-2022-26982"">Info Link</a>"
CVE-2019-17436,5.2,Palo Alto,"A Local Privilege Escalation vulnerability exists in GlobalProtect Agent for Linux and Mac OS X version 5.0.4 and earlier and version 4.1.12 and earlier, that can allow non-root users to overwrite root files on the file system.",2023-03-23T19:26:33.123,"<a href=""https://cve.circl.lu/cve/CVE-2019-17436"">Info Link</a>"
CVE-2023-24329,3.6,Python,An issue in the urllib.parse component of Python before v3.11 allows attackers to bypass blocklisting methods by supplying a URL that starts with blank characters.,2023-03-24T16:15:08.597,"<a href=""https://cve.circl.lu/cve/CVE-2023-24329"">Info Link</a>"
CVE-2018-25082,5.9,Python,A vulnerability was found in zwczou WeChat SDK Python 0.3.0 and classified as critical. This issue affects the function validate/to_xml. The manipulation leads to xml external entity reference. The attack may be initiated remotely. Upgrading to version 0.5.5 is able to address this issue. The name of the patch is e54abadc777715b6dcb545c13214d1dea63df6c9. It is recommended to upgrade the affected component. The associated identifier of this vulnerability is VDB-223403.,2023-03-24T19:34:14.640,"<a href=""https://cve.circl.lu/cve/CVE-2018-25082"">Info Link</a>"
CVE-2022-42333,,QEMU,"x86/HVM pinned cache attributes mis-handling T[his CNA information record relates to multiple CVEs; the text explains which aspects/vulnerabilities correspond to which CVE.] To allow cachability control for HVM guests with passed through devices, an interface exists to explicitly override defaults which would otherwise be put in place. While not exposed to the affected guests themselves, the interface specifically exists for domains controlling such guests. This interface may therefore be used by not fully privileged entities, e.g. qemu running deprivileged in Dom0 or qemu running in a so called stub-domain. With this exposure it is an issue that - the number of the such controlled regions was unbounded (CVE-2022-42333), - installation and removal of such regions was not properly serialized (CVE-2022-42334).",2023-03-27T00:15:08.133,"<a href=""https://cve.circl.lu/cve/CVE-2022-42333"">Info Link</a>"
CVE-2022-42334,,QEMU,"x86/HVM pinned cache attributes mis-handling T[his CNA information record relates to multiple CVEs; the text explains which aspects/vulnerabilities correspond to which CVE.] To allow cachability control for HVM guests with passed through devices, an interface exists to explicitly override defaults which would otherwise be put in place. While not exposed to the affected guests themselves, the interface specifically exists for domains controlling such guests. This interface may therefore be used by not fully privileged entities, e.g. qemu running deprivileged in Dom0 or qemu running in a so called stub-domain. With this exposure it is an issue that - the number of the such controlled regions was unbounded (CVE-2022-42333), - installation and removal of such regions was not properly serialized (CVE-2022-42334).",2023-03-27T00:15:08.203,"<a href=""https://cve.circl.lu/cve/CVE-2022-42334"">Info Link</a>"
CVE-2023-1544,,QEMU,"A flaw was found in the QEMU implementation of VMWare's paravirtual RDMA device. This flaw allows a crafted guest driver to allocate and initialize a huge number of page tables to be used as a ring of descriptors for CQ and async events, potentially leading to an out-of-bounds read and crash of QEMU.",2023-03-24T01:57:07.650,"<a href=""https://cve.circl.lu/cve/CVE-2023-1544"">Info Link</a>"
CVE-2022-0165,2.7,RDP,The Page Builder KingComposer WordPress plugin through 2.9.6 does not validate the id parameter before redirecting the user to it via the kc_get_thumbn AJAX action available to both unauthenticated and authenticated users,2023-03-27T18:37:29.723,"<a href=""https://cve.circl.lu/cve/CVE-2022-0165"">Info Link</a>"
CVE-2022-2460,5.9,RDP,"The WPDating WordPress plugin before 7.4.0 does not properly escape user input before concatenating it to certain SQL queries, leading to multiple SQL injection vulnerabilities exploitable by unauthenticated users",2023-03-24T14:15:09.827,"<a href=""https://cve.circl.lu/cve/CVE-2022-2460"">Info Link</a>"
CVE-2022-3141,5.9,RDP,"The Translate Multilingual sites WordPress plugin before 2.3.3 is vulnerable to an authenticated SQL injection. By adding a new language (via the settings page) containing specific special characters, the backticks in the SQL query can be surpassed and a time-based blind payload can be injected.",2023-03-27T18:15:11.913,"<a href=""https://cve.circl.lu/cve/CVE-2022-3141"">Info Link</a>"
CVE-2022-3142,5.9,RDP,"The NEX-Forms WordPress plugin before 7.9.7 does not properly sanitise and escape user input before using it in SQL statements, leading to SQL injections. The attack can be executed by anyone who is permitted to view the forms statistics chart, by default administrators, however can be configured otherwise via the plugin settings.",2023-03-27T18:15:12.003,"<a href=""https://cve.circl.lu/cve/CVE-2022-3142"">Info Link</a>"
CVE-2022-4371,5.9,RDP,"The Web Invoice WordPress plugin through 2.1.3 does not properly sanitize and escape a parameter before using it in a SQL statement, leading to a SQL Injection exploitable by high privilege users such as admin by default. However, depending on the plugin configuration, other users, such as subscriber could exploit this as well",2023-03-21T14:15:50.843,"<a href=""https://cve.circl.lu/cve/CVE-2022-4371"">Info Link</a>"
CVE-2023-0391,,Rapid7,"MGT-COMMERCE CloudPanel ships with a static SSL certificate to encrypt communications to the administrative interface, shared across every installation of CloudPanel. This behavior was observed in version 2.2.0. There has been no indication from the vendor this has been addressed in version 2.2.1.",2023-03-23T19:15:12.667,"<a href=""https://cve.circl.lu/cve/CVE-2023-0391"">Info Link</a>"
CVE-2018-18260,2.7,Red Hat,"** DISPUTED ** In the 2.4 version of Camaleon CMS, Stored XSS has been discovered. The profile image in the User settings section can be run in the update / upload area via /admin/media/upload?actions=false. NOTE: the vendor reports that they are ""unable to reproduce the reported issue on any version.""",2023-03-22T21:15:17.770,"<a href=""https://cve.circl.lu/cve/CVE-2018-18260"">Info Link</a>"
CVE-2023-28425,3.6,Redis,"Redis is an in-memory database that persists on disk. Starting in version 7.0.8 and prior to version 7.0.10, authenticated users can use the MSETNX command to trigger a runtime assertion and termination of the Redis server process. The problem is fixed in Redis version 7.0.10.",2023-03-24T18:13:08.233,"<a href=""https://cve.circl.lu/cve/CVE-2023-28425"">Info Link</a>"
CVE-2023-28859,,Redis,"redis-py through 4.5.3 leaves a connection open after canceling an async Redis command at an inopportune time (in the case of a non-pipeline operation), and can send response data to the client of an unrelated request. NOTE: this issue exists because of an incomplete fix for CVE-2023-28858.",2023-03-27T12:40:41.963,"<a href=""https://cve.circl.lu/cve/CVE-2023-28859"">Info Link</a>"
CVE-2023-1186,3.6,Remote Desktop,A vulnerability has been found in FabulaTech Webcam for Remote Desktop 2.8.42 and classified as problematic. This vulnerability affects the function 0x222010/0x222018 in the library ftwebcam.sys of the component IOCTL Handler. The manipulation leads to null pointer dereference. Attacking locally is a requirement. The exploit has been disclosed to the public and may be used. VDB-222358 is the identifier assigned to this vulnerability.,2023-03-26T10:15:06.813,"<a href=""https://cve.circl.lu/cve/CVE-2023-1186"">Info Link</a>"
CVE-2023-1188,3.6,Remote Desktop,A vulnerability was found in FabulaTech Webcam for Remote Desktop 2.8.42. It has been classified as problematic. Affected is the function 0x222018 in the library ftwebcam.sys of the component IoControlCode Handler. The manipulation leads to denial of service. The attack needs to be approached locally. The exploit has been disclosed to the public and may be used. The identifier of this vulnerability is VDB-222360.,2023-03-26T08:15:08.137,"<a href=""https://cve.circl.lu/cve/CVE-2023-1188"">Info Link</a>"
CVE-2023-1528,5.9,Remote Desktop,Use after free in Passwords in Google Chrome prior to 111.0.5563.110 allowed a remote attacker who had compromised the renderer process to potentially exploit heap corruption via a crafted HTML page. (Chromium security severity: High),2023-03-23T16:17:30.493,"<a href=""https://cve.circl.lu/cve/CVE-2023-1528"">Info Link</a>"
CVE-2023-1529,5.9,Remote Desktop,Out of bounds memory access in WebHID in Google Chrome prior to 111.0.5563.110 allowed a remote attacker to potentially exploit heap corruption via a malicious HID device. (Chromium security severity: High),2023-03-27T03:55:00.377,"<a href=""https://cve.circl.lu/cve/CVE-2023-1529"">Info Link</a>"
CVE-2023-1530,5.9,Remote Desktop,Use after free in PDF in Google Chrome prior to 111.0.5563.110 allowed a remote attacker to potentially exploit heap corruption via a crafted HTML page. (Chromium security severity: High),2023-03-23T15:49:01.167,"<a href=""https://cve.circl.lu/cve/CVE-2023-1530"">Info Link</a>"
CVE-2022-42906,5.9,Repository,"powerline-gitstatus (aka Powerline Gitstatus) before 1.3.2 allows arbitrary code execution. git repositories can contain per-repository configuration that changes the behavior of git, including running arbitrary commands. When using powerline-gitstatus, changing to a directory automatically runs git commands in order to display information about the current repository in the prompt. If an attacker can convince a user to change their current directory to one controlled by the attacker, such as in a shared filesystem or extracted archive, powerline-gitstatus will run arbitrary commands under the attacker's control. NOTE: this is similar to CVE-2022-20001.",2023-03-24T18:15:39.583,"<a href=""https://cve.circl.lu/cve/CVE-2022-42906"">Info Link</a>"
CVE-2023-1264,3.6,Repository,NULL Pointer Dereference in GitHub repository vim/vim prior to 9.0.1392.,2023-03-23T17:19:16.557,"<a href=""https://cve.circl.lu/cve/CVE-2023-1264"">Info Link</a>"
CVE-2023-1355,3.6,Repository,NULL Pointer Dereference in GitHub repository vim/vim prior to 9.0.1402.,2023-03-21T16:12:55.027,"<a href=""https://cve.circl.lu/cve/CVE-2023-1355"">Info Link</a>"
CVE-2023-25615,3.6,SAP,"Due to insufficient input sanitization, SAP ABAP - versions 751, 753, 753, 754, 756, 757, 791, allows an authenticated high privileged user to alter the current session of the user by injecting the malicious database queries over the network and gain access to the unintended data. This may lead to a high impact on the confidentiality and no impact on the availability and integrity of the application.",2023-03-22T20:15:12.533,"<a href=""https://cve.circl.lu/cve/CVE-2023-25615"">Info Link</a>"
CVE-2023-26459,3.7,SAP,"Due to improper input controls In SAP NetWeaver AS for ABAP and ABAP Platform - versions 700, 701, 702, 731, 740, 750, 751, 752, 753, 754, 755, 756, 757, 791, an attacker authenticated as a non-administrative user can craft a request which will trigger the application server to send a request to an arbitrary URL which can reveal, modify or make unavailable non-sensitive information, leading to low impact on Confidentiality, Integrity and Availability.",2023-03-21T15:44:14.100,"<a href=""https://cve.circl.lu/cve/CVE-2023-26459"">Info Link</a>"
CVE-2023-26461,3.6,SAP,"SAP NetWeaver allows (SAP Enterprise Portal) - version 7.50, allows an authenticated attacker with sufficient privileges to access the XML parser which can submit a crafted XML file which when parsed will enable them to access but not modify sensitive files and data. It allows the attacker to view sensitive data which is owned by certain privileges.",2023-03-21T17:14:38.390,"<a href=""https://cve.circl.lu/cve/CVE-2023-26461"">Info Link</a>"
CVE-2019-12163,1.4,SQL,GAT-Ship Web Module through 1.30 allows remote attackers to obtain potentially sensitive information via {} in a ws/gatshipWs.asmx/SqlVersion request.,2023-03-24T18:27:41.797,"<a href=""https://cve.circl.lu/cve/CVE-2019-12163"">Info Link</a>"
CVE-2021-3958,5.9,SQL,Improper Handling of Parameters vulnerability in Ipack Automation Systems Ipack SCADA Software allows : Blind SQL Injection.This issue affects Ipack SCADA Software: from unspecified before 1.1.0.,2023-03-26T20:15:07.267,"<a href=""https://cve.circl.lu/cve/CVE-2021-3958"">Info Link</a>"
CVE-2022-26986,5.9,SQL,"SQL Injection in ImpressCMS 1.4.3 and earlier allows remote attackers to inject into the code in unintended way, this allows an attacker to read and modify the sensitive information from the database used by the application. If misconfigured, an attacker can even upload a malicious web shell to compromise the entire system.",2023-03-27T18:15:11.163,"<a href=""https://cve.circl.lu/cve/CVE-2022-26986"">Info Link</a>"
CVE-2019-11538,4.0,SSL,"In Pulse Secure Pulse Connect Secure version 9.0RX before 9.0R3.4, 8.3RX before 8.3R7.1, 8.2RX before 8.2R12.1, and 8.1RX before 8.1R15.1, an NFS problem could allow an authenticated attacker to access the contents of arbitrary files on the affected device.",2023-03-24T17:49:25.157,"<a href=""https://cve.circl.lu/cve/CVE-2019-11538"">Info Link</a>"
CVE-2019-11542,5.9,SSL,"In Pulse Secure Pulse Connect Secure version 9.0RX before 9.0R3.4, 8.3RX before 8.3R7.1, 8.2RX before 8.2R12.1, and 8.1RX before 8.1R15.1 and Pulse Policy Secure version 9.0RX before 9.0R3.2, 5.4RX before 5.4R7.1, 5.3RX before 5.3R12.1, 5.2RX before 5.2R12.1, and 5.1RX before 5.1R15.1, an authenticated attacker (via the admin web interface) can send a specially crafted message resulting in a stack buffer overflow.",2023-03-24T17:49:45.373,"<a href=""https://cve.circl.lu/cve/CVE-2019-11542"">Info Link</a>"
CVE-2019-11507,2.7,SSL,"In Pulse Secure Pulse Connect Secure (PCS) 8.3.x before 8.3R7.1 and 9.0.x before 9.0R3, an XSS issue has been found on the Application Launcher page.",2023-03-24T17:49:57.187,"<a href=""https://cve.circl.lu/cve/CVE-2019-11507"">Info Link</a>"
CVE-2019-11508,5.9,SSL,"In Pulse Secure Pulse Connect Secure (PCS) before 8.1R15.1, 8.2 before 8.2R12.1, 8.3 before 8.3R7.1, and 9.0 before 9.0R3.4, an authenticated attacker (via the admin web interface) can exploit Directory Traversal to execute arbitrary code on the appliance.",2023-03-24T17:34:34.353,"<a href=""https://cve.circl.lu/cve/CVE-2019-11508"">Info Link</a>"
CVE-2022-3140,3.4,SharePoint,"LibreOffice supports Office URI Schemes to enable browser integration of LibreOffice with MS SharePoint server. An additional scheme 'vnd.libreoffice.command' specific to LibreOffice was added. In the affected versions of LibreOffice links using that scheme could be constructed to call internal macros with arbitrary arguments. Which when clicked on, or activated by document events, could result in arbitrary script execution without warning. This issue affects: The Document Foundation LibreOffice 7.4 versions prior to 7.4.1; 7.3 versions prior to 7.3.6.",2023-03-27T00:15:07.820,"<a href=""https://cve.circl.lu/cve/CVE-2022-3140"">Info Link</a>"
CVE-2023-23395,1.4,SharePoint,Microsoft SharePoint Server Spoofing Vulnerability,2023-03-20T21:19:19.997,"<a href=""https://cve.circl.lu/cve/CVE-2023-23395"">Info Link</a>"
