CVE,"Impact Score (1-10, 10 being the worst)",Keyword,Description,Last Modified,Link
CVE-2023-23935,1.4,Discourse,"Discourse is an open-source messaging platform. In versions 3.0.1 and prior on the `stable` branch and versions 3.1.0.beta2 and prior on the `beta` and `tests-passed` branches, the count of personal messages displayed for a tag is a count of all personal messages regardless of whether the personal message is visible to a given user. As a result, any users can technically poll a sensitive tag to determine if a new personal message is created even if the user does not have access to the personal message. In the patched versions, the count of personal messages tagged with a given tag is hidden by default. To revert to the old behaviour of displaying the count of personal messages for a given tag, an admin may enable the `display_personal_messages_tag_counts` site setting.",2023-03-23T14:57:04.963,"<a href=""https://cve.circl.lu/cve/CVE-2023-23935"">Info Link</a>"
CVE-2023-23622,1.4,Discourse,"Discourse is an open-source discussion platform. Prior to version 3.0.1 of the `stable` branch and version 3.1.0.beta2 of the `beta` and `tests-passed` branches, the count of topics displayed for a tag is a count of all regular topics regardless of whether the topic is in a read restricted category or not. As a result, any users can technically poll a sensitive tag to determine if a new topic is created in a category which the user does not have excess to. In version 3.0.1 of the `stable` branch and version 3.1.0.beta2 of the `beta` and `tests-passed` branches, the count of topics displayed for a tag defaults to only counting regular topics which are not in read restricted categories. Staff users will continue to see a count of all topics regardless of the topic's category read restrictions.",2023-03-23T20:21:36.680,"<a href=""https://cve.circl.lu/cve/CVE-2023-23622"">Info Link</a>"
CVE-2023-26040,2.7,Discourse,"Discourse is an open-source discussion platform. Between versions 3.1.0.beta2 and 3.1.0.beta3 of the `tests-passed` branch, editing or responding to a chat message containing malicious content could lead to a cross-site scripting attack. This issue is patched in version 3.1.0.beta3 of the `tests-passed` branch. There are no known workarounds.",2023-03-23T19:20:17.503,"<a href=""https://cve.circl.lu/cve/CVE-2023-26040"">Info Link</a>"
CVE-2023-25172,2.7,Discourse,"Discourse is an open-source discussion platform. Prior to version 3.0.1 of the `stable` branch and version 3.1.0.beta2 of the `beta` and `tests-passed` branches, a maliciously crafted URL can be included in a user's full name field to to carry out cross-site scripting attacks on sites with a disabled or overly permissive CSP (Content Security Policy). Discourse's default CSP prevents this vulnerability. The vulnerability is patched in version 3.0.1 of the `stable` branch and version 3.1.0.beta2 of the `beta` and `tests-passed` branches. As a workaround, enable and/or restore your site's CSP to the default one provided with Discourse.",2023-03-23T20:40:03.860,"<a href=""https://cve.circl.lu/cve/CVE-2023-25172"">Info Link</a>"
CVE-2023-28107,3.6,Discourse,"Discourse is an open-source discussion platform. Prior to version 3.0.2 of the `stable` branch and version 3.1.0.beta3 of the `beta` and `tests-passed` branches, a user logged as an administrator can request backups multiple times, which will eat up all the connections to the DB. If this is done on a site using multisite, then it can affect the whole cluster. The vulnerability is patched in version 3.0.2 of the `stable` branch and version 3.1.0.beta3 of the `beta` and `tests-passed` branches. There are no known workarounds.",2023-03-23T20:53:57.360,"<a href=""https://cve.circl.lu/cve/CVE-2023-28107"">Info Link</a>"
CVE-2023-28117,4.7,Django,"Sentry SDK is the official Python SDK for Sentry, real-time crash reporting software. When using the Django integration of versions prior to 1.14.0 of the Sentry SDK in a specific configuration it is possible to leak sensitive cookies values, including the session cookie to Sentry. These sensitive cookies could then be used by someone with access to your Sentry issues to impersonate or escalate their privileges within your application. In order for these sensitive values to be leaked, the Sentry SDK configuration must have `sendDefaultPII` set to `True`; one must use a custom name for either `SESSION_COOKIE_NAME` or `CSRF_COOKIE_NAME` in one's Django settings; and one must not be configured in one's organization or project settings to use Sentry's data scrubbing features to account for the custom cookie names. As of version 1.14.0, the Django integration of the `sentry-sdk` will detect the custom cookie names based on one's Django settings and will remove the values from the payload before sending the data to Sentry. As a workaround, use the SDK's filtering mechanism to remove the cookies from the payload that is sent to Sentry. For error events, this can be done with the `before_send` callback method and for performance related events (transactions) one can use the `before_send_transaction` callback method. Those who want to handle filtering of these values on the server-side can also use Sentry's advanced data scrubbing feature to account for the custom cookie names. Look for the `$http.cookies`, `$http.headers`, `$request.cookies`, or `$request.headers` fields to target with a scrubbing rule.",2023-03-23T01:03:10.803,"<a href=""https://cve.circl.lu/cve/CVE-2023-28117"">Info Link</a>"
CVE-2019-16884,3.6,Docker,"runc through 1.0.0-rc8, as used in Docker through 19.03.2-ce and other products, allows AppArmor restriction bypass because libcontainer/rootfs_linux.go incorrectly checks mount targets, and thus a malicious Docker image can mount over a /proc directory.",2023-03-27T18:15:10.387,"<a href=""https://cve.circl.lu/cve/CVE-2019-16884"">Info Link</a>"
CVE-2019-19921,5.9,Docker,"runc through 1.0.0-rc9 has Incorrect Access Control leading to Escalation of Privileges, related to libcontainer/rootfs_linux.go. To exploit this, an attacker must be able to spawn two containers with custom volume-mount configurations, and be able to run custom images. (This vulnerability does not affect Docker due to an implementation detail that happens to block the attack.)",2023-03-27T18:15:10.527,"<a href=""https://cve.circl.lu/cve/CVE-2019-19921"">Info Link</a>"
CVE-2023-28109,3.6,Docker,"Play With Docker is a browser-based Docker playground. Versions 0.0.2 and prior are vulnerable to domain hijacking. Because CORS configuration was not correct, an attacker could use `play-with-docker.com` as an example and set the origin header in an http request as `evil-play-with-docker.com`. The domain would echo in response header, which successfully bypassed the CORS policy and retrieved basic user information. This issue has been fixed in commit ed82247c9ab7990ad76ec2bf1498c2b2830b6f1a. There are no known workarounds.",2023-03-23T14:15:49.967,"<a href=""https://cve.circl.lu/cve/CVE-2023-28109"">Info Link</a>"
CVE-2023-28432,3.6,Docker,"Minio is a Multi-Cloud Object Storage framework. In a cluster deployment starting with RELEASE.2019-12-17T23-16-33Z and prior to RELEASE.2023-03-20T20-16-18Z, MinIO returns all environment variables, including `MINIO_SECRET_KEY` and `MINIO_ROOT_PASSWORD`, resulting in information disclosure. All users of distributed deployment are impacted. All users are advised to upgrade to RELEASE.2023-03-20T20-16-18Z.",2023-03-27T01:15:07.303,"<a href=""https://cve.circl.lu/cve/CVE-2023-28432"">Info Link</a>"
CVE-2023-28442,3.6,Docker,"GeoNode is an open source platform that facilitates the creation, sharing, and collaborative use of geospatial data. Prior to versions 2.20.6, 2.19.6, and 2.18.7, anonymous users can obtain sensitive information about GeoNode configurations from the response of the `/geoserver/rest/about/status` Geoserver REST API endpoint. The Geoserver endpoint is secured by default, but the configuration of Geoserver for GeoNode opens a list of REST endpoints to support some of its public-facing services. The vulnerability impacts both GeoNode 3 and GeoNode 4 instances. Geoserver security configuration is provided by `geoserver-geonode-ext`. A patch for 2.20.7 has been released which blocks access to the affected endpoint. The patch has been backported to branches 2.20.6, 2.19.7, 2.19.6, and 2.18.7. All the published artifacts and Docker images have been updated accordingly. A more advanced patch has been applied to the master and development versions, which require some changes to GeoNode code. They will be available with the next 4.1.0 release. The patched configuration only has an effect on new deployments. For existing setups, the patch must be applied manually inside the Geoserver data directory. The patched file must replace the existing `<geoserver_datadir>/security/rest.properties` file.",2023-03-24T01:57:07.650,"<a href=""https://cve.circl.lu/cve/CVE-2023-28442"">Info Link</a>"
CVE-2022-4933,5.9,Dolibarr,"A vulnerability, which was classified as critical, has been found in ATM Consulting dolibarr_module_quicksupplierprice up to 1.1.6. Affected by this issue is the function upatePrice of the file script/interface.php. The manipulation leads to sql injection. The attack may be launched remotely. Upgrading to version 1.1.7 is able to address this issue. The name of the patch is ccad1e4282b0e393a32fcc852e82ec0e0af5446f. It is recommended to upgrade the affected component. VDB-223382 is the identifier assigned to this vulnerability.",2023-03-24T19:05:48.167,"<a href=""https://cve.circl.lu/cve/CVE-2022-4933"">Info Link</a>"
CVE-2019-11068,5.9,Debian,libxslt through 1.1.33 allows bypass of a protection mechanism because callers of xsltCheckRead and xsltCheckWrite permit access even upon receiving a -1 error code. xsltCheckRead can return -1 for a crafted URL that is not actually invalid and is subsequently loaded.,2023-03-24T18:27:05.643,"<a href=""https://cve.circl.lu/cve/CVE-2019-11068"">Info Link</a>"
CVE-2019-12450,5.9,Debian,"file_copy_fallback in gio/gfile.c in GNOME GLib 2.15.0 through 2.61.1 does not properly restrict file permissions while a copy operation is in progress. Instead, default permissions are used.",2023-03-24T18:29:26.350,"<a href=""https://cve.circl.lu/cve/CVE-2019-12450"">Info Link</a>"
CVE-2019-0053,5.9,Debian,"Insufficient validation of environment variables in the telnet client supplied in Junos OS can lead to stack-based buffer overflows, which can be exploited to bypass veriexec restrictions on Junos OS. A stack-based overflow is present in the handling of environment variables when connecting via the telnet client to remote telnet servers. This issue only affects the telnet client — accessible from the CLI or shell — in Junos OS. Inbound telnet services are not affected by this issue. This issue affects: Juniper Networks Junos OS: 12.3 versions prior to 12.3R12-S13; 12.3X48 versions prior to 12.3X48-D80; 14.1X53 versions prior to 14.1X53-D130, 14.1X53-D49; 15.1 versions prior to 15.1F6-S12, 15.1R7-S4; 15.1X49 versions prior to 15.1X49-D170; 15.1X53 versions prior to 15.1X53-D237, 15.1X53-D496, 15.1X53-D591, 15.1X53-D69; 16.1 versions prior to 16.1R3-S11, 16.1R7-S4; 16.2 versions prior to 16.2R2-S9; 17.1 versions prior to 17.1R3; 17.2 versions prior to 17.2R1-S8, 17.2R2-S7, 17.2R3-S1; 17.3 versions prior to 17.3R3-S4; 17.4 versions prior to 17.4R1-S6, 17.4R2-S3, 17.4R3; 18.1 versions prior to 18.1R2-S4, 18.1R3-S3; 18.2 versions prior to 18.2R1-S5, 18.2R2-S2, 18.2R3; 18.2X75 versions prior to 18.2X75-D40; 18.3 versions prior to 18.3R1-S3, 18.3R2; 18.4 versions prior to 18.4R1-S2, 18.4R2.",2023-03-23T18:00:24.823,"<a href=""https://cve.circl.lu/cve/CVE-2019-0053"">Info Link</a>"
CVE-2019-16168,3.6,Debian,"In SQLite through 3.29.0, whereLoopAddBtreeIndex in sqlite3.c can crash a browser or other application because of missing validation of a sqlite_stat1 sz field, aka a ""severe division by zero in the query planner.""",2023-03-23T18:11:28.337,"<a href=""https://cve.circl.lu/cve/CVE-2019-16168"">Info Link</a>"
CVE-2023-27077,3.6,DDoS,Stack Overflow vulnerability found in 360 D901 allows a remote attacker to cause a Distributed Denial of Service (DDOS) via a crafted HTTP package.,2023-03-27T15:45:13.533,"<a href=""https://cve.circl.lu/cve/CVE-2023-27077"">Info Link</a>"
CVE-2023-24879,2.7,Dynamics 365,Microsoft Dynamics 365 (on-premises) Cross-site Scripting Vulnerability,2023-03-21T18:02:30.157,"<a href=""https://cve.circl.lu/cve/CVE-2023-24879"">Info Link</a>"
CVE-2023-27478,2.5,EMC,"libmemcached-awesome is an open source C/C++ client library and tools for the memcached server. `libmemcached` could return data for a previously requested key, if that previous request timed out due to a low `POLL_TIMEOUT`. This issue has been addressed in version 1.1.4. Users are advised to upgrade. There are several ways to workaround or lower the probability of this bug affecting a given deployment. 1: use a reasonably high `POLL_TIMEOUT` setting, like the default. 2: use separate libmemcached connections for unrelated data. 3: do not re-use libmemcached connections in an unknown state.",2023-03-23T16:59:14.237,"<a href=""https://cve.circl.lu/cve/CVE-2023-27478"">Info Link</a>"
CVE-2023-28098,3.6,EMC,"OpenSIPS is a Session Initiation Protocol (SIP) server implementation. Prior to versions 3.1.7 and 3.2.4, a specially crafted Authorization header causes OpenSIPS to crash or behave in an unexpected way due to a bug in the function `parse_param_name()` . This issue was discovered while performing coverage guided fuzzing of the function parse_msg. The AddressSanitizer identified that the issue occurred in the function `q_memchr()` which is being called by the function `parse_param_name()`. This issue may cause erratic program behaviour or a server crash. It affects configurations containing functions that make use of the affected code, such as the function `www_authorize()` . Versions 3.1.7 and 3.2.4 contain a fix.",2023-03-21T22:39:28.990,"<a href=""https://cve.circl.lu/cve/CVE-2023-28098"">Info Link</a>"
CVE-2021-21548,5.2,EMC,"Dell EMC Unisphere for PowerMax versions before 9.1.0.27, Dell EMC Unisphere for PowerMax Virtual Appliance versions before 9.1.0.27, and PowerMax OS Release 5978 contain an improper certificate validation vulnerability. An unauthenticated remote attacker may potentially exploit this vulnerability to carry out a man-in-the-middle attack by supplying a crafted certificate and intercepting the victim's traffic to view or modify a victim’s data in transit.",2023-03-24T13:30:57.810,"<a href=""https://cve.circl.lu/cve/CVE-2021-21548"">Info Link</a>"
CVE-2023-1570,1.4,EMC,"A vulnerability, which was classified as problematic, has been found in syoyo tinydng. Affected by this issue is the function __interceptor_memcpy of the file tiny_dng_loader.h. The manipulation leads to heap-based buffer overflow. Local access is required to approach this attack. The exploit has been disclosed to the public and may be used. Continious delivery with rolling releases is used by this product. Therefore, no version details of affected nor updated releases are available. It is recommended to apply a patch to fix this issue. VDB-223562 is the identifier assigned to this vulnerability.",2023-03-22T15:19:31.427,"<a href=""https://cve.circl.lu/cve/CVE-2023-1570"">Info Link</a>"
CVE-2023-27754,3.6,EMC,"vox2mesh 1.0 has stack-overflow in main.cpp, this is stack-overflow caused by incorrect use of memcpy() funciton. The flow allows an attacker to cause a denial of service (abort) via a crafted file.",2023-03-27T13:15:16.577,"<a href=""https://cve.circl.lu/cve/CVE-2023-27754"">Info Link</a>"
CVE-2019-11770,5.9,Eclipse,"In Eclipse Buildship versions prior to 3.1.1, the build files indicate that this project is resolving dependencies over HTTP instead of HTTPS. Any of these artifacts could have been MITM to maliciously compromise them and infect the build artifacts that were produced. Additionally, if any of these JARs or other dependencies were compromised, any developers using these could continue to be infected past updating to fix this.",2023-03-24T17:48:41.007,"<a href=""https://cve.circl.lu/cve/CVE-2019-11770"">Info Link</a>"
CVE-2019-11771,5.9,Eclipse,AIX builds of Eclipse OpenJ9 before 0.15.0 contain unused RPATHs which may facilitate code injection and privilege elevation by local users.,2023-03-24T17:48:52.927,"<a href=""https://cve.circl.lu/cve/CVE-2019-11771"">Info Link</a>"
CVE-2019-11774,5.2,Eclipse,"Prior to 0.1, all builds of Eclipse OMR contain a bug where the loop versioner may fail to privatize a value that is pulled out of the loop by versioning - for example if there is a condition that is moved out of the loop that reads a field we may not privatize the value of that field in the modified copy of the loop allowing the test to see one value of the field and subsequently the loop to see a modified field value without retesting the condition moved out of the loop. This can lead to a variety of different issues but read out of array bounds is one major consequence of these problems.",2023-03-24T17:49:06.513,"<a href=""https://cve.circl.lu/cve/CVE-2019-11774"">Info Link</a>"
CVE-2023-28431,3.6,Ethereum,"Frontier is an Ethereum compatibility layer for Substrate. Frontier's `modexp` precompile uses `num-bigint` crate under the hood. In the implementation prior to pull request 1017, the cases for modulus being even and modulus being odd are treated separately. Odd modulus uses the fast Montgomery multiplication, and even modulus uses the slow plain power algorithm. This gas cost discrepancy was not accounted for in the `modexp` precompile, leading to possible denial of service attacks. No fixes for `num-bigint` are currently available, and thus this issue is fixed in the short term by raising the gas costs for even modulus, and in the long term fixing it in `num-bigint` or switching to another modexp implementation. The short-term fix for Frontier is deployed at pull request 1017. There are no known workarounds aside from applying the fix.",2023-03-23T01:02:56.037,"<a href=""https://cve.circl.lu/cve/CVE-2023-28431"">Info Link</a>"
CVE-2022-41104,3.6,Excel,Microsoft Excel Security Feature Bypass Vulnerability.,2023-03-24T17:00:03.893,"<a href=""https://cve.circl.lu/cve/CVE-2022-41104"">Info Link</a>"
CVE-2023-23396,3.6,Excel,Microsoft Excel Denial of Service Vulnerability,2023-03-20T21:20:32.613,"<a href=""https://cve.circl.lu/cve/CVE-2023-23396"">Info Link</a>"
CVE-2023-23398,3.6,Excel,Microsoft Excel Spoofing Vulnerability,2023-03-20T21:22:32.353,"<a href=""https://cve.circl.lu/cve/CVE-2023-23398"">Info Link</a>"
CVE-2023-23399,5.9,Excel,Microsoft Excel Remote Code Execution Vulnerability,2023-03-20T21:22:44.917,"<a href=""https://cve.circl.lu/cve/CVE-2023-23399"">Info Link</a>"
CVE-2004-1349,2.9,Exchange,"gzip before 1.3 in Solaris 8, when called with the -f or -force flags, will change the permissions of files that are hard linked to the target files, which allows local users to view or modify these files.",2023-03-24T18:12:47.250,"<a href=""https://cve.circl.lu/cve/CVE-2004-1349"">Info Link</a>"
CVE-2018-1858,5.9,Exchange,IBM API Connect 5.0.0.0 through 5.0.8.6 is vulnerable to cross-site request forgery which could allow an attacker to execute malicious and unauthorized actions transmitted from a user that the website trusts. IBM X-Force ID: 151256.,2023-03-24T18:08:51.960,"<a href=""https://cve.circl.lu/cve/CVE-2018-1858"">Info Link</a>"
CVE-2021-30465,6.0,Exchange,"runc before 1.0.0-rc95 allows a Container Filesystem Breakout via Directory Traversal. To exploit the vulnerability, an attacker must be able to create multiple containers with a fairly specific mount configuration. The problem occurs via a symlink-exchange attack that relies on a race condition.",2023-03-27T18:15:10.693,"<a href=""https://cve.circl.lu/cve/CVE-2021-30465"">Info Link</a>"
CVE-2023-0361,3.6,Exchange,"A timing side-channel in the handling of RSA ClientKeyExchange messages was discovered in GnuTLS. This side-channel can be sufficient to recover the key encrypted in the RSA ciphertext across a network in a Bleichenbacher style attack. To achieve a successful decryption the attacker would need to send a large amount of specially crafted messages to the vulnerable server. By recovering the secret from the ClientKeyExchange message, the attacker would be able to decrypt the application data exchanged over that connection.",2023-03-24T16:15:08.417,"<a href=""https://cve.circl.lu/cve/CVE-2023-0361"">Info Link</a>"
CVE-2020-4556,1.4,Exchange,IBM Financial Transaction Manager for High Value Payments for Multi-Platform 3.2.0 through 3.2.10 allows web pages to be stored locally which can be read by another user on the system. IBM X-Force ID: 183329.,2023-03-22T15:55:39.420,"<a href=""https://cve.circl.lu/cve/CVE-2020-4556"">Info Link</a>"
CVE-2018-4844,5.2,Exploit,"A vulnerability has been identified in SIMATIC WinCC OA UI for Android (All versions < V3.15.10), SIMATIC WinCC OA UI for iOS (All versions < V3.15.10). Insufficient limitation of CONTROL script capabilities could allow read and write access from one HMI project cache folder to other HMI project cache folders within the app's sandbox on the same mobile device. This includes HMI project cache folders of other configured WinCC OA servers. The security vulnerability could be exploited by an attacker who tricks an app user to connect to an attacker-controlled WinCC OA server. Successful exploitation requires user interaction and read/write access to the app's folder on a mobile device. The vulnerability could allow reading data from and writing data to the app's folder. At the time of advisory publication no public exploitation of this security vulnerability was known. Siemens confirms the security vulnerability and provides mitigations to resolve the security issue.",2023-03-24T17:36:26.793,"<a href=""https://cve.circl.lu/cve/CVE-2018-4844"">Info Link</a>"
CVE-2018-4841,5.9,Exploit,"A vulnerability has been identified in TIM 1531 IRC (All versions < V1.1). A remote attacker with network access to port 80/tcp or port 443/tcp could perform administrative operations on the device without prior authentication. Successful exploitation could allow to cause a denial-of-service, or read and manipulate data as well as configuration settings of the affected device. At the stage of publishing this security advisory no public exploitation is known. Siemens provides mitigations to resolve it.",2023-03-24T17:36:34.353,"<a href=""https://cve.circl.lu/cve/CVE-2018-4841"">Info Link</a>"
CVE-2018-3822,5.9,Exploit,"X-Pack Security versions 6.2.0, 6.2.1, and 6.2.2 are vulnerable to a user impersonation attack via incorrect XML canonicalization and DOM traversal. An attacker might have been able to impersonate a legitimate user if the SAML Identity Provider allows for self registration with arbitrary identifiers and the attacker can register an account which an identifier that shares a suffix with a legitimate account. Both of those conditions must be true in order to exploit this flaw.",2023-03-24T17:29:41.633,"<a href=""https://cve.circl.lu/cve/CVE-2018-3822"">Info Link</a>"
CVE-2018-4845,5.9,Exploit,"A vulnerability has been identified in RAPIDLab 1200 systems / RAPIDPoint 400 systems / RAPIDPoint 500 systems (All versions_without_ use of Siemens Healthineers Informatics products), RAPIDLab 1200 Series (All versions < V3.3 _with_ Siemens Healthineers Informatics products), RAPIDPoint 500 systems (All versions >= V3.0 _with_ Siemens Healthineers Informatics products), RAPIDPoint 500 systems (V2.4.X_with_ Siemens Healthineers Informatics products), RAPIDPoint 500 systems (All versions =< V2.3 _with_ Siemens Healthineers Informatics products), RAPIDPoint 400 systems (All versions _with_ Siemens Healthineers Informatics products). Remote attackers with either local or remote credentialed access to the ""Remote View"" feature might be able to elevate their privileges, compromising confidentiality, integrity, and availability of the system. No special skills or user interaction are required to perform this attack. At the time of advisory publication, no public exploitation of this security vulnerability is known. Siemens Healthineers confirms the security vulnerability and provides mitigations to resolve the security issue.",2023-03-24T17:32:06.353,"<a href=""https://cve.circl.lu/cve/CVE-2018-4845"">Info Link</a>"
CVE-2018-3929,5.9,Exploit,"An exploitable heap corruption exists in the PowerPoint document conversion functionality of the Antenna House Office Server Document Converter version V6.1 Pro MR2 for Linux64 (6,1,2018,0312). A crafted PowerPoint (PPT) document can lead to heap corruption, resulting in remote code execution.",2023-03-24T17:31:30.753,"<a href=""https://cve.circl.lu/cve/CVE-2018-3929"">Info Link</a>"
CVE-2021-36783,6.0,Endpoint,"A Insufficiently Protected Credentials vulnerability in SUSE Rancher allows authenticated Cluster Owners, Cluster Members, Project Owners and Project Members to read credentials, passwords and API tokens that have been stored in cleartext and exposed via API endpoints. This issue affects: SUSE Rancher Rancher versions prior to 2.6.4; Rancher versions prior to 2.5.13.",2023-03-23T17:20:14.077,"<a href=""https://cve.circl.lu/cve/CVE-2021-36783"">Info Link</a>"
CVE-2022-1278,3.6,Endpoint,"A flaw was found in WildFly, where an attacker can see deployment names, endpoints, and any other data the trace payload may contain.",2023-03-22T18:04:57.793,"<a href=""https://cve.circl.lu/cve/CVE-2022-1278"">Info Link</a>"
