CVE,"Impact Score (1-10, 10 being the worst)",Keyword,Description,Last Modified,Link
CVE-2022-40684,5.9,Fortinet,"An authentication bypass using an alternate path or channel [CWE-288] in Fortinet FortiOS version 7.2.0 through 7.2.1 and 7.0.0 through 7.0.6, FortiProxy version 7.2.0 and version 7.0.0 through 7.0.6 and FortiSwitchManager version 7.2.0 and 7.0.0 allows an unauthenticated atttacker to perform operations on the administrative interface via specially crafted HTTP or HTTPS requests.",2023-03-27T18:15:12.080,"<a href=""https://cve.circl.lu/cve/CVE-2022-40684"">Info Link</a>"
CVE-2021-4105,5.9,Firewall,Improper Handling of Parameters vulnerability in BG-TEK COSLAT Firewall allows Remote Code Inclusion.This issue affects COSLAT Firewall: from 5.24.0.R.20180630 before 5.24.0.R.20210727.,2023-03-26T21:15:06.690,"<a href=""https://cve.circl.lu/cve/CVE-2021-4105"">Info Link</a>"
CVE-2023-27595,5.9,Firewall,"Cilium is a networking, observability, and security solution with an eBPF-based dataplane. In version 1.13.0, when Cilium is started, there is a short period when Cilium eBPF programs are not attached to the host. During this period, the host does not implement any of Cilium's featureset. This can cause disruption to newly established connections during this period due to the lack of Load Balancing, or can cause Network Policy bypass due to the lack of Network Policy enforcement during the window. This vulnerability impacts any Cilium-managed endpoints on the node (such as Kubernetes Pods), as well as the host network namespace (including Host Firewall). This vulnerability is fixed in Cilium 1.13.1 or later. Cilium releases 1.12.x, 1.11.x, and earlier are not affected. There are no known workarounds.",2023-03-24T16:37:25.810,"<a href=""https://cve.circl.lu/cve/CVE-2023-27595"">Info Link</a>"
CVE-2023-20107,1.4,Firewall,"A vulnerability in the deterministic random bit generator (DRBG), also known as pseudorandom number generator (PRNG), in Cisco Adaptive Security Appliance (ASA) Software and Cisco Firepower Threat Defense (FTD) Software for Cisco ASA 5506-X, ASA 5508-X, and ASA 5516-X Firewalls could allow an unauthenticated, remote attacker to cause a cryptographic collision, enabling the attacker to discover the private key of an affected device. This vulnerability is due to insufficient entropy in the DRBG for the affected hardware platforms when generating cryptographic keys. An attacker could exploit this vulnerability by generating a large number of cryptographic keys on an affected device and looking for collisions with target devices. A successful exploit could allow the attacker to impersonate an affected target device or to decrypt traffic secured by an affected key that is sent to or from an affected target device.",2023-03-24T01:57:07.650,"<a href=""https://cve.circl.lu/cve/CVE-2023-20107"">Info Link</a>"
CVE-2023-27042,,Firewall,Tenda AX3 V16.03.12.11 is vulnerable to Buffer Overflow via /goform/SetFirewallCfg.,2023-03-27T12:40:41.963,"<a href=""https://cve.circl.lu/cve/CVE-2023-27042"">Info Link</a>"
CVE-2019-13107,5.9,GIS,"Multiple integer overflows exist in MATIO before 1.5.16, related to mat.c, mat4.c, mat5.c, mat73.c, and matvar_struct.c",2023-03-24T18:05:58.597,"<a href=""https://cve.circl.lu/cve/CVE-2019-13107"">Info Link</a>"
CVE-2022-41418,5.9,GIS,An issue in the component BlogEngine/BlogEngine.NET/AppCode/Api/UploadController.cs of BlogEngine.NET v3.3.8.0 allows attackers to execute arbitrary code via uploading a crafted PNG file.,2023-03-22T00:15:12.163,"<a href=""https://cve.circl.lu/cve/CVE-2022-41418"">Info Link</a>"
CVE-2023-1114,5.9,GIS,"Improper Input Validation, Missing Authorization vulnerability in Eskom Bilgisayar e-Belediye allows Information Elicitation.This issue affects e-Belediye: from 1.0.0.95 before 1.0.0.100.",2023-03-26T20:15:09.143,"<a href=""https://cve.circl.lu/cve/CVE-2023-1114"">Info Link</a>"
CVE-2023-27561,5.9,GIS,"runc through 1.1.4 has Incorrect Access Control leading to Escalation of Privileges, related to libcontainer/rootfs_linux.go. To exploit this, an attacker must be able to spawn two containers with custom volume-mount configurations, and be able to run custom images. NOTE: this issue exists because of a CVE-2019-19921 regression.",2023-03-27T18:15:12.190,"<a href=""https://cve.circl.lu/cve/CVE-2023-27561"">Info Link</a>"
CVE-2022-3573,2.7,GitLab,"An issue has been discovered in GitLab CE/EE affecting all versions starting from 15.4 before 15.5.7, all versions starting from 15.6 before 15.6.4, all versions starting from 15.7 before 15.7.2. Due to the improper filtering of query parameters in the wiki changes page, an attacker can execute arbitrary JavaScript on the self-hosted instances running without strict CSP.",2023-03-22T16:19:06.077,"<a href=""https://cve.circl.lu/cve/CVE-2022-3573"">Info Link</a>"
CVE-2023-0804,3.6,GitLab,"LibTIFF 4.4.0 has an out-of-bounds write in tiffcrop in tools/tiffcrop.c:3609, allowing attackers to cause a denial-of-service via a crafted tiff file. For users that compile libtiff from sources, the fix is available with commit 33aee127.",2023-03-24T16:15:08.503,"<a href=""https://cve.circl.lu/cve/CVE-2023-0804"">Info Link</a>"
CVE-2023-28119,3.6,Golang,"The crewjam/saml go library contains a partial implementation of the SAML standard in golang. Prior to version 0.4.13, the package's use of `flate.NewReader` does not limit the size of the input. The user can pass more than 1 MB of data in the HTTP request to the processing functions, which will be decompressed server-side using the Deflate algorithm. Therefore, after repeating the same request multiple times, it is possible to achieve a reliable crash since the operating system kills the process. This issue is patched in version 0.4.13.",2023-03-23T01:03:10.803,"<a href=""https://cve.circl.lu/cve/CVE-2023-28119"">Info Link</a>"
CVE-2017-18381,5.9,Google,The installation process in Open edX before 2017-01-10 exposes a MongoDB instance to external connections with default credentials.,2023-03-24T18:11:27.457,"<a href=""https://cve.circl.lu/cve/CVE-2017-18381"">Info Link</a>"
CVE-2022-35583,5.9,Google,wkhtmlTOpdf 0.12.6 is vulnerable to SSRF which allows an attacker to get initial access into the target's system by injecting iframe tag with initial asset IP address on it's source. This allows the attacker to takeover the whole infrastructure by accessing their internal assets.,2023-03-24T19:15:07.130,"<a href=""https://cve.circl.lu/cve/CVE-2022-35583"">Info Link</a>"
CVE-2022-1471,5.9,Google,SnakeYaml's Constructor() class does not restrict types which can be instantiated during deserialization. Deserializing yaml content provided by an attacker can lead to remote code execution. We recommend using SnakeYaml's SafeConsturctor when parsing untrusted content to restrict deserialization.,2023-03-21T13:17:25.593,"<a href=""https://cve.circl.lu/cve/CVE-2022-1471"">Info Link</a>"
CVE-2022-23491,3.6,Google,"Certifi is a curated collection of Root Certificates for validating the trustworthiness of SSL certificates while verifying the identity of TLS hosts. Certifi 2022.12.07 removes root certificates from ""TrustCor"" from the root store. These are in the process of being removed from Mozilla's trust store. TrustCor's root certificates are being removed pursuant to an investigation prompted by media reporting that TrustCor's ownership also operated a business that produced spyware. Conclusions of Mozilla's investigation can be found in the linked google group discussion.",2023-03-24T18:12:24.360,"<a href=""https://cve.circl.lu/cve/CVE-2022-23491"">Info Link</a>"
CVE-2023-1007,5.9,Google,A vulnerability was found in Twister Antivirus 8.17. It has been declared as critical. This vulnerability affects the function 0x801120E4 in the library filmfd.sys of the component IoControlCode Handler. The manipulation leads to improper access controls. The attack needs to be approached locally. The exploit has been disclosed to the public and may be used. The identifier of this vulnerability is VDB-221740.,2023-03-26T08:15:07.777,"<a href=""https://cve.circl.lu/cve/CVE-2023-1007"">Info Link</a>"
CVE-2019-13068,2.5,Grafana,public/app/features/panel/panel_ctrl.ts in Grafana before 6.2.5 allows HTML Injection in panel drilldown links (via the Title or url field).,2023-03-27T18:15:10.273,"<a href=""https://cve.circl.lu/cve/CVE-2019-13068"">Info Link</a>"
CVE-2023-1410,2.7,Grafana,"Grafana is an open-source platform for monitoring and observability. Grafana had a stored XSS vulnerability in the Graphite FunctionDescription tooltip. The stored XSS vulnerability was possible due the value of the Function Description was not properly sanitized. An attacker needs to have control over the Graphite data source in order to manipulate a function description and a Grafana admin needs to configure the data source, later a Grafana user needs to select a tampered function and hover over the description. Users may upgrade to version 8.5.22, 9.2.15 and 9.3.11 to receive a fix.",2023-03-27T16:23:06.623,"<a href=""https://cve.circl.lu/cve/CVE-2023-1410"">Info Link</a>"
CVE-2017-10616,1.4,GitHub,The ifmap service that comes bundled with Juniper Networks Contrail releases uses hard coded credentials. Affected releases are Contrail releases 2.2 prior to 2.21.4; 3.0 prior to 3.0.3.4; 3.1 prior to 3.1.4.0; 3.2 prior to 3.2.5.0. CVE-2017-10616 and CVE-2017-10617 can be chained together and have a combined CVSSv3 score of 5.8 (CVSS:3.0/AV:N/AC:L/PR:N/UI:N/S:C/C:L/I:N/A:N).,2023-03-24T18:09:08.677,"<a href=""https://cve.circl.lu/cve/CVE-2017-10616"">Info Link</a>"
CVE-2017-16009,2.7,GitHub,"ag-grid is an advanced data grid that is library agnostic. ag-grid is vulnerable to Cross-site Scripting (XSS) via Angular Expressions, if AngularJS is used in combination with ag-grid.",2023-03-24T18:10:59.447,"<a href=""https://cve.circl.lu/cve/CVE-2017-16009"">Info Link</a>"
CVE-2019-11334,1.4,GitHub,An authentication bypass in website post requests in the Tzumi Electronics Klic Lock application 1.0.9 for mobile devices allows attackers to access resources (that are not otherwise accessible without proper authentication) via capture-replay. Physically proximate attackers can use this information to unlock unauthorized Tzumi Electronics Klic Smart Padlock Model 5686 Firmware 6.2.,2023-03-24T18:06:12.273,"<a href=""https://cve.circl.lu/cve/CVE-2019-11334"">Info Link</a>"
CVE-2022-37940,1.4,HPE,Potential security vulnerabilities have been identified in the HPE FlexFabric 5700 Switch Series. These vulnerabilities could be remotely exploited to allow host header injection and URL redirection. HPE has made the following software to resolve the vulnerability in HPE FlexFabric 5700 Switch Series version R2432P61 or later.,2023-03-22T12:48:04.240,"<a href=""https://cve.circl.lu/cve/CVE-2022-37940"">Info Link</a>"
CVE-2023-28083,2.7,HPE,"A remote Cross-site Scripting vulnerability was discovered in HPE Integrated Lights-Out 6 (iLO 6), Integrated Lights-Out 5 (iLO 5) and Integrated Lights-Out 4 (iLO 4). HPE has provided software updates to resolve this vulnerability in HPE Integrated Lights-Out.",2023-03-24T20:20:46.390,"<a href=""https://cve.circl.lu/cve/CVE-2023-28083"">Info Link</a>"
CVE-2023-23411,4.0,Hyper-V,Windows Hyper-V Denial of Service Vulnerability,2023-03-23T16:54:56.477,"<a href=""https://cve.circl.lu/cve/CVE-2023-23411"">Info Link</a>"
CVE-2023-27875,3.6,IBM,IBM Aspera Faspex 5.0.4 could allow a user to change other user's credentials due to improper access controls. IBM X-Force ID: 249847.,2023-03-22T00:57:46.697,"<a href=""https://cve.circl.lu/cve/CVE-2023-27875"">Info Link</a>"
CVE-2023-1638,3.6,IOBit,A vulnerability was found in IObit Malware Fighter 9.4.0.776. It has been rated as problematic. Affected by this issue is the function 0x8001E024/0x8001E040 in the library ImfRegistryFilter.sys of the component IOCTL Handler. The manipulation leads to denial of service. Attacking locally is a requirement. The exploit has been disclosed to the public and may be used. VDB-224018 is the identifier assigned to this vulnerability.,2023-03-27T12:40:41.963,"<a href=""https://cve.circl.lu/cve/CVE-2023-1638"">Info Link</a>"
CVE-2023-1639,3.6,IOBit,A vulnerability classified as problematic has been found in IObit Malware Fighter 9.4.0.776. This affects the function 0x8001E04C in the library ImfRegistryFilter.sys of the component IOCTL Handler. The manipulation leads to denial of service. It is possible to launch the attack on the local host. The exploit has been disclosed to the public and may be used. The associated identifier of this vulnerability is VDB-224019.,2023-03-27T12:40:41.963,"<a href=""https://cve.circl.lu/cve/CVE-2023-1639"">Info Link</a>"
CVE-2023-1640,3.6,IOBit,A vulnerability classified as problematic was found in IObit Malware Fighter 9.4.0.776. This vulnerability affects the function 0x222010 in the library ObCallbackProcess.sys of the component IOCTL Handler. The manipulation leads to denial of service. The attack needs to be approached locally. The exploit has been disclosed to the public and may be used. The identifier of this vulnerability is VDB-224020.,2023-03-27T12:40:41.963,"<a href=""https://cve.circl.lu/cve/CVE-2023-1640"">Info Link</a>"
CVE-2023-1641,3.6,IOBit,"A vulnerability, which was classified as problematic, has been found in IObit Malware Fighter 9.4.0.776. This issue affects the function 0x222018 in the library ObCallbackProcess.sys of the component IOCTL Handler. The manipulation leads to denial of service. An attack has to be approached locally. The exploit has been disclosed to the public and may be used. The identifier VDB-224021 was assigned to this vulnerability.",2023-03-27T12:40:41.963,"<a href=""https://cve.circl.lu/cve/CVE-2023-1641"">Info Link</a>"
CVE-2023-1642,3.6,IOBit,"A vulnerability, which was classified as problematic, was found in IObit Malware Fighter 9.4.0.776. Affected is the function 0x222034/0x222038/0x22203C/0x222040 in the library ObCallbackProcess.sys of the component IOCTL Handler. The manipulation leads to denial of service. Local access is required to approach this attack. The exploit has been disclosed to the public and may be used. VDB-224022 is the identifier assigned to this vulnerability.",2023-03-27T12:40:41.963,"<a href=""https://cve.circl.lu/cve/CVE-2023-1642"">Info Link</a>"
CVE-2018-3930,5.9,Intel,"In Antenna House Office Server Document Converter version V6.1 Pro MR2 for Linux64 (6,1,2018,0312), a crafted Microsoft Word (DOC) document can lead to an out-of-bounds write, resulting in remote code execution. This vulnerability occurs in the `vbgetfp` method.",2023-03-24T17:31:17.233,"<a href=""https://cve.circl.lu/cve/CVE-2018-3930"">Info Link</a>"
CVE-2018-3923,5.9,Intel,"A memory corruption vulnerability exists in the PCX-parsing functionality of Computerinsel Photoline 20.54. A specially crafted PCX image processed via the application can lead to an out-of-bounds write, overwriting arbitrary data. An attacker can deliver a PCX image to trigger this vulnerability and gain code execution.",2023-03-24T17:30:53.883,"<a href=""https://cve.circl.lu/cve/CVE-2018-3923"">Info Link</a>"
CVE-2019-11092,2.5,Intel,Insufficient password protection in the attestation database for Open CIT may allow an authenticated user to potentially enable information disclosure via local access.,2023-03-24T18:07:34.690,"<a href=""https://cve.circl.lu/cve/CVE-2019-11092"">Info Link</a>"
CVE-2023-27271,3.6,Intel,"In SAP BusinessObjects Business Intelligence Platform (Web Services) - versions 420, 430, an attacker can control a malicious BOE server, forcing the application server to connect to its own admintools, leading to a high impact on availability.",2023-03-21T15:53:06.163,"<a href=""https://cve.circl.lu/cve/CVE-2023-27271"">Info Link</a>"
CVE-2023-28096,3.6,IoT,"OpenSIPS, a Session Initiation Protocol (SIP) server implementation, has a memory leak starting in the 2.3 branch and priot to versions 3.1.8 and 3.2.5. The memory leak was detected in the function `parse_mi_request` while performing coverage-guided fuzzing. This issue can be reproduced by sending multiple requests of the form `{""jsonrpc"": ""2.0"",""method"": ""log_le`. This malformed message was tested against an instance of OpenSIPS via FIFO transport layer and was found to increase the memory consumption over time. To abuse this memory leak, attackers need to reach the management interface (MI) which typically should only be exposed on trusted interfaces. In cases where the MI is exposed to the internet without authentication, abuse of this issue will lead to memory exhaustion which may affect the underlying system’s availability. No authentication is typically required to reproduce this issue. On the other hand, memory leaks may occur in other areas of OpenSIPS where the cJSON library is used for parsing JSON objects. The issue has been fixed in versions 3.1.8 and 3.2.5.",2023-03-21T19:23:06.670,"<a href=""https://cve.circl.lu/cve/CVE-2023-28096"">Info Link</a>"
CVE-2023-24678,3.6,IoT,A vulnerability in Centralite Pearl Thermostat 0x04075010 allows attackers to cause a Denial of Service (DoS) via a crafted Zigbee message.,2023-03-24T16:36:19.250,"<a href=""https://cve.circl.lu/cve/CVE-2023-24678"">Info Link</a>"
CVE-2023-28116,5.9,IoT,"Contiki-NG is an open-source, cross-platform operating system for internet of things (IoT) devices. In versions 4.8 and prior, an out-of-bounds write can occur in the BLE L2CAP module of the Contiki-NG operating system. The network stack of Contiki-NG uses a global buffer (packetbuf) for processing of packets, with the size of PACKETBUF_SIZE. In particular, when using the BLE L2CAP module with the default configuration, the PACKETBUF_SIZE value becomes larger then the actual size of the packetbuf. When large packets are processed by the L2CAP module, a buffer overflow can therefore occur when copying the packet data to the packetbuf. The vulnerability has been patched in the ""develop"" branch of Contiki-NG, and will be included in release 4.9. The problem can be worked around by applying the patch manually.",2023-03-24T16:40:15.840,"<a href=""https://cve.circl.lu/cve/CVE-2023-28116"">Info Link</a>"
CVE-2023-25017,5.2,IoT,RIFARTEK IOT Wall has a vulnerability of incorrect authorization. An authenticated remote attacker with general user privilege is allowed to perform specific privileged function to access and modify all sensitive data.,2023-03-27T12:40:41.963,"<a href=""https://cve.circl.lu/cve/CVE-2023-25017"">Info Link</a>"
CVE-2023-25018,2.7,IoT,RIFARTEK IOT Wall transportation function has insufficient filtering for user input. An authenticated remote attacker with general user privilege can inject JavaScript to perform reflected XSS (Reflected Cross-site scripting) attack.,2023-03-27T12:40:41.963,"<a href=""https://cve.circl.lu/cve/CVE-2023-25018"">Info Link</a>"
CVE-2023-0681,2.7,Insight,"Rapid7 InsightVM versions 6.6.178 and lower suffers from an open redirect vulnerability, whereby an attacker has the ability to redirect the user to a site of the attacker’s choice using the ‘page’ parameter of the ‘data/console/redirect’ component of the application. This issue was resolved in the February, 2023 release of version 6.6.179.",2023-03-23T19:06:55.657,"<a href=""https://cve.circl.lu/cve/CVE-2023-0681"">Info Link</a>"
CVE-2023-1304,,Insight,"An authenticated attacker can leverage an exposed getattr() method via a Jinja template to smuggle OS commands and perform other actions that are normally expected to be private methods. This issue was resolved in the Managed and SaaS deployments on February 1, 2023, and in version 23.2.1 of the Self-Managed version of InsightCloudSec.",2023-03-21T20:07:21.987,"<a href=""https://cve.circl.lu/cve/CVE-2023-1304"">Info Link</a>"
CVE-2023-1305,,Insight,"An authenticated attacker can leverage an exposed “box” object to read and write arbitrary files from disk, provided those files can be parsed as yaml or JSON. This issue was resolved in the Managed and SaaS deployments on February 1, 2023, and in version 23.2.1 of the Self-Managed version of InsightCloudSec.",2023-03-21T20:07:21.987,"<a href=""https://cve.circl.lu/cve/CVE-2023-1305"">Info Link</a>"
CVE-2023-1306,,Insight,"An authenticated attacker can leverage an exposed resource.db() accessor method to smuggle Python method calls via a Jinja template, which can lead to code execution. This issue was resolved in the Managed and SaaS deployments on February 1, 2023, and in version 23.2.1 of the Self-Managed version of InsightCloudSec.",2023-03-21T20:07:21.987,"<a href=""https://cve.circl.lu/cve/CVE-2023-1306"">Info Link</a>"
CVE-2021-3844,5.2,Insight,"Rapid7 InsightVM suffers from insufficient session expiration when an administrator performs a security relevant edit on an existing, logged on user. For example, if a user's password is changed by an administrator due to an otherwise unrelated credential leak, that user account's current session is still valid after the password change, potentially allowing the attacker who originally compromised the credential to remain logged in and able to cause further damage. This vulnerability is mitigated by the use of the Platform Login feature. This issue is related to CVE-2019-5638.",2023-03-24T17:57:03.163,"<a href=""https://cve.circl.lu/cve/CVE-2021-3844"">Info Link</a>"
CVE-2021-43113,5.9,Java,iTextPDF in iText 7 and up to (excluding 4.4.13.3) 7.1.17 allows command injection via a CompareTool filename that is mishandled on the gs (aka Ghostscript) command line in GhostscriptHelper.java.,2023-03-24T22:15:06.940,"<a href=""https://cve.circl.lu/cve/CVE-2021-43113"">Info Link</a>"
CVE-2023-25617,5.9,Java,"SAP Business Object (Adaptive Job Server) - versions 420, 430, allows remote execution of arbitrary commands on Unix, when program objects execution is enabled, to authenticated users with scheduling rights, using the BI Launchpad, Central Management Console or a custom application based on the public java SDK. Programs could impact the confidentiality, integrity and availability of the system.",2023-03-22T18:15:14.070,"<a href=""https://cve.circl.lu/cve/CVE-2023-25617"">Info Link</a>"
CVE-2023-26460,1.4,Java,"Cache Management Service in SAP NetWeaver Application Server for Java - version 7.50, does not perform any authentication checks for functionalities that require user identity",2023-03-22T14:42:17.340,"<a href=""https://cve.circl.lu/cve/CVE-2023-26460"">Info Link</a>"
CVE-2023-27268,1.4,Java,"SAP NetWeaver AS Java (Object Analyzing Service) - version 7.50, does not perform necessary authorization checks, allowing an unauthenticated attacker to attach to an open interface and make use of an open naming and directory API to access a service which will enable them to access but not modify server settings and data with no effect on availability., resulting in escalation of privileges.",2023-03-21T17:12:46.327,"<a href=""https://cve.circl.lu/cve/CVE-2023-27268"">Info Link</a>"
CVE-2023-28685,4.2,Jenkins,Jenkins AbsInt a³ Plugin 1.1.0 and earlier does not configure its XML parser to prevent XML external entity (XXE) attacks.,2023-03-24T20:29:16.710,"<a href=""https://cve.circl.lu/cve/CVE-2023-28685"">Info Link</a>"
CVE-2022-48426,2.5,JetBrains,In JetBrains TeamCity before 2022.10.3 stored XSS in Perforce connection settings was possible,2023-03-27T17:04:33.497,"<a href=""https://cve.circl.lu/cve/CVE-2022-48426"">Info Link</a>"
CVE-2022-48429,2.5,JetBrains,"In JetBrains Hub before 2022.3.15573, 2022.2.15572, 2022.1.15583 reflected XSS in dashboards was possible",2023-03-27T17:04:33.497,"<a href=""https://cve.circl.lu/cve/CVE-2022-48429"">Info Link</a>"
CVE-2022-48427,2.5,JetBrains,In JetBrains TeamCity before 2022.10.3 stored XSS on “Pending changes” and “Changes” tabs was possible,2023-03-27T17:15:09.133,"<a href=""https://cve.circl.lu/cve/CVE-2022-48427"">Info Link</a>"
CVE-2022-48428,2.5,JetBrains,In JetBrains TeamCity before 2022.10.3 stored XSS on the SSH keys page was possible,2023-03-27T17:15:09.190,"<a href=""https://cve.circl.lu/cve/CVE-2022-48428"">Info Link</a>"
CVE-2022-43441,5.9,JavaScript,A code execution vulnerability exists in the Statement Bindings functionality of Ghost Foundation node-sqlite3 5.1.1. A specially-crafted Javascript file can lead to arbitrary code execution. An attacker can provide malicious input to trigger this vulnerability.,2023-03-22T21:01:25.970,"<a href=""https://cve.circl.lu/cve/CVE-2022-43441"">Info Link</a>"
CVE-2023-27494,2.7,JavaScript,"Streamlit, software for turning data scripts into web applications, had a cross-site scripting (XSS) vulnerability in versions 0.63.0 through 0.80.0. Users of hosted Streamlit app(s) were vulnerable to a reflected XSS vulnerability. An attacker could craft a malicious URL with Javascript payloads to a Streamlit app. The attacker could then trick the user into visiting the malicious URL and, if successful, the server would render the malicious javascript payload as-is, leading to XSS. Version 0.81.0 contains a patch for this vulnerability.",2023-03-23T18:21:46.700,"<a href=""https://cve.circl.lu/cve/CVE-2023-27494"">Info Link</a>"
