CVE,"Impact Score (1-10, 10 being the worst)",Keyword,Description,Last Modified,Link
CVE-2023-28434,5.9,AWS,"Minio is a Multi-Cloud Object Storage framework. Prior to RELEASE.2023-03-20T20-16-18Z, an attacker can use crafted requests to bypass metadata bucket name checking and put an object into any bucket while processing `PostPolicyBucket`. To carry out this attack, the attacker requires credentials with `arn:aws:s3:::*` permission, as well as enabled Console API access. This issue has been patched in RELEASE.2023-03-20T20-16-18Z. As a workaround, enable browser API access and turn off `MINIO_BROWSER=off`.",2023-03-23T01:02:56.037,https://cve.circl.lu/cve/CVE-2023-28434
CVE-2023-23707,2.7,AWS,"Improper Neutralization of Input During Web Page Generation ('Cross-site Scripting'), Unrestricted Upload of File with Dangerous Type vulnerability in Awsm Innovations Embed Any Document – Embed PDF, Word, PowerPoint and Excel Files allows Stored XSS via upload of SVG and HTML files. This issue affects Embed Any Document – Embed PDF, Word, PowerPoint and Excel Files plugin <= 2.7.1 versions.",2023-03-27T17:50:21.573,"<a href=""https://cve.circl.lu/cve/CVE-2023-23707"">Info Link</a>"
CVE-2023-21615,2.7,Adobe,"Experience Manager versions 6.5.15.0 (and earlier) are affected by a reflected Cross-Site Scripting (XSS) vulnerability. If a low-privileged attacker is able to convince a victim to visit a URL referencing a vulnerable page, malicious JavaScript content may be executed within the context of the victim's browser.",2023-03-24T02:25:10.837,"<a href=""https://cve.circl.lu/cve/CVE-2023-21615"">Info Link</a>"
CVE-2023-21616,2.7,Adobe,"Experience Manager versions 6.5.15.0 (and earlier) are affected by a reflected Cross-Site Scripting (XSS) vulnerability. If a low-privileged attacker is able to convince a victim to visit a URL referencing a vulnerable page, malicious JavaScript content may be executed within the context of the victim's browser.",2023-03-24T02:24:29.513,"<a href=""https://cve.circl.lu/cve/CVE-2023-21616"">Info Link</a>"
CVE-2023-22252,2.7,Adobe,"Experience Manager versions 6.5.15.0 (and earlier) are affected by a reflected Cross-Site Scripting (XSS) vulnerability. If a low-privileged attacker is able to convince a victim to visit a URL referencing a vulnerable page, malicious JavaScript content may be executed within the context of the victim's browser.",2023-03-24T02:26:30.810,"<a href=""https://cve.circl.lu/cve/CVE-2023-22252"">Info Link</a>"
CVE-2023-22253,2.7,Adobe,"Experience Manager versions 6.5.15.0 (and earlier) are affected by a reflected Cross-Site Scripting (XSS) vulnerability. If a low-privileged attacker is able to convince a victim to visit a URL referencing a vulnerable page, malicious JavaScript content may be executed within the context of the victim's browser.",2023-03-24T03:06:46.257,"<a href=""https://cve.circl.lu/cve/CVE-2023-22253"">Info Link</a>"
CVE-2023-22254,2.7,Adobe,"Experience Manager versions 6.5.15.0 (and earlier) are affected by a reflected Cross-Site Scripting (XSS) vulnerability. If a low-privileged attacker is able to convince a victim to visit a URL referencing a vulnerable page, malicious JavaScript content may be executed within the context of the victim's browser.",2023-03-24T03:05:54.583,"<a href=""https://cve.circl.lu/cve/CVE-2023-22254"">Info Link</a>"
CVE-2023-22680,2.7,Amazon,Auth. (admin+) Stored Cross-Site Scripting (XSS) vulnerability in Altanic No API Amazon Affiliate plugin <= 4.2.2 versions.,2023-03-23T15:07:27.350,"<a href=""https://cve.circl.lu/cve/CVE-2023-22680"">Info Link</a>"
CVE-2019-6111,3.6,Apache,"An issue was discovered in OpenSSH 7.9. Due to the scp implementation being derived from 1983 rcp, the server chooses which files/directories are sent to the client. However, the scp client only performs cursory validation of the object name returned (only directory traversal attacks are prevented). A malicious scp server (or Man-in-The-Middle attacker) can overwrite arbitrary files in the scp client target directory. If recursive operation (-r) is performed, the server can manipulate subdirectories as well (for example, to overwrite the .ssh/authorized_keys file).",2023-03-24T18:12:40.910,"<a href=""https://cve.circl.lu/cve/CVE-2019-6111"">Info Link</a>"
CVE-2019-11510,6.0,Apache,"In Pulse Secure Pulse Connect Secure (PCS) 8.2 before 8.2R12.1, 8.3 before 8.3R7.1, and 9.0 before 9.0R3.4, an unauthenticated remote attacker can send a specially crafted URI to perform an arbitrary file reading vulnerability .",2023-03-24T17:36:07.643,"<a href=""https://cve.circl.lu/cve/CVE-2019-11510"">Info Link</a>"
CVE-2023-25802,3.6,Apache,"Roxy-WI is a Web interface for managing Haproxy, Nginx, Apache, and Keepalived servers. Versions prior to 6.3.6.0 don't correctly neutralize `dir/../filename` sequences, such as `/etc/nginx/../passwd`, allowing an actor to gain information about a server. Version 6.3.6.0 has a patch for this issue.",2023-03-22T19:43:55.913,"<a href=""https://cve.circl.lu/cve/CVE-2023-25802"">Info Link</a>"
CVE-2023-25803,3.6,Apache,"Roxy-WI is a Web interface for managing Haproxy, Nginx, Apache, and Keepalived servers. Versions prior to 6.3.5.0 have a directory traversal vulnerability that allows the inclusion of server-side files. This issue is fixed in version 6.3.5.0.",2023-03-22T19:44:13.827,"<a href=""https://cve.circl.lu/cve/CVE-2023-25803"">Info Link</a>"
CVE-2023-0100,5.9,Apache,"In Eclipse BIRT, starting from version 2.6.2, the default configuration allowed to retrieve a report from the same host using an absolute HTTP path for the report parameter (e.g. __report=http://xyz.com/report.rptdesign). If the host indicated in the __report parameter matched the HTTP Host header value, the report would be retrieved. However, the Host header can be tampered with on some configurations where no virtual hosts are put in place (e.g. in the default configuration of Apache Tomcat) or when the default host points to the BIRT server. This vulnerability was patched on Eclipse BIRT 4.13.",2023-03-22T17:34:22.753,"<a href=""https://cve.circl.lu/cve/CVE-2023-0100"">Info Link</a>"
CVE-2023-23531,6.0,Apple,"The issue was addressed with improved memory handling. This issue is fixed in macOS Ventura 13.2, iOS 16.3 and iPadOS 16.3. An app may be able to execute arbitrary code out of its sandbox or with certain elevated privileges.",2023-03-23T17:03:08.793,"<a href=""https://cve.circl.lu/cve/CVE-2023-23531"">Info Link</a>"
CVE-2023-22752,5.9,Aruba,There are stack-based buffer overflow vulnerabilities that could lead to unauthenticated remote code execution by sending specially crafted packets destined to the PAPI (Aruba Networks access point management protocol) UDP port (8211). Successful exploitation of these vulnerabilities result in the ability to execute arbitrary code as a privileged user on the underlying operating system.,2023-03-23T17:05:50.170,"<a href=""https://cve.circl.lu/cve/CVE-2023-22752"">Info Link</a>"
CVE-2023-1168,5.9,Aruba,"An authenticated remote code execution vulnerability exists in the AOS-CX Network Analytics Engine. Successful exploitation of this vulnerability results in the ability to execute arbitrary code as a privileged user on the underlying operating system, leading to a complete compromise of the switch running AOS-CX.",2023-03-22T12:48:04.240,"<a href=""https://cve.circl.lu/cve/CVE-2023-1168"">Info Link</a>"
CVE-2023-25589,5.9,Aruba,A vulnerability in the web-based management interface of ClearPass Policy Manager could allow an unauthenticated remote attacker to create arbitrary users on the platform. A successful exploit allows an attacker to achieve total cluster compromise.,2023-03-27T17:56:51.457,"<a href=""https://cve.circl.lu/cve/CVE-2023-25589"">Info Link</a>"
CVE-2023-25590,5.9,Aruba,A vulnerability in the ClearPass OnGuard Linux agent could allow malicious users on a Linux instance to elevate their user privileges to those of a higher role. A successful exploit allows malicious users to execute arbitrary code with root level privileges on the Linux instance.,2023-03-27T18:03:26.580,"<a href=""https://cve.circl.lu/cve/CVE-2023-25590"">Info Link</a>"
CVE-2023-25591,4.7,Aruba,A vulnerability in the web-based management interface of ClearPass Policy Manager could allow a remote attacker authenticated with low privileges to access sensitive information. A successful exploit allows an attacker to retrieve information which could be used to potentially gain further privileges on the ClearPass instance.,2023-03-22T12:47:56.330,"<a href=""https://cve.circl.lu/cve/CVE-2023-25591"">Info Link</a>"
CVE-2022-36804,5.9,Atlassian,"Multiple API endpoints in Atlassian Bitbucket Server and Data Center 7.0.0 before version 7.6.17, from version 7.7.0 before version 7.17.10, from version 7.18.0 before version 7.21.4, from version 8.0.0 before version 8.0.3, from version 8.1.0 before version 8.1.3, and from version 8.2.0 before version 8.2.2, and from version 8.3.0 before 8.3.1 allows remote attackers with read permissions to a public or private Bitbucket repository to execute arbitrary code by sending a malicious HTTP request. This vulnerability was reported via our Bug Bounty Program by TheGrandPew.",2023-03-24T19:15:07.213,"<a href=""https://cve.circl.lu/cve/CVE-2022-36804"">Info Link</a>"
CVE-2023-28725,,Atlassian,"General Bytes Crypto Application Server (CAS) 20230120, as distributed with General Bytes BATM devices, allows remote attackers to execute arbitrary Java code by uploading a Java application to the /batm/app/admin/standalone/deployments directory, aka BATM-4780, as exploited in the wild in March 2023. This is fixed in 20221118.48 and 20230120.44.",2023-03-22T12:48:04.240,"<a href=""https://cve.circl.lu/cve/CVE-2023-28725"">Info Link</a>"
CVE-2022-45597,,ASP.NET,ComponentSpace.Saml2 4.4.0 Missing SSL Certificate Validation.,2023-03-27T12:40:41.963,"<a href=""https://cve.circl.lu/cve/CVE-2022-45597"">Info Link</a>"
CVE-2023-28609,5.9,Ansible,api/auth.go in Ansible Semaphore before 2.8.89 mishandles authentication.,2023-03-23T14:04:55.057,"<a href=""https://cve.circl.lu/cve/CVE-2023-28609"">Info Link</a>"
CVE-2022-3101,,Ansible,"A flaw was found in tripleo-ansible. Due to an insecure default configuration, the permissions of a sensitive file are not sufficiently restricted. This flaw allows a local attacker to use brute force to explore the relevant directory and discover the file, leading to information disclosure of important configuration details from the OpenStack deployment.",2023-03-24T01:57:07.650,"<a href=""https://cve.circl.lu/cve/CVE-2022-3101"">Info Link</a>"
CVE-2022-3146,,Ansible,"A flaw was found in tripleo-ansible. Due to an insecure default configuration, the permissions of a sensitive file are not sufficiently restricted. This flaw allows a local attacker to use brute force to explore the relevant directory and discover the file. This issue leads to information disclosure of important configuration details from the OpenStack deployment.",2023-03-24T01:57:07.650,"<a href=""https://cve.circl.lu/cve/CVE-2022-3146"">Info Link</a>"
CVE-2022-47145,2.7,Bitcoin,Reflected Cross-Site Scripting (XSS) vulnerability in Blockonomics WordPress Bitcoin Payments – Blockonomics plugin <= 3.5.7 versions.,2023-03-27T17:37:16.273,"<a href=""https://cve.circl.lu/cve/CVE-2022-47145"">Info Link</a>"
CVE-2022-39290,3.6,CSRF,"ZoneMinder is a free, open source Closed-circuit television software application. In affected versions authenticated users can bypass CSRF keys by modifying the request supplied to the Zoneminder web application. These modifications include replacing HTTP POST with an HTTP GET and removing the CSRF key from the request. An attacker can take advantage of this by using an HTTP GET request to perform actions with no CSRF protection. This could allow an attacker to cause an authenticated user to perform unexpected actions on the web application. Users are advised to upgrade as soon as possible. There are no known workarounds for this issue.",2023-03-27T18:15:11.687,"<a href=""https://cve.circl.lu/cve/CVE-2022-39290"">Info Link</a>"
CVE-2023-25170,5.9,CSRF,"PrestaShop is an open source e-commerce web application that, prior to version 8.0.1, is vulnerable to cross-site request forgery (CSRF). When authenticating users, PrestaShop preserves session attributes. Because this does not clear CSRF tokens upon login, this might enable same-site attackers to bypass the CSRF protection mechanism by performing an attack similar to a session-fixation. The problem is fixed in version 8.0.1.",2023-03-23T17:27:40.250,"<a href=""https://cve.circl.lu/cve/CVE-2023-25170"">Info Link</a>"
CVE-2023-27234,3.6,CSRF,A Cross-Site Request Forgery (CSRF) in /Sys/index.html of Jizhicms v2.4.5 allows attackers to arbitrarily make configuration changes within the application.,2023-03-20T19:21:04.963,"<a href=""https://cve.circl.lu/cve/CVE-2023-27234"">Info Link</a>"
CVE-2022-38063,5.9,CSRF,Cross-Site Request Forgery (CSRF) vulnerability in Social Login WP plugin <= 5.0.0.0 versions.,2023-03-21T18:35:55.460,"<a href=""https://cve.circl.lu/cve/CVE-2022-38063"">Info Link</a>"
CVE-2022-46854,5.9,CSRF,Cross-Site Request Forgery (CSRF) vulnerability in Obox Themes Launchpad – Coming Soon & Maintenance Mode plugin <= 1.0.13 versions.,2023-03-23T19:54:34.773,"<a href=""https://cve.circl.lu/cve/CVE-2022-46854"">Info Link</a>"
CVE-2019-1668,2.7,Cisco,"A vulnerability in the chat feed feature of Cisco SocialMiner could allow an unauthenticated, remote attacker to perform cross-site scripting (XSS) attacks against a user of the web-based user interface of an affected system. This vulnerability is due to insufficient sanitization of user-supplied input delivered to the chat feed as part of an HTTP request. An attacker could exploit this vulnerability by persuading a user to follow a link to attacker-controlled content. A successful exploit could allow the attacker to execute arbitrary script code in the context of the affected interface or access sensitive, browser-based information.",2023-03-23T17:37:55.757,"<a href=""https://cve.circl.lu/cve/CVE-2019-1668"">Info Link</a>"
CVE-2019-1677,2.7,Cisco,"A vulnerability in Cisco Webex Meetings for Android could allow an unauthenticated, local attacker to perform a cross-site scripting attack against the application. The vulnerability is due to insufficient validation of the application input parameters. An attacker could exploit this vulnerability by sending a malicious request to the Webex Meetings application through an intent. A successful exploit could allow the attacker to execute script code in the context of the Webex Meetings application. Versions prior to 11.7.0.236 are affected.",2023-03-23T17:37:45.110,"<a href=""https://cve.circl.lu/cve/CVE-2019-1677"">Info Link</a>"
CVE-2019-1678,1.4,Cisco,"A vulnerability in Cisco Meeting Server could allow an authenticated, remote attacker to cause a partial denial of service (DoS) to Cisco Meetings application users who are paired with a Session Initiation Protocol (SIP) endpoint. The vulnerability is due to improper validation of coSpaces configuration parameters. An attacker could exploit this vulnerability by inserting crafted strings in specific coSpace parameters. An exploit could allow the attacker to prevent clients from joining a conference call in the affected coSpace. Versions prior to 2.4.3 are affected.",2023-03-23T17:33:51.197,"<a href=""https://cve.circl.lu/cve/CVE-2019-1678"">Info Link</a>"
CVE-2019-1679,1.4,Cisco,"A vulnerability in the web interface of Cisco TelePresence Conductor, Cisco Expressway Series, and Cisco TelePresence Video Communication Server (VCS) Software could allow an authenticated, remote attacker to trigger an HTTP request from an affected server to an arbitrary host. This type of attack is commonly referred to as server-side request forgery (SSRF). The vulnerability is due to insufficient access controls for the REST API of Cisco Expressway Series and Cisco TelePresence VCS. An attacker could exploit this vulnerability by submitting a crafted HTTP request to the affected server. Versions prior to XC4.3.4 are affected.",2023-03-23T17:33:57.840,"<a href=""https://cve.circl.lu/cve/CVE-2019-1679"">Info Link</a>"
CVE-2019-1680,1.4,Cisco,"A vulnerability in Cisco Webex Business Suite could allow an unauthenticated, remote attacker to inject arbitrary text into a user's browser. The vulnerability is due to improper validation of input. An attacker could exploit this vulnerability by convincing a targeted user to view a malicious URL. A successful exploit could allow the attacker to inject arbitrary text into the user's browser. The attacker could use the content injection to conduct spoofing attacks. Versions prior than 3.0.9 are affected.",2023-03-24T17:48:18.200,"<a href=""https://cve.circl.lu/cve/CVE-2019-1680"">Info Link</a>"
CVE-2021-29444,3.6,Cryptograph,"jose-browser-runtime is an npm package which provides a number of cryptographic functions. In versions prior to 3.11.4 the AES_CBC_HMAC_SHA2 Algorithm (A128CBC-HS256, A192CBC-HS384, A256CBC-HS512) decryption would always execute both HMAC tag verification and CBC decryption, if either failed `JWEDecryptionFailed` would be thrown. But a possibly observable difference in timing when padding error would occur while decrypting the ciphertext makes a padding oracle and an adversary might be able to make use of that oracle to decrypt data without knowing the decryption key by issuing on average 128*b calls to the padding oracle (where b is the number of bytes in the ciphertext block). A patch was released which ensures the HMAC tag is verified before performing CBC decryption. The fixed versions are `>=3.11.4`. Users should upgrade to `^3.11.4`.",2023-03-21T13:18:38.997,"<a href=""https://cve.circl.lu/cve/CVE-2021-29444"">Info Link</a>"
CVE-2021-29445,3.6,Cryptograph,"jose-node-esm-runtime is an npm package which provides a number of cryptographic functions. In versions prior to 3.11.4 the AES_CBC_HMAC_SHA2 Algorithm (A128CBC-HS256, A192CBC-HS384, A256CBC-HS512) decryption would always execute both HMAC tag verification and CBC decryption, if either failed `JWEDecryptionFailed` would be thrown. But a possibly observable difference in timing when padding error would occur while decrypting the ciphertext makes a padding oracle and an adversary might be able to make use of that oracle to decrypt data without knowing the decryption key by issuing on average 128*b calls to the padding oracle (where b is the number of bytes in the ciphertext block). A patch was released which ensures the HMAC tag is verified before performing CBC decryption. The fixed versions are `>=3.11.4`. Users should upgrade to `^3.11.4`.",2023-03-21T13:19:20.030,"<a href=""https://cve.circl.lu/cve/CVE-2021-29445"">Info Link</a>"
CVE-2021-29446,3.6,Cryptograph,"jose-node-cjs-runtime is an npm package which provides a number of cryptographic functions. In versions prior to 3.11.4 the AES_CBC_HMAC_SHA2 Algorithm (A128CBC-HS256, A192CBC-HS384, A256CBC-HS512) decryption would always execute both HMAC tag verification and CBC decryption, if either failed `JWEDecryptionFailed` would be thrown. But a possibly observable difference in timing when padding error would occur while decrypting the ciphertext makes a padding oracle and an adversary might be able to make use of that oracle to decrypt data without knowing the decryption key by issuing on average 128*b calls to the padding oracle (where b is the number of bytes in the ciphertext block). A patch was released which ensures the HMAC tag is verified before performing CBC decryption. The fixed versions are `>=3.11.4`. Users should upgrade to `^3.11.4`.",2023-03-21T13:19:29.667,"<a href=""https://cve.circl.lu/cve/CVE-2021-29446"">Info Link</a>"
CVE-2023-23416,5.9,Cryptograph,Windows Cryptographic Services Remote Code Execution Vulnerability,2023-03-23T16:55:33.223,"<a href=""https://cve.circl.lu/cve/CVE-2023-23416"">Info Link</a>"
CVE-2023-22271,3.6,Cryptograph,Experience Manager versions 6.5.15.0 (and earlier) are affected by a Weak Cryptography for Passwords vulnerability that can lead to a security feature bypass. A low-privileged attacker can exploit this in order to decrypt a user's password. The attack complexity is high since a successful exploitation requires to already have in possession this encrypted secret.,2023-03-24T02:31:16.427,"<a href=""https://cve.circl.lu/cve/CVE-2023-22271"">Info Link</a>"
CVE-2023-28858,,ChatGPT,"redis-py before 4.5.3, as used in ChatGPT and other products, leaves a connection open after canceling an async Redis command at an inopportune time (in the case of a pipeline operation), and can send response data to the client of an unrelated request in an off-by-one manner. The fixed versions for this CVE Record are 4.3.6, 4.4.3, and 4.5.3; however, CVE-2023-28859 is a separate vulnerability.",2023-03-27T12:40:41.963,"<a href=""https://cve.circl.lu/cve/CVE-2023-28858"">Info Link</a>"
CVE-2023-27059,2.7,CRM,A cross-site scripting (XSS) vulnerability in the Edit Group function of ChurchCRM v4.5.3 allows attackers to execute arbitrary web scripts or HTML via a crafted payload injected into the Edit Group Name text field.,2023-03-22T17:35:29.343,"<a href=""https://cve.circl.lu/cve/CVE-2023-27059"">Info Link</a>"
CVE-2023-24655,,CRM,Simple Customer Relationship Management System v1.0 was discovered to contain a SQL injection vulnerability via the name parameter under the Profile Update function.,2023-03-23T13:42:07.967,"<a href=""https://cve.circl.lu/cve/CVE-2023-24655"">Info Link</a>"
CVE-2023-1608,3.4,CRM,A vulnerability was found in Zhong Bang CRMEB Java up to 1.3.4. It has been declared as critical. This vulnerability affects the function getAdminList of the file /api/admin/store/product/list. The manipulation of the argument cateId leads to sql injection. The attack can be initiated remotely. The exploit has been disclosed to the public and may be used. VDB-223738 is the identifier assigned to this vulnerability.,2023-03-24T01:57:07.650,"<a href=""https://cve.circl.lu/cve/CVE-2023-1608"">Info Link</a>"
CVE-2023-1609,1.4,CRM,A vulnerability was found in Zhong Bang CRMEB Java up to 1.3.4. It has been rated as problematic. This issue affects the function save of the file /api/admin/store/product/save. The manipulation leads to cross site scripting. The attack may be initiated remotely. The exploit has been disclosed to the public and may be used. The associated identifier of this vulnerability is VDB-223739.,2023-03-24T01:57:07.650,"<a href=""https://cve.circl.lu/cve/CVE-2023-1609"">Info Link</a>"
CVE-2023-24787,,CRM,RESERVED churchcrm v4.5.3 was discovered to contain a SQL injection vulnerability via the Event parameter at /churchcrm/EventAttendance.php.,2023-03-24T01:57:07.650,"<a href=""https://cve.circl.lu/cve/CVE-2023-24787"">Info Link</a>"
CVE-2023-25280,5.9,D-Link,OS Command injection vulnerability in D-Link DIR820LA1_FW105B03 allows attackers to escalate privileges to root via a crafted payload with the ping_addr parameter to ping.ccp.,2023-03-21T17:33:33.767,"<a href=""https://cve.circl.lu/cve/CVE-2023-25280"">Info Link</a>"
CVE-2023-25281,3.6,D-Link,"A stack overflow vulnerability exists in pingV4Msg component in D-Link DIR820LA1_FW105B03, allows attackers to cause a denial of service via the nextPage parameter to ping.ccp.",2023-03-21T17:46:30.813,"<a href=""https://cve.circl.lu/cve/CVE-2023-25281"">Info Link</a>"
CVE-2023-24571,5.9,Dell,Dell BIOS contains an Improper Input Validation vulnerability. A local authenticated malicious user with administrator privileges could potentially exploit this vulnerability to perform arbitrary code execution.,2023-03-21T22:30:08.107,"<a href=""https://cve.circl.lu/cve/CVE-2023-24571"">Info Link</a>"
CVE-2022-34406,5.9,Dell,Dell PowerEdge BIOS and Dell Precision BIOS contain an Improper SMM communication buffer verification vulnerability. A local malicious user with high Privileges may potentially exploit this vulnerability to perform arbitrary code execution or cause denial of service.,2023-03-22T17:20:57.133,"<a href=""https://cve.circl.lu/cve/CVE-2022-34406"">Info Link</a>"
CVE-2022-34407,5.9,Dell,Dell PowerEdge BIOS and Dell Precision BIOS contain an Improper SMM communication buffer verification vulnerability. A local malicious user with high Privileges may potentially exploit this vulnerability to perform arbitrary code execution or cause denial of service.,2023-03-22T17:21:28.703,"<a href=""https://cve.circl.lu/cve/CVE-2022-34407"">Info Link</a>"
CVE-2022-34408,5.9,Dell,Dell PowerEdge BIOS and Dell Precision BIOS contain an Improper SMM communication buffer verification vulnerability. A local malicious user with high Privileges may potentially exploit this vulnerability to perform arbitrary code execution or cause denial of service.,2023-03-24T14:53:26.990,"<a href=""https://cve.circl.lu/cve/CVE-2022-34408"">Info Link</a>"
CVE-2022-34409,5.9,Dell,Dell PowerEdge BIOS and Dell Precision BIOS contain an Improper SMM communication buffer verification vulnerability. A local malicious user with high Privileges may potentially exploit this vulnerability to perform arbitrary code execution or cause denial of service.,2023-03-22T14:49:27.497,"<a href=""https://cve.circl.lu/cve/CVE-2022-34409"">Info Link</a>"
