CVE,"Impact Score (1-10, 10 being the worst)",Keyword,Description,Last Modified,Link
CVE-2024-27657,NA,D-Link,"D-Link DIR-823G A1V1.0.2B05 was discovered to contain a buffer overflow via the User-Agent parameter. This vulnerability allows attackers to cause a Denial of Service (DoS) via a crafted input, and possibly remote code execution.",2024-03-01T14:04:26.010,https://cve.circl.lu/cve/CVE-2024-27657
CVE-2024-27658,NA,D-Link,D-Link DIR-823G A1V1.0.2B05 was discovered to contain Null-pointer dereferences in sub_4484A8(). This vulnerability allows attackers to cause a Denial of Service (DoS) via a crafted input.,2024-03-01T14:04:26.010,https://cve.circl.lu/cve/CVE-2024-27658
CVE-2024-27659,NA,D-Link,D-Link DIR-823G A1V1.0.2B05 was discovered to contain Null-pointer dereferences in sub_42AF30(). This vulnerability allows attackers to cause a Denial of Service (DoS) via a crafted input.,2024-03-01T14:04:26.010,https://cve.circl.lu/cve/CVE-2024-27659
CVE-2024-22457,5.9,Dell,"Dell Secure Connect Gateway 5.20 contains an improper authentication vulnerability during the SRS to SCG update path. A remote low privileged attacker could potentially exploit this vulnerability, leading to impersonation of the server through presenting a fake self-signed certificate and communicating with the remote server.",2024-03-01T14:04:04.827,https://cve.circl.lu/cve/CVE-2024-22457
CVE-2024-22458,1.4,Dell,"Dell Secure Connect Gateway, 5.18, contains an Inadequate Encryption Strength Vulnerability. An unauthenticated network attacker could potentially exploit this vulnerability, allowing an attacker to recover plaintext from a block of ciphertext.",2024-03-01T14:04:04.827,https://cve.circl.lu/cve/CVE-2024-22458
CVE-2023-39254,5.9,Dell,"Dell Update Package (DUP), Versions prior to 4.9.10 contain an Uncontrolled Search Path vulnerability. A malicious user with local access to the system could potentially exploit this vulnerability to run arbitrary code as admin.",2024-03-01T14:04:04.827,https://cve.circl.lu/cve/CVE-2023-39254
CVE-2023-48674,4.0,Dell,Dell Platform BIOS contains an Improper Null Termination vulnerability. A high privilege user with network access to the system could potentially send malicious data to the device in order to cause some services to cease to function.,2024-03-01T14:04:04.827,https://cve.circl.lu/cve/CVE-2023-48674
CVE-2024-24900,4.2,Dell,"Dell Secure Connect Gateway (SCG) Policy Manager, all versions, contain an improper authorization vulnerability. An adjacent network low privileged attacker could potentially exploit this vulnerability, leading to unauthorized devices added to policies. Exploitation may lead to information disclosure and unauthorized access to the system.",2024-03-01T14:04:04.827,https://cve.circl.lu/cve/CVE-2024-24900
CVE-2023-5457,3.6,Django,"A CWE-1269 “Product Released in Non-Release Configuration” vulnerability in the Django web framework used by the web application (due to the “debug” configuration parameter set to “True”) allows a remote unauthenticated attacker to access critical information and have other unspecified impacts to the confidentiality, integrity, and availability of the application. This issue affects: AiLux imx6 bundle below version imx6_1.0.7-2.",2024-03-05T13:41:01.900,https://cve.circl.lu/cve/CVE-2023-5457
CVE-2024-2215,NA,Docker,"A cross-site request forgery (CSRF) vulnerability in Jenkins docker-build-step Plugin 2.11 and earlier allows attackers to connect to an attacker-specified TCP or Unix socket URL, and to reconfigure the plugin using the provided connection test parameters, affecting future build step executions.",2024-03-06T21:42:54.697,https://cve.circl.lu/cve/CVE-2024-2215
CVE-2024-2216,NA,Docker,"A missing permission check in an HTTP endpoint in Jenkins docker-build-step Plugin 2.11 and earlier allows attackers with Overall/Read permission to connect to an attacker-specified TCP or Unix socket URL, and to reconfigure the plugin using the provided connection test parameters, affecting future build step executions.",2024-03-06T21:42:54.697,https://cve.circl.lu/cve/CVE-2024-2216
CVE-2024-22252,6.0,ESXi,"VMware ESXi, Workstation, and Fusion contain a use-after-free vulnerability in the XHCI USB controller. A malicious actor with local administrative privileges on a virtual machine may exploit this issue to execute code as the virtual machine's VMX process running on the host. On ESXi, the exploitation is contained within the VMX sandbox whereas, on Workstation and Fusion, this may lead to code execution on the machine where Workstation or Fusion is installed.",2024-03-05T18:50:18.333,https://cve.circl.lu/cve/CVE-2024-22252
CVE-2024-22253,6.0,ESXi,"VMware ESXi, Workstation, and Fusion contain a use-after-free vulnerability in the UHCI USB controller. A malicious actor with local administrative privileges on a virtual machine may exploit this issue to execute code as the virtual machine's VMX process running on the host. On ESXi, the exploitation is contained within the VMX sandbox whereas, on Workstation and Fusion, this may lead to code execution on the machine where Workstation or Fusion is installed.",2024-03-05T18:50:18.333,https://cve.circl.lu/cve/CVE-2024-22253
CVE-2024-22254,5.8,ESXi,VMware ESXi contains an out-of-bounds write vulnerability. A malicious actor with privileges within the VMX process may trigger an out-of-bounds write leading to an escape of the sandbox.,2024-03-05T18:50:18.333,https://cve.circl.lu/cve/CVE-2024-22254
CVE-2024-22255,4.0,ESXi,"VMware ESXi, Workstation, and Fusion contain an information disclosure vulnerability in the UHCI USB controller. A malicious actor with administrative access to a virtual machine may be able to exploit this issue to leak memory from the vmx process.  ",2024-03-05T18:50:18.333,https://cve.circl.lu/cve/CVE-2024-22255
CVE-2024-25847,NA,Excel,"SQL Injection vulnerability in MyPrestaModules ""Product Catalog (CSV, Excel) Import"" (simpleimportproduct) modules for PrestaShop versions 6.5.0 and before, allows attackers to escalate privileges and obtain sensitive information via Send::__construct() and importProducts::_addDataToDb methods.",2024-03-04T13:58:23.447,https://cve.circl.lu/cve/CVE-2024-25847
CVE-2024-28111,3.6,Excel,"Canarytokens helps track activity and actions on a network. Canarytokens.org supports exporting the history of a Canarytoken's incidents in CSV format. The generation of these CSV files is vulnerable to a CSV Injection vulnerability. This flaw can be used by an attacker who discovers an HTTP-based Canarytoken to target the Canarytoken's owner, if the owner exports the incident history to CSV and opens in a reader application such as Microsoft Excel. The impact is that this issue could lead to code execution on the machine on which the CSV file is opened. Version sha-c595a1f8 contains a fix for this issue.",2024-03-07T13:52:27.110,https://cve.circl.lu/cve/CVE-2024-28111
CVE-2024-0553,3.6,Exchange,"A vulnerability was found in GnuTLS. The response times to malformed ciphertexts in RSA-PSK ClientKeyExchange differ from the response times of ciphertexts with correct PKCS#1 v1.5 padding. This issue may allow a remote attacker to perform a timing side-channel attack in the RSA-PSK key exchange, potentially leading to the leakage of sensitive data. CVE-2024-0553 is designated as an incomplete resolution for CVE-2023-5981.",2024-03-05T11:15:08.367,https://cve.circl.lu/cve/CVE-2024-0553
CVE-2019-1748,5.2,Exploit,"A vulnerability in the Cisco Network Plug-and-Play (PnP) agent of Cisco IOS Software and Cisco IOS XE Software could allow an unauthenticated, remote attacker to gain unauthorized access to sensitive data. The vulnerability exists because the affected software insufficiently validates certificates. An attacker could exploit this vulnerability by supplying a crafted certificate to an affected device. A successful exploit could allow the attacker to conduct man-in-the-middle attacks to decrypt and modify confidential information on user connections to the affected software.",2024-03-04T22:59:43.640,https://cve.circl.lu/cve/CVE-2019-1748
CVE-2019-1752,3.6,Exploit,"A vulnerability in the ISDN functions of Cisco IOS Software and Cisco IOS XE Software could allow an unauthenticated, remote attacker to cause the device to reload. The vulnerability is due to incorrect processing of specific values in the Q.931 information elements. An attacker could exploit this vulnerability by calling the affected device with specific Q.931 information elements being present. An exploit could allow the attacker to cause the device to reload, resulting in a denial of service (DoS) condition on an affected device.",2024-03-04T22:59:48.230,https://cve.circl.lu/cve/CVE-2019-1752
CVE-2023-52513,NA,Endpoint,"In the Linux kernel, the following vulnerability has been resolved:RDMA/siw: Fix connection failure handlingIn case immediate MPA request processing fails, the newlycreated endpoint unlinks the listening endpoint and isready to be dropped. This special case was not handledcorrectly by the code handling the later TCP socket close,causing a NULL dereference crash in siw_cm_work_handler()when dereferencing a NULL listener. We now also cancelthe useless MPA timeout, if immediate MPA requestprocessing fails.This patch furthermore simplifies MPA processing in general:Scheduling a useless TCP socket read in sk_data_ready() upcallis now surpressed, if the socket is already moved out ofTCP_ESTABLISHED state.",2024-03-04T13:58:23.447,https://cve.circl.lu/cve/CVE-2023-52513
CVE-2024-0765,5.8,Endpoint,"As a default user on a multi-user instance of AnythingLLM, you could execute a call to the `/export-data` endpoint of the system and then unzip and read that export that would enable you do exfiltrate data of the system at that save state.This would require the attacked to be granted explicit access to the system, but they can do this at any role. Additionally, post-download, the data is deleted so no evidence would exist that the exfiltration occured.",2024-03-04T13:58:23.447,https://cve.circl.lu/cve/CVE-2024-0765
CVE-2024-28155,NA,Endpoint,"Jenkins AppSpider Plugin 1.0.16 and earlier does not perform permission checks in several HTTP endpoints, allowing attackers with Overall/Read permission to obtain information about available scan config names, engine group names, and client names.",2024-03-06T21:42:54.697,https://cve.circl.lu/cve/CVE-2024-28155
CVE-2024-27287,5.2,Endpoint,"ESPHome is a system to control your ESP8266/ESP32 for Home Automation systems. Starting in version 2023.12.9 and prior to version 2024.2.2, editing the configuration file API in dashboard component of ESPHome version 2023.12.9 (command line installation and Home Assistant add-on) serves unsanitized data with `Content-Type: text/html; charset=UTF-8`, allowing a remote authenticated user to inject arbitrary web script and exfiltrate session cookies via Cross-Site scripting. It is possible for a malicious authenticated user to inject arbitrary Javascript in configuration files using a POST request to the /edit endpoint, the configuration parameter allows to specify the file to write. To trigger the XSS vulnerability, the victim must visit the page` /edit?configuration=[xss file]`. Abusing this vulnerability a malicious actor could perform operations on the dashboard on the behalf of a logged user, access sensitive information, create, edit and delete configuration files and flash firmware on managed boards.In addition to this, cookies are not correctly secured, allowing the exfiltration of session cookie values. Version 2024.2.2 contains a patch for this issue.",2024-03-06T21:42:48.053,https://cve.circl.lu/cve/CVE-2024-27287
CVE-2023-26206,2.7,Fortinet,"An improper neutralization of input during web page generation ('cross-site scripting') in Fortinet FortiNAC 9.4.0 - 9.4.2, 9.2.0 - 9.2.8, 9.1.0 - 9.1.10 and 7.2.0 allows an attacker to execute unauthorized code or commands via the name fields observed in the policy audit logs.",2024-03-01T23:12:48.653,https://cve.circl.lu/cve/CVE-2023-26206
CVE-2023-5451,2.7,Firewall,"Forcepoint NGFW Security Management Center Management Server has SMC Downloads optional feature to offer standalone Management Client downloads and ECA configuration downloads.Improper Neutralization of Input During Web Page Generation ('Cross-site Scripting') vulnerability in Forcepoint Next Generation Firewall Security Management Center (SMC Downloads feature) allows Reflected XSS.This issue affects Next Generation Firewall Security Management Center : before 6.10.13, from 6.11.0 before 7.1.2.",2024-03-05T13:41:01.900,https://cve.circl.lu/cve/CVE-2023-5451
CVE-2024-27889,5.9,Firewall,"Multiple SQL Injection vulnerabilities exist in the reporting application of the Arista Edge Threat Management - Arista NG Firewall (NGFW). A user with advanced report application access rights can exploit the SQL injection, allowing them to execute commands on the underlying operating system with elevated privileges.",2024-03-05T13:41:01.900,https://cve.circl.lu/cve/CVE-2024-27889
CVE-2023-7028,3.6,GitLab,"An issue has been discovered in GitLab CE/EE affecting all versions from 16.1 prior to 16.1.6, 16.2 prior to 16.2.9, 16.3 prior to 16.3.7, 16.4 prior to 16.4.5, 16.5 prior to 16.5.6, 16.6 prior to 16.6.4, and 16.7 prior to 16.7.2 in which user account password reset emails could be delivered to an unverified email address.",2024-03-04T22:54:45.797,https://cve.circl.lu/cve/CVE-2023-7028
CVE-2023-6736,3.6,GitLab,"An issue has been discovered in GitLab EE affecting all versions starting from 11.3 before 16.7.6, all versions starting from 16.8 before 16.8.3, all versions starting from 16.9 before 16.9.1. It was possible for an attacker to cause a client-side denial of service using malicious crafted content in the CODEOWNERS file.",2024-03-04T20:33:21.807,https://cve.circl.lu/cve/CVE-2023-6736
CVE-2023-6840,5.5,GitLab,"An issue has been discovered in GitLab EE affecting all versions from 16.4 prior to 16.6.7, 16.7 prior to 16.7.5, and 16.8 prior to 16.8.2 which allows a maintainer to change the name of a protected branch that bypasses the security policy added to block MR.",2024-03-04T20:52:05.890,https://cve.circl.lu/cve/CVE-2023-6840
CVE-2024-1066,3.6,GitLab,"An issue has been discovered in GitLab EE affecting all versions from 13.3.0 prior to 16.6.7, 16.7 prior to 16.7.5, and 16.8 prior to 16.8.2 which allows an attacker to do a resource exhaustion using GraphQL `vulnerabilitiesCountByDay`",2024-03-04T21:00:15.267,https://cve.circl.lu/cve/CVE-2024-1066
CVE-2023-6564,3.6,GitLab,"An issue has been discovered in GitLab EE Premium and Ultimate affecting versions 16.4.3, 16.5.3, and 16.6.1. In projects using subgroups to define who can push and/or merge to protected branches, there may have been instances in which subgroup members with the Developer role were able to push or merge to protected branches.",2024-03-04T20:56:09.493,https://cve.circl.lu/cve/CVE-2023-6564
CVE-2023-39325,3.6,Golang,"A malicious HTTP/2 client which rapidly creates requests and immediately resets them can cause excessive server resource consumption. While the total number of requests is bounded by the http2.Server.MaxConcurrentStreams setting, resetting an in-progress request allows the attacker to create a new request while the existing one is still executing. With the fix applied, HTTP/2 servers now bound the number of simultaneously executing handler goroutines to the stream concurrency limit (MaxConcurrentStreams). New requests arriving when at the limit (which can only happen after the client has reset an existing, in-flight request) will be queued until a handler exits. If the request queue grows too large, the server will terminate the connection. This issue is also fixed in golang.org/x/net/http2 for users manually configuring HTTP/2. The default stream concurrency limit is 250 streams (requests) per HTTP/2 connection. This value may be adjusted using the golang.org/x/net/http2 package; see the Server.MaxConcurrentStreams setting and the ConfigureServer function.",2024-03-07T03:15:06.257,https://cve.circl.lu/cve/CVE-2023-39325
CVE-2024-1938,NA,Google,Type Confusion in V8 in Google Chrome prior to 122.0.6261.94 allowed a remote attacker to potentially exploit object corruption via a crafted HTML page. (Chromium security severity: High),2024-03-07T23:15:07.177,https://cve.circl.lu/cve/CVE-2024-1938
CVE-2024-1939,NA,Google,Type Confusion in V8 in Google Chrome prior to 122.0.6261.94 allowed a remote attacker to potentially exploit heap corruption via a crafted HTML page. (Chromium security severity: High),2024-03-07T23:15:07.250,https://cve.circl.lu/cve/CVE-2024-1939
CVE-2024-27101,5.8,Google,"SpiceDB is an open source, Google Zanzibar-inspired database for creating and managing security-critical application permissions. Integer overflow in chunking helper causes dispatching to miss elements or panic.  Any SpiceDB cluster with any schema where a resource being checked has more than 65535 relationships for the same resource and subject type is affected by this problem.  The CheckPermission, BulkCheckPermission, and LookupSubjects API methods are affected. This vulnerability is fixed in 1.29.2.",2024-03-01T22:22:25.913,https://cve.circl.lu/cve/CVE-2024-27101
CVE-2021-47078,NA,Google,"In the Linux kernel, the following vulnerability has been resolved:RDMA/rxe: Clear all QP fields if creation failedrxe_qp_do_cleanup() relies on valid pointer values in QP for the properlycreated ones, but in case rxe_qp_from_init() failed it was filled withgarbage and caused tot the following error.  refcount_t: underflow; use-after-free.  WARNING: CPU: 1 PID: 12560 at lib/refcount.c:28 refcount_warn_saturate+0x1d1/0x1e0 lib/refcount.c:28  Modules linked in:  CPU: 1 PID: 12560 Comm: syz-executor.4 Not tainted 5.12.0-syzkaller #0  Hardware name: Google Google Compute Engine/Google Compute Engine, BIOS Google 01/01/2011  RIP: 0010:refcount_warn_saturate+0x1d1/0x1e0 lib/refcount.c:28  Code: e9 db fe ff ff 48 89 df e8 2c c2 ea fd e9 8a fe ff ff e8 72 6a a7 fd 48 c7 c7 e0 b2 c1 89 c6 05 dc 3a e6 09 01 e8 ee 74 fb 04 <0f> 0b e9 af fe ff ff 0f 1f 84 00 00 00 00 00 41 56 41 55 41 54 55  RSP: 0018:ffffc900097ceba8 EFLAGS: 00010286  RAX: 0000000000000000 RBX: 0000000000000000 RCX: 0000000000000000  RDX: 0000000000040000 RSI: ffffffff815bb075 RDI: fffff520012f9d67  RBP: 0000000000000003 R08: 0000000000000000 R09: 0000000000000000  R10: ffffffff815b4eae R11: 0000000000000000 R12: ffff8880322a4800  R13: ffff8880322a4940 R14: ffff888033044e00 R15: 0000000000000000  FS:  00007f6eb2be3700(0000) GS:ffff8880b9d00000(0000) knlGS:0000000000000000  CS:  0010 DS: 0000 ES: 0000 CR0: 0000000080050033  CR2: 00007fdbe5d41000 CR3: 000000001d181000 CR4: 00000000001506e0  DR0: 0000000000000000 DR1: 0000000000000000 DR2: 0000000000000000  DR3: 0000000000000000 DR6: 00000000fffe0ff0 DR7: 0000000000000400  Call Trace:   __refcount_sub_and_test include/linux/refcount.h:283 [inline]   __refcount_dec_and_test include/linux/refcount.h:315 [inline]   refcount_dec_and_test include/linux/refcount.h:333 [inline]   kref_put include/linux/kref.h:64 [inline]   rxe_qp_do_cleanup+0x96f/0xaf0 drivers/infiniband/sw/rxe/rxe_qp.c:805   execute_in_process_context+0x37/0x150 kernel/workqueue.c:3327   rxe_elem_release+0x9f/0x180 drivers/infiniband/sw/rxe/rxe_pool.c:391   kref_put include/linux/kref.h:65 [inline]   rxe_create_qp+0x2cd/0x310 drivers/infiniband/sw/rxe/rxe_verbs.c:425   _ib_create_qp drivers/infiniband/core/core_priv.h:331 [inline]   ib_create_named_qp+0x2ad/0x1370 drivers/infiniband/core/verbs.c:1231   ib_create_qp include/rdma/ib_verbs.h:3644 [inline]   create_mad_qp+0x177/0x2d0 drivers/infiniband/core/mad.c:2920   ib_mad_port_open drivers/infiniband/core/mad.c:3001 [inline]   ib_mad_init_device+0xd6f/0x1400 drivers/infiniband/core/mad.c:3092   add_client_context+0x405/0x5e0 drivers/infiniband/core/device.c:717   enable_device_and_get+0x1cd/0x3b0 drivers/infiniband/core/device.c:1331   ib_register_device drivers/infiniband/core/device.c:1413 [inline]   ib_register_device+0x7c7/0xa50 drivers/infiniband/core/device.c:1365   rxe_register_device+0x3d5/0x4a0 drivers/infiniband/sw/rxe/rxe_verbs.c:1147   rxe_add+0x12fe/0x16d0 drivers/infiniband/sw/rxe/rxe.c:247   rxe_net_add+0x8c/0xe0 drivers/infiniband/sw/rxe/rxe_net.c:503   rxe_newlink drivers/infiniband/sw/rxe/rxe.c:269 [inline]   rxe_newlink+0xb7/0xe0 drivers/infiniband/sw/rxe/rxe.c:250   nldev_newlink+0x30e/0x550 drivers/infiniband/core/nldev.c:1555   rdma_nl_rcv_msg+0x36d/0x690 drivers/infiniband/core/netlink.c:195   rdma_nl_rcv_skb drivers/infiniband/core/netlink.c:239 [inline]   rdma_nl_rcv+0x2ee/0x430 drivers/infiniband/core/netlink.c:259   netlink_unicast_kernel net/netlink/af_netlink.c:1312 [inline]   netlink_unicast+0x533/0x7d0 net/netlink/af_netlink.c:1338   netlink_sendmsg+0x856/0xd90 net/netlink/af_netlink.c:1927   sock_sendmsg_nosec net/socket.c:654 [inline]   sock_sendmsg+0xcf/0x120 net/socket.c:674   ____sys_sendmsg+0x6e8/0x810 net/socket.c:2350   ___sys_sendmsg+0xf3/0x170 net/socket.c:2404   __sys_sendmsg+0xe5/0x1b0 net/socket.c:2433   do_syscall_64+0x3a/0xb0 arch/x86/entry/common.c:47   entry_SYSCALL_64_after_hwframe+0---truncated---",2024-03-01T22:22:25.913,https://cve.circl.lu/cve/CVE-2021-47078
CVE-2023-52528,NA,Google,"In the Linux kernel, the following vulnerability has been resolved:net: usb: smsc75xx: Fix uninit-value access in __smsc75xx_read_regsyzbot reported the following uninit-value access issue:=====================================================BUG: KMSAN: uninit-value in smsc75xx_wait_ready drivers/net/usb/smsc75xx.c:975 [inline]BUG: KMSAN: uninit-value in smsc75xx_bind+0x5c9/0x11e0 drivers/net/usb/smsc75xx.c:1482CPU: 0 PID: 8696 Comm: kworker/0:3 Not tainted 5.8.0-rc5-syzkaller #0Hardware name: Google Google Compute Engine/Google Compute Engine, BIOS Google 01/01/2011Workqueue: usb_hub_wq hub_eventCall Trace: __dump_stack lib/dump_stack.c:77 [inline] dump_stack+0x21c/0x280 lib/dump_stack.c:118 kmsan_report+0xf7/0x1e0 mm/kmsan/kmsan_report.c:121 __msan_warning+0x58/0xa0 mm/kmsan/kmsan_instr.c:215 smsc75xx_wait_ready drivers/net/usb/smsc75xx.c:975 [inline] smsc75xx_bind+0x5c9/0x11e0 drivers/net/usb/smsc75xx.c:1482 usbnet_probe+0x1152/0x3f90 drivers/net/usb/usbnet.c:1737 usb_probe_interface+0xece/0x1550 drivers/usb/core/driver.c:374 really_probe+0xf20/0x20b0 drivers/base/dd.c:529 driver_probe_device+0x293/0x390 drivers/base/dd.c:701 __device_attach_driver+0x63f/0x830 drivers/base/dd.c:807 bus_for_each_drv+0x2ca/0x3f0 drivers/base/bus.c:431 __device_attach+0x4e2/0x7f0 drivers/base/dd.c:873 device_initial_probe+0x4a/0x60 drivers/base/dd.c:920 bus_probe_device+0x177/0x3d0 drivers/base/bus.c:491 device_add+0x3b0e/0x40d0 drivers/base/core.c:2680 usb_set_configuration+0x380f/0x3f10 drivers/usb/core/message.c:2032 usb_generic_driver_probe+0x138/0x300 drivers/usb/core/generic.c:241 usb_probe_device+0x311/0x490 drivers/usb/core/driver.c:272 really_probe+0xf20/0x20b0 drivers/base/dd.c:529 driver_probe_device+0x293/0x390 drivers/base/dd.c:701 __device_attach_driver+0x63f/0x830 drivers/base/dd.c:807 bus_for_each_drv+0x2ca/0x3f0 drivers/base/bus.c:431 __device_attach+0x4e2/0x7f0 drivers/base/dd.c:873 device_initial_probe+0x4a/0x60 drivers/base/dd.c:920 bus_probe_device+0x177/0x3d0 drivers/base/bus.c:491 device_add+0x3b0e/0x40d0 drivers/base/core.c:2680 usb_new_device+0x1bd4/0x2a30 drivers/usb/core/hub.c:2554 hub_port_connect drivers/usb/core/hub.c:5208 [inline] hub_port_connect_change drivers/usb/core/hub.c:5348 [inline] port_event drivers/usb/core/hub.c:5494 [inline] hub_event+0x5e7b/0x8a70 drivers/usb/core/hub.c:5576 process_one_work+0x1688/0x2140 kernel/workqueue.c:2269 worker_thread+0x10bc/0x2730 kernel/workqueue.c:2415 kthread+0x551/0x590 kernel/kthread.c:292 ret_from_fork+0x1f/0x30 arch/x86/entry/entry_64.S:293Local variable ----buf.i87@smsc75xx_bind created at: __smsc75xx_read_reg drivers/net/usb/smsc75xx.c:83 [inline] smsc75xx_wait_ready drivers/net/usb/smsc75xx.c:968 [inline] smsc75xx_bind+0x485/0x11e0 drivers/net/usb/smsc75xx.c:1482 __smsc75xx_read_reg drivers/net/usb/smsc75xx.c:83 [inline] smsc75xx_wait_ready drivers/net/usb/smsc75xx.c:968 [inline] smsc75xx_bind+0x485/0x11e0 drivers/net/usb/smsc75xx.c:1482This issue is caused because usbnet_read_cmd() reads less bytes than requested(zero byte in the reproducer). In this case, 'buf' is not properly filled.This patch fixes the issue by returning -ENODATA if usbnet_read_cmd() readsless bytes than requested.",2024-03-04T13:58:23.447,https://cve.circl.lu/cve/CVE-2023-52528
CVE-2023-35946,3.6,Gradle,"Gradle is a build tool with a focus on build automation and support for multi-language development. When Gradle writes a dependency into its dependency cache, it uses the dependency's coordinates to compute a file location. With specially crafted dependency coordinates, Gradle can be made to write files into an unintended location. The file may be written outside the dependency cache or over another file in the dependency cache. This vulnerability could be used to poison the dependency cache or overwrite important files elsewhere on the filesystem where the Gradle process has write permissions. Exploiting this vulnerability requires an attacker to have control over a dependency repository used by the Gradle build or have the ability to modify the build's configuration. It is unlikely that this would go unnoticed. A fix has been released in Gradle 7.6.2 and 8.2 to protect against this vulnerability. Gradle will refuse to cache dependencies that have path traversal elements in their dependency coordinates. It is recommended that users upgrade to a patched version. If you are unable to upgrade to Gradle 7.6.2 or 8.2, `dependency verification` will make this vulnerability more difficult to exploit.",2024-03-06T15:20:18.167,https://cve.circl.lu/cve/CVE-2023-35946
