CVE,"Impact Score (1-10, 10 being the worst)",Keyword,Description,Last Modified,Link
CVE-2023-44324,5.9,Adobe,Adobe FrameMaker versions 2022 and earlier are affected by an Improper Authentication vulnerability that could result in a Security feature bypass. An unauthenticated attacker can abuse this vulnerability to access the API and leak default admin's password. Exploitation of this issue does not require user interaction.,2024-03-05T19:56:42.527,https://cve.circl.lu/cve/CVE-2023-44324
CVE-2024-26280,NA,Airflow,"Apache Airflow, versions before 2.8.2, has a vulnerability that allows authenticated Ops and Viewers users to view all information on audit logs, including dag names and usernames they were not permitted to view. With 2.8.2 and newer, Ops and Viewer users do not have audit log permission by default, they need to be explicitly granted permissions to see the logs. Only admin users have audit log permission by default.Users of Apache Airflow are recommended to upgrade to version 2.8.2 or newer to mitigate the risk associated with this vulnerability",2024-03-01T14:04:04.827,https://cve.circl.lu/cve/CVE-2024-26280
CVE-2021-47102,NA,Amazon,"In the Linux kernel, the following vulnerability has been resolved:net: marvell: prestera: fix incorrect structure accessIn line:	upper = info->upper_dev;We access upper_dev field, which is related only for particular events(e.g. event == NETDEV_CHANGEUPPER). So, this line cause invalid memoryaccess for another events,when ptr is not netdev_notifier_changeupper_info.The KASAN logs are as follows:[   30.123165] BUG: KASAN: stack-out-of-bounds in prestera_netdev_port_event.constprop.0+0x68/0x538 [prestera][   30.133336] Read of size 8 at addr ffff80000cf772b0 by task udevd/778[   30.139866][   30.141398] CPU: 0 PID: 778 Comm: udevd Not tainted 5.16.0-rc3 #6[   30.147588] Hardware name: DNI AmazonGo1 A7040 board (DT)[   30.153056] Call trace:[   30.155547]  dump_backtrace+0x0/0x2c0[   30.159320]  show_stack+0x18/0x30[   30.162729]  dump_stack_lvl+0x68/0x84[   30.166491]  print_address_description.constprop.0+0x74/0x2b8[   30.172346]  kasan_report+0x1e8/0x250[   30.176102]  __asan_load8+0x98/0xe0[   30.179682]  prestera_netdev_port_event.constprop.0+0x68/0x538 [prestera][   30.186847]  prestera_netdev_event_handler+0x1b4/0x1c0 [prestera][   30.193313]  raw_notifier_call_chain+0x74/0xa0[   30.197860]  call_netdevice_notifiers_info+0x68/0xc0[   30.202924]  register_netdevice+0x3cc/0x760[   30.207190]  register_netdev+0x24/0x50[   30.211015]  prestera_device_register+0x8a0/0xba0 [prestera]",2024-03-05T13:41:01.900,https://cve.circl.lu/cve/CVE-2021-47102
CVE-2023-48795,3.6,Apache,"The SSH transport protocol with certain OpenSSH extensions, found in OpenSSH before 9.6 and other products, allows remote attackers to bypass integrity checks such that some packets are omitted (from the extension negotiation message), and a client and server may consequently end up with a connection for which some security features have been downgraded or disabled, aka a Terrapin attack. This occurs because the SSH Binary Packet Protocol (BPP), implemented by these extensions, mishandles the handshake phase and mishandles use of sequence numbers. For example, there is an effective attack against SSH's use of ChaCha20-Poly1305 (and CBC with Encrypt-then-MAC). The bypass occurs in chacha20-poly1305@openssh.com and (if CBC is used) the -etm@openssh.com MAC algorithms. This also affects Maverick Synergy Java SSH API before 3.1.0-SNAPSHOT, Dropbear through 2022.83, Ssh before 5.1.1 in Erlang/OTP, PuTTY before 0.80, AsyncSSH before 2.14.2, golang.org/x/crypto before 0.17.0, libssh before 0.10.6, libssh2 through 1.11.0, Thorn Tech SFTP Gateway before 3.4.6, Tera Term before 5.1, Paramiko before 3.4.0, jsch before 0.2.15, SFTPGo before 2.5.6, Netgate pfSense Plus through 23.09.1, Netgate pfSense CE through 2.7.2, HPN-SSH through 18.2.0, ProFTPD before 1.3.8b (and before 1.3.9rc2), ORYX CycloneSSH before 2.3.4, NetSarang XShell 7 before Build 0144, CrushFTP before 10.6.0, ConnectBot SSH library before 2.2.22, Apache MINA sshd through 2.11.0, sshj through 0.37.0, TinySSH through 20230101, trilead-ssh2 6401, LANCOM LCOS and LANconfig, FileZilla before 3.66.4, Nova before 11.8, PKIX-SSH before 14.4, SecureCRT before 9.4.3, Transmit5 before 5.10.4, Win32-OpenSSH before 9.5.0.0p1-Beta, WinSCP before 6.2.2, Bitvise SSH Server before 9.32, Bitvise SSH Client before 9.33, KiTTY through 0.76.1.13, the net-ssh gem 7.2.0 for Ruby, the mscdex ssh2 module before 1.15.0 for Node.js, the thrussh library before 0.35.1 for Rust, and the Russh crate before 0.40.2 for Rust.",2024-03-07T19:15:10.263,https://cve.circl.lu/cve/CVE-2023-48795
CVE-2024-24814,3.6,Apache,"mod_auth_openidc is an OpenID Certified™ authentication and authorization module for the Apache 2.x HTTP server that implements the OpenID Connect Relying Party functionality. In affected versions missing input validation on mod_auth_openidc_session_chunks cookie value makes the server vulnerable to a denial of service (DoS) attack. An internal security audit has been conducted and the reviewers found that if they manipulated the value of the mod_auth_openidc_session_chunks cookie to a very large integer, like 99999999, the server struggles with the request for a long time and finally gets back with a 500 error. Making a few requests of this kind caused our server to become unresponsive. Attackers can craft requests that would make the server work very hard (and possibly become unresponsive) and/or crash with minimal effort. This issue has been addressed in version 2.4.15.2. Users are advised to upgrade. There are no known workarounds for this vulnerability.",2024-03-02T02:15:39.880,https://cve.circl.lu/cve/CVE-2024-24814
CVE-2024-25710,3.6,Apache,Loop with Unreachable Exit Condition ('Infinite Loop') vulnerability in Apache Commons Compress.This issue affects Apache Commons Compress: from 1.3 through 1.25.0.Users are recommended to upgrade to version 1.26.0 which fixes the issue.,2024-03-07T17:15:12.940,https://cve.circl.lu/cve/CVE-2024-25710
CVE-2024-26308,3.6,Apache,"Allocation of Resources Without Limits or Throttling vulnerability in Apache Commons Compress.This issue affects Apache Commons Compress: from 1.21 before 1.26.Users are recommended to upgrade to version 1.26, which fixes the issue.",2024-03-07T17:15:13.050,https://cve.circl.lu/cve/CVE-2024-26308
CVE-2024-23225,5.9,Apple,"A memory corruption issue was addressed with improved validation. This issue is fixed in iOS 16.7.6 and iPadOS 16.7.6, iOS 17.4 and iPadOS 17.4. An attacker with arbitrary kernel read and write capability may be able to bypass kernel memory protections. Apple is aware of a report that this issue may have been exploited.",2024-03-07T19:15:11.630,https://cve.circl.lu/cve/CVE-2024-23225
CVE-2024-23296,5.9,Apple,A memory corruption issue was addressed with improved validation. This issue is fixed in iOS 17.4 and iPadOS 17.4. An attacker with arbitrary kernel read and write capability may be able to bypass kernel memory protections. Apple is aware of a report that this issue may have been exploited.,2024-03-07T19:15:11.687,https://cve.circl.lu/cve/CVE-2024-23296
CVE-2023-52595,NA,Apple,"In the Linux kernel, the following vulnerability has been resolved:wifi: rt2x00: restart beacon queue when hardware resetWhen a hardware reset is triggered, all registers are reset, so allqueues are forced to stop in hardware interface. However, mac80211will not automatically stop the queue. If we don't manually stop thebeacon queue, the queue will be deadlocked and unable to start again.This patch fixes the issue where Apple devices cannot connect to theAP after calling ieee80211_restart_hw().",2024-03-06T15:18:08.093,https://cve.circl.lu/cve/CVE-2023-52595
CVE-2024-25729,NA,Arris,"Arris SBG6580 devices have predictable default WPA2 security passwords that could lead to unauthorized remote access. (They use the first 6 characters of the SSID and the last 6 characters of the BSSID, decrementing the last octet.)",2024-03-08T00:15:50.033,https://cve.circl.lu/cve/CVE-2024-25729
CVE-2024-1356,5.9,Aruba,Authenticated command injection vulnerabilities exist in the ArubaOS command line interface. Successful exploitation of these vulnerabilities result in the ability to execute arbitrary commands as a privileged user on the underlying operating system.,2024-03-06T15:18:08.093,https://cve.circl.lu/cve/CVE-2024-1356
CVE-2024-25611,5.9,Aruba,Authenticated command injection vulnerabilities exist in the ArubaOS command line interface. Successful exploitation of these vulnerabilities result in the ability to execute arbitrary commands as a privileged user on the underlying operating system.,2024-03-06T15:18:08.093,https://cve.circl.lu/cve/CVE-2024-25611
CVE-2024-25612,5.9,Aruba,Authenticated command injection vulnerabilities exist in the ArubaOS command line interface. Successful exploitation of these vulnerabilities result in the ability to execute arbitrary commands as a privileged user on the underlying operating system.,2024-03-06T15:18:08.093,https://cve.circl.lu/cve/CVE-2024-25612
CVE-2024-25613,5.9,Aruba,Authenticated command injection vulnerabilities exist in the ArubaOS command line interface. Successful exploitation of these vulnerabilities result in the ability to execute arbitrary commands as a privileged user on the underlying operating system.,2024-03-06T15:18:08.093,https://cve.circl.lu/cve/CVE-2024-25613
CVE-2024-25614,4.2,Aruba,"There is an arbitrary file deletion vulnerability in the CLI used by ArubaOS. Successful exploitation of this vulnerability results in the ability to delete arbitrary files on the underlying operating system, which could lead to denial-of-service conditions and impact the integrity of the controller. ",2024-03-06T15:18:08.093,https://cve.circl.lu/cve/CVE-2024-25614
CVE-2024-21364,6.0,Azure,Microsoft Azure Site Recovery Elevation of Privilege Vulnerability,2024-03-07T19:28:06.433,https://cve.circl.lu/cve/CVE-2024-21364
CVE-2024-21376,6.0,Azure,Microsoft Azure Kubernetes Service Confidential Container Remote Code Execution Vulnerability,2024-03-07T19:28:25.637,https://cve.circl.lu/cve/CVE-2024-21376
CVE-2021-47076,NA,Atom,"In the Linux kernel, the following vulnerability has been resolved:RDMA/rxe: Return CQE error if invalid lkey was suppliedRXE is missing update of WQE status in LOCAL_WRITE failures.  This causedthe following kernel panic if someone sent an atomic operation with anexplicitly wrong lkey.[leonro@vm ~]$ mkt testtest_atomic_invalid_lkey (tests.test_atomic.AtomicTest) ... WARNING: CPU: 5 PID: 263 at drivers/infiniband/sw/rxe/rxe_comp.c:740 rxe_completer+0x1a6d/0x2e30 [rdma_rxe] Modules linked in: crc32_generic rdma_rxe ip6_udp_tunnel udp_tunnel rdma_ucm rdma_cm ib_umad ib_ipoib iw_cm ib_cm mlx5_ib ib_uverbs ib_core mlx5_core ptp pps_core CPU: 5 PID: 263 Comm: python3 Not tainted 5.13.0-rc1+ #2936 Hardware name: QEMU Standard PC (Q35 + ICH9, 2009), BIOS rel-1.13.0-0-gf21b5a4aeb02-prebuilt.qemu.org 04/01/2014 RIP: 0010:rxe_completer+0x1a6d/0x2e30 [rdma_rxe] Code: 03 0f 8e 65 0e 00 00 3b 93 10 06 00 00 0f 84 82 0a 00 00 4c 89 ff 4c 89 44 24 38 e8 2d 74 a9 e1 4c 8b 44 24 38 e9 1c f5 ff ff <0f> 0b e9 0c e8 ff ff b8 05 00 00 00 41 bf 05 00 00 00 e9 ab e7 ff RSP: 0018:ffff8880158af090 EFLAGS: 00010246 RAX: 0000000000000000 RBX: ffff888016a78000 RCX: ffffffffa0cf1652 RDX: 1ffff9200004b442 RSI: 0000000000000004 RDI: ffffc9000025a210 RBP: dffffc0000000000 R08: 00000000ffffffea R09: ffff88801617740b R10: ffffed1002c2ee81 R11: 0000000000000007 R12: ffff88800f3b63e8 R13: ffff888016a78008 R14: ffffc9000025a180 R15: 000000000000000c FS:  00007f88b622a740(0000) GS:ffff88806d540000(0000) knlGS:0000000000000000 CS:  0010 DS: 0000 ES: 0000 CR0: 0000000080050033 CR2: 00007f88b5a1fa10 CR3: 000000000d848004 CR4: 0000000000370ea0 DR0: 0000000000000000 DR1: 0000000000000000 DR2: 0000000000000000 DR3: 0000000000000000 DR6: 00000000fffe0ff0 DR7: 0000000000000400 Call Trace:  rxe_do_task+0x130/0x230 [rdma_rxe]  rxe_rcv+0xb11/0x1df0 [rdma_rxe]  rxe_loopback+0x157/0x1e0 [rdma_rxe]  rxe_responder+0x5532/0x7620 [rdma_rxe]  rxe_do_task+0x130/0x230 [rdma_rxe]  rxe_rcv+0x9c8/0x1df0 [rdma_rxe]  rxe_loopback+0x157/0x1e0 [rdma_rxe]  rxe_requester+0x1efd/0x58c0 [rdma_rxe]  rxe_do_task+0x130/0x230 [rdma_rxe]  rxe_post_send+0x998/0x1860 [rdma_rxe]  ib_uverbs_post_send+0xd5f/0x1220 [ib_uverbs]  ib_uverbs_write+0x847/0xc80 [ib_uverbs]  vfs_write+0x1c5/0x840  ksys_write+0x176/0x1d0  do_syscall_64+0x3f/0x80  entry_SYSCALL_64_after_hwframe+0x44/0xae",2024-03-01T22:22:25.913,https://cve.circl.lu/cve/CVE-2021-47076
CVE-2023-52503,NA,Atom,"In the Linux kernel, the following vulnerability has been resolved:tee: amdtee: fix use-after-free vulnerability in amdtee_close_sessionThere is a potential race condition in amdtee_close_session that maycause use-after-free in amdtee_open_session. For instance, if a sessionhas refcount == 1, and one thread tries to free this session via:    kref_put(&sess->refcount, destroy_session);the reference count will get decremented, and the next step would be tocall destroy_session(). However, if in another thread,amdtee_open_session() is called before destroy_session() has completedexecution, alloc_session() may return 'sess' that will be freed uplater in destroy_session() leading to use-after-free inamdtee_open_session.To fix this issue, treat decrement of sess->refcount and removal of'sess' from session list in destroy_session() as a critical section, sothat it is executed atomically.",2024-03-04T13:58:23.447,https://cve.circl.lu/cve/CVE-2023-52503
CVE-2023-52586,NA,Atom,"In the Linux kernel, the following vulnerability has been resolved:drm/msm/dpu: Add mutex lock in control vblank irqAdd a mutex lock to control vblank irq to synchronize vblankenable/disable operations happening from different threads to preventrace conditions while registering/unregistering the vblank irq callback.v4: -Removed vblank_ctl_lock from dpu_encoder_virt, so it is only a    parameter of dpu_encoder_phys.    -Switch from atomic refcnt to a simple int counter as mutex has    now been addedv3: Mistakenly did not change wording in last version. It is done now.v2: Slightly changed wording of commit messagePatchwork: https://patchwork.freedesktop.org/patch/571854/",2024-03-06T15:18:08.093,https://cve.circl.lu/cve/CVE-2023-52586
CVE-2023-7103,5.9,Biometric,Authentication Bypass by Primary Weakness vulnerability in ZKSoftware Biometric Security Solutions UFace 5 allows Authentication Bypass.This issue affects UFace 5: through 12022024.,2024-03-05T13:41:01.900,https://cve.circl.lu/cve/CVE-2023-7103
CVE-2023-52555,NA,CSRF,"In mongo-express 1.0.2, /admin allows CSRF, as demonstrated by deletion of a Collection.",2024-03-01T14:04:26.010,https://cve.circl.lu/cve/CVE-2023-52555
CVE-2017-6663,3.6,Cisco,"A vulnerability in the Autonomic Networking feature of Cisco IOS Software and Cisco IOS XE Software could allow an unauthenticated, adjacent attacker to cause autonomic nodes of an affected system to reload, resulting in a denial of service (DoS) condition. More Information: CSCvd88936. Known Affected Releases: Denali-16.2.1 Denali-16.3.1.",2024-03-04T22:59:19.157,https://cve.circl.lu/cve/CVE-2017-6663
CVE-2017-6665,3.6,Cisco,"A vulnerability in the Autonomic Networking feature of Cisco IOS Software and Cisco IOS XE Software could allow an unauthenticated, adjacent attacker to reset the Autonomic Control Plane (ACP) of an affected system and view ACP packets that are transferred in clear text within an affected system, an Information Disclosure Vulnerability. More Information: CSCvd51214. Known Affected Releases: Denali-16.2.1 Denali-16.3.1.",2024-03-04T22:59:22.970,https://cve.circl.lu/cve/CVE-2017-6665
CVE-2017-6627,3.6,Cisco,"A vulnerability in the UDP processing code of Cisco IOS 15.1, 15.2, and 15.4 and IOS XE 3.14 through 3.18 could allow an unauthenticated, remote attacker to cause the input queue of an affected system to hold UDP packets, causing an interface queue wedge and a denial of service (DoS) condition. The vulnerability is due to Cisco IOS Software application changes that create UDP sockets and leave the sockets idle without closing them. An attacker could exploit this vulnerability by sending UDP packets with a destination port of 0 to an affected device. A successful exploit could allow the attacker to cause UDP packets to be held in the input interfaces queue, resulting in a DoS condition. The input interface queue will stop holding UDP packets when it receives 250 packets. Cisco Bug IDs: CSCup10024, CSCva55744, CSCva95506.",2024-03-04T22:59:28.410,https://cve.circl.lu/cve/CVE-2017-6627
CVE-2019-1738,3.6,Cisco,"A vulnerability in the Network-Based Application Recognition (NBAR) feature of Cisco IOS Software and Cisco IOS XE Software could allow an unauthenticated, remote attacker to cause an affected device to reload. This vulnerability is due to a parsing issue on DNS packets. An attacker could exploit these vulnerabilities by sending crafted DNS packets through routers that are running an affected version and have NBAR enabled. A successful exploit could allow the attacker to cause the affected device to reload, resulting in a denial of service (DoS) condition.",2024-03-04T22:59:31.617,https://cve.circl.lu/cve/CVE-2019-1738
CVE-2019-1739,3.6,Cisco,"A vulnerability in the Network-Based Application Recognition (NBAR) feature of Cisco IOS Software and Cisco IOS XE Software could allow an unauthenticated, remote attacker to cause an affected device to reload. This vulnerability is due to a parsing issue on DNS packets. An attacker could exploit this vulnerability by sending crafted DNS packets through routers that are running an affected version and have NBAR enabled. A successful exploit could allow the attacker to cause the affected device to reload, resulting in a denial of service (DoS) condition.",2024-03-04T22:59:36.037,https://cve.circl.lu/cve/CVE-2019-1739
CVE-2023-47152,3.6,Cryptograph,"IBM Db2 for Linux, UNIX and Windows (includes Db2 Connect Server) 11.5 is vulnerable to an insecure cryptographic algorithm and to information disclosure in stack trace under exceptional conditions.  IBM X-Force ID:  270730.",2024-03-07T17:15:11.063,https://cve.circl.lu/cve/CVE-2023-47152
CVE-2024-23218,3.6,Cryptograph,"A timing side-channel issue was addressed with improvements to constant-time computation in cryptographic functions. This issue is fixed in macOS Sonoma 14.3, watchOS 10.3, tvOS 17.3, iOS 17.3 and iPadOS 17.3. An attacker may be able to decrypt legacy RSA PKCS#1 v1.5 ciphertexts without having the private key.",2024-03-07T19:15:11.560,https://cve.circl.lu/cve/CVE-2024-23218
CVE-2024-27255,3.6,Cryptograph,"IBM MQ Operator 2.0.0 LTS, 2.0.18 LTS, 3.0.0 CD, 3.0.1 CD, 2.4.0 through 2.4.7, 2.3.0 through 2.3.3, 2.2.0 through 2.2.2, and 2.3.0 through 2.3.3 uses weaker than expected cryptographic algorithms that could allow an attacker to decrypt highly sensitive information.  IBM X-Force ID:  283905.",2024-03-04T13:58:23.447,https://cve.circl.lu/cve/CVE-2024-27255
CVE-2024-22463,5.2,Cryptograph,"Dell PowerScale OneFS 8.2.x through 9.6.0.x contains a use of a broken or risky cryptographic algorithm vulnerability. A remote unprivileged attacker could potentially exploit this vulnerability, leading to compromise of confidentiality and integrity of sensitive information",2024-03-04T15:35:25.673,https://cve.circl.lu/cve/CVE-2024-22463
CVE-2023-42419,3.4,Cryptograph,"Maintenance Server, in Cybellum's QCOW air-gapped distribution (China Edition), versions 2.15.5 through 2.27, was compiled with a hard-coded private cryptographic key.An attacker with administrative privileges & access to the air-gapped server could potentially use this key to run commands on the server.The issue was resolved in version 2.28.Earlier versions, including all Cybellum 1.x versions, and distributions for the rest of the world remain unaffected.",2024-03-05T13:41:01.900,https://cve.circl.lu/cve/CVE-2023-42419
CVE-2024-27564,NA,ChatGPT,A Server-Side Request Forgery (SSRF) in pictureproxy.php of ChatGPT commit f9f4bbc allows attackers to force the application to make arbitrary requests via injection of crafted URLs into the urlparameter.,2024-03-05T18:50:18.333,https://cve.circl.lu/cve/CVE-2024-27564
CVE-2024-27565,NA,ChatGPT,A Server-Side Request Forgery (SSRF) in weixin.php of ChatGPT-wechat-personal commit a0857f6 allows attackers to force the application to make arbitrary requests.,2024-03-05T18:50:18.333,https://cve.circl.lu/cve/CVE-2024-27565
CVE-2023-2889,5.9,CRM,Improper Neutralization of Special Elements used in an SQL Command ('SQL Injection') vulnerability in Veon Computer Service Tracking Software allows SQL Injection.This issue affects Service Tracking Software: before crm 2.0.,2024-03-07T12:15:46.590,https://cve.circl.lu/cve/CVE-2023-2889
CVE-2023-52506,NA,CRM,"In the Linux kernel, the following vulnerability has been resolved:LoongArch: Set all reserved memblocks on Node#0 at initializationAfter commit 61167ad5fecdea (""mm: pass nid to reserve_bootmem_region()"")we get a panic if DEFERRED_STRUCT_PAGE_INIT is enabled:[    0.000000] CPU 0 Unable to handle kernel paging request at virtual address 0000000000002b82, era == 90000000040e3f28, ra == 90000000040e3f18[    0.000000] Oops[#1]:[    0.000000] CPU: 0 PID: 0 Comm: swapper Not tainted 6.5.0+ #733[    0.000000] pc 90000000040e3f28 ra 90000000040e3f18 tp 90000000046f4000 sp 90000000046f7c90[    0.000000] a0 0000000000000001 a1 0000000000200000 a2 0000000000000040 a3 90000000046f7ca0[    0.000000] a4 90000000046f7ca4 a5 0000000000000000 a6 90000000046f7c38 a7 0000000000000000[    0.000000] t0 0000000000000002 t1 9000000004b00ac8 t2 90000000040e3f18 t3 90000000040f0800[    0.000000] t4 00000000000f0000 t5 80000000ffffe07e t6 0000000000000003 t7 900000047fff5e20[    0.000000] t8 aaaaaaaaaaaaaaab u0 0000000000000018 s9 0000000000000000 s0 fffffefffe000000[    0.000000] s1 0000000000000000 s2 0000000000000080 s3 0000000000000040 s4 0000000000000000[    0.000000] s5 0000000000000000 s6 fffffefffe000000 s7 900000000470b740 s8 9000000004ad4000[    0.000000]    ra: 90000000040e3f18 reserve_bootmem_region+0xec/0x21c[    0.000000]   ERA: 90000000040e3f28 reserve_bootmem_region+0xfc/0x21c[    0.000000]  CRMD: 000000b0 (PLV0 -IE -DA +PG DACF=CC DACM=CC -WE)[    0.000000]  PRMD: 00000000 (PPLV0 -PIE -PWE)[    0.000000]  EUEN: 00000000 (-FPE -SXE -ASXE -BTE)[    0.000000]  ECFG: 00070800 (LIE=11 VS=7)[    0.000000] ESTAT: 00010800 [PIL] (IS=11 ECode=1 EsubCode=0)[    0.000000]  BADV: 0000000000002b82[    0.000000]  PRID: 0014d000 (Loongson-64bit, Loongson-3A6000)[    0.000000] Modules linked in:[    0.000000] Process swapper (pid: 0, threadinfo=(____ptrval____), task=(____ptrval____))[    0.000000] Stack : 0000000000000000 9000000002eb5430 0000003a00000020 90000000045ccd00[    0.000000]         900000000470e000 90000000002c1918 0000000000000000 9000000004110780[    0.000000]         00000000fe6c0000 0000000480000000 9000000004b4e368 9000000004110748[    0.000000]         0000000000000000 900000000421ca84 9000000004620000 9000000004564970[    0.000000]         90000000046f7d78 9000000002cc9f70 90000000002c1918 900000000470e000[    0.000000]         9000000004564970 90000000040bc0e0 90000000046f7d78 0000000000000000[    0.000000]         0000000000004000 90000000045ccd00 0000000000000000 90000000002c1918[    0.000000]         90000000002c1900 900000000470b700 9000000004b4df78 9000000004620000[    0.000000]         90000000046200a8 90000000046200a8 0000000000000000 9000000004218b2c[    0.000000]         9000000004270008 0000000000000001 0000000000000000 90000000045ccd00[    0.000000]         ...[    0.000000] Call Trace:[    0.000000] [<90000000040e3f28>] reserve_bootmem_region+0xfc/0x21c[    0.000000] [<900000000421ca84>] memblock_free_all+0x114/0x350[    0.000000] [<9000000004218b2c>] mm_core_init+0x138/0x3cc[    0.000000] [<9000000004200e38>] start_kernel+0x488/0x7a4[    0.000000] [<90000000040df0d8>] kernel_entry+0xd8/0xdc[    0.000000][    0.000000] Code: 02eb21ad  00410f4c  380c31ac <262b818d> 6800b70d  02c1c196  0015001c  57fe4bb1  260002cdThe reason is early memblock_reserve() in memblock_init() set node id toMAX_NUMNODES, making NODE_DATA(nid) a NULL dereference in the call chainreserve_bootmem_region() -> init_reserved_page(). After memblock_init(),those late calls of memblock_reserve() operate on subregions of memblock.memory regions. As a result, these reserved regions will be set to thecorrect node at the first iteration of memmap_init_reserved_pages().So set all reserved memblocks on Node#0 at initialization can avoid thispanic.",2024-03-04T13:58:23.447,https://cve.circl.lu/cve/CVE-2023-52506
CVE-2024-25842,NA,CRM,"An issue was discovered in Presta World ""Account Manager - Sales Representative & Dealers - CRM"" (prestasalesmanager) module for PrestaShop before version 9.0, allows remote attackers to escalate privilege and obtain sensitive information via the uploadLogo() and postProcess methods.",2024-03-04T13:58:23.447,https://cve.circl.lu/cve/CVE-2024-25842
CVE-2024-27655,NA,D-Link,"D-Link DIR-823G A1V1.0.2B05 was discovered to contain a buffer overflow via the SOAPACTION parameter. This vulnerability allows attackers to cause a Denial of Service (DoS) via a crafted input, and possibly remote code execution.",2024-03-01T14:04:26.010,https://cve.circl.lu/cve/CVE-2024-27655
CVE-2024-27656,NA,D-Link,"D-Link DIR-823G A1V1.0.2B05 was discovered to contain a buffer overflow via the Cookie parameter. This vulnerability allows attackers to cause a Denial of Service (DoS) via a crafted input, and possibly remote code execution.",2024-03-01T14:04:26.010,https://cve.circl.lu/cve/CVE-2024-27656
