CVE,"Impact Score (1-10, 10 being the worst)",Keyword,Description,Last Modified,Link
CVE-2024-27294,5.5,Puppet,"dp-golang is a Puppet module for Go installations.  Prior to 1.2.7, dp-golang could install files — including the compiler binary — with the wrong ownership when Puppet was run as root and the installed package was On macOS: Go version 1.4.3 through 1.21rc3, inclusive, go1.4-bootstrap-20170518.tar.gz, or go1.4-bootstrap-20170531.tar.gz. The user and group specified in Puppet code were ignored for files within the archive. dp-puppet version 1.2.7 will recreate installations if the owner or group of any file or directory within that installation does not match the requested owner or group",2024-03-01T14:04:26.010,https://cve.circl.lu/cve/CVE-2024-27294
CVE-2023-3019,4.0,QEMU,"A DMA reentrancy issue leading to a use-after-free error was found in the e1000e NIC emulation code in QEMU. This issue could allow a privileged guest user to crash the QEMU process on the host, resulting in a denial of service.",2024-03-07T19:57:07.887,https://cve.circl.lu/cve/CVE-2023-3019
CVE-2023-5088,5.9,QEMU,"A bug in QEMU could cause a guest I/O operation otherwise addressed to an arbitrary disk offset to be targeted to offset 0 instead (potentially overwriting the VM's boot code). This could be used, for example, by L2 guests with a virtual disk (vdiskL2) stored on a virtual disk of an L1 (vdiskL1) hypervisor to read and/or write data to LBA 0 of vdiskL1, potentially gaining control of L1 at its next reboot.",2024-03-07T17:46:40.173,https://cve.circl.lu/cve/CVE-2023-5088
CVE-2023-52434,NA,QEMU,"In the Linux kernel, the following vulnerability has been resolved:smb: client: fix potential OOBs in smb2_parse_contexts()Validate offsets and lengths before dereferencing create contexts insmb2_parse_contexts().This fixes following oops when accessing invalid create contexts fromserver:  BUG: unable to handle page fault for address: ffff8881178d8cc3  #PF: supervisor read access in kernel mode  #PF: error_code(0x0000) - not-present page  PGD 4a01067 P4D 4a01067 PUD 0  Oops: 0000 [#1] PREEMPT SMP NOPTI  CPU: 3 PID: 1736 Comm: mount.cifs Not tainted 6.7.0-rc4 #1  Hardware name: QEMU Standard PC (Q35 + ICH9, 2009), BIOS  rel-1.16.2-3-gd478f380-rebuilt.opensuse.org 04/01/2014  RIP: 0010:smb2_parse_contexts+0xa0/0x3a0 [cifs]  Code: f8 10 75 13 48 b8 93 ad 25 50 9c b4 11 e7 49 39 06 0f 84 d2 00  00 00 8b 45 00 85 c0 74 61 41 29 c5 48 01 c5 41 83 fd 0f 76 55 <0f> b7  7d 04 0f b7 45 06 4c 8d 74 3d 00 66 83 f8 04 75 bc ba 04 00  RSP: 0018:ffffc900007939e0 EFLAGS: 00010216  RAX: ffffc90000793c78 RBX: ffff8880180cc000 RCX: ffffc90000793c90  RDX: ffffc90000793cc0 RSI: ffff8880178d8cc0 RDI: ffff8880180cc000  RBP: ffff8881178d8cbf R08: ffffc90000793c22 R09: 0000000000000000  R10: ffff8880180cc000 R11: 0000000000000024 R12: 0000000000000000  R13: 0000000000000020 R14: 0000000000000000 R15: ffffc90000793c22  FS: 00007f873753cbc0(0000) GS:ffff88806bc00000(0000)  knlGS:0000000000000000  CS:  0010 DS: 0000 ES: 0000 CR0: 0000000080050033  CR2: ffff8881178d8cc3 CR3: 00000000181ca000 CR4: 0000000000750ef0  PKRU: 55555554  Call Trace:   <TASK>   ? __die+0x23/0x70   ? page_fault_oops+0x181/0x480   ? search_module_extables+0x19/0x60   ? srso_alias_return_thunk+0x5/0xfbef5   ? exc_page_fault+0x1b6/0x1c0   ? asm_exc_page_fault+0x26/0x30   ? smb2_parse_contexts+0xa0/0x3a0 [cifs]   SMB2_open+0x38d/0x5f0 [cifs]   ? smb2_is_path_accessible+0x138/0x260 [cifs]   smb2_is_path_accessible+0x138/0x260 [cifs]   cifs_is_path_remote+0x8d/0x230 [cifs]   cifs_mount+0x7e/0x350 [cifs]   cifs_smb3_do_mount+0x128/0x780 [cifs]   smb3_get_tree+0xd9/0x290 [cifs]   vfs_get_tree+0x2c/0x100   ? capable+0x37/0x70   path_mount+0x2d7/0xb80   ? srso_alias_return_thunk+0x5/0xfbef5   ? _raw_spin_unlock_irqrestore+0x44/0x60   __x64_sys_mount+0x11a/0x150   do_syscall_64+0x47/0xf0   entry_SYSCALL_64_after_hwframe+0x6f/0x77  RIP: 0033:0x7f8737657b1e",2024-03-01T14:15:53.143,https://cve.circl.lu/cve/CVE-2023-52434
CVE-2021-47080,NA,QEMU,"In the Linux kernel, the following vulnerability has been resolved:RDMA/core: Prevent divide-by-zero error triggered by the userThe user_entry_size is supplied by the user and later used as adenominator to calculate number of entries. The zero supplied by the userwill trigger the following divide-by-zero error: divide error: 0000 [#1] SMP KASAN PTI CPU: 4 PID: 497 Comm: c_repro Not tainted 5.13.0-rc1+ #281 Hardware name: QEMU Standard PC (i440FX + PIIX, 1996), BIOS rel-1.13.0-0-gf21b5a4aeb02-prebuilt.qemu.org 04/01/2014 RIP: 0010:ib_uverbs_handler_UVERBS_METHOD_QUERY_GID_TABLE+0x1b1/0x510 Code: 87 59 03 00 00 e8 9f ab 1e ff 48 8d bd a8 00 00 00 e8 d3 70 41 ff 44 0f b7 b5 a8 00 00 00 e8 86 ab 1e ff 31 d2 4c 89 f0 31 ff <49> f7 f5 48 89 d6 48 89 54 24 10 48 89 04 24 e8 1b ad 1e ff 48 8b RSP: 0018:ffff88810416f828 EFLAGS: 00010246 RAX: 0000000000000008 RBX: 1ffff1102082df09 RCX: ffffffff82183f3d RDX: 0000000000000000 RSI: ffff888105f2da00 RDI: 0000000000000000 RBP: ffff88810416fa98 R08: 0000000000000001 R09: ffffed102082df5f R10: ffff88810416faf7 R11: ffffed102082df5e R12: 0000000000000000 R13: 0000000000000000 R14: 0000000000000008 R15: ffff88810416faf0 FS:  00007f5715efa740(0000) GS:ffff88811a700000(0000) knlGS:0000000000000000 CS:  0010 DS: 0000 ES: 0000 CR0: 0000000080050033 CR2: 0000000020000840 CR3: 000000010c2e0001 CR4: 0000000000370ea0 DR0: 0000000000000000 DR1: 0000000000000000 DR2: 0000000000000000 DR3: 0000000000000000 DR6: 00000000fffe0ff0 DR7: 0000000000000400 Call Trace:  ? ib_uverbs_handler_UVERBS_METHOD_INFO_HANDLES+0x4b0/0x4b0  ib_uverbs_cmd_verbs+0x1546/0x1940  ib_uverbs_ioctl+0x186/0x240  __x64_sys_ioctl+0x38a/0x1220  do_syscall_64+0x3f/0x80  entry_SYSCALL_64_after_hwframe+0x44/0xae",2024-03-01T22:22:25.913,https://cve.circl.lu/cve/CVE-2021-47080
CVE-2024-20292,3.6,RDP,"A vulnerability in the logging component of Cisco Duo Authentication for Windows Logon and RDP could allow an authenticated, local attacker to view sensitive information in clear text on an affected system.  This vulnerability is due to improper storage of an unencrypted registry key in certain logs. An attacker could exploit this vulnerability by accessing the logs on an affected system. A successful exploit could allow the attacker to view sensitive information in clear text.",2024-03-07T13:52:27.110,https://cve.circl.lu/cve/CVE-2024-20292
CVE-2024-20301,5.9,RDP,"A vulnerability in Cisco Duo Authentication for Windows Logon and RDP could allow an authenticated, physical attacker to bypass secondary authentication and access an affected Windows device.  This vulnerability is due to a failure to invalidate locally created trusted sessions after a reboot of the affected device. An attacker with primary user credentials could exploit this vulnerability by attempting to authenticate to an affected device. A successful exploit could allow the attacker to access the affected device without valid permissions.",2024-03-07T13:52:27.110,https://cve.circl.lu/cve/CVE-2024-20301
CVE-2021-47082,NA,Red Hat,"In the Linux kernel, the following vulnerability has been resolved:tun: avoid double free in tun_free_netdevAvoid double free in tun_free_netdev() by moving thedev->tstats and tun->security allocs to a new ndo_init routine(tun_net_init()) that will be called by register_netdevice().ndo_init is paired with the desctructor (tun_free_netdev()),so if there's an error in register_netdevice() the destructorwill handle the frees.BUG: KASAN: double-free or invalid-free in selinux_tun_dev_free_security+0x1a/0x20 security/selinux/hooks.c:5605CPU: 0 PID: 25750 Comm: syz-executor416 Not tainted 5.16.0-rc2-syzk #1Hardware name: Red Hat KVM, BIOSCall Trace:<TASK>__dump_stack lib/dump_stack.c:88 [inline]dump_stack_lvl+0x89/0xb5 lib/dump_stack.c:106print_address_description.constprop.9+0x28/0x160 mm/kasan/report.c:247kasan_report_invalid_free+0x55/0x80 mm/kasan/report.c:372____kasan_slab_free mm/kasan/common.c:346 [inline]__kasan_slab_free+0x107/0x120 mm/kasan/common.c:374kasan_slab_free include/linux/kasan.h:235 [inline]slab_free_hook mm/slub.c:1723 [inline]slab_free_freelist_hook mm/slub.c:1749 [inline]slab_free mm/slub.c:3513 [inline]kfree+0xac/0x2d0 mm/slub.c:4561selinux_tun_dev_free_security+0x1a/0x20 security/selinux/hooks.c:5605security_tun_dev_free_security+0x4f/0x90 security/security.c:2342tun_free_netdev+0xe6/0x150 drivers/net/tun.c:2215netdev_run_todo+0x4df/0x840 net/core/dev.c:10627rtnl_unlock+0x13/0x20 net/core/rtnetlink.c:112__tun_chr_ioctl+0x80c/0x2870 drivers/net/tun.c:3302tun_chr_ioctl+0x2f/0x40 drivers/net/tun.c:3311vfs_ioctl fs/ioctl.c:51 [inline]__do_sys_ioctl fs/ioctl.c:874 [inline]__se_sys_ioctl fs/ioctl.c:860 [inline]__x64_sys_ioctl+0x19d/0x220 fs/ioctl.c:860do_syscall_x64 arch/x86/entry/common.c:50 [inline]do_syscall_64+0x3a/0x80 arch/x86/entry/common.c:80entry_SYSCALL_64_after_hwframe+0x44/0xae",2024-03-05T13:41:01.900,https://cve.circl.lu/cve/CVE-2021-47082
CVE-2022-3734,5.9,Redis,A vulnerability was found in a port or fork of Redis. It has been declared as critical. This vulnerability affects unknown code in the library C:/Program Files/Redis/dbghelp.dll. The manipulation leads to uncontrolled search path. The attack can be initiated remotely. The exploit has been disclosed to the public and may be used. The real existence of this vulnerability is still doubted at the moment. The identifier of this vulnerability is VDB-212416. NOTE: The official Redis release is not affected. This issue might affect an unofficial fork or port on Windows only.,2024-03-04T22:55:48.850,https://cve.circl.lu/cve/CVE-2022-3734
CVE-2023-31655,3.6,Redis,redis v7.0.10 was discovered to contain a segmentation violation. This vulnerability allows attackers to cause a Denial of Service (DoS) via unspecified vectors.,2024-03-07T20:15:49.820,https://cve.circl.lu/cve/CVE-2023-31655
CVE-2024-27917,3.6,Redis,"Shopware is an open commerce platform based on Symfony Framework and Vue. The Symfony Session Handler pops the Session Cookie and assigns it to the Response. Since Shopware 6.5.8.0, the 404 pages are cached to improve the performance of 404 pages. So the cached Response which contains a Session Cookie when the Browser accessing the 404 page, has no cookies yet. The Symfony Session Handler is in use, when no explicit Session configuration has been done. When Redis is in use for Sessions using the PHP Redis extension, this exploiting code is not used. Shopware version 6.5.8.7 contains a patch for this issue. As a workaround, use Redis for Sessions, as this does not trigger the exploit code.",2024-03-06T21:42:48.053,https://cve.circl.lu/cve/CVE-2024-27917
CVE-2024-24275,NA,Remote Desktop,Cross Site Scripting vulnerability in Teamwire Windows desktop client v.2.0.1 through v.2.4.0 allows a remote attacker to obtain sensitive information via a crafted payload to the global search function.,2024-03-06T15:18:08.093,https://cve.circl.lu/cve/CVE-2024-24275
CVE-2024-24276,NA,Remote Desktop,"Cross Site Scripting (XSS) vulnerability in Teamwire Windows desktop client v.2.0.1 through v.2.4.0 allows a remote attacker to obtain sensitive information via a crafted payload to the chat name, message preview, username and group name components.",2024-03-06T15:18:08.093,https://cve.circl.lu/cve/CVE-2024-24276
CVE-2024-24278,NA,Remote Desktop,An issue in Teamwire Windows desktop client v.2.0.1 through v.2.4.0 allows a remote attacker to obtain sensitive information via a crafted payload to the message function.,2024-03-06T15:18:08.093,https://cve.circl.lu/cve/CVE-2024-24278
CVE-2024-0968,3.4,Repository,Cross-site Scripting (XSS) - DOM in GitHub repository langchain-ai/chat-langchain prior to 0.0.0.,2024-03-04T13:58:23.447,https://cve.circl.lu/cve/CVE-2024-0968
CVE-2024-28088,NA,Repository,"LangChain through 0.1.10 allows ../ directory traversal by an actor who is able to control the final part of the path parameter in a load_chain call. This bypasses the intended behavior of loading configurations only from the hwchase17/langchain-hub GitHub repository. The outcome can be disclosure of an API key for a large language model online service, or remote code execution.",2024-03-04T13:58:23.447,https://cve.circl.lu/cve/CVE-2024-28088
CVE-2023-42509,5.9,Repository,JFrog Artifactory later than version 7.17.4 but prior to version 7.77.0 is vulnerable to an issue whereby a sequence of improperly handled exceptions in repository configuration initialization steps may lead to exposure of sensitive data.,2024-03-07T14:15:46.187,https://cve.circl.lu/cve/CVE-2023-42509
CVE-2023-42536,5.9,SAP,An improper input validation in saped_dec in libsaped prior to SMR Nov-2023 Release 1 allows local attackers to cause out-of-bounds read and write.,2024-03-04T09:15:37.057,https://cve.circl.lu/cve/CVE-2023-42536
CVE-2023-42538,5.9,SAP,An improper input validation in saped_rec_silence in libsaped prior to SMR Nov-2023 Release 1 allows local attackers to cause out-of-bounds read and write.,2024-03-04T09:15:37.553,https://cve.circl.lu/cve/CVE-2023-42538
CVE-2024-0971,3.6,SQL,"A SQL injection vulnerability exists where an authenticated, low-privileged remote attacker could potentially alter scan DB content.",2024-03-04T22:58:00.967,https://cve.circl.lu/cve/CVE-2024-0971
CVE-2024-24213,5.9,SQL,"Supabase PostgreSQL v15.1 was discovered to contain a SQL injection vulnerability via the component /pg_meta/default/query. NOTE: the vendor's position is that this is an intended feature; also, it exists in the Supabase dashboard product, not the Supabase PostgreSQL product. Specifically, /pg_meta/default/query is for SQL queries that are entered in an intended UI by an authorized user. Nothing is injected.",2024-03-05T02:15:27.493,https://cve.circl.lu/cve/CVE-2024-24213
CVE-2024-0853,1.4,SSL,"curl inadvertently kept the SSL session ID for connections in its cache even when the verify status (*OCSP stapling*) test failed. A subsequent transfer tothe same hostname could then succeed if the session ID cache was still fresh, which then skipped the verify status check.",2024-03-07T17:15:12.657,https://cve.circl.lu/cve/CVE-2024-0853
CVE-2024-28161,NA,SSL,"In Jenkins Delphix Plugin 3.0.1, a global option for administrators to enable or disable SSL/TLS certificate validation for Data Control Tower (DCT) connections is disabled by default.",2024-03-06T21:42:54.697,https://cve.circl.lu/cve/CVE-2024-28161
CVE-2024-28162,NA,SSL,In Jenkins Delphix Plugin 3.0.1 through 3.1.0 (both inclusive) a global option for administrators to enable or disable SSL/TLS certificate validation for Data Control Tower (DCT) connections fails to take effect until Jenkins is restarted when switching from disabled validation to enabled validation.,2024-03-06T21:42:54.697,https://cve.circl.lu/cve/CVE-2024-28162
CVE-2024-0692,5.9,Solarwinds,"The SolarWinds Security Event Manager was susceptible to Remote Code Execution Vulnerability. This vulnerability allows an unauthenticated user to abuse SolarWinds’ service, resulting in remote code execution.",2024-03-01T14:04:04.827,https://cve.circl.lu/cve/CVE-2024-0692
CVE-2022-20920,4.0,SSH,"A vulnerability in the SSH implementation of Cisco IOS Software and Cisco IOS XE Software could allow an authenticated, remote attacker to cause an affected device to reload. This vulnerability is due to improper handling of resources during an exceptional situation. An attacker could exploit this vulnerability by continuously connecting to an affected device and sending specific SSH requests. A successful exploit could allow the attacker to cause the affected device to reload.",2024-03-06T15:22:06.480,https://cve.circl.lu/cve/CVE-2022-20920
CVE-2023-52160,3.6,TLS,"The implementation of PEAP in wpa_supplicant through 2.10 allows authentication bypass. For a successful attack, wpa_supplicant must be configured to not verify the network's TLS certificate during Phase 1 authentication, and an eap_peap_decrypt vulnerability can then be abused to skip Phase 2 authentication. The attack vector is sending an EAP-TLV Success packet instead of starting Phase 2. This allows an adversary to impersonate Enterprise Wi-Fi networks.",2024-03-04T22:47:18.233,https://cve.circl.lu/cve/CVE-2023-52160
CVE-2023-50312,3.6,TLS,IBM WebSphere Application Server Liberty 17.0.0.3 through 24.0.0.2 could provide weaker than expected security for outbound TLS connections caused by a failure to honor user configuration.  IBM X-Force ID:  274711.,2024-03-01T14:04:26.010,https://cve.circl.lu/cve/CVE-2023-50312
CVE-2024-2048,5.9,TLS,"Vault and Vault Enterprise (“Vault”) TLS certificate auth method did not correctly validate client certificates when configured with a non-CA certificate as trusted certificate. In this configuration, an attacker may be able to craft a malicious certificate that could be used to bypass authentication. Fixed in Vault 1.15.5 and 1.14.10.",2024-03-05T13:41:01.900,https://cve.circl.lu/cve/CVE-2024-2048
CVE-2024-24783,NA,TLS,"Verifying a certificate chain which contains a certificate with an unknown public key algorithm will cause Certificate.Verify to panic. This affects all crypto/tls clients, and servers that set Config.ClientAuth to VerifyClientCertIfGiven or RequireAndVerifyClientCert. The default behavior is for TLS servers to not verify client certificates.",2024-03-06T15:18:08.093,https://cve.circl.lu/cve/CVE-2024-24783
CVE-2024-22256,6.0,VMware,VMware Cloud Director contains a partial information disclosure vulnerability. A malicious actor can potentially gather information about organization names based on the behavior of the instance.,2024-03-07T13:52:27.110,https://cve.circl.lu/cve/CVE-2024-22256
CVE-2021-45810,3.6,VPN,"GlobalProtect-openconnect versions prior to 2.0.0 (exclusive) are affected by incorrect access control in GPService through DBUS, GUI. The way GlobalProtect-Openconnect is set up enables arbitrary users to start a VPN connection to arbitrary servers. By hosting an openconnect compatible server, the attack can redirect the entire host's traffic via their own server.",2024-03-05T22:15:46.827,https://cve.circl.lu/cve/CVE-2021-45810
CVE-2024-27567,NA,VPN,LBT T300- T390 v2.2.1.8 were discovered to contain a stack overflow via the vpn_client_ip parameter in the config_vpn_pptp function. This vulnerability allows attackers to cause a Denial of Service (DoS) via a crafted POST request.,2024-03-01T15:23:36.177,https://cve.circl.lu/cve/CVE-2024-27567
CVE-2024-20337,4.7,VPN,"A vulnerability in the SAML authentication process of Cisco Secure Client could allow an unauthenticated, remote attacker to conduct a carriage return line feed (CRLF) injection attack against a user.  This vulnerability is due to insufficient validation of user-supplied input. An attacker could exploit this vulnerability by persuading a user to click a crafted link while establishing a VPN session. A successful exploit could allow the attacker to execute arbitrary script code in the browser or access sensitive, browser-based information, including a valid SAML token. The attacker could then use the token to establish a remote access VPN session with the privileges of the affected user. Individual hosts and services behind the VPN headend would still need additional credentials for successful access.",2024-03-07T13:52:27.110,https://cve.circl.lu/cve/CVE-2024-20337
CVE-2024-2128,2.7,Vim,"The EmbedPress – Embed PDF, Google Docs, Vimeo, Wistia, Embed YouTube Videos, Audios, Maps & Embed Any Documents in Gutenberg & Elementor plugin for WordPress is vulnerable to Stored Cross-Site Scripting via the plugin's embed widget in all versions up to, and including, 3.9.10 due to insufficient input sanitization and output escaping on user supplied attributes. This makes it possible for authenticated attackers with contributor-level and above permissions to inject arbitrary web scripts in pages that will execute whenever a user accesses an injected page.",2024-03-07T20:15:51.097,https://cve.circl.lu/cve/CVE-2024-2128
CVE-2024-1802,2.7,Vim,"The EmbedPress – Embed PDF, Google Docs, Vimeo, Wistia, Embed YouTube Videos, Audios, Maps & Embed Any Documents in Gutenberg & Elementor plugin for WordPress is vulnerable to Stored Cross-Site Scripting via the plugin's Wistia embed block in all versions up to, and including, 3.9.10 due to insufficient input sanitization and output escaping on the user supplied url. This makes it possible for authenticated attackers with contributor-level and above permissions to inject arbitrary web scripts in pages that will execute whenever a user accesses an injected page.",2024-03-07T21:15:07.837,https://cve.circl.lu/cve/CVE-2024-1802
CVE-2023-38161,5.9,Windows,Windows GDI Elevation of Privilege Vulnerability,2024-03-07T17:46:16.493,https://cve.circl.lu/cve/CVE-2023-38161
CVE-2019-10271,1.4,WordPress,"An issue was discovered in the Ultimate Member plugin 2.39 for WordPress. It allows unauthorized profile and cover picture modification. It is possible to modify the profile and cover picture of any user once one is connected. One can also modify the profiles and cover pictures of privileged users. To perform such a modification, one first needs to (for example) intercept an upload-picture request and modify the user_id parameter.",2024-03-05T21:11:12.187,https://cve.circl.lu/cve/CVE-2019-10271
CVE-2023-5665,2.7,WordPress,"The Payment Forms for Paystack plugin for WordPress is vulnerable to Stored Cross-Site Scripting via the plugin's shortcodes in all versions up to, and including, 3.4.1 due to insufficient input sanitization and output escaping on user supplied attributes. This makes it possible for authenticated attackers with contributor-level and above permissions to inject arbitrary web scripts in pages that will execute whenever a user accesses an injected page.",2024-03-05T20:23:44.463,https://cve.circl.lu/cve/CVE-2023-5665
CVE-2024-1120,1.4,WordPress,"The NextMove Lite – Thank You Page for WooCommerce and Finale Lite – Sales Countdown Timer & Discount for WooCommerce plugins for WordPress are vulnerable to unauthorized access of data due to a missing capability check on the download_tools_settings() function in all versions up to, and including, 2.17.0. This makes it possible for unauthenticated attackers to export system information that can aid attackers in an attack.",2024-03-01T14:04:04.827,https://cve.circl.lu/cve/CVE-2024-1120
CVE-2024-1592,1.4,WordPress,"The Complianz – GDPR/CCPA Cookie Consent plugin for WordPress is vulnerable to Cross-Site Request Forgery in all versions up to, and including, 6.5.6. This is due to missing or incorrect nonce validation on the process_delete function in class-DNSMPD.php. This makes it possible for unauthenticated attackers to delete GDPR data requests via a forged request granted they can trick a site administrator into performing an action such as clicking on a link.",2024-03-04T13:58:23.447,https://cve.circl.lu/cve/CVE-2024-1592
CVE-2021-47073,NA,WMI,"In the Linux kernel, the following vulnerability has been resolved:platform/x86: dell-smbios-wmi: Fix oops on rmmod dell_smbiosinit_dell_smbios_wmi() only registers the dell_smbios_wmi_driver on systemswhere the Dell WMI interface is supported. While exit_dell_smbios_wmi()unregisters it unconditionally, this leads to the following oops:[  175.722921] ------------[ cut here ]------------[  175.722925] Unexpected driver unregister![  175.722939] WARNING: CPU: 1 PID: 3630 at drivers/base/driver.c:194 driver_unregister+0x38/0x40...[  175.723089] Call Trace:[  175.723094]  cleanup_module+0x5/0xedd [dell_smbios]...[  175.723148] ---[ end trace 064c34e1ad49509d ]---Make the unregister happen on the same condition the register happensto fix this.",2024-03-01T22:22:25.913,https://cve.circl.lu/cve/CVE-2021-47073
CVE-2024-1451,5.8,XSS,"An issue has been discovered in GitLab CE/EE affecting all versions starting from 16.9 before 16.9.1. A crafted payload  added to the user profile page could lead to a stored XSS on the client side, allowing attackers to perform arbitrary actions on behalf of victims.""",2024-03-04T20:12:59.223,https://cve.circl.lu/cve/CVE-2024-1451
CVE-2023-50378,NA,XSS,"Lack of proper input validation and constraint enforcement in Apache Ambari prior to 2.7.8   Impact : As it will be stored XSS, Could be exploited to perform unauthorized actions, varying from data access to session hijacking and delivering malicious payloads. Users are recommended to upgrade to version  2.7.8 which fixes this issue.",2024-03-01T15:23:36.177,https://cve.circl.lu/cve/CVE-2023-50378
CVE-2023-4479,5.2,XSS,Stored XSS Vulnerability in M-Files Web versions before 23.8 allows attacker to execute script on users browser via stored HTML document within limited time period.,2024-03-04T13:58:23.447,https://cve.circl.lu/cve/CVE-2023-4479
CVE-2024-2179,1.4,XSS,Concrete CMS version 9 before 9.2.7 is vulnerable to Stored XSS via the Name field of a Group type since there is insufficient validation of administrator provided data for that field. A rogue administrator could inject malicious code into the Name field which might be executed when users visit the affected page. The Concrete CMS security team gave this vulnerability a CVSS v3.1 score of 2.2 with a vector of AV:N/AC:H/PR:H/UI:N/S:U/C:L/I:N/A:N  Concrete versions below 9 do not include group types so they are not affected by this vulnerability. Thanks Luca Fuda for reporting.,2024-03-06T15:18:08.093,https://cve.circl.lu/cve/CVE-2024-2179
