CVE,"Impact Score (1-10, 10 being the worst)",Keyword,Description,Last Modified,Link
CVE-2024-23449,1.4,Elasticsearch,An uncaught exception in Elasticsearch >= 8.4.0 and < 8.11.1 occurs when an encrypted PDF is passed to an attachment processor through the REST API. The Elasticsearch ingest node that attempts to parse the PDF file will crash. This does not happen with password-protected PDF files or with unencrypted PDF files.,2024-03-29T12:45:02.937,https://cve.circl.lu/cve/CVE-2024-23449
CVE-2024-29814,3.7,Exchange,Improper Neutralization of Input During Web Page Generation ('Cross-site Scripting') vulnerability in CurrencyRate.Today Exchange Rates Widget allows Stored XSS.This issue affects Exchange Rates Widget: from n/a through 1.4.0.,2024-03-27T12:29:30.307,https://cve.circl.lu/cve/CVE-2024-29814
CVE-2023-6951,4.0,Exchange,"A Use of Weak Credentials vulnerability affecting the Wi-Fi network generated by a set of DJI drones could allow a remote attacker to derive the WPA2 PSK key and authenticate without permission to the drone’s Wi- Fi network. This, in turn, allows the attacker to perform unauthorized interaction with the network services exposed by the drone and to potentially decrypt the Wi-Fi traffic exchanged between the drone and the Android/IOS device of the legitimate user during QuickTransfer mode. Affected models are Mavic 3 Pro until v01.01.0300, Mavic 3 until v01.00.1200, Mavic 3 Classic until v01.00.0500, Mavic 3 Enterprise until v07.01.10.03, Matrice 300 until v57.00.01.00, Matrice M30 until v07.01.0022 and Mini 3 Pro until v01.00.0620.",2024-04-02T12:50:42.233,https://cve.circl.lu/cve/CVE-2023-6951
CVE-2018-8822,5.9,Exploit,"Incorrect buffer length handling in the ncp_read_kernel function in fs/ncpfs/ncplib_kernel.c in the Linux kernel through 4.15.11, and in drivers/staging/ncpfs/ncplib_kernel.c in the Linux kernel 4.16-rc through 4.16-rc6, could be exploited by malicious NCPFS servers to crash the kernel or execute code.",2024-03-28T16:08:31.410,https://cve.circl.lu/cve/CVE-2018-8822
CVE-2021-30560,5.9,Exploit,Use after free in Blink XSLT in Google Chrome prior to 91.0.4472.164 allowed a remote attacker to potentially exploit heap corruption via a crafted HTML page.,2024-03-27T14:45:52.567,https://cve.circl.lu/cve/CVE-2021-30560
CVE-2021-3631,5.2,Exploit,"A flaw was found in libvirt while it generates SELinux MCS category pairs for VMs' dynamic labels. This flaw allows one exploited guest to access files labeled for another guest, resulting in the breaking out of sVirt confinement. The highest threat from this vulnerability is to confidentiality and integrity.",2024-04-01T13:16:41.153,https://cve.circl.lu/cve/CVE-2021-3631
CVE-2022-0897,1.4,Exploit,"A flaw was found in the libvirt nwfilter driver. The virNWFilterObjListNumOfNWFilters method failed to acquire the driver->nwfilters mutex before iterating over virNWFilterObj instances. There was no protection to stop another thread from concurrently modifying the driver->nwfilters object. This flaw allows a malicious, unprivileged user to exploit this issue via libvirt's API virConnectNumOfNWFilters to crash the network filter management daemon (libvirtd/virtnwfilterd).",2024-04-01T13:16:57.670,https://cve.circl.lu/cve/CVE-2022-0897
CVE-2023-1018,3.6,Exploit,An out-of-bounds read vulnerability exists in TPM2.0's Module Library allowing a 2-byte read past the end of a TPM2.0 command in the CryptParameterDecryption routine. An attacker who can successfully exploit this vulnerability can read or access sensitive data stored in the TPM.,2024-04-01T15:50:11.033,https://cve.circl.lu/cve/CVE-2023-1018
CVE-2022-45169,2.7,Endpoint,"An issue was discovered in LIVEBOX Collaboration vDesk through v031. A URL Redirection to an Untrusted Site (Open Redirect) can occur under the /api/v1/notification/createnotification endpoint, allowing an authenticated user to send an arbitrary push notification to any other user of the system. This push notification can include an (invisible) clickable link.",2024-04-01T15:52:55.667,https://cve.circl.lu/cve/CVE-2022-45169
CVE-2022-45177,3.6,Endpoint,"An issue was discovered in LIVEBOX Collaboration vDesk through v031. An Observable Response Discrepancy can occur under the /api/v1/vdeskintegration/user/isenableuser endpoint, the /api/v1/sharedsearch?search={NAME]+{SURNAME] endpoint, and the /login endpoint. The web application provides different responses to incoming requests in a way that reveals internal state information to an unauthorized actor outside of the intended control sphere.",2024-04-01T15:52:59.233,https://cve.circl.lu/cve/CVE-2022-45177
CVE-2022-45179,2.7,Endpoint,"An issue was discovered in LIVEBOX Collaboration vDesk through v031. A basic XSS vulnerability exists under the /api/v1/vdeskintegration/todo/createorupdate endpoint via the title parameter and /dashboard/reminders. A remote user (authenticated to the product) can store arbitrary HTML code in the reminder section title in order to corrupt the web page (for example, by creating phishing sections to exfiltrate victims' credentials).",2024-04-01T15:52:47.307,https://cve.circl.lu/cve/CVE-2022-45179
CVE-2024-2206,3.4,Endpoint,The /proxy route allows a user to proxy arbitrary urls including potential internal endpoints.,2024-03-27T12:29:30.307,https://cve.circl.lu/cve/CVE-2024-2206
CVE-2024-30468,1.4,Firewall,Cross-Site Request Forgery (CSRF) vulnerability in All In One WP Security & Firewall Team All In One WP Security & Firewall.This issue affects All In One WP Security & Firewall: from n/a through 5.2.6.,2024-04-01T01:12:59.077,https://cve.circl.lu/cve/CVE-2024-30468
CVE-2024-0259,5.9,Fortra,"Fortra's Robot Schedule Enterprise Agent for Windows prior to version 3.04 is susceptible to privilege escalation. A low-privileged user can overwrite the service executable. When the service is restarted, the replaced binary runs with local system privileges, allowing a low-privileged user to gain elevated privileges.",2024-03-28T16:07:30.893,https://cve.circl.lu/cve/CVE-2024-0259
CVE-2023-6371,5.8,GitLab,"An issue has been discovered in GitLab CE/EE affecting all versions before 16.8.5, all versions starting from 16.9 before 16.9.3, all versions starting from 16.10 before 16.10.1. A wiki page with a crafted payload may lead to a Stored XSS, allowing attackers to perform arbitrary actions on behalf of victims.",2024-03-28T12:42:56.150,https://cve.circl.lu/cve/CVE-2023-6371
CVE-2024-2818,1.4,GitLab,"An issue has been discovered in GitLab CE/EE affecting all versions before 16.8.5, all versions starting from 16.9 before 16.9.3, all versions starting from 16.10 before 16.10.1. It was possible for an attacker to cause a denial of service using malicious crafted description parameter for labels.",2024-03-28T12:42:56.150,https://cve.circl.lu/cve/CVE-2024-2818
CVE-2024-1394,3.6,Golang,"A memory leak flaw was found in Golang in the RSA encrypting/decrypting code, which might lead to a resource exhaustion vulnerability using attacker-controlled inputs​. The memory leak happens in github.com/golang-fips/openssl/openssl/rsa.go#L113. The objects leaked are pkey​ and ctx​. That function uses named return parameters to free pkey​ and ctx​ if there is an error initializing the context or setting the different properties. All return statements related to error cases follow the ""return nil, nil, fail(...)"" pattern, meaning that pkey​ and ctx​ will be nil inside the deferred function that should free them.",2024-04-03T00:15:08.400,https://cve.circl.lu/cve/CVE-2024-1394
CVE-2024-2625,5.9,Google,Object lifecycle issue in V8 in Google Chrome prior to 123.0.6312.58 allowed a remote attacker to potentially exploit object corruption via a crafted HTML page. (Chromium security severity: High),2024-04-01T15:32:17.010,https://cve.circl.lu/cve/CVE-2024-2625
CVE-2024-2626,3.6,Google,Out of bounds read in Swiftshader in Google Chrome prior to 123.0.6312.58 allowed a remote attacker to perform out of bounds memory access via a crafted HTML page. (Chromium security severity: Medium),2024-04-01T15:22:37.883,https://cve.circl.lu/cve/CVE-2024-2626
CVE-2024-2627,5.9,Google,Use after free in Canvas in Google Chrome prior to 123.0.6312.58 allowed a remote attacker to potentially exploit heap corruption via a crafted HTML page. (Chromium security severity: Medium),2024-04-01T15:22:56.233,https://cve.circl.lu/cve/CVE-2024-2627
CVE-2024-2628,1.4,Google,Inappropriate implementation in Downloads in Google Chrome prior to 123.0.6312.58 allowed a remote attacker to perform UI spoofing via a crafted URL. (Chromium security severity: Medium),2024-04-01T15:23:07.793,https://cve.circl.lu/cve/CVE-2024-2628
CVE-2024-1313,3.6,Grafana,"It is possible for a user in a different organization from the owner of a snapshot to bypass authorization and delete a snapshot by issuing a DELETE request to /api/snapshots/<key> using its view key. This functionality is intended to only be available to individuals with the permission to write/edit to the snapshot in question, but due to a bug in the authorization logic, deletion requests issued by an unprivileged user in a different organization than the snapshot owner are treated as authorized.Grafana Labs would like to thank Ravid Mazon and Jay Chen of Palo Alto Research for discovering and disclosing this vulnerability.This issue affects Grafana: from 9.5.0 before 9.5.18, from 10.0.0 before 10.0.13, from 10.1.0 before 10.1.9, from 10.2.0 before 10.2.6, from 10.3.0 before 10.3.5.",2024-03-27T12:29:41.530,https://cve.circl.lu/cve/CVE-2024-1313
CVE-2023-31634,NA,Grafana,"In TeslaMate before 1.27.2, there is unauthorized access to port 4000 for remote viewing and operation of user data. After accessing the IP address for the TeslaMate instance, an attacker can switch the port to 3000 to enter Grafana for remote operations. At that time, the default username and password can be used to enter the Grafana management console without logging in, a related issue to CVE-2022-23126.",2024-03-27T12:29:30.307,https://cve.circl.lu/cve/CVE-2023-31634
CVE-2023-47846,6.0,GitHub,Unrestricted Upload of File with Dangerous Type vulnerability in Terry Lin WP Githuber MD.This issue affects WP Githuber MD: from n/a through 1.16.2.,2024-03-27T12:29:30.307,https://cve.circl.lu/cve/CVE-2023-47846
CVE-2024-22436,3.6,HPE,A security vulnerability in HPE IceWall Agent products could be exploited remotely to cause a denial of service.,2024-03-27T12:29:41.530,https://cve.circl.lu/cve/CVE-2024-22436
CVE-2024-22352,3.6,IBM,IBM InfoSphere Information Server 11.7 stores potentially sensitive information in log files that could be read by a local user.  IBM X-Force ID:  280361.,2024-04-01T15:23:54.530,https://cve.circl.lu/cve/CVE-2024-22352
CVE-2023-47715,1.4,IBM,IBM Storage Protect Plus Server 10.1.0 through 10.1.16 could allow an authenticated user with read-only permissions to add or delete entries from an existing HyperVisor configuration.  IBM X-Force ID:  271538.,2024-04-01T15:27:50.130,https://cve.circl.lu/cve/CVE-2023-47715
CVE-2022-32751,1.4,IBM,IBM Security Verify Directory 10.0.0 could disclose sensitive server information that could be used in further attacks against the system.  IBM X-Force ID:  228437.,2024-04-01T15:28:05.580,https://cve.circl.lu/cve/CVE-2022-32751
CVE-2022-32754,2.7,IBM,IBM Security Verify Directory 10.0.0 is vulnerable to cross-site scripting. This vulnerability allows users to embed arbitrary JavaScript code in the Web UI thus altering the intended functionality potentially leading to credentials disclosure within a trusted session.  IBM X-Force ID:  228445.,2024-04-01T15:29:43.033,https://cve.circl.lu/cve/CVE-2022-32754
CVE-2023-29162,5.5,Intel,Improper buffer restrictions the Intel(R) C++ Compiler Classic before version 2021.8 for Intel(R) oneAPI Toolkits before version 2022.3.1 may allow a privileged user to potentially enable escalation of privilege via local access.,2024-03-28T16:15:07.657,https://cve.circl.lu/cve/CVE-2023-29162
CVE-2023-35121,6.0,Intel,Improper access control in the Intel(R) oneAPI DPC++/C++ Compiler before version 2022.2.1 for some Intel(R) oneAPI Toolkits before version  2022.3.1 may allow authenticated user to potentially enable escalation of privilege via local access.,2024-03-28T15:15:45.453,https://cve.circl.lu/cve/CVE-2023-35121
CVE-2024-26646,NA,Intel,"In the Linux kernel, the following vulnerability has been resolved:thermal: intel: hfi: Add syscore callbacks for system-wide PMThe kernel allocates a memory buffer and provides its location to thehardware, which uses it to update the HFI table. This allocation occursduring boot and remains constant throughout runtime.When resuming from hibernation, the restore kernel allocates a secondmemory buffer and reprograms the HFI hardware with the new location aspart of a normal boot. The location of the second memory buffer maydiffer from the one allocated by the image kernel.When the restore kernel transfers control to the image kernel, its HFIbuffer becomes invalid, potentially leading to memory corruption if thehardware writes to it (the hardware continues to use the buffer from therestore kernel).It is also possible that the hardware ""forgets"" the address of the memorybuffer when resuming from ""deep"" suspend. Memory corruption may also occurin such a scenario.To prevent the described memory corruption, disable HFI when preparing tosuspend or hibernate. Enable it when resuming.Add syscore callbacks to handle the package of the boot CPU (packages ofnon-boot CPUs are handled via CPU offline). Syscore ops always run on theboot CPU. Additionally, HFI only needs to be disabled during ""deep"" suspendand hibernation. Syscore ops only run in these cases.[ rjw: Comment adjustment, subject and changelog edits ]",2024-03-27T12:29:41.530,https://cve.circl.lu/cve/CVE-2024-26646
CVE-2024-29890,5.9,Intel,DataLens is a business intelligence and data visualization system. A specifically crafted request allowed the creation of a special chart type with the ability to pass custom javascript code that would later be executed in an unprotected sandbox on subsequent requests to that chart. The problem was fixed in the datalens-ui version `0.1449.0`. Restricting access to the API for creating or modifying charts (`/charts/api/charts/v1/`) would mitigate the issue.,2024-04-01T01:12:59.077,https://cve.circl.lu/cve/CVE-2024-29890
CVE-2024-2745,1.4,Insight,"Rapid7's InsightVM maintenance mode login page suffers from a sensitive information exposure vulnerability whereby, sensitive information is exposed through query strings in the URL when login is attempted before the page is fully loaded.  This vulnerability allows attackers to acquire sensitive information such as passwords, auth tokens, usernames etc.   The vulnerability is remediated in version 6.6.244. ",2024-04-02T12:50:42.233,https://cve.circl.lu/cve/CVE-2024-2745
CVE-2013-5788,10.0,Java,"Unspecified vulnerability in Oracle Java SE 7u40 and earlier and Java SE Embedded 7u40 and earlier allows remote attackers to affect confidentiality, integrity, and availability via unknown vectors related to Deployment.",2024-04-01T15:50:29.317,https://cve.circl.lu/cve/CVE-2013-5788
CVE-2022-41946,3.6,Java,"pgjdbc is an open source postgresql JDBC Driver. In affected versions a prepared statement using either `PreparedStatement.setText(int, InputStream)` or `PreparedStatemet.setBytea(int, InputStream)` will create a temporary file if the InputStream is larger than 2k. This will create a temporary file which is readable by other users on Unix like systems, but not MacOS. On Unix like systems, the system's temporary directory is shared between all users on that system. Because of this, when files and directories are written into this directory they are, by default, readable by other users on that same system. This vulnerability does not allow other users to overwrite the contents of these directories or files. This is purely an information disclosure vulnerability. Because certain JDK file system APIs were only added in JDK 1.7, this this fix is dependent upon the version of the JDK you are using. Java 1.7 and higher users: this vulnerability is fixed in 4.5.0. Java 1.6 and lower users: no patch is available. If you are unable to patch, or are stuck running on Java 1.6, specifying the java.io.tmpdir system environment variable to a directory that is exclusively owned by the executing user will mitigate this vulnerability.",2024-03-29T13:15:13.690,https://cve.circl.lu/cve/CVE-2022-41946
CVE-2023-32787,3.6,Java,The OPC UA Legacy Java Stack before 6f176f2 enables an attacker to block OPC UA server applications via uncontrolled resource consumption so that they can no longer serve client applications.,2024-04-02T14:49:48.757,https://cve.circl.lu/cve/CVE-2023-32787
CVE-2024-22201,3.6,Java,"Jetty is a Java based web server and servlet engine. An HTTP/2 SSL connection that is established and TCP congested will be leaked when it times out. An attacker can cause many connections to end up in this state, and the server may run out of file descriptors, eventually causing the server to stop accepting new connections from valid clients. The vulnerability is patched in 9.4.54, 10.0.20, 11.0.20, and 12.0.6.",2024-03-29T13:15:14.077,https://cve.circl.lu/cve/CVE-2024-22201
CVE-2024-28176,3.6,Java,"jose is JavaScript module for JSON Object Signing and Encryption, providing support for JSON Web Tokens (JWT), JSON Web Signature (JWS), JSON Web Encryption (JWE), JSON Web Key (JWK), JSON Web Key Set (JWKS), and more. A vulnerability has  been identified in the JSON Web Encryption (JWE) decryption interfaces, specifically related to the support for decompressing plaintext after its decryption. Under certain conditions it is possible to have the user's environment consume unreasonable amount of CPU time or memory during JWE Decryption operations. This issue has been patched in versions 2.0.7 and 4.15.5.",2024-03-30T04:15:08.393,https://cve.circl.lu/cve/CVE-2024-28176
CVE-2024-31134,3.6,JetBrains,In JetBrains TeamCity before 2024.03 authenticated users without administrative permissions could register other users when self-registration was disabled,2024-03-28T16:07:30.893,https://cve.circl.lu/cve/CVE-2024-31134
CVE-2024-31135,2.7,JetBrains,In JetBrains TeamCity before 2024.03 open redirect was possible on the login page,2024-03-28T16:07:30.893,https://cve.circl.lu/cve/CVE-2024-31135
CVE-2024-31136,5.2,JetBrains,In JetBrains TeamCity before 2024.03 2FA could be bypassed by providing a special URL parameter,2024-03-28T16:07:30.893,https://cve.circl.lu/cve/CVE-2024-31136
CVE-2024-31137,5.2,JetBrains,In JetBrains TeamCity before 2024.03 reflected XSS was possible via Space connection configuration,2024-03-28T16:07:30.893,https://cve.circl.lu/cve/CVE-2024-31137
CVE-2024-31138,2.5,JetBrains,In JetBrains TeamCity before 2024.03 xSS was possible via Agent Distribution settings,2024-03-28T16:07:30.893,https://cve.circl.lu/cve/CVE-2024-31138
CVE-2020-23064,2.7,JQuery,Cross Site Scripting vulnerability in jQuery 2.2.0 through 3.x before 3.5.0 allows a remote attacker to execute arbitrary code via the <options> element.,2024-04-01T15:43:36.933,https://cve.circl.lu/cve/CVE-2020-23064
CVE-2024-28180,1.4,JavaScript,"Package jose aims to provide an implementation of the Javascript Object Signing and Encryption set of standards. An attacker could send a JWE containing compressed data that used large amounts of memory and CPU when decompressed by Decrypt or DecryptMulti. Those functions now return an error if the decompressed data would exceed 250kB or 10x the compressed size (whichever is larger). This vulnerability has been patched in versions 4.0.1, 3.0.3 and 2.6.3.",2024-03-31T03:15:07.680,https://cve.circl.lu/cve/CVE-2024-28180
CVE-2024-28335,NA,JavaScript,"Lektor before 3.3.11 does not sanitize DB path traversal. Thus, shell commands might be executed via a file that is added to the templates directory, if the victim's web browser accesses an untrusted website that uses JavaScript to send requests to localhost port 5000, and the web browser is running on the same machine as the ""lektor server"" command.",2024-03-27T12:29:30.307,https://cve.circl.lu/cve/CVE-2024-28335
CVE-2023-50961,2.7,JavaScript,IBM QRadar SIEM 7.5 is vulnerable to stored cross-site scripting. This vulnerability allows users to embed arbitrary JavaScript code in the Web UI thus altering the intended functionality potentially leading to credentials disclosure within a trusted session.  IBM X-Force ID:  275939.,2024-03-27T15:49:51.300,https://cve.circl.lu/cve/CVE-2023-50961
CVE-2024-29893,3.6,Kubernetes,"Argo CD is a declarative, GitOps continuous delivery tool for Kubernetes. All versions of ArgoCD starting from v2.4 have a bug where the ArgoCD repo-server component is vulnerable to a Denial-of-Service attack vector. Specifically,  it's possible to crash the repo server component through an out of memory error by pointing it to a malicious Helm registry. The loadRepoIndex() function in the ArgoCD's helm package, does not limit the size nor time while fetching the data. It fetches it and creates a byte slice from the retrieved data in one go. If the registry is implemented to push data continuously, the repo server will keep allocating memory until it runs out of it. A patch for this vulnerability has been released in v2.10.3, v2.9.8, and v2.8.12.",2024-04-01T01:12:59.077,https://cve.circl.lu/cve/CVE-2024-29893
CVE-2016-3841,5.9,Linux,"The IPv6 stack in the Linux kernel before 4.3.3 mishandles options data, which allows local users to gain privileges or cause a denial of service (use-after-free and system crash) via a crafted sendmsg system call.",2024-04-02T18:02:01.370,https://cve.circl.lu/cve/CVE-2016-3841
CVE-2017-12188,6.0,Linux,"arch/x86/kvm/mmu.c in the Linux kernel through 4.13.5, when nested virtualisation is used, does not properly traverse guest pagetable entries to resolve a guest virtual address, which allows L1 guest OS users to execute arbitrary code on the host OS or cause a denial of service (incorrect index during page walking, and host OS crash), aka an ""MMU potential stack buffer overrun.""",2024-04-02T18:05:18.423,https://cve.circl.lu/cve/CVE-2017-12188
CVE-2017-16525,5.9,Linux,"The usb_serial_console_disconnect function in drivers/usb/serial/console.c in the Linux kernel before 4.13.8 allows local users to cause a denial of service (use-after-free and system crash) or possibly have unspecified other impact via a crafted USB device, related to disconnection and failed setup.",2024-04-01T15:43:24.400,https://cve.circl.lu/cve/CVE-2017-16525
CVE-2023-3390,5.9,Linux,A use-after-free vulnerability was found in the Linux kernel's netfilter subsystem in net/netfilter/nf_tables_api.c.Mishandled error handling with NFT_MSG_NEWRULE makes it possible to use a dangling pointer in the same transaction causing a use-after-free vulnerability. This flaw allows a local attacker with user access to cause a privilege escalation issue.We recommend upgrading past commit 1240eb93f0616b21c675416516ff3d74798fdc97.,2024-03-27T14:11:37.090,https://cve.circl.lu/cve/CVE-2023-3390
CVE-2024-23284,NA,Management,"A logic issue was addressed with improved state management. This issue is fixed in tvOS 17.4, macOS Sonoma 14.4, visionOS 1.1, iOS 17.4 and iPadOS 17.4, watchOS 10.4, iOS 16.7.6 and iPadOS 16.7.6, Safari 17.4. Processing maliciously crafted web content may prevent Content Security Policy from being enforced.",2024-04-02T03:15:16.297,https://cve.circl.lu/cve/CVE-2024-23284
CVE-2024-2916,3.4,Management,A vulnerability was found in Campcodes House Rental Management System 1.0. It has been classified as critical. Affected is an unknown function of the file ajax.php. The manipulation of the argument username leads to sql injection. It is possible to launch the attack remotely. The exploit has been disclosed to the public and may be used. VDB-257982 is the identifier assigned to this vulnerability.,2024-03-27T12:29:30.307,https://cve.circl.lu/cve/CVE-2024-2916
CVE-2024-2917,2.5,Management,A vulnerability was found in Campcodes House Rental Management System 1.0. It has been declared as critical. Affected by this vulnerability is an unknown functionality of the file index.php. The manipulation of the argument page leads to file inclusion. The attack can be launched remotely. The exploit has been disclosed to the public and may be used. The associated identifier of this vulnerability is VDB-257983.,2024-03-27T12:29:30.307,https://cve.circl.lu/cve/CVE-2024-2917
CVE-2023-36728,3.6,Microsoft,Microsoft SQL Server Denial of Service Vulnerability,2024-04-01T15:44:53.980,https://cve.circl.lu/cve/CVE-2023-36728
CVE-2024-26196,1.4,Microsoft,Microsoft Edge for Android (Chromium-based) Information Disclosure Vulnerability,2024-04-01T15:23:59.877,https://cve.circl.lu/cve/CVE-2024-26196
CVE-2017-20190,NA,Microsoft,"Some Microsoft technologies as used in Windows 8 through 11 allow a temporary client-side performance degradation during processing of multiple Unicode combining characters, aka a ""Zalgo text"" attack. NOTE: third parties dispute whether the computational cost of interpreting Unicode data should be considered a vulnerability.",2024-03-27T12:29:30.307,https://cve.circl.lu/cve/CVE-2017-20190
CVE-2024-2209,NA,Microsoft,A user with administrative privileges can create a compromised dll file of the same name as the original dll within the HP printer’s Firmware Update Utility (FUU) bundle and place it in the Microsoft Windows default downloads directory which can lead to potential arbitrary code execution.,2024-03-27T12:29:30.307,https://cve.circl.lu/cve/CVE-2024-2209
