CVE,"Impact Score (1-10, 10 being the worst)",Keyword,Description,Last Modified,Link
CVE-2023-52623,NA,QEMU,"In the Linux kernel, the following vulnerability has been resolved:SUNRPC: Fix a suspicious RCU usage warningI received the following warning while running cthon against an ontapserver running pNFS:[   57.202521] =============================[   57.202522] WARNING: suspicious RCU usage[   57.202523] 6.7.0-rc3-g2cc14f52aeb7 #41492 Not tainted[   57.202525] -----------------------------[   57.202525] net/sunrpc/xprtmultipath.c:349 RCU-list traversed in non-reader section!![   57.202527]               other info that might help us debug this:[   57.202528]               rcu_scheduler_active = 2, debug_locks = 1[   57.202529] no locks held by test5/3567.[   57.202530]               stack backtrace:[   57.202532] CPU: 0 PID: 3567 Comm: test5 Not tainted 6.7.0-rc3-g2cc14f52aeb7 #41492 5b09971b4965c0aceba19f3eea324a4a806e227e[   57.202534] Hardware name: QEMU Standard PC (Q35 + ICH9, 2009), BIOS unknown 2/2/2022[   57.202536] Call Trace:[   57.202537]  <TASK>[   57.202540]  dump_stack_lvl+0x77/0xb0[   57.202551]  lockdep_rcu_suspicious+0x154/0x1a0[   57.202556]  rpc_xprt_switch_has_addr+0x17c/0x190 [sunrpc ebe02571b9a8ceebf7d98e71675af20c19bdb1f6][   57.202596]  rpc_clnt_setup_test_and_add_xprt+0x50/0x180 [sunrpc ebe02571b9a8ceebf7d98e71675af20c19bdb1f6][   57.202621]  ? rpc_clnt_add_xprt+0x254/0x300 [sunrpc ebe02571b9a8ceebf7d98e71675af20c19bdb1f6][   57.202646]  rpc_clnt_add_xprt+0x27a/0x300 [sunrpc ebe02571b9a8ceebf7d98e71675af20c19bdb1f6][   57.202671]  ? __pfx_rpc_clnt_setup_test_and_add_xprt+0x10/0x10 [sunrpc ebe02571b9a8ceebf7d98e71675af20c19bdb1f6][   57.202696]  nfs4_pnfs_ds_connect+0x345/0x760 [nfsv4 c716d88496ded0ea6d289bbea684fa996f9b57a9][   57.202728]  ? __pfx_nfs4_test_session_trunk+0x10/0x10 [nfsv4 c716d88496ded0ea6d289bbea684fa996f9b57a9][   57.202754]  nfs4_fl_prepare_ds+0x75/0xc0 [nfs_layout_nfsv41_files e3a4187f18ae8a27b630f9feae6831b584a9360a][   57.202760]  filelayout_write_pagelist+0x4a/0x200 [nfs_layout_nfsv41_files e3a4187f18ae8a27b630f9feae6831b584a9360a][   57.202765]  pnfs_generic_pg_writepages+0xbe/0x230 [nfsv4 c716d88496ded0ea6d289bbea684fa996f9b57a9][   57.202788]  __nfs_pageio_add_request+0x3fd/0x520 [nfs 6c976fa593a7c2976f5a0aeb4965514a828e6902][   57.202813]  nfs_pageio_add_request+0x18b/0x390 [nfs 6c976fa593a7c2976f5a0aeb4965514a828e6902][   57.202831]  nfs_do_writepage+0x116/0x1e0 [nfs 6c976fa593a7c2976f5a0aeb4965514a828e6902][   57.202849]  nfs_writepages_callback+0x13/0x30 [nfs 6c976fa593a7c2976f5a0aeb4965514a828e6902][   57.202866]  write_cache_pages+0x265/0x450[   57.202870]  ? __pfx_nfs_writepages_callback+0x10/0x10 [nfs 6c976fa593a7c2976f5a0aeb4965514a828e6902][   57.202891]  nfs_writepages+0x141/0x230 [nfs 6c976fa593a7c2976f5a0aeb4965514a828e6902][   57.202913]  do_writepages+0xd2/0x230[   57.202917]  ? filemap_fdatawrite_wbc+0x5c/0x80[   57.202921]  filemap_fdatawrite_wbc+0x67/0x80[   57.202924]  filemap_write_and_wait_range+0xd9/0x170[   57.202930]  nfs_wb_all+0x49/0x180 [nfs 6c976fa593a7c2976f5a0aeb4965514a828e6902][   57.202947]  nfs4_file_flush+0x72/0xb0 [nfsv4 c716d88496ded0ea6d289bbea684fa996f9b57a9][   57.202969]  __se_sys_close+0x46/0xd0[   57.202972]  do_syscall_64+0x68/0x100[   57.202975]  ? do_syscall_64+0x77/0x100[   57.202976]  ? do_syscall_64+0x77/0x100[   57.202979]  entry_SYSCALL_64_after_hwframe+0x6e/0x76[   57.202982] RIP: 0033:0x7fe2b12e4a94[   57.202985] Code: 00 f7 d8 64 89 01 48 83 c8 ff c3 66 2e 0f 1f 84 00 00 00 00 00 90 f3 0f 1e fa 80 3d d5 18 0e 00 00 74 13 b8 03 00 00 00 0f 05 <48> 3d 00 f0 ff ff 77 44 c3 0f 1f 00 48 83 ec 18 89 7c 24 0c e8 c3[   57.202987] RSP: 002b:00007ffe857ddb38 EFLAGS: 00000202 ORIG_RAX: 0000000000000003[   57.202989] RAX: ffffffffffffffda RBX: 00007ffe857dfd68 RCX: 00007fe2b12e4a94[   57.202991] RDX: 0000000000002000 RSI: 00007ffe857ddc40 RDI: 0000000000000003[   57.202992] RBP: 00007ffe857dfc50 R08: 7fffffffffffffff R09: 0000000065650f49[   57.202993] R10: 00007f---truncated---",2024-03-27T12:29:41.530,https://cve.circl.lu/cve/CVE-2023-52623
CVE-2024-29922,3.7,Quantum,Improper Neutralization of Input During Web Page Generation ('Cross-site Scripting') vulnerability in Quantum Cloud Slider Hero allows Stored XSS.This issue affects Slider Hero: from n/a through 8.6.1.,2024-03-27T12:29:30.307,https://cve.circl.lu/cve/CVE-2024-29922
CVE-2024-3019,5.9,Redis,"A flaw was found in PCP. The default pmproxy configuration exposes the Redis server backend to the local network, allowing remote command execution with the privileges of the Redis user. This issue can only be exploited when pmproxy is running. By default, pmproxy is not running and needs to be started manually. The pmproxy service is usually started from the 'Metrics settings' page of the Cockpit web interface. This flaw affects PCP versions 4.3.4 and newer.",2024-03-28T20:53:20.813,https://cve.circl.lu/cve/CVE-2024-3019
CVE-2023-47438,NA,Repo,SQL Injection vulnerability in Reportico Till 8.1.0 allows attackers to obtain sensitive information or other system information via the project parameter.,2024-03-28T02:01:13.303,https://cve.circl.lu/cve/CVE-2023-47438
CVE-2023-52628,NA,Repo,"In the Linux kernel, the following vulnerability has been resolved:netfilter: nftables: exthdr: fix 4-byte stack OOB writeIf priv->len is a multiple of 4, then dst[len / 4] can write pastthe destination array which leads to stack corruption.This construct is necessary to clean the remainder of the registerin case ->len is NOT a multiple of the register size, so make itconditional just like nft_payload.c does.The bug was added in 4.1 cycle and then copied/inherited whentcp/sctp and ip option support was added.Bug reported by Zero Day Initiative project (ZDI-CAN-21950,ZDI-CAN-21951, ZDI-CAN-21961).",2024-03-28T12:42:56.150,https://cve.circl.lu/cve/CVE-2023-52628
CVE-2022-35737,3.6,SQL,SQLite 1.0.12 through 3.39.x before 3.39.2 sometimes allows an array-bounds overflow if billions of bytes are used in a string argument to a C API.,2024-03-27T16:05:26.360,https://cve.circl.lu/cve/CVE-2022-35737
CVE-2023-28787,4.7,SQL,Improper Neutralization of Special Elements used in an SQL Command ('SQL Injection') vulnerability in ExpressTech Quiz And Survey Master.This issue affects Quiz And Survey Master: from n/a through 8.1.4.,2024-03-27T12:29:30.307,https://cve.circl.lu/cve/CVE-2023-28787
CVE-2024-2927,3.4,SQL,A vulnerability was found in code-projects Mobile Shop 1.0. It has been classified as critical. Affected is an unknown function of the file Details.php of the component Login Page. The manipulation of the argument id leads to sql injection. It is possible to launch the attack remotely. The exploit has been disclosed to the public and may be used. The identifier of this vulnerability is VDB-258000.,2024-03-27T12:29:30.307,https://cve.circl.lu/cve/CVE-2024-2927
CVE-2021-22947,3.6,STARTTLS,"When curl >= 7.20.0 and <= 7.78.0 connects to an IMAP or POP3 server to retrieve data using STARTTLS to upgrade to TLS security, the server can respond and send back multiple responses at once that curl caches. curl would then upgrade to TLS but not flush the in-queue of cached responses but instead continue using and trustingthe responses it got *before* the TLS handshake as if they were authenticated.Using this flaw, it allows a Man-In-The-Middle attacker to first inject the fake responses, then pass-through the TLS traffic from the legitimate server and trick curl into sending data back to the user thinking the attacker's injected data comes from the TLS-protected server.",2024-03-27T15:03:30.377,https://cve.circl.lu/cve/CVE-2021-22947
CVE-2022-27782,3.6,SSH,"libcurl would reuse a previously created connection even when a TLS or SSHrelated option had been changed that should have prohibited reuse.libcurl keeps previously used connections in a connection pool for subsequenttransfers to reuse if one of them matches the setup. However, several TLS andSSH settings were left out from the configuration match checks, making themmatch too easily.",2024-03-27T15:01:49.180,https://cve.circl.lu/cve/CVE-2022-27782
CVE-2023-27538,3.6,SSH,"An authentication bypass vulnerability exists in libcurl prior to v8.0.0 where it reuses a previously established SSH connection despite the fact that an SSH option was modified, which should have prevented reuse. libcurl maintains a pool of previously used connections to reuse them for subsequent transfers if the configurations match. However, two SSH settings were omitted from the configuration check, allowing them to match easily, potentially leading to the reuse of an inappropriate connection.",2024-03-27T14:46:06.490,https://cve.circl.lu/cve/CVE-2023-27538
CVE-2021-22890,1.4,TLS,"curl 7.63.0 to and including 7.75.0 includes vulnerability that allows a malicious HTTPS proxy to MITM a connection due to bad handling of TLS 1.3 session tickets. When using a HTTPS proxy and TLS 1.3, libcurl can confuse session tickets arriving from the HTTPS proxy but work as if they arrived from the remote server and then wrongly ""short-cut"" the host handshake. When confusing the tickets, a HTTPS proxy can trick libcurl to use the wrong session ticket resume for the host and thereby circumvent the server TLS certificate check and make a MITM attack to be possible to perform unnoticed. Note that such a malicious HTTPS proxy needs to provide a certificate that curl will accept for the MITMed server for an attack to work - unless curl has been told to ignore the server certificate check.",2024-03-27T15:47:45.160,https://cve.circl.lu/cve/CVE-2021-22890
CVE-2021-22897,1.4,TLS,"curl 7.61.0 through 7.76.1 suffers from exposure of data element to wrong session due to a mistake in the code for CURLOPT_SSL_CIPHER_LIST when libcurl is built to use the Schannel TLS library. The selected cipher set was stored in a single ""static"" variable in the library, which has the surprising side-effect that if an application sets up multiple concurrent transfers, the last one that sets the ciphers will accidentally control the set used by all transfers. In a worst-case scenario, this weakens transport security significantly.",2024-03-27T15:47:40.347,https://cve.circl.lu/cve/CVE-2021-22897
CVE-2021-22946,3.6,TLS,"A user can tell curl >= 7.20.0 and <= 7.78.0 to require a successful upgrade to TLS when speaking to an IMAP, POP3 or FTP server (`--ssl-reqd` on the command line or`CURLOPT_USE_SSL` set to `CURLUSESSL_CONTROL` or `CURLUSESSL_ALL` withlibcurl). This requirement could be bypassed if the server would return a properly crafted but perfectly legitimate response.This flaw would then make curl silently continue its operations **withoutTLS** contrary to the instructions and expectations, exposing possibly sensitive data in clear text over the network.",2024-03-27T15:12:52.090,https://cve.circl.lu/cve/CVE-2021-22946
CVE-2024-2893,5.9,Tenda,A vulnerability was found in Tenda AC7 15.03.06.44 and classified as critical. Affected by this issue is the function formSetDeviceName of the file /goform/SetOnlineDevName. The manipulation of the argument devName leads to stack-based buffer overflow. The attack may be launched remotely. The exploit has been disclosed to the public and may be used. The identifier of this vulnerability is VDB-257936. NOTE: The vendor was contacted early about this disclosure but did not respond in any way.,2024-03-27T12:29:41.530,https://cve.circl.lu/cve/CVE-2024-2893
CVE-2024-2894,5.9,Tenda,A vulnerability was found in Tenda AC7 15.03.06.44. It has been classified as critical. This affects the function formSetQosBand of the file /goform/SetNetControlList. The manipulation of the argument list leads to stack-based buffer overflow. It is possible to initiate the attack remotely. The exploit has been disclosed to the public and may be used. The identifier VDB-257937 was assigned to this vulnerability. NOTE: The vendor was contacted early about this disclosure but did not respond in any way.,2024-03-27T12:29:41.530,https://cve.circl.lu/cve/CVE-2024-2894
CVE-2024-2895,5.9,Tenda,A vulnerability was found in Tenda AC7 15.03.06.44. It has been declared as critical. This vulnerability affects the function formWifiWpsOOB of the file /goform/WifiWpsOOB. The manipulation of the argument index leads to stack-based buffer overflow. The attack can be initiated remotely. The exploit has been disclosed to the public and may be used. VDB-257938 is the identifier assigned to this vulnerability. NOTE: The vendor was contacted early about this disclosure but did not respond in any way.,2024-03-27T12:29:41.530,https://cve.circl.lu/cve/CVE-2024-2895
CVE-2024-2896,5.9,Tenda,A vulnerability was found in Tenda AC7 15.03.06.44. It has been rated as critical. This issue affects the function formWifiWpsStart of the file /goform/WifiWpsStart. The manipulation of the argument index leads to stack-based buffer overflow. The attack may be initiated remotely. The exploit has been disclosed to the public and may be used. The associated identifier of this vulnerability is VDB-257939. NOTE: The vendor was contacted early about this disclosure but did not respond in any way.,2024-03-27T12:29:41.530,https://cve.circl.lu/cve/CVE-2024-2896
CVE-2024-2897,3.4,Tenda,A vulnerability classified as critical has been found in Tenda AC7 15.03.06.44. Affected is the function formWriteFacMac of the file /goform/WriteFacMac. The manipulation of the argument mac leads to os command injection. It is possible to launch the attack remotely. The exploit has been disclosed to the public and may be used. The identifier of this vulnerability is VDB-257940. NOTE: The vendor was contacted early about this disclosure but did not respond in any way.,2024-03-27T12:29:41.530,https://cve.circl.lu/cve/CVE-2024-2897
CVE-2024-22246,5.9,VMware,VMware SD-WAN Edge contains an unauthenticated command injection vulnerability potentially leading to remote code execution.A malicious actor with local access to the Edge Router UI during activation may be able to perform a command injection attack that could lead to full control of the router. ,2024-04-02T18:12:16.283,https://cve.circl.lu/cve/CVE-2024-22246
CVE-2024-22247,4.2,VMware,"VMware SD-WAN Edge contains a missing authentication and protection mechanism vulnerability.A malicious actor with physical access to the SD-WAN Edge appliance during activation can potentially exploit this vulnerability to access the BIOS configuration. In addition, the malicious actor may be able to exploit the default boot priority configured.",2024-04-02T18:12:16.283,https://cve.circl.lu/cve/CVE-2024-22247
CVE-2023-33009,5.9,VPN,"A buffer overflow vulnerability in the notification function in Zyxel ATP series firmware versions 4.60 through 5.36 Patch 1, USG FLEX series firmware versions 4.60 through 5.36 Patch 1, USG FLEX 50(W) firmware versions 4.60 through 5.36 Patch 1, USG20(W)-VPN firmware versions 4.60 through 5.36 Patch 1, VPN series firmware versions 4.60 through 5.36 Patch 1, ZyWALL/USG series firmware versions 4.60 through 4.73 Patch 1, could allow an unauthenticated attacker to cause denial-of-service (DoS) conditions and even a remote code execution on an affected device.",2024-04-01T15:51:48.877,https://cve.circl.lu/cve/CVE-2023-33009
CVE-2024-2910,3.4,VPN,"A vulnerability, which was classified as critical, has been found in Ruijie RG-EG350 up to 20240318. Affected by this issue is the function vpnAction of the file /itbox_pi/vpn_quickset_service.php?a=set_vpn of the component HTTP POST Request Handler. The manipulation of the argument ip/port/user/pass/dns/startIp leads to os command injection. The attack may be launched remotely. The exploit has been disclosed to the public and may be used. VDB-257978 is the identifier assigned to this vulnerability. NOTE: The vendor was contacted early about this disclosure but did not respond in any way.",2024-03-27T12:29:30.307,https://cve.circl.lu/cve/CVE-2024-2910
CVE-2018-8493,3.6,Windows,"An information disclosure vulnerability exists when the Windows TCP/IP stack improperly handles fragmented IP packets, aka ""Windows TCP/IP Information Disclosure Vulnerability."" This affects Windows Server 2012 R2, Windows RT 8.1, Windows Server 2016, Windows 8.1, Windows 10, Windows 10 Servers.",2024-04-01T15:42:44.803,https://cve.circl.lu/cve/CVE-2018-8493
CVE-2023-47039,5.9,Windows,"A vulnerability was found in Perl. This security issue occurs while Perl for Windows relies on the system path environment variable to find the shell (`cmd.exe`). When running an executable that uses the Windows Perl interpreter, Perl attempts to find and execute `cmd.exe` within the operating system. However, due to path search order issues, Perl initially looks for cmd.exe in the current working directory. This flaw allows an attacker with limited privileges to place`cmd.exe` in locations with weak permissions, such as `C:\ProgramData`. By doing so, arbitrary code can be executed when an administrator attempts to use this executable from these compromised locations.",2024-03-28T14:15:13.467,https://cve.circl.lu/cve/CVE-2023-47039
CVE-2023-40290,NA,Windows,"An issue was discovered on Supermicro X11SSM-F, X11SAE-F, and X11SSE-F 1.66 devices. An attacker could exploit an XSS issue that affects Internet Explorer 11 on Windows.",2024-03-27T12:29:30.307,https://cve.circl.lu/cve/CVE-2023-40290
CVE-2024-2139,2.7,WordPress,"The Master Addons for Elementor plugin for WordPress is vulnerable to Stored Cross-Site Scripting via the Pricing Table widget in all versions up to, and including, 2.0.5.6 due to insufficient input sanitization and output escaping. This makes it possible for authenticated attackers, with contributor-level access and above, to inject arbitrary web scripts in pages that will execute whenever a user accesses an injected page.",2024-03-27T12:29:30.307,https://cve.circl.lu/cve/CVE-2024-2139
CVE-2024-1364,2.7,WordPress,"The Elementor Website Builder Pro plugin for WordPress is vulnerable to Stored Cross-Site Scripting via widget's custom_id in all versions up to, and including, 3.20.1 due to insufficient input sanitization and output escaping on user supplied attributes. This makes it possible for authenticated attackers with contributor-level and above permissions to inject arbitrary web scripts in pages that will execute whenever a user accesses an injected page.",2024-03-27T12:29:30.307,https://cve.circl.lu/cve/CVE-2024-1364
CVE-2023-45754,2.7,XSS,Improper Neutralization of Input During Web Page Generation ('Cross-site Scripting') vulnerability in I Thirteen Web Solution Easy Testimonial Slider and Form allows Stored XSS.This issue affects Easy Testimonial Slider and Form: from n/a through 1.0.18.,2024-03-28T09:15:07.903,https://cve.circl.lu/cve/CVE-2023-45754
CVE-2023-28687,3.7,XSS,"Improper Neutralization of Input During Web Page Generation ('Cross-site Scripting') vulnerability in perfectwpthemes Glaze Blog Lite, themebeez Fascinate, themebeez Cream Blog, themebeez Cream Magazine allows Reflected XSS.This issue affects Glaze Blog Lite: from n/a through <= 1.1.4; Fascinate: from n/a through 1.0.8; Cream Blog: from n/a through 2.1.3; Cream Magazine: from n/a through 2.1.4.",2024-03-27T12:29:30.307,https://cve.circl.lu/cve/CVE-2023-28687
CVE-2023-40284,NA,XSS,"An issue was discovered on Supermicro X11SSM-F, X11SAE-F, and X11SSE-F 1.66 devices. An attacker could exploit an XSS issue.",2024-03-27T12:29:30.307,https://cve.circl.lu/cve/CVE-2023-40284
CVE-2023-40285,NA,XSS,"An issue was discovered on Supermicro X11SSM-F, X11SAE-F, and X11SSE-F 1.66 devices. An attacker could exploit an XSS issue.",2024-03-27T12:29:30.307,https://cve.circl.lu/cve/CVE-2023-40285
CVE-2024-26674,NA,X86,"In the Linux kernel, the following vulnerability has been resolved:x86/lib: Revert to _ASM_EXTABLE_UA() for {get,put}_user() fixupsDuring memory error injection test on kernels >= v6.4, the kernel panicslike below. However, this issue couldn't be reproduced on kernels <= v6.3.  mce: [Hardware Error]: CPU 296: Machine Check Exception: f Bank 1: bd80000000100134  mce: [Hardware Error]: RIP 10:<ffffffff821b9776> {__get_user_nocheck_4+0x6/0x20}  mce: [Hardware Error]: TSC 411a93533ed ADDR 346a8730040 MISC 86  mce: [Hardware Error]: PROCESSOR 0:a06d0 TIME 1706000767 SOCKET 1 APIC 211 microcode 80001490  mce: [Hardware Error]: Run the above through 'mcelog --ascii'  mce: [Hardware Error]: Machine check: Data load in unrecoverable area of kernel  Kernel panic - not syncing: Fatal local machine checkThe MCA code can recover from an in-kernel #MC if the fixup type isEX_TYPE_UACCESS, explicitly indicating that the kernel is attempting toaccess userspace memory. However, if the fixup type is EX_TYPE_DEFAULTthe only thing that is raised for an in-kernel #MC is a panic.ex_handler_uaccess() would warn if users gave a non-canonical addresses(with bit 63 clear) to {get, put}_user(), which was unexpected.Therefore, commit  b19b74bc99b1 (""x86/mm: Rework address range check in get_user() and put_user()"")replaced _ASM_EXTABLE_UA() with _ASM_EXTABLE() for {get, put}_user()fixups. However, the new fixup type EX_TYPE_DEFAULT results in a panic.Commit  6014bc27561f (""x86-64: make access_ok() independent of LAM"")added the check gp_fault_address_ok() right before the WARN_ONCE() inex_handler_uaccess() to not warn about non-canonical user addresses dueto LAM.With that in place, revert back to _ASM_EXTABLE_UA() for {get,put}_user()exception fixups in order to be able to handle in-kernel MCEs correctlyagain.  [ bp: Massage commit message. ]",2024-04-02T12:50:42.233,https://cve.circl.lu/cve/CVE-2024-26674
CVE-2024-26678,NA,X86,"In the Linux kernel, the following vulnerability has been resolved:x86/efistub: Use 1:1 file:memory mapping for PE/COFF .compat sectionThe .compat section is a dummy PE section that contains the address ofthe 32-bit entrypoint of the 64-bit kernel image if it is bootable from32-bit firmware (i.e., CONFIG_EFI_MIXED=y)This section is only 8 bytes in size and is only referenced from theloader, and so it is placed at the end of the memory view of the image,to avoid the need for padding it to 4k, which is required for sectionsappearing in the middle of the image.Unfortunately, this violates the PE/COFF spec, and even if most EFIloaders will work correctly (including the Tianocore referenceimplementation), PE loaders do exist that reject such images, on thebasis that both the file and memory views of the file contents should bedescribed by the section headers in a monotonically increasing mannerwithout leaving any gaps.So reorganize the sections to avoid this issue. This results in a slightpadding overhead (< 4k) which can be avoided if desired by disablingCONFIG_EFI_MIXED (which is only needed in rare cases these days)",2024-04-02T12:50:42.233,https://cve.circl.lu/cve/CVE-2024-26678
CVE-2024-30239,4.7,Zoho,Improper Neutralization of Special Elements used in an SQL Command ('SQL Injection') vulnerability in Zoho Campaigns.This issue affects Zoho Campaigns: from n/a through 2.0.6.,2024-03-28T12:42:56.150,https://cve.circl.lu/cve/CVE-2024-30239
