CVE,"Impact Score (1-10, 10 being the worst)",Keyword,Description,Last Modified,Link
CVE-2024-20799,2.7,Adobe,Adobe Experience Manager versions 6.5.19 and earlier are affected by a stored Cross-Site Scripting (XSS) vulnerability that could be abused by an attacker to inject malicious scripts into vulnerable form fields. Malicious JavaScript may be executed in a victim’s browser when they browse to the page containing the vulnerable field.,2024-04-02T12:50:42.233,https://cve.circl.lu/cve/CVE-2024-20799
CVE-2024-29735,NA,Airflow,"Improper Preservation of Permissions vulnerability in Apache Airflow.This issue affects Apache Airflow from 2.8.2 through 2.8.3.Airflow's local file task handler in Airflow incorrectly set permissions for all parent folders of log folder, in default configuration adding write access to Unix group of the folders. In the case Airflow is run with the root user (not recommended) it added group write permission to all folders up to the root of the filesystem.If your log files are stored in the home directory, these permission changes might impact your ability to run SSH operations after your home directory becomes group-writeable.This issue does not affect users who use or extend Airflow using Official Airflow Docker reference images ( https://hub.docker.com/r/apache/airflow/ ) - those images require to have group write permission set anyway.You are affected only if you install Airflow using local installation / virtualenv or other Docker images, but the issue has no impact if docker containers are used as intended, i.e. where Airflow components do not share containers with other applications and users.Also you should not be affected if your umask is 002 (group write enabled) - this is the default on many linux systems.Recommendation for users using Airflow outside of the containers:  *  if you are using root to run Airflow, change your Airflow user to use non-root  *  upgrade Apache Airflow to 2.8.4 or above  *  If you prefer not to upgrade, you can change the  https://airflow.apache.org/docs/apache-airflow/stable/configurations-ref.html#file-task-handler-new-folder-permissions  to 0o755 (original value 0o775).  *  if you already ran Airflow tasks before and your default umask is 022 (group write disabled) you should stop Airflow components, check permissions of AIRFLOW_HOME/logs in all your components and all parent directories of this directory and remove group write access for all the parent directories",2024-03-27T12:29:41.530,https://cve.circl.lu/cve/CVE-2024-29735
CVE-2024-30199,3.7,Amazon,Improper Neutralization of Input During Web Page Generation ('Cross-site Scripting') vulnerability in WP Lab WP-Lister Lite for Amazon allows Reflected XSS.This issue affects WP-Lister Lite for Amazon: from n/a through 2.6.8.,2024-03-27T12:29:30.307,https://cve.circl.lu/cve/CVE-2024-30199
CVE-2024-29795,3.7,Amazon,"Improper Neutralization of Input During Web Page Generation ('Cross-site Scripting') vulnerability in Interfacelab Media Cloud for Amazon S3, Imgix, Google Cloud Storage, DigitalOcean Spaces and more allows Stored XSS.This issue affects Media Cloud for Amazon S3, Imgix, Google Cloud Storage, DigitalOcean Spaces and more: from n/a through 4.5.24.",2024-03-27T15:49:41.437,https://cve.circl.lu/cve/CVE-2024-29795
CVE-2011-0419,2.9,Apache,"Stack consumption vulnerability in the fnmatch implementation in apr_fnmatch.c in the Apache Portable Runtime (APR) library before 1.4.3 and the Apache HTTP Server before 2.2.18, and in fnmatch.c in libc in NetBSD 5.1, OpenBSD 4.8, FreeBSD, Apple Mac OS X 10.6, Oracle Solaris 10, and Android, allows context-dependent attackers to cause a denial of service (CPU and memory consumption) via *? sequences in the first argument, as demonstrated by attacks against mod_autoindex in httpd.",2024-04-02T18:46:47.630,https://cve.circl.lu/cve/CVE-2011-0419
CVE-2013-4558,2.9,Apache,"The get_parent_resource function in repos.c in mod_dav_svn Apache HTTPD server module in Subversion 1.7.11 through 1.7.13 and 1.8.1 through 1.8.4, when built with assertions enabled and SVNAutoversioning is enabled, allows remote attackers to cause a denial of service (assertion failure and Apache process abort) via a non-canonical URL in a request, as demonstrated using a trailing /.",2024-03-28T14:15:13.023,https://cve.circl.lu/cve/CVE-2013-4558
CVE-2022-47937,5.9,Apache,"Improper input validation in the Apache Sling Commons JSON bundle allows an attacker to trigger unexpected errors by supplying specially-crafted input.The org.apache.sling.commons.json bundle has been deprecated as of March 2017 and should not be used anymore. Consumers are encouraged to consider the Apache Sling Commons Johnzon OSGi bundle provided by the Apache Sling project, but may of course use other JSON libraries.",2024-03-29T10:15:07.963,https://cve.circl.lu/cve/CVE-2022-47937
CVE-2024-23672,NA,Apache,"Denial of Service via incomplete cleanup vulnerability in Apache Tomcat. It was possible for WebSocket clients to keep WebSocket connections open leading to increased resource consumption.This issue affects Apache Tomcat: from 11.0.0-M1 through 11.0.0-M16, from 10.1.0-M1 through 10.1.18, from 9.0.0-M1 through 9.0.85, from 8.5.0 through 8.5.98.Users are recommended to upgrade to version 11.0.0-M17, 10.1.19, 9.0.86 or 8.5.99 which fix the issue.",2024-04-02T23:15:54.273,https://cve.circl.lu/cve/CVE-2024-23672
CVE-2024-24549,NA,Apache,"Denial of Service due to improper input validation vulnerability for HTTP/2 requests in Apache Tomcat. When processing an HTTP/2 request, if the request exceeded any of the configured limits for headers, the associated HTTP/2 stream was not reset until after all of the headers had been processed.This issue affects Apache Tomcat: from 11.0.0-M1 through 11.0.0-M16, from 10.1.0-M1 through 10.1.18, from 9.0.0-M1 through 9.0.85, from 8.5.0 through 8.5.98.Users are recommended to upgrade to version 11.0.0-M17, 10.1.19, 9.0.86 or 8.5.99 which fix the issue.",2024-04-02T23:15:54.360,https://cve.circl.lu/cve/CVE-2024-24549
CVE-2024-26303,3.6,Aruba,Authenticated Denial of Service Vulnerability in ArubaOS-Switch SSH Daemon,2024-03-27T12:29:30.307,https://cve.circl.lu/cve/CVE-2024-26303
CVE-2022-32207,5.9,Atom,"When curl < 7.84.0 saves cookies, alt-svc and hsts data to local files, it makes the operation atomic by finalizing the operation with a rename from a temporary name to the final target file name.In that rename operation, it might accidentally *widen* the permissions for the target file, leaving the updated file accessible to more users than intended.",2024-03-27T15:00:46.637,https://cve.circl.lu/cve/CVE-2022-32207
CVE-2023-28746,4.0,Atom,Information exposure through microarchitectural state after transient execution from some register files for some Intel(R) Atom(R) Processors may allow an authenticated user to potentially enable information disclosure via local access.,2024-03-30T04:15:08.210,https://cve.circl.lu/cve/CVE-2023-28746
CVE-2024-26681,NA,Atom,"In the Linux kernel, the following vulnerability has been resolved:netdevsim: avoid potential loop in nsim_dev_trap_report_work()Many syzbot reports include the following trace [1]If nsim_dev_trap_report_work() can not grab the mutex,it should rearm itself at least one jiffie later.[1]Sending NMI from CPU 1 to CPUs 0:NMI backtrace for cpu 0CPU: 0 PID: 32383 Comm: kworker/0:2 Not tainted 6.8.0-rc2-syzkaller-00031-g861c0981648f #0Hardware name: Google Google Compute Engine/Google Compute Engine, BIOS Google 11/17/2023Workqueue: events nsim_dev_trap_report_work RIP: 0010:bytes_is_nonzero mm/kasan/generic.c:89 [inline] RIP: 0010:memory_is_nonzero mm/kasan/generic.c:104 [inline] RIP: 0010:memory_is_poisoned_n mm/kasan/generic.c:129 [inline] RIP: 0010:memory_is_poisoned mm/kasan/generic.c:161 [inline] RIP: 0010:check_region_inline mm/kasan/generic.c:180 [inline] RIP: 0010:kasan_check_range+0x101/0x190 mm/kasan/generic.c:189Code: 07 49 39 d1 75 0a 45 3a 11 b8 01 00 00 00 7c 0b 44 89 c2 e8 21 ed ff ff 83 f0 01 5b 5d 41 5c c3 48 85 d2 74 4f 48 01 ea eb 09 <48> 83 c0 01 48 39 d0 74 41 80 38 00 74 f2 eb b6 41 bc 08 00 00 00RSP: 0018:ffffc90012dcf998 EFLAGS: 00000046RAX: fffffbfff258af1e RBX: fffffbfff258af1f RCX: ffffffff8168eda3RDX: fffffbfff258af1f RSI: 0000000000000004 RDI: ffffffff92c578f0RBP: fffffbfff258af1e R08: 0000000000000000 R09: fffffbfff258af1eR10: ffffffff92c578f3 R11: ffffffff8acbcbc0 R12: 0000000000000002R13: ffff88806db38400 R14: 1ffff920025b9f42 R15: ffffffff92c578e8FS:  0000000000000000(0000) GS:ffff8880b9800000(0000) knlGS:0000000000000000CS:  0010 DS: 0000 ES: 0000 CR0: 0000000080050033CR2: 000000c00994e078 CR3: 000000002c250000 CR4: 00000000003506f0DR0: 0000000000000000 DR1: 0000000000000000 DR2: 0000000000000000DR3: 0000000000000000 DR6: 00000000fffe0ff0 DR7: 0000000000000400Call Trace: <NMI> </NMI> <TASK>  instrument_atomic_read include/linux/instrumented.h:68 [inline]  atomic_read include/linux/atomic/atomic-instrumented.h:32 [inline]  queued_spin_is_locked include/asm-generic/qspinlock.h:57 [inline]  debug_spin_unlock kernel/locking/spinlock_debug.c:101 [inline]  do_raw_spin_unlock+0x53/0x230 kernel/locking/spinlock_debug.c:141  __raw_spin_unlock_irqrestore include/linux/spinlock_api_smp.h:150 [inline]  _raw_spin_unlock_irqrestore+0x22/0x70 kernel/locking/spinlock.c:194  debug_object_activate+0x349/0x540 lib/debugobjects.c:726  debug_work_activate kernel/workqueue.c:578 [inline]  insert_work+0x30/0x230 kernel/workqueue.c:1650  __queue_work+0x62e/0x11d0 kernel/workqueue.c:1802  __queue_delayed_work+0x1bf/0x270 kernel/workqueue.c:1953  queue_delayed_work_on+0x106/0x130 kernel/workqueue.c:1989  queue_delayed_work include/linux/workqueue.h:563 [inline]  schedule_delayed_work include/linux/workqueue.h:677 [inline]  nsim_dev_trap_report_work+0x9c0/0xc80 drivers/net/netdevsim/dev.c:842  process_one_work+0x886/0x15d0 kernel/workqueue.c:2633  process_scheduled_works kernel/workqueue.c:2706 [inline]  worker_thread+0x8b9/0x1290 kernel/workqueue.c:2787  kthread+0x2c6/0x3a0 kernel/kthread.c:388  ret_from_fork+0x45/0x80 arch/x86/kernel/process.c:147  ret_from_fork_asm+0x11/0x20 arch/x86/entry/entry_64.S:242 </TASK>",2024-04-02T12:50:42.233,https://cve.circl.lu/cve/CVE-2024-26681
CVE-2023-5189,3.6,Ansible,"A path traversal vulnerability exists in Ansible when extracting tarballs. An attacker could craft a malicious tarball so that when using the galaxy importer of Ansible Automation Hub, a symlink could be dropped on the disk, resulting in files being overwritten.",2024-03-27T18:15:08.710,https://cve.circl.lu/cve/CVE-2023-5189
CVE-2024-29201,6.0,Ansible,"JumpServer is an open source bastion host and an operation and maintenance security audit system. Attackers can bypass the input validation mechanism in JumpServer's Ansible to execute arbitrary code within the Celery container. Since the Celery container runs with root privileges and has database access, attackers could steal sensitive information from all hosts or manipulate the database. This vulnerability is fixed in v3.10.7.",2024-04-01T01:12:59.077,https://cve.circl.lu/cve/CVE-2024-29201
CVE-2024-29202,6.0,Ansible,"JumpServer is an open source bastion host and an operation and maintenance security audit system. Attackers can exploit a Jinja2 template injection vulnerability in JumpServer's Ansible to execute arbitrary code within the Celery container. Since the Celery container runs with root privileges and has database access, attackers could steal sensitive information from all hosts or manipulate the database. This vulnerability is fixed in v3.10.7.",2024-04-01T01:12:59.077,https://cve.circl.lu/cve/CVE-2024-29202
CVE-2024-27091,2.7,CSRF,"GeoNode is a geospatial content management system, a platform for the management and publication of geospatial data. An issue exists within GEONODE where the current rich text editor is vulnerable to Stored XSS. The applications cookies are set securely, but it is possible to retrieve a victims CSRF token and issue a request to change another user's email address to perform a full account takeover. Due to the script element not impacting the CORS policy, requests will succeed. This vulnerability is fixed in 4.2.3.",2024-03-27T15:49:51.300,https://cve.circl.lu/cve/CVE-2024-27091
CVE-2024-1522,5.9,CSRF,"The parisneo/lollms-webui does not have CSRF protections. As a result, an attacker is able to execute arbitrary OS commands via the `/execute_code` API endpoint by tricking a user into visiting a specially crafted webpage.",2024-04-02T19:15:46.807,https://cve.circl.lu/cve/CVE-2024-1522
CVE-2024-2262,NA,CSRF,"Themify  WordPress plugin before 1.4.4 does not have CSRF check in its bulk action, which could allow attackers to make logged in users delete arbitrary filters via CSRF attack, granted they know the related filter slugs",2024-04-01T12:49:00.877,https://cve.circl.lu/cve/CVE-2024-2262
CVE-2024-3135,3.6,CSRF,"The web server lacked CSRF tokens allowing an attacker to host malicious JavaScript on a host that when visited by a LocalAI user, could allow the attacker to fill disk space to deny service or abuse credits.",2024-04-02T12:50:42.233,https://cve.circl.lu/cve/CVE-2024-3135
CVE-2024-20259,4.0,Cisco,"A vulnerability in the DHCP snooping feature of Cisco IOS XE Software could allow an unauthenticated, remote attacker to cause an affected device to reload unexpectedly, resulting in a denial of service (DoS) condition. This vulnerability is due to a crafted IPv4 DHCP request packet being mishandled when endpoint analytics are enabled. An attacker could exploit this vulnerability by sending a crafted DHCP request through an affected device. A successful exploit could allow the attacker to cause the device to reload, resulting in a DoS condition. Note: The attack vector is listed as network because a DHCP relay anywhere on the network could allow exploits from networks other than the adjacent one.",2024-03-27T17:48:21.140,https://cve.circl.lu/cve/CVE-2024-20259
CVE-2024-20265,5.2,Cisco,"A vulnerability in the boot process of Cisco Access Point (AP) Software could allow an unauthenticated, physical attacker to bypass the Cisco Secure Boot functionality and load a software image that has been tampered with on an affected device. This vulnerability exists because unnecessary commands are available during boot time at the physical console. An attacker could exploit this vulnerability by interrupting the boot process and executing specific commands to bypass the Cisco Secure Boot validation checks and load an image that has been tampered with. This image would have been previously downloaded onto the targeted device. A successful exploit could allow the attacker to load the image once. The Cisco Secure Boot functionality is not permanently compromised.",2024-03-27T17:48:21.140,https://cve.circl.lu/cve/CVE-2024-20265
CVE-2024-20271,4.0,Cisco,"A vulnerability in the IP packet processing of Cisco Access Point (AP) Software could allow an unauthenticated, remote attacker to cause a denial of service (DoS) condition on an affected device. This vulnerability is due to insufficient input validation of certain IPv4 packets. An attacker could exploit this vulnerability by sending a crafted IPv4 packet either to or through an affected device. A successful exploit could allow the attacker to cause an affected device to reload unexpectedly, resulting in a DoS condition. To successfully exploit this vulnerability, the attacker does not need to be associated with the affected AP. This vulnerability cannot be exploited by sending IPv6 packets.",2024-03-27T17:48:21.140,https://cve.circl.lu/cve/CVE-2024-20271
CVE-2024-20276,4.0,Cisco,"A vulnerability in Cisco IOS Software for Cisco Catalyst 6000 Series Switches could allow an unauthenticated, adjacent attacker to cause an affected device to reload unexpectedly. This vulnerability is due to improper handling of process-switched traffic. An attacker could exploit this vulnerability by sending crafted traffic to an affected device. A successful exploit could allow the attacker to cause the affected device to reload, resulting in a denial of service (DoS) condition.",2024-03-27T17:48:21.140,https://cve.circl.lu/cve/CVE-2024-20276
CVE-2024-20278,5.2,Cisco,"A vulnerability in the NETCONF feature of Cisco IOS XE Software could allow an authenticated, remote attacker to elevate privileges to root on an affected device. This vulnerability is due to improper validation of user-supplied input. An attacker could exploit this vulnerability by sending crafted input over NETCONF to an affected device. A successful exploit could allow the attacker to elevate privileges from Administrator to root.",2024-03-27T17:48:21.140,https://cve.circl.lu/cve/CVE-2024-20278
CVE-2022-32753,3.6,Cryptograph,IBM Security Verify Directory 10.0.0 uses weaker than expected cryptographic algorithms that could allow an attacker to decrypt highly sensitive information.  IBM X-Force ID:  228444.,2024-04-01T15:29:18.843,https://cve.circl.lu/cve/CVE-2022-32753
CVE-2024-28860,5.8,Cryptograph,"Cilium is a networking, observability, and security solution with an eBPF-based dataplane. Users of IPsec transparent encryption in Cilium may be vulnerable to cryptographic attacks that render the transparent encryption ineffective. In particular, Cilium is vulnerable to chosen plaintext, key recovery, replay attacks by a man-in-the-middle attacker. These attacks are possible due to an ESP sequence number collision when multiple nodes are configured with the same key. Fixed versions of Cilium use unique keys for each IPsec tunnel established between nodes, resolving all of the above attacks. This vulnerability is fixed in 1.13.13, 1.14.9, and 1.15.3.",2024-03-28T02:01:21.693,https://cve.circl.lu/cve/CVE-2024-28860
CVE-2024-25963,3.6,Cryptograph,"Dell PowerScale OneFS, versions 8.2.2.x through 9.5.0.x contains a use of a broken cryptographic algorithm vulnerability. A remote unauthenticated attacker could potentially exploit this vulnerability, leading to information disclosure.",2024-03-28T20:53:20.813,https://cve.circl.lu/cve/CVE-2024-25963
CVE-2024-29090,4.0,ChatGPT,Server-Side Request Forgery (SSRF) vulnerability in Jordy Meow AI Engine: ChatGPT Chatbot.This issue affects AI Engine: ChatGPT Chatbot: from n/a through 2.1.4.,2024-03-28T12:42:56.150,https://cve.circl.lu/cve/CVE-2024-29090
CVE-2024-29100,6.0,ChatGPT,Unrestricted Upload of File with Dangerous Type vulnerability in Jordy Meow AI Engine: ChatGPT Chatbot.This issue affects AI Engine: ChatGPT Chatbot: from n/a through 2.1.4.,2024-03-28T12:42:56.150,https://cve.circl.lu/cve/CVE-2024-29100
CVE-2024-28714,NA,CRM,SQL Injection vulnerability in CRMEB_Java e-commerce system v.1.3.4 allows an attacker to execute arbitrary code via the groupid parameter.,2024-03-29T12:45:02.937,https://cve.circl.lu/cve/CVE-2024-28714
CVE-2024-0608,5.9,CRM,"The WP ERP | Complete HR solution with recruitment & job listings | WooCommerce CRM & Accounting plugin for WordPress is vulnerable to union-based SQL Injection via the 'email' parameter in all versions up to, and including, 1.12.9 due to insufficient escaping on the user supplied parameter and lack of sufficient preparation on the existing SQL query.  This makes it possible for authenticated attackers, with subscriber-level access and above, to append additional SQL queries into already existing queries that can be used to extract sensitive information from the database.",2024-03-29T12:45:02.937,https://cve.circl.lu/cve/CVE-2024-0608
CVE-2024-0609,2.7,CRM,"The WP ERP | Complete HR solution with recruitment & job listings | WooCommerce CRM & Accounting plugin for WordPress is vulnerable to Stored Cross-Site Scripting via the 'api_key' parameter in all versions up to, and including, 1.12.9 due to insufficient input sanitization and output escaping. This makes it possible for unauthenticated attackers to inject arbitrary web scripts in pages that will execute whenever a user accesses an injected page.",2024-03-29T12:45:02.937,https://cve.circl.lu/cve/CVE-2024-0609
CVE-2024-0913,5.9,CRM,"The WP ERP | Complete HR solution with recruitment & job listings | WooCommerce CRM & Accounting plugin for WordPress is vulnerable to time-based SQL Injection via the erp/v1/accounting/v1/transactions/sales REST API endpoint in all versions up to, and including, 1.12.9 due to insufficient escaping on the user supplied status and customer_id parameters and lack of sufficient preparation on the existing SQL query.  This makes it possible for authenticated attackers, with accounting manager or admin privileges and higher to append additional SQL queries into already existing queries that can be used to extract sensitive information from the database.",2024-03-29T12:45:02.937,https://cve.circl.lu/cve/CVE-2024-0913
CVE-2024-0956,5.9,CRM,"The WP ERP | Complete HR solution with recruitment & job listings | WooCommerce CRM & Accounting plugin for WordPress is vulnerable to time-based SQL Injection via the id parameter via the erp/v1/accounting/v1/vendors/1/products/ REST route in all versions up to, and including, 1.12.9 due to insufficient escaping on the user supplied parameter and lack of sufficient preparation on the existing SQL query.  This makes it possible for authenticated attackers, with admin or accounting manager privileges, to append additional SQL queries into already existing queries that can be used to extract sensitive information from the database.",2024-03-29T12:45:02.937,https://cve.circl.lu/cve/CVE-2024-0956
CVE-2024-25962,5.5,Dell,"Dell InsightIQ, version 5.0, contains an improper access control vulnerability. A remote low privileged attacker could potentially exploit this vulnerability, leading to unauthorized access to monitoring data.",2024-03-27T12:29:30.307,https://cve.circl.lu/cve/CVE-2024-25962
CVE-2024-25959,5.3,Dell,"Dell PowerScale OneFS versions 9.4.0.x through 9.7.0.x contains an insertion of sensitive information into log file vulnerability. A low privileged local attacker could potentially exploit this vulnerability, leading to sensitive information disclosure, escalation of privileges.",2024-03-28T20:53:20.813,https://cve.circl.lu/cve/CVE-2024-25959
CVE-2024-25961,5.2,Dell,"Dell PowerScale OneFS versions 8.2.2.x through 9.7.0.x contains an improper privilege management vulnerability. A local high privileged attacker could potentially exploit this vulnerability, leading to escalation of privileges.",2024-03-28T20:53:20.813,https://cve.circl.lu/cve/CVE-2024-25961
CVE-2024-25946,5.9,Dell,"Dell vApp Manager, versions prior to 9.2.4.9 contain a Command Injection Vulnerability. An authorized attacker could potentially exploit this vulnerability leading to an execution of an inserted command. Dell recommends customers to upgrade at the earliest opportunity.",2024-03-28T20:53:20.813,https://cve.circl.lu/cve/CVE-2024-25946
CVE-2024-25952,5.2,Dell,"Dell PowerScale OneFS versions 8.2.2.x through 9.7.0.x contains an UNIX symbolic link (symlink) following vulnerability. A local high privileged attacker could potentially exploit this vulnerability, leading to denial of service, information tampering.",2024-03-28T20:53:20.813,https://cve.circl.lu/cve/CVE-2024-25952
CVE-2017-8806,3.6,Debian,"The Debian pg_ctlcluster, pg_createcluster, and pg_upgradecluster scripts, as distributed in the Debian postgresql-common package before 181+deb9u1 for PostgreSQL (and other packages related to Debian and Ubuntu), handled symbolic links insecurely, which could result in local denial of service by overwriting arbitrary files.",2024-04-01T15:50:53.473,https://cve.circl.lu/cve/CVE-2017-8806
CVE-2024-1023,NA,Eclipse,"A vulnerability in the Eclipse Vert.x toolkit results in a memory leak due to using Netty FastThreadLocal data structures. Specifically, when the Vert.x HTTP client establishes connections to different hosts, triggering the memory leak. The leak can be accelerated with intimate runtime knowledge, allowing an attacker to exploit this vulnerability. For instance, a server accepting arbitrary internet addresses could serve as an attack vector by connecting to these addresses, thereby accelerating the memory leak.",2024-03-27T12:29:30.307,https://cve.circl.lu/cve/CVE-2024-1023
CVE-2024-1300,NA,Eclipse,"A vulnerability in the Eclipse Vert.x toolkit causes a memory leak in TCP servers configured with TLS and SNI support. When processing an unknown SNI server name assigned the default certificate instead of a mapped certificate, the SSL context is erroneously cached in the server name map, leading to memory exhaustion. This flaw allows attackers to send TLS client hello messages with fake server names, triggering a JVM out-of-memory error.",2024-04-02T12:50:42.233,https://cve.circl.lu/cve/CVE-2024-1300
CVE-2024-23450,3.6,Elasticsearch,"A flaw was discovered in Elasticsearch, where processing a document in a deeply nested pipeline on an ingest node could cause the Elasticsearch node to crash.",2024-03-27T17:48:21.140,https://cve.circl.lu/cve/CVE-2024-23450
CVE-2024-23451,3.6,Elasticsearch,"Incorrect Authorization issue exists in the API key based security model for Remote Cluster Security, which is currently in Beta, in Elasticsearch 8.10.0 and before 8.13.0. This allows a malicious user with a valid API key for a remote cluster configured to use the new Remote Cluster Security to read arbitrary documents from any index on the remote cluster, and only if they use the Elasticsearch custom transport protocol to issue requests with the target index ID, the shard ID and the document ID. None of Elasticsearch REST API endpoints are affected by this issue.",2024-03-28T02:01:21.693,https://cve.circl.lu/cve/CVE-2024-23451
