CVE,"Impact Score (1-10, 10 being the worst)",Keyword,Description,Last Modified,Link
CVE-2024-26658,NA,MongoDB,"In the Linux kernel, the following vulnerability has been resolved:bcachefs: grab s_umount only if snapshottingWhen I was testing mongodb over bcachefs with compression,there is a lockdep warning when snapshotting mongodb data volume.$ cat test.shprog=bcachefs$prog subvolume create /mnt/data$prog subvolume create /mnt/data/snapshotswhile true;do    $prog subvolume snapshot /mnt/data /mnt/data/snapshots/$(date +%s)    sleep 1sdone$ cat /etc/mongodb.confsystemLog:  destination: file  logAppend: true  path: /mnt/data/mongod.logstorage:  dbPath: /mnt/data/lockdep reports:[ 3437.452330] ======================================================[ 3437.452750] WARNING: possible circular locking dependency detected[ 3437.453168] 6.7.0-rc7-custom+ #85 Tainted: G            E[ 3437.453562] ------------------------------------------------------[ 3437.453981] bcachefs/35533 is trying to acquire lock:[ 3437.454325] ffffa0a02b2b1418 (sb_writers#10){.+.+}-{0:0}, at: filename_create+0x62/0x190[ 3437.454875]               but task is already holding lock:[ 3437.455268] ffffa0a02b2b10e0 (&type->s_umount_key#48){.+.+}-{3:3}, at: bch2_fs_file_ioctl+0x232/0xc90 [bcachefs][ 3437.456009]               which lock already depends on the new lock.[ 3437.456553]               the existing dependency chain (in reverse order) is:[ 3437.457054]               -> #3 (&type->s_umount_key#48){.+.+}-{3:3}:[ 3437.457507]        down_read+0x3e/0x170[ 3437.457772]        bch2_fs_file_ioctl+0x232/0xc90 [bcachefs][ 3437.458206]        __x64_sys_ioctl+0x93/0xd0[ 3437.458498]        do_syscall_64+0x42/0xf0[ 3437.458779]        entry_SYSCALL_64_after_hwframe+0x6e/0x76[ 3437.459155]               -> #2 (&c->snapshot_create_lock){++++}-{3:3}:[ 3437.459615]        down_read+0x3e/0x170[ 3437.459878]        bch2_truncate+0x82/0x110 [bcachefs][ 3437.460276]        bchfs_truncate+0x254/0x3c0 [bcachefs][ 3437.460686]        notify_change+0x1f1/0x4a0[ 3437.461283]        do_truncate+0x7f/0xd0[ 3437.461555]        path_openat+0xa57/0xce0[ 3437.461836]        do_filp_open+0xb4/0x160[ 3437.462116]        do_sys_openat2+0x91/0xc0[ 3437.462402]        __x64_sys_openat+0x53/0xa0[ 3437.462701]        do_syscall_64+0x42/0xf0[ 3437.462982]        entry_SYSCALL_64_after_hwframe+0x6e/0x76[ 3437.463359]               -> #1 (&sb->s_type->i_mutex_key#15){+.+.}-{3:3}:[ 3437.463843]        down_write+0x3b/0xc0[ 3437.464223]        bch2_write_iter+0x5b/0xcc0 [bcachefs][ 3437.464493]        vfs_write+0x21b/0x4c0[ 3437.464653]        ksys_write+0x69/0xf0[ 3437.464839]        do_syscall_64+0x42/0xf0[ 3437.465009]        entry_SYSCALL_64_after_hwframe+0x6e/0x76[ 3437.465231]               -> #0 (sb_writers#10){.+.+}-{0:0}:[ 3437.465471]        __lock_acquire+0x1455/0x21b0[ 3437.465656]        lock_acquire+0xc6/0x2b0[ 3437.465822]        mnt_want_write+0x46/0x1a0[ 3437.465996]        filename_create+0x62/0x190[ 3437.466175]        user_path_create+0x2d/0x50[ 3437.466352]        bch2_fs_file_ioctl+0x2ec/0xc90 [bcachefs][ 3437.466617]        __x64_sys_ioctl+0x93/0xd0[ 3437.466791]        do_syscall_64+0x42/0xf0[ 3437.466957]        entry_SYSCALL_64_after_hwframe+0x6e/0x76[ 3437.467180]               other info that might help us debug this:[ 3437.469670] 2 locks held by bcachefs/35533:               other info that might help us debug this:[ 3437.467507] Chain exists of:                 sb_writers#10 --> &c->snapshot_create_lock --> &type->s_umount_key#48[ 3437.467979]  Possible unsafe locking scenario:[ 3437.468223]        CPU0                    CPU1[ 3437.468405]        ----                    ----[ 3437.468585]   rlock(&type->s_umount_key#48);[ 3437.468758]                                lock(&c->snapshot_create_lock);[ 3437.469030]                                lock(&type->s_umount_key#48);[ 3437.469291]   rlock(sb_writers#10);[ 3437.469434]                *** DEADLOCK ***[ 3437.469---truncated---",2024-04-02T12:50:42.233,https://cve.circl.lu/cve/CVE-2024-26658
CVE-2021-22926,3.6,MacOS,"libcurl-using applications can ask for a specific client certificate to be used in a transfer. This is done with the `CURLOPT_SSLCERT` option (`--cert` with the command line tool).When libcurl is built to use the macOS native TLS library Secure Transport, an application can ask for the client certificate by name or with a file name - using the same option. If the name exists as a file, it will be used instead of by name.If the appliction runs with a current working directory that is writable by other users (like `/tmp`), a malicious user can create a file name with the same name as the app wants to use by name, and thereby trick the application to use the file based cert instead of the one referred to by name making libcurl send the wrong client certificate in the TLS connection handshake.",2024-03-27T15:11:38.047,https://cve.circl.lu/cve/CVE-2021-22926
CVE-2024-23263,NA,MacOS,"A logic issue was addressed with improved validation. This issue is fixed in tvOS 17.4, macOS Sonoma 14.4, visionOS 1.1, iOS 17.4 and iPadOS 17.4, watchOS 10.4, iOS 16.7.6 and iPadOS 16.7.6, Safari 17.4. Processing maliciously crafted web content may prevent Content Security Policy from being enforced.",2024-04-02T03:15:11.087,https://cve.circl.lu/cve/CVE-2024-23263
CVE-2024-23280,NA,MacOS,"An injection issue was addressed with improved validation. This issue is fixed in Safari 17.4, macOS Sonoma 14.4, iOS 17.4 and iPadOS 17.4, watchOS 10.4, tvOS 17.4. A maliciously crafted webpage may be able to fingerprint the user.",2024-04-02T03:15:14.200,https://cve.circl.lu/cve/CVE-2024-23280
CVE-2024-0071,5.9,NVIDIA,"NVIDIA GPU Display Driver for Windows contains a vulnerability in the user mode layer, where an unprivileged regular user can cause an out-of-bounds write. A successful exploit of this vulnerability may lead to code execution, denial of service, escalation of privileges, information disclosure, and data tampering.",2024-03-28T02:01:13.303,https://cve.circl.lu/cve/CVE-2024-0071
CVE-2024-0073,5.9,NVIDIA,"NVIDIA GPU Display Driver for Windows contains a vulnerability in the kernel mode layer when the driver is performing an operation at a privilege level that is higher than the minimum level required. A successful exploit of this vulnerability may lead to code execution, denial of service, escalation of privileges, information disclosure, and data tampering.",2024-03-28T02:01:13.303,https://cve.circl.lu/cve/CVE-2024-0073
CVE-2024-0074,5.2,NVIDIA,NVIDIA GPU Display Driver for Linux contains a vulnerability where an attacker may access a memory location after the end of the buffer. A successful exploit of this vulnerability may lead to denial of service and data tampering.,2024-03-28T02:01:13.303,https://cve.circl.lu/cve/CVE-2024-0074
CVE-2024-0075,4.2,NVIDIA,NVIDIA GPU Display Driver for Windows and Linux contains a vulnerability where a user may cause a NULL-pointer dereference by accessing passed parameters the validity of which has not been checked. A successful exploit of this vulnerability may lead to denial of service and limited information disclosure.,2024-03-28T02:01:13.303,https://cve.circl.lu/cve/CVE-2024-0075
CVE-2024-0077,5.9,NVIDIA,"NVIDIA Virtual GPU Manager contains a vulnerability in the vGPU plugin, where it allows a guest OS to allocate resources for which the guest OS is not authorized. A successful exploit of this vulnerability may lead to code execution, denial of service, escalation of privileges, information disclosure, and data tampering.",2024-03-28T02:01:13.303,https://cve.circl.lu/cve/CVE-2024-0077
CVE-2024-30247,6.0,Nextcloud,"NextcloudPi is a ready to use image for Virtual Machines, Raspberry Pi, Odroid HC1, Rock64 and other boards. A command injection vulnerability in NextCloudPi allows command execution as the root user via the NextCloudPi web-panel. Due to a security misconfiguration this can be used by anyone with access to NextCloudPi web-panel, no authentication is required. It is recommended that the NextCloudPi is upgraded to 1.53.1.",2024-04-01T01:12:59.077,https://cve.circl.lu/cve/CVE-2024-30247
CVE-2024-1521,2.7,Nginx,"The Elementor Website Builder Pro plugin for WordPress is vulnerable to Stored Cross-Site Scripting via an SVGZ file uploaded via the Form widget in all versions up to, and including, 3.20.1 due to insufficient input sanitization and output escaping. This makes it possible for authenticated attackers, with contributor-level access and above, to inject arbitrary web scripts in pages that will execute whenever a user accesses an injected page. NOTE: This vulnerability is only exploitable on web servers running NGINX. It is not exploitable on web servers running Apache HTTP Server.",2024-03-27T12:29:30.307,https://cve.circl.lu/cve/CVE-2024-1521
CVE-2024-21896,5.8,Node.js,"The permission model protects itself against path traversal attacks by calling path.resolve() on any paths given by the user. If the path is to be treated as a Buffer, the implementation uses Buffer.from() to obtain a Buffer from the result of path.resolve(). By monkey-patching Buffer internals, namely, Buffer.prototype.utf8Write, the application can modify the result of path.resolve(), which leads to a path traversal vulnerability.This vulnerability affects all users using the experimental permission model in Node.js 20 and Node.js 21.Please note that at the time this CVE was issued, the permission model is an experimental feature of Node.js.",2024-03-29T13:15:14.000,https://cve.circl.lu/cve/CVE-2024-21896
CVE-2024-22025,3.6,Node.js,"A vulnerability in Node.js has been identified, allowing for a Denial of Service (DoS) attack through resource exhaustion when using the fetch() function to retrieve content from an untrusted URL.The vulnerability stems from the fact that the fetch() function in Node.js always decodes Brotli, making it possible for an attacker to cause resource exhaustion when fetching content from an untrusted URL.An attacker controlling the URL passed into fetch() can exploit this vulnerability to exhaust memory, potentially leading to process termination, depending on the system configuration.",2024-03-27T03:15:11.187,https://cve.circl.lu/cve/CVE-2024-22025
CVE-2024-29900,3.6,Node.js,"Electron Packager bundles Electron-based application source code with a renamed Electron executable and supporting files into folders ready for distribution. A random segment of ~1-10kb of Node.js heap memory allocated either side of a known buffer will be leaked into the final executable. This memory _could_ contain sensitive information such as environment variables, secrets files, etc. This issue is patched in 18.3.1.",2024-04-01T01:12:59.077,https://cve.circl.lu/cve/CVE-2024-29900
CVE-2020-10703,3.6,NULL Pointer,"A NULL pointer dereference was found in the libvirt API responsible introduced in upstream version 3.10.0, and fixed in libvirt 6.0.0, for fetching a storage pool based on its target path. In more detail, this flaw affects storage pools created without a target path such as network-based pools like gluster and RBD. Unprivileged users with a read-only connection could abuse this flaw to crash the libvirt daemon, resulting in a potential denial of service.",2024-04-01T13:15:47.333,https://cve.circl.lu/cve/CVE-2020-10703
CVE-2022-36227,5.9,NULL Pointer,"In libarchive before 3.6.2, the software does not check for an error after calling calloc function that can return with a NULL pointer if the function fails, which leads to a resultant NULL pointer dereference. NOTE: the discoverer cites this CWE-476 remark but third parties dispute the code-execution impact: ""In rare circumstances, when NULL is equivalent to the 0x0 memory address and privileged code can access it, then writing or reading memory is possible, which may lead to code execution.""",2024-03-27T16:04:27.210,https://cve.circl.lu/cve/CVE-2022-36227
CVE-2024-2496,3.6,NULL Pointer,A NULL pointer dereference flaw was found in the udevConnectListAllInterfaces() function in libvirt. This issue can occur when detaching a host interface while at the same time collecting the list of interfaces via virConnectListAllInterfaces API. This flaw could be used to perform a denial of service attack by causing the libvirt daemon to crash.,2024-04-01T13:17:10.640,https://cve.circl.lu/cve/CVE-2024-2496
CVE-2023-52627,NA,NULL Pointer,"In the Linux kernel, the following vulnerability has been resolved:iio: adc: ad7091r: Allow users to configure device eventsAD7091R-5 devices are supported by the ad7091r-5 driver together withthe ad7091r-base driver. Those drivers declared iio events for notifyinguser space when ADC readings fall bellow the thresholds of low limitregisters or above the values set in high limit registers.However, to configure iio events and their thresholds, a set of callbackfunctions must be implemented and those were not present until now.The consequence of trying to configure ad7091r-5 events without theproper callback functions was a null pointer dereference in the kernelbecause the pointers to the callback functions were not set.Implement event configuration callbacks allowing users to read/writeevent thresholds and enable/disable event generation.Since the event spec structs are generic to AD7091R devices, also movethose from the ad7091r-5 driver the base driver so they can be reusedwhen support for ad7091r-2/-4/-8 be added.",2024-03-27T12:29:41.530,https://cve.circl.lu/cve/CVE-2023-52627
CVE-2024-26647,NA,NULL Pointer,"In the Linux kernel, the following vulnerability has been resolved:drm/amd/display: Fix late derefrence 'dsc' check in 'link_set_dsc_pps_packet()'In link_set_dsc_pps_packet(), 'struct display_stream_compressor *dsc'was dereferenced in a DC_LOGGER_INIT(dsc->ctx->logger); before the 'dsc'NULL pointer check.Fixes the below:drivers/gpu/drm/amd/amdgpu/../display/dc/link/link_dpms.c:905 link_set_dsc_pps_packet() warn: variable dereferenced before check 'dsc' (see line 903)",2024-03-27T12:29:41.530,https://cve.circl.lu/cve/CVE-2024-26647
CVE-2022-22576,5.2,OAuth,"An improper authentication vulnerability exists in curl 7.33.0 to and including 7.82.0 which might allow reuse OAUTH2-authenticated connections without properly making sure that the connection was authenticated with the same credentials as set for this transfer. This affects SASL-enabled protocols: SMPTP(S), IMAP(S), POP3(S) and LDAP(S) (openldap only).",2024-03-27T15:02:35.557,https://cve.circl.lu/cve/CVE-2022-22576
CVE-2024-0980,NA,Okta,The Auto-update service for Okta Verify for Windows is vulnerable to two flaws which in combination could be used to execute arbitrary code.,2024-03-28T02:01:13.303,https://cve.circl.lu/cve/CVE-2024-0980
CVE-2021-22901,5.9,OpenSSL,"curl 7.75.0 through 7.76.1 suffers from a use-after-free vulnerability resulting in already freed memory being used when a TLS 1.3 session ticket arrives over a connection. A malicious server can use this in rare unfortunate circumstances to potentially reach remote code execution in the client. When libcurl at run-time sets up support for TLS 1.3 session tickets on a connection using OpenSSL, it stores pointers to the transfer in-memory object for later retrieval when a session ticket arrives. If the connection is used by multiple transfers (like with a reused HTTP/1.1 connection or multiplexed HTTP/2 connection) that first transfer object might be freed before the new session is established on that connection and then the function will access a memory buffer that might be freed. When using that memory, libcurl might even call a function pointer in the object, making it possible for a remote code execution if the server could somehow manage to get crafted memory content into the correct place in memory.",2024-03-27T15:12:59.917,https://cve.circl.lu/cve/CVE-2021-22901
CVE-2024-22248,4.2,Orchestrator,VMware SD-WAN Orchestrator contains an open redirect vulnerability.A malicious actor may be able to redirect a victim to an attacker controlled domain due to improper path handling leading to sensitive information disclosure.,2024-04-02T18:12:16.283,https://cve.circl.lu/cve/CVE-2024-22248
CVE-2022-31630,5.2,PHP,"In PHP versions prior to 7.4.33, 8.0.25 and 8.1.12, when using imageloadfont() function in gd extension, it is possible to supply a specially crafted font file, such as if the loaded font is used with imagechar() function, the read outside allocated buffer will be used. This can lead to crashes or disclosure of confidential information. ",2024-04-02T03:15:07.973,https://cve.circl.lu/cve/CVE-2022-31630
CVE-2023-43655,5.9,PHP,"Composer is a dependency manager for PHP. Users publishing a composer.phar to a public web-accessible server where the composer.phar can be executed as a php file may be subject to a remote code execution vulnerability if PHP also has `register_argc_argv` enabled in php.ini. Versions 2.6.4, 2.2.22 and 1.10.27 patch this vulnerability. Users are advised to upgrade. Users unable to upgrade should make sure `register_argc_argv` is disabled in php.ini, and avoid publishing composer.phar to the web as this is not best practice.",2024-03-27T10:15:08.007,https://cve.circl.lu/cve/CVE-2023-43655
CVE-2024-24399,5.9,PHP,An arbitrary file upload vulnerability in LEPTON v7.0.0 allows authenticated attackers to execute arbitrary PHP code by uploading this code to the backend/languages/index.php languages area.,2024-04-01T04:15:10.803,https://cve.circl.lu/cve/CVE-2024-24399
CVE-2024-2203,2.7,PHP,"The The Plus Addons for Elementor plugin for WordPress is vulnerable to Local File Inclusion in all versions up to, and including, 5.4.1 via the Clients widget. This makes it possible for authenticated attackers, with contributor-level access and above, to include and execute arbitrary files on the server, allowing the execution of any PHP code in those files. This can be used to bypass access controls, obtain sensitive data, or achieve code execution in cases where images and other “safe” file types can be uploaded and included.",2024-03-27T12:29:30.307,https://cve.circl.lu/cve/CVE-2024-2203
CVE-2024-2210,2.7,PHP,"The The Plus Addons for Elementor plugin for WordPress is vulnerable to Local File Inclusion in all versions up to, and including, 5.4.1 via the Team Member Listing widget. This makes it possible for authenticated attackers, with contributor-level access and above, to include and execute arbitrary files on the server, allowing the execution of any PHP code in those files. This can be used to bypass access controls, obtain sensitive data, or achieve code execution in cases where images and other “safe” file types can be uploaded and included.",2024-03-27T12:29:30.307,https://cve.circl.lu/cve/CVE-2024-2210
CVE-2024-1141,3.6,Python,A vulnerability was found in python-glance-store. The issue occurs when the package logs the access_key for the glance-store when the DEBUG log level is enabled.,2024-04-01T15:52:06.640,https://cve.circl.lu/cve/CVE-2024-1141
CVE-2024-30248,5.8,Python,"Piccolo Admin is an admin interface/content management system for Python, built on top of Piccolo. Piccolo's admin panel allows media files to be uploaded. As a default, SVG is an allowed file type for upload. An attacker can upload an SVG which when loaded can allow arbitrary access to the admin page. This vulnerability was patched in version 1.3.2.",2024-04-02T18:12:16.283,https://cve.circl.lu/cve/CVE-2024-30248
CVE-2020-12430,3.6,QEMU,"An issue was discovered in qemuDomainGetStatsIOThread in qemu/qemu_driver.c in libvirt 4.10.0 though 6.x before 6.1.0. A memory leak was found in the virDomainListGetStats libvirt API that is responsible for retrieving domain statistics when managing QEMU guests. This flaw allows unprivileged users with a read-only connection to cause a memory leak in the domstats command, resulting in a potential denial of service.",2024-04-01T13:16:04.047,https://cve.circl.lu/cve/CVE-2020-12430
CVE-2020-25637,5.9,QEMU,"A double free memory issue was found to occur in the libvirt API, in versions before 6.8.0, responsible for requesting information about network interfaces of a running QEMU domain. This flaw affects the polkit access control driver. Specifically, clients connecting to the read-write socket with limited ACL permissions could use this flaw to crash the libvirt daemon, resulting in a denial of service, or potentially escalate their privileges on the system. The highest threat from this vulnerability is to data confidentiality and integrity as well as system availability.",2024-04-01T13:16:37.240,https://cve.circl.lu/cve/CVE-2020-25637
CVE-2021-3975,3.6,QEMU,A use-after-free flaw was found in libvirt. The qemuMonitorUnregister() function in qemuProcessHandleMonitorEOF is called using multiple threads without being adequately protected by a monitor lock. This flaw could be triggered by the virConnectGetAllDomainStats API when the guest is shutting down. An unprivileged client with a read-only connection could use this flaw to perform a denial of service attack by causing the libvirt daemon to crash.,2024-04-01T13:16:50.493,https://cve.circl.lu/cve/CVE-2021-3975
CVE-2023-52621,NA,QEMU,"In the Linux kernel, the following vulnerability has been resolved:bpf: Check rcu_read_lock_trace_held() before calling bpf map helpersThese three bpf_map_{lookup,update,delete}_elem() helpers are alsoavailable for sleepable bpf program, so add the corresponding lockassertion for sleepable bpf program, otherwise the following warningwill be reported when a sleepable bpf program manipulates bpf map underinterpreter mode (aka bpf_jit_enable=0):  WARNING: CPU: 3 PID: 4985 at kernel/bpf/helpers.c:40 ......  CPU: 3 PID: 4985 Comm: test_progs Not tainted 6.6.0+ #2  Hardware name: QEMU Standard PC (i440FX + PIIX, 1996) ......  RIP: 0010:bpf_map_lookup_elem+0x54/0x60  ......  Call Trace:   <TASK>   ? __warn+0xa5/0x240   ? bpf_map_lookup_elem+0x54/0x60   ? report_bug+0x1ba/0x1f0   ? handle_bug+0x40/0x80   ? exc_invalid_op+0x18/0x50   ? asm_exc_invalid_op+0x1b/0x20   ? __pfx_bpf_map_lookup_elem+0x10/0x10   ? rcu_lockdep_current_cpu_online+0x65/0xb0   ? rcu_is_watching+0x23/0x50   ? bpf_map_lookup_elem+0x54/0x60   ? __pfx_bpf_map_lookup_elem+0x10/0x10   ___bpf_prog_run+0x513/0x3b70   __bpf_prog_run32+0x9d/0xd0   ? __bpf_prog_enter_sleepable_recur+0xad/0x120   ? __bpf_prog_enter_sleepable_recur+0x3e/0x120   bpf_trampoline_6442580665+0x4d/0x1000   __x64_sys_getpgid+0x5/0x30   ? do_syscall_64+0x36/0xb0   entry_SYSCALL_64_after_hwframe+0x6e/0x76   </TASK>",2024-03-27T12:29:41.530,https://cve.circl.lu/cve/CVE-2023-52621
