CVE,"Impact Score (1-10, 10 being the worst)",Keyword,Description,Last Modified,Link
CVE-2018-11727,3.6,GitHub,The libfsntfs_attribute_read_from_mft function in libfsntfs_attribute.c in libfsntfs through 2018-04-20 allows remote attackers to cause an information disclosure (heap-based buffer over-read) via a crafted ntfs file. NOTE: the vendor has disputed this as described in libyal/libfsntfs issue 8 on GitHub,2024-06-04T19:16:56.537,https://cve.circl.lu/cve/CVE-2018-11727
CVE-2020-18900,1.4,GitHub,A heap-based buffer overflow in the libexe_io_handle_read_coff_optional_header function of libyal libexe before 20181128. NOTE: the vendor has disputed this as described in libyal/libexe issue 1 on GitHub,2024-06-04T19:17:01.007,https://cve.circl.lu/cve/CVE-2020-18900
CVE-2024-35221,1.4,GitHub,Rubygems.org is the Ruby community's gem hosting service. A Gem publisher can cause a Remote DoS when publishing a Gem. This is due to how Ruby reads the Manifest of Gem files when using Gem::Specification.from_yaml. from_yaml makes use of SafeYAML.load which allows YAML aliases inside the YAML-based metadata of a gem. YAML aliases allow for Denial of Service attacks with so-called `YAML-bombs` (comparable to Billion laughs attacks). This was patched. There is is no action required by users. This issue is also tracked as GHSL-2024-001 and was discovered by the GitHub security lab.,2024-05-30T13:15:41.297,https://cve.circl.lu/cve/CVE-2024-35221
CVE-2024-3924,2.7,GitHub,"A code injection vulnerability exists in the huggingface/text-generation-inference repository, specifically within the `autodocs.yml` workflow file. The vulnerability arises from the insecure handling of the `github.head_ref` user input, which is used to dynamically construct a command for installing a software package. An attacker can exploit this by forking the repository, creating a branch with a malicious payload as the name, and then opening a pull request to the base repository. Successful exploitation could lead to arbitrary code execution within the context of the GitHub Actions runner. This issue affects versions up to and including v2.0.0 and was fixed in version 2.0.0.",2024-05-30T18:19:11.743,https://cve.circl.lu/cve/CVE-2024-3924
CVE-2024-4253,5.9,GitHub,"A command injection vulnerability exists in the gradio-app/gradio repository, specifically within the 'test-functional.yml' workflow. The vulnerability arises due to improper neutralization of special elements used in a command, allowing for unauthorized modification of the base repository or secrets exfiltration. The issue affects versions up to and including '@gradio/video@0.6.12'. The flaw is present in the workflow's handling of GitHub context information, where it echoes the full name of the head repository, the head branch, and the workflow reference without adequate sanitization. This could potentially lead to the exfiltration of sensitive secrets such as 'GITHUB_TOKEN', 'COMMENT_TOKEN', and 'CHROMATIC_PROJECT_TOKEN'.",2024-06-04T16:57:41.053,https://cve.circl.lu/cve/CVE-2024-4253
CVE-2022-43384,2.5,IBM,IBM Aspera Console 3.4.0 through 3.4.2 PL5 is vulnerable to cross-site scripting. This vulnerability allows users to embed arbitrary JavaScript code in the Web UI thus altering the intended functionality potentially leading to credentials disclosure within a trusted session.  IBM X-Force ID:  238645.,2024-05-30T13:15:41.297,https://cve.circl.lu/cve/CVE-2022-43384
CVE-2022-43575,2.7,IBM,IBM Aspera Console 3.4.0 through 3.4.2 PL5 is vulnerable to cross-site scripting. This vulnerability allows users to embed arbitrary JavaScript code in the Web UI thus altering the intended functionality potentially leading to credentials disclosure within a trusted session.  IBM X-Force ID:  238645.,2024-05-30T13:15:41.297,https://cve.circl.lu/cve/CVE-2022-43575
CVE-2022-43841,1.4,IBM,IBM Aspera Console 3.4.0 through 3.4.2 PL9 allows web pages to be stored locally which can be read by another user on the system.  IBM X-Force ID:  239078.,2024-05-30T13:15:41.297,https://cve.circl.lu/cve/CVE-2022-43841
CVE-2024-36926,NA,IBM,"In the Linux kernel, the following vulnerability has been resolved:powerpc/pseries/iommu: LPAR panics during boot up with a frozen PEAt the time of LPAR boot up, partition firmware provides Open Firmwareproperty ibm,dma-window for the PE. This property is provided on the PCIbus the PE is attached to.There are execptions where the partition firmware might not provide thisproperty for the PE at the time of LPAR boot up. One of the scenario iswhere the firmware has frozen the PE due to some error condition. ThisPE is frozen for 24 hours or unless the whole system is reinitialized.Within this time frame, if the LPAR is booted, the frozen PE will bepresented to the LPAR but ibm,dma-window property could be missing.Today, under these circumstances, the LPAR oopses with NULL pointerdereference, when configuring the PCI bus the PE is attached to.  BUG: Kernel NULL pointer dereference on read at 0x000000c8  Faulting instruction address: 0xc0000000001024c0  Oops: Kernel access of bad area, sig: 7 [#1]  LE PAGE_SIZE=64K MMU=Radix SMP NR_CPUS=2048 NUMA pSeries  Modules linked in:  Supported: Yes  CPU: 0 PID: 1 Comm: swapper/0 Not tainted 6.4.0-150600.9-default #1  Hardware name: IBM,9043-MRX POWER10 (raw) 0x800200 0xf000006 of:IBM,FW1060.00 (NM1060_023) hv:phyp pSeries  NIP:  c0000000001024c0 LR: c0000000001024b0 CTR: c000000000102450  REGS: c0000000037db5c0 TRAP: 0300   Not tainted  (6.4.0-150600.9-default)  MSR:  8000000002009033 <SF,VEC,EE,ME,IR,DR,RI,LE>  CR: 28000822  XER: 00000000  CFAR: c00000000010254c DAR: 00000000000000c8 DSISR: 00080000 IRQMASK: 0  ...  NIP [c0000000001024c0] pci_dma_bus_setup_pSeriesLP+0x70/0x2a0  LR [c0000000001024b0] pci_dma_bus_setup_pSeriesLP+0x60/0x2a0  Call Trace:    pci_dma_bus_setup_pSeriesLP+0x60/0x2a0 (unreliable)    pcibios_setup_bus_self+0x1c0/0x370    __of_scan_bus+0x2f8/0x330    pcibios_scan_phb+0x280/0x3d0    pcibios_init+0x88/0x12c    do_one_initcall+0x60/0x320    kernel_init_freeable+0x344/0x3e4    kernel_init+0x34/0x1d0    ret_from_kernel_user_thread+0x14/0x1c",2024-05-30T18:18:58.870,https://cve.circl.lu/cve/CVE-2024-36926
CVE-2024-36928,NA,IBM,"In the Linux kernel, the following vulnerability has been resolved:s390/qeth: Fix kernel panic after setting hsuidSymptom:When the hsuid attribute is set for the first time on an IQD Layer3device while the corresponding network interface is already UP,the kernel will try to execute a napi function pointer that is NULL.Example:---------------------------------------------------------------------------[ 2057.572696] illegal operation: 0001 ilc:1 [#1] SMP[ 2057.572702] Modules linked in: af_iucv qeth_l3 zfcp scsi_transport_fc sunrpc nft_fib_inet nft_fib_ipv4 nft_fib_ipv6 nft_fib nft_reject_inet nf_reject_ipv4 nf_reject_ipv6nft_reject nft_ct nf_tables_set nft_chain_nat nf_nat nf_conntrack nf_defrag_ipv6 nf_defrag_ipv4 ip_set nf_tables libcrc32c nfnetlink ghash_s390 prng xts aes_s390 des_s390 des_generic sha3_512_s390 sha3_256_s390 sha512_s390 vfio_ccw vfio_mdev mdev vfio_iommu_type1 eadm_sch vfio ext4 mbcache jbd2 qeth_l2 bridge stp llc dasd_eckd_mod qeth dasd_mod qdio ccwgroup pkey zcrypt[ 2057.572739] CPU: 6 PID: 60182 Comm: stress_client Kdump: loaded Not tainted 4.18.0-541.el8.s390x #1[ 2057.572742] Hardware name: IBM 3931 A01 704 (LPAR)[ 2057.572744] Krnl PSW : 0704f00180000000 0000000000000002 (0x2)[ 2057.572748]            R:0 T:1 IO:1 EX:1 Key:0 M:1 W:0 P:0 AS:3 CC:3 PM:0 RI:0 EA:3[ 2057.572751] Krnl GPRS: 0000000000000004 0000000000000000 00000000a3b008d8 0000000000000000[ 2057.572754]            00000000a3b008d8 cb923a29c779abc5 0000000000000000 00000000814cfd80[ 2057.572756]            000000000000012c 0000000000000000 00000000a3b008d8 00000000a3b008d8[ 2057.572758]            00000000bab6d500 00000000814cfd80 0000000091317e46 00000000814cfc68[ 2057.572762] Krnl Code:#0000000000000000: 0000                illegal                         >0000000000000002: 0000                illegal                          0000000000000004: 0000                illegal                          0000000000000006: 0000                illegal                          0000000000000008: 0000                illegal                          000000000000000a: 0000                illegal                          000000000000000c: 0000                illegal                          000000000000000e: 0000                illegal[ 2057.572800] Call Trace:[ 2057.572801] ([<00000000ec639700>] 0xec639700)[ 2057.572803]  [<00000000913183e2>] net_rx_action+0x2ba/0x398[ 2057.572809]  [<0000000091515f76>] __do_softirq+0x11e/0x3a0[ 2057.572813]  [<0000000090ce160c>] do_softirq_own_stack+0x3c/0x58[ 2057.572817] ([<0000000090d2cbd6>] do_softirq.part.1+0x56/0x60)[ 2057.572822]  [<0000000090d2cc60>] __local_bh_enable_ip+0x80/0x98[ 2057.572825]  [<0000000091314706>] __dev_queue_xmit+0x2be/0xd70[ 2057.572827]  [<000003ff803dd6d6>] afiucv_hs_send+0x24e/0x300 [af_iucv][ 2057.572830]  [<000003ff803dd88a>] iucv_send_ctrl+0x102/0x138 [af_iucv][ 2057.572833]  [<000003ff803de72a>] iucv_sock_connect+0x37a/0x468 [af_iucv][ 2057.572835]  [<00000000912e7e90>] __sys_connect+0xa0/0xd8[ 2057.572839]  [<00000000912e9580>] sys_socketcall+0x228/0x348[ 2057.572841]  [<0000000091514e1a>] system_call+0x2a6/0x2c8[ 2057.572843] Last Breaking-Event-Address:[ 2057.572844]  [<0000000091317e44>] __napi_poll+0x4c/0x1d8[ 2057.572846][ 2057.572847] Kernel panic - not syncing: Fatal exception in interrupt-------------------------------------------------------------------------------------------Analysis:There is one napi structure per out_q: card->qdio.out_qs[i].napiThe napi.poll functions are set during qeth_open().Sincecommit 1cfef80d4c2b (""s390/qeth: Don't call dev_close/dev_open (DOWN/UP)"")qeth_set_offline()/qeth_set_online() no longer call dev_close()/dev_open(). So if qeth_free_qdio_queues() clearedcard->qdio.out_qs[i].napi.poll while the network interface was UP and thecard was offline, they are not set again.Reproduction:chzdev -e $devno layer2=0ip link set dev $network_interface upecho 0 > /sys/bus/ccw---truncated---",2024-05-30T18:18:58.870,https://cve.circl.lu/cve/CVE-2024-36928
CVE-2024-3720,3.4,Intel,A vulnerability has been found in Tianwell Fire Intelligent Command Platform 1.1.1.1 and classified as critical. This vulnerability affects unknown code of the file /mfsNotice/page of the component API Interface. The manipulation of the argument gsdwid leads to sql injection. The attack can be initiated remotely. The exploit has been disclosed to the public and may be used. The identifier of this vulnerability is VDB-260572.,2024-06-04T19:20:23.660,https://cve.circl.lu/cve/CVE-2024-3720
CVE-2024-36955,NA,Intel,"In the Linux kernel, the following vulnerability has been resolved:ALSA: hda: intel-sdw-acpi: fix usage of device_get_named_child_node()The documentation for device_get_named_child_node() mentions thisimportant point:""The caller is responsible for calling fwnode_handle_put() on thereturned fwnode pointer.""Add fwnode_handle_put() to avoid a leaked reference.",2024-05-30T18:18:58.870,https://cve.circl.lu/cve/CVE-2024-36955
CVE-2018-11681,5.9,IoT,"Default and unremovable support credentials (user:nwk password:nwk2) allow attackers to gain total super user control of an IoT device through a TELNET session to products using the RadioRA 2 Lutron integration protocol Revision M to Revision Y. NOTE: The vendor disputes this id as not being a vulnerability because what can be done through the ports revolve around controlling lighting, not code execution. A certain set of commands are listed, which bear some similarity to code, but they are not arbitrary and do not allow admin-level control of a machine",2024-06-04T19:16:56.400,https://cve.circl.lu/cve/CVE-2018-11681
CVE-2017-14522,2.7,Java,"In WonderCMS 2.3.1, the application's input fields accept arbitrary user input resulting in execution of malicious JavaScript. NOTE: the vendor disputes this issue stating that this is a feature that enables only a logged in administrator to write execute JavaScript anywhere on their website",2024-06-04T19:16:54.113,https://cve.circl.lu/cve/CVE-2017-14522
CVE-2019-13644,2.7,Java,"Firefly III before 4.7.17.1 is vulnerable to stored XSS due to lack of filtration of user-supplied data in a budget name. The JavaScript code is contained in a transaction, and is executed on the tags/show/$tag_number$ tag summary page. NOTE: It is asserted that an attacker must have the same access rights as the user in order to be able to execute the vulnerability",2024-06-04T19:16:57.510,https://cve.circl.lu/cve/CVE-2019-13644
CVE-2020-5245,5.9,Java,"Dropwizard-Validation before 1.3.19, and 2.0.2 may allow arbitrary code execution on the host system, with the privileges of the Dropwizard service account, by injecting arbitrary Java Expression Language expressions when using the self-validating feature.The issue has been fixed in dropwizard-validation 1.3.19 and 2.0.2.",2024-06-05T17:15:10.123,https://cve.circl.lu/cve/CVE-2020-5245
CVE-2022-27139,5.9,Java,"An arbitrary file upload vulnerability in the file upload module of Ghost v4.39.0 allows attackers to execute arbitrary code via a crafted SVG file. NOTE: Vendor states that as outlined in Ghost's security documentation, upload of SVGs is only possible by trusted authenticated users. The uploading of SVG files to Ghost does not represent a remote code execution vulnerability. SVGs are not executable on the server, and may only execute javascript in a client's browser - this is expected and intentional functionality",2024-06-04T19:17:15.347,https://cve.circl.lu/cve/CVE-2022-27139
CVE-2024-36362,3.6,JetBrains,"In JetBrains TeamCity before 2022.04.7, 2022.10.6, 2023.05.6, 2023.11.5, 2024.03.2 path traversal allowing to read files from server was possible",2024-05-31T14:15:09.370,https://cve.circl.lu/cve/CVE-2024-36362
CVE-2024-36363,2.5,JetBrains,"In JetBrains TeamCity before 2022.04.7, 2022.10.6, 2023.05.6, 2023.11.5 several Stored XSS in code inspection reports were possible",2024-05-31T14:15:09.563,https://cve.circl.lu/cve/CVE-2024-36363
CVE-2024-36364,3.6,JetBrains,"In JetBrains TeamCity before 2022.04.7, 2022.10.6, 2023.05.6, 2023.11.5 improper access control in Pull Requests and Commit status publisher build features was possible",2024-05-31T14:15:09.660,https://cve.circl.lu/cve/CVE-2024-36364
CVE-2024-36365,5.2,JetBrains,"In JetBrains TeamCity before 2022.04.7, 2022.10.6, 2023.05.6, 2023.11.5, 2024.03.2 a third-party agent could impersonate a cloud agent",2024-05-31T14:15:09.753,https://cve.circl.lu/cve/CVE-2024-36365
CVE-2024-36366,2.5,JetBrains,"In JetBrains TeamCity before 2022.04.7, 2022.10.6, 2023.05.6, 2023.11.5 an XSS could be executed via certain report grouping and filtering operations",2024-05-31T14:15:09.853,https://cve.circl.lu/cve/CVE-2024-36366
CVE-2022-48197,2.7,JavaScript,"Reflected cross-site scripting (XSS) exists in Sandbox examples in the YUI2 repository. The download distributions, TreeView component and the YUI Javascript library overall are not affected. NOTE: This vulnerability only affects products that are no longer supported by the maintainer.",2024-06-04T19:17:20.033,https://cve.circl.lu/cve/CVE-2022-48197
CVE-2022-41678,5.9,JDK,"Once an user is authenticated on Jolokia, he can potentially trigger arbitrary code execution. In details, in ActiveMQ configurations, jetty allowsorg.jolokia.http.AgentServlet to handler request to /api/jolokiaorg.jolokia.http.HttpRequestHandler#handlePostRequest is able tocreate JmxRequest through JSONObject. And calls toorg.jolokia.http.HttpRequestHandler#executeRequest.Into deeper calling stacks,org.jolokia.handler.ExecHandler#doHandleRequest can be invokedthrough refection. This could lead to RCE through viavarious mbeans. One example is unrestricted deserialization in jdk.management.jfr.FlightRecorderMXBeanImpl which exists on Java version above 11.1 Call newRecording.2 Call setConfiguration. And a webshell data hides in it.3 Call startRecording.4 Call copyTo method. The webshell will be written to a .jsp file.The mitigation is to restrict (by default) the actions authorized on Jolokia, or disable Jolokia.A more restrictive Jolokia configuration has been defined in default ActiveMQ distribution. We encourage users to upgrade to ActiveMQ distributions version including updated Jolokia configuration: 5.16.6, 5.17.4, 5.18.0, 6.0.0.",2024-05-31T09:15:09.367,https://cve.circl.lu/cve/CVE-2022-41678
CVE-2024-36114,4.7,JDK,"Aircompressor is a library with ports of the Snappy, LZO, LZ4, and Zstandard compression algorithms to Java. All decompressor implementations of Aircompressor (LZ4, LZO, Snappy, Zstandard) can crash the JVM for certain input, and in some cases also leak the content of other memory of the Java process (which could contain sensitive information). When decompressing certain data, the decompressors try to access memory outside the bounds of the given byte arrays or byte buffers. Because Aircompressor uses the JDK class `sun.misc.Unsafe` to speed up memory access, no additional bounds checks are performed and this has similar security consequences as out-of-bounds access in C or C++, namely it can lead to non-deterministic behavior or crash the JVM. Users should update to Aircompressor 0.27 or newer where these issues have been fixed. When decompressing data from untrusted users, this can be exploited for a denial-of-service attack by crashing the JVM, or to leak other sensitive information from the Java process. There are no known workarounds for this issue.",2024-05-30T13:15:41.297,https://cve.circl.lu/cve/CVE-2024-36114
CVE-2024-36124,1.4,JDK,"iq80 Snappy is a compression/decompression library. When uncompressing certain data, Snappy tries to read outside the bounds of the given byte arrays. Because Snappy uses the JDK class `sun.misc.Unsafe` to speed up memory access, no additional bounds checks are performed and this has similar security consequences as out-of-bounds access in C or C++, namely it can lead to non-deterministic behavior or crash the JVM. iq80 Snappy is not actively maintained anymore. As quick fix users can upgrade to version 0.5.",2024-06-03T19:23:17.807,https://cve.circl.lu/cve/CVE-2024-36124
CVE-2019-16229,3.6,Linux,"drivers/gpu/drm/amd/amdkfd/kfd_interrupt.c in the Linux kernel 5.2.14 does not check the alloc_workqueue return value, leading to a NULL pointer dereference. NOTE: The security community disputes this issues as not being serious enough to be deserving a CVE id",2024-06-04T19:16:57.683,https://cve.circl.lu/cve/CVE-2019-16229
CVE-2019-19065,3.6,Linux,"A memory leak in the sdma_init() function in drivers/infiniband/hw/hfi1/sdma.c in the Linux kernel before 5.3.9 allows attackers to cause a denial of service (memory consumption) by triggering rhashtable_init() failures, aka CID-34b3be18a04e. NOTE: This has been disputed as not a vulnerability because ""rhashtable_init() can only fail if it is passed invalid values in the second parameter's struct, but when invoked from sdma_init() that is a pointer to a static const struct, so an attacker could only trigger failure if they could corrupt kernel memory (in which case a small memory leak is not a significant problem).",2024-06-04T19:16:57.910,https://cve.circl.lu/cve/CVE-2019-19065
CVE-2020-12656,3.6,Linux,"gss_mech_free in net/sunrpc/auth_gss/gss_mech_switch.c in the rpcsec_gss_krb5 implementation in the Linux kernel through 5.6.10 lacks certain domain_release calls, leading to a memory leak. Note: This was disputed with the assertion that the issue does not grant any access not already available. It is a problem that on unloading a specific kernel module some memory is leaked, but loading kernel modules is a privileged operation. A user could also write a kernel module to consume any amount of memory they like and load that replicating the effect of this bug",2024-06-04T19:17:00.153,https://cve.circl.lu/cve/CVE-2020-12656
CVE-2023-24069,1.4,Linux,"Signal Desktop before 6.2.0 on Windows, Linux, and macOS allows an attacker to obtain potentially sensitive attachments sent in messages from the attachments.noindex directory. Cached attachments are not effectively cleared. In some cases, even after a self-initiated file deletion, an attacker can still recover the file if it was previously replied to in a conversation. (Local filesystem access is needed by the attacker.) NOTE: the vendor disputes the relevance of this finding because the product is not intended to protect against adversaries with this degree of local access.",2024-06-04T19:17:23.460,https://cve.circl.lu/cve/CVE-2023-24069
CVE-2024-36885,NA,MSI,"In the Linux kernel, the following vulnerability has been resolved:drm/nouveau/firmware: Fix SG_DEBUG error with nvkm_firmware_ctor()Currently, enabling SG_DEBUG in the kernel will cause nouveau to hit aBUG() on startup:  kernel BUG at include/linux/scatterlist.h:187!  invalid opcode: 0000 [#1] PREEMPT SMP NOPTI  CPU: 7 PID: 930 Comm: (udev-worker) Not tainted 6.9.0-rc3Lyude-Test+ #30  Hardware name: MSI MS-7A39/A320M GAMING PRO (MS-7A39), BIOS 1.I0 01/22/2019  RIP: 0010:sg_init_one+0x85/0xa0  Code: 69 88 32 01 83 e1 03 f6 c3 03 75 20 a8 01 75 1e 48 09 cb 41 89 54  24 08 49 89 1c 24 41 89 6c 24 0c 5b 5d 41 5c e9 7b b9 88 00 <0f> 0b 0f 0b  0f 0b 48 8b 05 5e 46 9a 01 eb b2 66 66 2e 0f 1f 84 00  RSP: 0018:ffffa776017bf6a0 EFLAGS: 00010246  RAX: 0000000000000000 RBX: ffffa77600d87000 RCX: 000000000000002b  RDX: 0000000000000001 RSI: 0000000000000000 RDI: ffffa77680d87000  RBP: 000000000000e000 R08: 0000000000000000 R09: 0000000000000000  R10: ffff98f4c46aa508 R11: 0000000000000000 R12: ffff98f4c46aa508  R13: ffff98f4c46aa008 R14: ffffa77600d4a000 R15: ffffa77600d4a018  FS:  00007feeb5aae980(0000) GS:ffff98f5c4dc0000(0000) knlGS:0000000000000000  CS:  0010 DS: 0000 ES: 0000 CR0: 0000000080050033  CR2: 00007f22cb9a4520 CR3: 00000001043ba000 CR4: 00000000003506f0  Call Trace:   <TASK>   ? die+0x36/0x90   ? do_trap+0xdd/0x100   ? sg_init_one+0x85/0xa0   ? do_error_trap+0x65/0x80   ? sg_init_one+0x85/0xa0   ? exc_invalid_op+0x50/0x70   ? sg_init_one+0x85/0xa0   ? asm_exc_invalid_op+0x1a/0x20   ? sg_init_one+0x85/0xa0   nvkm_firmware_ctor+0x14a/0x250 [nouveau]   nvkm_falcon_fw_ctor+0x42/0x70 [nouveau]   ga102_gsp_booter_ctor+0xb4/0x1a0 [nouveau]   r535_gsp_oneinit+0xb3/0x15f0 [nouveau]   ? srso_return_thunk+0x5/0x5f   ? srso_return_thunk+0x5/0x5f   ? nvkm_udevice_new+0x95/0x140 [nouveau]   ? srso_return_thunk+0x5/0x5f   ? srso_return_thunk+0x5/0x5f   ? ktime_get+0x47/0xb0   ? srso_return_thunk+0x5/0x5f   nvkm_subdev_oneinit_+0x4f/0x120 [nouveau]   nvkm_subdev_init_+0x39/0x140 [nouveau]   ? srso_return_thunk+0x5/0x5f   nvkm_subdev_init+0x44/0x90 [nouveau]   nvkm_device_init+0x166/0x2e0 [nouveau]   nvkm_udevice_init+0x47/0x70 [nouveau]   nvkm_object_init+0x41/0x1c0 [nouveau]   nvkm_ioctl_new+0x16a/0x290 [nouveau]   ? __pfx_nvkm_client_child_new+0x10/0x10 [nouveau]   ? __pfx_nvkm_udevice_new+0x10/0x10 [nouveau]   nvkm_ioctl+0x126/0x290 [nouveau]   nvif_object_ctor+0x112/0x190 [nouveau]   nvif_device_ctor+0x23/0x60 [nouveau]   nouveau_cli_init+0x164/0x640 [nouveau]   nouveau_drm_device_init+0x97/0x9e0 [nouveau]   ? srso_return_thunk+0x5/0x5f   ? pci_update_current_state+0x72/0xb0   ? srso_return_thunk+0x5/0x5f   nouveau_drm_probe+0x12c/0x280 [nouveau]   ? srso_return_thunk+0x5/0x5f   local_pci_probe+0x45/0xa0   pci_device_probe+0xc7/0x270   really_probe+0xe6/0x3a0   __driver_probe_device+0x87/0x160   driver_probe_device+0x1f/0xc0   __driver_attach+0xec/0x1f0   ? __pfx___driver_attach+0x10/0x10   bus_for_each_dev+0x88/0xd0   bus_add_driver+0x116/0x220   driver_register+0x59/0x100   ? __pfx_nouveau_drm_init+0x10/0x10 [nouveau]   do_one_initcall+0x5b/0x320   do_init_module+0x60/0x250   init_module_from_file+0x86/0xc0   idempotent_init_module+0x120/0x2b0   __x64_sys_finit_module+0x5e/0xb0   do_syscall_64+0x83/0x160   ? srso_return_thunk+0x5/0x5f   entry_SYSCALL_64_after_hwframe+0x71/0x79  RIP: 0033:0x7feeb5cc20cd  Code: ff c3 66 2e 0f 1f 84 00 00 00 00 00 90 f3 0f 1e fa 48 89 f8 48 89  f7 48 89 d6 48 89 ca 4d 89 c2 4d 89 c8 4c 8b 4c 24 08 0f 05 <48> 3d 01 f0  ff ff 73 01 c3 48 8b 0d 1b cd 0c 00 f7 d8 64 89 01 48  RSP: 002b:00007ffcf220b2c8 EFLAGS: 00000246 ORIG_RAX: 0000000000000139  RAX: ffffffffffffffda RBX: 000055fdd2916aa0 RCX: 00007feeb5cc20cd  RDX: 0000000000000000 RSI: 000055fdd29161e0 RDI: 0000000000000035  RBP: 00007ffcf220b380 R08: 00007feeb5d8fb20 R09: 00007ffcf220b310  R10: 000055fdd2909dc0 R11: 0000000000000246 R12: 000055---truncated---",2024-05-30T18:18:58.870,https://cve.circl.lu/cve/CVE-2024-36885
CVE-2021-25649,3.6,Management,An information disclosure vulnerability was discovered in the directory and file management of Avaya Aura Utility Services. This vulnerability may potentially allow any local user to access system functionality and configuration information that should only be available to a privileged user. Affects all 7.x versions of Avaya Aura Utility Services,2024-06-04T19:17:03.130,https://cve.circl.lu/cve/CVE-2021-25649
CVE-2023-5271,5.9,Management,A vulnerability was found in SourceCodester Best Courier Management System 1.0. It has been rated as critical. Affected by this issue is some unknown functionality of the file edit_parcel.php. The manipulation of the argument email leads to sql injection. The exploit has been disclosed to the public and may be used. The identifier of this vulnerability is VDB-240884.,2024-06-05T21:15:14.203,https://cve.circl.lu/cve/CVE-2023-5271
