CVE,"Impact Score (1-10, 10 being the worst)",Keyword,Description,Last Modified,Link
CVE-2024-36889,NA,QEMU,"In the Linux kernel, the following vulnerability has been resolved:mptcp: ensure snd_nxt is properly initialized on connectChristoph reported a splat hinting at a corrupted snd_una:  WARNING: CPU: 1 PID: 38 at net/mptcp/protocol.c:1005 __mptcp_clean_una+0x4b3/0x620 net/mptcp/protocol.c:1005  Modules linked in:  CPU: 1 PID: 38 Comm: kworker/1:1 Not tainted 6.9.0-rc1-gbbeac67456c9 #59  Hardware name: QEMU Standard PC (i440FX + PIIX, 1996), BIOS 1.11.0-2.el7 04/01/2014  Workqueue: events mptcp_worker  RIP: 0010:__mptcp_clean_una+0x4b3/0x620 net/mptcp/protocol.c:1005  Code: be 06 01 00 00 bf 06 01 00 00 e8 a8 12 e7 fe e9 00 fe ff ff e8  	8e 1a e7 fe 0f b7 ab 3e 02 00 00 e9 d3 fd ff ff e8 7d 1a e7 fe  	<0f> 0b 4c 8b bb e0 05 00 00 e9 74 fc ff ff e8 6a 1a e7 fe 0f 0b e9  RSP: 0018:ffffc9000013fd48 EFLAGS: 00010293  RAX: 0000000000000000 RBX: ffff8881029bd280 RCX: ffffffff82382fe4  RDX: ffff8881003cbd00 RSI: ffffffff823833c3 RDI: 0000000000000001  RBP: 0000000000000000 R08: 0000000000000001 R09: 0000000000000000  R10: 0000000000000000 R11: fefefefefefefeff R12: ffff888138ba8000  R13: 0000000000000106 R14: ffff8881029bd908 R15: ffff888126560000  FS:  0000000000000000(0000) GS:ffff88813bd00000(0000) knlGS:0000000000000000  CS:  0010 DS: 0000 ES: 0000 CR0: 0000000080050033  CR2: 00007f604a5dae38 CR3: 0000000101dac002 CR4: 0000000000170ef0  Call Trace:   <TASK>   __mptcp_clean_una_wakeup net/mptcp/protocol.c:1055 [inline]   mptcp_clean_una_wakeup net/mptcp/protocol.c:1062 [inline]   __mptcp_retrans+0x7f/0x7e0 net/mptcp/protocol.c:2615   mptcp_worker+0x434/0x740 net/mptcp/protocol.c:2767   process_one_work+0x1e0/0x560 kernel/workqueue.c:3254   process_scheduled_works kernel/workqueue.c:3335 [inline]   worker_thread+0x3c7/0x640 kernel/workqueue.c:3416   kthread+0x121/0x170 kernel/kthread.c:388   ret_from_fork+0x44/0x50 arch/x86/kernel/process.c:147   ret_from_fork_asm+0x1a/0x30 arch/x86/entry/entry_64.S:243   </TASK>When fallback to TCP happens early on a client socket, snd_nxtis not yet initialized and any incoming ack will copy such valueinto snd_una. If the mptcp worker (dumbly) tries mptcp-levelre-injection after such ack, that would unconditionally trigger a sendbuffer cleanup using 'bad' snd_una values.We could easily disable re-injection for fallback sockets, but suchdumb behavior already helped catching a few subtle issues and a verylow to zero impact in practice.Instead address the issue always initializing snd_nxt (and write_seq,for consistency) at connect time.",2024-05-30T18:18:58.870,https://cve.circl.lu/cve/CVE-2024-36889
CVE-2024-36927,NA,QEMU,"In the Linux kernel, the following vulnerability has been resolved:ipv4: Fix uninit-value access in __ip_make_skb()KMSAN reported uninit-value access in __ip_make_skb() [1].  __ip_make_skb()tests HDRINCL to know if the skb has icmphdr. However, HDRINCL can cause arace condition. If calling setsockopt(2) with IP_HDRINCL changes HDRINCLwhile __ip_make_skb() is running, the function will access icmphdr in theskb even if it is not included. This causes the issue reported by KMSAN.Check FLOWI_FLAG_KNOWN_NH on fl4->flowi4_flags instead of testing HDRINCLon the socket.Also, fl4->fl4_icmp_type and fl4->fl4_icmp_code are not initialized. Theseare union in struct flowi4 and are implicitly initialized byflowi4_init_output(), but we should not rely on specific union layout.Initialize these explicitly in raw_sendmsg().[1]BUG: KMSAN: uninit-value in __ip_make_skb+0x2b74/0x2d20 net/ipv4/ip_output.c:1481 __ip_make_skb+0x2b74/0x2d20 net/ipv4/ip_output.c:1481 ip_finish_skb include/net/ip.h:243 [inline] ip_push_pending_frames+0x4c/0x5c0 net/ipv4/ip_output.c:1508 raw_sendmsg+0x2381/0x2690 net/ipv4/raw.c:654 inet_sendmsg+0x27b/0x2a0 net/ipv4/af_inet.c:851 sock_sendmsg_nosec net/socket.c:730 [inline] __sock_sendmsg+0x274/0x3c0 net/socket.c:745 __sys_sendto+0x62c/0x7b0 net/socket.c:2191 __do_sys_sendto net/socket.c:2203 [inline] __se_sys_sendto net/socket.c:2199 [inline] __x64_sys_sendto+0x130/0x200 net/socket.c:2199 do_syscall_64+0xd8/0x1f0 arch/x86/entry/common.c:83 entry_SYSCALL_64_after_hwframe+0x6d/0x75Uninit was created at: slab_post_alloc_hook mm/slub.c:3804 [inline] slab_alloc_node mm/slub.c:3845 [inline] kmem_cache_alloc_node+0x5f6/0xc50 mm/slub.c:3888 kmalloc_reserve+0x13c/0x4a0 net/core/skbuff.c:577 __alloc_skb+0x35a/0x7c0 net/core/skbuff.c:668 alloc_skb include/linux/skbuff.h:1318 [inline] __ip_append_data+0x49ab/0x68c0 net/ipv4/ip_output.c:1128 ip_append_data+0x1e7/0x260 net/ipv4/ip_output.c:1365 raw_sendmsg+0x22b1/0x2690 net/ipv4/raw.c:648 inet_sendmsg+0x27b/0x2a0 net/ipv4/af_inet.c:851 sock_sendmsg_nosec net/socket.c:730 [inline] __sock_sendmsg+0x274/0x3c0 net/socket.c:745 __sys_sendto+0x62c/0x7b0 net/socket.c:2191 __do_sys_sendto net/socket.c:2203 [inline] __se_sys_sendto net/socket.c:2199 [inline] __x64_sys_sendto+0x130/0x200 net/socket.c:2199 do_syscall_64+0xd8/0x1f0 arch/x86/entry/common.c:83 entry_SYSCALL_64_after_hwframe+0x6d/0x75CPU: 1 PID: 15709 Comm: syz-executor.7 Not tainted 6.8.0-11567-gb3603fcb79b1 #25Hardware name: QEMU Standard PC (i440FX + PIIX, 1996), BIOS 1.16.3-1.fc39 04/01/2014",2024-05-30T18:18:58.870,https://cve.circl.lu/cve/CVE-2024-36927
CVE-2024-36939,NA,QEMU,"In the Linux kernel, the following vulnerability has been resolved:nfs: Handle error of rpc_proc_register() in nfs_net_init().syzkaller reported a warning [0] triggered while destroying immaturenetns.rpc_proc_register() was called in init_nfs_fs(), but its errorhas been ignored since at least the initial commit 1da177e4c3f4(""Linux-2.6.12-rc2"").Recently, commit d47151b79e32 (""nfs: expose /proc/net/sunrpc/nfsin net namespaces"") converted the procfs to per-netns and madethe problem more visible.Even when rpc_proc_register() fails, nfs_net_init() could succeed,and thus nfs_net_exit() will be called while destroying the netns.Then, remove_proc_entry() will be called for non-existing procdirectory and trigger the warning below.Let's handle the error of rpc_proc_register() properly in nfs_net_init().[0]:name 'nfs'WARNING: CPU: 1 PID: 1710 at fs/proc/generic.c:711 remove_proc_entry+0x1bb/0x2d0 fs/proc/generic.c:711Modules linked in:CPU: 1 PID: 1710 Comm: syz-executor.2 Not tainted 6.8.0-12822-gcd51db110a7e #12Hardware name: QEMU Standard PC (i440FX + PIIX, 1996), BIOS rel-1.16.0-0-gd239552ce722-prebuilt.qemu.org 04/01/2014RIP: 0010:remove_proc_entry+0x1bb/0x2d0 fs/proc/generic.c:711Code: 41 5d 41 5e c3 e8 85 09 b5 ff 48 c7 c7 88 58 64 86 e8 09 0e 71 02 e8 74 09 b5 ff 4c 89 e6 48 c7 c7 de 1b 80 84 e8 c5 ad 97 ff <0f> 0b eb b1 e8 5c 09 b5 ff 48 c7 c7 88 58 64 86 e8 e0 0d 71 02 ebRSP: 0018:ffffc9000c6d7ce0 EFLAGS: 00010286RAX: 0000000000000000 RBX: ffff8880422b8b00 RCX: ffffffff8110503cRDX: ffff888030652f00 RSI: ffffffff81105045 RDI: 0000000000000001RBP: 0000000000000000 R08: 0000000000000001 R09: 0000000000000000R10: 0000000000000001 R11: ffffffff81bb62cb R12: ffffffff84807ffcR13: ffff88804ad6fcc0 R14: ffffffff84807ffc R15: ffffffff85741ff8FS:  00007f30cfba8640(0000) GS:ffff88807dd00000(0000) knlGS:0000000000000000CS:  0010 DS: 0000 ES: 0000 CR0: 0000000080050033CR2: 00007ff51afe8000 CR3: 000000005a60a005 CR4: 0000000000770ef0DR0: 0000000000000000 DR1: 0000000000000000 DR2: 0000000000000000DR3: 0000000000000000 DR6: 00000000fffe0ff0 DR7: 0000000000000400PKRU: 55555554Call Trace: <TASK> rpc_proc_unregister+0x64/0x70 net/sunrpc/stats.c:310 nfs_net_exit+0x1c/0x30 fs/nfs/inode.c:2438 ops_exit_list+0x62/0xb0 net/core/net_namespace.c:170 setup_net+0x46c/0x660 net/core/net_namespace.c:372 copy_net_ns+0x244/0x590 net/core/net_namespace.c:505 create_new_namespaces+0x2ed/0x770 kernel/nsproxy.c:110 unshare_nsproxy_namespaces+0xae/0x160 kernel/nsproxy.c:228 ksys_unshare+0x342/0x760 kernel/fork.c:3322 __do_sys_unshare kernel/fork.c:3393 [inline] __se_sys_unshare kernel/fork.c:3391 [inline] __x64_sys_unshare+0x1f/0x30 kernel/fork.c:3391 do_syscall_x64 arch/x86/entry/common.c:52 [inline] do_syscall_64+0x4f/0x110 arch/x86/entry/common.c:83 entry_SYSCALL_64_after_hwframe+0x46/0x4eRIP: 0033:0x7f30d0febe5dCode: ff c3 66 2e 0f 1f 84 00 00 00 00 00 90 f3 0f 1e fa 48 89 f8 48 89 f7 48 89 d6 48 89 ca 4d 89 c2 4d 89 c8 4c 8b 4c 24 08 0f 05 <48> 3d 01 f0 ff ff 73 01 c3 48 8b 0d 73 9f 1b 00 f7 d8 64 89 01 48RSP: 002b:00007f30cfba7cc8 EFLAGS: 00000246 ORIG_RAX: 0000000000000110RAX: ffffffffffffffda RBX: 00000000004bbf80 RCX: 00007f30d0febe5dRDX: 0000000000000000 RSI: 0000000000000000 RDI: 000000006c020600RBP: 00000000004bbf80 R08: 0000000000000000 R09: 0000000000000000R10: 0000000000000000 R11: 0000000000000246 R12: 0000000000000002R13: 000000000000000b R14: 00007f30d104c530 R15: 0000000000000000 </TASK>",2024-05-30T18:18:58.870,https://cve.circl.lu/cve/CVE-2024-36939
CVE-2024-4436,3.6,Red Hat,"The etcd package distributed with the Red Hat OpenStack platform has an incomplete fix for CVE-2022-41723. This issue occurs because the etcd package in the Red Hat OpenStack platform is using http://golang.org/x/net/http2 instead of the one provided by Red Hat Enterprise Linux versions, meaning it should be updated at compile time instead.",2024-05-30T02:15:47.300,https://cve.circl.lu/cve/CVE-2024-4436
CVE-2024-4437,3.6,Red Hat,"The etcd package distributed with the Red Hat OpenStack platform has an incomplete fix for CVE-2021-44716. This issue occurs because the etcd package in the Red Hat OpenStack platform is using http://golang.org/x/net/http2 instead of the one provided by Red Hat Enterprise Linux versions, meaning it should be updated at compile time instead.",2024-05-30T02:15:47.433,https://cve.circl.lu/cve/CVE-2024-4437
CVE-2024-4438,3.6,Red Hat,"The etcd package distributed with the Red Hat OpenStack platform has an incomplete fix for CVE-2023-39325/CVE-2023-44487, known as Rapid Reset. This issue occurs because the etcd package in the Red Hat OpenStack platform is using http://golang.org/x/net/http2 instead of the one provided by Red Hat Enterprise Linux versions, meaning it should be updated at compile time instead.",2024-05-30T02:15:47.537,https://cve.circl.lu/cve/CVE-2024-4438
CVE-2022-47558,5.9,Rootkit,"Devices ekorCCP and ekorRCI are vulnerable due to access to the FTP service using default credentials. Exploitation of this vulnerability can allow an attacker to modify critical files that could allow the creation of new users, delete or modify existing users, modify configuration files, install rootkits or backdoors.",2024-06-04T19:17:19.917,https://cve.circl.lu/cve/CVE-2022-47558
CVE-2024-3804,3.4,Remote Desktop,"A vulnerability, which was classified as critical, has been found in Vesystem Cloud Desktop up to 20240408. This issue affects some unknown processing of the file /Public/webuploader/0.1.5/server/fileupload2.php. The manipulation of the argument file leads to unrestricted upload. The attack may be initiated remotely. The exploit has been disclosed to the public and may be used. The identifier VDB-260777 was assigned to this vulnerability. NOTE: The vendor was contacted early about this disclosure but did not respond in any way.",2024-06-04T19:20:24.583,https://cve.circl.lu/cve/CVE-2024-3804
CVE-2024-4330,1.4,Repository,"A path traversal vulnerability was identified in the parisneo/lollms-webui repository, specifically within version 9.6. The vulnerability arises due to improper handling of user-supplied input in the 'list_personalities' endpoint. By crafting a malicious HTTP request, an attacker can traverse the directory structure and view the contents of any folder, albeit limited to subfolder names only. This issue was demonstrated via a specific HTTP request that manipulated the 'category' parameter to access arbitrary directories. The vulnerability is present in the code located at the 'endpoints/lollms_advanced.py' file.",2024-05-30T18:19:11.743,https://cve.circl.lu/cve/CVE-2024-4330
CVE-2024-36127,3.6,Repository,apko is an apk-based OCI image builder. apko exposures HTTP basic auth credentials from repository and keyring URLs in log output. This vulnerability is fixed in v0.14.5.,2024-06-03T19:23:17.807,https://cve.circl.lu/cve/CVE-2024-36127
CVE-2017-7961,5.9,Repo,"The cr_tknzr_parse_rgb function in cr-tknzr.c in libcroco 0.6.11 and 0.6.12 has an ""outside the range of representable values of type long"" undefined behavior issue, which might allow remote attackers to cause a denial of service (application crash) or possibly have unspecified other impact via a crafted CSS file. NOTE: third-party analysis reports ""This is not a security issue in my view. The conversion surely is truncating the double into a long value, but there is no impact as the value is one of the RGB components.",2024-06-04T19:16:55.123,https://cve.circl.lu/cve/CVE-2017-7961
CVE-2017-9855,5.9,Repo,"An issue was discovered in SMA Solar Technology products. A secondary authentication system is available for Installers called the Grid Guard system. This system uses predictable codes, and a single Grid Guard code can be used on any SMA inverter. Any such code, when combined with the installer account, allows changing very sensitive parameters. NOTE: the vendor reports that Grid Guard is not an authentication feature; it is only a tracing feature. Also, only Sunny Boy TLST-21 and TL-21 and Sunny Tripower TL-10 and TL-30 could potentially be affected",2024-06-04T19:16:55.507,https://cve.circl.lu/cve/CVE-2017-9855
CVE-2017-9856,5.9,Repo,"An issue was discovered in SMA Solar Technology products. Sniffed passwords from SMAdata2+ communication can be decrypted very easily. The passwords are ""encrypted"" using a very simple encryption algorithm. This enables an attacker to find the plaintext passwords and authenticate to the device. NOTE: the vendor reports that only Sunny Boy TLST-21 and TL-21 and Sunny Tripower TL-10 and TL-30 could potentially be affected",2024-06-04T19:16:55.747,https://cve.circl.lu/cve/CVE-2017-9856
CVE-2017-11191,5.9,Repo,FreeIPA 4.x with API version 2.213 allows a remote authenticated users to bypass intended account-locking restrictions via an unlock action with an old session ID (for the same user account) that had been created for an earlier session. NOTE: Vendor states that issue does not exist in product and does not recognize this report as a valid security concern,2024-06-04T20:15:09.637,https://cve.circl.lu/cve/CVE-2017-11191
CVE-2017-17973,5.9,Repo,"In LibTIFF 4.0.8, there is a heap-based use-after-free in the t2p_writeproc function in tiff2pdf.c. NOTE: there is a third-party report of inability to reproduce this issue",2024-06-04T19:16:54.477,https://cve.circl.lu/cve/CVE-2017-17973
CVE-2010-5096,6.4,SQL,"Multiple SQL injection vulnerabilities in MyBB (aka MyBulletinBoard) before 1.6.1 allow remote attackers to execute arbitrary SQL commands via the keywords parameter in a (1) do_search action to search.php or (2) do_stuff action to private.php.  NOTE: the vendor disputes this issue, saying ""Although this doesn't lead to an SQL injection, it does provide a general MyBB SQL error.",2024-06-04T19:16:52.920,https://cve.circl.lu/cve/CVE-2010-5096
CVE-2017-17919,5.9,SQL,SQL injection vulnerability in the 'order' method in Ruby on Rails 5.1.4 and earlier allows remote attackers to execute arbitrary SQL commands via the 'id desc' parameter. NOTE: The vendor disputes this issue because the documentation states that this method is not intended for use with untrusted input,2024-06-04T19:16:54.370,https://cve.circl.lu/cve/CVE-2017-17919
CVE-2022-40824,5.9,SQL,B.C. Institute of Technology CodeIgniter <=3.1.13 is vulnerable to SQL Injection via system\database\DB_query_builder.php or_where() function. Note: Multiple third parties have disputed this as not a valid vulnerability.,2024-06-05T20:15:10.583,https://cve.circl.lu/cve/CVE-2022-40824
CVE-2022-40826,5.9,SQL,B.C. Institute of Technology CodeIgniter <=3.1.13 is vulnerable to SQL Injection via system\database\DB_query_builder.php or_having() function. Note: Multiple third parties have disputed this as not a valid vulnerability.,2024-06-05T20:15:10.707,https://cve.circl.lu/cve/CVE-2022-40826
CVE-2022-40833,5.9,SQL,B.C. Institute of Technology CodeIgniter <=3.1.13 is vulnerable to SQL Injection via system\database\DB_query_builder.php or_where_in() function. Note: Multiple third parties have disputed this as not a valid vulnerability.,2024-06-04T19:17:17.973,https://cve.circl.lu/cve/CVE-2022-40833
CVE-2023-23130,3.6,SSL,"Connectwise Automate 2022.11 is vulnerable to Cleartext authentication. Authentication is being done via HTTP (cleartext) with SSL disabled. OTE: the vendor's position is that, by design, this is controlled by a configuration option in which a customer can choose to use HTTP (rather than HTTPS) during troubleshooting.",2024-06-04T19:17:22.790,https://cve.circl.lu/cve/CVE-2023-23130
CVE-2024-35196,1.4,Slack,"Sentry is a developer-first error tracking and performance monitoring platform. Sentry's Slack integration incorrectly records the incoming request body in logs. This request data can contain sensitive information, including the deprecated Slack verification token. With this verification token, it is possible under specific configurations, an attacker can forge requests and act as the Slack integration. The request body is leaked in log entries matching `event == ""slack.*"" && name == ""sentry.integrations.slack"" && request_data == *`. The deprecated slack verification token, will be found in the `request_data.token` key. **SaaS users** do not need to take any action. **Self-hosted users** should upgrade to version 24.5.0 or higher, rotate their Slack verification token, and use the Slack Signing Secret instead of the verification token. For users only using the `slack.signing-secret` in their self-hosted configuration, the legacy verification token is not used to verify the webhook payload. It is ignored. Users unable to upgrade should either set the `slack.signing-secret` instead of `slack.verification-token`. The signing secret is Slack's recommended way of authenticating webhooks. By having `slack.singing-secret` set, Sentry self-hosted will no longer use the verification token for authentication of the webhooks, regardless of whether `slack.verification-token` is set or not. Alternatively if the self-hosted instance is unable to be upgraded or re-configured to use the `slack.signing-secret`, the logging configuration can be adjusted to not generate logs from the integration. The default logging configuration can be found in `src/sentry/conf/server.py`. **Services should be restarted once the configuration change is saved.**",2024-05-31T19:14:47.793,https://cve.circl.lu/cve/CVE-2024-35196
CVE-2024-28996,5.9,Solarwinds,The SolarWinds Platform was determined to be affected by a SWQL Injection Vulnerability. Attack complexity is high for this vulnerability.  ,2024-06-04T16:57:41.053,https://cve.circl.lu/cve/CVE-2024-28996
CVE-2024-28999,4.7,Solarwinds,The SolarWinds Platform was determined to be affected by a Race Condition Vulnerability affecting the web console. ,2024-06-04T16:57:41.053,https://cve.circl.lu/cve/CVE-2024-28999
CVE-2024-29004,5.3,Solarwinds,The SolarWinds Platform was determined to be affected by a stored cross-site scripting vulnerability affecting the web console. A high-privileged user and user interaction is required to exploit this vulnerability.  ,2024-06-04T16:57:41.053,https://cve.circl.lu/cve/CVE-2024-29004
CVE-2017-9857,5.9,TLS,"An issue was discovered in SMA Solar Technology products. The SMAdata2+ communication protocol does not properly use authentication with encryption: it is vulnerable to man in the middle, packet injection, and replay attacks. Any setting change, authentication packet, scouting packet, etc. can be replayed, injected, or used for a man in the middle session. All functionalities available in Sunny Explorer can effectively be done from anywhere within the network as long as an attacker gets the packet setup correctly. This includes the authentication process for all (including hidden) access levels and the changing of settings in accordance with the gained access rights. Furthermore, because the SMAdata2+ communication channel is unencrypted, an attacker capable of understanding the protocol can eavesdrop on communications. NOTE: the vendor's position is that authentication with encryption is not required on an isolated subnetwork. Also, only Sunny Boy TLST-21 and TL-21 and Sunny Tripower TL-10 and TL-30 could potentially be affected",2024-06-04T19:16:55.880,https://cve.circl.lu/cve/CVE-2017-9857
CVE-2024-2700,5.9,TLS,"A vulnerability was found in the quarkus-core component. Quarkus captures local environment variables from the Quarkus namespace during the application's build, therefore, running the resulting application inherits the values captured at build time. Some local environment variables may have been set by the developer or CI environment for testing purposes, such as dropping the database during application startup or trusting all TLS certificates to accept self-signed certificates. If these properties are configured using environment variables or the .env facility, they are captured into the built application, which can lead to dangerous behavior if the application does not override these values. This behavior only happens for configuration properties from the `quarkus.*` namespace. Application-specific properties are not captured.",2024-05-31T01:15:54.150,https://cve.circl.lu/cve/CVE-2024-2700
CVE-2024-2895,5.9,Tenda,A vulnerability was found in Tenda AC7 15.03.06.44. It has been declared as critical. This vulnerability affects the function formWifiWpsOOB of the file /goform/WifiWpsOOB. The manipulation of the argument index leads to stack-based buffer overflow. The attack can be initiated remotely. The exploit has been disclosed to the public and may be used. VDB-257938 is the identifier assigned to this vulnerability. NOTE: The vendor was contacted early about this disclosure but did not respond in any way.,2024-06-05T20:15:13.023,https://cve.circl.lu/cve/CVE-2024-2895
CVE-2024-2897,3.4,Tenda,A vulnerability classified as critical has been found in Tenda AC7 15.03.06.44. Affected is the function formWriteFacMac of the file /goform/WriteFacMac. The manipulation of the argument mac leads to os command injection. It is possible to launch the attack remotely. The exploit has been disclosed to the public and may be used. The identifier of this vulnerability is VDB-257940. NOTE: The vendor was contacted early about this disclosure but did not respond in any way.,2024-06-04T19:19:19.267,https://cve.circl.lu/cve/CVE-2024-2897
CVE-2024-2992,5.9,Tenda,A vulnerability was found in Tenda FH1203 2.0.1.6 and classified as critical. This issue affects the function formSetCfm of the file /goform/setcfm. The manipulation of the argument funcpara1 leads to stack-based buffer overflow. The attack may be initiated remotely. The exploit has been disclosed to the public and may be used. The identifier VDB-258161 was assigned to this vulnerability. NOTE: The vendor was contacted early about this disclosure but did not respond in any way.,2024-06-04T19:19:19.957,https://cve.circl.lu/cve/CVE-2024-2992
CVE-2024-3874,5.9,Tenda,A vulnerability was found in Tenda W20E 15.11.0.6. It has been declared as critical. This vulnerability affects the function formSetRemoteWebManage of the file /goform/SetRemoteWebManage. The manipulation of the argument remoteIP leads to stack-based buffer overflow. The attack can be initiated remotely. The exploit has been disclosed to the public and may be used. The identifier of this vulnerability is VDB-260908. NOTE: The vendor was contacted early about this disclosure but did not respond in any way.,2024-06-04T19:20:25.697,https://cve.circl.lu/cve/CVE-2024-3874
CVE-2024-3875,5.9,Tenda,A vulnerability was found in Tenda F1202 1.2.0.20(408). It has been rated as critical. This issue affects the function fromNatlimit of the file /goform/Natlimit. The manipulation of the argument page leads to stack-based buffer overflow. The attack may be initiated remotely. The exploit has been disclosed to the public and may be used. The identifier VDB-260909 was assigned to this vulnerability. NOTE: The vendor was contacted early about this disclosure but did not respond in any way.,2024-06-04T19:20:25.807,https://cve.circl.lu/cve/CVE-2024-3875
CVE-2024-37057,5.9,TensorFlow,"Deserialization of untrusted data can occur in versions of the MLflow platform running version 2.0.0rc0 or newer, enabling a maliciously uploaded Tensorflow model to run arbitrary code on an end user’s system when interacted with.",2024-06-04T16:57:41.053,https://cve.circl.lu/cve/CVE-2024-37057
