CVE,"Impact Score (1-10, 10 being the worst)",Keyword,Description,Last Modified,Link
CVE-2024-4254,4.2,AWS,"The 'deploy-website.yml' workflow in the gradio-app/gradio repository, specifically in the 'main' branch, is vulnerable to secrets exfiltration due to improper authorization. The vulnerability arises from the workflow's explicit checkout and execution of code from a fork, which is unsafe as it allows the running of untrusted code in an environment with access to push to the base repository and access secrets. This flaw could lead to the exfiltration of sensitive secrets such as GITHUB_TOKEN, HF_TOKEN, VERCEL_ORG_ID, VERCEL_PROJECT_ID, COMMENT_TOKEN, AWSACCESSKEYID, AWSSECRETKEY, and VERCEL_TOKEN. The vulnerability is present in the workflow file located at https://github.com/gradio-app/gradio/blob/72f4ca88ab569aae47941b3fb0609e57f2e13a27/.github/workflows/deploy-website.yml.",2024-06-04T16:57:41.053,https://cve.circl.lu/cve/CVE-2024-4254
CVE-2024-4084,4.0,AWS,"A Server-Side Request Forgery (SSRF) vulnerability exists in the latest version of mintplex-labs/anything-llm, allowing attackers to bypass the official fix intended to restrict access to intranet IP addresses and protocols. Despite efforts to filter out intranet IP addresses starting with 192, 172, 10, and 127 through regular expressions and limit access protocols to HTTP and HTTPS, attackers can still bypass these restrictions using alternative representations of IP addresses and accessing other ports running on localhost. This vulnerability enables attackers to access any asset on the internal network, attack web services on the internal network, scan hosts on the internal network, and potentially access AWS metadata endpoints. The vulnerability is due to insufficient validation of user-supplied URLs, which can be exploited to perform SSRF attacks.",2024-06-05T12:53:50.240,https://cve.circl.lu/cve/CVE-2024-4084
CVE-2011-0737,2.9,Adobe,"Adobe ColdFusion 9.0.1 CHF1 and earlier allows remote attackers to obtain sensitive information via an id=- query to a .cfm file, which reveals the installation path in an error message.  NOTE: the vendor disputes the significance of this issue because the Site-wide Error Handler and Debug Output Settings sections of the ColdFusion Lockdown guide explain the requirement for settings that prevent this information disclosure",2024-06-04T19:16:53.317,https://cve.circl.lu/cve/CVE-2011-0737
CVE-2022-45378,5.9,Apache,"In the default configuration of Apache SOAP, an RPCRouterServlet is available without authentication. This gives an attacker the possibility to invoke methods on the classpath that meet certain criteria. Depending on what classes are available on the classpath this might even lead to arbitrary remote code execution. NOTE: This vulnerability only affects products that are no longer supported by the maintainer.",2024-06-04T19:17:18.987,https://cve.circl.lu/cve/CVE-2022-45378
CVE-2022-46366,5.9,Apache,"Apache Tapestry 3.x allows deserialization of untrusted data, leading to remote code execution. This issue is similar to but distinct from CVE-2020-17531, which applies the the (also unsupported) 4.x version line. NOTE: This vulnerability only affects Apache Tapestry version line 3.x, which is no longer supported by the maintainer. Users are recommended to upgrade to a supported version line of Apache Tapestry.",2024-06-04T19:17:19.320,https://cve.circl.lu/cve/CVE-2022-46366
CVE-2023-34150,1.4,Apache,** UNSUPPORTED WHEN ASSIGNED ** Use of TikaEncodingDetector in Apache Any23 can cause excessive memory usage.,2024-06-04T19:17:29.713,https://cve.circl.lu/cve/CVE-2023-34150
CVE-2024-36104,NA,Apache,"Improper Limitation of a Pathname to a Restricted Directory ('Path Traversal') vulnerability in Apache OFBiz. This issue affects Apache OFBiz: before 18.12.14.Users are recommended to upgrade to version 18.12.14, which fixes the issue.",2024-06-04T16:57:41.053,https://cve.circl.lu/cve/CVE-2024-36104
CVE-2024-5194,3.4,Arris,A vulnerability was found in Arris VAP2500 08.50. It has been declared as critical. Affected by this vulnerability is an unknown functionality of the file /assoc_table.php. The manipulation of the argument id leads to command injection. The attack can be launched remotely. The exploit has been disclosed to the public and may be used. The associated identifier of this vulnerability is VDB-265831.,2024-06-04T19:21:01.977,https://cve.circl.lu/cve/CVE-2024-5194
CVE-2024-5195,3.4,Arris,A vulnerability was found in Arris VAP2500 08.50. It has been rated as critical. Affected by this issue is some unknown functionality of the file /diag_s.php. The manipulation of the argument customer_info leads to command injection. The attack may be launched remotely. The exploit has been disclosed to the public and may be used. The identifier of this vulnerability is VDB-265832.,2024-06-04T19:21:02.077,https://cve.circl.lu/cve/CVE-2024-5195
CVE-2024-5196,3.4,Arris,A vulnerability classified as critical has been found in Arris VAP2500 08.50. This affects an unknown part of the file /tools_command.php. The manipulation of the argument cmb_header/txt_command leads to command injection. It is possible to initiate the attack remotely. The exploit has been disclosed to the public and may be used. The identifier VDB-265833 was assigned to this vulnerability.,2024-06-04T19:21:02.183,https://cve.circl.lu/cve/CVE-2024-5196
CVE-2024-21683,5.9,Atlassian,"This High severity RCE (Remote Code Execution) vulnerability was introduced in version 5.2 of Confluence Data Center and Server.This RCE (Remote Code Execution) vulnerability, with a CVSS Score of 8.3, allows an authenticated attacker to execute arbitrary code which has high impact to confidentiality, high impact to integrity, high impact to availability, and requires no user interaction. Atlassian recommends that Confluence Data Center and Server customers upgrade to latest version. If you are unable to do so, upgrade your instance to one of the specified supported fixed versions. See the release notes https://confluence.atlassian.com/doc/confluence-release-notes-327.htmlYou can download the latest version of Confluence Data Center and Server from the download center https://www.atlassian.com/software/confluence/download-archives.This vulnerability was found internally.",2024-06-04T14:30:30.870,https://cve.circl.lu/cve/CVE-2024-21683
CVE-2024-36887,NA,Atom,"In the Linux kernel, the following vulnerability has been resolved:e1000e: change usleep_range to udelay in PHY mdic accessThis is a partial revert of commit 6dbdd4de0362 (""e1000e: Workaroundfor sporadic MDI error on Meteor Lake systems""). The referenced commitused usleep_range inside the PHY access routines, which are sometimescalled from an atomic context. This can lead to a kernel panic in somescenarios, such as cable disconnection and reconnection on vPro systems.Solve this by changing the usleep_range calls back to udelay.",2024-05-30T18:18:58.870,https://cve.circl.lu/cve/CVE-2024-36887
CVE-2024-36897,NA,Atom,"In the Linux kernel, the following vulnerability has been resolved:drm/amd/display: Atom Integrated System Info v2_2 for DCN35New request from KMD/VBIOS in order to support new UMA carveoutmodel. This fixes a null dereference from accessingCtx->dc_bios->integrated_info while it was NULL.DAL parses through the BIOS and extracts the necessaryintegrated_info but was missing a case for the new BIOSversion 2.3.",2024-05-30T18:18:58.870,https://cve.circl.lu/cve/CVE-2024-36897
CVE-2024-36904,NA,Atom,"In the Linux kernel, the following vulnerability has been resolved:tcp: Use refcount_inc_not_zero() in tcp_twsk_unique().Anderson Nascimento reported a use-after-free splat in tcp_twsk_unique()with nice analysis.Since commit ec94c2696f0b (""tcp/dccp: avoid one atomic operation fortimewait hashdance""), inet_twsk_hashdance() sets TIME-WAIT socket'ssk_refcnt after putting it into ehash and releasing the bucket lock.Thus, there is a small race window where other threads could try toreuse the port during connect() and call sock_hold() in tcp_twsk_unique()for the TIME-WAIT socket with zero refcnt.If that happens, the refcnt taken by tcp_twsk_unique() is overwrittenand sock_put() will cause underflow, triggering a real use-after-freesomewhere else.To avoid the use-after-free, we need to use refcount_inc_not_zero() intcp_twsk_unique() and give up on reusing the port if it returns false.[0]:refcount_t: addition on 0; use-after-free.WARNING: CPU: 0 PID: 1039313 at lib/refcount.c:25 refcount_warn_saturate+0xe5/0x110CPU: 0 PID: 1039313 Comm: trigger Not tainted 6.8.6-200.fc39.x86_64 #1Hardware name: VMware, Inc. VMware20,1/440BX Desktop Reference Platform, BIOS VMW201.00V.21805430.B64.2305221830 05/22/2023RIP: 0010:refcount_warn_saturate+0xe5/0x110Code: 42 8e ff 0f 0b c3 cc cc cc cc 80 3d aa 13 ea 01 00 0f 85 5e ff ff ff 48 c7 c7 f8 8e b7 82 c6 05 96 13 ea 01 01 e8 7b 42 8e ff <0f> 0b c3 cc cc cc cc 48 c7 c7 50 8f b7 82 c6 05 7a 13 ea 01 01 e8RSP: 0018:ffffc90006b43b60 EFLAGS: 00010282RAX: 0000000000000000 RBX: ffff888009bb3ef0 RCX: 0000000000000027RDX: ffff88807be218c8 RSI: 0000000000000001 RDI: ffff88807be218c0RBP: 0000000000069d70 R08: 0000000000000000 R09: ffffc90006b439f0R10: ffffc90006b439e8 R11: 0000000000000003 R12: ffff8880029ede84R13: 0000000000004e20 R14: ffffffff84356dc0 R15: ffff888009bb3ef0FS:  00007f62c10926c0(0000) GS:ffff88807be00000(0000) knlGS:0000000000000000CS:  0010 DS: 0000 ES: 0000 CR0: 0000000080050033CR2: 0000000020ccb000 CR3: 000000004628c005 CR4: 0000000000f70ef0PKRU: 55555554Call Trace: <TASK> ? refcount_warn_saturate+0xe5/0x110 ? __warn+0x81/0x130 ? refcount_warn_saturate+0xe5/0x110 ? report_bug+0x171/0x1a0 ? refcount_warn_saturate+0xe5/0x110 ? handle_bug+0x3c/0x80 ? exc_invalid_op+0x17/0x70 ? asm_exc_invalid_op+0x1a/0x20 ? refcount_warn_saturate+0xe5/0x110 tcp_twsk_unique+0x186/0x190 __inet_check_established+0x176/0x2d0 __inet_hash_connect+0x74/0x7d0 ? __pfx___inet_check_established+0x10/0x10 tcp_v4_connect+0x278/0x530 __inet_stream_connect+0x10f/0x3d0 inet_stream_connect+0x3a/0x60 __sys_connect+0xa8/0xd0 __x64_sys_connect+0x18/0x20 do_syscall_64+0x83/0x170 entry_SYSCALL_64_after_hwframe+0x78/0x80RIP: 0033:0x7f62c11a885dCode: ff c3 66 2e 0f 1f 84 00 00 00 00 00 90 f3 0f 1e fa 48 89 f8 48 89 f7 48 89 d6 48 89 ca 4d 89 c2 4d 89 c8 4c 8b 4c 24 08 0f 05 <48> 3d 01 f0 ff ff 73 01 c3 48 8b 0d a3 45 0c 00 f7 d8 64 89 01 48RSP: 002b:00007f62c1091e58 EFLAGS: 00000296 ORIG_RAX: 000000000000002aRAX: ffffffffffffffda RBX: 0000000020ccb004 RCX: 00007f62c11a885dRDX: 0000000000000010 RSI: 0000000020ccb000 RDI: 0000000000000003RBP: 00007f62c1091e90 R08: 0000000000000000 R09: 0000000000000000R10: 0000000000000000 R11: 0000000000000296 R12: 00007f62c10926c0R13: ffffffffffffff88 R14: 0000000000000000 R15: 00007ffe237885b0 </TASK>",2024-05-30T18:18:58.870,https://cve.circl.lu/cve/CVE-2024-36904
CVE-2024-36937,NA,Atom,"In the Linux kernel, the following vulnerability has been resolved:xdp: use flags field to disambiguate broadcast redirectWhen redirecting a packet using XDP, the bpf_redirect_map() helper will setup the redirect destination information in struct bpf_redirect_info (usingthe __bpf_xdp_redirect_map() helper function), and the xdp_do_redirect()function will read this information after the XDP program returns and passthe frame on to the right redirect destination.When using the BPF_F_BROADCAST flag to do multicast redirect to a wholemap, __bpf_xdp_redirect_map() sets the 'map' pointer in structbpf_redirect_info to point to the destination map to be broadcast. Andxdp_do_redirect() reacts to the value of this map pointer to decide whetherit's dealing with a broadcast or a single-value redirect. However, if thedestination map is being destroyed before xdp_do_redirect() is called, themap pointer will be cleared out (by bpf_clear_redirect_map()) withoutwaiting for any XDP programs to stop running. This causes xdp_do_redirect()to think that the redirect was to a single target, but the target pointeris also NULL (since broadcast redirects don't have a single target), sothis causes a crash when a NULL pointer is passed to dev_map_enqueue().To fix this, change xdp_do_redirect() to react directly to the presence ofthe BPF_F_BROADCAST flag in the 'flags' value in struct bpf_redirect_infoto disambiguate between a single-target and a broadcast redirect. And onlyread the 'map' pointer if the broadcast flag is set, aborting if that hasbeen cleared out in the meantime. This prevents the crash, while keepingthe atomic (cmpxchg-based) clearing of the map pointer itself, and withoutadding any more checks in the non-broadcast fast path.",2024-05-30T18:18:58.870,https://cve.circl.lu/cve/CVE-2024-36937
CVE-2024-36943,NA,Atom,"In the Linux kernel, the following vulnerability has been resolved:fs/proc/task_mmu: fix loss of young/dirty bits during pagemap scanmake_uffd_wp_pte() was previously doing:  pte = ptep_get(ptep);  ptep_modify_prot_start(ptep);  pte = pte_mkuffd_wp(pte);  ptep_modify_prot_commit(ptep, pte);But if another thread accessed or dirtied the pte between the first 2calls, this could lead to loss of that information.  Sinceptep_modify_prot_start() gets and clears atomically, the following is thecorrect pattern and prevents any possible race.  Any access after thefirst call would see an invalid pte and cause a fault:  pte = ptep_modify_prot_start(ptep);  pte = pte_mkuffd_wp(pte);  ptep_modify_prot_commit(ptep, pte);",2024-05-30T18:18:58.870,https://cve.circl.lu/cve/CVE-2024-36943
CVE-2017-9230,3.6,Bitcoin,"The Bitcoin Proof-of-Work algorithm does not consider a certain attack methodology related to 80-byte block headers with a variety of initial 64-byte chunks followed by the same 16-byte chunk, multiple candidate root values ending with the same 4 bytes, and calculations involving sqrt numbers. This violates the security assumptions of (1) the choice of input, outside of the dedicated nonce area, fed into the Proof-of-Work function should not change its difficulty to evaluate and (2) every Proof-of-Work function execution should be independent. NOTE: a number of persons feel that this methodology is a benign mining optimization, not a vulnerability",2024-06-04T19:16:55.253,https://cve.circl.lu/cve/CVE-2017-9230
CVE-2024-34001,NA,CSRF,Actions in the admin preset tool did not include the necessary token to prevent a CSRF risk.,2024-06-03T14:46:24.250,https://cve.circl.lu/cve/CVE-2024-34001
CVE-2024-34007,NA,CSRF,The logout option within MFA did not include the necessary token to avoid the risk of users inadvertently being logged out via CSRF.,2024-06-03T14:46:24.250,https://cve.circl.lu/cve/CVE-2024-34007
CVE-2024-34008,NA,CSRF,Actions in the admin management of analytics models did not include the necessary token to prevent a CSRF risk.,2024-06-03T14:46:24.250,https://cve.circl.lu/cve/CVE-2024-34008
CVE-2024-4088,1.4,CSRF,"The Gutenberg Blocks and Page Layouts – Attire Blocks plugin for WordPress is vulnerable to unauthorized modification of data due to a missing capability check on the disable_fe_assets function in all versions up to, and including, 1.9.2. This makes it possible for authenticated attackers, with subscriber access or above, to change the plugin's settings. Additionally, no nonce check is performed resulting in a CSRF vulnerability.",2024-06-05T12:53:50.240,https://cve.circl.lu/cve/CVE-2024-4088
CVE-2024-20404,2.7,Cisco,"A vulnerability in the web-based management interface of Cisco Finesse could allow an unauthenticated, remote attacker to conduct an SSRF attack on an affected system. This vulnerability is due to insufficient validation of user-supplied input for specific HTTP requests that are sent to an affected system. An attacker could exploit this vulnerability by sending a crafted HTTP request to the affected device. A successful exploit could allow the attacker to obtain limited sensitive information for services that are associated to the affected device.",2024-06-05T17:15:11.790,https://cve.circl.lu/cve/CVE-2024-20404
CVE-2024-20405,2.7,Cisco,"A vulnerability in the web-based management interface of Cisco Finesse could allow an unauthenticated, remote attacker to conduct a stored XSS attack by exploiting an RFI vulnerability.  This vulnerability is due to insufficient validation of user-supplied input for specific HTTP requests that are sent to an affected device. An attacker could exploit this vulnerability by persuading a user to click a crafted link. A successful exploit could allow the attacker to execute arbitrary script code in the context of the affected interface or access sensitive information on the affected device.",2024-06-05T17:15:12.107,https://cve.circl.lu/cve/CVE-2024-20405
CVE-2024-1275,NA,Cryptograph,Use of Default Cryptographic Key vulnerability in Baxter Welch Allyn Connex Spot Monitor may allow Configuration/Environment Manipulation.This issue affects Welch Allyn Connex Spot Monitor in all versions prior to 1.52.,2024-06-05T15:15:10.990,https://cve.circl.lu/cve/CVE-2024-1275
CVE-2024-20070,NA,Cryptograph,"In modem, there is a possible information disclosure due to using risky cryptographic algorithm during connection establishment negotiation. This could lead to remote information disclosure, when weak encryption algorithm is used, with no additional execution privileges needed. User interaction is not needed for exploitation. Patch ID: MOLY00942482; Issue ID: MSV-1469.",2024-06-03T14:46:24.250,https://cve.circl.lu/cve/CVE-2024-20070
CVE-2023-43551,5.2,Cryptograph,"Cryptographic issue while performing attach with a LTE network, a rogue base station can skip the authentication phase and immediately send the Security Mode Command.",2024-06-03T14:46:24.250,https://cve.circl.lu/cve/CVE-2023-43551
CVE-2024-3690,3.4,CRM,A vulnerability classified as critical was found in PHPGurukul Small CRM 3.0. Affected by this vulnerability is an unknown functionality of the component Change Password Handler. The manipulation leads to sql injection. The attack can be launched remotely. The exploit has been disclosed to the public and may be used. The associated identifier of this vulnerability is VDB-260479.,2024-06-04T19:20:23.213,https://cve.circl.lu/cve/CVE-2024-3690
CVE-2024-35632,1.4,CRM,Cross-Site Request Forgery (CSRF) vulnerability in CRM Perks. Integration for Contact Form 7 and Constant Contact.This issue affects Integration for Contact Form 7 and Constant Contact: from n/a through 1.1.5.,2024-06-03T14:46:24.250,https://cve.circl.lu/cve/CVE-2024-35632
CVE-2024-36837,NA,CRM,SQL Injection vulnerability in CRMEB v.5.2.2 allows a remote attacker to obtain sensitive information via the getProductList function in the ProductController.php file.,2024-06-05T15:15:11.803,https://cve.circl.lu/cve/CVE-2024-36837
CVE-2021-29296,3.6,D-Link,"Null Pointer Dereference vulnerability in D-Link DIR-825 2.10b02, which could let a remote malicious user cause a denial of service. The vulnerability could be triggered by sending an HTTP request with URL /vct_wan; the sbin/httpd would invoke the strchr function and take NULL as a first argument, which finally leads to the segmentation fault. NOTE: The DIR-825 and all hardware revisions is considered End of Life and as such this issue will not be patched",2024-06-04T19:17:04.097,https://cve.circl.lu/cve/CVE-2021-29296
CVE-2023-36090,5.9,D-Link,Authentication Bypass vulnerability in D-Link DIR-885L FW102b01 allows remote attackers to gain escalated privileges via phpcgi. NOTE: This vulnerability only affects products that are no longer supported by the maintainer.,2024-06-05T21:15:11.203,https://cve.circl.lu/cve/CVE-2023-36090
CVE-2023-4711,5.9,D-Link,"A vulnerability, which was classified as critical, has been found in D-Link DAR-8000-10 up to 20230819. Affected by this issue is some unknown functionality of the file /log/decodmail.php. The manipulation of the argument file leads to os command injection. The attack may be launched remotely. The complexity of an attack is rather high. The exploitation is known to be difficult. The exploit has been disclosed to the public and may be used. VDB-238574 is the identifier assigned to this vulnerability. NOTE: The vendor was contacted early about this disclosure but did not respond in any way.",2024-06-05T21:15:13.273,https://cve.circl.lu/cve/CVE-2023-4711
CVE-2023-5144,5.9,D-Link,"** UNSUPPORTED WHEN ASSIGNED ** A vulnerability, which was classified as critical, was found in D-Link DAR-7000 and DAR-8000 up to 20151231. Affected is an unknown function of the file /sysmanage/updateos.php. The manipulation of the argument file_upload leads to unrestricted upload. It is possible to launch the attack remotely. The exploit has been disclosed to the public and may be used. The identifier of this vulnerability is VDB-240240. NOTE: This vulnerability only affects products that are no longer supported by the maintainer. NOTE: Vendor was contacted early and confirmed that the product is end-of-life. It should be retired and replaced.",2024-06-04T19:18:09.637,https://cve.circl.lu/cve/CVE-2023-5144
CVE-2023-5145,5.9,D-Link,** UNSUPPORTED WHEN ASSIGNED ** A vulnerability has been found in D-Link DAR-7000 up to 20151231 and classified as critical. Affected by this vulnerability is an unknown functionality of the file /sysmanage/licence.php. The manipulation of the argument file_upload leads to unrestricted upload. The attack can be launched remotely. The exploit has been disclosed to the public and may be used. The identifier VDB-240241 was assigned to this vulnerability. NOTE: This vulnerability only affects products that are no longer supported by the maintainer. NOTE: Vendor was contacted early and confirmed immediately that the product is end-of-life. It should be retired and replaced.,2024-06-05T21:15:13.860,https://cve.circl.lu/cve/CVE-2023-5145
CVE-2023-47189,1.4,Defender,Improper Authentication vulnerability in WPMU DEV Defender Security allows Accessing Functionality Not Properly Constrained by ACLs.This issue affects Defender Security: from n/a through 4.2.0.,2024-06-04T16:57:41.053,https://cve.circl.lu/cve/CVE-2023-47189
CVE-2024-36919,NA,Dell,"In the Linux kernel, the following vulnerability has been resolved:scsi: bnx2fc: Remove spin_lock_bh while releasing resources after uploadThe session resources are used by FW and driver when session is offloaded,once session is uploaded these resources are not used. The lock is notrequired as these fields won't be used any longer. The offload and uploadcalls are sequential, hence lock is not required.This will suppress following BUG_ON():[  449.843143] ------------[ cut here ]------------[  449.848302] kernel BUG at mm/vmalloc.c:2727![  449.853072] invalid opcode: 0000 [#1] PREEMPT SMP PTI[  449.858712] CPU: 5 PID: 1996 Comm: kworker/u24:2 Not tainted 5.14.0-118.el9.x86_64 #1Rebooting.[  449.867454] Hardware name: Dell Inc. PowerEdge R730/0WCJNT, BIOS 2.3.4 11/08/2016[  449.876966] Workqueue: fc_rport_eq fc_rport_work [libfc][  449.882910] RIP: 0010:vunmap+0x2e/0x30[  449.887098] Code: 00 65 8b 05 14 a2 f0 4a a9 00 ff ff 00 75 1b 55 48 89 fd e8 34 36 79 00 48 85 ed 74 0b 48 89 ef 31 f6 5d e9 14 fc ff ff 5d c3 <0f> 0b 0f 1f 44 00 00 41 57 41 56 49 89 ce 41 55 49 89 fd 41 54 41[  449.908054] RSP: 0018:ffffb83d878b3d68 EFLAGS: 00010206[  449.913887] RAX: 0000000080000201 RBX: ffff8f4355133550 RCX: 000000000d400005[  449.921843] RDX: 0000000000000001 RSI: 0000000000001000 RDI: ffffb83da53f5000[  449.929808] RBP: ffff8f4ac6675800 R08: ffffb83d878b3d30 R09: 00000000000efbdf[  449.937774] R10: 0000000000000003 R11: ffff8f434573e000 R12: 0000000000001000[  449.945736] R13: 0000000000001000 R14: ffffb83da53f5000 R15: ffff8f43d4ea3ae0[  449.953701] FS:  0000000000000000(0000) GS:ffff8f529fc80000(0000) knlGS:0000000000000000[  449.962732] CS:  0010 DS: 0000 ES: 0000 CR0: 0000000080050033[  449.969138] CR2: 00007f8cf993e150 CR3: 0000000efbe10003 CR4: 00000000003706e0[  449.977102] DR0: 0000000000000000 DR1: 0000000000000000 DR2: 0000000000000000[  449.985065] DR3: 0000000000000000 DR6: 00000000fffe0ff0 DR7: 0000000000000400[  449.993028] Call Trace:[  449.995756]  __iommu_dma_free+0x96/0x100[  450.000139]  bnx2fc_free_session_resc+0x67/0x240 [bnx2fc][  450.006171]  bnx2fc_upload_session+0xce/0x100 [bnx2fc][  450.011910]  bnx2fc_rport_event_handler+0x9f/0x240 [bnx2fc][  450.018136]  fc_rport_work+0x103/0x5b0 [libfc][  450.023103]  process_one_work+0x1e8/0x3c0[  450.027581]  worker_thread+0x50/0x3b0[  450.031669]  ? rescuer_thread+0x370/0x370[  450.036143]  kthread+0x149/0x170[  450.039744]  ? set_kthread_struct+0x40/0x40[  450.044411]  ret_from_fork+0x22/0x30[  450.048404] Modules linked in: vfat msdos fat xfs nfs_layout_nfsv41_files rpcsec_gss_krb5 auth_rpcgss nfsv4 dns_resolver dm_service_time qedf qed crc8 bnx2fc libfcoe libfc scsi_transport_fc intel_rapl_msr intel_rapl_common x86_pkg_temp_thermal intel_powerclamp dcdbas rapl intel_cstate intel_uncore mei_me pcspkr mei ipmi_ssif lpc_ich ipmi_si fuse zram ext4 mbcache jbd2 loop nfsv3 nfs_acl nfs lockd grace fscache netfs irdma ice sd_mod t10_pi sg ib_uverbs ib_core 8021q garp mrp stp llc mgag200 i2c_algo_bit drm_kms_helper syscopyarea sysfillrect sysimgblt mxm_wmi fb_sys_fops cec crct10dif_pclmul ahci crc32_pclmul bnx2x drm ghash_clmulni_intel libahci rfkill i40e libata megaraid_sas mdio wmi sunrpc lrw dm_crypt dm_round_robin dm_multipath dm_snapshot dm_bufio dm_mirror dm_region_hash dm_log dm_zero dm_mod linear raid10 raid456 async_raid6_recov async_memcpy async_pq async_xor async_tx raid6_pq libcrc32c crc32c_intel raid1 raid0 iscsi_ibft squashfs be2iscsi bnx2i cnic uio cxgb4i cxgb4 tls[  450.048497]  libcxgbi libcxgb qla4xxx iscsi_boot_sysfs iscsi_tcp libiscsi_tcp libiscsi scsi_transport_iscsi edd ipmi_devintf ipmi_msghandler[  450.159753] ---[ end trace 712de2c57c64abc8 ]---",2024-05-30T18:18:58.870,https://cve.circl.lu/cve/CVE-2024-36919
