CVE,"Impact Score (1-10, 10 being the worst)",Keyword,Description,Last Modified,Link
CVE-2024-29170,5.2,Dell,"Dell PowerScale OneFS versions 8.2.x through 9.8.0.x contain a use of hard coded credentials vulnerability. An adjacent network unauthenticated attacker could potentially exploit this vulnerability, leading to information disclosure of network traffic and denial of service.",2024-06-04T16:57:41.053,https://cve.circl.lu/cve/CVE-2024-29170
CVE-2024-35228,4.2,Django,"Wagtail is an open source content management system built on Django. Due to an improperly applied permission check in the `wagtail.contrib.settings` module, a user with access to the Wagtail admin and knowledge of the URL of the edit view for a settings model can access and update that setting, even when they have not been granted permission over the model. The vulnerability is not exploitable by an ordinary site visitor without access to the Wagtail admin. Patched versions have been released as Wagtail 6.0.5 and 6.1.2. Wagtail releases prior to 6.0 are unaffected. Users are advised to upgrade. Site owners who are unable to upgrade to a patched version can avoid the vulnerability in `ModelViewSet` by registering the model as a snippet instead. No workaround is available for `wagtail.contrib.settings`.",2024-05-31T13:01:46.727,https://cve.circl.lu/cve/CVE-2024-35228
CVE-2024-35140,5.2,Docker,IBM Security Verify Access Docker 10.0.0 through 10.0.6 could allow a local user to escalate their privileges due to improper certificate validation.  IBM X-Force ID:  292416.,2024-05-31T19:14:47.793,https://cve.circl.lu/cve/CVE-2024-35140
CVE-2024-35142,5.9,Docker,IBM Security Verify Access Docker 10.0.0 through 10.0.6 could allow a local user to escalate their privileges due to execution of unnecessary privileges.  IBM X-Force ID:  292418.,2024-05-31T19:14:47.793,https://cve.circl.lu/cve/CVE-2024-35142
CVE-2024-34051,NA,Dolibarr,A Reflected Cross-site scripting (XSS) vulnerability located in htdocs/compta/paiement/card.php of Dolibarr before 19.0.2 allows remote attackers to inject arbitrary web script or HTML via a crafted payload injected into the facid parameter.,2024-06-04T16:57:41.057,https://cve.circl.lu/cve/CVE-2024-34051
CVE-2024-1023,3.6,Eclipse,"A vulnerability in the Eclipse Vert.x toolkit results in a memory leak due to using Netty FastThreadLocal data structures. Specifically, when the Vert.x HTTP client establishes connections to different hosts, triggering the memory leak. The leak can be accelerated with intimate runtime knowledge, allowing an attacker to exploit this vulnerability. For instance, a server accepting arbitrary internet addresses could serve as an attack vector by connecting to these addresses, thereby accelerating the memory leak.",2024-05-31T01:15:53.040,https://cve.circl.lu/cve/CVE-2024-1023
CVE-2024-1300,2.5,Eclipse,"A vulnerability in the Eclipse Vert.x toolkit causes a memory leak in TCP servers configured with TLS and SNI support. When processing an unknown SNI server name assigned the default certificate instead of a mapped certificate, the SSL context is erroneously cached in the server name map, leading to memory exhaustion. This flaw allows attackers to send TLS client hello messages with fake server names, triggering a JVM out-of-memory error.",2024-05-31T01:15:53.967,https://cve.circl.lu/cve/CVE-2024-1300
CVE-2013-3245,6.4,Exploit,"plugins/demux/libmkv_plugin.dll in VideoLAN VLC Media Player 2.0.7, and possibly other versions, allows remote attackers to cause a denial of service (crash) and possibly execute arbitrary code via a crafted MKV file, possibly involving an integer overflow and out-of-bounds read or heap-based buffer overflow, or an uncaught exception.  NOTE: the vendor disputes the severity and claimed vulnerability type of this issue, stating ""This PoC crashes VLC, indeed, but does nothing more... this is not an integer overflow error, but an uncaught exception and I doubt that it is exploitable. This uncaught exception makes VLC abort, not execute random code, on my Linux 64bits machine."" A PoC posted by the original researcher shows signs of an attacker-controlled out-of-bounds read, but the affected instruction does not involve a register that directly influences control flow",2024-06-04T19:16:53.593,https://cve.circl.lu/cve/CVE-2013-3245
CVE-2017-3506,5.2,Exploit,"Vulnerability in the Oracle WebLogic Server component of Oracle Fusion Middleware (subcomponent: Web Services). Supported versions that are affected are 10.3.6.0, 12.1.3.0, 12.2.1.0, 12.2.1.1 and 12.2.1.2. Difficult to exploit vulnerability allows unauthenticated attacker with network access via HTTP to compromise Oracle WebLogic Server. Successful attacks of this vulnerability can result in unauthorized creation, deletion or modification access to critical data or all Oracle WebLogic Server accessible data as well as unauthorized access to critical data or complete access to all Oracle WebLogic Server accessible data. CVSS 3.0 Base Score 7.4 (Confidentiality and Integrity impacts). CVSS Vector: (CVSS:3.0/AV:N/AC:H/PR:N/UI:N/S:U/C:H/I:H/A:N).",2024-06-04T01:00:01.837,https://cve.circl.lu/cve/CVE-2017-3506
CVE-2019-11391,1.4,Exploit,An issue was discovered in OWASP ModSecurity Core Rule Set (CRS) through 3.1.0. /rules/REQUEST-933-APPLICATION-ATTACK-PHP.conf allows remote attackers to cause a denial of service (ReDOS) by entering a specially crafted string with $a# at the beginning and nested repetition operators. NOTE: the software maintainer disputes that this is a vulnerability because the issue cannot be exploited via ModSecurity,2024-06-04T19:16:57.383,https://cve.circl.lu/cve/CVE-2019-11391
CVE-2019-11021,5.9,Exploit,"admin/app/mediamanager in Schlix CMS 2.1.8-7 allows Authenticated Unrestricted File Upload, leading to remote code execution. NOTE: ""While inadvertently allowing a PHP file to be uploaded via Media Manager was an oversight, it still requires an admin permission. We think it's pretty rare for an administrator to exploit a bug on his/her own site to own his/her own site.",2024-06-04T19:16:57.237,https://cve.circl.lu/cve/CVE-2019-11021
CVE-2017-20016,3.6,Exploit,A vulnerability has been found in WEKA INTEREST Security Scanner up to 1.8 and classified as problematic. This vulnerability affects unknown code of the component Portscan. The manipulation with an unknown input leads to denial of service. The attack can be initiated remotely. The exploit has been disclosed to the public and may be used. NOTE: This vulnerability only affects products that are no longer supported by the maintainer,2024-06-04T19:16:54.600,https://cve.circl.lu/cve/CVE-2017-20016
CVE-2021-25310,5.9,Endpoint,The administration web interface on Belkin Linksys WRT160NL 1.0.04.002_US_20130619 devices allows remote authenticated attackers to execute system commands with root privileges via shell metacharacters in the ui_language POST parameter to the apply.cgi form endpoint. This occurs in do_upgrade_post in mini_httpd. NOTE: This vulnerability only affects products that are no longer supported by the maintaine,2024-06-04T19:17:02.997,https://cve.circl.lu/cve/CVE-2021-25310
CVE-2021-28247,2.7,Endpoint,"CA eHealth Performance Manager through 6.3.2.12 is affected by Cross Site Scripting (XSS). The impact is: An authenticated remote user is able to inject arbitrary web script or HTML due to incorrect sanitization of user-supplied data and perform a Reflected Cross-Site Scripting attack against the platform users. The affected endpoints are: cgi/nhWeb with the parameter report, aviewbin/filtermibobjects.pl with the parameter namefilter, and aviewbin/query.pl with the parameters System, SystemText, Group, and GroupText. NOTE: This vulnerability only affects products that are no longer supported by the maintainer",2024-06-04T19:17:03.890,https://cve.circl.lu/cve/CVE-2021-28247
CVE-2024-3193,5.9,Endpoint,A vulnerability has been found in MailCleaner up to 2023.03.14 and classified as critical. Affected by this vulnerability is an unknown functionality of the component Admin Endpoints. The manipulation leads to os command injection. The attack can be launched remotely. The exploit has been disclosed to the public and may be used. It is recommended to apply a patch to fix this issue. The identifier VDB-262309 was assigned to this vulnerability.,2024-06-04T19:20:17.130,https://cve.circl.lu/cve/CVE-2024-3193
CVE-2024-3194,1.4,Endpoint,A vulnerability was found in MailCleaner up to 2023.03.14 and classified as problematic. Affected by this issue is some unknown functionality of the component Log File Endpoint. The manipulation leads to cross site scripting. The attack may be launched remotely. The exploit has been disclosed to the public and may be used. It is recommended to apply a patch to fix this issue. VDB-262310 is the identifier assigned to this vulnerability.,2024-06-04T19:20:17.237,https://cve.circl.lu/cve/CVE-2024-3194
CVE-2024-3195,3.4,Endpoint,A vulnerability was found in MailCleaner up to 2023.03.14. It has been classified as critical. This affects an unknown part of the component Admin Endpoints. The manipulation leads to path traversal. It is possible to initiate the attack remotely. The exploit has been disclosed to the public and may be used. It is recommended to apply a patch to fix this issue. The associated identifier of this vulnerability is VDB-262311.,2024-06-04T19:20:17.337,https://cve.circl.lu/cve/CVE-2024-3195
CVE-2023-48789,1.4,Fortinet,A client-side enforcement of server-side security in Fortinet FortiPortal version 6.0.0 through 6.0.14 allows attacker to improper access control via crafted HTTP requests.,2024-06-03T14:46:24.250,https://cve.circl.lu/cve/CVE-2023-48789
CVE-2024-23664,2.7,Fortinet,"A URL redirection to untrusted site ('open redirect') in Fortinet FortiAuthenticator version 6.6.0, version 6.5.3 and below, version 6.4.9 and below may allow an attacker to to redirect users to an arbitrary website via a crafted URL.",2024-06-03T14:46:24.250,https://cve.circl.lu/cve/CVE-2024-23664
CVE-2024-23667,5.9,Fortinet,An improper authorization in Fortinet FortiWebManager version 7.2.0 and 7.0.0 through 7.0.4 and 6.3.0 and 6.2.3 through 6.2.4 and 6.0.2 allows attacker to execute unauthorized code or commands via HTTP requests or CLI.,2024-06-03T14:46:24.250,https://cve.circl.lu/cve/CVE-2024-23667
CVE-2024-23668,5.9,Fortinet,An improper authorization in Fortinet FortiWebManager version 7.2.0 and 7.0.0 through 7.0.4 and 6.3.0 and 6.2.3 through 6.2.4 and 6.0.2 allows attacker to execute unauthorized code or commands via HTTP requests or CLI.,2024-06-03T14:46:24.250,https://cve.circl.lu/cve/CVE-2024-23668
CVE-2024-23670,5.9,Fortinet,An improper authorization in Fortinet FortiWebManager version 7.2.0 and 7.0.0 through 7.0.4 and 6.3.0 and 6.2.3 through 6.2.4 and 6.0.2 allows attacker to execute unauthorized code or commands via HTTP requests or CLI.,2024-06-03T14:46:24.250,https://cve.circl.lu/cve/CVE-2024-23670
CVE-2023-36631,5.9,Firewall,"Lack of access control in wfc.exe in Malwarebytes Binisoft Windows Firewall Control 6.9.2.0 allows local unprivileged users to bypass Windows Firewall restrictions via the user interface's rules tab. NOTE: the vendor's perspective is ""this is intended behavior as the application can be locked using a password.""",2024-06-05T21:15:11.700,https://cve.circl.lu/cve/CVE-2023-36631
CVE-2024-2644,3.4,Firewall,A vulnerability was found in Netentsec NS-ASG Application Security Gateway 6.3. It has been rated as critical. Affected by this issue is some unknown functionality of the file /protocol/firewall/addfirewall.php. The manipulation of the argument FireWallTableArray leads to sql injection. The attack may be launched remotely. The exploit has been disclosed to the public and may be used. VDB-257282 is the identifier assigned to this vulnerability. NOTE: The vendor was contacted early about this disclosure but did not respond in any way.,2024-06-05T20:15:12.680,https://cve.circl.lu/cve/CVE-2024-2644
CVE-2023-52147,1.4,Firewall,Exposure of Sensitive Information to an Unauthorized Actor vulnerability in All In One WP Security & Firewall Team All In One WP Security & Firewall allows Accessing Functionality Not Properly Constrained by ACLs.This issue affects All In One WP Security & Firewall: from n/a through 5.2.4.,2024-06-04T16:57:41.053,https://cve.circl.lu/cve/CVE-2023-52147
CVE-2024-1100,NA,GIS,Improper Neutralization of Special Elements used in an SQL Command ('SQL Injection') vulnerability in Vadi Corporate Information Systems DIGIKENT GIS allows SQL Injection.This issue affects DIGIKENT GIS: through 2.23.5.,2024-05-30T13:15:41.297,https://cve.circl.lu/cve/CVE-2024-1100
CVE-2020-27986,3.6,GitLab,"SonarQube 8.4.2.36762 allows remote attackers to discover cleartext SMTP, SVN, and GitLab credentials via the api/settings/values URI. NOTE: reportedly, the vendor's position for SMTP and SVN is ""it is the administrator's responsibility to configure it.",2024-06-04T19:17:01.417,https://cve.circl.lu/cve/CVE-2020-27986
CVE-2007-3484,2.9,Google,"Cross-site scripting (XSS) vulnerability in search.php in Google Custom Search Engine allows remote attackers to inject arbitrary web script or HTML via the q parameter.  NOTE: this issue is disputed by the Google Security Team, who states that ""Google does not provide the 'search.php' script referenced.  When a user creates a custom search engine, we provide them with a block of javascript to include on their site.  Some users write additional code around this block of javascript to further customize their website.",2024-06-04T19:16:52.743,https://cve.circl.lu/cve/CVE-2007-3484
CVE-2024-36901,NA,Google,"In the Linux kernel, the following vulnerability has been resolved:ipv6: prevent NULL dereference in ip6_output()According to syzbot, there is a chance that ip6_dst_idev()returns NULL in ip6_output(). Most places in IPv6 stackdeal with a NULL idev just fine, but not here.syzbot reported:general protection fault, probably for non-canonical address 0xdffffc00000000bc: 0000 [#1] PREEMPT SMP KASAN PTIKASAN: null-ptr-deref in range [0x00000000000005e0-0x00000000000005e7]CPU: 0 PID: 9775 Comm: syz-executor.4 Not tainted 6.9.0-rc5-syzkaller-00157-g6a30653b604a #0Hardware name: Google Google Compute Engine/Google Compute Engine, BIOS Google 03/27/2024 RIP: 0010:ip6_output+0x231/0x3f0 net/ipv6/ip6_output.c:237Code: 3c 1e 00 49 89 df 74 08 4c 89 ef e8 19 58 db f7 48 8b 44 24 20 49 89 45 00 49 89 c5 48 8d 9d e0 05 00 00 48 89 d8 48 c1 e8 03 <42> 0f b6 04 38 84 c0 4c 8b 74 24 28 0f 85 61 01 00 00 8b 1b 31 ffRSP: 0018:ffffc9000927f0d8 EFLAGS: 00010202RAX: 00000000000000bc RBX: 00000000000005e0 RCX: 0000000000040000RDX: ffffc900131f9000 RSI: 0000000000004f47 RDI: 0000000000004f48RBP: 0000000000000000 R08: ffffffff8a1f0b9a R09: 1ffffffff1f51fadR10: dffffc0000000000 R11: fffffbfff1f51fae R12: ffff8880293ec8c0R13: ffff88805d7fc000 R14: 1ffff1100527d91a R15: dffffc0000000000FS:  00007f135c6856c0(0000) GS:ffff8880b9400000(0000) knlGS:0000000000000000CS:  0010 DS: 0000 ES: 0000 CR0: 0000000080050033CR2: 0000000020000080 CR3: 0000000064096000 CR4: 00000000003506f0DR0: 0000000000000000 DR1: 0000000000000000 DR2: 0000000000000000DR3: 0000000000000000 DR6: 00000000fffe0ff0 DR7: 0000000000000400Call Trace: <TASK>  NF_HOOK include/linux/netfilter.h:314 [inline]  ip6_xmit+0xefe/0x17f0 net/ipv6/ip6_output.c:358  sctp_v6_xmit+0x9f2/0x13f0 net/sctp/ipv6.c:248  sctp_packet_transmit+0x26ad/0x2ca0 net/sctp/output.c:653  sctp_packet_singleton+0x22c/0x320 net/sctp/outqueue.c:783  sctp_outq_flush_ctrl net/sctp/outqueue.c:914 [inline]  sctp_outq_flush+0x6d5/0x3e20 net/sctp/outqueue.c:1212  sctp_side_effects net/sctp/sm_sideeffect.c:1198 [inline]  sctp_do_sm+0x59cc/0x60c0 net/sctp/sm_sideeffect.c:1169  sctp_primitive_ASSOCIATE+0x95/0xc0 net/sctp/primitive.c:73  __sctp_connect+0x9cd/0xe30 net/sctp/socket.c:1234  sctp_connect net/sctp/socket.c:4819 [inline]  sctp_inet_connect+0x149/0x1f0 net/sctp/socket.c:4834  __sys_connect_file net/socket.c:2048 [inline]  __sys_connect+0x2df/0x310 net/socket.c:2065  __do_sys_connect net/socket.c:2075 [inline]  __se_sys_connect net/socket.c:2072 [inline]  __x64_sys_connect+0x7a/0x90 net/socket.c:2072  do_syscall_x64 arch/x86/entry/common.c:52 [inline]  do_syscall_64+0xf5/0x240 arch/x86/entry/common.c:83 entry_SYSCALL_64_after_hwframe+0x77/0x7f",2024-05-30T18:18:58.870,https://cve.circl.lu/cve/CVE-2024-36901
CVE-2024-36902,NA,Google,"In the Linux kernel, the following vulnerability has been resolved:ipv6: fib6_rules: avoid possible NULL dereference in fib6_rule_action()syzbot is able to trigger the following crash [1],caused by unsafe ip6_dst_idev() use.Indeed ip6_dst_idev() can return NULL, and must always be checked.[1]Oops: general protection fault, probably for non-canonical address 0xdffffc0000000000: 0000 [#1] PREEMPT SMP KASAN PTIKASAN: null-ptr-deref in range [0x0000000000000000-0x0000000000000007]CPU: 0 PID: 31648 Comm: syz-executor.0 Not tainted 6.9.0-rc4-next-20240417-syzkaller #0Hardware name: Google Google Compute Engine/Google Compute Engine, BIOS Google 03/27/2024 RIP: 0010:__fib6_rule_action net/ipv6/fib6_rules.c:237 [inline] RIP: 0010:fib6_rule_action+0x241/0x7b0 net/ipv6/fib6_rules.c:267Code: 02 00 00 49 8d 9f d8 00 00 00 48 89 d8 48 c1 e8 03 42 80 3c 20 00 74 08 48 89 df e8 f9 32 bf f7 48 8b 1b 48 89 d8 48 c1 e8 03 <42> 80 3c 20 00 74 08 48 89 df e8 e0 32 bf f7 4c 8b 03 48 89 ef 4cRSP: 0018:ffffc9000fc1f2f0 EFLAGS: 00010246RAX: 0000000000000000 RBX: 0000000000000000 RCX: 1a772f98c8186700RDX: 0000000000000003 RSI: ffffffff8bcac4e0 RDI: ffffffff8c1f9760RBP: ffff8880673fb980 R08: ffffffff8fac15ef R09: 1ffffffff1f582bdR10: dffffc0000000000 R11: fffffbfff1f582be R12: dffffc0000000000R13: 0000000000000080 R14: ffff888076509000 R15: ffff88807a029a00FS:  00007f55e82ca6c0(0000) GS:ffff8880b9400000(0000) knlGS:0000000000000000CS:  0010 DS: 0000 ES: 0000 CR0: 0000000080050033CR2: 0000001b31d23000 CR3: 0000000022b66000 CR4: 00000000003506f0DR0: 0000000000000000 DR1: 0000000000000000 DR2: 0000000000000000DR3: 0000000000000000 DR6: 00000000fffe0ff0 DR7: 0000000000000400Call Trace: <TASK>  fib_rules_lookup+0x62c/0xdb0 net/core/fib_rules.c:317  fib6_rule_lookup+0x1fd/0x790 net/ipv6/fib6_rules.c:108  ip6_route_output_flags_noref net/ipv6/route.c:2637 [inline]  ip6_route_output_flags+0x38e/0x610 net/ipv6/route.c:2649  ip6_route_output include/net/ip6_route.h:93 [inline]  ip6_dst_lookup_tail+0x189/0x11a0 net/ipv6/ip6_output.c:1120  ip6_dst_lookup_flow+0xb9/0x180 net/ipv6/ip6_output.c:1250  sctp_v6_get_dst+0x792/0x1e20 net/sctp/ipv6.c:326  sctp_transport_route+0x12c/0x2e0 net/sctp/transport.c:455  sctp_assoc_add_peer+0x614/0x15c0 net/sctp/associola.c:662  sctp_connect_new_asoc+0x31d/0x6c0 net/sctp/socket.c:1099  __sctp_connect+0x66d/0xe30 net/sctp/socket.c:1197  sctp_connect net/sctp/socket.c:4819 [inline]  sctp_inet_connect+0x149/0x1f0 net/sctp/socket.c:4834  __sys_connect_file net/socket.c:2048 [inline]  __sys_connect+0x2df/0x310 net/socket.c:2065  __do_sys_connect net/socket.c:2075 [inline]  __se_sys_connect net/socket.c:2072 [inline]  __x64_sys_connect+0x7a/0x90 net/socket.c:2072  do_syscall_x64 arch/x86/entry/common.c:52 [inline]  do_syscall_64+0xf5/0x240 arch/x86/entry/common.c:83 entry_SYSCALL_64_after_hwframe+0x77/0x7f",2024-05-30T18:18:58.870,https://cve.circl.lu/cve/CVE-2024-36902
CVE-2024-36905,NA,Google,"In the Linux kernel, the following vulnerability has been resolved:tcp: defer shutdown(SEND_SHUTDOWN) for TCP_SYN_RECV socketsTCP_SYN_RECV state is really special, it is only used bycross-syn connections, mostly used by fuzzers.In the following crash [1], syzbot managed to trigger a divideby zero in tcp_rcv_space_adjust()A socket makes the following state transitions,without ever calling tcp_init_transfer(),meaning tcp_init_buffer_space() is also not called.         TCP_CLOSEconnect()         TCP_SYN_SENT         TCP_SYN_RECVshutdown() -> tcp_shutdown(sk, SEND_SHUTDOWN)         TCP_FIN_WAIT1To fix this issue, change tcp_shutdown() to notperform a TCP_SYN_RECV -> TCP_FIN_WAIT1 transition,which makes no sense anyway.When tcp_rcv_state_process() later changes socket statefrom TCP_SYN_RECV to TCP_ESTABLISH, then look atsk->sk_shutdown to finally enter TCP_FIN_WAIT1 state,and send a FIN packet from a sane socket state.This means tcp_send_fin() can now be called from BHcontext, and must use GFP_ATOMIC allocations.[1]divide error: 0000 [#1] PREEMPT SMP KASAN NOPTICPU: 1 PID: 5084 Comm: syz-executor358 Not tainted 6.9.0-rc6-syzkaller-00022-g98369dccd2f8 #0Hardware name: Google Google Compute Engine/Google Compute Engine, BIOS Google 03/27/2024 RIP: 0010:tcp_rcv_space_adjust+0x2df/0x890 net/ipv4/tcp_input.c:767Code: e3 04 4c 01 eb 48 8b 44 24 38 0f b6 04 10 84 c0 49 89 d5 0f 85 a5 03 00 00 41 8b 8e c8 09 00 00 89 e8 29 c8 48 0f af c3 31 d2 <48> f7 f1 48 8d 1c 43 49 8d 96 76 08 00 00 48 89 d0 48 c1 e8 03 48RSP: 0018:ffffc900031ef3f0 EFLAGS: 00010246RAX: 0c677a10441f8f42 RBX: 000000004fb95e7e RCX: 0000000000000000RDX: 0000000000000000 RSI: 0000000000000000 RDI: 0000000000000000RBP: 0000000027d4b11f R08: ffffffff89e535a4 R09: 1ffffffff25e6ab7R10: dffffc0000000000 R11: ffffffff8135e920 R12: ffff88802a9f8d30R13: dffffc0000000000 R14: ffff88802a9f8d00 R15: 1ffff1100553f2daFS:  00005555775c0380(0000) GS:ffff8880b9500000(0000) knlGS:0000000000000000CS:  0010 DS: 0000 ES: 0000 CR0: 0000000080050033CR2: 00007f1155bf2304 CR3: 000000002b9f2000 CR4: 0000000000350ef0Call Trace: <TASK>  tcp_recvmsg_locked+0x106d/0x25a0 net/ipv4/tcp.c:2513  tcp_recvmsg+0x25d/0x920 net/ipv4/tcp.c:2578  inet6_recvmsg+0x16a/0x730 net/ipv6/af_inet6.c:680  sock_recvmsg_nosec net/socket.c:1046 [inline]  sock_recvmsg+0x109/0x280 net/socket.c:1068  ____sys_recvmsg+0x1db/0x470 net/socket.c:2803  ___sys_recvmsg net/socket.c:2845 [inline]  do_recvmmsg+0x474/0xae0 net/socket.c:2939  __sys_recvmmsg net/socket.c:3018 [inline]  __do_sys_recvmmsg net/socket.c:3041 [inline]  __se_sys_recvmmsg net/socket.c:3034 [inline]  __x64_sys_recvmmsg+0x199/0x250 net/socket.c:3034  do_syscall_x64 arch/x86/entry/common.c:52 [inline]  do_syscall_64+0xf5/0x240 arch/x86/entry/common.c:83 entry_SYSCALL_64_after_hwframe+0x77/0x7fRIP: 0033:0x7faeb6363db9Code: 28 00 00 00 75 05 48 83 c4 28 c3 e8 c1 17 00 00 90 48 89 f8 48 89 f7 48 89 d6 48 89 ca 4d 89 c2 4d 89 c8 4c 8b 4c 24 08 0f 05 <48> 3d 01 f0 ff ff 73 01 c3 48 c7 c1 b8 ff ff ff f7 d8 64 89 01 48RSP: 002b:00007ffcc1997168 EFLAGS: 00000246 ORIG_RAX: 000000000000012bRAX: ffffffffffffffda RBX: 0000000000000000 RCX: 00007faeb6363db9RDX: 0000000000000001 RSI: 0000000020000bc0 RDI: 0000000000000005RBP: 0000000000000000 R08: 0000000000000000 R09: 000000000000001cR10: 0000000000000122 R11: 0000000000000246 R12: 0000000000000000R13: 0000000000000000 R14: 0000000000000001 R15: 0000000000000001",2024-05-30T18:18:58.870,https://cve.circl.lu/cve/CVE-2024-36905
CVE-2024-36915,NA,Google,"In the Linux kernel, the following vulnerability has been resolved:nfc: llcp: fix nfc_llcp_setsockopt() unsafe copiessyzbot reported unsafe calls to copy_from_sockptr() [1]Use copy_safe_from_sockptr() instead.[1]BUG: KASAN: slab-out-of-bounds in copy_from_sockptr_offset include/linux/sockptr.h:49 [inline] BUG: KASAN: slab-out-of-bounds in copy_from_sockptr include/linux/sockptr.h:55 [inline] BUG: KASAN: slab-out-of-bounds in nfc_llcp_setsockopt+0x6c2/0x850 net/nfc/llcp_sock.c:255Read of size 4 at addr ffff88801caa1ec3 by task syz-executor459/5078CPU: 0 PID: 5078 Comm: syz-executor459 Not tainted 6.8.0-syzkaller-08951-gfe46a7dd189e #0Hardware name: Google Google Compute Engine/Google Compute Engine, BIOS Google 03/27/2024Call Trace: <TASK>  __dump_stack lib/dump_stack.c:88 [inline]  dump_stack_lvl+0x241/0x360 lib/dump_stack.c:114  print_address_description mm/kasan/report.c:377 [inline]  print_report+0x169/0x550 mm/kasan/report.c:488  kasan_report+0x143/0x180 mm/kasan/report.c:601  copy_from_sockptr_offset include/linux/sockptr.h:49 [inline]  copy_from_sockptr include/linux/sockptr.h:55 [inline]  nfc_llcp_setsockopt+0x6c2/0x850 net/nfc/llcp_sock.c:255  do_sock_setsockopt+0x3b1/0x720 net/socket.c:2311  __sys_setsockopt+0x1ae/0x250 net/socket.c:2334  __do_sys_setsockopt net/socket.c:2343 [inline]  __se_sys_setsockopt net/socket.c:2340 [inline]  __x64_sys_setsockopt+0xb5/0xd0 net/socket.c:2340 do_syscall_64+0xfd/0x240 entry_SYSCALL_64_after_hwframe+0x6d/0x75RIP: 0033:0x7f7fac07fd89Code: 28 00 00 00 75 05 48 83 c4 28 c3 e8 91 18 00 00 90 48 89 f8 48 89 f7 48 89 d6 48 89 ca 4d 89 c2 4d 89 c8 4c 8b 4c 24 08 0f 05 <48> 3d 01 f0 ff ff 73 01 c3 48 c7 c1 b8 ff ff ff f7 d8 64 89 01 48RSP: 002b:00007fff660eb788 EFLAGS: 00000246 ORIG_RAX: 0000000000000036RAX: ffffffffffffffda RBX: 0000000000000003 RCX: 00007f7fac07fd89RDX: 0000000000000000 RSI: 0000000000000118 RDI: 0000000000000004RBP: 0000000000000000 R08: 0000000000000002 R09: 0000000000000000R10: 0000000020000a80 R11: 0000000000000246 R12: 0000000000000000R13: 0000000000000000 R14: 0000000000000000 R15: 0000000000000000",2024-05-30T18:18:58.870,https://cve.circl.lu/cve/CVE-2024-36915
CVE-2022-32275,3.6,Grafana,"Grafana 8.4.3 allows reading files via (for example) a /dashboard/snapshot/%7B%7Bconstructor.constructor'/.. /.. /.. /.. /.. /.. /.. /.. /etc/passwd URI. NOTE: the vendor's position is that there is no vulnerability; this request yields a benign error page, not /etc/passwd content",2024-06-04T19:17:15.757,https://cve.circl.lu/cve/CVE-2022-32275
CVE-2024-5526,4.0,Grafana,"Grafana OnCall is an easy-to-use on-call management tool that will help reduce toil in on-call management through simpler workflows and interfaces that are tailored specifically for engineers.Grafana OnCall, from version 1.1.37 before 1.5.2 are vulnerable to a Server Side Request Forgery (SSRF) vulnerability in the webhook functionallity. This issue was fixed in version 1.5.2",2024-06-05T12:53:50.240,https://cve.circl.lu/cve/CVE-2024-5526
