CVE,"Impact Score (1-10, 10 being the worst)",Keyword,Description,Last Modified,Link
CVE-2023-4154,3.6,Samba,"A design flaw was found in Samba's DirSync control implementation, which exposes passwords and secrets in Active Directory to privileged users and Read-Only Domain Controllers (RODCs). This flaw allows RODCs and users possessing the GET_CHANGES right to access all attributes, including sensitive secrets and passwords. Even in a default setup, RODC DC accounts, which should only replicate some passwords, can gain access to all domain secrets, including the vital krbtgt, effectively eliminating the RODC / DC distinction. Furthermore, the vulnerability fails to account for error conditions (fail open), like out-of-memory situations, potentially granting access to secret attributes, even under low-privileged attacker influence.",2023-12-29T05:15:08.850,https://cve.circl.lu/cve/CVE-2023-4154
CVE-2021-36367,5.2,SSH,"PuTTY through 0.75 proceeds with establishing an SSH session even if it has never sent a substantive authentication response. This makes it easier for an attacker-controlled SSH server to present a later spoofed authentication prompt (that the attacker can use to capture credential data, and use that data for purposes that are undesired by the client user).",2023-12-24T18:15:44.520,https://cve.circl.lu/cve/CVE-2021-36367
CVE-2022-39260,5.9,SSH,"Git is an open source, scalable, distributed revision control system. `git shell` is a restricted login shell that can be used to implement Git's push/pull functionality via SSH. In versions prior to 2.30.6, 2.31.5, 2.32.4, 2.33.5, 2.34.5, 2.35.5, 2.36.3, and 2.37.4, the function that splits the command arguments into an array improperly uses an `int` to represent the number of entries in the array, allowing a malicious actor to intentionally overflow the return value, leading to arbitrary heap writes. Because the resulting array is then passed to `execv()`, it is possible to leverage this attack to gain remote code execution on a victim machine. Note that a victim must first allow access to `git shell` as a login shell in order to be vulnerable to this attack. This problem is patched in versions 2.30.6, 2.31.5, 2.32.4, 2.33.5, 2.34.5, 2.35.5, 2.36.3, and 2.37.4 and users are advised to upgrade to the latest version. Disabling `git shell` access via remote logins is a viable short-term workaround.",2023-12-27T10:15:37.793,https://cve.circl.lu/cve/CVE-2022-39260
CVE-2023-27990,2.7,VPN,"The cross-site scripting (XSS) vulnerability in Zyxel ATP series firmware versions 4.32 through 5.35, USG FLEX series firmware versions 4.50 through 5.35, USG FLEX 50(W) firmware versions 4.16 through 5.35, USG20(W)-VPN firmware versions 4.16 through 5.35, and VPN series firmware versions 4.30 through 5.35, which could allow an authenticated attacker with administrator privileges to store malicious scripts in a vulnerable device. A successful XSS attack could then result in the stored malicious scripts being executed when the user visits the Logs page of the GUI on the device.",2023-12-29T07:15:10.510,https://cve.circl.lu/cve/CVE-2023-27990
CVE-2020-17148,5.9,Visual Studio,Visual Studio Code Remote Development Extension Remote Code Execution Vulnerability,2023-12-30T00:15:17.227,https://cve.circl.lu/cve/CVE-2020-17148
CVE-2020-17156,5.9,Visual Studio,Visual Studio Remote Code Execution Vulnerability,2023-12-30T00:15:17.643,https://cve.circl.lu/cve/CVE-2020-17156
CVE-2021-1639,5.9,Visual Studio,Visual Studio Code Remote Code Execution Vulnerability,2023-12-29T17:15:50.150,https://cve.circl.lu/cve/CVE-2021-1639
CVE-2023-48231,1.4,Vim,"Vim is an open source command line text editor. When closing a window, vim may try to access already freed window structure. Exploitation beyond crashing the application has not been shown to be viable. This issue has been addressed in commit `25aabc2b` which has been included in release version 9.0.2106. Users are advised to upgrade. There are no known workarounds for this vulnerability.",2023-12-28T17:39:29.390,https://cve.circl.lu/cve/CVE-2023-48231
CVE-2023-48232,1.4,Vim,Vim is an open source command line text editor. A floating point exception may occur when calculating the line offset for overlong lines and smooth scrolling is enabled and the cpo-settings include the 'n' flag. This may happen when a window border is present and when the wrapped line continues on the next physical line directly in the window border because the 'cpo' setting includes the 'n' flag. Only users with non-default settings are affected and the exception should only result in a crash. This issue has been addressed in commit `cb0b99f0` which has been included in release version 9.0.2107. Users are advised to upgrade. There are no known workarounds for this vulnerability.,2023-12-27T15:15:45.190,https://cve.circl.lu/cve/CVE-2023-48232
CVE-2021-27075,4.0,Virtual Machine,Azure Virtual Machine Information Disclosure Vulnerability,2023-12-29T17:16:05.550,https://cve.circl.lu/cve/CVE-2021-27075
CVE-2021-26443,6.0,Virtual Machine,Microsoft Virtual Machine Bus (VMBus) Remote Code Execution Vulnerability,2023-12-28T16:15:46.900,https://cve.circl.lu/cve/CVE-2021-26443
CVE-2021-1709,5.9,Win32k,Windows Win32k Elevation of Privilege Vulnerability,2023-12-29T23:15:25.240,https://cve.circl.lu/cve/CVE-2021-1709
CVE-2021-1698,5.9,Win32k,Windows Win32k Elevation of Privilege Vulnerability,2023-12-29T23:15:23.367,https://cve.circl.lu/cve/CVE-2021-1698
CVE-2021-1732,5.9,Win32k,Windows Win32k Elevation of Privilege Vulnerability,2023-12-29T23:15:26.480,https://cve.circl.lu/cve/CVE-2021-1732
CVE-2021-26863,5.9,Win32k,Windows Win32k Elevation of Privilege Vulnerability,2023-12-29T20:15:50.713,https://cve.circl.lu/cve/CVE-2021-26863
CVE-2021-26875,5.9,Win32k,Windows Win32k Elevation of Privilege Vulnerability,2023-12-29T20:15:53.097,https://cve.circl.lu/cve/CVE-2021-26875
CVE-2005-0772,3.6,Windows,"VERITAS Backup Exec 9.0 through 10.0 for Windows Servers, and 9.0.4019 through 9.1.307 for Netware, allows remote attackers to cause a denial of service (Remote Agent crash) via (1) a crafted packet in NDMLSRVR.DLL or (2) a request packet with an invalid (non-0) ""Error Status"" value, which triggers a null dereference.",2023-12-28T15:29:13.657,https://cve.circl.lu/cve/CVE-2005-0772
CVE-2020-17092,5.9,Windows,Windows Network Connections Service Elevation of Privilege Vulnerability,2023-12-30T00:15:12.533,https://cve.circl.lu/cve/CVE-2020-17092
CVE-2020-17096,5.9,Windows,Windows NTFS Remote Code Execution Vulnerability,2023-12-30T00:15:13.160,https://cve.circl.lu/cve/CVE-2020-17096
CVE-2020-17097,1.4,Windows,Windows Digital Media Receiver Elevation of Privilege Vulnerability,2023-12-30T00:15:13.360,https://cve.circl.lu/cve/CVE-2020-17097
CVE-2005-1688,2.9,WordPress,"Wordpress 1.5 and earlier allows remote attackers to obtain sensitive information via a direct request to files in (1) wp-content/themes/, (2) wp-includes/, or (3) wp-admin/, which reveal the path in an error message.",2023-12-28T19:27:32.360,https://cve.circl.lu/cve/CVE-2005-1688
CVE-2012-6527,2.9,WordPress,Cross-site scripting (XSS) vulnerability in the My Calendar plugin before 1.10.2 for WordPress allows remote attackers to inject arbitrary web script or HTML via the PATH_INFO.,2023-12-26T17:03:55.613,https://cve.circl.lu/cve/CVE-2012-6527
CVE-2016-10890,2.7,WordPress,The aryo-activity-log plugin before 2.3.2 for WordPress has XSS.,2023-12-26T19:56:27.157,https://cve.circl.lu/cve/CVE-2016-10890
CVE-2016-10891,2.7,WordPress,The aryo-activity-log plugin before 2.3.3 for WordPress has XSS.,2023-12-26T19:56:27.157,https://cve.circl.lu/cve/CVE-2016-10891
CVE-2023-28100,4.0,Xterm,"Flatpak is a system for building, distributing, and running sandboxed desktop applications on Linux. Versions prior to 1.10.8, 1.12.8, 1.14.4, and 1.15.4 contain a vulnerability similar to CVE-2017-5226, but using the `TIOCLINUX` ioctl command instead of `TIOCSTI`. If a Flatpak app is run on a Linux virtual console such as `/dev/tty1`, it can copy text from the virtual console and paste it into the command buffer, from which the command might be run after the Flatpak app has exited. Ordinary graphical terminal emulators like xterm, gnome-terminal and Konsole are unaffected. This vulnerability is specific to the Linux virtual consoles `/dev/tty1`, `/dev/tty2` and so on. A patch is available in versions 1.10.8, 1.12.8, 1.14.4, and 1.15.4. As a workaround, don't run Flatpak on a Linux virtual console. Flatpak is primarily designed to be used in a Wayland or X11 graphical environment.",2023-12-23T10:15:09.703,https://cve.circl.lu/cve/CVE-2023-28100
CVE-2023-47272,2.7,XSS,Roundcube 1.5.x before 1.5.6 and 1.6.x before 1.6.5 allows XSS via a Content-Type or Content-Disposition header (used for attachment preview or download).,2023-12-28T17:24:36.373,https://cve.circl.lu/cve/CVE-2023-47272
CVE-2022-43391,3.6,Zyxel,"A buffer overflow vulnerability in the parameter of the CGI program in Zyxel NR7101 firmware prior to V1.15(ACCC.3)C0, which could allow an authenticated attacker to cause denial-of-service (DoS) conditions by sending a crafted HTTP request.",2023-12-29T07:15:08.013,https://cve.circl.lu/cve/CVE-2022-43391
CVE-2022-43392,3.6,Zyxel,"A buffer overflow vulnerability in the parameter of web server in Zyxel NR7101 firmware prior to V1.15(ACCC.3)C0, which could allow an authenticated attacker to cause denial-of-service (DoS) conditions by sending a crafted authorization request.",2023-12-29T07:15:09.660,https://cve.circl.lu/cve/CVE-2022-43392
CVE-2022-45854,1.4,Zyxel,"An improper check for unusual conditions in Zyxel NWA110AX firmware verisons prior to 6.50(ABTG.0)C0, which could allow a LAN attacker to cause a temporary denial-of-service (DoS) by sending crafted VLAN frames if the MAC address of the vulnerable AP were intercepted by the attacker.",2023-12-29T07:15:10.010,https://cve.circl.lu/cve/CVE-2022-45854
CVE-2023-43314,3.6,Zyxel,** UNSUPPORTED WHEN ASSIGNED **The buffer overflow vulnerability in the Zyxel PMG2005-T20B firmware version V1.00(ABNK.2)b11_C0 could allow an unauthenticated attacker to cause a denial of service condition via a crafted uid.,2023-12-29T08:15:36.570,https://cve.circl.lu/cve/CVE-2023-43314
