CVE,"Impact Score (1-10, 10 being the worst)",Keyword,Description,Last Modified,Link
CVE-2023-50713,3.4,JavaScript,"Speckle Server provides server, frontend, 3D viewer, and other JavaScript utilities for the Speckle 3D data platform. A vulnerability in versions prior to 2.17.6 affects users who: authorized an application which requested a 'token write' scope or, using frontend-2, created a Personal Access Token (PAT) with `token write` scope. When creating a new token an agent needs to authorise the request with an existing token (the 'requesting token').  The requesting token is required to have token write scope in order to generate new tokens. However, Speckle server was not verifying that other privileges granted to the new token were not in excess of the privileges of the requesting token. A malicious actor could use a token with only token write scope to subsequently generate further tokens with additional privileges. These privileges would only grant privileges up to the existing privileges of the user. This vulnerability cannot be used to escalate a user's privileges or grant privileges on behalf of other users.This has been patched as of version 2.17.6. All operators of Speckle servers should upgrade their server to version 2.17.6 or higher. Any users who authorized an application with 'token write' scope, or created a token in frontend-2 with `token write` scope should review existing tokens and permanently revoke any they do not recognize, revoke existing tokens and create new tokens, and review usage of their account for suspicious activity. No known workarounds for this issue exist.",2023-12-28T20:23:47.670,https://cve.circl.lu/cve/CVE-2023-50713
CVE-2021-28448,5.9,Kubernetes,Visual Studio Code Kubernetes Tools Remote Code Execution Vulnerability,2023-12-29T01:15:38.850,https://cve.circl.lu/cve/CVE-2021-28448
CVE-2021-31938,5.9,Kubernetes,Microsoft VsCode Kubernetes Tools Extension Elevation of Privilege Vulnerability,2023-12-28T23:15:13.787,https://cve.circl.lu/cve/CVE-2021-31938
CVE-2009-2698,5.9,Linux,The udp_sendmsg function in the UDP implementation in (1) net/ipv4/udp.c and (2) net/ipv6/udp.c in the Linux kernel before 2.6.19 allows local users to gain privileges or cause a denial of service (NULL pointer dereference and system crash) via vectors involving the MSG_MORE flag and a UDP socket.,2023-12-28T15:22:01.253,https://cve.circl.lu/cve/CVE-2009-2698
CVE-2009-4895,3.6,Linux,"Race condition in the tty_fasync function in drivers/char/tty_io.c in the Linux kernel before 2.6.32.6 allows local users to cause a denial of service (NULL pointer dereference and system crash) or possibly have unspecified other impact via unknown vectors, related to the put_tty_queue and __f_setown functions.  NOTE: the vulnerability was addressed in a different way in 2.6.32.9.",2023-12-28T15:22:24.383,https://cve.circl.lu/cve/CVE-2009-4895
CVE-2014-3532,2.9,Linux,"dbus 1.3.0 before 1.6.22 and 1.8.x before 1.8.6, when running on Linux 2.6.37-rc4 or later, allows local users to cause a denial of service (system-bus disconnect of other services or applications) by sending a message containing a file descriptor, then exceeding the maximum recursion depth before the initial message is forwarded.",2023-12-27T16:36:58.353,https://cve.circl.lu/cve/CVE-2014-3532
CVE-2014-3182,10.0,Linux,Array index error in the logi_dj_raw_event function in drivers/hid/hid-logitech-dj.c in the Linux kernel before 3.16.2 allows physically proximate attackers to execute arbitrary code or cause a denial of service (invalid kfree) via a crafted device that provides a malformed REPORT_TYPE_NOTIF_DEVICE_UNPAIRED value.,2023-12-29T15:41:33.040,https://cve.circl.lu/cve/CVE-2014-3182
CVE-2014-3183,10.0,Linux,Heap-based buffer overflow in the logi_dj_ll_raw_request function in drivers/hid/hid-logitech-dj.c in the Linux kernel before 3.16.2 allows physically proximate attackers to cause a denial of service (system crash) or possibly execute arbitrary code via a crafted device that specifies a large report size for an LED report.,2023-12-29T15:42:53.263,https://cve.circl.lu/cve/CVE-2014-3183
CVE-2021-1689,5.9,Management,Windows Multipoint Management Elevation of Privilege Vulnerability,2023-12-29T23:15:21.660,https://cve.circl.lu/cve/CVE-2021-1689
CVE-2021-24084,3.6,Management,Windows Mobile Device Management Information Disclosure Vulnerability,2023-12-29T23:15:28.880,https://cve.circl.lu/cve/CVE-2021-24084
CVE-2021-34493,5.9,Management,Windows Partition Management Driver Elevation of Privilege Vulnerability,2023-12-28T23:15:34.987,https://cve.circl.lu/cve/CVE-2021-34493
CVE-2021-38645,5.9,Management,Open Management Infrastructure Elevation of Privilege Vulnerability,2023-12-28T20:16:02.483,https://cve.circl.lu/cve/CVE-2021-38645
CVE-2020-17089,5.9,Microsoft,Microsoft SharePoint Elevation of Privilege Vulnerability,2023-12-30T00:15:12.267,https://cve.circl.lu/cve/CVE-2020-17089
CVE-2020-17118,5.2,Microsoft,Microsoft SharePoint Remote Code Execution Vulnerability,2023-12-30T00:15:14.370,https://cve.circl.lu/cve/CVE-2020-17118
CVE-2020-17119,3.6,Microsoft,Microsoft Outlook Information Disclosure Vulnerability,2023-12-30T00:15:14.580,https://cve.circl.lu/cve/CVE-2020-17119
CVE-2023-36942,2.7,MySQL,A cross-site scripting (XSS) vulnerability in PHPGurukul Online Fire Reporting System Using PHP and MySQL 1.2 allows attackers to execute arbitrary web scripts or HTML via a crafted payload injected into the website title field.,2023-12-28T14:36:28.463,https://cve.circl.lu/cve/CVE-2023-36942
CVE-2022-46705,1.4,MacOS,"A spoofing issue existed in the handling of URLs. This issue was addressed with improved input validation. This issue is fixed in iOS 16.2 and iPadOS 16.2, macOS Ventura 13.1, Safari 16.2. Visiting a malicious website may lead to address bar spoofing.",2023-12-28T14:48:17.850,https://cve.circl.lu/cve/CVE-2022-46705
CVE-2021-26700,5.9,NPM,Visual Studio Code npm-script Extension Remote Code Execution Vulnerability,2023-12-29T17:16:00.217,https://cve.circl.lu/cve/CVE-2021-26700
CVE-2008-0062,5.9,NULL Pointer,"KDC in MIT Kerberos 5 (krb5kdc) does not set a global variable for some krb4 message types, which allows remote attackers to cause a denial of service (crash) and possibly execute arbitrary code via crafted messages that trigger a NULL pointer dereference or double-free.",2023-12-28T15:34:12.043,https://cve.circl.lu/cve/CVE-2008-0062
CVE-2008-5183,3.6,NULL Pointer,"cupsd in CUPS 1.3.9 and earlier allows local users, and possibly remote attackers, to cause a denial of service (daemon crash) by adding a large number of RSS Subscriptions, which triggers a NULL pointer dereference.  NOTE: this issue can be triggered remotely by leveraging CVE-2008-5184.",2023-12-28T15:35:17.220,https://cve.circl.lu/cve/CVE-2008-5183
CVE-2018-6197,3.6,NULL Pointer,w3m through 0.5.3 is prone to a NULL pointer dereference flaw in formUpdateBuffer in form.c.,2023-12-29T18:38:04.570,https://cve.circl.lu/cve/CVE-2018-6197
CVE-2019-13147,3.6,NULL Pointer,"In Audio File Library (aka audiofile) 0.3.6, there exists one NULL pointer dereference bug in ulaw2linear_buf in G711.cpp in libmodules.a that allows an attacker to cause a denial of service via a crafted file.",2023-12-28T15:58:45.607,https://cve.circl.lu/cve/CVE-2019-13147
CVE-2004-0079,3.6,OpenSSL,"The do_change_cipher_spec function in OpenSSL 0.9.6c to 0.9.6k, and 0.9.7a to 0.9.7c, allows remote attackers to cause a denial of service (crash) via a crafted SSL/TLS handshake that triggers a null dereference.",2023-12-28T15:33:29.973,https://cve.circl.lu/cve/CVE-2004-0079
CVE-2021-28452,3.7,Outlook,Microsoft Outlook Memory Corruption Vulnerability,2023-12-29T01:15:39.563,https://cve.circl.lu/cve/CVE-2021-28452
CVE-2021-1711,5.9,Office,Microsoft Office Remote Code Execution Vulnerability,2023-12-29T17:15:51.820,https://cve.circl.lu/cve/CVE-2021-1711
CVE-2021-24108,5.9,Office,Microsoft Office Remote Code Execution Vulnerability,2023-12-29T17:15:58.370,https://cve.circl.lu/cve/CVE-2021-24108
CVE-2021-27057,5.9,Office,Microsoft Office Remote Code Execution Vulnerability,2023-12-29T17:16:03.877,https://cve.circl.lu/cve/CVE-2021-27057
CVE-2021-27058,5.9,Office,Microsoft Office ClickToRun Remote Code Execution Vulnerability,2023-12-29T17:16:04.067,https://cve.circl.lu/cve/CVE-2021-27058
CVE-2021-27059,6.0,Office,Microsoft Office Remote Code Execution Vulnerability,2023-12-29T17:16:04.247,https://cve.circl.lu/cve/CVE-2021-27059
CVE-2021-41617,5.9,OpenSSH,"sshd in OpenSSH 6.2 through 8.x before 8.8, when certain non-default configurations are used, allows privilege escalation because supplemental groups are not initialized as expected. Helper programs for AuthorizedKeysCommand and AuthorizedPrincipalsCommand may run with privileges associated with group memberships of the sshd process, if the configuration specifies running the command as a different user.",2023-12-26T04:15:07.520,https://cve.circl.lu/cve/CVE-2021-41617
CVE-2021-45435,5.9,PHP,An SQL Injection vulnerability exists in Sourcecodester Simple Cold Storage Management System using PHP/OOP 1.0 via the username field in login.php.,2023-12-28T16:46:19.600,https://cve.circl.lu/cve/CVE-2021-45435
CVE-2023-0562,5.9,PHP,A vulnerability was found in PHPGurukul Bank Locker Management System 1.0. It has been rated as critical. Affected by this issue is some unknown functionality of the file index.php of the component Login. The manipulation of the argument username leads to sql injection. The attack may be launched remotely. The exploit has been disclosed to the public and may be used. The identifier of this vulnerability is VDB-219716.,2023-12-28T14:42:15.407,https://cve.circl.lu/cve/CVE-2023-0562
CVE-2023-0563,2.7,PHP,A vulnerability classified as problematic has been found in PHPGurukul Bank Locker Management System 1.0. This affects an unknown part of the file add-locker-form.php of the component Assign Locker. The manipulation of the argument ahname leads to cross site scripting. It is possible to initiate the attack remotely. The exploit has been disclosed to the public and may be used. The identifier VDB-219717 was assigned to this vulnerability.,2023-12-28T14:43:54.757,https://cve.circl.lu/cve/CVE-2023-0563
CVE-2023-39551,5.9,PHP,PHPGurukul Online Security Guards Hiring System v.1.0 is vulnerable to SQL Injection via osghs/admin/search.php.,2023-12-28T14:38:04.070,https://cve.circl.lu/cve/CVE-2023-39551
CVE-2021-27056,5.9,Powerpoint,Microsoft PowerPoint Remote Code Execution Vulnerability,2023-12-29T17:16:03.677,https://cve.circl.lu/cve/CVE-2021-27056
CVE-2022-41607,3.6,Python,"All versions of ETIC Telecom Remote Access Server (RAS) 4.5.0 and prior’s application programmable interface (API) is vulnerable to directory traversal through several different methods. This could allow an attacker to read sensitive files from the server, including SSH private keys, passwords, scripts, python objects, database files, and more.",2023-12-28T19:15:31.467,https://cve.circl.lu/cve/CVE-2022-41607
CVE-2023-27043,1.4,Python,"The email module of Python through 3.11.3 incorrectly parses e-mail addresses that contain a special character. The wrong portion of an RFC2822 header is identified as the value of the addr-spec. In some applications, an attacker can bypass a protection mechanism in which application access is granted only after verifying receipt of e-mail to a specific domain (e.g., only @company.example.com addresses may be used for signup). This occurs in email/_parseaddr.py in recent versions of Python.",2023-12-28T02:15:54.543,https://cve.circl.lu/cve/CVE-2023-27043
CVE-2023-5629,2.7,Phishing,A CWE-601:URL Redirection to Untrusted Site (‘Open Redirect’) vulnerability exists that couldcause disclosure of information through phishing attempts over HTTP.,2023-12-27T18:45:15.347,https://cve.circl.lu/cve/CVE-2023-5629
CVE-2023-2680,6.0,QEMU,"This CVE exists because of an incomplete fix for CVE-2021-3750. More specifically, the qemu-kvm package as released for Red Hat Enterprise Linux 9.1 via RHSA-2022:7967 included a version of qemu-kvm that was actually missing the fix for CVE-2021-3750.",2023-12-28T16:23:09.520,https://cve.circl.lu/cve/CVE-2023-2680
CVE-2021-27082,5.9,Quantum,Quantum Development Kit for Visual Studio Code Remote Code Execution Vulnerability,2023-12-29T17:16:06.610,https://cve.circl.lu/cve/CVE-2021-27082
CVE-2020-14297,3.6,Red Hat,"A flaw was discovered in Wildfly's EJB Client as shipped with Red Hat JBoss EAP 7, where some specific EJB transaction objects may get accumulated over the time and can cause services to slow down and eventaully unavailable. An attacker can take advantage and cause denial of service attack and make services unavailable.",2023-12-29T17:55:26.820,https://cve.circl.lu/cve/CVE-2020-14297
CVE-2023-4042,3.6,Red Hat,A flaw was found in ghostscript. The fix for CVE-2020-16305 in ghostscript was not included in RHSA-2021:1852-06 advisory as it was claimed to be. This issue only affects the ghostscript package as shipped with Red Hat Enterprise Linux 8.,2023-12-27T22:04:29.077,https://cve.circl.lu/cve/CVE-2023-4042
CVE-2021-1669,5.9,Remote Desktop,Windows Remote Desktop Security Feature Bypass Vulnerability,2023-12-29T23:15:18.013,https://cve.circl.lu/cve/CVE-2021-1669
CVE-2021-1674,5.9,Remote Desktop,Windows Remote Desktop Protocol Core Security Feature Bypass Vulnerability,2023-12-29T23:15:19.040,https://cve.circl.lu/cve/CVE-2021-1674
CVE-2021-34535,5.9,Remote Desktop,Remote Desktop Client Remote Code Execution Vulnerability,2023-12-28T20:15:50.293,https://cve.circl.lu/cve/CVE-2021-34535
CVE-2021-38631,3.6,Remote Desktop,Windows Remote Desktop Protocol (RDP) Information Disclosure Vulnerability,2023-12-28T16:15:47.650,https://cve.circl.lu/cve/CVE-2021-38631
CVE-2021-38665,4.0,Remote Desktop,Remote Desktop Protocol Client Information Disclosure Vulnerability,2023-12-28T16:15:47.883,https://cve.circl.lu/cve/CVE-2021-38665
CVE-2022-24765,5.9,Repository,"Git for Windows is a fork of Git containing Windows-specific patches. This vulnerability affects users working on multi-user machines, where untrusted parties have write access to the same hard disk. Those untrusted parties could create the folder `C:\.git`, which would be picked up by Git operations run supposedly outside a repository while searching for a Git directory. Git would then respect any config in said Git directory. Git Bash users who set `GIT_PS1_SHOWDIRTYSTATE` are vulnerable as well. Users who installed posh-gitare vulnerable simply by starting a PowerShell. Users of IDEs such as Visual Studio are vulnerable: simply creating a new project would already read and respect the config specified in `C:\.git\config`. Users of the Microsoft fork of Git are vulnerable simply by starting a Git Bash. The problem has been patched in Git for Windows v2.35.2. Users unable to upgrade may create the folder `.git` on all drives where Git commands are run, and remove read/write access from those folders as a workaround. Alternatively, define or extend `GIT_CEILING_DIRECTORIES` to cover the _parent_ directory of the user profile, e.g. `C:\Users` if the user profile is located in `C:\Users\my-user-name`.",2023-12-27T10:15:37.267,https://cve.circl.lu/cve/CVE-2022-24765
CVE-2022-39253,3.6,Repository,"Git is an open source, scalable, distributed revision control system. Versions prior to 2.30.6, 2.31.5, 2.32.4, 2.33.5, 2.34.5, 2.35.5, 2.36.3, and 2.37.4 are subject to exposure of sensitive information to a malicious actor. When performing a local clone (where the source and target of the clone are on the same volume), Git copies the contents of the source's `$GIT_DIR/objects` directory into the destination by either creating hardlinks to the source contents, or copying them (if hardlinks are disabled via `--no-hardlinks`). A malicious actor could convince a victim to clone a repository with a symbolic link pointing at sensitive information on the victim's machine. This can be done either by having the victim clone a malicious repository on the same machine, or having them clone a malicious repository embedded as a bare repository via a submodule from any source, provided they clone with the `--recurse-submodules` option. Git does not create symbolic links in the `$GIT_DIR/objects` directory. The problem has been patched in the versions published on 2022-10-18, and backported to v2.30.x. Potential workarounds: Avoid cloning untrusted repositories using the `--local` optimization when on a shared machine, either by passing the `--no-local` option to `git clone` or cloning from a URL that uses the `file://` scheme. Alternatively, avoid cloning repositories from untrusted sources with `--recurse-submodules` or run `git config --global protocol.file.allow user`.",2023-12-27T10:15:37.640,https://cve.circl.lu/cve/CVE-2022-39253
CVE-2022-23521,5.9,Repository,"Git is distributed revision control system. gitattributes are a mechanism to allow defining attributes for paths. These attributes can be defined by adding a `.gitattributes` file to the repository, which contains a set of file patterns and the attributes that should be set for paths matching this pattern. When parsing gitattributes, multiple integer overflows can occur when there is a huge number of path patterns, a huge number of attributes for a single pattern, or when the declared attribute names are huge. These overflows can be triggered via a crafted `.gitattributes` file that may be part of the commit history. Git silently splits lines longer than 2KB when parsing gitattributes from a file, but not when parsing them from the index. Consequentially, the failure mode depends on whether the file exists in the working tree, the index or both. This integer overflow can result in arbitrary heap reads and writes, which may result in remote code execution. The problem has been patched in the versions published on 2023-01-17, going back to v2.30.7. Users are advised to upgrade. There are no known workarounds for this issue.",2023-12-27T10:15:36.893,https://cve.circl.lu/cve/CVE-2022-23521
CVE-2022-41903,5.9,Repository,"Git is distributed revision control system. `git log` can display commits in an arbitrary format using its `--format` specifiers. This functionality is also exposed to `git archive` via the `export-subst` gitattribute. When processing the padding operators, there is a integer overflow in `pretty.c::format_and_pad_commit()` where a `size_t` is stored improperly as an `int`, and then added as an offset to a `memcpy()`. This overflow can be triggered directly by a user running a command which invokes the commit formatting machinery (e.g., `git log --format=...`). It may also be triggered indirectly through git archive via the export-subst mechanism, which expands format specifiers inside of files within the repository during a git archive. This integer overflow can result in arbitrary heap writes, which may result in arbitrary code execution. The problem has been patched in the versions published on 2023-01-17, going back to v2.30.7. Users are advised to upgrade. Users who are unable to upgrade should disable `git archive` in untrusted repositories. If you expose git archive via `git daemon`, disable it by running `git config --global daemon.uploadArch false`.",2023-12-27T10:15:37.930,https://cve.circl.lu/cve/CVE-2022-41903
CVE-2020-17094,3.6,Repo,Windows Error Reporting Information Disclosure Vulnerability,2023-12-30T00:15:12.747,https://cve.circl.lu/cve/CVE-2020-17094
CVE-2020-17138,3.6,Repo,Windows Error Reporting Information Disclosure Vulnerability,2023-12-30T00:15:15.810,https://cve.circl.lu/cve/CVE-2020-17138
CVE-2021-24090,5.9,Repo,Windows Error Reporting Elevation of Privilege Vulnerability,2023-12-29T20:15:48.603,https://cve.circl.lu/cve/CVE-2021-24090
CVE-2021-1636,5.9,SQL,Microsoft SQL Elevation of Privilege Vulnerability,2023-12-29T17:15:49.923,https://cve.circl.lu/cve/CVE-2021-1636
CVE-2021-20678,5.9,SQL,SQL injection vulnerability in the Paid Memberships Pro versions prior to 2.5.6 allows remote authenticated attackers to execute arbitrary SQL commands via unspecified vectors.,2023-12-28T18:33:11.173,https://cve.circl.lu/cve/CVE-2021-20678
CVE-2022-42241,5.9,SQL,Simple Cold Storage Management System v1.0 is vulnerable to SQL injection via /csms/classes/Master.php?f=delete_message.,2023-12-28T16:46:19.600,https://cve.circl.lu/cve/CVE-2022-42241
CVE-2022-42242,5.9,SQL,Simple Cold Storage Management System v1.0 is vulnerable to SQL injection via /csms/classes/Master.php?f=delete_booking.,2023-12-28T16:46:19.600,https://cve.circl.lu/cve/CVE-2022-42242
CVE-2023-38200,3.6,SSL,"A flaw was found in Keylime. Due to their blocking nature, the Keylime registrar is subject to a remote denial of service against its SSL connections. This flaw allows an attacker to exhaust all available connections.",2023-12-28T15:40:32.947,https://cve.circl.lu/cve/CVE-2023-38200
CVE-2023-46724,3.6,SSL," Squid is a caching proxy for the Web. Due to an Improper Validation of Specified Index bug, Squid versions 3.3.0.1 through 5.9 and 6.0 prior to 6.4 compiled using `--with-openssl` are vulnerable to a Denial of Service attack against SSL Certificate validation. This problem allows a remote server to perform Denial of Service against Squid Proxy by initiating a TLS Handshake with a specially crafted SSL Certificate in a server certificate chain. This attack is limited to HTTPS and SSL-Bump. This bug is fixed in Squid version 6.4. In addition, patches addressing this problem for the stable releases can be found in Squid's patch archives. Those who you use a prepackaged version of Squid should refer to the package vendor for availability information on updated packages.",2023-12-29T03:15:10.793,https://cve.circl.lu/cve/CVE-2023-46724
CVE-2021-1641,2.5,SharePoint,Microsoft SharePoint Server Spoofing Vulnerability,2023-12-29T17:15:50.357,https://cve.circl.lu/cve/CVE-2021-1641
CVE-2021-1707,5.9,SharePoint,Microsoft SharePoint Server Remote Code Execution Vulnerability,2023-12-29T17:15:51.617,https://cve.circl.lu/cve/CVE-2021-1707
CVE-2021-1712,5.9,SharePoint,Microsoft SharePoint Elevation of Privilege Vulnerability,2023-12-29T17:15:52.010,https://cve.circl.lu/cve/CVE-2021-1712
CVE-2023-33225,5.9,Solarwinds,The SolarWinds Platform was susceptible to the Incorrect Comparison Vulnerability. This vulnerability allows users with administrative access to SolarWinds Web Console to execute arbitrary commands with SYSTEM privileges.,2023-12-28T17:15:08.980,https://cve.circl.lu/cve/CVE-2023-33225
CVE-2023-3622,1.4,Solarwinds, Access Control Bypass Vulnerability in the SolarWinds Platform that allows an underprivileged user to read arbitrary resource ,2023-12-28T17:15:09.333,https://cve.circl.lu/cve/CVE-2023-3622
CVE-2023-23840,5.9,Solarwinds,The SolarWinds Platform was susceptible to the Incorrect Comparison Vulnerability. This vulnerability allows users with administrative access to SolarWinds Web Console to execute arbitrary commands with NETWORK SERVICE privileges.,2023-12-28T17:15:08.677,https://cve.circl.lu/cve/CVE-2023-23840
CVE-2023-23845,5.9,Solarwinds,The SolarWinds Platform was susceptible to the Incorrect Comparison Vulnerability. This vulnerability allows users with administrative access to SolarWinds Web Console to execute arbitrary commands with NETWORK SERVICE privileges.,2023-12-28T17:15:08.827,https://cve.circl.lu/cve/CVE-2023-23845
CVE-2023-35185,5.9,Solarwinds,The SolarWinds Access Rights Manager was susceptible to a Directory Traversal Remote Code Vulnerability using SYSTEM privileges. ,2023-12-28T17:15:09.107,https://cve.circl.lu/cve/CVE-2023-35185
CVE-2023-34966,3.6,Samba,"An infinite loop vulnerability was found in Samba's mdssvc RPC service for Spotlight. When parsing Spotlight mdssvc RPC packets sent by the client, the core unmarshalling function sl_unpack_loop() did not validate a field in the network packet that contains the count of elements in an array-like structure. By passing 0 as the count value, the attacked function will run in an endless loop consuming 100% CPU. This flaw allows an attacker to issue a malformed RPC request, triggering an infinite loop, resulting in a denial of service condition.",2023-12-27T22:06:19.453,https://cve.circl.lu/cve/CVE-2023-34966
CVE-2023-34967,1.4,Samba,"A Type Confusion vulnerability was found in Samba's mdssvc RPC service for Spotlight. When parsing Spotlight mdssvc RPC packets, one encoded data structure is a key-value style dictionary where the keys are character strings, and the values can be any of the supported types in the mdssvc protocol. Due to a lack of type checking in callers of the dalloc_value_for_key() function, which returns the object associated with a key, a caller may trigger a crash in talloc_get_size() when talloc detects that the passed-in pointer is not a valid talloc pointer. With an RPC worker process shared among multiple client connections, a malicious client or attacker can trigger a process crash in a shared RPC mdssvc worker process, affecting all other clients this worker serves.",2023-12-27T22:06:24.227,https://cve.circl.lu/cve/CVE-2023-34967
CVE-2023-34968,1.4,Samba,"A path disclosure vulnerability was found in Samba. As part of the Spotlight protocol, Samba discloses the server-side absolute path of shares, files, and directories in the results for search queries. This flaw allows a malicious client or an attacker with a targeted RPC request to view the information that is part of the disclosed path.",2023-12-28T14:38:56.397,https://cve.circl.lu/cve/CVE-2023-34968
