CVE,"Impact Score (1-10, 10 being the worst)",Keyword,Description,Last Modified,Link
CVE-2021-24111,3.6,.NET Framework,.NET Framework Denial of Service Vulnerability,2023-12-29T17:15:58.967,https://cve.circl.lu/cve/CVE-2021-24111
CVE-2022-3697,3.6,Amazon,"A flaw was found in Ansible in the amazon.aws collection when using the tower_callback parameter from the amazon.aws.ec2_instance module. This flaw allows an attacker to take advantage of this issue as the module is handling the parameter insecurely, leading to the password leaking in the logs.",2023-12-28T19:15:14.283,https://cve.circl.lu/cve/CVE-2022-3697
CVE-2022-47502,5.9,Apache,"Apache OpenOffice documents can contain links that call internal macros with arbitrary arguments. Several URI Schemes are defined for this purpose.Links can be activated by clicks, or by automatic document events.The execution of such links must be subject to user approval.In the affected versions of OpenOffice, approval for certain links is not   requested; when activated, such links could therefore result in arbitrary script execution.",2023-12-28T21:15:07.767,https://cve.circl.lu/cve/CVE-2022-47502
CVE-2023-49070,5.9,Apache,Pre-auth RCE in Apache Ofbiz 18.12.09.It's due to XML-RPC no longer maintained still present.This issue affects Apache OFBiz: before 18.12.10. Users are recommended to upgrade to version 18.12.10,2023-12-29T18:15:39.103,https://cve.circl.lu/cve/CVE-2023-49070
CVE-2020-7121,3.6,Aruba,"Two memory corruption vulnerabilities in the Aruba CX Switches Series 6200F, 6300, 6400, 8320, 8325, and 8400 have been found. Successful exploitation of these vulnerabilities could result in Local Denial of Service of the LLDP (Link Layer Discovery Protocol) process in the switch. This applies to firmware versions prior to 10.04.3021.",2023-12-28T19:02:53.863,https://cve.circl.lu/cve/CVE-2020-7121
CVE-2020-7122,3.6,Aruba,"Two memory corruption vulnerabilities in the Aruba CX Switches Series 6200F, 6300, 6400, 8320, 8325, and 8400 have been found. Successful exploitation of these vulnerabilities could result in Local Denial of Service of the CDP (Cisco Discovery Protocol) process in the switch. This applies to firmware versions prior to 10.04.1000.",2023-12-28T19:02:53.863,https://cve.circl.lu/cve/CVE-2020-7122
CVE-2020-17135,2.7,Azure,Azure DevOps Server Spoofing Vulnerability,2023-12-30T00:15:15.223,https://cve.circl.lu/cve/CVE-2020-17135
CVE-2021-1677,3.6,Azure,Azure Active Directory Pod Identity Spoofing Vulnerability,2023-12-29T17:15:51.207,https://cve.circl.lu/cve/CVE-2021-1677
CVE-2021-24087,5.9,Azure,Azure IoT CLI extension Elevation of Privilege Vulnerability,2023-12-29T23:15:29.310,https://cve.circl.lu/cve/CVE-2021-24087
CVE-2021-24109,5.9,Azure,Microsoft Azure Kubernetes Service Elevation of Privilege Vulnerability,2023-12-29T17:15:58.583,https://cve.circl.lu/cve/CVE-2021-24109
CVE-2021-27074,3.6,Azure,Azure Sphere Unsigned Code Execution Vulnerability,2023-12-29T17:16:05.367,https://cve.circl.lu/cve/CVE-2021-27074
CVE-2021-1723,3.6,ASP.NET,ASP.NET Core and Visual Studio Denial of Service Vulnerability,2023-12-29T17:15:53.777,https://cve.circl.lu/cve/CVE-2021-1723
CVE-2021-34532,3.6,ASP.NET,ASP.NET Core and Visual Studio Information Disclosure Vulnerability,2023-12-28T20:15:49.673,https://cve.circl.lu/cve/CVE-2021-34532
CVE-2021-43877,6.0,ASP.NET,ASP.NET Core and Visual Studio Elevation of Privilege Vulnerability,2023-12-28T00:15:11.683,https://cve.circl.lu/cve/CVE-2021-43877
CVE-2021-36949,5.9,Active Directory,Microsoft Azure Active Directory Connect Authentication Bypass Vulnerability,2023-12-28T20:15:54.210,https://cve.circl.lu/cve/CVE-2021-36949
CVE-2021-42278,5.9,Active Directory,Active Directory Domain Services Elevation of Privilege Vulnerability,2023-12-28T16:15:55.160,https://cve.circl.lu/cve/CVE-2021-42278
CVE-2021-42282,5.9,Active Directory,Active Directory Domain Services Elevation of Privilege Vulnerability,2023-12-28T16:15:55.820,https://cve.circl.lu/cve/CVE-2021-42282
CVE-2021-42287,5.9,Active Directory,Active Directory Domain Services Elevation of Privilege Vulnerability,2023-12-28T16:15:56.857,https://cve.circl.lu/cve/CVE-2021-42287
CVE-2019-10206,3.6,Ansible,"ansible-playbook -k and ansible cli tools, all versions 2.8.x before 2.8.4, all 2.7.x before 2.7.13 and all 2.6.x before 2.6.19, prompt passwords by expanding them from templates as they could contain special characters. Passwords should be wrapped to prevent templates trigger and exposing them.",2023-12-28T19:15:12.027,https://cve.circl.lu/cve/CVE-2019-10206
CVE-2021-3447,3.6,Ansible,"A flaw was found in several ansible modules, where parameters containing credentials, such as secrets, were being logged in plain-text on managed nodes, as well as being made visible on the controller node when run in verbose mode. These parameters were not protected by the no_log feature. An attacker can take advantage of this information to steal those credentials, provided when they have access to the log files containing them. The highest threat from this vulnerability is to data confidentiality. This flaw affects Red Hat Ansible Automation Platform in versions before 1.2.2 and Ansible Tower in versions before 3.8.2.",2023-12-28T19:15:12.757,https://cve.circl.lu/cve/CVE-2021-3447
CVE-2021-20178,3.6,Ansible,A flaw was found in ansible module where credentials are disclosed in the console log by default and not protected by the security feature when using the bitbucket_pipeline_variable module. This flaw allows an attacker to steal bitbucket_pipeline credentials. The highest threat from this vulnerability is to confidentiality.,2023-12-28T19:15:12.310,https://cve.circl.lu/cve/CVE-2021-20178
CVE-2021-20191,3.6,Ansible,"A flaw was found in ansible. Credentials, such as secrets, are being disclosed in console log by default and not protected by no_log feature when using those modules. An attacker can take advantage of this information to steal those credentials. The highest threat from this vulnerability is to data confidentiality. Versions before ansible 2.9.18 are affected.",2023-12-28T19:15:12.460,https://cve.circl.lu/cve/CVE-2021-20191
CVE-2021-3583,5.2,Ansible,"A flaw was found in Ansible, where a user's controller is vulnerable to template injection. This issue can occur through facts used in the template if the user is trying to put templates in multi-line YAML strings and the facts being handled do not routinely include special template characters. This flaw allows attackers to perform command injection, which discloses sensitive information. The highest threat from this vulnerability is to confidentiality and integrity.",2023-12-28T19:15:12.917,https://cve.circl.lu/cve/CVE-2021-3583
CVE-2023-48050,5.9,Biometric,"SQL injection vulnerability in Cams Biometrics Zkteco, eSSL, Cams Biometrics Integration Module with HR Attendance (aka odoo-biometric-attendance) v. 13.0 through 16.0.1 allows a remote attacker to execute arbitrary code and to gain privileges via the db parameter in the controllers/controllers.py component.",2023-12-27T18:36:33.847,https://cve.circl.lu/cve/CVE-2023-48050
CVE-2021-38632,5.2,BitLocker,BitLocker Security Feature Bypass Vulnerability,2023-12-28T20:15:59.597,https://cve.circl.lu/cve/CVE-2021-38632
CVE-2021-36938,3.6,Cryptograph,Windows Cryptographic Primitives Library Information Disclosure Vulnerability,2023-12-28T20:15:52.390,https://cve.circl.lu/cve/CVE-2021-36938
CVE-2022-2127,3.6,Cryptograph,"An out-of-bounds read vulnerability was found in Samba due to insufficient length checks in winbindd_pam_auth_crap.c. When performing NTLM authentication, the client replies to cryptographic challenges back to the server. These replies have variable lengths, and Winbind fails to check the lan manager response length. When Winbind is used for NTLM authentication, a maliciously crafted request can trigger an out-of-bounds read in Winbind, possibly resulting in a crash.",2023-12-27T22:05:25.597,https://cve.circl.lu/cve/CVE-2022-2127
CVE-2023-40660,5.9,Cryptograph,"A flaw was found in OpenSC packages that allow a potential PIN bypass. When a token/card is authenticated by one process, it can perform cryptographic operations in other processes when an empty zero-length pin is passed. This issue poses a security risk, particularly for OS logon/screen unlock and for small, permanently connected tokens to computers. Additionally, the token can internally track login status. This flaw allows an attacker to gain unauthorized access, carry out malicious actions, or compromise the system without the user's awareness.",2023-12-23T05:15:08.743,https://cve.circl.lu/cve/CVE-2023-40660
CVE-2020-17147,5.8,CRM,Dynamics CRM Webclient Cross-site Scripting Vulnerability,2023-12-30T00:15:17.023,https://cve.circl.lu/cve/CVE-2020-17147
CVE-2021-1647,5.9,Defender,Microsoft Defender Remote Code Execution Vulnerability,2023-12-29T17:15:50.933,https://cve.circl.lu/cve/CVE-2021-1647
CVE-2021-24092,5.9,Defender,Microsoft Defender Elevation of Privilege Vulnerability,2023-12-29T17:15:57.120,https://cve.circl.lu/cve/CVE-2021-24092
CVE-2021-34522,5.9,Defender,Microsoft Defender Remote Code Execution Vulnerability,2023-12-28T23:15:40.847,https://cve.circl.lu/cve/CVE-2021-34522
CVE-2021-34464,5.9,Defender,Microsoft Defender Remote Code Execution Vulnerability,2023-12-28T23:15:30.860,https://cve.circl.lu/cve/CVE-2021-34464
CVE-2021-34471,5.9,Defender,Microsoft Windows Defender Elevation of Privilege Vulnerability,2023-12-28T20:15:47.707,https://cve.circl.lu/cve/CVE-2021-34471
CVE-2023-44277,5.9,Dell,"Dell PowerProtect DD, versions prior to 7.13.0.10, LTS 7.7.5.25, LTS 7.10.1.15, 6.2.1.110 contain an OS command injection vulnerability in the CLI. A local low privileged attacker could potentially exploit this vulnerability, leading to the execution of arbitrary OS commands on the application's underlying OS, with the privileges of the vulnerable application. Exploitation may lead to a system take over by an attacker. ",2023-12-27T19:33:29.213,https://cve.circl.lu/cve/CVE-2023-44277
CVE-2023-44278,5.9,Dell,"Dell PowerProtect DD , versions prior to 7.13.0.10, LTS 7.7.5.25, LTS 7.10.1.15, 6.2.1.110  contain a path traversal vulnerability. A local high privileged attacker could potentially exploit this vulnerability, to gain unauthorized read and write access to the OS files stored on the server filesystem, with the privileges of the running application. ",2023-12-27T19:32:20.107,https://cve.circl.lu/cve/CVE-2023-44278
CVE-2023-44279,5.9,Dell,"Dell PowerProtect DD , versions prior to 7.13.0.10,  LTS 7.7.5.25, LTS 7.10.1.15, 6.2.1.110 contain an OS command injection vulnerability in administrator CLI. A local high privileged attacker could potentially exploit this vulnerability, to bypass security restrictions. Exploitation may lead to a system take over by an attacker",2023-12-27T19:32:06.713,https://cve.circl.lu/cve/CVE-2023-44279
CVE-2023-44284,1.4,Dell,"Dell PowerProtect DD , versions prior to 7.13.0.10, LTS 7.7.5.25, LTS 7.10.1.15, 6.2.1.110 contain an SQL Injection vulnerability. A remote low privileged attacker could potentially exploit this vulnerability, leading to the execution of certain SQL commands on the application's backend database causing unauthorized read access to application data. ",2023-12-27T19:31:19.403,https://cve.circl.lu/cve/CVE-2023-44284
CVE-2023-44285,5.9,Dell,"Dell PowerProtect DD, versions prior to 7.13.0.10, LTS 7.7.5.25, LTS 7.10.1.15, 6.2.1.110 contain an improper access control vulnerability. A local malicious user with low privileges could potentially exploit this vulnerability leading to escalation of privilege.",2023-12-27T19:30:58.020,https://cve.circl.lu/cve/CVE-2023-44285
CVE-2023-45809,1.4,Django,"Wagtail is an open source content management system built on Django. A user with a limited-permission editor account for the Wagtail admin can make a direct URL request to the admin view that handles bulk actions on user accounts. While authentication rules prevent the user from making any changes, the error message discloses the display names of user accounts, and by modifying URL parameters, the user can retrieve the display name for any user. The vulnerability is not exploitable by an ordinary site visitor without access to the Wagtail admin. Patched versions have been released as Wagtail 4.1.8 (LTS), 5.0.5 and 5.1.3. The fix is also included in Release Candidate 1 of the forthcoming Wagtail 5.2 release. Users are advised to upgrade. There are no known workarounds for this vulnerability.",2023-12-28T18:58:51.657,https://cve.circl.lu/cve/CVE-2023-45809
CVE-2021-1645,3.6,Docker,Windows Docker Information Disclosure Vulnerability,2023-12-29T23:15:11.920,https://cve.circl.lu/cve/CVE-2021-1645
CVE-2020-17152,5.9,Dynamics 365,Microsoft Dynamics 365 for Finance and Operations (on-premises) Remote Code Execution Vulnerability,2023-12-30T00:15:17.433,https://cve.circl.lu/cve/CVE-2020-17152
CVE-2020-17158,5.9,Dynamics 365,Microsoft Dynamics 365 for Finance and Operations (on-premises) Remote Code Execution Vulnerability,2023-12-30T00:15:17.830,https://cve.circl.lu/cve/CVE-2020-17158
CVE-2021-34524,5.2,Dynamics 365,Microsoft Dynamics 365 On-Premises Remote Code Execution Vulnerability,2023-12-28T20:15:49.293,https://cve.circl.lu/cve/CVE-2021-34524
CVE-2021-36950,2.7,Dynamics 365,Microsoft Dynamics 365 (on-premises) Cross-site Scripting Vulnerability,2023-12-28T20:15:54.393,https://cve.circl.lu/cve/CVE-2021-36950
CVE-2021-40457,4.0,Dynamics 365,Microsoft Dynamics 365 Customer Engagement Cross-Site Scripting Vulnerability,2023-12-28T16:15:48.583,https://cve.circl.lu/cve/CVE-2021-40457
CVE-2021-1713,5.9,Excel,Microsoft Excel Remote Code Execution Vulnerability,2023-12-29T17:15:52.213,https://cve.circl.lu/cve/CVE-2021-1713
CVE-2021-1714,5.9,Excel,Microsoft Excel Remote Code Execution Vulnerability,2023-12-29T17:15:52.413,https://cve.circl.lu/cve/CVE-2021-1714
CVE-2021-24067,5.9,Excel,Microsoft Excel Remote Code Execution Vulnerability,2023-12-29T17:15:55.313,https://cve.circl.lu/cve/CVE-2021-24067
CVE-2021-24068,5.9,Excel,Microsoft Excel Remote Code Execution Vulnerability,2023-12-29T17:15:55.503,https://cve.circl.lu/cve/CVE-2021-24068
CVE-2021-24069,5.9,Excel,Microsoft Excel Remote Code Execution Vulnerability,2023-12-29T17:15:55.693,https://cve.circl.lu/cve/CVE-2021-24069
CVE-2020-17117,5.9,Exchange,Microsoft Exchange Remote Code Execution Vulnerability,2023-12-30T00:15:14.163,https://cve.circl.lu/cve/CVE-2020-17117
CVE-2020-17132,6.0,Exchange,Microsoft Exchange Remote Code Execution Vulnerability,2023-12-30T00:15:14.807,https://cve.circl.lu/cve/CVE-2020-17132
CVE-2020-17141,6.0,Exchange,Microsoft Exchange Remote Code Execution Vulnerability,2023-12-30T00:15:16.190,https://cve.circl.lu/cve/CVE-2020-17141
CVE-2020-17142,6.0,Exchange,Microsoft Exchange Remote Code Execution Vulnerability,2023-12-30T00:15:16.427,https://cve.circl.lu/cve/CVE-2020-17142
CVE-2020-17143,5.9,Exchange,Microsoft Exchange Server Information Disclosure Vulnerability,2023-12-30T00:15:16.620,https://cve.circl.lu/cve/CVE-2020-17143
CVE-2022-22995,5.9,Exploit,"The combination of primitives offered by SMB and AFP in their default configuration allows the arbitrary writing of files. By exploiting these combination of primitives, an attacker can execute arbitrary code.",2023-12-28T15:19:51.203,https://cve.circl.lu/cve/CVE-2022-22995
CVE-2022-29187,5.9,Exploit,"Git is a distributed revision control system. Git prior to versions 2.37.1, 2.36.2, 2.35.4, 2.34.4, 2.33.4, 2.32.3, 2.31.4, and 2.30.5, is vulnerable to privilege escalation in all platforms. An unsuspecting user could still be affected by the issue reported in CVE-2022-24765, for example when navigating as root into a shared tmp directory that is owned by them, but where an attacker could create a git repository. Versions 2.37.1, 2.36.2, 2.35.4, 2.34.4, 2.33.4, 2.32.3, 2.31.4, and 2.30.5 contain a patch for this issue. The simplest way to avoid being affected by the exploit described in the example is to avoid running git as root (or an Administrator in Windows), and if needed to reduce its use to a minimum. While a generic workaround is not possible, a system could be hardened from the exploit described in the example by removing any such repository if it exists already and creating one as root to block any future attacks.",2023-12-27T10:15:37.470,https://cve.circl.lu/cve/CVE-2022-29187
CVE-2022-3470,3.6,Exploit,A vulnerability was found in SourceCodester Human Resource Management System. It has been classified as critical. Affected is an unknown function of the file getstatecity.php. The manipulation of the argument sc leads to sql injection. It is possible to launch the attack remotely. The exploit has been disclosed to the public and may be used. VDB-210714 is the identifier assigned to this vulnerability.,2023-12-26T19:56:27.157,https://cve.circl.lu/cve/CVE-2022-3470
CVE-2021-27091,5.9,Endpoint,RPC Endpoint Mapper Service Elevation of Privilege Vulnerability,2023-12-29T20:16:00.400,https://cve.circl.lu/cve/CVE-2021-27091
CVE-2023-3655,3.6,Endpoint,"cashIT! - serving solutions. Devices from ""PoS/ Dienstleistung, Entwicklung & Vertrieb GmbH"" to 03.A06rks 2023.02.37 are affected by a dangerous methods, that allows to leak the database (system settings, user accounts,...). This vulnerability can be triggered by an HTTP endpoint exposed to the network.",2023-12-28T15:20:29.200,https://cve.circl.lu/cve/CVE-2023-3655
CVE-2023-3656,5.9,Endpoint,"cashIT! - serving solutions. Devices from ""PoS/ Dienstleistung, Entwicklung & Vertrieb GmbH"" to 03.A06rks 2023.02.37 are affected by an unauthenticated remote code execution vulnerability. This vulnerability can be triggered by an HTTP endpoint exposed to the network.",2023-12-28T15:20:34.697,https://cve.circl.lu/cve/CVE-2023-3656
CVE-2023-3654,5.9,Endpoint,"cashIT! - serving solutions. Devices from ""PoS/ Dienstleistung, Entwicklung & Vertrieb GmbH"" to 03.A06rks 2023.02.37 are affected by a origin bypass via the host header in an HTTP request. This vulnerability can be triggered by an HTTP endpoint exposed to the network.",2023-12-28T15:20:38.820,https://cve.circl.lu/cve/CVE-2023-3654
CVE-2023-46846,1.4,Firewall,"SQUID is vulnerable to HTTP request smuggling, caused by chunked decoder lenience, allows a remote attacker to perform Request/Response smuggling past firewall and frontend security systems.",2023-12-28T16:24:10.387,https://cve.circl.lu/cve/CVE-2023-46846
CVE-2023-4522,1.4,GitLab,An issue has been discovered in GitLab affecting all versions before 16.2.0. Committing directories containing LF character results in 500 errors when viewing the commit.,2023-12-28T14:50:15.647,https://cve.circl.lu/cve/CVE-2023-4522
CVE-2015-1239,3.6,Google,"Double free vulnerability in the j2k_read_ppm_v3 function in OpenJPEG before r2997, as used in PDFium in Google Chrome, allows remote attackers to cause a denial of service (process crash) via a crafted PDF.",2023-12-29T18:05:05.527,https://cve.circl.lu/cve/CVE-2015-1239
CVE-2022-4907,5.9,Google,Uninitialized Use in FFmpeg in Google Chrome prior to 108.0.5359.71 allowed a remote attacker to execute arbitrary code inside a sandbox via a crafted HTML page. (Chromium security severity: Medium),2023-12-28T15:39:50.990,https://cve.circl.lu/cve/CVE-2022-4907
CVE-2021-28470,5.9,GitHub,Visual Studio Code GitHub Pull Requests and Issues Extension Remote Code Execution Vulnerability,2023-12-29T01:15:41.797,https://cve.circl.lu/cve/CVE-2021-28470
CVE-2023-2426,3.6,GitHub,Use of Out-of-range Pointer Offset in GitHub repository vim/vim prior to 9.0.1499.,2023-12-23T07:15:49.433,https://cve.circl.lu/cve/CVE-2023-2426
CVE-2023-2609,3.6,GitHub,NULL Pointer Dereference in GitHub repository vim/vim prior to 9.0.1531.,2023-12-23T07:15:49.590,https://cve.circl.lu/cve/CVE-2023-2609
CVE-2023-2610,5.9,GitHub,Integer Overflow or Wraparound in GitHub repository vim/vim prior to 9.0.1532.,2023-12-23T07:15:49.740,https://cve.circl.lu/cve/CVE-2023-2610
CVE-2023-3515,2.7,GitHub,Open Redirect in GitHub repository go-gitea/gitea prior to 1.19.4.,2023-12-23T11:15:07.817,https://cve.circl.lu/cve/CVE-2023-3515
CVE-2023-5954,3.6,HashiCorp,"HashiCorp Vault and Vault Enterprise inbound client requests triggering a policy check can lead to an unbounded consumption of memory. A large number of these requests may lead to denial-of-service. Fixed in Vault 1.15.2, 1.14.6, and 1.13.10.",2023-12-27T15:15:45.790,https://cve.circl.lu/cve/CVE-2023-5954
CVE-2020-17095,6.0,Hyper-V,Windows Hyper-V Remote Code Execution Vulnerability,2023-12-30T00:15:12.957,https://cve.circl.lu/cve/CVE-2020-17095
CVE-2021-1691,4.0,Hyper-V,Windows Hyper-V Denial of Service Vulnerability,2023-12-29T23:15:22.037,https://cve.circl.lu/cve/CVE-2021-1691
CVE-2021-1692,4.0,Hyper-V,Windows Hyper-V Denial of Service Vulnerability,2023-12-29T23:15:22.237,https://cve.circl.lu/cve/CVE-2021-1692
CVE-2021-1704,5.9,Hyper-V,Windows Hyper-V Elevation of Privilege Vulnerability,2023-12-29T23:15:24.577,https://cve.circl.lu/cve/CVE-2021-1704
CVE-2021-26867,6.0,Hyper-V,Windows Hyper-V Remote Code Execution Vulnerability,2023-12-29T20:15:51.500,https://cve.circl.lu/cve/CVE-2021-26867
CVE-2023-49298,3.6,IBM,"OpenZFS through 2.1.13 and 2.2.x through 2.2.1, in certain scenarios involving applications that try to rely on efficient copying of file data, can replace file contents with zero-valued bytes and thus potentially disable security mechanisms. NOTE: this issue is not always security related, but can be security related in realistic situations. A possible example is cp, from a recent GNU Core Utilities (coreutils) version, when attempting to preserve a rule set for denying unauthorized access. (One might use cp when configuring access control, such as with the /etc/hosts.deny file specified in the IBM Support reference.) NOTE: this issue occurs less often in version 2.2.1, and in versions before 2.1.4, because of the default configuration in those versions.",2023-12-26T15:15:08.420,https://cve.circl.lu/cve/CVE-2023-49298
CVE-2021-41365,5.9,IoT,Microsoft Defender for IoT Remote Code Execution Vulnerability,2023-12-28T00:15:08.970,https://cve.circl.lu/cve/CVE-2021-41365
CVE-2021-42310,5.9,IoT,Microsoft Defender for IoT Remote Code Execution Vulnerability,2023-12-28T00:15:09.290,https://cve.circl.lu/cve/CVE-2021-42310
CVE-2021-42311,6.0,IoT,Microsoft Defender for IoT Remote Code Execution Vulnerability,2023-12-28T00:15:09.373,https://cve.circl.lu/cve/CVE-2021-42311
CVE-2021-42313,6.0,IoT,Microsoft Defender for IoT Remote Code Execution Vulnerability,2023-12-28T00:15:09.590,https://cve.circl.lu/cve/CVE-2021-42313
CVE-2021-31980,5.9,InTune,Microsoft Intune Management Extension Remote Code Execution Vulnerability,2023-12-28T23:15:15.170,https://cve.circl.lu/cve/CVE-2021-31980
CVE-2021-41363,2.7,InTune,Intune Management Extension Security Feature Bypass Vulnerability,2023-12-28T16:15:50.900,https://cve.circl.lu/cve/CVE-2021-41363
CVE-2021-40448,4.0,Insight,Microsoft Accessibility Insights for Android Information Disclosure Vulnerability,2023-12-28T20:16:06.993,https://cve.circl.lu/cve/CVE-2021-40448
CVE-2018-8729,2.7,Java,Multiple cross-site scripting (XSS) vulnerabilities in the Activity Log plugin before 2.4.1 for WordPress allow remote attackers to inject arbitrary JavaScript or HTML via a title that is not escaped.,2023-12-26T19:56:27.157,https://cve.circl.lu/cve/CVE-2018-8729
CVE-2020-17159,5.9,Java,Visual Studio Code Java Extension Pack Remote Code Execution Vulnerability,2023-12-30T00:15:18.027,https://cve.circl.lu/cve/CVE-2020-17159
CVE-2021-27084,5.9,Java,Visual Studio Code Java Extension Pack Remote Code Execution Vulnerability,2023-12-29T17:16:06.947,https://cve.circl.lu/cve/CVE-2021-27084
CVE-2021-28472,5.9,Java,Visual Studio Code Maven for Java Extension Remote Code Execution Vulnerability,2023-12-29T01:15:42.177,https://cve.circl.lu/cve/CVE-2021-28472
CVE-2023-38703,5.9,Java,"PJSIP is a free and open source multimedia communication library written in C with high level API in C, C++, Java, C#, and Python languages. SRTP is a higher level media transport which is stacked upon a lower level media transport such as UDP and ICE. Currently a higher level transport is not synchronized with its lower level transport that may introduce use-after-free issue. This vulnerability affects applications that have SRTP capability (`PJMEDIA_HAS_SRTP` is set) and use underlying media transport other than UDP. This vulnerability’s impact may range from unexpected application termination to control flow hijack/memory corruption. The patch is available as a commit in the master branch.",2023-12-29T00:15:49.813,https://cve.circl.lu/cve/CVE-2023-38703
CVE-2021-21655,4.2,Jenkins,A cross-site request forgery (CSRF) vulnerability in Jenkins P4 Plugin 1.11.4 and earlier allows attackers to connect to an attacker-specified Perforce server using attacker-specified username and password.,2023-12-27T22:00:26.347,https://cve.circl.lu/cve/CVE-2021-21655
CVE-2021-21675,3.6,Jenkins,A cross-site request forgery (CSRF) vulnerability in Jenkins requests-plugin Plugin 2.2.12 and earlier allows attackers to create requests and/or have administrators apply pending requests.,2023-12-27T22:03:24.467,https://cve.circl.lu/cve/CVE-2021-21675
CVE-2023-44286,2.7,JavaScript,"Dell PowerProtect DD , versions prior to 7.13.0.10, LTS 7.7.5.25, LTS 7.10.1.15, 6.2.1.110 contain a DOM-based Cross-Site Scripting vulnerability. A remote unauthenticated attacker could potentially exploit this vulnerability, leading to the injection of malicious HTML or JavaScript code to a victim user's DOM environment in the browser. .  Exploitation may lead to information disclosure, session theft, or client-side request forgery. ",2023-12-27T19:30:23.780,https://cve.circl.lu/cve/CVE-2023-44286
