CVE,"Impact Score (1-10, 10 being the worst)",Keyword,Description,Last Modified,Link
CVE-2020-1496,5.9,Excel,"<p>A remote code execution vulnerability exists in Microsoft Excel software when the software fails to properly handle objects in memory. An attacker who successfully exploited the vulnerability could run arbitrary code in the context of the current user. If the current user is logged on with administrative user rights, an attacker could take control of the affected system. An attacker could then install programs; view, change, or delete data; or create new accounts with full user rights. Users whose accounts are configured to have fewer user rights on the system could be less impacted than users who operate with administrative user rights.</p><p>Exploitation of the vulnerability requires that a user open a specially crafted file with an affected version of Microsoft Excel. In an email attack scenario, an attacker could exploit the vulnerability by sending the specially crafted file to the user and convincing the user to open the file. In a web-based attack scenario, an attacker could host a website (or leverage a compromised website that accepts or hosts user-provided content) containing a specially crafted file designed to exploit the vulnerability. An attacker would have no way to force users to visit the website. Instead, an attacker would have to convince users to click a link, typically by way of an enticement in an email or instant message, and then convince them to open the specially crafted file.</p><p>The security update addresses the vulnerability by correcting how Microsoft Excel handles objects in memory.</p>",2024-01-04T02:15:15.290,https://cve.circl.lu/cve/CVE-2020-1496
CVE-2020-1497,3.6,Excel,"<p>An information disclosure vulnerability exists when Microsoft Excel improperly discloses the contents of its memory. An attacker who exploited the vulnerability could use the information to compromise the user’s computer or data.</p><p>To exploit the vulnerability, an attacker could craft a special document file and then convince the user to open it. An attacker must know the memory address location where the object was created.</p><p>The update addresses the vulnerability by changing the way certain Excel functions handle objects in memory.</p>",2024-01-04T02:15:15.367,https://cve.circl.lu/cve/CVE-2020-1497
CVE-2020-1498,5.9,Excel,"<p>A remote code execution vulnerability exists in Microsoft Excel software when the software fails to properly handle objects in memory. An attacker who successfully exploited the vulnerability could run arbitrary code in the context of the current user. If the current user is logged on with administrative user rights, an attacker could take control of the affected system. An attacker could then install programs; view, change, or delete data; or create new accounts with full user rights. Users whose accounts are configured to have fewer user rights on the system could be less impacted than users who operate with administrative user rights.</p><p>Exploitation of the vulnerability requires that a user open a specially crafted file with an affected version of Microsoft Excel. In an email attack scenario, an attacker could exploit the vulnerability by sending the specially crafted file to the user and convincing the user to open the file. In a web-based attack scenario, an attacker could host a website (or leverage a compromised website that accepts or hosts user-provided content) containing a specially crafted file designed to exploit the vulnerability. An attacker would have no way to force users to visit the website. Instead, an attacker would have to convince users to click a link, typically by way of an enticement in an email or instant message, and then convince them to open the specially crafted file.</p><p>The security update addresses the vulnerability by correcting how Microsoft Excel handles objects in memory.</p>",2024-01-04T02:15:15.440,https://cve.circl.lu/cve/CVE-2020-1498
CVE-2020-16875,6.0,Exchange,<p>A remote code execution vulnerability exists in Microsoft Exchange server due to improper validation of cmdlet arguments.</p><p>An attacker who successfully exploited the vulnerability could run arbitrary code in the context of the System user. Exploitation of the vulnerability requires an authenticated user in a certain Exchange role to be compromised.</p><p>The security update addresses the vulnerability by correcting how Microsoft Exchange handles cmdlet arguments.</p>,2023-12-31T22:15:52.447,https://cve.circl.lu/cve/CVE-2020-16875
CVE-2020-16969,3.7,Exchange,"<p>An information disclosure vulnerability exists in how Microsoft Exchange validates tokens when handling certain messages. An attacker who successfully exploited the vulnerability could use this to gain further information from a user.</p><p>To exploit the vulnerability, an attacker could include specially crafted OWA messages that could be loaded, without warning or filtering, from the attacker-controlled URL. This callback vector provides an information disclosure tactic used in web beacons and other types of tracking systems.</p><p>The security update corrects the way that Exchange handles these token validations.</p>",2023-12-31T20:15:59.407,https://cve.circl.lu/cve/CVE-2020-16969
CVE-2020-17083,3.7,Exchange,Microsoft Exchange Server Remote Code Execution Vulnerability,2023-12-31T19:15:28.283,https://cve.circl.lu/cve/CVE-2020-17083
CVE-2020-17084,6.0,Exchange,Microsoft Exchange Server Remote Code Execution Vulnerability,2023-12-31T19:15:28.470,https://cve.circl.lu/cve/CVE-2020-17084
CVE-2020-17085,5.5,Exchange,Microsoft Exchange Server Denial of Service Vulnerability,2023-12-31T19:15:28.650,https://cve.circl.lu/cve/CVE-2020-17085
CVE-2020-1470,5.9,Exploit,"<p>An elevation of privilege vulnerability exists when the Windows Work Folders Service improperly handles memory.</p><p>To exploit this vulnerability, an attacker would first have to gain execution on the victim system. An attacker could then run a specially crafted application to elevate privileges.</p><p>The security update addresses the vulnerability by correcting how the Windows Work Folders Service handles memory.</p>",2024-01-04T02:15:11.820,https://cve.circl.lu/cve/CVE-2020-1470
CVE-2020-1484,5.9,Exploit,"<p>An elevation of privilege vulnerability exists when the Windows Work Folders Service improperly handles memory.</p><p>To exploit this vulnerability, an attacker would first have to gain execution on the victim system. An attacker could then run a specially crafted application to elevate privileges.</p><p>The security update addresses the vulnerability by correcting how the Windows Work Folders Service handles memory.</p>",2024-01-04T02:15:13.837,https://cve.circl.lu/cve/CVE-2020-1484
CVE-2020-1488,5.9,Exploit,"<p>An elevation of privilege vulnerability exists when the Windows AppX Deployment Extensions improperly performs privilege management, resulting in access to system files.</p><p>To exploit this vulnerability, an authenticated attacker would need to run a specially crafted application to elevate privileges.</p><p>The security update addresses the vulnerability by correcting how AppX Deployment Extensions manages privileges.</p>",2024-01-04T02:15:14.507,https://cve.circl.lu/cve/CVE-2020-1488
CVE-2020-1489,5.9,Exploit,"<p>An elevation of privilege vulnerability exists when the Windows CSC Service improperly handles memory.</p><p>To exploit this vulnerability, an attacker would first have to gain execution on the victim system. An attacker could then run a specially crafted application to elevate privileges.</p><p>The security update addresses the vulnerability by correcting how the Windows CSC Service handles memory.</p>",2024-01-04T02:15:14.693,https://cve.circl.lu/cve/CVE-2020-1489
CVE-2020-1513,5.9,Exploit,"<p>An elevation of privilege vulnerability exists when the Windows CSC Service improperly handles memory.</p><p>To exploit this vulnerability, an attacker would first have to gain execution on the victim system. An attacker could then run a specially crafted application to elevate privileges.</p><p>The security update addresses the vulnerability by correcting how the Windows CSC Service handles memory.</p>",2024-01-04T02:15:17.200,https://cve.circl.lu/cve/CVE-2020-1513
CVE-2021-45967,5.9,Endpoint,"An issue was discovered in Pascom Cloud Phone System before 7.20.x. A configuration error between NGINX and a backend Tomcat server leads to a path traversal in the Tomcat server, exposing unintended endpoints.",2024-01-03T18:55:26.920,https://cve.circl.lu/cve/CVE-2021-45967
CVE-2022-25153,5.9,Endpoint,"The ITarian Endpoint Manage Communication Client, prior to version 6.43.41148.21120, is compiled using insecure OpenSSL settings. Due to this setting, a malicious actor with low privileges access to a system can escalate his privileges to SYSTEM abusing an insecure openssl.conf lookup.",2024-01-02T19:15:09.293,https://cve.circl.lu/cve/CVE-2022-25153
CVE-2022-45052,3.6,Endpoint,"A Local File Inclusion vulnerability has been found in Axiell Iguana CMS. Due to insufficient neutralisation of user input on the url parameter on the Proxy.type.php endpoint, external users are capable of accessing files on the server.",2024-01-02T19:15:10.030,https://cve.circl.lu/cve/CVE-2022-45052
CVE-2019-15592,1.4,GitLab,GitLab 12.2.2 and below contains a security vulnerability that allows a guest user in a private project to see the merge request ID associated to an issue via the activity timeline.,2024-01-03T18:55:45.153,https://cve.circl.lu/cve/CVE-2019-15592
CVE-2023-6051,3.6,GitLab,"An issue has been discovered in GitLab CE/EE affecting all versions before 16.4.4, all versions starting from 16.5 before 16.5.4, all versions starting from 16.6 before 16.6.2. File integrity may be compromised when source code or installation packages are pulled from a specific tag.",2024-01-02T09:15:07.310,https://cve.circl.lu/cve/CVE-2023-6051
CVE-2023-6348,5.9,Google,Type Confusion in Spellcheck in Google Chrome prior to 119.0.6045.199 allowed a remote attacker who had compromised the renderer process to potentially exploit heap corruption via a crafted HTML page. (Chromium security severity: High),2024-01-03T17:15:11.823,https://cve.circl.lu/cve/CVE-2023-6348
CVE-2020-0890,4.0,Hyper-V,"<p>A denial of service vulnerability exists when Microsoft Hyper-V on a host server fails to properly validate specific malicious data from a user on a guest operating system.</p><p>To exploit the vulnerability, an attacker who already has a privileged account on a guest operating system, running as a virtual machine, could run a specially crafted application.</p><p>The security update addresses the vulnerability by resolving the conditions where Hyper-V would fail to handle these requests.</p>",2023-12-31T22:15:46.697,https://cve.circl.lu/cve/CVE-2020-0890
CVE-2020-0904,4.0,Hyper-V,"<p>A denial of service vulnerability exists when Microsoft Hyper-V on a host server fails to properly validate specific malicious data from a user on a guest operating system.</p><p>To exploit the vulnerability, an attacker who already has a privileged account on a guest operating system, running as a virtual machine, could run a specially crafted application.</p><p>The security update addresses the vulnerability by resolving the conditions where Hyper-V would fail to handle these requests.</p>",2023-12-31T22:15:46.877,https://cve.circl.lu/cve/CVE-2020-0904
CVE-2020-16891,6.0,Hyper-V,"<p>A remote code execution vulnerability exists when Windows Hyper-V on a host server fails to properly validate input from an authenticated user on a guest operating system. To exploit the vulnerability, an attacker could run a specially crafted application on a guest operating system that could cause the Hyper-V host operating system to execute arbitrary code.</p><p>An attacker who successfully exploited the vulnerability could execute arbitrary code on the host operating system.</p><p>The security update addresses the vulnerability by correcting how Hyper-V validates guest operating system user input.</p>",2023-12-31T20:15:47.797,https://cve.circl.lu/cve/CVE-2020-16891
CVE-2020-1047,5.9,Hyper-V,"<p>An elevation of privilege vulnerability exists when Windows Hyper-V on a host server fails to properly handle objects in memory. An attacker who successfully exploited these vulnerabilities could gain elevated privileges on a target operating system.</p><p>This vulnerability by itself does not allow arbitrary code to be run.  However, this vulnerability could be used in conjunction with one or more vulnerabilities (e.g. a remote code execution vulnerability and another elevation of privilege) that could take advantage of the elevated privileges when running.</p><p>The update addresses the vulnerabilities by correcting how Windows Hyper-V handles objects in memory.</p>",2023-12-31T20:16:01.757,https://cve.circl.lu/cve/CVE-2020-1047
CVE-2020-1080,6.0,Hyper-V,"<p>An elevation of privilege vulnerability exists when Windows Hyper-V on a host server fails to properly handle objects in memory. An attacker who successfully exploited these vulnerabilities could gain elevated privileges on a target operating system.</p><p>This vulnerability by itself does not allow arbitrary code to be run.  However, this vulnerability could be used in conjunction with one or more vulnerabilities (e.g. a remote code execution vulnerability and another elevation of privilege) that could take advantage of the elevated privileges when running.</p><p>The update addresses the vulnerabilities by correcting how Windows Hyper-V handles objects in memory.</p>",2023-12-31T20:16:02.003,https://cve.circl.lu/cve/CVE-2020-1080
CVE-2020-16971,5.2,Java,Azure SDK for Java Security Feature Bypass Vulnerability,2023-12-31T18:15:46.853,https://cve.circl.lu/cve/CVE-2020-16971
CVE-2023-40397,5.9,Java,The issue was addressed with improved checks. This issue is fixed in macOS Ventura 13.5. A remote attacker may be able to cause arbitrary javascript code execution.,2024-01-05T14:15:47.920,https://cve.circl.lu/cve/CVE-2023-40397
CVE-2023-40338,1.4,Jenkins,"Jenkins Folders Plugin 6.846.v23698686f0f6 and earlier displays an error message that includes an absolute path of a log file when attempting to access the Scan Organization Folder Log if no logs are available, exposing information about the Jenkins controller file system.",2024-01-02T19:53:57.583,https://cve.circl.lu/cve/CVE-2023-40338
CVE-2023-5408,5.9,Kubernetes,A privilege escalation flaw was found in the node restriction admission plugin of the kubernetes api server of OpenShift. A remote attacker who modifies the node role label could steer workloads from the control plane and etcd nodes onto different worker nodes and gain broader access to the cluster.,2023-12-30T12:15:43.933,https://cve.circl.lu/cve/CVE-2023-5408
CVE-2023-40238,3.6,Lenovo,"A LogoFAIL issue was discovered in BmpDecoderDxe in Insyde InsydeH2O with kernel 5.2 before 05.28.47, 5.3 before 05.37.47, 5.4 before 05.45.47, 5.5 before 05.53.47, and 5.6 before 05.60.47 for certain Lenovo devices. Image parsing of crafted BMP logo files can copy data to a specific address during the DXE phase of UEFI execution. This occurs because of an integer signedness error involving PixelHeight and PixelWidth during RLE4/RLE8 compression.",2024-01-05T18:15:29.060,https://cve.circl.lu/cve/CVE-2023-40238
CVE-2020-16995,5.9,Linux,"<p>An elevation of privilege vulnerability exists in Network Watcher Agent virtual machine extension for Linux. An attacker who successfully exploited this vulnerability could execute code with elevated privileges.</p><p>To exploit this vulnerability, an attacker would have to be present as a user on the affected virtual machine.</p><p>The security update addresses this vulnerability by correcting how Network Watcher Agent virtual machine extension for Linux executes with elevated privileges.</p>",2023-12-31T20:16:01.050,https://cve.circl.lu/cve/CVE-2020-16995
CVE-2023-33952,5.9,Linux,"A double-free vulnerability was found in handling vmw_buffer_object objects in the vmwgfx driver in the Linux kernel. This issue occurs due to the lack of validating the existence of an object prior to performing further free operations on the object, which may allow a local privileged user to escalate privileges and execute code in the context of the kernel.",2024-01-04T20:15:24.550,https://cve.circl.lu/cve/CVE-2023-33952
CVE-2023-3812,5.9,Linux,An out-of-bounds memory access flaw was found in the Linux kernel’s TUN/TAP device driver functionality in how a user generates a malicious (too big) networking packet when napi frags is enabled. This flaw allows a local user to crash or potentially escalate their privileges on the system.,2024-01-03T06:15:46.847,https://cve.circl.lu/cve/CVE-2023-3812
CVE-2023-45871,5.9,Linux,An issue was discovered in drivers/net/ethernet/intel/igb/igb_main.c in the IGB driver in the Linux kernel before 6.5.3. A buffer size may not be adequate for frames larger than the MTU.,2024-01-04T18:04:09.773,https://cve.circl.lu/cve/CVE-2023-45871
CVE-2023-40791,5.2,Linux,"extract_user_to_sg in lib/scatterlist.c in the Linux kernel before 6.4.12 fails to unpin pages in a certain situation, as demonstrated by a WARNING for try_grab_page.",2024-01-04T19:08:57.303,https://cve.circl.lu/cve/CVE-2023-40791
CVE-2020-1455,3.4,Management,"<p>A denial of service vulnerability exists when Microsoft SQL Server Management Studio (SSMS) improperly handles files. An attacker could exploit the vulnerability to trigger a denial of service.</p><p>To exploit the vulnerability, an attacker would first require execution on the victim system.</p><p>The security update addresses the vulnerability by ensuring Microsoft SQL Server Management Studio properly handles files.</p>",2024-01-04T02:15:10.823,https://cve.circl.lu/cve/CVE-2020-1455
CVE-2020-1475,5.9,Management,"<p>An elevation of privilege vulnerability exists in the way that the srmsvc.dll handles objects in memory. An attacker who successfully exploited the vulnerability could execute code with elevated permissions.</p><p>To exploit the vulnerability, a locally authenticated attacker could run a specially crafted application.</p><p>The security update addresses the vulnerability by ensuring the srmsvc.dll properly handles objects in memory.</p>",2024-01-04T02:15:12.683,https://cve.circl.lu/cve/CVE-2020-1475
CVE-2020-1517,5.9,Management,"<p>An elevation of privilege vulnerability exists when the Windows File Server Resource Management Service improperly handles memory.</p><p>To exploit this vulnerability, an attacker would first have to gain execution on the victim system. An attacker could then run a specially crafted application to elevate privileges.</p><p>The security update addresses the vulnerability by correcting how the Windows File Server Resource Management Service handles memory.</p>",2024-01-04T02:15:17.827,https://cve.circl.lu/cve/CVE-2020-1517
CVE-2020-1518,5.9,Management,"<p>An elevation of privilege vulnerability exists when the Windows File Server Resource Management Service improperly handles memory.</p><p>To exploit this vulnerability, an attacker would first have to gain execution on the victim system. An attacker could then run a specially crafted application to elevate privileges.</p><p>The security update addresses the vulnerability by correcting how the Windows File Server Resource Management Service handles memory.</p>",2024-01-04T02:15:18.037,https://cve.circl.lu/cve/CVE-2020-1518
CVE-2020-1483,3.6,Microsoft,"<p>A remote code execution vulnerability exists in Microsoft Outlook when the software fails to properly handle objects in memory. An attacker who successfully exploited the vulnerability could run arbitrary code in the context of the current user. If the current user is logged on with administrative user rights, an attacker could take control of the affected system. An attacker could then install programs; view, change, or delete data; or create new accounts with full user rights. Users whose accounts are configured to have fewer user rights on the system could be less impacted than users who operate with administrative user rights.</p><p>Exploitation of the vulnerability requires that a user open a specially crafted file with an affected version of Microsoft Outlook software. In an email attack scenario, an attacker could exploit the vulnerability by sending the specially crafted file to the user and convincing the user to open the file. In a web-based attack scenario, an attacker could host a website (or leverage a compromised website that accepts or hosts user-provided content) that contains a specially crafted file designed to exploit the vulnerability. An attacker would have no way to force users to visit the website. Instead, an attacker would have to convince users to click a link, typically by way of an enticement in an email or instant message, and then convince them to open the specially crafted file.</p><p>Note that where severity is indicated as Critical in the Affected Products table, the Preview Pane is an attack vector.</p><p>The security update addresses the vulnerability by correcting how Outlook handles objects in memory.</p>",2024-01-04T02:15:13.657,https://cve.circl.lu/cve/CVE-2020-1483
CVE-2023-24805,5.9,MacOS,"cups-filters contains backends, filters, and other software required to get the cups printing service working on operating systems other than macos. If you use the Backend Error Handler (beh) to create an accessible network printer, this security vulnerability can cause remote code execution. `beh.c` contains the line `retval = system(cmdline) >> 8;` which calls the `system` command with the operand `cmdline`. `cmdline` contains multiple user controlled, unsanitized values. As a result an attacker with network access to the hosted print server can exploit this vulnerability to inject system commands which are executed in the context of the running server. This issue has been addressed in commit `8f2740357` and is expected to be bundled in the next release. Users are advised to upgrade when possible and to restrict access to network printers in the meantime.",2024-01-05T16:15:44.550,https://cve.circl.lu/cve/CVE-2023-24805
CVE-2021-22931,5.9,Node.js,"Node.js before 16.6.0, 14.17.4, and 12.22.4 is vulnerable to Remote Code Execution, XSS, Application crashes due to missing input validation of host names returned by Domain Name Servers in Node.js dns library which can lead to output of wrong hostnames (leading to Domain Hijacking) and injection vulnerabilities in applications using the library.",2024-01-05T10:15:09.183,https://cve.circl.lu/cve/CVE-2021-22931
CVE-2021-22939,1.4,Node.js,"If the Node.js https API was used incorrectly and ""undefined"" was in passed for the ""rejectUnauthorized"" parameter, no error was returned and connections to servers with an expired certificate would have been accepted.",2024-01-05T10:15:09.860,https://cve.circl.lu/cve/CVE-2021-22939
CVE-2021-22940,3.6,Node.js,"Node.js before 16.6.1, 14.17.5, and 12.22.5 is vulnerable to a use after free attack where an attacker might be able to exploit the memory corruption, to change process behavior.",2024-01-05T10:15:10.103,https://cve.circl.lu/cve/CVE-2021-22940
CVE-2021-22930,5.9,Node.js,"Node.js before 16.6.0, 14.17.4, and 12.22.4 is vulnerable to a use after free attack where an attacker might be able to exploit the memory corruption, to change process behavior.",2024-01-05T10:15:07.943,https://cve.circl.lu/cve/CVE-2021-22930
CVE-2023-49936,3.6,NULL Pointer,"An issue was discovered in SchedMD Slurm 22.05.x, 23.02.x, and 23.11.x. A NULL pointer dereference leads to denial of service. The fixed versions are 22.05.11, 23.02.7, and 23.11.1.",2024-01-03T03:15:09.927,https://cve.circl.lu/cve/CVE-2023-49936
CVE-2020-1493,3.6,Outlook,"<p>An information disclosure vulnerability exists when attaching files to Outlook messages. This vulnerability could potentially allow users to share attached files such that they are accessible by anonymous users where they should be restricted to specific users.</p><p>To exploit this vulnerability, an attacker would have to attach a file as a link to an email. The email could then be shared with individuals that should not have access to the files, ignoring the default organizational setting.</p><p>The security update addresses the vulnerability by correcting how Outlook handles file attachment links.</p>",2024-01-04T02:15:15.050,https://cve.circl.lu/cve/CVE-2020-1493
