CVE,"Impact Score (1-10, 10 being the worst)",Keyword,Description,Last Modified,Link
CVE-2023-28841,4.0,Cryptograph,"Moby is an open source container framework developed by Docker Inc. that is distributed as Docker, Mirantis Container Runtime, and various other downstream projects/products. The Moby daemon component (`dockerd`), which is developed as moby/moby is commonly referred to as *Docker*.Swarm Mode, which is compiled in and delivered by default in `dockerd` and is thus present in most major Moby downstreams, is a simple, built-in container orchestrator that is implemented through a combination of SwarmKit and supporting network code.The `overlay` network driver is a core feature of Swarm Mode, providing isolated virtual LANs that allow communication between containers and services across the cluster. This driver is an implementation/user of VXLAN, which encapsulates link-layer (Ethernet) frames in UDP datagrams that tag the frame with the VXLAN metadata, including a VXLAN Network ID (VNI) that identifies the originating overlay network. In addition, the overlay network driver supports an optional, off-by-default encrypted mode, which is especially useful when VXLAN packets traverses an untrusted network between nodes.Encrypted overlay networks function by encapsulating the VXLAN datagrams through the use of the IPsec Encapsulating Security Payload protocol in Transport mode. By deploying IPSec encapsulation, encrypted overlay networks gain the additional properties of source authentication through cryptographic proof, data integrity through check-summing, and confidentiality through encryption.When setting an endpoint up on an encrypted overlay network, Moby installs three iptables (Linux kernel firewall) rules that enforce both incoming and outgoing IPSec. These rules rely on the `u32` iptables extension provided by the `xt_u32` kernel module to directly filter on a VXLAN packet's VNI field, so that IPSec guarantees can be enforced on encrypted overlay networks without interfering with other overlay networks or other users of VXLAN.An iptables rule designates outgoing VXLAN datagrams with a VNI that corresponds to an encrypted overlay network for IPsec encapsulation.Encrypted overlay networks on affected platforms silently transmit unencrypted data. As a result, `overlay` networks may appear to be functional, passing traffic as expected, but without any of the expected confidentiality or data integrity guarantees.It is possible for an attacker sitting in a trusted position on the network to read all of the application traffic that is moving across the overlay network, resulting in unexpected secrets or user data disclosure. Thus, because many database protocols, internal APIs, etc. are not protected by a second layer of encryption, a user may use Swarm encrypted overlay networks to provide confidentiality, which due to this vulnerability this is no longer guaranteed.Patches are available in Moby releases 23.0.3, and 20.10.24. As Mirantis Container Runtime's 20.10 releases are numbered differently, users of that platform should update to 20.10.16.Some workarounds are available. Close the VXLAN port (by default, UDP port 4789) to outgoing traffic at the Internet boundary in order to prevent unintentionally leaking unencrypted traffic over the Internet, and/or ensure that the `xt_u32` kernel module is available on all nodes of the Swarm cluster.",2023-09-05T03:15:10.997,https://cve.circl.lu/cve/CVE-2023-28841
CVE-2023-28842,4.0,Cryptograph,"Moby) is an open source container framework developed by Docker Inc. that is distributed as Docker, Mirantis Container Runtime, and various other downstream projects/products. The Moby daemon component (`dockerd`), which is developed as moby/moby is commonly referred to as *Docker*.Swarm Mode, which is compiled in and delivered by default in `dockerd` and is thus present in most major Moby downstreams, is a simple, built-in container orchestrator that is implemented through a combination of SwarmKit and supporting network code.The `overlay` network driver is a core feature of Swarm Mode, providing isolated virtual LANs that allow communication between containers and services across the cluster. This driver is an implementation/user of VXLAN, which encapsulates link-layer (Ethernet) frames in UDP datagrams that tag the frame with the VXLAN metadata, including a VXLAN Network ID (VNI) that identifies the originating overlay network. In addition, the overlay network driver supports an optional, off-by-default encrypted mode, which is especially useful when VXLAN packets traverses an untrusted network between nodes.Encrypted overlay networks function by encapsulating the VXLAN datagrams through the use of the IPsec Encapsulating Security Payload protocol in Transport mode. By deploying IPSec encapsulation, encrypted overlay networks gain the additional properties of source authentication through cryptographic proof, data integrity through check-summing, and confidentiality through encryption.When setting an endpoint up on an encrypted overlay network, Moby installs three iptables (Linux kernel firewall) rules that enforce both incoming and outgoing IPSec. These rules rely on the `u32` iptables extension provided by the `xt_u32` kernel module to directly filter on a VXLAN packet's VNI field, so that IPSec guarantees can be enforced on encrypted overlay networks without interfering with other overlay networks or other users of VXLAN.The `overlay` driver dynamically and lazily defines the kernel configuration for the VXLAN network on each node as containers are attached and detached. Routes and encryption parameters are only defined for destination nodes that participate in the network. The iptables rules that prevent encrypted overlay networks from accepting unencrypted packets are not created until a peer is available with which to communicate.Encrypted overlay networks silently accept cleartext VXLAN datagrams that are tagged with the VNI of an encrypted overlay network. As a result, it is possible to inject arbitrary Ethernet frames into the encrypted overlay network by encapsulating them in VXLAN datagrams. The implications of this can be quite dire, and GHSA-vwm3-crmr-xfxw should be referenced for a deeper exploration.Patches are available in Moby releases 23.0.3, and 20.10.24. As Mirantis Container Runtime's 20.10 releases are numbered differently, users of that platform should update to 20.10.16.Some workarounds are available. In multi-node clusters, deploy a global ‘pause’ container for each encrypted overlay network, on every node. For a single-node cluster, do not use overlay networks of any sort. Bridge networks provide the same connectivity on a single node and have no multi-node features. The Swarm ingress feature is implemented using an overlay network, but can be disabled by publishing ports in `host` mode instead of `ingress` mode (allowing the use of an external load balancer), and removing the `ingress` network. If encrypted overlay networks are in exclusive use, block UDP port 4789 from traffic that has not been validated by IPSec.",2023-09-05T03:15:11.240,https://cve.circl.lu/cve/CVE-2023-28842
CVE-2023-41037,1.4,Cryptograph,"OpenPGP.js is a JavaScript implementation of the OpenPGP protocol. In affected versions OpenPGP Cleartext Signed Messages are cryptographically signed messages where the signed text is readable without special tools. These messages typically contain a ""Hash: ..."" header declaring the hash algorithm used to compute the signature digest. OpenPGP.js up to v5.9.0 ignored any data preceding the ""Hash: ..."" texts when verifying the signature. As a result, malicious parties could add arbitrary text to a third-party Cleartext Signed Message, to lead the victim to believe that the arbitrary text was signed. A user or application is vulnerable to said attack vector if it verifies the CleartextMessage by only checking the returned `verified` property, discarding the associated `data` information, and instead _visually trusting_ the contents of the original message. Since `verificationResult.data` would always contain the actual signed data, users and apps that check this information are not vulnerable. Similarly, given a CleartextMessage object, retrieving the data using `getText()` or the `text` field returns only the contents that are considered when verifying the signature. Finally, re-armoring a CleartextMessage object (using `armor()` will also result in a ""sanitised"" version, with the extraneous text being removed. This issue has been addressed in version 5.10.1 (current stable version) which will reject messages when calling `openpgp.readCleartextMessage()` and in version 4.10.11 (legacy version) which will will reject messages when calling `openpgp.cleartext.readArmored()`. Users are advised to upgrade. Users unable to upgrade should check the contents of `verificationResult.data` to see what data was actually signed, rather than visually trusting the contents of the armored message.",2023-09-08T14:01:40.800,https://cve.circl.lu/cve/CVE-2023-41037
CVE-2023-34039,5.9,Cryptograph,Aria Operations for Networks contains an Authentication Bypass vulnerability due to a lack of unique cryptographic key generation. A malicious actor with network access to Aria Operations for Networks could bypass SSH authentication to gain access to the Aria Operations for Networks CLI.,2023-09-02T15:15:27.437,https://cve.circl.lu/cve/CVE-2023-34039
CVE-2023-4711,5.9,D-Link,"A vulnerability, which was classified as critical, has been found in D-Link DAR-8000-10 up to 20230819. Affected by this issue is some unknown functionality of the file /log/decodmail.php. The manipulation of the argument file leads to os command injection. The attack may be launched remotely. The complexity of an attack is rather high. The exploitation is known to be difficult. The exploit has been disclosed to the public and may be used. VDB-238574 is the identifier assigned to this vulnerability. NOTE: The vendor was contacted early about this disclosure but did not respond in any way.",2023-09-07T19:21:02.327,https://cve.circl.lu/cve/CVE-2023-4711
CVE-2023-28072,5.9,Dell,"Dell Alienware Command Center, versions prior to 5.5.51.0, contain a deserialization of untrusted data vulnerability. A local malicious user could potentially send specially crafted requests to the .NET Remoting server to run arbitrary code on the system.",2023-09-08T13:58:40.990,https://cve.circl.lu/cve/CVE-2023-28072
CVE-2023-32470,3.6,Dell,Dell Digital Delivery versions prior to 5.0.82.0 contain an Insecure Operation on Windows Junction / Mount Point vulnerability. A local malicious user could potentially exploit this vulnerability to create arbitrary folder leading to permanent Denial of Service (DOS).,2023-09-08T12:58:39.247,https://cve.circl.lu/cve/CVE-2023-32470
CVE-2023-25173,5.9,Docker,"containerd is an open source container runtime. A bug was found in containerd prior to versions 1.6.18 and 1.5.18 where supplementary groups are not set up properly inside a container. If an attacker has direct access to a container and manipulates their supplementary group access, they may be able to use supplementary group access to bypass primary group restrictions in some cases, potentially gaining access to sensitive information or gaining the ability to execute code in that container. Downstream applications that use the containerd client library may be affected as well.This bug has been fixed in containerd v1.6.18 and v.1.5.18. Users should update to these versions and recreate containers to resolve this issue. Users who rely on a downstream application that uses containerd's client library should check that application for a separate advisory and instructions. As a workaround, ensure that the `""USER $USERNAME""` Dockerfile instruction is not used. Instead, set the container entrypoint to a value similar to `ENTRYPOINT [""su"", ""-"", ""user""]` to allow `su` to properly set up supplementary groups.",2023-09-05T03:15:10.060,https://cve.circl.lu/cve/CVE-2023-25173
CVE-2023-41044,2.5,Docker,"Graylog is a free and open log management platform. A partial path traversal vulnerability exists in Graylog's `Support Bundle` feature. The vulnerability is caused by incorrect user input validation in an HTTP API resource. Graylog's Support Bundle feature allows an attacker with valid Admin role credentials to download or delete files in sibling directories of the support bundle directory. The default `data_dir` in operating system packages (DEB, RPM) is set to `/var/lib/graylog-server`. The data directory for the Support Bundle feature is always `<data_dir>/support-bundle`. Due to the partial path traversal vulnerability, an attacker with valid Admin role credentials can read or delete files in directories that start with a `/var/lib/graylog-server/support-bundle` directory name. The vulnerability would allow the download or deletion of files in the following example directories: `/var/lib/graylog-server/support-bundle-test` and `/var/lib/graylog-server/support-bundlesdirectory`. For the Graylog Docker images, the `data_dir` is set to `/usr/share/graylog/data` by default. This vulnerability is fixed in Graylog version 5.1.3 and later. Users are advised to upgrade. Users unable to upgrade should block all HTTP requests to the following HTTP API endpoints by using a reverse proxy server in front of Graylog. `GET /api/system/debug/support/bundle/download/{filename}` and `DELETE /api/system/debug/support/bundle/{filename}`.",2023-09-06T19:48:09.783,https://cve.circl.lu/cve/CVE-2023-41044
