CVE,"Impact Score (1-10, 10 being the worst)",Keyword,Description,Last Modified,Link
CVE-2023-41941,NA,AWS,A missing permission check in Jenkins AWS CodeCommit Trigger Plugin 3.0.12 and earlier allows attackers with Overall/Read permission to enumerate credentials IDs of AWS credentials stored in Jenkins.,2023-09-07T01:10:21.083,https://cve.circl.lu/cve/CVE-2023-41941
CVE-2023-41942,NA,AWS,A cross-site request forgery (CSRF) vulnerability in Jenkins AWS CodeCommit Trigger Plugin 3.0.12 and earlier allows attackers to clear the SQS queue.,2023-09-07T01:10:21.083,https://cve.circl.lu/cve/CVE-2023-41942
CVE-2023-41943,NA,AWS,"Jenkins AWS CodeCommit Trigger Plugin 3.0.12 and earlier does not perform a permission check in an HTTP endpoint, allowing attackers with Overall/Read permission to clear the SQS queue.",2023-09-07T01:10:21.083,https://cve.circl.lu/cve/CVE-2023-41943
CVE-2023-41944,NA,AWS,"Jenkins AWS CodeCommit Trigger Plugin 3.0.12 and earlier does not escape the queue name parameter passed to a form validation URL, when rendering an error message, resulting in an HTML injection vulnerability.",2023-09-07T01:10:21.083,https://cve.circl.lu/cve/CVE-2023-41944
CVE-2021-36060,3.6,Adobe,Adobe Media Encoder version 15.2 (and earlier) is affected by an out-of-bounds read vulnerability that could lead to disclosure of sensitive memory. An attacker could leverage this vulnerability to bypass mitigations such as ASLR. Exploitation of this issue requires user interaction in that a victim must open a malicious file.,2023-09-07T01:10:21.083,https://cve.circl.lu/cve/CVE-2021-36060
CVE-2021-40790,3.6,Adobe,Adobe Premiere Pro versions 22.0 (and earlier) and 15.4.2 (and earlier) are affected by an Use-After-Free vulnerability that could lead to disclosure of sensitive memory. An attacker could leverage this vulnerability to bypass mitigations such as ASLR. Exploitation of this issue requires user interaction in that a victim must open a malicious file.,2023-09-07T13:42:46.843,https://cve.circl.lu/cve/CVE-2021-40790
CVE-2021-40791,3.6,Adobe,Adobe Premiere Pro versions 22.0 (and earlier) and 15.4.2 (and earlier) are affected by an out-of-bounds read vulnerability that could lead to disclosure of sensitive memory. An attacker could leverage this vulnerability to bypass mitigations such as ASLR. Exploitation of this issue requires user interaction in that a victim must open a malicious file.,2023-09-07T13:42:46.843,https://cve.circl.lu/cve/CVE-2021-40791
CVE-2021-40795,5.9,Adobe,Adobe Premiere Pro versions 22.0 (and earlier) and 15.4.2 (and earlier) are affected by an out-of-bounds read vulnerability which could result in a read past the end of an allocated memory structure. An attacker could leverage this vulnerability to execute code in the context of the current user. Exploitation of this issue requires user interaction in that a victim must open a malicious file.,2023-09-07T13:42:46.843,https://cve.circl.lu/cve/CVE-2021-40795
CVE-2021-42265,3.6,Adobe,Adobe Premiere Pro versions 22.0 (and earlier) and 15.4.2 (and earlier) are affected by an out-of-bounds read vulnerability that could lead to disclosure of sensitive memory. An attacker could leverage this vulnerability to bypass mitigations such as ASLR. Exploitation of this issue requires user interaction in that a victim must open a malicious file.,2023-09-07T13:42:46.843,https://cve.circl.lu/cve/CVE-2021-42265
CVE-2006-20001,3.6,Apache,"A carefully crafted If: request header can cause a memory read, or write of a single zero byte, in a pool (heap) memory location beyond the header value sent. This could cause the process to crash.This issue affects Apache HTTP Server 2.4.54 and earlier.",2023-09-08T22:15:08.013,https://cve.circl.lu/cve/CVE-2006-20001
CVE-2022-36760,6.0,Apache,Inconsistent Interpretation of HTTP Requests ('HTTP Request Smuggling') vulnerability in mod_proxy_ajp of Apache HTTP Server allows an attacker to smuggle requests to the AJP server it forwards requests to.  This issue affects Apache HTTP Server Apache HTTP Server 2.4 version 2.4.54 and prior versions.,2023-09-08T22:15:10.133,https://cve.circl.lu/cve/CVE-2022-36760
CVE-2022-37436,1.4,Apache,"Prior to Apache HTTP Server 2.4.55, a malicious backend can cause the response headers to be truncated early, resulting in some headers being incorporated into the response body. If the later headers have any security purpose, they will not be interpreted by the client.",2023-09-08T22:15:10.340,https://cve.circl.lu/cve/CVE-2022-37436
CVE-2022-24963,5.9,Apache,Integer Overflow or Wraparound vulnerability in apr_encode functions of Apache Portable Runtime (APR) allows an attacker to write beyond bounds of a buffer.This issue affects Apache Portable Runtime (APR) version 1.7.0.,2023-09-08T17:15:15.570,https://cve.circl.lu/cve/CVE-2022-24963
CVE-2023-25690,5.9,Apache,"Some mod_proxy configurations on Apache HTTP Server versions 2.4.0 through 2.4.55 allow a HTTP Request Smuggling attack.Configurations are affected when mod_proxy is enabled along with some form of RewriteRule or ProxyPassMatch in which a non-specific pattern matches some portion of the user-supplied request-target (URL) data and is then re-inserted into the proxied request-target using variable substitution. For example, something like:RewriteEngine onRewriteRule ""^/here/(.*)"" ""http://example.com:8080/elsewhere?$1""; [P]ProxyPassReverse /here/ http://example.com:8080/Request splitting/smuggling could result in bypass of access controls in the proxy server, proxying unintended URLs to existing origin servers, and cache poisoning. Users are recommended to update to at least version 2.4.56 of Apache HTTP Server.",2023-09-08T22:15:10.527,https://cve.circl.lu/cve/CVE-2023-25690
CVE-2022-21248,1.4,Apple,"Vulnerability in the Oracle Java SE, Oracle GraalVM Enterprise Edition product of Oracle Java SE (component: Serialization). Supported versions that are affected are Oracle Java SE: 7u321, 8u311, 11.0.13, 17.0.1; Oracle GraalVM Enterprise Edition: 20.3.4 and 21.3.0. Difficult to exploit vulnerability allows unauthenticated attacker with network access via multiple protocols to compromise Oracle Java SE, Oracle GraalVM Enterprise Edition. Successful attacks of this vulnerability can result in unauthorized update, insert or delete access to some of Oracle Java SE, Oracle GraalVM Enterprise Edition accessible data. Note: This vulnerability applies to Java deployments, typically in clients running sandboxed Java Web Start applications or sandboxed Java applets, that load and run untrusted code (e.g., code that comes from the internet) and rely on the Java sandbox for security. This vulnerability can also be exploited by using APIs in the specified Component, e.g., through a web service which supplies data to the APIs. CVSS 3.1 Base Score 3.7 (Integrity impacts). CVSS Vector: (CVSS:3.1/AV:N/AC:H/PR:N/UI:N/S:U/C:N/I:L/A:N).",2023-09-08T00:15:07.480,https://cve.circl.lu/cve/CVE-2022-21248
CVE-2022-21277,1.4,Apple,"Vulnerability in the Oracle Java SE, Oracle GraalVM Enterprise Edition product of Oracle Java SE (component: ImageIO). Supported versions that are affected are Oracle Java SE: 11.0.13, 17.0.1; Oracle GraalVM Enterprise Edition: 20.3.4 and 21.3.0. Easily exploitable vulnerability allows unauthenticated attacker with network access via multiple protocols to compromise Oracle Java SE, Oracle GraalVM Enterprise Edition. Successful attacks of this vulnerability can result in unauthorized ability to cause a partial denial of service (partial DOS) of Oracle Java SE, Oracle GraalVM Enterprise Edition. Note: This vulnerability applies to Java deployments, typically in clients running sandboxed Java Web Start applications or sandboxed Java applets, that load and run untrusted code (e.g., code that comes from the internet) and rely on the Java sandbox for security. This vulnerability can also be exploited by using APIs in the specified Component, e.g., through a web service which supplies data to the APIs. CVSS 3.1 Base Score 5.3 (Availability impacts). CVSS Vector: (CVSS:3.1/AV:N/AC:L/PR:N/UI:N/S:U/C:N/I:N/A:L).",2023-09-08T00:15:07.800,https://cve.circl.lu/cve/CVE-2022-21277
CVE-2022-21282,1.4,Apple,"Vulnerability in the Oracle Java SE, Oracle GraalVM Enterprise Edition product of Oracle Java SE (component: JAXP). Supported versions that are affected are Oracle Java SE: 7u321, 8u311, 11.0.13, 17.0.1; Oracle GraalVM Enterprise Edition: 20.3.4 and 21.3.0. Easily exploitable vulnerability allows unauthenticated attacker with network access via multiple protocols to compromise Oracle Java SE, Oracle GraalVM Enterprise Edition. Successful attacks of this vulnerability can result in unauthorized read access to a subset of Oracle Java SE, Oracle GraalVM Enterprise Edition accessible data. Note: This vulnerability applies to Java deployments, typically in clients running sandboxed Java Web Start applications or sandboxed Java applets, that load and run untrusted code (e.g., code that comes from the internet) and rely on the Java sandbox for security. This vulnerability can also be exploited by using APIs in the specified Component, e.g., through a web service which supplies data to the APIs. CVSS 3.1 Base Score 5.3 (Confidentiality impacts). CVSS Vector: (CVSS:3.1/AV:N/AC:L/PR:N/UI:N/S:U/C:L/I:N/A:N).",2023-09-08T00:15:07.920,https://cve.circl.lu/cve/CVE-2022-21282
CVE-2022-21283,1.4,Apple,"Vulnerability in the Oracle Java SE, Oracle GraalVM Enterprise Edition product of Oracle Java SE (component: Libraries). Supported versions that are affected are Oracle Java SE: 11.0.13, 17.0.1; Oracle GraalVM Enterprise Edition: 20.3.4 and 21.3.0. Easily exploitable vulnerability allows unauthenticated attacker with network access via multiple protocols to compromise Oracle Java SE, Oracle GraalVM Enterprise Edition. Successful attacks of this vulnerability can result in unauthorized ability to cause a partial denial of service (partial DOS) of Oracle Java SE, Oracle GraalVM Enterprise Edition. Note: This vulnerability applies to Java deployments, typically in clients running sandboxed Java Web Start applications or sandboxed Java applets, that load and run untrusted code (e.g., code that comes from the internet) and rely on the Java sandbox for security. This vulnerability can also be exploited by using APIs in the specified Component, e.g., through a web service which supplies data to the APIs. CVSS 3.1 Base Score 5.3 (Availability impacts). CVSS Vector: (CVSS:3.1/AV:N/AC:L/PR:N/UI:N/S:U/C:N/I:N/A:L).",2023-09-08T00:15:08.077,https://cve.circl.lu/cve/CVE-2022-21283
CVE-2022-21291,1.4,Apple,"Vulnerability in the Oracle Java SE, Oracle GraalVM Enterprise Edition product of Oracle Java SE (component: Hotspot). Supported versions that are affected are Oracle Java SE: 7u321, 8u311, 11.0.13, 17.0.1; Oracle GraalVM Enterprise Edition: 20.3.4 and 21.3.0. Easily exploitable vulnerability allows unauthenticated attacker with network access via multiple protocols to compromise Oracle Java SE, Oracle GraalVM Enterprise Edition. Successful attacks of this vulnerability can result in unauthorized update, insert or delete access to some of Oracle Java SE, Oracle GraalVM Enterprise Edition accessible data. Note: This vulnerability applies to Java deployments, typically in clients running sandboxed Java Web Start applications or sandboxed Java applets, that load and run untrusted code (e.g., code that comes from the internet) and rely on the Java sandbox for security. This vulnerability can also be exploited by using APIs in the specified Component, e.g., through a web service which supplies data to the APIs. CVSS 3.1 Base Score 5.3 (Integrity impacts). CVSS Vector: (CVSS:3.1/AV:N/AC:L/PR:N/UI:N/S:U/C:N/I:L/A:N).",2023-09-08T00:15:08.240,https://cve.circl.lu/cve/CVE-2022-21291
CVE-2015-1390,2.7,Aruba,Aruba AirWave before 8.0.7 allows XSS attacks agsinat an administrator.,2023-09-08T14:26:50.920,https://cve.circl.lu/cve/CVE-2015-1390
CVE-2015-1391,5.9,Aruba,Aruba AirWave before 8.0.7 allows bypass of a CSRF protection mechanism.,2023-09-08T14:26:44.737,https://cve.circl.lu/cve/CVE-2015-1391
CVE-2015-2201,5.9,Aruba,Aruba AirWave before 7.7.14.2 and 8.x before 8.0.7 allows VisualRF remote OS command execution and file disclosure by administrative users.,2023-09-08T18:55:29.563,https://cve.circl.lu/cve/CVE-2015-2201
CVE-2015-2202,5.9,Aruba,Aruba AirWave before 7.7.14.2 and 8.x before 8.0.7 allows administrative users to escalate privileges to root on the underlying OS.,2023-09-08T18:57:27.627,https://cve.circl.lu/cve/CVE-2015-2202
CVE-2023-38484,6.0,Aruba,Vulnerabilities exist in the BIOS implementation of Aruba 9200 and 9000 Series Controllers and Gateways that could allow an attacker to execute arbitrary code early in the boot sequence. An attacker could exploit this vulnerability to gain access to and change underlying sensitive information in the affected controller leading to complete system compromise.,2023-09-07T01:10:21.083,https://cve.circl.lu/cve/CVE-2023-38484
CVE-2023-41935,NA,Azure,"Jenkins Azure AD Plugin 396.v86ce29279947 and earlier, except 378.380.v545b_1154b_3fb_, uses a non-constant time comparison function when checking whether the provided and expected CSRF protection nonce are equal, potentially allowing attackers to use statistical methods to obtain a valid nonce.",2023-09-07T01:10:21.083,https://cve.circl.lu/cve/CVE-2023-41935
CVE-2023-35785,5.9,Active Directory,"Zoho ManageEngine Active Directory 360 versions 4315 and below, ADAudit Plus 7202 and below, ADManager Plus 7200 and below, Asset Explorer 7002 and below, Cloud Security Plus 4161 and below, Data Security Plus 6110 and below, Eventlog Analyzer 12301 and below, Exchange Reporter Plus 5709 and below, Log360 5315 and below, Log360 UEBA 4045 and below, M365 Manager Plus 4529 and below, M365 Security Plus 4529 and below, Recovery Manager Plus 6061 and below, ServiceDesk Plus 14302 and below, ServiceDesk Plus MSP 14300 and below, SharePoint Manager Plus 4402 and below and Support Center Plus 14300 and below are vulnerable to the authentication bypass vulnerability via a few authenticators.",2023-09-08T03:15:08.017,https://cve.circl.lu/cve/CVE-2023-35785
CVE-2019-13473,5.9,BusyBox,"TELESTAR Bobs Rock Radio, Dabman D10, Dabman i30 Stereo, Imperial i110, Imperial i150, Imperial i200, Imperial i200-cd, Imperial i400, Imperial i450, Imperial i500-bt, and Imperial i600 TN81HH96-g102h-g102 devices have an undocumented TELNET service within the BusyBox subsystem, leading to root access.",2023-09-05T17:15:07.477,https://cve.circl.lu/cve/CVE-2019-13473
CVE-2023-39810,5.9,BusyBox,An issue in the CPIO command of Busybox v1.33.2 allows attackers to execute a directory traversal.,2023-09-07T13:48:46.393,https://cve.circl.lu/cve/CVE-2023-39810
CVE-2023-39372,5.9,CSRF,StarTrinity Softswitch version 2023-02-16 - Multiple CSRF (CWE-352),2023-09-08T06:43:14.083,https://cve.circl.lu/cve/CVE-2023-39372
CVE-2023-4059,1.4,CSRF,"The Profile Builder WordPress plugin before 3.9.8 lacks authorisation and CSRF in its page creation function which allows unauthenticated users to create the register, log-in and edit-profile pages from the plugin on the blog",2023-09-08T06:49:52.050,https://cve.circl.lu/cve/CVE-2023-4059
CVE-2023-20168,4.0,Cisco,"A vulnerability in TACACS+ and RADIUS remote authentication for Cisco NX-OS Software could allow an unauthenticated, local attacker to cause an affected device to unexpectedly reload. This vulnerability is due to incorrect input validation when processing an authentication attempt if the directed request option is enabled for TACACS+ or RADIUS. An attacker could exploit this vulnerability by entering a crafted string at the login prompt of an affected device. A successful exploit could allow the attacker to cause the affected device to unexpectedly reload, resulting in a denial of service (DoS) condition. ",2023-09-05T15:59:01.170,https://cve.circl.lu/cve/CVE-2023-20168
CVE-2023-20200,4.0,Cisco,"A vulnerability in the Simple Network Management Protocol (SNMP) service of Cisco FXOS Software for Firepower 4100 Series and Firepower 9300 Security Appliances and of Cisco UCS 6300 Series Fabric Interconnects could allow an authenticated, remote attacker to cause a denial of service (DoS) condition on an affected device. This vulnerability is due to the improper handling of specific SNMP requests. An attacker could exploit this vulnerability by sending a crafted SNMP request to an affected device. A successful exploit could allow the attacker to cause the affected device to reload, resulting in a DoS condition. Note: This vulnerability affects all supported SNMP versions. To exploit this vulnerability through SNMPv2c or earlier, an attacker must know the SNMP community string that is configured on an affected device. To exploit this vulnerability through SNMPv3, the attacker must have valid credentials for an SNMP user who is configured on the affected device.",2023-09-07T17:58:03.400,https://cve.circl.lu/cve/CVE-2023-20200
CVE-2023-20234,5.2,Cisco,"A vulnerability in the CLI of Cisco FXOS Software could allow an authenticated, local attacker to create a file or overwrite any file on the filesystem of an affected device, including system files. The vulnerability occurs because there is no validation of parameters when a specific CLI command is used. An attacker could exploit this vulnerability by authenticating to an affected device and using the command at the CLI. A successful exploit could allow the attacker to overwrite any file on the disk of the affected device, including system files. The attacker must have valid administrative credentials on the affected device to exploit this vulnerability.",2023-09-05T15:57:17.487,https://cve.circl.lu/cve/CVE-2023-20234
CVE-2023-20250,5.2,Cisco,"A vulnerability in the web-based management interface of Cisco Small Business RV110W, RV130, RV130W, and RV215W Routers could allow an authenticated, remote attacker to execute arbitrary code on an affected device. This vulnerability is due to improper validation of requests that are sent to the web-based management interface. An attacker could exploit this vulnerability by sending a crafted request to the web-based management interface. A successful exploit could allow the attacker to execute arbitrary code with root privileges on an affected device. To exploit this vulnerability, the attacker must have valid Administrator credentials on the affected device.",2023-09-07T01:10:21.083,https://cve.circl.lu/cve/CVE-2023-20250
CVE-2023-20238,6.0,Cisco,"A vulnerability in the single sign-on (SSO) implementation of Cisco BroadWorks Application Delivery Platform and Cisco BroadWorks Xtended Services Platform could allow an unauthenticated, remote attacker to forge the credentials required to access an affected system. This vulnerability is due to the method used to validate SSO tokens. An attacker could exploit this vulnerability by authenticating to the application with forged credentials. A successful exploit could allow the attacker to commit toll fraud or to execute commands at the privilege level of the forged account. If that account is an Administrator account, the attacker would have the ability to view confidential information, modify customer settings, or modify settings for other users. To exploit this vulnerability, the attacker would need a valid user ID that is associated with an affected Cisco BroadWorks system.",2023-09-07T01:10:21.083,https://cve.circl.lu/cve/CVE-2023-20238
CVE-2023-39910,3.6,Cryptocurrency,"The cryptocurrency wallet entropy seeding mechanism used in Libbitcoin Explorer 3.0.0 through 3.6.0 is weak, aka the Milk Sad issue. The use of an mt19937 Mersenne Twister PRNG restricts the internal entropy to 32 bits regardless of settings. This allows remote attackers to recover any wallet private keys generated from ""bx seed"" entropy output and steal funds. (Affected users need to move funds to a secure new cryptocurrency wallet.) NOTE: the vendor's position is that there was sufficient documentation advising against ""bx seed"" but others disagree. NOTE: this was exploited in the wild in June and July 2023.",2023-09-07T07:15:08.640,https://cve.circl.lu/cve/CVE-2023-39910
CVE-2023-28840,5.8,Cryptograph,"Moby is an open source container framework developed by Docker Inc. that is distributed as Docker, Mirantis Container Runtime, and various other downstream projects/products. The Moby daemon component (`dockerd`), which is developed as moby/moby, is commonly referred to as *Docker*.Swarm Mode, which is compiled in and delivered by default in dockerd and is thus present in most major Moby downstreams, is a simple, built-in container orchestrator that is implemented through a combination of SwarmKit and supporting network code.The overlay network driver is a core feature of Swarm Mode, providing isolated virtual LANs that allow communication between containers and services across the cluster. This driver is an implementation/user of VXLAN, which encapsulates link-layer (Ethernet) frames in UDP datagrams that tag the frame with a VXLAN Network ID (VNI) that identifies the originating overlay network. In addition, the overlay network driver supports an optional, off-by-default encrypted mode, which is especially useful when VXLAN packets traverses an untrusted network between nodes.Encrypted overlay networks function by encapsulating the VXLAN datagrams through the use of the IPsec Encapsulating Security Payload protocol in Transport mode. By deploying IPSec encapsulation, encrypted overlay networks gain the additional properties of source authentication through cryptographic proof, data integrity through check-summing, and confidentiality through encryption.When setting an endpoint up on an encrypted overlay network, Moby installs three iptables (Linux kernel firewall) rules that enforce both incoming and outgoing IPSec. These rules rely on the u32 iptables extension provided by the xt_u32 kernel module to directly filter on a VXLAN packet's VNI field, so that IPSec guarantees can be enforced on encrypted overlay networks without interfering with other overlay networks or other users of VXLAN.Two iptables rules serve to filter incoming VXLAN datagrams with a VNI that corresponds to an encrypted network and discards unencrypted datagrams. The rules are appended to the end of the INPUT filter chain, following any rules that have been previously set by the system administrator. Administrator-set rules take precedence over the rules Moby sets to discard unencrypted VXLAN datagrams, which can potentially admit unencrypted datagrams that should have been discarded.The injection of arbitrary Ethernet frames can enable a Denial of Service attack. A sophisticated attacker may be able to establish a UDP or TCP connection by way of the container’s outbound gateway that would otherwise be blocked by a stateful firewall, or carry out other escalations beyond simple injection by smuggling packets into the overlay network.Patches are available in Moby releases 23.0.3 and 20.10.24. As Mirantis Container Runtime's 20.10 releases are numbered differently, users of that platform should update to 20.10.16.Some workarounds are available. Close the VXLAN port (by default, UDP port 4789) to incoming traffic at the Internet boundary to prevent all VXLAN packet injection, and/or ensure that the `xt_u32` kernel module is available on all nodes of the Swarm cluster.",2023-09-05T03:15:10.760,https://cve.circl.lu/cve/CVE-2023-28840
