CVE,"Impact Score (1-10, 10 being the worst)",Keyword,Description,Last Modified,Link
CVE-2021-21899,5.9,JDK,A code execution vulnerability exists in the dwgCompressor::copyCompBytes21 functionality of LibreCad libdxfrw 2.2.0-rc2-19-ge02f3580. A specially-crafted .dwg file can lead to a heap buffer overflow. An attacker can provide a malicious file to trigger this vulnerability.,2023-05-21T22:15:10.407,https://cve.circl.lu/cve/CVE-2021-21899
CVE-2021-21900,5.9,JDK,A code execution vulnerability exists in the dxfRW::processLType() functionality of LibreCad libdxfrw 2.2.0-rc2-19-ge02f3580. A specially-crafted .dxf file can lead to a use-after-free vulnerability. An attacker can provide a malicious file to trigger this vulnerability.,2023-05-21T22:15:10.503,https://cve.circl.lu/cve/CVE-2021-21900
CVE-2021-21898,5.9,JDK,A code execution vulnerability exists in the dwgCompressor::decompress18() functionality of LibreCad libdxfrw 2.2.0-rc2-19-ge02f3580. A specially-crafted .dwg file can lead to an out-of-bounds write. An attacker can provide a malicious file to trigger this vulnerability.,2023-05-21T22:15:10.163,https://cve.circl.lu/cve/CVE-2021-21898
CVE-2021-46877,3.6,JDK,jackson-databind 2.10.x through 2.12.x before 2.12.6 and 2.13.x before 2.13.1 allows attackers to cause a denial of service (2 GB transient heap usage per read) in uncommon situations involving JsonNode JDK serialization.,2023-05-19T19:11:04.160,https://cve.circl.lu/cve/CVE-2021-46877
CVE-2023-32784,NA,KeePass,"In KeePass 2.x before 2.54, it is possible to recover the cleartext master password from a memory dump, even when a workspace is locked or no longer running. The memory dump can be a KeePass process dump, swap file (pagefile.sys), hibernation file (hiberfil.sys), or RAM dump of the entire system. The first character cannot be recovered. In 2.54, there is different API usage and/or random string insertion for mitigation.",2023-05-20T15:15:08.893,https://cve.circl.lu/cve/CVE-2023-32784
CVE-2020-0597,3.6,Lenovo,Out-of-bounds read in IPv6 subsystem in Intel(R) AMT and Intel(R) ISM versions before 14.0.33 may allow an unauthenticated user to potentially enable denial of service via network access.,2023-05-22T15:32:51.257,https://cve.circl.lu/cve/CVE-2020-0597
CVE-2013-4348,6.9,Linux,The skb_flow_dissect function in net/core/flow_dissector.c in the Linux kernel through 3.12 allows remote attackers to cause a denial of service (infinite loop) via a small value in the IHL field of a packet with IPIP encapsulation.,2023-05-19T16:50:59.817,https://cve.circl.lu/cve/CVE-2013-4348
CVE-2021-20313,3.6,MSI,A flaw was found in ImageMagick in versions before 7.0.11. A potential cipher leak when the calculate signatures in TransformSignature is possible. The highest threat from this vulnerability is to data confidentiality.,2023-05-22T02:15:10.730,https://cve.circl.lu/cve/CVE-2021-20313
CVE-2019-16010,2.7,Management,"A vulnerability in the web UI of the Cisco SD-WAN vManage software could allow an authenticated, remote attacker to conduct a cross-site scripting (XSS) attack against a user of the web-based management interface of the vManage software. The vulnerability is due to insufficient validation of user-supplied input by the web-based management interface. An attacker could exploit this vulnerability by persuading a user of the interface to click a crafted link. A successful exploit could allow the attacker to execute arbitrary script code in the context of the interface or access sensitive, browser-based information.",2023-05-23T13:55:46.380,https://cve.circl.lu/cve/CVE-2019-16010
CVE-2020-3372,3.6,Management,"A vulnerability in the web-based management interface of Cisco SD-WAN vManage Software could allow an authenticated, remote attacker to consume excessive system memory and cause a denial of service (DoS) condition on an affected system. The vulnerability is due to inefficient memory management. An attacker could exploit this vulnerability by sending a large number of crafted HTTP requests to the affected web-based management interface. A successful exploit could allow the attacker to exhaust system memory, which could cause the system to stop processing new connections and could result in a DoS condition.",2023-05-23T13:55:46.380,https://cve.circl.lu/cve/CVE-2020-3372
CVE-2020-3378,1.4,Management,"A vulnerability in the web-based management interface for Cisco SD-WAN vManage Software could allow an authenticated, remote attacker to impact the integrity of an affected system by executing arbitrary SQL queries. The vulnerability is due to insufficient validation of user-supplied input. An attacker could exploit this vulnerability by sending crafted input that includes SQL statements to an affected system. A successful exploit could allow the attacker to modify entries in some database tables, affecting the integrity of the data.",2023-05-23T13:55:46.380,https://cve.circl.lu/cve/CVE-2020-3378
CVE-2023-2514,3.6,Mattermost,Mattermost Sever fails to redact the DB username and password before emitting an application log during server initialization. ,2023-05-22T16:41:25.710,https://cve.circl.lu/cve/CVE-2023-2514
CVE-2023-2515,5.9,Mattermost,Mattermost fails to restrict a user with permissions to edit other users and to create personal access tokens from elevating their privileges to system admin,2023-05-23T19:53:59.490,https://cve.circl.lu/cve/CVE-2023-2515
CVE-2018-0598,5.9,Microsoft,Untrusted search path vulnerability in Self-extracting archive files created by IExpress bundled with Microsoft Windows allows an attacker to gain privileges via a Trojan horse DLL in an unspecified directory.,2023-05-18T16:15:09.463,https://cve.circl.lu/cve/CVE-2018-0598
CVE-2022-21845,3.6,Microsoft,Windows Kernel Information Disclosure Vulnerability,2023-05-18T19:15:09.073,https://cve.circl.lu/cve/CVE-2022-21845
CVE-2022-22022,5.2,Microsoft,Windows Print Spooler Elevation of Privilege Vulnerability,2023-05-17T17:15:10.977,https://cve.circl.lu/cve/CVE-2022-22022
CVE-2022-22023,5.9,Microsoft,Windows Portable Device Enumerator Service Security Feature Bypass Vulnerability,2023-05-17T17:15:11.130,https://cve.circl.lu/cve/CVE-2022-22023
CVE-2022-22024,5.9,Microsoft,Windows Fax Service Remote Code Execution Vulnerability,2023-05-17T17:15:11.213,https://cve.circl.lu/cve/CVE-2022-22024
CVE-2020-14597,3.6,MySQL,Vulnerability in the MySQL Server product of Oracle MySQL (component: Server: Optimizer). Supported versions that are affected are 8.0.20 and prior. Easily exploitable vulnerability allows high privileged attacker with network access via multiple protocols to compromise MySQL Server. Successful attacks of this vulnerability can result in unauthorized ability to cause a hang or frequently repeatable crash (complete DOS) of MySQL Server. CVSS 3.1 Base Score 4.9 (Availability impacts). CVSS Vector: (CVSS:3.1/AV:N/AC:L/PR:H/UI:N/S:U/C:N/I:N/A:H).,2023-05-18T17:39:04.083,https://cve.circl.lu/cve/CVE-2020-14597
CVE-2020-14614,3.6,MySQL,Vulnerability in the MySQL Server product of Oracle MySQL (component: Server: Optimizer). Supported versions that are affected are 8.0.20 and prior. Easily exploitable vulnerability allows high privileged attacker with network access via multiple protocols to compromise MySQL Server. Successful attacks of this vulnerability can result in unauthorized ability to cause a hang or frequently repeatable crash (complete DOS) of MySQL Server. CVSS 3.1 Base Score 4.9 (Availability impacts). CVSS Vector: (CVSS:3.1/AV:N/AC:L/PR:H/UI:N/S:U/C:N/I:N/A:H).,2023-05-18T18:00:02.037,https://cve.circl.lu/cve/CVE-2020-14614
CVE-2020-14619,3.6,MySQL,Vulnerability in the MySQL Server product of Oracle MySQL (component: Server: Parser). Supported versions that are affected are 8.0.20 and prior. Easily exploitable vulnerability allows low privileged attacker with network access via multiple protocols to compromise MySQL Server. Successful attacks of this vulnerability can result in unauthorized ability to cause a hang or frequently repeatable crash (complete DOS) of MySQL Server. CVSS 3.1 Base Score 6.5 (Availability impacts). CVSS Vector: (CVSS:3.1/AV:N/AC:L/PR:L/UI:N/S:U/C:N/I:N/A:H).,2023-05-18T18:00:07.580,https://cve.circl.lu/cve/CVE-2020-14619
CVE-2020-14620,3.6,MySQL,Vulnerability in the MySQL Server product of Oracle MySQL (component: Server: DML). Supported versions that are affected are 8.0.20 and prior. Easily exploitable vulnerability allows high privileged attacker with network access via multiple protocols to compromise MySQL Server. Successful attacks of this vulnerability can result in unauthorized ability to cause a hang or frequently repeatable crash (complete DOS) of MySQL Server. CVSS 3.1 Base Score 4.9 (Availability impacts). CVSS Vector: (CVSS:3.1/AV:N/AC:L/PR:H/UI:N/S:U/C:N/I:N/A:H).,2023-05-18T18:00:12.007,https://cve.circl.lu/cve/CVE-2020-14620
CVE-2020-14623,3.6,MySQL,Vulnerability in the MySQL Server product of Oracle MySQL (component: InnoDB). Supported versions that are affected are 8.0.20 and prior. Easily exploitable vulnerability allows high privileged attacker with network access via multiple protocols to compromise MySQL Server. Successful attacks of this vulnerability can result in unauthorized ability to cause a hang or frequently repeatable crash (complete DOS) of MySQL Server. CVSS 3.1 Base Score 4.9 (Availability impacts). CVSS Vector: (CVSS:3.1/AV:N/AC:L/PR:H/UI:N/S:U/C:N/I:N/A:H).,2023-05-18T18:00:15.173,https://cve.circl.lu/cve/CVE-2020-14623
CVE-2023-23532,6.0,MacOS,"This issue was addressed with improved checks. This issue is fixed in macOS Ventura 13.3, iOS 16.4 and iPadOS 16.4. An app may be able to break out of its sandbox",2023-05-19T16:15:11.060,https://cve.circl.lu/cve/CVE-2023-23532
CVE-2023-23533,3.6,MacOS,"A logic issue was addressed with improved checks. This issue is fixed in macOS Monterey 12.6.4, macOS Ventura 13.3. An app may be able to modify protected parts of the file system",2023-05-19T16:15:11.140,https://cve.circl.lu/cve/CVE-2023-23533
CVE-2017-17916,5.9,Malware,** DISPUTED ** SQL injection vulnerability in the 'find_by' method in Ruby on Rails 5.1.4 and earlier allows remote attackers to execute arbitrary SQL commands via the 'name' parameter. NOTE: The vendor disputes this issue because the documentation states that this method is not intended for use with untrusted input.,2023-05-19T16:51:14.040,https://cve.circl.lu/cve/CVE-2017-17916
CVE-2017-17917,5.9,Malware,** DISPUTED ** SQL injection vulnerability in the 'where' method in Ruby on Rails 5.1.4 and earlier allows remote attackers to execute arbitrary SQL commands via the 'id' parameter. NOTE: The vendor disputes this issue because the documentation states that this method is not intended for use with untrusted input.,2023-05-19T16:48:35.417,https://cve.circl.lu/cve/CVE-2017-17917
CVE-2023-27562,3.6,Node.js,The n8n package 0.218.0 for Node.js allows Directory Traversal.,2023-05-17T18:42:50.633,https://cve.circl.lu/cve/CVE-2023-27562
CVE-2023-27563,5.9,Node.js,The n8n package 0.218.0 for Node.js allows Escalation of Privileges.,2023-05-17T18:47:30.687,https://cve.circl.lu/cve/CVE-2023-27563
CVE-2023-27564,3.6,Node.js,The n8n package 0.218.0 for Node.js allows Information Disclosure.,2023-05-17T19:14:43.370,https://cve.circl.lu/cve/CVE-2023-27564
CVE-2023-28359,1.4,NoSQL,"A NoSQL injection vulnerability has been identified in the listEmojiCustom method call within Rocket.Chat. This can be exploited by unauthenticated users when there is at least one custom emoji uploaded to the Rocket.Chat instance. The vulnerability causes a delay in the server response, with the potential for limited impact.",2023-05-22T14:33:15.997,https://cve.circl.lu/cve/CVE-2023-28359
CVE-2023-26116,3.6,NPM,"Versions of the package angular from 1.2.21 are vulnerable to Regular Expression Denial of Service (ReDoS) via the angular.copy() utility function due to the usage of an insecure regular expression. Exploiting this vulnerability is possible by a large carefully-crafted input, which can result in catastrophic backtracking.",2023-05-22T13:15:09.537,https://cve.circl.lu/cve/CVE-2023-26116
CVE-2023-26117,3.6,NPM,"Versions of the package angular from 1.0.0 are vulnerable to Regular Expression Denial of Service (ReDoS) via the $resource service due to the usage of an insecure regular expression. Exploiting this vulnerability is possible by a large carefully-crafted input, which can result in catastrophic backtracking.",2023-05-22T13:15:09.673,https://cve.circl.lu/cve/CVE-2023-26117
CVE-2023-26118,3.6,NPM,"Versions of the package angular from 1.4.9 are vulnerable to Regular Expression Denial of Service (ReDoS) via the <input type=""url""> element due to the usage of an insecure regular expression in the input[url] functionality. Exploiting this vulnerability is possible by a large carefully-crafted input, which can result in catastrophic backtracking.",2023-05-22T13:15:09.757,https://cve.circl.lu/cve/CVE-2023-26118
CVE-2019-12654,3.6,NULL Pointer,"A vulnerability in the common Session Initiation Protocol (SIP) library of Cisco IOS and IOS XE Software could allow an unauthenticated, remote attacker to trigger a reload of an affected device, resulting in a denial of service (DoS) condition. The vulnerability is due to insufficient sanity checks on an internal data structure. An attacker could exploit this vulnerability by sending a sequence of malicious SIP messages to an affected device. An exploit could allow the attacker to cause a NULL pointer dereference, resulting in a crash of the iosd process. This triggers a reload of the device.",2023-05-22T18:57:24.750,https://cve.circl.lu/cve/CVE-2019-12654
CVE-2021-45343,3.6,NULL Pointer,"In LibreCAD 2.2.0, a NULL pointer dereference in the HATCH handling of libdxfrw allows an attacker to crash the application using a crafted DXF document.",2023-05-21T22:15:11.830,https://cve.circl.lu/cve/CVE-2021-45343
CVE-2022-2850,3.6,NULL Pointer,"A flaw was found In 389-ds-base. When the Content Synchronization plugin is enabled, an authenticated user can reach a NULL pointer dereference using a specially crafted query. This flaw allows an authenticated attacker to cause a denial of service. This CVE is assigned against an incomplete fix of CVE-2021-3514.",2023-05-18T18:04:16.263,https://cve.circl.lu/cve/CVE-2022-2850
CVE-2022-43507,5.9,OpenSSL,Improper buffer restrictions in the Intel(R) QAT Engine for OpenSSL before version 0.6.16 may allow a privileged user to potentially enable escalation of privilege via network access.,2023-05-23T14:20:04.157,https://cve.circl.lu/cve/CVE-2022-43507
CVE-2023-2647,5.9,Office,A vulnerability was found in Weaver E-Office 9.5 and classified as critical. Affected by this issue is some unknown functionality of the file /webroot/inc/utility_all.php of the component File Upload Handler. The manipulation leads to command injection. The attack may be launched remotely. The exploit has been disclosed to the public and may be used. The identifier of this vulnerability is VDB-228776. NOTE: The vendor was contacted early about this disclosure but did not respond in any way.,2023-05-17T20:51:22.823,https://cve.circl.lu/cve/CVE-2023-2647
CVE-2023-0851,5.9,Office,"Buffer overflow in CPCA Resource Download process of Office / Small Office Multifunction Printers and Laser Printers(*) which may allow an attacker on the network segment to trigger the affected product being unresponsive or to execute arbitrary code. *:Satera LBP660C Series/LBP620C Series/MF740C Series/MF640C Series firmware Ver.11.04 and earlier sold in Japan. Color imageCLASS LBP660C Series/LBP 620C Series/X LBP1127C/MF740C Series/MF640C Series/X MF1127C firmware Ver.11.04 and earlier sold in US. i-SENSYS LBP660C Series/LBP620C Series/MF740C Series/MF640C Series, C1127P, C1127iF, C1127i firmware Ver.11.04 and earlier sold in Europe.",2023-05-20T00:44:41.463,https://cve.circl.lu/cve/CVE-2023-0851
CVE-2023-0852,5.9,Office,"Buffer overflow in the Address Book of Mobile Device function of Office / Small Office Multifunction Printers and Laser Printers(*) which may allow an attacker on the network segment to trigger the affected product being unresponsive or to execute arbitrary code. *:Satera LBP660C Series/LBP620C Series/MF740C Series/MF640C Series firmware Ver.11.04 and earlier sold in Japan. Color imageCLASS LBP660C Series/LBP 620C Series/X LBP1127C/MF740C Series/MF640C Series/X MF1127C firmware Ver.11.04 and earlier sold in US. i-SENSYS LBP660C Series/LBP620C Series/MF740C Series/MF640C Series, C1127P, C1127iF, C1127i firmware Ver.11.04 and earlier sold in Europe.",2023-05-20T00:44:33.487,https://cve.circl.lu/cve/CVE-2023-0852
CVE-2023-0853,5.9,Office,"Buffer overflow in mDNS NSEC record registering process of Office / Small Office Multifunction Printers and Laser Printers(*) which may allow an attacker on the network segment to trigger the affected product being unresponsive or to execute arbitrary code. *:Satera LBP660C Series/LBP620C Series/MF740C Series/MF640C Series firmware Ver.11.04 and earlier sold in Japan. Color imageCLASS LBP660C Series/LBP 620C Series/X LBP1127C/MF740C Series/MF640C Series/X MF1127C firmware Ver.11.04 and earlier sold in US. i-SENSYS LBP660C Series/LBP620C Series/MF740C Series/MF640C Series, C1127P, C1127iF, C1127i firmware Ver.11.04 and earlier sold in Europe.",2023-05-20T00:44:22.347,https://cve.circl.lu/cve/CVE-2023-0853
CVE-2019-9568,3.6,PHP,"The ""Forminator Contact Form, Poll & Quiz Builder"" plugin before 1.6 for WordPress has SQL Injection via the wp-admin/admin.php?page=forminator-entries entry[] parameter if the attacker has the delete permission.",2023-05-18T15:42:17.260,https://cve.circl.lu/cve/CVE-2019-9568
CVE-2019-14788,5.9,PHP,wp-admin/admin-ajax.php?action=newsletters_exportmultiple in the Tribulant Newsletters plugin before 4.6.19 for WordPress allows directory traversal with resultant remote PHP code execution via the subscribers[1][1] parameter in conjunction with an exportfile=../ value.,2023-05-18T15:03:03.467,https://cve.circl.lu/cve/CVE-2019-14788
CVE-2022-28206,5.9,PHP,An issue was discovered in MediaWiki through 1.37.1. ImportPlanValidator.php in the FileImporter extension mishandles the check for edit rights.,2023-05-21T22:15:12.467,https://cve.circl.lu/cve/CVE-2022-28206
CVE-2022-31090,4.0,PHP,"Guzzle, an extensible PHP HTTP client. `Authorization` headers on requests are sensitive information. In affected versions when using our Curl handler, it is possible to use the `CURLOPT_HTTPAUTH` option to specify an `Authorization` header. On making a request which responds with a redirect to a URI with a different origin (change in host, scheme or port), if we choose to follow it, we should remove the `CURLOPT_HTTPAUTH` option before continuing, stopping curl from appending the `Authorization` header to the new request. Affected Guzzle 7 users should upgrade to Guzzle 7.4.5 as soon as possible. Affected users using any earlier series of Guzzle should upgrade to Guzzle 6.5.8 or 7.4.5. Note that a partial fix was implemented in Guzzle 7.4.2, where a change in host would trigger removal of the curl-added Authorization header, however this earlier fix did not cover change in scheme or change in port. If you do not require or expect redirects to be followed, one should simply disable redirects all together. Alternatively, one can specify to use the Guzzle steam handler backend, rather than curl.",2023-05-21T22:15:12.610,https://cve.circl.lu/cve/CVE-2022-31090
CVE-2023-0007,2.7,Palo Alto,A cross-site scripting (XSS) vulnerability in Palo Alto Networks PAN-OS software on Panorama appliances enables an authenticated read-write administrator to store a JavaScript payload in the web interface that will execute in the context of another administrator’s browser when viewed.,2023-05-17T19:50:00.107,https://cve.circl.lu/cve/CVE-2023-0007
CVE-2023-0008,3.6,Palo Alto,A file disclosure vulnerability in Palo Alto Networks PAN-OS software enables an authenticated read-write administrator with access to the web interface to export local files from the firewall through a race condition.,2023-05-17T19:43:56.483,https://cve.circl.lu/cve/CVE-2023-0008
CVE-2023-30837,3.6,Python,Vyper is a pythonic smart contract language for the EVM. The storage allocator does not guard against allocation overflows in versions prior to 0.3.8. An attacker can overwrite the owner variable. This issue was fixed in version 0.3.8.,2023-05-17T15:11:27.660,https://cve.circl.lu/cve/CVE-2023-30837
CVE-2019-9567,2.7,RDP,"The ""Forminator Contact Form, Poll & Quiz Builder"" plugin before 1.6 for WordPress has XSS via a custom input field of a poll.",2023-05-18T15:42:36.547,https://cve.circl.lu/cve/CVE-2019-9567
CVE-2014-6418,6.9,Red Hat,"net/ceph/auth_x.c in Ceph, as used in the Linux kernel before 3.16.3, does not properly validate auth replies, which allows remote attackers to cause a denial of service (system crash) or possibly have unspecified other impact via crafted data from the IP address of a Ceph Monitor.",2023-05-19T16:50:32.413,https://cve.circl.lu/cve/CVE-2014-6418
CVE-2023-28859,3.6,Redis,"redis-py before 4.4.4 and 4.5.x before 4.5.4 leaves a connection open after canceling an async Redis command at an inopportune time, and can send response data to the client of an unrelated request. (This could, for example, happen for a non-pipeline operation.) NOTE: the solutions for CVE-2023-28859 address data leakage across AsyncIO connections in general.",2023-05-17T17:08:20.883,https://cve.circl.lu/cve/CVE-2023-28859
CVE-2023-31655,NA,Redis,redis-7.0.10 was discovered to contain a segmentation violation.,2023-05-18T20:16:21.423,https://cve.circl.lu/cve/CVE-2023-31655
CVE-2023-2721,NA,Remote Desktop,Use after free in Navigation in Google Chrome prior to 113.0.5672.126 allowed a remote attacker to potentially exploit heap corruption via a crafted HTML page. (Chromium security severity: Critical),2023-05-22T04:15:09.867,https://cve.circl.lu/cve/CVE-2023-2721
CVE-2023-2722,NA,Remote Desktop,Use after free in Autofill UI in Google Chrome on Android prior to 113.0.5672.126 allowed a remote attacker to potentially exploit heap corruption via a crafted HTML page. (Chromium security severity: High),2023-05-22T04:15:09.933,https://cve.circl.lu/cve/CVE-2023-2722
CVE-2023-2723,NA,Remote Desktop,Use after free in DevTools in Google Chrome prior to 113.0.5672.126 allowed a remote attacker who had compromised the renderer process to potentially exploit heap corruption via a crafted HTML page. (Chromium security severity: High),2023-05-22T04:15:10.010,https://cve.circl.lu/cve/CVE-2023-2723
CVE-2023-2724,NA,Remote Desktop,Type confusion in V8 in Google Chrome prior to 113.0.5672.126 allowed a remote attacker to potentially exploit heap corruption via a crafted HTML page. (Chromium security severity: High),2023-05-22T04:15:10.077,https://cve.circl.lu/cve/CVE-2023-2724
CVE-2023-2426,3.6,Repository,Use of Out-of-range Pointer Offset in GitHub repository vim/vim prior to 9.0.1499.,2023-05-20T04:15:09.527,https://cve.circl.lu/cve/CVE-2023-2426
CVE-2023-2479,5.9,Repository,OS Command Injection in GitHub repository appium/appium-desktop prior to v1.22.3-4.,2023-05-17T17:05:52.643,https://cve.circl.lu/cve/CVE-2023-2479
CVE-2023-2629,5.9,Repository,Improper Neutralization of Formula Elements in a CSV File in GitHub repository pimcore/customer-data-framework prior to 3.3.9.,2023-05-17T17:15:23.327,https://cve.circl.lu/cve/CVE-2023-2629
CVE-2023-2630,2.7,Repository,Cross-site Scripting (XSS) - Stored in GitHub repository pimcore/pimcore prior to 10.5.21.,2023-05-17T13:16:52.083,https://cve.circl.lu/cve/CVE-2023-2630
CVE-2018-3919,6.0,Repo,"An exploitable stack-based buffer overflow vulnerability exists in the retrieval of database fields in video-core's HTTP server of Samsung SmartThings Hub STH-ETH-250 devices with firmware version 0.20.17. The video-core process insecurely extracts the fields from the ""clips"" table of its SQLite database, leading to a buffer overflow on the stack. An attacker can send a series of HTTP requests to trigger this vulnerability.",2023-05-19T16:50:21.370,https://cve.circl.lu/cve/CVE-2018-3919
CVE-2018-3880,6.0,Repo,"An exploitable stack-based buffer overflow vulnerability exists in the database 'find-by-cameraId' functionality of video-core's HTTP server of Samsung SmartThings Hub STH-ETH-250 - Firmware version 0.20.17. The video-core process incorrectly handles existing records inside its SQLite database, leading to a buffer overflow on the stack. An attacker can send an HTTP request to trigger this vulnerability.",2023-05-19T16:50:14.507,https://cve.circl.lu/cve/CVE-2018-3880
CVE-2018-3875,6.0,Repo,"An exploitable buffer overflow vulnerability exists in the credentials handler of video-core's HTTP server of Samsung SmartThings Hub STH-ETH-250-Firmware version 0.20.17. The video-core process incorrectly extracts fields from a user-controlled JSON payload, leading to a buffer overflow on the stack. The strncpy overflows the destination buffer, which has a size of 2,000 bytes. An attacker can send an arbitrarily long ""sessionToken"" value in order to exploit this vulnerability.",2023-05-19T16:49:55.027,https://cve.circl.lu/cve/CVE-2018-3875
