CVE,"Impact Score (1-10, 10 being the worst)",Keyword,Description,Last Modified,Link
CVE-2021-34703,3.6,SNMP,"A vulnerability in the Link Layer Discovery Protocol (LLDP) message parser of Cisco IOS Software and Cisco IOS XE Software could allow an attacker to trigger a reload of an affected device, resulting in a denial of service (DoS) condition. This vulnerability is due to improper initialization of a buffer. An attacker could exploit this vulnerability via any of the following methods: An authenticated, remote attacker could access the LLDP neighbor table via either the CLI or SNMP while the device is in a specific state. An unauthenticated, adjacent attacker could corrupt the LLDP neighbor table by injecting specific LLDP frames into the network and then waiting for an administrator of the device or a network management system (NMS) managing the device to retrieve the LLDP neighbor table of the device via either the CLI or SNMP. An authenticated, adjacent attacker with SNMP read-only credentials or low privileges on the device CLI could corrupt the LLDP neighbor table by injecting specific LLDP frames into the network and then accessing the LLDP neighbor table via either the CLI or SNMP. A successful exploit could allow the attacker to cause the affected device to crash, resulting in a reload of the device.",2023-05-22T18:57:24.750,https://cve.circl.lu/cve/CVE-2021-34703
CVE-2022-46738,2.7,SNMP,The affected product exposes multiple sensitive data fields of the affected product. An attacker can use the SNMP command to get device mac address and login as admin.,2023-05-23T13:04:39.657,https://cve.circl.lu/cve/CVE-2022-46738
CVE-2021-46880,5.9,SSL,"x509/x509_verify.c in LibreSSL before 3.4.2, and OpenBSD before 7.0 errata 006, allows authentication bypass because an error for an unverified certificate chain is sometimes discarded.",2023-05-17T20:15:09.333,https://cve.circl.lu/cve/CVE-2021-46880
CVE-2023-1934,3.6,SSL,"The PnPSCADA system, a product of SDG Technologies CC, is afflicted by a critical unauthenticated error-based PostgreSQL Injection vulnerability. Present within the hitlogcsv.jsp endpoint, this security flaw permits unauthenticated attackers to engage with the underlying database seamlessly and passively. Consequently, malicious actors could gain access to vital information, such as Industrial Control System (ICS) and OT data, alongside other sensitive records like SMS and SMS Logs. The unauthorized database access exposes compromised systems to potential manipulation or breach of essential infrastructure data, highlighting the severity of this vulnerability.",2023-05-24T01:24:00.233,https://cve.circl.lu/cve/CVE-2023-1934
CVE-2022-45453,3.6,SSL,"TLS/SSL weak cipher suites enabled. The following products are affected: Acronis Cyber Protect 15 (Windows, Linux) before build 30984.",2023-05-18T12:53:07.890,https://cve.circl.lu/cve/CVE-2022-45453
CVE-2020-3404,5.9,SSH,"A vulnerability in the persistent Telnet/Secure Shell (SSH) CLI of Cisco IOS XE Software could allow an authenticated, local attacker to gain shell access on an affected device and execute commands on the underlying operating system (OS) with root privileges. The vulnerability is due to insufficient enforcement of the consent token in authorizing shell access. An attacker could exploit this vulnerability by authenticating to the persistent Telnet/SSH CLI on an affected device and requesting shell access. A successful exploit could allow the attacker to gain shell access on the affected device and execute commands on the underlying OS with root privileges.",2023-05-23T13:55:46.380,https://cve.circl.lu/cve/CVE-2020-3404
CVE-2023-20046,5.9,SSH,"A vulnerability in the key-based SSH authentication feature of Cisco StarOS Software could allow an authenticated, remote attacker to elevate privileges on an affected device. This vulnerability is due to insufficient validation of user-supplied credentials. An attacker could exploit this vulnerability by sending a valid low-privileged SSH key to an affected device from a host that has an IP address that is configured as the source for a high-privileged user account. A successful exploit could allow the attacker to log in to the affected device through SSH as a high-privileged user.   There are workarounds that address this vulnerability.",2023-05-17T18:11:46.627,https://cve.circl.lu/cve/CVE-2023-20046
CVE-2023-33235,5.9,SSH,"MXsecurity version 1.0 is vulnearble to command injection vulnerability. This vulnerability has been reported in the SSH CLI program, which can be exploited by attackers who have gained authorization privileges. The attackers can break out of the restricted shell and subsequently execute arbitrary code.",2023-05-22T10:56:50.933,https://cve.circl.lu/cve/CVE-2023-33235
CVE-2023-2588,5.9,SSH,"Teltonika’s Remote Management System versions prior to 4.10.0 have a feature allowing users to access managed devices’ local secure shell (SSH)/web management services over the cloud proxy. A user can request a web proxy and obtain a URL in the Remote Management System cloud subdomain. This URL could be shared with others without Remote Management System authentication . An attacker could exploit this vulnerability to create a malicious webpage that uses a trusted and certified domain. An attacker could initiate a reverse shell when a victim connects to the malicious webpage, achieving remote code execution on the victim device.",2023-05-22T16:15:51.187,https://cve.circl.lu/cve/CVE-2023-2588
CVE-2023-26463,5.9,TLS,"strongSwan 5.9.8 and 5.9.9 potentially allows remote code execution because it uses a variable named ""public"" for two different purposes within the same function. There is initially incorrect access control, later followed by an expired pointer dereference. One attack vector is sending an untrusted client certificate during EAP-TLS. A server is affected only if it loads plugins that implement TLS-based EAP methods (EAP-TLS, EAP-TTLS, EAP-PEAP, or EAP-TNC). This is fixed in 5.9.10.",2023-05-17T20:15:09.867,https://cve.circl.lu/cve/CVE-2023-26463
CVE-2022-36937,5.9,TLS,"HHVM 4.172.0 and all prior versions use TLS 1.0 for secure connections when handling tls:// URLs in the stream extension. TLS1.0 has numerous published vulnerabilities and is deprecated. HHVM 4.153.4, 4.168.2, 4.169.2, 4.170.2, 4.171.1, 4.172.1, 4.173.0 replaces TLS1.0 with TLS1.3.Applications that call stream_socket_server or stream_socket_client functions with a URL starting with tls:// are affected.",2023-05-18T21:21:31.163,https://cve.circl.lu/cve/CVE-2022-36937
CVE-2023-31442,3.6,TLS,"In Lightbend Akka before 2.8.1, the async-dns resolver (used by Discovery in DNS mode and transitively by Cluster Bootstrap) uses predictable DNS transaction IDs when resolving DNS records, making DNS resolution subject to poisoning by an attacker. If the application performing discovery does not validate (e.g., via TLS) the authenticity of the discovered service, this may result in exfiltration of application data (e.g., persistence events may be published to an unintended Kafka broker). If such validation is performed, then the poisoning constitutes a denial of access to the intended service. This affects Akka 2.5.14 through 2.8.0, and Akka Discovery through 2.8.0.",2023-05-22T19:25:05.797,https://cve.circl.lu/cve/CVE-2023-31442
CVE-2023-30351,3.6,Tenda,Shenzen Tenda Technology IP Camera CP3 V11.10.00.2211041355 was discovered to contain a hard-coded default password for root which is stored using weak encryption. This vulnerability allows attackers to connect to the TELNET service (or UART) by using the exposed credentials.,2023-05-17T20:36:04.243,https://cve.circl.lu/cve/CVE-2023-30351
CVE-2023-30352,5.9,Tenda,Shenzen Tenda Technology IP Camera CP3 V11.10.00.2211041355 was discovered to contain a hard-coded default password for the RTSP feed.,2023-05-17T20:33:46.237,https://cve.circl.lu/cve/CVE-2023-30352
CVE-2023-30353,5.9,Tenda,Shenzen Tenda Technology IP Camera CP3 V11.10.00.2211041355 allows unauthenticated remote code execution via an XML document.,2023-05-17T20:32:56.523,https://cve.circl.lu/cve/CVE-2023-30353
CVE-2023-30354,5.9,Tenda,"Shenzen Tenda Technology IP Camera CP3 V11.10.00.2211041355 does not defend against physical access to U-Boot via the UART: the Wi-Fi password is shown, and the hardcoded boot password can be inserted for console access.",2023-05-18T12:55:54.787,https://cve.circl.lu/cve/CVE-2023-30354
CVE-2023-30356,3.6,Tenda,Missing Support for an Integrity Check in Shenzen Tenda Technology IP Camera CP3 V11.10.00.2211041355 allows attackers to update the device with crafted firmware,2023-05-17T20:06:55.363,https://cve.circl.lu/cve/CVE-2023-30356
CVE-2020-3479,3.6,VPN,"A vulnerability in the implementation of Multiprotocol Border Gateway Protocol (MP-BGP) for the Layer 2 VPN (L2VPN) Ethernet VPN (EVPN) address family in Cisco IOS Software and Cisco IOS XE Software could allow an unauthenticated, remote attacker to cause a denial of service (DoS) condition. The vulnerability is due to incorrect processing of Border Gateway Protocol (BGP) update messages that contain crafted EVPN attributes. An attacker could exploit this vulnerability by sending BGP update messages with specific, malformed attributes to an affected device. A successful exploit could allow the attacker to cause an affected device to crash, resulting in a DoS condition.",2023-05-22T18:57:24.750,https://cve.circl.lu/cve/CVE-2020-3479
CVE-2023-28182,3.6,VPN,"The issue was addressed with improved authentication. This issue is fixed in iOS 15.7.4 and iPadOS 15.7.4, macOS Ventura 13.3, macOS Big Sur 11.7.5, macOS Monterey 12.6.4, iOS 16.4 and iPadOS 16.4. A user in a privileged network position may be able to spoof a VPN server that is configured with EAP-only authentication on a device",2023-05-19T16:15:13.720,https://cve.circl.lu/cve/CVE-2023-28182
CVE-2023-32348,1.4,VPN,"Teltonika’s Remote Management System versions prior to 4.10.0 contain a virtual private network (VPN) hub feature for cross-device communication that uses OpenVPN. It connects new devices in a manner that allows the new device to communicate with all Teltonika devices connected to the VPN. The OpenVPN server also allows users to route through it. An attacker could route a connection to a remote server through the OpenVPN server, enabling them to scan and access data from other Teltonika devices connected to the VPN.",2023-05-22T16:15:51.187,https://cve.circl.lu/cve/CVE-2023-32348
CVE-2021-1449,5.9,VS Code,"A vulnerability in the boot logic of Cisco Access Points Software could allow an authenticated, local attacker to execute unsigned code at boot time. The vulnerability is due to an improper check that is performed by the area of code that manages system startup processes. An attacker could exploit this vulnerability by modifying a specific file that is stored on the system, which would allow the attacker to bypass existing protections. A successful exploit could allow the attacker to execute unsigned code at boot time and bypass the software image verification check part of the secure boot process of an affected device. Note: To exploit this vulnerability, the attacker would need to have access to the development shell (devshell) on the device.",2023-05-22T18:57:24.750,https://cve.circl.lu/cve/CVE-2021-1449
CVE-2021-45341,5.9,VS Code,A buffer overflow vulnerability in CDataMoji of the jwwlib component of LibreCAD 2.2.0-rc3 and older allows an attacker to achieve Remote Code Execution using a crafted JWW document.,2023-05-21T22:15:11.663,https://cve.circl.lu/cve/CVE-2021-45341
CVE-2021-45342,5.9,VS Code,A buffer overflow vulnerability in CDataList of the jwwlib component of LibreCAD 2.2.0-rc3 and older allows an attacker to achieve Remote Code Execution using a crafted JWW document.,2023-05-21T22:15:11.757,https://cve.circl.lu/cve/CVE-2021-45342
CVE-2023-22809,5.9,Vim,"In Sudo before 1.9.12p2, the sudoedit (aka -e) feature mishandles extra arguments passed in the user-provided environment variables (SUDO_EDITOR, VISUAL, and EDITOR), allowing a local attacker to append arbitrary entries to the list of files to process. This can lead to privilege escalation. Affected versions are 1.8.0 through 1.9.12.p1. The problem exists because a user-specified editor may contain a ""--"" argument that defeats a protection mechanism, e.g., an EDITOR='vim -- /path/to/extra/file' value.",2023-05-23T16:15:21.390,https://cve.circl.lu/cve/CVE-2023-22809
CVE-2022-32287,3.6,Virtual Machine,A relative path traversal vulnerability in a FileUtil class used by the PEAR management component of Apache UIMA allows an attacker to create files outside the designated target directory using carefully crafted ZIP entry names. This issue affects Apache UIMA Apache UIMA version 3.3.0 and prior versions. Note that PEAR files should never be installed into an UIMA installation from untrusted sources because PEAR archives are executable plugins that will be able to perform any actions with the same privileges as the host Java Virtual Machine.,2023-05-22T15:44:41.953,https://cve.circl.lu/cve/CVE-2022-32287
CVE-2022-42336,NA,Xen,"Mishandling of guest SSBD selection on AMD hardware The current logic to set SSBD on AMD Family 17h and Hygon Family 18h processors requires that the setting of SSBD is coordinated at a core level, as the setting is shared between threads. Logic was introduced to keep track of how many threads require SSBD active in order to coordinate it, such logic relies on using a per-core counter of threads that have SSBD active. When running on the mentioned hardware, it's possible for a guest to under or overflow the thread counter, because each write to VIRT_SPEC_CTRL.SSBD by the guest gets propagated to the helper that does the per-core active accounting. Underflowing the counter causes the value to get saturated, and thus attempts for guests running on the same core to set SSBD won't have effect because the hypervisor assumes it's already active.",2023-05-17T12:46:46.567,https://cve.circl.lu/cve/CVE-2022-42336
CVE-2023-1859,NA,Xen,"A use-after-free flaw was found in xen_9pfs_front_removet in net/9p/trans_xen.c in Xen transport for 9pfs in the Linux Kernel. This flaw could allow a local attacker to crash the system due to a race problem, possibly leading to a kernel information leak.",2023-05-18T12:53:07.890,https://cve.circl.lu/cve/CVE-2023-1859
CVE-2021-29657,5.9,X86,"arch/x86/kvm/svm/nested.c in the Linux kernel before 5.11.12 has a use-after-free in which an AMD KVM guest can bypass access control on host OS MSRs when there are nested guests, aka CID-a58d9166a756. This occurs because of a TOCTOU race condition associated with a VMCB12 double fetch in nested_svm_vmrun.",2023-05-19T16:51:04.113,https://cve.circl.lu/cve/CVE-2021-29657
CVE-2022-45770,5.9,X86,Improper input validation in adgnetworkwfpdrv.sys in Adguard For Windows x86 through 7.11 allows local privilege escalation.,2023-05-23T23:15:09.093,https://cve.circl.lu/cve/CVE-2022-45770
CVE-2023-2644,5.9,X86,"A vulnerability, which was classified as problematic, has been found in DigitalPersona FPSensor 1.0.0.1. This issue affects some unknown processing of the file C:\Program Files (x86)\FPSensor\bin\DpHost.exe. The manipulation leads to unquoted search path. Attacking locally is a requirement. The identifier VDB-228773 was assigned to this vulnerability.",2023-05-23T19:00:42.333,https://cve.circl.lu/cve/CVE-2023-2644
