CVE,"Impact Score (1-10, 10 being the worst)",Keyword,Description,Last Modified,Link
CVE-2023-32322,3.6,EMC,"Ombi is an open source application which allows users to request specific media from popular self-hosted streaming servers. Versions prior to 4.38.2 contain an arbitrary file read vulnerability where an Ombi administrative user may access files available to the Ombi server process on the host operating system. Ombi administrators may not always be local system administrators and so this may violate the security expectations of the system. The arbitrary file read vulnerability was present in `ReadLogFile` and `Download` endpoints in `SystemControllers.cs` as the parameter `logFileName` is not sanitized before being combined with the `Logs` directory. When using `Path.Combine(arg1, arg2, arg3)`, an attacker may be able to escape to folders/files outside of `Path.Combine(arg1, arg2)` by using "".."" in `arg3`. In addition, by specifying an absolute path for `arg3`, `Path.Combine` will completely ignore the first two arguments and just return just `arg3`. This vulnerability can lead to information disclosure. The Ombi `documentation` suggests running Ombi as a Service with Administrator privileges. An attacker targeting such an application may be able to read the files of any Windows user on the host machine and certain system files. This issue has been addressed in commit `b8a8f029` and in release version 4.38.2. Users are advised to upgrade. There are no known workarounds for this vulnerability. This issue is also tracked as GHSL-2023-088.",2023-05-18T18:04:44.523,https://cve.circl.lu/cve/CVE-2023-32322
CVE-2023-31707,NA,EMC,SEMCMS 1.5 is vulnerable to SQL Injection via Ant_Rponse.php.,2023-05-19T17:53:19.810,https://cve.circl.lu/cve/CVE-2023-31707
CVE-2023-2597,5.9,Eclipse,"In Eclipse Openj9 before version 0.38.0, in the implementation of the shared cache (which is enabled by default in OpenJ9 builds) the size of a string is not properly checked against the size of the buffer.",2023-05-22T13:21:34.157,https://cve.circl.lu/cve/CVE-2023-2597
CVE-2023-31146,5.2,Ethereum,"Vyper is a Pythonic smart contract language for the Ethereum virtual machine. Prior to version 0.3.8, during codegen, the length word of a dynarray is written before the data, which can result in out-of-bounds array access in the case where the dynarray is on both the lhs and rhs of an assignment. The issue can cause data corruption across call frames. The expected behavior is to revert due to out-of-bounds array access. Version 0.3.8 contains a patch for this issue.",2023-05-22T18:12:02.287,https://cve.circl.lu/cve/CVE-2023-31146
CVE-2023-32058,3.6,Ethereum,"Vyper is a Pythonic smart contract language for the Ethereum virtual machine. Prior to version 0.3.8, due to missing overflow check for loop variables, by assigning the iterator of a loop to a variable, it is possible to overflow the type of the latter. The issue seems to happen only in loops of type `for i in range(a, a + N)` as in loops of type `for i in range(start, stop)` and `for i in range(stop)`, the compiler is able to raise a `TypeMismatch` when trying to overflow the variable. The problem has been patched in version 0.3.8.",2023-05-22T18:08:53.923,https://cve.circl.lu/cve/CVE-2023-32058
CVE-2023-32059,3.6,Ethereum,"Vyper is a Pythonic smart contract language for the Ethereum virtual machine. Prior to version 0.3.8, internal calls with default arguments are compiled incorrectly. Depending on the number of arguments provided in the call, the defaults are added not right-to-left, but left-to-right. If the types are incompatible, typechecking is bypassed. The ability to pass kwargs to internal functions is an undocumented feature that is not well known about. The issue is patched in version 0.3.8.",2023-05-23T19:07:14.350,https://cve.circl.lu/cve/CVE-2023-32059
CVE-2023-32675,1.4,Ethereum,"Vyper is a pythonic Smart Contract Language for the ethereum virtual machine. In contracts with more than one regular nonpayable function, it is possible to send funds to the default function, even if the default function is marked `nonpayable`. This applies to contracts compiled with vyper versions prior to 0.3.8. This issue was fixed by the removal of the global `calldatasize` check in commit `02339dfda`. Users are advised to upgrade to version 0.3.8. Users unable to upgrade should avoid use of nonpayable default functions.",2023-05-20T11:31:57.830,https://cve.circl.lu/cve/CVE-2023-32675
CVE-2022-41104,3.6,Excel,Microsoft Excel Security Feature Bypass Vulnerability,2023-05-19T17:15:08.920,https://cve.circl.lu/cve/CVE-2022-41104
CVE-2023-23396,3.6,Excel,Microsoft Excel Denial of Service Vulnerability,2023-05-19T15:09:58.743,https://cve.circl.lu/cve/CVE-2023-23396
CVE-2023-30330,5.9,Excel,SoftExpert (SE) Excellence Suite 2.x versions before 2.1.3 is vulnerable to Local File Inclusion in the function /se/v42300/generic/gn_defaultframe/2.0/defaultframe_filter.php.,2023-05-23T19:17:36.410,https://cve.circl.lu/cve/CVE-2023-30330
CVE-2014-5077,6.9,Exchange,"The sctp_assoc_update function in net/sctp/associola.c in the Linux kernel through 3.15.8, when SCTP authentication is enabled, allows remote attackers to cause a denial of service (NULL pointer dereference and OOPS) by starting to establish an association between two endpoints immediately after an exchange of INIT and INIT ACK chunks to establish an earlier association between these endpoints in the opposite direction.",2023-05-19T16:50:38.867,https://cve.circl.lu/cve/CVE-2014-5077
CVE-2023-0361,5.2,Exchange,"A timing side-channel in the handling of RSA ClientKeyExchange messages was discovered in GnuTLS. This side-channel can be sufficient to recover the key encrypted in the RSA ciphertext across a network in a Bleichenbacher style attack. To achieve a successful decryption the attacker would need to send a large amount of specially crafted messages to the vulnerable server. By recovering the secret from the ClientKeyExchange message, the attacker would be able to decrypt the application data exchanged over that connection.",2023-05-23T17:22:55.810,https://cve.circl.lu/cve/CVE-2023-0361
CVE-2023-28528,5.9,Exchange,"IBM AIX 7.1, 7.2, 7.3, and VIOS 3.1 could allow a non-privileged local user to exploit a vulnerability in the invscout command to execute arbitrary commands.  IBM X-Force ID:  251207.",2023-05-18T16:15:09.617,https://cve.circl.lu/cve/CVE-2023-28528
CVE-2016-2279,2.7,Exploit,Cross-site scripting (XSS) vulnerability in the web server in Rockwell Automation Allen-Bradley CompactLogix 1769-L* before 28.011+ allows remote attackers to inject arbitrary web script or HTML via unspecified vectors.,2023-05-23T14:00:31.100,https://cve.circl.lu/cve/CVE-2016-2279
CVE-2018-3878,6.0,Exploit,"Multiple exploitable buffer overflow vulnerabilities exist in the credentials handler of video-core's HTTP server of Samsung SmartThings Hub STH-ETH-250 devices with firmware version 0.20.17. The video-core process incorrectly extracts fields from a user-controlled JSON payload, leading to a buffer overflow on the stack. A strncpy overflows the destination buffer, which has a size of 16 bytes. An attacker can send an arbitrarily long ""region"" value in order to exploit this vulnerability.",2023-05-19T16:50:10.250,https://cve.circl.lu/cve/CVE-2018-3878
CVE-2020-11514,5.9,Endpoint,"The Rank Math plugin through 1.0.40.2 for WordPress allows unauthenticated remote attackers to update arbitrary WordPress metadata, including the ability to escalate or revoke administrative privileges for existing users via the unsecured rankmath/v1/updateMeta REST API endpoint.",2023-05-23T14:57:32.420,https://cve.circl.lu/cve/CVE-2020-11514
CVE-2020-11515,2.7,Endpoint,"The Rank Math plugin through 1.0.40.2 for WordPress allows unauthenticated remote attackers to create new URIs (that redirect to an external web site) via the unsecured rankmath/v1/updateRedirection REST API endpoint. In other words, this is not an ""Open Redirect"" issue; instead, it allows the attacker to create a new URI with an arbitrary name (e.g., the /exampleredirect URI).",2023-05-23T14:57:32.420,https://cve.circl.lu/cve/CVE-2020-11515
CVE-2020-3428,3.6,Endpoint,"A vulnerability in the WLAN Local Profiling feature of Cisco IOS XE Wireless Controller Software for the Cisco Catalyst 9000 Family could allow an unauthenticated, adjacent attacker to cause a denial of service (DoS) condition on an affected device. The vulnerability is due to incorrect parsing of HTTP packets while performing HTTP-based endpoint device classifications. An attacker could exploit this vulnerability by sending a crafted HTTP packet to an affected device. A successful exploit could cause an affected device to reboot, resulting in a DoS condition.",2023-05-22T18:57:24.750,https://cve.circl.lu/cve/CVE-2020-3428
CVE-2020-3421,3.6,Firewall,"Multiple vulnerabilities in the Zone-Based Firewall feature of Cisco IOS XE Software could allow an unauthenticated, remote attacker to cause the device to reload or stop forwarding traffic through the firewall. The vulnerabilities are due to incomplete handling of Layer 4 packets through the device. An attacker could exploit these vulnerabilities by sending a certain sequence of traffic patterns through the device. A successful exploit could allow the attacker to cause the device to reload or stop forwarding traffic through the firewall, resulting in a denial of service. For more information about these vulnerabilities, see the Details section of this advisory.",2023-05-22T18:57:24.750,https://cve.circl.lu/cve/CVE-2020-3421
CVE-2020-3480,4.0,Firewall,"Multiple vulnerabilities in the Zone-Based Firewall feature of Cisco IOS XE Software could allow an unauthenticated, remote attacker to cause the device to reload or stop forwarding traffic through the firewall. The vulnerabilities are due to incomplete handling of Layer 4 packets through the device. An attacker could exploit these vulnerabilities by sending a certain sequence of traffic patterns through the device. A successful exploit could allow the attacker to cause the device to reload or stop forwarding traffic through the firewall, resulting in a denial of service. For more information about these vulnerabilities, see the Details section of this advisory.",2023-05-22T18:57:24.750,https://cve.circl.lu/cve/CVE-2020-3480
CVE-2022-39956,5.9,Firewall,"The OWASP ModSecurity Core Rule Set (CRS) is affected by a partial rule set bypass for HTTP multipart requests by submitting a payload that uses a character encoding scheme via the Content-Type or the deprecated Content-Transfer-Encoding multipart MIME header fields that will not be decoded and inspected by the web application firewall engine and the rule set. The multipart payload will therefore bypass detection. A vulnerable backend that supports these encoding schemes can potentially be exploited. The legacy CRS versions 3.0.x and 3.1.x are affected, as well as the currently supported versions 3.2.1 and 3.3.2. Integrators and users are advised upgrade to 3.2.2 and 3.3.3 respectively. The mitigation against these vulnerabilities depends on the installation of the latest ModSecurity version (v2.9.6 / v3.0.8).",2023-05-21T22:15:13.937,https://cve.circl.lu/cve/CVE-2022-39956
CVE-2022-39957,3.6,Firewall,"The OWASP ModSecurity Core Rule Set (CRS) is affected by a response body bypass. A client can issue an HTTP Accept header field containing an optional ""charset"" parameter in order to receive the response in an encoded form. Depending on the ""charset"", this response can not be decoded by the web application firewall. A restricted resource, access to which would ordinarily be detected, may therefore bypass detection. The legacy CRS versions 3.0.x and 3.1.x are affected, as well as the currently supported versions 3.2.1 and 3.3.2. Integrators and users are advised to upgrade to 3.2.2 and 3.3.3 respectively.",2023-05-21T22:15:14.133,https://cve.circl.lu/cve/CVE-2022-39957
CVE-2023-2250,5.9,GIS,"A flaw was found in the Open Cluster Management (OCM) when a user have access to the worker nodes which has the cluster-manager-registration-controller or cluster-manager deployments. A malicious user can take advantage of this and bind the cluster-admin to any service account or using the service account to list all secrets for all kubernetes namespaces, leading into a cluster-level privilege escalation.",2023-05-17T19:57:05.427,https://cve.circl.lu/cve/CVE-2023-2250
CVE-2023-25834,2.5,GIS,Changes to user permissions in Portal for ArcGIS 10.9.1 and below are incompletely applied in specific use cases. This issue may allow users to access content that they are no longer privileged to access.,2023-05-22T22:15:10.180,https://cve.circl.lu/cve/CVE-2023-25834
CVE-2022-23818,3.6,GIS,Insufficient input validation on the modelspecific register: VM_HSAVE_PA may potentially lead to loss of SEV-SNP guestmemory integrity. ,2023-05-22T15:51:44.203,https://cve.circl.lu/cve/CVE-2022-23818
CVE-2023-25832,5.9,GIS,There is a cross-site-request forgery vulnerability in Esri Portal for ArcGIS Versions 11.0 and below that may allow an attacker to trick an authorized user into executing unwanted actions.,2023-05-22T22:15:09.997,https://cve.circl.lu/cve/CVE-2023-25832
CVE-2023-25833,2.7,GIS,"There is an HTML injection vulnerability in Esri Portal for ArcGIS versions 11.0 and below that may allow a remote, authenticated attacker to create a crafted link which when clicked could render arbitrary HTML in the victim’s browser (no stateful change made or customer data rendered).",2023-05-22T22:15:10.087,https://cve.circl.lu/cve/CVE-2023-25833
CVE-2023-0664,5.9,GitLab,A flaw was found in the QEMU Guest Agent service for Windows. A local unprivileged user may be able to manipulate the QEMU Guest Agent's Windows installer via repair custom actions to elevate their privileges on the system.,2023-05-17T20:15:09.687,https://cve.circl.lu/cve/CVE-2023-0664
CVE-2023-32668,3.6,GitLab,"LuaTeX before 1.17.0 allows a document (compiled with the default settings) to make arbitrary network requests. This occurs because full access to the socket library is permitted by default, as stated in the documentation. This also affects TeX Live before 2023 r66984 and MiKTeX before 23.5.",2023-05-23T17:31:45.217,https://cve.circl.lu/cve/CVE-2023-32668
CVE-2023-2731,NA,GitLab,"A NULL pointer dereference flaw was found in Libtiff's LZWDecode() function in the libtiff/tif_lzw.c file. This flaw allows a local attacker to craft specific input data that can cause the program to dereference a NULL pointer when decompressing a TIFF format file, resulting in a program crash or denial of service.",2023-05-18T12:53:07.890,https://cve.circl.lu/cve/CVE-2023-2731
CVE-2019-25137,NA,GitLab,"Umbraco CMS 4.11.8 through 7.15.10, and 7.12.4, allows Remote Code Execution by authenticated administrators via msxsl:script in an xsltSelection to developer/Xslt/xsltVisualize.aspx.",2023-05-22T06:15:09.520,https://cve.circl.lu/cve/CVE-2019-25137
CVE-2023-24539,3.4,Golang,"Angle brackets (<>) are not considered dangerous characters when inserted into CSS contexts. Templates containing multiple actions separated by a '/' character can result in unexpectedly closing the CSS context and allowing for injection of unexpected HTML, if executed with untrusted input.",2023-05-22T18:22:51.903,https://cve.circl.lu/cve/CVE-2023-24539
CVE-2023-24540,5.9,Golang,"Not all valid JavaScript whitespace characters are considered to be whitespace. Templates containing whitespace characters outside of the character set ""\t\n\f\r\u0020\u2028\u2029"" in JavaScript contexts that also contain actions may not be properly sanitized during execution.",2023-05-22T18:22:32.727,https://cve.circl.lu/cve/CVE-2023-24540
CVE-2023-29400,3.4,Golang,"Templates containing actions in unquoted HTML attributes (e.g. ""attr={{.}}"") executed with empty input can result in output with unexpected results when parsed due to HTML normalization rules. This may allow injection of arbitrary attributes into tags.",2023-05-22T18:21:02.567,https://cve.circl.lu/cve/CVE-2023-29400
CVE-2019-10692,5.9,Google,"In the wp-google-maps plugin before 7.11.18 for WordPress, includes/class.rest-api.php in the REST API does not sanitize field names before a SELECT statement.",2023-05-23T20:30:59.777,https://cve.circl.lu/cve/CVE-2019-10692
CVE-2019-14792,2.7,Google,The WP Google Maps plugin before 7.11.35 for WordPress allows XSS via the wp-admin/ rectangle_name or rectangle_opacity parameter.,2023-05-23T20:30:59.777,https://cve.circl.lu/cve/CVE-2019-14792
CVE-2015-9305,2.7,Google,The wp-google-map-plugin plugin before 2.3.7 for WordPress has XSS related to the add_query_arg() and remove_query_arg() functions.,2023-05-23T15:11:16.463,https://cve.circl.lu/cve/CVE-2015-9305
CVE-2012-6497,2.9,GitHub,"The Authlogic gem for Ruby on Rails, when used with certain versions before 3.2.10, makes potentially unsafe find_by_id method calls, which might allow remote attackers to conduct CVE-2012-6496 SQL injection attacks via a crafted parameter in environments that have a known secret_token value, as demonstrated by a value contained in secret_token.rb in an open-source product.",2023-05-19T16:52:23.170,https://cve.circl.lu/cve/CVE-2012-6497
CVE-2013-4563,6.9,GitHub,"The udp6_ufo_fragment function in net/ipv6/udp_offload.c in the Linux kernel through 3.12, when UDP Fragmentation Offload (UFO) is enabled, does not properly perform a certain size comparison before inserting a fragment header, which allows remote attackers to cause a denial of service (panic) via a large IPv6 UDP packet, as demonstrated by use of the Token Bucket Filter (TBF) queueing discipline.",2023-05-19T16:50:53.503,https://cve.circl.lu/cve/CVE-2013-4563
CVE-2014-2672,6.9,GitHub,Race condition in the ath_tx_aggr_sleep function in drivers/net/wireless/ath/ath9k/xmit.c in the Linux kernel before 3.13.7 allows remote attackers to cause a denial of service (system crash) via a large amount of network traffic that triggers certain list deletions.,2023-05-19T16:50:49.677,https://cve.circl.lu/cve/CVE-2014-2672
CVE-2014-2706,6.9,GitHub,"Race condition in the mac80211 subsystem in the Linux kernel before 3.13.7 allows remote attackers to cause a denial of service (system crash) via network traffic that improperly interacts with the WLAN_STA_PS_STA state (aka power-save mode), related to sta_info.c and tx.c.",2023-05-19T16:50:46.427,https://cve.circl.lu/cve/CVE-2014-2706
CVE-2017-18640,3.6,Hadoop,"The Alias feature in SnakeYAML before 1.26 allows entity expansion during a load operation, a related issue to CVE-2003-1564.",2023-05-21T22:15:09.760,https://cve.circl.lu/cve/CVE-2017-18640
CVE-2022-22042,3.6,Hyper-V,Windows Hyper-V Information Disclosure Vulnerability,2023-05-17T17:15:12.270,https://cve.circl.lu/cve/CVE-2022-22042
CVE-2022-30223,3.6,Hyper-V,Windows Hyper-V Information Disclosure Vulnerability,2023-05-17T17:15:14.143,https://cve.circl.lu/cve/CVE-2022-30223
CVE-2023-27554,5.2,IBM,IBM WebSphere Application Server 8.5 and 9.0 is vulnerable to an XML External Entity Injection (XXE) attack when processing XML data. A remote attacker could exploit this vulnerability to expose sensitive information or consume memory resources. IBM X-Force ID: 249185.,2023-05-22T18:16:35.837,https://cve.circl.lu/cve/CVE-2023-27554
CVE-2023-27870,3.6,IBM,"IBM Spectrum Virtualize 8.5, under certain circumstances, could disclose sensitive credential information while a download from Fix Central is in progress. IBM X-Force ID: 249518.",2023-05-22T14:26:22.887,https://cve.circl.lu/cve/CVE-2023-27870
CVE-2017-5711,5.9,Intel,Multiple buffer overflows in Active Management Technology (AMT) in Intel Manageability Engine Firmware 8.x/9.x/10.x/11.0/11.5/11.6/11.7/11.10/11.20 allow attacker with local access to the system to execute arbitrary code with AMT execution privilege.,2023-05-22T16:18:57.140,https://cve.circl.lu/cve/CVE-2017-5711
CVE-2017-5712,5.9,Intel,Buffer overflow in Active Management Technology (AMT) in Intel Manageability Engine Firmware 8.x/9.x/10.x/11.0/11.5/11.6/11.7/11.10/11.20 allows attacker with remote Admin access to the system to execute arbitrary code with AMT execution privilege.,2023-05-22T16:18:54.070,https://cve.circl.lu/cve/CVE-2017-5712
CVE-2017-5729,5.2,Intel,Frame replay vulnerability in Wi-Fi subsystem in Intel Dual-Band and Tri-Band Wireless-AC Products allows remote attacker to replay frames via channel-based man-in-the-middle.,2023-05-22T15:40:19.407,https://cve.circl.lu/cve/CVE-2017-5729
CVE-2018-3879,5.9,Intel,"An exploitable JSON injection vulnerability exists in the credentials handler of video-core's HTTP server of Samsung SmartThings Hub STH-ETH-250 devices with firmware version 0.20.17. The video-core process incorrectly parses the user-controlled JSON payload, leading to a JSON injection which in turn leads to a SQL injection in the video-core database. An attacker can send a series of HTTP requests to trigger this vulnerability.",2023-05-19T16:50:01.493,https://cve.circl.lu/cve/CVE-2018-3879
CVE-2023-31528,5.9,IoT,Motorola CX2L Router 1.0.1 was discovered to contain a command injection vulnerability via the staticroute_list parameter.,2023-05-18T13:27:34.690,https://cve.circl.lu/cve/CVE-2023-31528
CVE-2023-31529,5.9,IoT,Motorola CX2L Router 1.0.1 was discovered to contain a command injection vulnerability via the system_time_timezone parameter.,2023-05-18T13:27:17.197,https://cve.circl.lu/cve/CVE-2023-31529
CVE-2023-31530,5.9,IoT,Motorola CX2L Router 1.0.1 was discovered to contain a command injection vulnerability via the smartqos_priority_devices parameter.,2023-05-18T13:26:52.670,https://cve.circl.lu/cve/CVE-2023-31530
CVE-2023-31531,5.9,IoT,Motorola CX2L Router 1.0.1 was discovered to contain a command injection vulnerability via the tomography_ping_number parameter.,2023-05-18T13:26:13.030,https://cve.circl.lu/cve/CVE-2023-31531
CVE-2023-31700,NA,IoT,TP-Link TL-WPA4530 KIT V2 (EU)_170406 and V2 (EU)_161115 is vulnerable to Command Injection via _httpRpmPlcDeviceAdd.,2023-05-17T17:00:54.967,https://cve.circl.lu/cve/CVE-2023-31700
CVE-2023-23999,3.7,Insight,Auth. (contributor+) Stored Cross-Site Scripting (XSS) vulnerability in MonsterInsights plugin <= 8.14.0 versions.,2023-05-18T12:53:07.890,https://cve.circl.lu/cve/CVE-2023-23999
CVE-2018-17191,5.9,Java,"Apache NetBeans (incubating) 9.0 NetBeans Proxy Auto-Configuration (PAC) interpretation is vulnerable for remote command execution (RCE). Using the nashorn script engine the environment of the javascript execution for the Proxy Auto-Configuration leaks privileged objects, that can be used to circumvent the execution limits. If a different script engine was used, no execution limits were in place. Both vectors allow remote code execution.",2023-05-23T13:31:35.920,https://cve.circl.lu/cve/CVE-2018-17191
CVE-2018-8035,2.7,Java,"This vulnerability relates to the user's browser processing of DUCC webpage input data.The javascript comprising Apache UIMA DUCC (<= 2.2.2) which runs in the user's browser does not sufficiently filter user supplied inputs, which may result in unintended execution of user supplied javascript code.",2023-05-22T11:36:12.143,https://cve.circl.lu/cve/CVE-2018-8035
CVE-2020-9334,2.7,Java,A stored XSS vulnerability exists in the Envira Photo Gallery plugin through 1.7.6 for WordPress. Successful exploitation of this vulnerability would allow a authenticated low-privileged user to inject arbitrary JavaScript code that is viewed by other users.,2023-05-23T14:22:22.827,https://cve.circl.lu/cve/CVE-2020-9334
CVE-2023-2648,5.9,JQuery,A vulnerability was found in Weaver E-Office 9.5. It has been classified as critical. This affects an unknown part of the file /inc/jquery/uploadify/uploadify.php. The manipulation of the argument Filedata leads to unrestricted upload. It is possible to initiate the attack remotely. The exploit has been disclosed to the public and may be used. The identifier VDB-228777 was assigned to this vulnerability. NOTE: The vendor was contacted early about this disclosure but did not respond in any way.,2023-05-17T20:47:29.147,https://cve.circl.lu/cve/CVE-2023-2648
CVE-2023-32070,2.7,Jira,"XWiki Platform is a generic wiki platform. Prior to version 14.6-rc-1, HTML rendering didn't check for dangerous attributes/attribute values. This allowed cross-site scripting (XSS) attacks via attributes and link URLs, e.g., supported in XWiki syntax. This has been patched in XWiki 14.6-rc-1. There are no known workarounds apart from upgrading to a fixed version.",2023-05-17T20:12:44.580,https://cve.circl.lu/cve/CVE-2023-32070
CVE-2020-35933,3.7,JavaScript,"A Reflected Authenticated Cross-Site Scripting (XSS) vulnerability in the Newsletter plugin before 6.8.2 for WordPress allows remote attackers to trick a victim into submitting a tnpc_render AJAX request containing either JavaScript in an options parameter, or a base64-encoded JSON string containing JavaScript in the encoded_options parameter.",2023-05-18T15:42:47.343,https://cve.circl.lu/cve/CVE-2020-35933
CVE-2021-32819,5.9,JavaScript,Squirrelly is a template engine implemented in JavaScript that works out of the box with ExpressJS. Squirrelly mixes pure template data with engine configuration options through the Express render API. By overwriting internal configuration options remote code execution may be triggered in downstream applications. This issue is fixed in version 9.0.0. For complete details refer to the referenced GHSL-2021-023.,2023-05-22T19:15:09.717,https://cve.circl.lu/cve/CVE-2021-32819
