CVE,"Impact Score (1-10, 10 being the worst)",Keyword,Description,Last Modified,Link
CVE-2023-29273,5.9,Adobe,"Adobe Substance 3D Painter versions 8.3.0 (and earlier) is affected by an out-of-bounds read vulnerability when parsing a crafted file, which could result in a read past the end of an allocated memory structure. An attacker could leverage this vulnerability to execute code in the context of the current user. Exploitation of this issue requires user interaction in that a victim must open a malicious file.",2023-05-17T12:50:17.923,https://cve.circl.lu/cve/CVE-2023-29273
CVE-2023-29274,5.9,Adobe,"Adobe Substance 3D Painter versions 8.3.0 (and earlier) is affected by an out-of-bounds read vulnerability when parsing a crafted file, which could result in a read past the end of an allocated memory structure. An attacker could leverage this vulnerability to execute code in the context of the current user. Exploitation of this issue requires user interaction in that a victim must open a malicious file.",2023-05-17T12:50:06.257,https://cve.circl.lu/cve/CVE-2023-29274
CVE-2023-29275,5.9,Adobe,"Adobe Substance 3D Painter versions 8.3.0 (and earlier) is affected by an out-of-bounds read vulnerability when parsing a crafted file, which could result in a read past the end of an allocated memory structure. An attacker could leverage this vulnerability to execute code in the context of the current user. Exploitation of this issue requires user interaction in that a victim must open a malicious file.",2023-05-17T12:50:00.397,https://cve.circl.lu/cve/CVE-2023-29275
CVE-2023-29276,5.9,Adobe,Adobe Substance 3D Painter versions 8.3.0 (and earlier) is affected by an out-of-bounds write vulnerability that could result in arbitrary code execution in the context of the current user. Exploitation of this issue requires user interaction in that a victim must open a malicious file.,2023-05-17T12:49:50.070,https://cve.circl.lu/cve/CVE-2023-29276
CVE-2023-29277,3.6,Adobe,Adobe Substance 3D Painter versions 8.3.0 (and earlier) is affected by an out-of-bounds read vulnerability that could lead to disclosure of sensitive memory. An attacker could leverage this vulnerability to bypass mitigations such as ASLR. Exploitation of this issue requires user interaction in that a victim must open a malicious file.,2023-05-17T12:49:25.880,https://cve.circl.lu/cve/CVE-2023-29277
CVE-2023-22884,5.9,Airflow,"Improper Neutralization of Special Elements used in a Command ('Command Injection') vulnerability in Apache Software Foundation Apache Airflow, Apache Software Foundation Apache Airflow MySQL Provider.This issue affects Apache Airflow: before 2.5.1; Apache Airflow MySQL Provider: before 4.0.0.",2023-05-22T14:26:45.583,https://cve.circl.lu/cve/CVE-2023-22884
CVE-2023-25693,5.9,Airflow,Improper Input Validation vulnerability in the Apache Airflow Sqoop Provider. This issue affects Apache Airflow Sqoop Provider versions before 3.1.1.,2023-05-22T14:17:56.153,https://cve.circl.lu/cve/CVE-2023-25693
CVE-2023-25696,5.9,Airflow,Improper Input Validation vulnerability in the Apache Airflow Hive Provider. This issue affects Apache Airflow Hive Provider versions before 5.1.3.,2023-05-22T14:26:28.947,https://cve.circl.lu/cve/CVE-2023-25696
CVE-2023-28707,3.6,Airflow,Improper Input Validation vulnerability in Apache Software Foundation Apache Airflow Drill Provider.This issue affects Apache Airflow Drill Provider: before 2.3.2.,2023-05-22T14:25:13.693,https://cve.circl.lu/cve/CVE-2023-28707
CVE-2023-28710,3.6,Airflow,Improper Input Validation vulnerability in Apache Software Foundation Apache Airflow Spark Provider.This issue affects Apache Airflow Spark Provider: before 4.0.1.,2023-05-22T14:27:01.200,https://cve.circl.lu/cve/CVE-2023-28710
CVE-2016-3094,3.6,Apache,"PlainSaslServer.java in Apache Qpid Java before 6.0.3, when the broker is configured to allow plaintext passwords, allows remote attackers to cause a denial of service (broker termination) via a crafted authentication attempt, which triggers an uncaught exception.",2023-05-22T15:46:39.577,https://cve.circl.lu/cve/CVE-2016-3094
CVE-2016-8741,3.6,Apache,The Apache Qpid Broker for Java can be configured to use different so called AuthenticationProviders to handle user authentication. Among the choices are the SCRAM-SHA-1 and SCRAM-SHA-256 AuthenticationProvider types. It was discovered that these AuthenticationProviders in Apache Qpid Broker for Java 6.0.x before 6.0.6 and 6.1.x before 6.1.1 prematurely terminate the SCRAM SASL negotiation if the provided user name does not exist thus allowing remote attacker to determine the existence of user accounts. The Vulnerability does not apply to AuthenticationProviders other than SCRAM-SHA-1 and SCRAM-SHA-256.,2023-05-22T15:46:50.753,https://cve.circl.lu/cve/CVE-2016-8741
CVE-2017-15701,3.6,Apache,In Apache Qpid Broker-J versions 6.1.0 through 6.1.4 (inclusive) the broker does not properly enforce a maximum frame size in AMQP 1.0 frames. A remote unauthenticated attacker could exploit this to cause the broker to exhaust all available memory and eventually terminate. Older AMQP protocols are not affected.,2023-05-22T15:46:42.590,https://cve.circl.lu/cve/CVE-2017-15701
CVE-2017-15702,5.9,Apache,"In Apache Qpid Broker-J 0.18 through 0.32, if the broker is configured with different authentication providers on different ports one of which is an HTTP port, then the broker can be tricked by a remote unauthenticated attacker connecting to the HTTP port into using an authentication provider that was configured on a different port. The attacker still needs valid credentials with the authentication provider on the spoofed port. This becomes an issue when the spoofed port has weaker authentication protection (e.g., anonymous access, default accounts) and is normally protected by firewall rules or similar which can be circumvented by this vulnerability. AMQP ports are not affected. Versions 6.0.0 and newer are not affected.",2023-05-22T15:46:45.633,https://cve.circl.lu/cve/CVE-2017-15702
CVE-2018-8740,3.6,Apache,"In SQLite through 3.22.0, databases whose schema is corrupted using a CREATE TABLE AS statement could cause a NULL pointer dereference, related to build.c and prepare.c.",2023-05-22T13:15:09.370,https://cve.circl.lu/cve/CVE-2018-8740
CVE-2022-32221,5.9,Apple,"When doing HTTP(S) transfers, libcurl might erroneously use the read callback (`CURLOPT_READFUNCTION`) to ask for data to send, even when the `CURLOPT_POSTFIELDS` option has been set, if the same handle previously was used to issue a `PUT` request which used that callback. This flaw may surprise the application and cause it to misbehave and either send off the wrong data or use memory after free or similar in the subsequent `POST` request. The problem exists in the logic for a reused handle when it is changed from a PUT to a POST.",2023-05-17T09:15:09.367,https://cve.circl.lu/cve/CVE-2022-32221
CVE-2023-21968,1.4,Apple,"Vulnerability in the Oracle Java SE, Oracle GraalVM Enterprise Edition product of Oracle Java SE (component: Libraries).  Supported versions that are affected are Oracle Java SE: 8u361, 8u361-perf, 11.0.18, 17.0.6, 20; Oracle GraalVM Enterprise Edition: 20.3.9, 21.3.5 and  22.3.1. Difficult to exploit vulnerability allows unauthenticated attacker with network access via multiple protocols to compromise Oracle Java SE, Oracle GraalVM Enterprise Edition.  Successful attacks of this vulnerability can result in  unauthorized update, insert or delete access to some of Oracle Java SE, Oracle GraalVM Enterprise Edition accessible data. Note: This vulnerability applies to Java deployments, typically in clients running sandboxed Java Web Start applications or sandboxed Java applets, that load and run untrusted code (e.g., code that comes from the internet) and rely on the Java sandbox for security. This vulnerability can also be exploited by using APIs in the specified Component, e.g., through a web service which supplies data to the APIs. CVSS 3.1 Base Score 3.7 (Integrity impacts).  CVSS Vector: (CVSS:3.1/AV:N/AC:H/PR:N/UI:N/S:U/C:N/I:L/A:N).",2023-05-17T17:06:35.360,https://cve.circl.lu/cve/CVE-2023-21968
CVE-2022-46720,6.0,Apple,"An integer overflow was addressed with improved input validation. This issue is fixed in macOS Ventura 13.1, iOS 16.2 and iPadOS 16.2. An app may be able to break out of its sandbox",2023-05-19T16:15:10.733,https://cve.circl.lu/cve/CVE-2022-46720
CVE-2023-23525,5.9,Apple,"This issue was addressed with improved checks. This issue is fixed in macOS Big Sur 11.7.5, macOS Ventura 13.3, iOS 16.4 and iPadOS 16.4. An app may be able to gain root privileges",2023-05-19T16:15:10.933,https://cve.circl.lu/cve/CVE-2023-23525
CVE-2023-23527,3.6,Apple,"The issue was addressed with improved checks. This issue is fixed in iOS 16.4 and iPadOS 16.4, macOS Big Sur 11.7.5, watchOS 9.4, macOS Ventura 13.3, tvOS 16.4, macOS Monterey 12.6.4. A user may gain access to protected parts of the file system",2023-05-19T16:15:10.990,https://cve.circl.lu/cve/CVE-2023-23527
CVE-2023-30452,NA,Atlassian,The MoroSystems EasyMind - Mind Maps plugin before 2.15.0 for Confluence allows persistent XSS when saving a Mind Map with the hyperlink parameter.,2023-05-17T12:46:46.567,https://cve.circl.lu/cve/CVE-2023-30452
CVE-2022-30181,5.2,Azure,Azure Site Recovery Elevation of Privilege Vulnerability,2023-05-17T17:15:12.843,https://cve.circl.lu/cve/CVE-2022-30181
CVE-2022-30187,3.6,Azure,Azure Storage Library Information Disclosure Vulnerability,2023-05-17T17:15:12.920,https://cve.circl.lu/cve/CVE-2022-30187
CVE-2022-33641,5.2,Azure,Azure Site Recovery Elevation of Privilege Vulnerability,2023-05-17T17:15:14.593,https://cve.circl.lu/cve/CVE-2022-33641
CVE-2022-33642,3.6,Azure,Azure Site Recovery Elevation of Privilege Vulnerability,2023-05-17T17:15:14.667,https://cve.circl.lu/cve/CVE-2022-33642
CVE-2022-33643,5.2,Azure,Azure Site Recovery Elevation of Privilege Vulnerability,2023-05-17T17:15:14.740,https://cve.circl.lu/cve/CVE-2022-33643
CVE-2021-1620,4.0,AnyConnect,"A vulnerability in the Internet Key Exchange Version 2 (IKEv2) support for the AutoReconnect feature of Cisco IOS Software and Cisco IOS XE Software could allow an authenticated, remote attacker to exhaust the free IP addresses from the assigned local pool. This vulnerability occurs because the code does not release the allocated IP address under certain failure conditions. An attacker could exploit this vulnerability by trying to connect to the device with a non-AnyConnect client. A successful exploit could allow the attacker to exhaust the IP addresses from the assigned local pool, which prevents users from logging in and leads to a denial of service (DoS) condition.",2023-05-22T18:57:24.750,https://cve.circl.lu/cve/CVE-2021-1620
CVE-2022-30215,5.9,Active Directory,Active Directory Federation Services Elevation of Privilege Vulnerability,2023-05-17T17:15:13.777,https://cve.circl.lu/cve/CVE-2022-30215
CVE-2023-0812,3.6,Active Directory,"The Active Directory Integration / LDAP Integration WordPress plugin before 4.1.1 does not have proper authorization or nonce values for some POST requests, leading to unauthenticated data disclosure.",2023-05-23T17:34:40.603,https://cve.circl.lu/cve/CVE-2023-0812
CVE-2023-33254,NA,Active Directory,"There is an LDAP bind credentials exposure on KACE Systems Deployment and Remote Site appliances 9.0.146. The captured credentials may provide a higher privilege level on the Active Directory domain. To exploit this, an authenticated attacker edits the user-authentication settings to specify an attacker-controlled LDAP server, clicks the Test Settings button, and captures the cleartext credentials.",2023-05-22T10:56:56.373,https://cve.circl.lu/cve/CVE-2023-33254
CVE-2023-33297,NA,Bitcoin,"Bitcoin Core before 24.1, when debug mode is not used, allows attackers to cause a denial of service (CPU consumption) because draining the inventory-to-send queue is inefficient, as exploited in the wild in May 2023.",2023-05-22T10:56:56.373,https://cve.circl.lu/cve/CVE-2023-33297
CVE-2022-22048,5.2,BitLocker,BitLocker Security Feature Bypass Vulnerability,2023-05-17T17:15:12.583,https://cve.circl.lu/cve/CVE-2022-22048
CVE-2022-22711,5.2,BitLocker,Windows BitLocker Information Disclosure Vulnerability,2023-05-18T19:15:09.327,https://cve.circl.lu/cve/CVE-2022-22711
CVE-2008-4128,10.0,CSRF,"Multiple cross-site request forgery (CSRF) vulnerabilities in the HTTP Administration component in Cisco IOS 12.4 on the 871 Integrated Services Router allow remote attackers to execute arbitrary commands via (1) a certain ""show privilege"" command to the /level/15/exec/- URI, and (2) a certain ""alias exec"" command to the /level/15/exec/-/configure/http URI.  NOTE: some of these details are obtained from third party information.",2023-05-22T17:08:24.593,https://cve.circl.lu/cve/CVE-2008-4128
CVE-2015-9307,5.9,CSRF,The wp-google-map-plugin plugin before 2.3.10 for WordPress has CSRF in the add/edit location feature.,2023-05-23T15:11:16.463,https://cve.circl.lu/cve/CVE-2015-9307
CVE-2015-9308,5.9,CSRF,The wp-google-map-plugin plugin before 2.3.10 for WordPress has CSRF in the add/edit map feature.,2023-05-23T15:11:16.463,https://cve.circl.lu/cve/CVE-2015-9308
CVE-2015-9309,5.9,CSRF,The wp-google-map-plugin plugin before 2.3.10 for WordPress has CSRF in the add/edit category feature.,2023-05-23T15:11:16.463,https://cve.circl.lu/cve/CVE-2015-9309
CVE-2021-24705,2.7,CSRF,"The NEX-Forms WordPress plugin before 8.4.3 does not have CSRF checks in place when editing a form, and does not escape some of its settings as well as form fields before outputting them in attributes. This could allow attackers to make a logged in admin edit arbitrary forms with Cross-Site Scripting payloads in them",2023-05-18T11:15:09.023,https://cve.circl.lu/cve/CVE-2021-24705
CVE-2015-6289,3.6,Cisco,"Cisco IOS 15.5(3)M on Integrated Services Router (ISR) 800, 819, and 829 devices allows remote attackers to cause a denial of service (memory consumption) via crafted TCP packets on the SSH port, aka Bug ID CSCuu13476.",2023-05-22T17:08:24.593,https://cve.circl.lu/cve/CVE-2015-6289
CVE-2018-0150,5.9,Cisco,"A vulnerability in Cisco IOS XE Software could allow an unauthenticated, remote attacker to log in to a device running an affected release of Cisco IOS XE Software with the default username and password that are used at initial boot, aka a Static Credential Vulnerability. The vulnerability is due to an undocumented user account with privilege level 15 that has a default username and password. An attacker could exploit this vulnerability by using this account to remotely connect to an affected device. A successful exploit could allow the attacker to log in to the device with privilege level 15 access. This vulnerability affects Cisco devices that are running a vulnerable release of Cisco IOS XE Software Release 16.x. This vulnerability does not affect Cisco IOS XE Software releases prior to Release 16.x. Cisco Bug IDs: CSCve89880.",2023-05-22T17:08:24.593,https://cve.circl.lu/cve/CVE-2018-0150
CVE-2019-12646,3.6,Cisco,"A vulnerability in the Network Address Translation (NAT) Session Initiation Protocol (SIP) Application Layer Gateway (ALG) of Cisco IOS XE Software could allow an unauthenticated, remote attacker to cause an affected device to reload. The vulnerability is due to improper processing of transient SIP packets on which NAT is performed on an affected device. An attacker could exploit this vulnerability by using UDP port 5060 to send crafted SIP packets through an affected device that is performing NAT for SIP packets. A successful exploit could allow an attacker to cause the device to reload, resulting in a denial of service (DoS) condition.",2023-05-22T18:57:24.750,https://cve.circl.lu/cve/CVE-2019-12646
CVE-2019-12650,5.9,Cisco,"Multiple vulnerabilities in the web-based user interface (Web UI) of Cisco IOS XE Software could allow an authenticated, remote attacker to execute commands with elevated privileges on the affected device. For more information about these vulnerabilities, see the Details section of this advisory.",2023-05-22T18:57:24.750,https://cve.circl.lu/cve/CVE-2019-12650
CVE-2022-37409,3.6,Cryptograph,Insufficient control flow management for the Intel(R) IPP Cryptography software before version 2021.6 may allow an authenticated user to potentially enable information disclosure via local access.,2023-05-18T22:54:36.777,https://cve.circl.lu/cve/CVE-2022-37409
CVE-2022-40974,3.6,Cryptograph,Incomplete cleanup in the Intel(R) IPP Cryptography software before version 2021.6 may allow a privileged user to potentially enable information disclosure via local access.,2023-05-18T19:15:39.943,https://cve.circl.lu/cve/CVE-2022-40974
CVE-2022-41646,3.6,Cryptograph,Insufficient control flow management in the Intel(R) IPP Cryptography software before version 2021.6 may allow an unauthenticated user to potentially enable information disclosure via local access.,2023-05-22T17:18:08.867,https://cve.circl.lu/cve/CVE-2022-41646
CVE-2023-31135,1.4,Cryptograph,"Dgraph is an open source distributed GraphQL database. Existing Dgraph audit logs are vulnerable to brute force attacks due to nonce collisions. The first 12 bytes come from a baseIv which is initialized when an audit log is created. The last 4 bytes come from the length of the log line being encrypted. This is problematic because two log lines will often have the same length, so due to these collisions we are reusing the same nonce many times. All audit logs generated by versions of Dgraph <v23.0.0 are affected. Attackers must have access to the system the logs are stored on. Dgraph users should upgrade to v23.0.0. Users unable to upgrade should store existing audit logs in a secure location and for extra security, encrypt using an external tool like `gpg`.",2023-05-18T12:53:07.890,https://cve.circl.lu/cve/CVE-2023-31135
CVE-2023-27921,NA,Cryptograph,"JINS MEME CORE Firmware version 2.2.0 and earlier uses a hard-coded cryptographic key, which may lead to data acquired by a sensor of the affected product being decrypted by a network-adjacent attacker.",2023-05-23T13:04:30.710,https://cve.circl.lu/cve/CVE-2023-27921
CVE-2023-28858,1.4,ChatGPT,"redis-py before 4.5.3 leaves a connection open after canceling an async Redis command at an inopportune time, and can send response data to the client of an unrelated request in an off-by-one manner. NOTE: this CVE Record was initially created in response to reports about ChatGPT, and 4.3.6, 4.4.3, and 4.5.3 were released (changing the behavior for pipeline operations); however, please see CVE-2023-28859 about addressing data leakage across AsyncIO connections in general.",2023-05-17T17:07:38.017,https://cve.circl.lu/cve/CVE-2023-28858
CVE-2023-27742,NA,CRM,IDURAR ERP/CRM v1 was discovered to contain a SQL injection vulnerability via the component /api/login.,2023-05-17T12:46:50.773,https://cve.circl.lu/cve/CVE-2023-27742
CVE-2023-31699,NA,CRM,ChurchCRM v4.5.4 is vulnerable to Reflected Cross-Site Scripting (XSS) via image file.,2023-05-17T17:00:54.967,https://cve.circl.lu/cve/CVE-2023-31699
CVE-2023-25440,NA,CRM,"Stored Cross Site Scripting (XSS) vulnerability in the add contact function CiviCRM 5.59.alpha1, allows attackers to execute arbitrary code in first/second name field.",2023-05-23T13:04:39.657,https://cve.circl.lu/cve/CVE-2023-25440
CVE-2023-31814,NA,D-Link,D-Link DIR-300 firmware <=REVA1.06 and <=REVB2.06 is vulnerable to File inclusion via /model/__lang_msg.php.,2023-05-23T13:04:34.787,https://cve.circl.lu/cve/CVE-2023-31814
CVE-2022-33637,3.6,Defender,Microsoft Defender for Endpoint Tampering Vulnerability,2023-05-17T17:15:14.517,https://cve.circl.lu/cve/CVE-2022-33637
CVE-2023-28045,4.2,Dell,"Dell CloudIQ Collector version 1.10.2 contains a missing encryption of sensitive data vulnerability. An attacker with low privileges could potentially exploit this vulnerability, leading to gain access to unauthorized data.",2023-05-19T13:00:09.947,https://cve.circl.lu/cve/CVE-2023-28045
CVE-2023-25537,4.2,Dell,"Dell PowerEdge 14G server BIOS versions prior to 2.18.1 and Dell Precision BIOS versions prior to 2.18.2, contain an Out of Bounds write vulnerability. A local attacker with low privileges could potentially exploit this vulnerability leading to exposure of some SMRAM stack/data/code in System Management Mode, leading to arbitrary code execution or escalation of privilege.",2023-05-22T13:21:34.157,https://cve.circl.lu/cve/CVE-2023-25537
CVE-2023-23693,5.3,Dell,"Dell VxRail, versions prior to 7.0.450, contains an OS command injection Vulnerability in DCManager command-line utility. A local high privileged attacker could potentially exploit this vulnerability, leading to the execution of arbitrary OS commands on the application's underlying OS, with the privileges of the vulnerable application. Exploitation may lead to a system take over by an attacker.",2023-05-23T13:04:30.710,https://cve.circl.lu/cve/CVE-2023-23693
CVE-2023-23694,3.4,Dell,"Dell VxRail versions earlier than 7.0.450, contain(s) an OS command injection vulnerability in VxRail Manager. A local authenticated attacker could potentially exploit this vulnerability, leading to the execution of arbitrary OS commands on the application's underlying OS, with the privileges of the vulnerable application. Exploitation may lead to a system take over by an attacker.",2023-05-23T13:04:30.710,https://cve.circl.lu/cve/CVE-2023-23694
CVE-2020-3393,5.9,Docker,"A vulnerability in the application-hosting subsystem of Cisco IOS XE Software could allow an authenticated, local attacker to elevate privileges to root on an affected device. The attacker could execute IOS XE commands outside the application-hosting subsystem Docker container as well as on the underlying Linux operating system. These commands could be run as the root user. The vulnerability is due to a combination of two factors: (a) incomplete input validation of the user payload of CLI commands, and (b) improper role-based access control (RBAC) when commands are issued at the command line within the application-hosting subsystem. An attacker could exploit this vulnerability by using a CLI command with crafted user input. A successful exploit could allow the lower-privileged attacker to execute arbitrary CLI commands with root privileges. The attacker would need valid user credentials to exploit this vulnerability.",2023-05-23T13:55:46.380,https://cve.circl.lu/cve/CVE-2020-3393
CVE-2023-27482,6.0,Docker,"homeassistant is an open source home automation tool. A remotely exploitable vulnerability bypassing authentication for accessing the Supervisor API through Home Assistant has been discovered. This impacts all Home Assistant installation types that use the Supervisor 2023.01.1 or older. Installation types, like Home Assistant Container (for example Docker), or Home Assistant Core manually in a Python environment, are not affected. The issue has been mitigated and closed in Supervisor version 2023.03.1, which has been rolled out to all affected installations via the auto-update feature of the Supervisor. This rollout has been completed at the time of publication of this advisory. Home Assistant Core 2023.3.0 included mitigation for this vulnerability. Upgrading to at least that version is thus advised. In case one is not able to upgrade the Home Assistant Supervisor or the Home Assistant Core application at this time, it is advised to not expose your Home Assistant instance to the internet.",2023-05-17T23:15:09.167,https://cve.circl.lu/cve/CVE-2023-27482
CVE-2022-45144,NA,Docker,Algoo Tracim before 4.4.2 allows XSS via HTML file upload.,2023-05-17T12:46:46.567,https://cve.circl.lu/cve/CVE-2022-45144
CVE-2013-4389,2.9,Debian,Multiple format string vulnerabilities in log_subscriber.rb files in the log subscriber component in Action Mailer in Ruby on Rails 3.x before 3.2.15 allow remote attackers to cause a denial of service via a crafted e-mail address that is improperly handled during construction of a log message.,2023-05-19T16:52:10.997,https://cve.circl.lu/cve/CVE-2013-4389
CVE-2014-9087,6.4,Debian,"Integer underflow in the ksba_oid_to_str function in Libksba before 1.3.2, as used in GnuPG, allows remote attackers to cause a denial of service (crash) via a crafted OID in a (1) S/MIME message or (2) ECC based OpenPGP data, which triggers a buffer overflow.",2023-05-18T18:08:04.067,https://cve.circl.lu/cve/CVE-2014-9087
CVE-2016-0753,1.4,Debian,"Active Model in Ruby on Rails 4.1.x before 4.1.14.1, 4.2.x before 4.2.5.1, and 5.x before 5.0.0.beta1.1 supports the use of instance-level writers for class accessors, which allows remote attackers to bypass intended validation steps via crafted parameters.",2023-05-19T16:36:58.103,https://cve.circl.lu/cve/CVE-2016-0753
CVE-2016-6153,3.4,Debian,"os_unix.c in SQLite before 3.13.0 improperly implements the temporary directory search algorithm, which might allow local users to obtain sensitive information, cause a denial of service (application crash), or have unspecified other impact by leveraging use of the current working directory for temporary files.",2023-05-22T13:15:09.220,https://cve.circl.lu/cve/CVE-2016-6153
CVE-2023-21807,4.7,Dynamics 365,Microsoft Dynamics 365 (on-premises) Cross-site Scripting Vulnerability,2023-05-22T15:43:57.893,https://cve.circl.lu/cve/CVE-2023-21807
