CVE,"Impact Score (1-10, 10 being the worst)",Keyword,Description,Last Modified,Link
CVE-2022-0858,1.4,Orchestrator,A cross-site scripting (XSS) vulnerability in McAfee Enterprise ePolicy Orchestrator (ePO) prior to 5.10 Update 13 allows a remote attacker to potentially obtain access to an ePO administrator's session by convincing the attacker to click on a carefully crafted link. This would lead to limited ability to alter some information in ePO due to the area of the User Interface the vulnerability is present in.,2023-11-16T03:13:42.247,https://cve.circl.lu/cve/CVE-2022-0858
CVE-2021-4302,2.7,PHP,A vulnerability was found in slackero phpwcms up to 1.9.26. It has been classified as problematic. This affects an unknown part of the component SVG File Handler. The manipulation leads to cross site scripting. It is possible to initiate the attack remotely. Upgrading to version 1.9.27 is able to address this issue. The patch is named b39db9c7ad3800f319195ff0e26a0981395b1c54. It is recommended to upgrade the affected component. The associated identifier of this vulnerability is VDB-217419.,2023-11-16T02:21:50.130,https://cve.circl.lu/cve/CVE-2021-4302
CVE-2023-0527,2.7,PHP,"A vulnerability was found in PHPGurukul Online Security Guards Hiring System 1.0 and classified as problematic. Affected by this issue is some unknown functionality of the file search-request.php. The manipulation of the argument searchdata with the input ""><script>alert(document.domain)</script> leads to cross site scripting. The attack may be launched remotely. The exploit has been disclosed to the public and may be used. The identifier of this vulnerability is VDB-219596.",2023-11-15T03:09:54.733,https://cve.circl.lu/cve/CVE-2023-0527
CVE-2023-3187,2.5,PHP,"A vulnerability, which was classified as critical, has been found in PHPGurukul Teachers Record Management System 1.0. Affected by this issue is some unknown functionality of the file /changeimage.php of the component Profile Picture Handler. The manipulation of the argument newpic leads to unrestricted upload. The attack may be launched remotely. The exploit has been disclosed to the public and may be used. The identifier of this vulnerability is VDB-231176.",2023-11-16T01:35:31.690,https://cve.circl.lu/cve/CVE-2023-3187
CVE-2023-0001,5.9,Palo Alto,"An information exposure vulnerability in the Palo Alto Networks Cortex XDR agent on Windows devices allows a local system administrator to disclose the admin password for the agent in cleartext, which bad actors can then use to execute privileged cytool commands that disable or uninstall the agent.",2023-11-21T19:15:08.073,https://cve.circl.lu/cve/CVE-2023-0001
CVE-2021-3947,3.6,QEMU,A stack-buffer-overflow was found in QEMU in the NVME component. The flaw lies in nvme_changed_nslist() where a malicious guest controlling certain input can read out of bounds memory. A malicious user could use this flaw leading to disclosure of sensitive information.,2023-11-21T21:38:40.057,https://cve.circl.lu/cve/CVE-2021-3947
CVE-2023-0330,4.0,QEMU,A vulnerability in the lsi53c895a device affects the latest version of qemu. A DMA-MMIO reentrancy problem may lead to memory corruption bugs like stack overflow or use-after-free.,2023-11-15T17:14:05.297,https://cve.circl.lu/cve/CVE-2023-0330
CVE-2023-2680,6.0,QEMU,"This CVE exists because of an incomplete fix for CVE-2021-3750. More specifically, the qemu-kvm package as released for Red Hat Enterprise Linux 9.1 via RHSA-2022:7967 included a version of qemu-kvm that was actually missing the fix for CVE-2021-3750.",2023-11-16T16:15:30.260,https://cve.circl.lu/cve/CVE-2023-2680
CVE-2022-24883,5.9,RDP,"FreeRDP is a free implementation of the Remote Desktop Protocol (RDP). Prior to version 2.7.0, server side authentication against a `SAM` file might be successful for invalid credentials if the server has configured an invalid `SAM` file path. FreeRDP based clients are not affected. RDP server implementations using FreeRDP to authenticate against a `SAM` file are affected. Version 2.7.0 contains a fix for this issue. As a workaround, use custom authentication via `HashCallback` and/or ensure the `SAM` database path configured is valid and the application has file handles left.",2023-11-17T19:15:07.920,https://cve.circl.lu/cve/CVE-2022-24883
CVE-2023-45145,2.5,Redis,"Redis is an in-memory database that persists on disk. On startup, Redis begins listening on a Unix socket before adjusting its permissions to the user-provided configuration. If a permissive umask(2) is used, this creates a race condition that enables, during a short period of time, another process to establish an otherwise unauthorized connection. This problem has existed since Redis 2.6.0-RC1. This issue has been addressed in Redis versions 7.2.2, 7.0.14 and 6.2.14. Users are advised to upgrade. For users unable to upgrade, it is possible to work around the problem by disabling Unix sockets, starting Redis with a restrictive umask, or storing the Unix socket file in a protected directory.",2023-11-16T15:15:09.813,https://cve.circl.lu/cve/CVE-2023-45145
CVE-2023-47004,5.9,Redis,Buffer Overflow vulnerability in Redis RedisGraph v.2.x through v.2.12.8 and fixed in v.2.12.9 allows an attacker to execute arbitrary code via the code logic after valid authentication.,2023-11-16T17:36:06.167,https://cve.circl.lu/cve/CVE-2023-47004
CVE-2022-39282,3.6,Remote Desktop,"FreeRDP is a free remote desktop protocol library and clients. FreeRDP based clients on unix systems using `/parallel` command line switch might read uninitialized data and send it to the server the client is currently connected to. FreeRDP based server implementations are not affected. Please upgrade to 2.8.1 where this issue is patched. If unable to upgrade, do not use parallel port redirection (`/parallel` command line switch) as a workaround.",2023-11-17T19:15:08.060,https://cve.circl.lu/cve/CVE-2022-39282
CVE-2022-39283,3.6,Remote Desktop,"FreeRDP is a free remote desktop protocol library and clients. All FreeRDP based clients when using the `/video` command line switch might read uninitialized data, decode it as audio/video and display the result. FreeRDP based server implementations are not affected. This issue has been patched in version 2.8.1. If you cannot upgrade do not use the `/video` switch.",2023-11-17T19:15:08.203,https://cve.circl.lu/cve/CVE-2022-39283
CVE-2022-39316,3.6,Remote Desktop,FreeRDP is a free remote desktop protocol library and clients. In affected versions there is an out of bound read in ZGFX decoder component of FreeRDP. A malicious server can trick a FreeRDP based client to read out of bound data and try to decode it likely resulting in a crash. This issue has been addressed in the 2.9.0 release. Users are advised to upgrade.,2023-11-17T19:15:08.313,https://cve.circl.lu/cve/CVE-2022-39316
CVE-2021-43809,5.9,Repository,"`Bundler` is a package for managing application dependencies in Ruby. In `bundler` versions before 2.2.33, when working with untrusted and apparently harmless `Gemfile`'s, it is not expected that they lead to execution of external code, unless that's explicit in the ruby code inside the `Gemfile` itself. However, if the `Gemfile` includes `gem` entries that use the `git` option with invalid, but seemingly harmless, values with a leading dash, this can be false. To handle dependencies that come from a Git repository instead of a registry, Bundler uses various commands, such as `git clone`. These commands are being constructed using user input (e.g. the repository URL). When building the commands, Bundler versions before 2.2.33 correctly avoid Command Injection vulnerabilities by passing an array of arguments instead of a command string. However, there is the possibility that a user input starts with a dash (`-`) and is therefore treated as an optional argument instead of a positional one. This can lead to Code Execution because some of the commands have options that can be leveraged to run arbitrary executables. Since this value comes from the `Gemfile` file, it can contain any character, including a leading dash.To exploit this vulnerability, an attacker has to craft a directory containing a `Gemfile` file that declares a dependency that is located in a Git repository. This dependency has to have a Git URL in the form of `-u./payload`. This URL will be used to construct a Git clone command but will be interpreted as the upload-pack argument. Then this directory needs to be shared with the victim, who then needs to run a command that evaluates the Gemfile, such as `bundle lock`, inside.This vulnerability can lead to Arbitrary Code Execution, which could potentially lead to the takeover of the system. However, the exploitability is very low, because it requires a lot of user interaction. Bundler 2.2.33 has patched this problem by inserting `--` as an argument before any positional arguments to those Git commands that were affected by this issue. Regardless of whether users can upgrade or not, they should review any untrustred `Gemfile`'s before running any `bundler` commands that may read them, since they can contain arbitrary ruby code.",2023-11-16T03:04:51.220,https://cve.circl.lu/cve/CVE-2021-43809
CVE-2021-23884,3.6,Repo,Cleartext Transmission of Sensitive Information vulnerability in the ePO Extension of McAfee Content Security Reporter (CSR) prior to 2.8.0 allows an ePO administrator to view the unencrypted password of the McAfee Web Gateway (MWG) or the password of the McAfee Web Gateway Cloud Server (MWGCS) read only user used to retrieve log files for analysis in CSR.,2023-11-16T02:51:05.737,https://cve.circl.lu/cve/CVE-2021-23884
CVE-2022-28145,2.7,Repo,"Jenkins Continuous Integration with Toad Edge Plugin 2.3 and earlier does not apply Content-Security-Policy headers to report files it serves, resulting in a stored cross-site scripting (XSS) exploitable by attackers with Item/Configure permission or otherwise able to control report contents.",2023-11-17T17:21:49.487,https://cve.circl.lu/cve/CVE-2022-28145
CVE-2023-29462,5.9,Repo,"An arbitrary code execution vulnerability contained in Rockwell Automation's Arena Simulation software was reported that could potentially allow a malicious user to commit unauthorized arbitrary code to the software by using a memory buffer overflow in the heap.  potentially resulting in a complete loss of confidentiality, integrity, and availability.",2023-11-15T03:11:42.963,https://cve.circl.lu/cve/CVE-2023-29462
CVE-2021-31831,3.4,SQL,Incorrect access to deleted scripts vulnerability in McAfee Database Security (DBSec) prior to 4.8.2 allows a remote authenticated attacker to gain access to signed SQL scripts which have been marked as deleted or expired within the administrative console. This access was only available through the REST API.,2023-11-15T18:53:33.923,https://cve.circl.lu/cve/CVE-2021-31831
CVE-2021-31849,5.9,SQL,SQL injection vulnerability in McAfee Data Loss Prevention (DLP) ePO extension prior to 11.7.100 allows a remote attacker logged into ePO as an administrator to inject arbitrary SQL into the ePO database through the user management section of the DLP ePO extension.,2023-11-15T19:05:44.010,https://cve.circl.lu/cve/CVE-2021-31849
CVE-2021-4088,5.9,SQL,"SQL injection vulnerability in Data Loss Protection (DLP) ePO extension 11.8.x prior to 11.8.100, 11.7.x prior to 11.7.101, and 11.6.401 allows a remote authenticated attacker to inject unfiltered SQL into the DLP part of the ePO database. This could lead to remote code execution on the ePO server with privilege escalation.",2023-11-15T20:25:04.923,https://cve.circl.lu/cve/CVE-2021-4088
CVE-2022-0859,5.9,SQL,McAfee Enterprise ePolicy Orchestrator (ePO) prior to 5.10 Update 13 allows a local attacker to point an ePO server to an arbitrary SQL server during the restoration of the ePO server. To achieve this the attacker would have to be logged onto the server hosting the ePO server (restricted to administrators) and to know the SQL server password.,2023-11-15T19:30:45.040,https://cve.circl.lu/cve/CVE-2022-0859
CVE-2022-28142,3.6,SSL,Jenkins Proxmox Plugin 0.6.0 and earlier disables SSL/TLS certificate validation globally for the Jenkins controller JVM when configured to ignore SSL/TLS issues.,2023-11-17T17:27:16.030,https://cve.circl.lu/cve/CVE-2022-28142
CVE-2022-28143,3.6,SSL,"A cross-site request forgery (CSRF) vulnerability in Jenkins Proxmox Plugin 0.7.0 and earlier allows attackers to connect to an attacker-specified host using attacker-specified username and password (perform a connection test), disable SSL/TLS validation for the entire Jenkins controller JVM as part of the connection test (see CVE-2022-28142), and test a rollback with attacker-specified parameters.",2023-11-17T17:27:22.153,https://cve.circl.lu/cve/CVE-2022-28143
CVE-2022-28144,3.6,SSL,"Jenkins Proxmox Plugin 0.7.0 and earlier does not perform a permission check in several HTTP endpoints, allowing attackers with Overall/Read permission to connect to an attacker-specified host using attacker-specified username and password (perform a connection test), disable SSL/TLS validation for the entire Jenkins controller JVM as part of the connection test (see CVE-2022-28142), and test a rollback with attacker-specified parameters.",2023-11-17T17:21:38.463,https://cve.circl.lu/cve/CVE-2022-28144
CVE-2023-33225,5.9,Solarwinds,The SolarWinds Platform was susceptible to the Incorrect Comparison Vulnerability. This vulnerability allows users with administrative access to SolarWinds Web Console to execute arbitrary commands with SYSTEM privileges.,2023-11-15T02:54:12.713,https://cve.circl.lu/cve/CVE-2023-33225
CVE-2020-17477,3.6,Samba,"Incorrect LDAP ACLs in ucs-school-ldap-acls-master in UCS@school before 4.4v5-errata allow remote teachers, staff, and school administrators to read LDAP password hashes (sambaNTPassword, krb5Key, sambaPasswordHistory, and pwhistory) via LDAP search requests. For example, a teacher can gain administrator access via an NTLM hash.",2023-11-16T15:12:35.080,https://cve.circl.lu/cve/CVE-2020-17477
CVE-2023-4091,3.6,Samba,"A vulnerability was discovered in Samba, where the flaw allows SMB clients to truncate files, even with read-only permissions when the Samba VFS module ""acl_xattr"" is configured with ""acl_xattr:ignore system acls = yes"". The SMB protocol allows opening files when the client requests read-only access but then implicitly truncates the opened file to 0 bytes if the client specifies a separate OVERWRITE create disposition request. The issue arises in configurations that bypass kernel file system permissions checks, relying solely on Samba's permissions.",2023-11-21T18:15:08.623,https://cve.circl.lu/cve/CVE-2023-4091
CVE-2023-3961,5.9,Samba,"A path traversal vulnerability was identified in Samba when processing client pipe names connecting to Unix domain sockets within a private directory. Samba typically uses this mechanism to connect SMB clients to remote procedure call (RPC) services like SAMR LSA or SPOOLSS, which Samba initiates on demand. However, due to inadequate sanitization of incoming client pipe names, allowing a client to send a pipe name containing Unix directory traversal characters (../). This could result in SMB clients connecting as root to Unix domain sockets outside the private directory. If an attacker or client managed to send a pipe name resolving to an external service using an existing Unix domain socket, it could potentially lead to unauthorized access to the service and consequential adverse events, including compromise or service crashes.",2023-11-21T18:15:08.227,https://cve.circl.lu/cve/CVE-2023-3961
CVE-2023-42669,3.6,Samba,"A vulnerability was found in Samba's ""rpcecho"" development server, a non-Windows RPC server used to test Samba's DCE/RPC stack elements. This vulnerability stems from an RPC function that can be blocked indefinitely. The issue arises because the ""rpcecho"" service operates with only one worker in the main RPC task, allowing calls to the ""rpcecho"" server to be blocked for a specified time, causing service disruptions. This disruption is triggered by a ""sleep()"" call in the ""dcesrv_echo_TestSleep()"" function under specific conditions. Authenticated users or attackers can exploit this vulnerability to make calls to the ""rpcecho"" server, requesting it to block for a specified duration, effectively disrupting most services and leading to a complete denial of service on the AD DC. The DoS affects all other services as ""rpcecho"" runs in the main RPC task.",2023-11-21T18:15:08.343,https://cve.circl.lu/cve/CVE-2023-42669
CVE-2021-4298,5.9,SIP,A vulnerability classified as critical has been found in Hesburgh Libraries of Notre Dame Sipity. This affects the function SearchCriteriaForWorksParameter of the file app/parameters/sipity/parameters/search_criteria_for_works_parameter.rb. The manipulation leads to sql injection. Upgrading to version 2021.8 is able to address this issue. The patch is named d1704c7363b899ffce65be03a796a0ee5fdbfbdc. It is recommended to upgrade the affected component. The associated identifier of this vulnerability is VDB-217179.,2023-11-16T02:15:38.070,https://cve.circl.lu/cve/CVE-2021-4298
CVE-2022-23110,2.7,SSH,"Jenkins Publish Over SSH Plugin 1.22 and earlier does not escape the SSH server name, resulting in a stored cross-site scripting (XSS) vulnerability exploitable by attackers with Overall/Administer permission.",2023-11-15T03:39:44.593,https://cve.circl.lu/cve/CVE-2022-23110
CVE-2021-45450,3.6,TLS,"In Mbed TLS before 2.28.0 and 3.x before 3.1.0, psa_cipher_generate_iv and psa_cipher_encrypt allow policy bypass or oracle-based decryption when the output buffer is at memory locations accessible to an untrusted application.",2023-11-21T16:29:39.140,https://cve.circl.lu/cve/CVE-2021-45450
CVE-2023-34462,3.6,TLS,"Netty is an asynchronous event-driven network application framework for rapid development of maintainable high performance protocol servers & clients. The `SniHandler` can allocate up to 16MB of heap for each channel during the TLS handshake. When the handler or the channel does not have an idle timeout, it can be used to make a TCP server using the `SniHandler` to allocate 16MB of heap. The `SniHandler` class is a handler that waits for the TLS handshake to configure a `SslHandler` according to the indicated server name by the `ClientHello` record. For this matter it allocates a `ByteBuf` using the value defined in the `ClientHello` record. Normally the value of the packet should be smaller than the handshake packet but there are not checks done here and the way the code is written, it is possible to craft a packet that makes the `SslClientHelloHandler`. This vulnerability has been fixed in version 4.1.94.Final.",2023-11-18T21:15:07.830,https://cve.circl.lu/cve/CVE-2023-34462
CVE-2023-34058,5.9,VMware,VMware Tools contains a SAML token signature bypass vulnerability. A malicious actor that has been granted  Guest Operation Privileges https://docs.vmware.com/en/VMware-vSphere/8.0/vsphere-security/GUID-6A952214-0E5E-4CCF-9D2A-90948FF643EC.html  in a target virtual machine may be able to elevate their privileges if that target virtual machine has been assigned a more privileged  Guest Alias https://vdc-download.vmware.com/vmwb-repository/dcr-public/d1902b0e-d479-46bf-8ac9-cee0e31e8ec0/07ce8dbd-db48-4261-9b8f-c6d3ad8ba472/vim.vm.guest.AliasManager.html .,2023-11-17T05:15:12.043,https://cve.circl.lu/cve/CVE-2023-34058
CVE-2023-20900,5.9,Virtual Machine,A malicious actor that has been granted  Guest Operation Privileges https://docs.vmware.com/en/VMware-vSphere/8.0/vsphere-security/GUID-6A952214-0E5E-4CCF-9D2A-90948FF643EC.html  in a target virtual machine may be able to elevate their privileges if that target virtual machine has been assigned a more privileged  Guest Alias https://vdc-download.vmware.com/vmwb-repository/dcr-public/d1902b0e-d479-46bf-8ac9-cee0e31e8ec0/07ce8dbd-db48-4261-9b8f-c6d3ad8ba472/vim.vm.guest.AliasManager.html .,2023-11-17T05:15:11.647,https://cve.circl.lu/cve/CVE-2023-20900
CVE-2018-2627,6.0,Windows,"Vulnerability in the Java SE component of Oracle Java SE (subcomponent: Installer). Supported versions that are affected are Java SE: 8u152 and 9.0.1. Difficult to exploit vulnerability allows low privileged attacker with logon to the infrastructure where Java SE executes to compromise Java SE. Successful attacks require human interaction from a person other than the attacker and while the vulnerability is in Java SE, attacks may significantly impact additional products. Successful attacks of this vulnerability can result in takeover of Java SE. Note: This vulnerability applies to the Windows installer only. CVSS 3.0 Base Score 7.5 (Confidentiality, Integrity and Availability impacts). CVSS Vector: (CVSS:3.0/AV:L/AC:H/PR:L/UI:R/S:C/C:H/I:H/A:H).",2023-11-21T19:13:38.713,https://cve.circl.lu/cve/CVE-2018-2627
CVE-2020-7343,3.6,Windows,Missing Authorization vulnerability in McAfee Agent (MA) for Windows prior to 5.7.1 allows local users to block McAfee product updates by manipulating a directory used by MA for temporary files. The product would continue to function with out-of-date detection files.,2023-11-16T02:21:44.233,https://cve.circl.lu/cve/CVE-2020-7343
CVE-2021-23880,3.6,Windows,Improper Access Control in attribute in McAfee Endpoint Security (ENS) for Windows prior to 10.7.0 February 2021 Update allows authenticated local administrator user to perform an uninstallation of the anti-malware engine via the running of a specific command with the correct parameters.,2023-11-16T02:25:13.827,https://cve.circl.lu/cve/CVE-2021-23880
CVE-2021-23882,3.6,Windows,Improper Access Control vulnerability in McAfee Endpoint Security (ENS) for Windows prior to 10.7.0 February 2021 Update allows local administrators to prevent the installation of some ENS files by placing carefully crafted files where ENS will be installed. This is only applicable to clean installations of ENS as the Access Control rules will prevent modification prior to up an upgrade.,2023-11-16T02:43:55.787,https://cve.circl.lu/cve/CVE-2021-23882
CVE-2021-42362,5.9,WordPress,"The WordPress Popular Posts WordPress plugin is vulnerable to arbitrary file uploads due to insufficient input file type validation found in the ~/src/Image.php file which makes it possible for attackers with contributor level access and above to upload malicious files that can be used to obtain remote code execution, in versions up to and including 5.3.2.",2023-11-22T00:15:07.070,https://cve.circl.lu/cve/CVE-2021-42362
CVE-2022-3469,2.7,WordPress,"The WP Attachments WordPress plugin before 5.0.5 does not sanitize and escapes some of its settings, which could allow high-privilege users such as admin to perform Stored Cross-Site Scripting attacks even when the unfiltered_html capability is disallowed (for example, in multisite setup).",2023-11-15T13:45:47.877,https://cve.circl.lu/cve/CVE-2022-3469
CVE-2022-4330,2.7,WordPress,"The WP Attachments WordPress plugin before 5.0.6 does not sanitise and escape some of its settings, which could allow high privilege users such as admin to perform Stored Cross-Site Scripting attacks even when the unfiltered_html capability is disallowed (for example in multisite setup).",2023-11-15T13:45:47.877,https://cve.circl.lu/cve/CVE-2022-4330
CVE-2017-20177,2.7,WordPress,"A vulnerability, which was classified as problematic, has been found in WangGuard Plugin 1.8.0 on WordPress. Affected by this issue is the function wangguard_users_info of the file wangguard-user-info.php of the component WGG User List Handler. The manipulation of the argument userIP leads to cross site scripting. The attack may be launched remotely. The patch is identified as 88414951e30773c8d2ec13b99642688284bf3189. It is recommended to apply a patch to fix this issue. VDB-220214 is the identifier assigned to this vulnerability.",2023-11-16T01:15:29.783,https://cve.circl.lu/cve/CVE-2017-20177
CVE-2014-125090,2.7,WordPress,A vulnerability was found in Media Downloader Plugin 0.1.992 on WordPress. It has been declared as problematic. This vulnerability affects the function dl_file_resumable of the file getfile.php. The manipulation of the argument file leads to cross site scripting. The attack can be initiated remotely. Upgrading to version 0.1.993 is able to address this issue. The patch is identified as 77beb720c682b9300035ab5f96eee225181d8a92. It is recommended to upgrade the affected component. VDB-222262 is the identifier assigned to this vulnerability.,2023-11-18T03:03:20.007,https://cve.circl.lu/cve/CVE-2014-125090
CVE-2022-3844,2.7,Xterm,"A vulnerability, which was classified as problematic, was found in Webmin 2.001. Affected is an unknown function of the file xterm/index.cgi. The manipulation leads to basic cross site scripting. It is possible to launch the attack remotely. Upgrading to version 2.003 is able to address this issue. The patch is identified as d3d33af3c0c3fd3a889c84e287a038b7a457d811. It is recommended to upgrade the affected component. VDB-212862 is the identifier assigned to this vulnerability.",2023-11-16T01:34:34.367,https://cve.circl.lu/cve/CVE-2022-3844
CVE-2021-4038,2.7,XSS,Cross Site Scripting (XSS) vulnerability in McAfee Network Security Manager (NSM) prior to 10.1 Minor 7 allows a remote authenticated administrator to embed a XSS in the administrator interface via specially crafted custom rules containing HTML. NSM did not correctly sanitize custom rule content in all scenarios.,2023-11-16T03:06:23.680,https://cve.circl.lu/cve/CVE-2021-4038
CVE-2023-37580,2.7,XSS,Zimbra Collaboration (ZCS) 8 before 8.8.15 Patch 41 allows XSS in the Zimbra Classic Web Client.,2023-11-17T15:15:11.693,https://cve.circl.lu/cve/CVE-2023-37580
CVE-2023-40224,2.7,XSS,MISP 2.4.174 allows XSS in app/View/Events/index.ctp.,2023-11-17T05:15:12.387,https://cve.circl.lu/cve/CVE-2023-40224
