CVE,"Impact Score (1-10, 10 being the worst)",Keyword,Description,Last Modified,Link
CVE-2023-39325,3.6,Golang,"A malicious HTTP/2 client which rapidly creates requests and immediately resets them can cause excessive server resource consumption. While the total number of requests is bounded by the http2.Server.MaxConcurrentStreams setting, resetting an in-progress request allows the attacker to create a new request while the existing one is still executing. With the fix applied, HTTP/2 servers now bound the number of simultaneously executing handler goroutines to the stream concurrency limit (MaxConcurrentStreams). New requests arriving when at the limit (which can only happen after the client has reset an existing, in-flight request) will be queued until a handler exits. If the request queue grows too large, the server will terminate the connection. This issue is also fixed in golang.org/x/net/http2 for users manually configuring HTTP/2. The default stream concurrency limit is 250 streams (requests) per HTTP/2 connection. This value may be adjusted using the golang.org/x/net/http2 package; see the Server.MaxConcurrentStreams setting and the ConfigureServer function.",2023-11-20T03:15:44.190,https://cve.circl.lu/cve/CVE-2023-39325
CVE-2023-5217,5.9,Google,Heap buffer overflow in vp8 encoding in libvpx in Google Chrome prior to 117.0.5938.132 and libvpx 1.13.1 allowed a remote attacker to potentially exploit heap corruption via a crafted HTML page. (Chromium security severity: High),2023-11-17T18:56:01.750,https://cve.circl.lu/cve/CVE-2023-5217
CVE-2023-5346,5.9,Google,Type confusion in V8 in Google Chrome prior to 117.0.5938.149 allowed a remote attacker to potentially exploit heap corruption via a crafted HTML page. (Chromium security severity: High),2023-11-16T01:45:40.253,https://cve.circl.lu/cve/CVE-2023-5346
CVE-2023-5218,5.9,Google,Use after free in Site Isolation in Google Chrome prior to 118.0.5993.70 allowed a remote attacker to potentially exploit heap corruption via a crafted HTML page. (Chromium security severity: Critical),2023-11-16T02:08:37.280,https://cve.circl.lu/cve/CVE-2023-5218
CVE-2023-5475,3.6,Google,Inappropriate implementation in DevTools in Google Chrome prior to 118.0.5993.70 allowed an attacker who convinced a user to install a malicious extension to bypass discretionary access control via a crafted Chrome Extension. (Chromium security severity: Medium),2023-11-16T02:06:32.557,https://cve.circl.lu/cve/CVE-2023-5475
CVE-2023-5484,3.6,Google,Inappropriate implementation in Navigation in Google Chrome prior to 118.0.5993.70 allowed a remote attacker to spoof security UI via a crafted HTML page. (Chromium security severity: Medium),2023-11-16T02:09:38.077,https://cve.circl.lu/cve/CVE-2023-5484
CVE-2023-5441,3.6,GitHub,NULL Pointer Dereference in GitHub repository vim/vim prior to 20d161ace307e28690229b68584f2d84556f8960.,2023-11-15T02:33:52.560,https://cve.circl.lu/cve/CVE-2023-5441
CVE-2023-5535,5.9,GitHub,Use After Free in GitHub repository vim/vim prior to v9.0.2010.,2023-11-15T02:31:02.843,https://cve.circl.lu/cve/CVE-2023-5535
CVE-2022-23109,3.6,HashiCorp,Jenkins HashiCorp Vault Plugin 3.7.0 and earlier does not mask Vault credentials in Pipeline build logs or in Pipeline step descriptions when Pipeline: Groovy Plugin 2.85 or later is installed.,2023-11-15T03:39:49.603,https://cve.circl.lu/cve/CVE-2022-23109
CVE-2022-25186,3.6,HashiCorp,"Jenkins HashiCorp Vault Plugin 3.8.0 and earlier implements functionality that allows agent processes to retrieve any Vault secrets for use on the agent, allowing attackers able to control agent processes to obtain Vault secrets for an attacker-specified path and key.",2023-11-15T03:39:13.003,https://cve.circl.lu/cve/CVE-2022-25186
CVE-2021-39077,3.6,IBM,"IBM Security Guardium 10.5, 10.6, 11.0, 11.1, 11.2, 11.3, and 11.4 stores user credentials in plain clear text which can be read by a local privileged user. IBM X-Force ID: 215587.?",2023-11-18T03:06:44.563,https://cve.circl.lu/cve/CVE-2021-39077
CVE-2022-40752,5.9,IBM,IBM InfoSphere DataStage 11.7 is vulnerable to a command injection vulnerability due to improper neutralization of special elements. IBM X-Force ID:  236687.,2023-11-18T03:07:40.743,https://cve.circl.lu/cve/CVE-2022-40752
CVE-2023-30987,3.6,IBM,"IBM Db2 for Linux, UNIX and Windows (includes Db2 Connect Server) 10.5, 11.1, and 11.5 is vulnerable to denial of service with a specially crafted query on certain databases.  IBM X-Force ID:  253440.",2023-11-16T16:15:30.380,https://cve.circl.lu/cve/CVE-2023-30987
CVE-2023-38720,3.6,IBM,"IBM Db2 for Linux, UNIX and Windows (includes Db2 Connect Server) 11.5 and 11.5 is vulnerable to denial of service with a specially crafted ALTER TABLE statement.  IBM X-Force ID:  261616.",2023-11-16T16:15:31.103,https://cve.circl.lu/cve/CVE-2023-38720
CVE-2023-38728,3.6,IBM,"IBM Db2 for Linux, UNIX and Windows (includes Db2 Connect Server) 10.5, 11.1, and 11.5 is vulnerable to denial of service with a specially crafted XML query statement.  IBM X-Force ID:  262258.",2023-11-16T16:15:31.207,https://cve.circl.lu/cve/CVE-2023-38728
CVE-2020-7308,2.5,Intel,"Cleartext Transmission of Sensitive Information between McAfee Endpoint Security (ENS) for Windows prior to 10.7.0 February 2021 Update and McAfee Global Threat Intelligence (GTI) servers using DNS allows a remote attacker to view the requests from ENS and responses from GTI over DNS. By gaining control of an intermediate DNS server or altering the network DNS configuration, it is possible for an attacker to intercept requests and send their own responses.",2023-11-16T14:22:12.090,https://cve.circl.lu/cve/CVE-2020-7308
CVE-2022-23106,1.4,Jenkins,Jenkins Configuration as Code Plugin 1.55 and earlier used a non-constant time comparison function when validating an authentication token allowing attackers to use statistical methods to obtain a valid authentication token.,2023-11-15T04:03:18.817,https://cve.circl.lu/cve/CVE-2022-23106
CVE-2022-23107,5.2,Jenkins,"Jenkins Warnings Next Generation Plugin 9.10.2 and earlier does not restrict the name of a file when configuring custom ID, allowing attackers with Item/Configure permission to write and read specific files with a hard-coded suffix on the Jenkins controller file system.",2023-11-15T04:03:15.320,https://cve.circl.lu/cve/CVE-2022-23107
CVE-2022-23108,2.7,Jenkins,"Jenkins Badge Plugin 1.9 and earlier does not escape the description and does not check for allowed protocols when creating a badge, resulting in a stored cross-site scripting (XSS) vulnerability exploitable by attackers with Item/Configure permission.",2023-11-15T04:03:02.120,https://cve.circl.lu/cve/CVE-2022-23108
CVE-2022-29041,2.7,Jira,"Jenkins Jira Plugin 3.7 and earlier, except 3.6.1, does not escape the name and description of Jira Issue and Jira Release Version parameters on views displaying parameters, resulting in a stored cross-site scripting (XSS) vulnerability exploitable by attackers with Item/Configure permission.",2023-11-17T17:22:50.997,https://cve.circl.lu/cve/CVE-2022-29041
CVE-2021-31830,2.7,JavaScript,Improper Neutralization of Input During Web Page Generation ('Cross-site Scripting') vulnerability in McAfee Database Security (DBSec) prior to 4.8.2 allows an administrator to embed JavaScript code when configuring the name of a database to be monitored. This would be triggered when any authorized user logs into the DBSec interface and opens the properties configuration page for this database.,2023-11-16T03:12:03.267,https://cve.circl.lu/cve/CVE-2021-31830
CVE-2021-31832,2.7,JavaScript,Improper Neutralization of Input in the ePO administrator extension for McAfee Data Loss Prevention (DLP) Endpoint for Windows prior to 11.6.200 allows a remote ePO DLP administrator to inject JavaScript code into the alert configuration text field. This JavaScript will be executed when an end user triggers a DLP policy on their machine.,2023-11-16T02:17:49.003,https://cve.circl.lu/cve/CVE-2021-31832
CVE-2022-30677,2.7,JavaScript,"Adobe Experience Manager versions 6.5.13.0 (and earlier) is affected by a reflected Cross-Site Scripting (XSS) vulnerability. If an attacker is able to convince a victim to visit a URL referencing a vulnerable page, malicious JavaScript content may be executed within the context of the victim's browser. Exploitation of this issue requires low-privilege access to AEM.",2023-11-15T20:22:29.277,https://cve.circl.lu/cve/CVE-2022-30677
CVE-2022-30678,2.7,JavaScript,"Adobe Experience Manager versions 6.5.13.0 (and earlier) is affected by a reflected Cross-Site Scripting (XSS) vulnerability. If an attacker is able to convince a victim to visit a URL referencing a vulnerable page, malicious JavaScript content may be executed within the context of the victim's browser. Exploitation of this issue requires low-privilege access to AEM.",2023-11-15T20:22:17.827,https://cve.circl.lu/cve/CVE-2022-30678
CVE-2023-5408,5.9,Kubernetes,A privilege escalation flaw was found in the node restriction admission plugin of the kubernetes api server of OpenShift. A remote attacker who modifies the node role label could steer workloads from the control plane and etcd nodes onto different worker nodes and gain broader access to the cluster.,2023-11-17T00:15:08.287,https://cve.circl.lu/cve/CVE-2023-5408
CVE-2013-4300,10.0,Linux,"The scm_check_creds function in net/core/scm.c in the Linux kernel before 3.11 performs a capability check in an incorrect namespace, which allows local users to gain privileges via PID spoofing.",2023-11-15T02:51:28.227,https://cve.circl.lu/cve/CVE-2013-4300
CVE-2015-4036,10.0,Linux,Array index error in the tcm_vhost_make_tpg function in drivers/vhost/scsi.c in the Linux kernel before 4.0 might allow guest OS users to cause a denial of service (memory corruption) or possibly have unspecified other impact via a crafted VHOST_SCSI_SET_ENDPOINT ioctl call.  NOTE: the affected function was renamed to vhost_scsi_make_tpg before the vulnerability was announced.,2023-11-21T19:15:17.657,https://cve.circl.lu/cve/CVE-2015-4036
CVE-2022-44689,5.9,Linux,Windows Subsystem for Linux (WSL2) Kernel Elevation of Privilege Vulnerability,2023-11-17T17:37:19.567,https://cve.circl.lu/cve/CVE-2022-44689
CVE-2023-34256,3.6,Linux,"An issue was discovered in the Linux kernel before 6.3.3. There is an out-of-bounds read in crc16 in lib/crc16.c when called from fs/ext4/super.c because ext4_group_desc_csum does not properly check an offset. NOTE: this is disputed by third parties because the kernel is not intended to defend against attackers with the stated ""When modifying the block device while it is mounted by the filesystem"" access.",2023-11-15T02:51:56.783,https://cve.circl.lu/cve/CVE-2023-34256
CVE-2023-34241,5.2,Linux,"OpenPrinting CUPS is a standards-based, open source printing system for Linux and other Unix-like operating systems. Starting in version 2.0.0 and prior to version 2.4.6, CUPS logs data of free memory to the logging service AFTER the connection has been closed, when it should have logged the data right before. This is a use-after-free bug that impacts the entire cupsd process.The exact cause of this issue is the function `httpClose(con->http)` being called in `scheduler/client.c`. The problem is that httpClose always, provided its argument is not null, frees the pointer at the end of the call, only for cupsdLogClient to pass the pointer to httpGetHostname. This issue happens in function `cupsdAcceptClient` if LogLevel is warn or higher and in two scenarios: there is a double-lookup for the IP Address (HostNameLookups Double is set in `cupsd.conf`) which fails to resolve, or if CUPS is compiled with TCP wrappers and the connection is refused by rules from `/etc/hosts.allow` and `/etc/hosts.deny`.Version 2.4.6 has a patch for this issue.",2023-11-17T19:33:17.840,https://cve.circl.lu/cve/CVE-2023-34241
CVE-2019-15656,3.6,Management,D-Link DSL-2875AL and DSL-2877AL devices through 1.00.05 are prone to information disclosure via a simple crafted request to index.asp on the web management server because of username_v and password_v variables.,2023-11-17T20:01:46.870,https://cve.circl.lu/cve/CVE-2019-15656
CVE-2020-7336,3.6,Management,Cross Site Request Forgery vulnerability in McAfee Network Security Management (NSM) prior to 10.1.7.35 and NSM 9.x prior to 9.2.9.55 may allow an attacker to change the configuration of the Network Security Manager via a carefully crafted HTTP request.,2023-11-16T02:48:19.323,https://cve.circl.lu/cve/CVE-2020-7336
CVE-2021-31839,1.4,Management,Improper privilege management vulnerability in McAfee Agent for Windows prior to 5.7.3 allows a local user to modify event information in the MA event folder. This allows a local user to either add false events or remove events from the event logs prior to them being sent to the ePO server.,2023-11-15T20:49:17.243,https://cve.circl.lu/cve/CVE-2021-31839
CVE-2021-31836,5.2,Management,Improper privilege management vulnerability in maconfig for McAfee Agent for Windows prior to 5.7.4 allows a local user to gain access to sensitive information. The utility was able to be run from any location on the file system and by a low privileged user.,2023-11-15T18:54:47.457,https://cve.circl.lu/cve/CVE-2021-31836
CVE-2021-31848,2.7,Management,Cross site scripting (XSS) vulnerability in McAfee Data Loss Prevention (DLP) ePO extension prior to 11.7.100 allows a remote attacker to highjack an active DLP ePO administrator session by convincing the logged in administrator to click on a carefully crafted link in the case management part of the DLP ePO extension.,2023-11-16T03:12:12.673,https://cve.circl.lu/cve/CVE-2021-31848
CVE-2022-41115,5.9,Microsoft,Microsoft Edge (Chromium-based) Update Elevation of Privilege Vulnerability,2023-11-17T17:38:58.437,https://cve.circl.lu/cve/CVE-2022-41115
CVE-2022-44704,5.9,Microsoft,Microsoft Windows System Monitor (Sysmon) Elevation of Privilege Vulnerability,2023-11-17T17:35:04.130,https://cve.circl.lu/cve/CVE-2022-44704
CVE-2022-44708,6.0,Microsoft,Microsoft Edge (Chromium-based) Elevation of Privilege Vulnerability,2023-11-17T17:34:35.497,https://cve.circl.lu/cve/CVE-2022-44708
CVE-2023-21946,3.6,MySQL,Vulnerability in the MySQL Server product of Oracle MySQL (component: Server: Optimizer).  Supported versions that are affected are 8.0.32 and prior. Easily exploitable vulnerability allows low privileged attacker with network access via multiple protocols to compromise MySQL Server.  Successful attacks of this vulnerability can result in unauthorized ability to cause a hang or frequently repeatable crash (complete DOS) of MySQL Server. CVSS 3.1 Base Score 6.5 (Availability impacts).  CVSS Vector: (CVSS:3.1/AV:N/AC:L/PR:L/UI:N/S:U/C:N/I:N/A:H).,2023-11-15T02:56:53.250,https://cve.circl.lu/cve/CVE-2023-21946
CVE-2023-21947,3.6,MySQL,Vulnerability in the MySQL Server product of Oracle MySQL (component: Server: Components Services).  Supported versions that are affected are 8.0.32 and prior. Difficult to exploit vulnerability allows high privileged attacker with network access via multiple protocols to compromise MySQL Server.  Successful attacks of this vulnerability can result in unauthorized ability to cause a hang or frequently repeatable crash (complete DOS) of MySQL Server. CVSS 3.1 Base Score 4.4 (Availability impacts).  CVSS Vector: (CVSS:3.1/AV:N/AC:H/PR:H/UI:N/S:U/C:N/I:N/A:H).,2023-11-15T02:58:21.247,https://cve.circl.lu/cve/CVE-2023-21947
CVE-2023-21953,3.6,MySQL,Vulnerability in the MySQL Server product of Oracle MySQL (component: Server: Partition).  Supported versions that are affected are 8.0.32 and prior. Easily exploitable vulnerability allows high privileged attacker with network access via multiple protocols to compromise MySQL Server.  Successful attacks of this vulnerability can result in unauthorized ability to cause a hang or frequently repeatable crash (complete DOS) of MySQL Server. CVSS 3.1 Base Score 4.9 (Availability impacts).  CVSS Vector: (CVSS:3.1/AV:N/AC:L/PR:H/UI:N/S:U/C:N/I:N/A:H).,2023-11-15T02:59:01.443,https://cve.circl.lu/cve/CVE-2023-21953
CVE-2023-22053,4.2,MySQL,Vulnerability in the MySQL Server product of Oracle MySQL (component: Client programs).  Supported versions that are affected are 5.7.42 and prior and  8.0.33 and prior. Difficult to exploit vulnerability allows low privileged attacker with network access via multiple protocols to compromise MySQL Server.  Successful attacks of this vulnerability can result in unauthorized ability to cause a hang or frequently repeatable crash (complete DOS) of MySQL Server and  unauthorized read access to a subset of MySQL Server accessible data. CVSS 3.1 Base Score 5.9 (Confidentiality and Availability impacts).  CVSS Vector: (CVSS:3.1/AV:N/AC:H/PR:L/UI:N/S:U/C:L/I:N/A:H).,2023-11-15T03:00:54.377,https://cve.circl.lu/cve/CVE-2023-22053
CVE-2023-22054,3.6,MySQL,Vulnerability in the MySQL Server product of Oracle MySQL (component: Server: Optimizer).  Supported versions that are affected are 8.0.33 and prior. Easily exploitable vulnerability allows high privileged attacker with network access via multiple protocols to compromise MySQL Server.  Successful attacks of this vulnerability can result in unauthorized ability to cause a hang or frequently repeatable crash (complete DOS) of MySQL Server. CVSS 3.1 Base Score 4.9 (Availability impacts).  CVSS Vector: (CVSS:3.1/AV:N/AC:L/PR:H/UI:N/S:U/C:N/I:N/A:H).,2023-11-15T03:02:24.347,https://cve.circl.lu/cve/CVE-2023-22054
CVE-2022-46705,1.4,MacOS,"A spoofing issue existed in the handling of URLs. This issue was addressed with improved input validation. This issue is fixed in iOS 16.2 and iPadOS 16.2, macOS Ventura 13.1, Safari 16.2. Visiting a malicious website may lead to address bar spoofing.",2023-11-15T21:15:07.583,https://cve.circl.lu/cve/CVE-2022-46705
CVE-2023-28200,3.6,MacOS,"A validation issue was addressed with improved input sanitization. This issue is fixed in macOS Ventura 13.3, iOS 15.7.4 and iPadOS 15.7.4, macOS Monterey 12.6.4, macOS Big Sur 11.7.5. An app may be able to disclose kernel memory.",2023-11-17T19:33:06.590,https://cve.circl.lu/cve/CVE-2023-28200
CVE-2023-41993,5.9,MacOS,"The issue was addressed with improved checks. This issue is fixed in Safari 17, iOS 16.7 and iPadOS 16.7, macOS Sonoma 14. Processing web content may lead to arbitrary code execution. Apple is aware of a report that this issue may have been actively exploited against versions of iOS before iOS 16.7.",2023-11-16T03:15:07.190,https://cve.circl.lu/cve/CVE-2023-41993
CVE-2023-41983,3.6,MacOS,"The issue was addressed with improved memory handling. This issue is fixed in macOS Sonoma 14.1, Safari 17.1, iOS 16.7.2 and iPadOS 16.7.2, iOS 17.1 and iPadOS 17.1. Processing web content may lead to a denial-of-service.",2023-11-17T13:15:08.653,https://cve.circl.lu/cve/CVE-2023-41983
CVE-2021-23876,5.9,Malware,Bypass Remote Procedure call in McAfee Total Protection (MTP) prior to 16.0.30 allows a local user to gain elevated privileges and perform arbitrary file modification as the SYSTEM user potentially causing Denial of Service via executing carefully constructed malware.,2023-11-16T02:22:30.853,https://cve.circl.lu/cve/CVE-2021-23876
CVE-2023-30586,3.6,Node.js,"A privilege escalation vulnerability exists in Node.js 20 that allowed loading arbitrary OpenSSL engines when the experimental permission model is enabled, which can bypass and/or disable the permission model. The attack complexity is high. However, the crypto.setEngine() API can be used to bypass the permission model when called with a compatible OpenSSL engine. The OpenSSL engine can, for example, disable the permission model in the host process by manipulating the process's stack memory to locate the permission model Permission::enabled_ in the host process's heap memory. Please note that at the time this CVE was issued, the permission model is an experimental feature of Node.js.",2023-11-17T18:10:10.547,https://cve.circl.lu/cve/CVE-2023-30586
CVE-2023-38552,3.6,Node.js,"When the Node.js policy feature checks the integrity of a resource against a trusted manifest, the application can intercept the operation and return a forged checksum to the node's policy implementation, thus effectively disabling the integrity check.Impacts:This vulnerability affects all users using the experimental policy mechanism in all active release lines: 18.x and, 20.x.Please note that at the time this CVE was issued, the policy mechanism is an experimental feature of Node.js.",2023-11-16T16:15:30.800,https://cve.circl.lu/cve/CVE-2023-38552
CVE-2023-39331,3.6,Node.js,"A previously disclosed vulnerability (CVE-2023-30584) was patched insufficiently in commit 205f1e6. The new path traversal vulnerability arises because the implementation does not protect itself against the application overwriting built-in utility functions with user-defined implementations.Please note that at the time this CVE was issued, the permission model is an experimental feature of Node.js.",2023-11-17T19:10:41.253,https://cve.circl.lu/cve/CVE-2023-39331
CVE-2023-39332,5.9,Node.js,"Various `node:fs` functions allow specifying paths as either strings or `Uint8Array` objects. In Node.js environments, the `Buffer` class extends the `Uint8Array` class. Node.js prevents path traversal through strings (see CVE-2023-30584) and `Buffer` objects (see CVE-2023-32004), but not through non-`Buffer` `Uint8Array` objects.This is distinct from CVE-2023-32004 which only referred to `Buffer` objects. However, the vulnerability follows the same pattern using `Uint8Array` instead of `Buffer`.Please note that at the time this CVE was issued, the permission model is an experimental feature of Node.js.",2023-11-17T19:08:58.170,https://cve.circl.lu/cve/CVE-2023-39332
CVE-2021-23883,3.6,NULL Pointer,A Null Pointer Dereference vulnerability in McAfee Endpoint Security (ENS) for Windows prior to 10.7.0 February 2021 Update allows a local administrator to cause Windows to crash via a specific system call which is not handled correctly. This varies by machine and had partial protection prior to this update.,2023-11-16T02:50:43.797,https://cve.circl.lu/cve/CVE-2021-23883
CVE-2023-41909,3.6,NULL Pointer,"An issue was discovered in FRRouting FRR through 9.0. bgp_nlri_parse_flowspec in bgpd/bgp_flowspec.c processes malformed requests with no attributes, leading to a NULL pointer dereference.",2023-11-15T05:15:09.433,https://cve.circl.lu/cve/CVE-2023-41909
CVE-2023-5678,1.4,OpenSSL,"Issue summary: Generating excessively long X9.42 DH keys or checkingexcessively long X9.42 DH keys or parameters may be very slow.Impact summary: Applications that use the functions DH_generate_key() togenerate an X9.42 DH key may experience long delays.  Likewise, applicationsthat use DH_check_pub_key(), DH_check_pub_key_ex() or EVP_PKEY_public_check()to check an X9.42 DH key or X9.42 DH parameters may experience long delays.Where the key or parameters that are being checked have been obtained froman untrusted source this may lead to a Denial of Service.While DH_check() performs all the necessary checks (as of CVE-2023-3817),DH_check_pub_key() doesn't make any of these checks, and is thereforevulnerable for excessively large P and Q parameters.Likewise, while DH_generate_key() performs a check for an excessively largeP, it doesn't check for an excessively large Q.An application that calls DH_generate_key() or DH_check_pub_key() andsupplies a key or parameters obtained from an untrusted source could bevulnerable to a Denial of Service attack.DH_generate_key() and DH_check_pub_key() are also called by a number ofother OpenSSL functions.  An application calling any of those otherfunctions may similarly be affected.  The other functions affected by thisare DH_check_pub_key_ex(), EVP_PKEY_public_check(), and EVP_PKEY_generate().Also vulnerable are the OpenSSL pkey command line application when using the""-pubcheck"" option, as well as the OpenSSL genpkey command line application.The OpenSSL SSL/TLS implementation is not affected by this issue.The OpenSSL 3.0 and 3.1 FIPS providers are not affected by this issue.",2023-11-21T16:54:10.720,https://cve.circl.lu/cve/CVE-2023-5678
CVE-2021-31834,2.7,Orchestrator,Stored Cross-Site Scripting vulnerability in McAfee ePolicy Orchestrator (ePO) prior to 5.10 Update 11 allows ePO administrators to inject arbitrary web script or HTML via multiple parameters where the administrator's entries were not correctly sanitized.,2023-11-15T21:02:01.610,https://cve.circl.lu/cve/CVE-2021-31834
CVE-2021-31835,2.7,Orchestrator,Cross-Site Scripting vulnerability in McAfee ePolicy Orchestrator (ePO) prior to 5.10 Update 11 allows ePO administrators to inject arbitrary web script or HTML via a specific parameter where the administrator's entries were not correctly sanitized.,2023-11-15T18:53:43.750,https://cve.circl.lu/cve/CVE-2021-31835
CVE-2022-0842,3.6,Orchestrator,A blind SQL injection vulnerability in McAfee Enterprise ePolicy Orchestrator (ePO) prior to 5.10 Update 13 allows a remote authenticated attacker to potentially obtain information from the ePO database. The data obtained is dependent on the privileges the attacker has and to obtain sensitive data the attacker would require administrator privileges.,2023-11-15T20:24:37.953,https://cve.circl.lu/cve/CVE-2022-0842
CVE-2022-0857,2.7,Orchestrator,A reflected cross-site scripting (XSS) vulnerability in McAfee Enterprise ePolicy Orchestrator (ePO) prior to 5.10 Update 13 allows a remote attacker to potentially obtain access to an ePO administrator's session by convincing the attacker to click on a carefully crafted link. This would lead to limited access to sensitive information and limited ability to alter some information in ePO due to the area of the User Interface the vulnerability is present in.,2023-11-15T19:06:18.457,https://cve.circl.lu/cve/CVE-2022-0857
