CVE,"Impact Score (1-10, 10 being the worst)",Keyword,Description,Last Modified,Link
CVE-2022-41089,5.9,.NET Framework,.NET Framework Remote Code Execution Vulnerability,2023-11-17T17:39:58.597,https://cve.circl.lu/cve/CVE-2022-41089
CVE-2022-23201,2.7,Adobe,"Adobe RoboHelp versions 2020.0.7 (and earlier) is affected by a reflected Cross-Site Scripting (XSS) vulnerability. If an attacker is able to convince a victim to visit a URL referencing a vulnerable page, malicious JavaScript content may be executed within the context of the victim's browser.",2023-11-15T20:22:50.260,https://cve.circl.lu/cve/CVE-2022-23201
CVE-2022-34216,5.9,Adobe,"Adobe Acrobat Reader versions 22.001.20142 (and earlier), 20.005.30334 (and earlier) and 17.012.30229 (and earlier) are affected by a Use After Free vulnerability that could result in arbitrary code execution in the context of the current user. Exploitation of this issue requires user interaction in that a victim must open a malicious file.",2023-11-15T20:13:19.470,https://cve.circl.lu/cve/CVE-2022-34216
CVE-2022-34219,5.9,Adobe,"Adobe Acrobat Reader versions 22.001.20142 (and earlier), 20.005.30334 (and earlier) and 17.012.30229 (and earlier) are affected by a Use After Free vulnerability that could result in arbitrary code execution in the context of the current user. Exploitation of this issue requires user interaction in that a victim must open a malicious file.",2023-11-15T20:13:06.460,https://cve.circl.lu/cve/CVE-2022-34219
CVE-2022-34220,5.9,Adobe,"Adobe Acrobat Reader versions 22.001.20142 (and earlier), 20.005.30334 (and earlier) and 17.012.30229 (and earlier) are affected by a Use After Free vulnerability that could result in arbitrary code execution in the context of the current user. Exploitation of this issue requires user interaction in that a victim must open a malicious file.",2023-11-15T20:13:44.527,https://cve.circl.lu/cve/CVE-2022-34220
CVE-2022-34221,5.9,Adobe,"Adobe Acrobat Reader versions 22.001.20142 (and earlier), 20.005.30334 (and earlier) and 17.012.30229 (and earlier) are affected by an Access of Resource Using Incompatible Type ('Type Confusion') vulnerability that could result in arbitrary code execution in the context of the current user. Exploitation of this issue requires user interaction in that a victim must open a malicious file.",2023-11-15T20:12:45.487,https://cve.circl.lu/cve/CVE-2022-34221
CVE-2023-45348,1.4,Airflow,"Apache Airflow, versions 2.7.0 and 2.7.1, is affected by a vulnerability that allows an authenticated user to retrieve sensitive configuration information when the ""expose_config"" option is set to ""non-sensitive-only"". The `expose_config` option is False by default.It is recommended to upgrade to a version that is not affected.",2023-11-16T02:22:46.000,https://cve.circl.lu/cve/CVE-2023-45348
CVE-2020-13920,3.6,Apache,"Apache ActiveMQ uses LocateRegistry.createRegistry() to create the JMX RMI registry and binds the server to the ""jmxrmi"" entry. It is possible to connect to the registry without authentication and call the rebind method to rebind jmxrmi to something else. If an attacker creates another server to proxy the original, and bound that, he effectively becomes a man in the middle and is able to intercept the credentials when an user connects. Upgrade to Apache ActiveMQ 5.15.12.",2023-11-20T22:15:06.783,https://cve.circl.lu/cve/CVE-2020-13920
CVE-2021-26117,3.6,Apache,"The optional ActiveMQ LDAP login module can be configured to use anonymous access to the LDAP server. In this case, for Apache ActiveMQ Artemis prior to version 2.16.0 and Apache ActiveMQ prior to versions 5.16.1 and 5.15.14, the anonymous context is used to verify a valid users password in error, resulting in no check on the password.",2023-11-20T22:15:06.903,https://cve.circl.lu/cve/CVE-2021-26117
CVE-2021-41160,5.9,Apache,"FreeRDP is a free implementation of the Remote Desktop Protocol (RDP), released under the Apache license. In affected versions a malicious server might trigger out of bound writes in a connected client. Connections using GDI or SurfaceCommands to send graphics updates to the client might send `0` width/height or out of bound rectangles to trigger out of bound writes. With `0` width or heigth the memory allocation will be `0` but the missing bounds checks allow writing to the pointer at this (not allocated) region. This issue has been patched in FreeRDP 2.4.1.",2023-11-17T19:15:07.773,https://cve.circl.lu/cve/CVE-2021-41160
CVE-2021-39231,5.2,Apache,"In Apache Ozone versions prior to 1.2.0, Various internal server-to-server RPC endpoints are available for connections, making it possible for an attacker to download raw data from Datanode and Ozone manager and modify Ratis replication configuration.",2023-11-15T09:15:06.787,https://cve.circl.lu/cve/CVE-2021-39231
CVE-2023-35887,1.4,Apache,"Exposure of Sensitive Information to an Unauthorized Actor vulnerability in Apache Software Foundation Apache MINA.In SFTP servers implemented using Apache MINA SSHD that use a RootedFileSystem, logged users may be able to discover ""exists/does not exist"" information about items outside the rooted tree via paths including parent navigation ("".."") beyond the root, or involving symlinks.This issue affects Apache MINA: from 1.0 before 2.10. Users are recommended to upgrade to 2.10",2023-11-21T14:38:55.627,https://cve.circl.lu/cve/CVE-2023-35887
CVE-2018-2579,1.4,Apple,"Vulnerability in the Java SE, Java SE Embedded, JRockit component of Oracle Java SE (subcomponent: Libraries). Supported versions that are affected are Java SE: 6u171, 7u161, 8u152 and 9.0.1; Java SE Embedded: 8u151; JRockit: R28.3.16. Difficult to exploit vulnerability allows unauthenticated attacker with network access via multiple protocols to compromise Java SE, Java SE Embedded, JRockit. Successful attacks of this vulnerability can result in unauthorized read access to a subset of Java SE, Java SE Embedded, JRockit accessible data. Note: This vulnerability applies to client and server deployment of Java. This vulnerability can be exploited through sandboxed Java Web Start applications and sandboxed Java applets. It can also be exploited by supplying data to APIs in the specified Component without using sandboxed Java Web Start applications or sandboxed Java applets, such as through a web service. CVSS 3.0 Base Score 3.7 (Confidentiality impacts). CVSS Vector: (CVSS:3.0/AV:N/AC:H/PR:N/UI:N/S:U/C:L/I:N/A:N).",2023-11-21T19:13:33.743,https://cve.circl.lu/cve/CVE-2018-2579
CVE-2018-2581,1.4,Apple,"Vulnerability in the Java SE component of Oracle Java SE (subcomponent: JavaFX). Supported versions that are affected are Java SE: 7u161, 8u152 and 9.0.1. Easily exploitable vulnerability allows unauthenticated attacker with network access via multiple protocols to compromise Java SE. Successful attacks require human interaction from a person other than the attacker and while the vulnerability is in Java SE, attacks may significantly impact additional products. Successful attacks of this vulnerability can result in unauthorized read access to a subset of Java SE accessible data. Note: This vulnerability applies to Java deployments, typically in clients running sandboxed Java Web Start applications or sandboxed Java applets, that load and run untrusted code (e.g., code that comes from the internet) and rely on the Java sandbox for security. This vulnerability does not apply to Java deployments, typically in servers, that load and run only trusted code (e.g., code installed by an administrator). CVSS 3.0 Base Score 4.7 (Confidentiality impacts). CVSS Vector: (CVSS:3.0/AV:N/AC:L/PR:N/UI:R/S:C/C:L/I:N/A:N).",2023-11-21T19:13:17.797,https://cve.circl.lu/cve/CVE-2018-2581
CVE-2018-2582,3.6,Apple,"Vulnerability in the Java SE, Java SE Embedded component of Oracle Java SE (subcomponent: Hotspot). Supported versions that are affected are Java SE: 8u152 and 9.0.1; Java SE Embedded: 8u151. Easily exploitable vulnerability allows unauthenticated attacker with network access via multiple protocols to compromise Java SE, Java SE Embedded. Successful attacks require human interaction from a person other than the attacker. Successful attacks of this vulnerability can result in unauthorized creation, deletion or modification access to critical data or all Java SE, Java SE Embedded accessible data. Note: This vulnerability applies to client and server deployment of Java. This vulnerability can be exploited through sandboxed Java Web Start applications and sandboxed Java applets. It can also be exploited by supplying data to APIs in the specified Component without using sandboxed Java Web Start applications or sandboxed Java applets, such as through a web service. CVSS 3.0 Base Score 6.5 (Integrity impacts). CVSS Vector: (CVSS:3.0/AV:N/AC:L/PR:N/UI:R/S:U/C:N/I:H/A:N).",2023-11-21T19:13:28.723,https://cve.circl.lu/cve/CVE-2018-2582
CVE-2018-2588,1.4,Apple,"Vulnerability in the Java SE, Java SE Embedded, JRockit component of Oracle Java SE (subcomponent: LDAP). Supported versions that are affected are Java SE: 6u171, 7u161, 8u152 and 9.0.1; Java SE Embedded: 8u151; JRockit: R28.3.16. Easily exploitable vulnerability allows low privileged attacker with network access via multiple protocols to compromise Java SE, Java SE Embedded, JRockit. Successful attacks of this vulnerability can result in unauthorized read access to a subset of Java SE, Java SE Embedded, JRockit accessible data. Note: This vulnerability applies to client and server deployment of Java. This vulnerability can be exploited through sandboxed Java Web Start applications and sandboxed Java applets. It can also be exploited by supplying data to APIs in the specified Component without using sandboxed Java Web Start applications or sandboxed Java applets, such as through a web service. CVSS 3.0 Base Score 4.3 (Confidentiality impacts). CVSS Vector: (CVSS:3.0/AV:N/AC:L/PR:L/UI:N/S:U/C:L/I:N/A:N).",2023-11-21T19:13:22.147,https://cve.circl.lu/cve/CVE-2018-2588
CVE-2018-2599,2.5,Apple,"Vulnerability in the Java SE, Java SE Embedded, JRockit component of Oracle Java SE (subcomponent: JNDI). Supported versions that are affected are Java SE: 6u171, 7u161, 8u152 and 9.0.1; Java SE Embedded: 8u151; JRockit: R28.3.16. Difficult to exploit vulnerability allows unauthenticated attacker with network access via multiple protocols to compromise Java SE, Java SE Embedded, JRockit. Successful attacks of this vulnerability can result in unauthorized update, insert or delete access to some of Java SE, Java SE Embedded, JRockit accessible data and unauthorized ability to cause a partial denial of service (partial DOS) of Java SE, Java SE Embedded, JRockit. Note: This vulnerability applies to client and server deployment of Java. This vulnerability can be exploited through sandboxed Java Web Start applications and sandboxed Java applets. It can also be exploited by supplying data to APIs in the specified Component without using sandboxed Java Web Start applications or sandboxed Java applets, such as through a web service. CVSS 3.0 Base Score 4.8 (Integrity and Availability impacts). CVSS Vector: (CVSS:3.0/AV:N/AC:H/PR:N/UI:N/S:U/C:N/I:L/A:L).",2023-11-21T19:09:02.703,https://cve.circl.lu/cve/CVE-2018-2599
CVE-2022-23105,3.6,Active Directory,Jenkins Active Directory Plugin 2.25 and earlier does not encrypt the transmission of data between the Jenkins controller and Active Directory servers in most configurations.,2023-11-15T04:03:23.080,https://cve.circl.lu/cve/CVE-2022-23105
CVE-2023-4237,5.9,Ansible,"A flaw was found in the Ansible Automation Platform. When creating a new keypair, the ec2_key module prints out the private key directly to the standard output. This flaw allows an attacker to fetch those keys from the log files, compromising the system's confidentiality, integrity, and availability.",2023-11-18T11:15:42.257,https://cve.circl.lu/cve/CVE-2023-4237
CVE-2022-20715,4.0,Cisco,"A vulnerability in the remote access SSL VPN features of Cisco Adaptive Security Appliance (ASA) Software and Cisco Firepower Threat Defense (FTD) Software could allow an unauthenticated, remote attacker to cause a denial of service (DoS) condition on an affected device. This vulnerability is due to improper validation of errors that are logged as a result of client connections that are made using remote access VPN. An attacker could exploit this vulnerability by sending crafted requests to an affected system. A successful exploit could allow the attacker to cause the affected device to restart, resulting in a DoS condition.",2023-11-15T15:36:59.673,https://cve.circl.lu/cve/CVE-2022-20715
CVE-2023-20198,6.0,Cisco,"Cisco is providing an update for the ongoing investigation into observed exploitation of the web UI feature in Cisco IOS XE Software. We are updating the list of fixed releases and adding the Software Checker. Our investigation has determined that the actors exploited two previously unknown issues. The attacker first exploited CVE-2023-20198 to gain initial access and issued a privilege 15 command to create a local user and password combination. This allowed the user to log in with normal user access. The attacker then exploited another component of the web UI feature, leveraging the new local user to elevate privilege to root and write the implant to the file system. Cisco has assigned CVE-2023-20273 to this issue. CVE-2023-20198 has been assigned a CVSS Score of 10.0. CVE-2023-20273 has been assigned a CVSS Score of 7.2. Both of these CVEs are being tracked by CSCwh87343.",2023-11-15T19:29:03.473,https://cve.circl.lu/cve/CVE-2023-20198
CVE-2023-20273,5.9,Cisco,"A vulnerability in the web UI feature of Cisco IOS XE Software could allow an authenticated, remote attacker to inject commands with the privileges of root. This vulnerability is due to insufficient input validation. An attacker could exploit this vulnerability by sending crafted input to the web UI. A successful exploit could allow the attacker to inject commands to the underlying operating system with root privileges.",2023-11-15T19:13:12.563,https://cve.circl.lu/cve/CVE-2023-20273
CVE-2018-1000807,5.9,Cryptograph,Python Cryptographic Authority pyopenssl version prior to version 17.5.0 contains a CWE-416: Use After Free vulnerability in X509 object handling that can result in Use after free can lead to possible denial of service or remote code execution.. This attack appear to be exploitable via Depends on the calling application and if it retains a reference to the memory.. This vulnerability appears to have been fixed in 17.5.0.,2023-11-17T22:15:07.470,https://cve.circl.lu/cve/CVE-2018-1000807
CVE-2020-7339,3.4,Cryptograph,Use of a Broken or Risky Cryptographic Algorithm vulnerability in McAfee Database Security Server and Sensor prior to 4.8.0 in the form of a SHA1 signed certificate that would allow an attacker on the same local network to potentially intercept communication between the Server and Sensors.,2023-11-16T03:11:19.030,https://cve.circl.lu/cve/CVE-2020-7339
CVE-2023-46129,3.6,Cryptograph,"NATS.io is a high performance open source pub-sub distributed communication technology, built for the cloud, on-premise, IoT, and edge computing. The cryptographic key handling library, nkeys, recently gained support for encryption, not just for signing/authentication. This is used in nats-server 2.10 (Sep 2023) and newer for authentication callouts. In nkeys versions 0.4.0 through 0.4.5, corresponding with NATS server versions 2.10.0 through 2.10.3, the nkeys library's `xkeys` encryption handling logic mistakenly passed an array by value into an internal function, where the function mutated that buffer to populate the encryption key to use. As a result, all encryption was actually to an all-zeros key. This affects encryption only, not signing.  FIXME: FILL IN IMPACT ON NATS-SERVER AUTH CALLOUT SECURITY. nkeys Go library 0.4.6, corresponding with NATS Server 2.10.4, has a patch for this issue. No known workarounds are available. For any application handling auth callouts in Go, if using the nkeys library, update the dependency, recompile and deploy that in lockstep.",2023-11-17T19:33:33.457,https://cve.circl.lu/cve/CVE-2023-46129
CVE-2014-9517,2.9,D-Link,Cross-site scripting (XSS) vulnerability in D-link IP camera DCS-2103 with firmware before 1.20 allows remote attackers to inject arbitrary web script or HTML via the QUERY_STRING to vb.htm.,2023-11-17T20:01:31.690,https://cve.circl.lu/cve/CVE-2014-9517
CVE-2017-14419,3.6,D-Link,"The D-Link NPAPI extension, as used on D-Link DIR-850L REV. A (with firmware through FW114WWb07_h2ab_beta1) and REV. B (with firmware through FW208WWb02) devices, participates in mydlink Cloud Services by establishing a TCP relay service for HTTP, even though a TCP relay service for HTTPS is also established.",2023-11-17T20:01:16.417,https://cve.circl.lu/cve/CVE-2017-14419
CVE-2017-14420,3.6,D-Link,"The D-Link NPAPI extension, as used on D-Link DIR-850L REV. A (with firmware through FW114WWb07_h2ab_beta1) and REV. B (with firmware through FW208WWb02) devices, does not verify X.509 certificates from SSL servers, which allows man-in-the-middle attackers to spoof servers and obtain sensitive information via a crafted certificate.",2023-11-17T19:58:23.067,https://cve.circl.lu/cve/CVE-2017-14420
CVE-2017-14424,5.9,D-Link,D-Link DIR-850L REV. A (with firmware through FW114WWb07_h2ab_beta1) and REV. B (with firmware through FW208WWb02) devices have 0666 /var/passwd permissions.,2023-11-17T20:00:53.310,https://cve.circl.lu/cve/CVE-2017-14424
CVE-2017-14425,5.9,D-Link,D-Link DIR-850L REV. A (with firmware through FW114WWb07_h2ab_beta1) and REV. B (with firmware through FW208WWb02) devices have 0666 /var/etc/hnapasswd permissions.,2023-11-17T20:00:45.137,https://cve.circl.lu/cve/CVE-2017-14425
CVE-2023-36053,3.6,Django,"In Django 3.2 before 3.2.20, 4 before 4.1.10, and 4.2 before 4.2.3, EmailValidator and URLValidator are subject to a potential ReDoS (regular expression denial of service) attack via a very large number of domain name labels of emails and URLs.",2023-11-15T03:18:42.683,https://cve.circl.lu/cve/CVE-2023-36053
CVE-2023-4759,5.9,Eclipse,"Arbitrary File Overwrite in Eclipse JGit <= 6.6.0In Eclipse JGit, all versions <= 6.6.0.202305301015-r, a symbolic link present in a specially crafted git repository can be used to write a file to locations outside the working tree when this repository is cloned with JGit to a case-insensitive filesystem, or when a checkout from a clone of such a repository is performed on a case-insensitive filesystem.This can happen on checkout (DirCacheCheckout), merge (ResolveMerger via its WorkingTreeUpdater), pull (PullCommand using merge), and when applying a patch (PatchApplier). This can be exploited for remote code execution (RCE), for instance if the file written outside the working tree is a git filter that gets executed on a subsequent git command.The issue occurs only on case-insensitive filesystems, like the default filesystems on Windows and macOS. The user performing the clone or checkout must have the rights to create symbolic links for the problem to occur, and symbolic links must be enabled in the git configuration.Setting git configuration option core.symlinks = false before checking out avoids the problem.The issue was fixed in Eclipse JGit version 6.6.1.202309021850-r and 6.7.0.202309050840-r, available via  Maven Central https://repo1.maven.org/maven2/org/eclipse/jgit/  and  repo.eclipse.org https://repo.eclipse.org/content/repositories/jgit-releases/ .The JGit maintainers would like to thank RyotaK for finding and reporting this issue.",2023-11-15T19:35:44.150,https://cve.circl.lu/cve/CVE-2023-4759
CVE-2023-36478,3.6,Eclipse,"Eclipse Jetty provides a web server and servlet container. In versions 11.0.0 through 11.0.15, 10.0.0 through 10.0.15, and 9.0.0 through 9.4.52, an integer overflow in `MetaDataBuilder.checkSize` allows for HTTP/2 HPACK header values toexceed their size limit. `MetaDataBuilder.java` determines if a header name or value exceeds the size limit, and throws an exception if the limit is exceeded. However, when length is very large and huffman is true, the multiplication by 4 in line 295will overflow, and length will become negative. `(_size+length)` will now be negative, and the check on line 296 will not be triggered. Furthermore, `MetaDataBuilder.checkSize` allows for user-entered HPACK header value sizes to be negative, potentially leading to a very large buffer allocation later on when the user-entered size is multiplied by 2. This means that if a user provides a negative length value (or, more precisely, a length value which, when multiplied by the 4/3 fudge factor, is negative), and this length value is a very large positive number when multiplied by 2, then the user can cause a very large buffer to be allocated on the server. Users of HTTP/2 can be impacted by a remote denial of service attack. The issue has been fixed in versions 11.0.16, 10.0.16, and 9.4.53. There are no known workarounds.",2023-11-16T16:15:30.653,https://cve.circl.lu/cve/CVE-2023-36478
CVE-2023-31419,3.6,Elasticsearch,"A flaw was discovered in Elasticsearch, affecting the _search API that allowed a specially crafted query string to cause a Stack Overflow and ultimately a Denial of Service.",2023-11-16T16:15:30.490,https://cve.circl.lu/cve/CVE-2023-31419
CVE-2023-45161,5.9,Exchange,"The 1E-Exchange-URLResponseTime instruction that is part of the Network product pack available on the 1E Exchange does not properly validate the URL parameter, which allows for a specially crafted input to perform arbitrary code execution with SYSTEM permissions. This instruction only runs on Windows clients.To remediate this issue download the updated Network product pack from the 1E Exchange and update the 1E-Exchange-URLResponseTime instruction to v20.1 by uploading it through the 1E Platform instruction upload UI",2023-11-21T18:15:08.443,https://cve.circl.lu/cve/CVE-2023-45161
CVE-2023-45163,5.9,Exchange,"The 1E-Exchange-CommandLinePing instruction that is part of the Network product pack available on the 1E Exchange does not properly validate the input parameter, which allows for a specially crafted input to perform arbitrary code execution with SYSTEM permissions. This instruction only runs on Windows clients.To remediate this issue download the updated Network product pack from the 1E Exchange and update the 1E-Exchange-CommandLinePing instruction to v18.1 by uploading it through the 1E Platform instruction upload UI",2023-11-21T18:15:08.543,https://cve.circl.lu/cve/CVE-2023-45163
CVE-2023-5964,5.9,Exchange,"The 1E-Exchange-DisplayMessageinstruction that is part of the End-User Interaction product pack available on the 1E Exchange does not properly validate the Caption or Message parameters, which allows for a specially crafted input to perform arbitrary code execution with SYSTEM permissions. This instruction only runs on Windows clients.To remediate this issue DELETE the instruction “Show dialogue with caption %Caption% and message %Message%” from the list of instructions in the Settings UI, and replace it with the new instruction 1E-Exchange-ShowNotification instruction available in the updated End-User Interaction product pack. The new instruction should show as “Show %Type% type notification with header %Header% and message %Message%” with a version of 7.1 or above.",2023-11-21T18:15:09.550,https://cve.circl.lu/cve/CVE-2023-5964
CVE-2020-7328,5.9,Endpoint,"External entity attack vulnerability in the ePO extension in McAfee MVISION Endpoint prior to 20.11 allows remote attackers to gain control of a resource or trigger arbitrary code execution via improper input validation of an HTTP request, where the content for the attack has been loaded into ePO by an ePO administrator.",2023-11-16T14:12:09.180,https://cve.circl.lu/cve/CVE-2020-7328
CVE-2020-7329,5.9,Endpoint,Server-side request forgery vulnerability in the ePO extension in McAfee MVISION Endpoint prior to 20.11 allows remote attackers trigger server-side DNS requests to arbitrary domains via carefully constructed XML files loaded by an ePO administrator.,2023-11-16T14:23:13.797,https://cve.circl.lu/cve/CVE-2020-7329
CVE-2020-7331,5.9,Endpoint,Unquoted service executable path in McAfee Endpoint Security (ENS) prior to 10.7.0 November 2020 Update allows local users to cause a denial of service and malicious file execution via carefully crafted and named executable files.,2023-11-15T19:12:41.143,https://cve.circl.lu/cve/CVE-2020-7331
CVE-2020-7332,5.9,Endpoint,Cross Site Request Forgery vulnerability in the firewall ePO extension of McAfee Endpoint Security (ENS) prior to 10.7.0 November 2020 Update allows an attacker to execute arbitrary HTML code due to incorrect security configuration.,2023-11-16T03:05:59.747,https://cve.circl.lu/cve/CVE-2020-7332
CVE-2020-7333,2.7,Endpoint,Cross site scripting vulnerability in the firewall ePO extension of McAfee Endpoint Security (ENS) prior to 10.7.0 November 2020 Update allows administrators to inject arbitrary web script or HTML via the configuration wizard.,2023-11-16T02:18:57.103,https://cve.circl.lu/cve/CVE-2020-7333
CVE-2022-27206,3.6,GitLab,Jenkins GitLab Authentication Plugin 1.13 and earlier stores the GitLab client secret unencrypted in the global config.xml file on the Jenkins controller where it can be viewed by users with access to the Jenkins controller file system.,2023-11-15T04:03:30.343,https://cve.circl.lu/cve/CVE-2022-27206
CVE-2023-4522,1.4,GitLab,An issue has been discovered in GitLab affecting all versions before 16.2.0. Committing directories containing LF character results in 500 errors when viewing the commit.,2023-11-15T12:15:06.860,https://cve.circl.lu/cve/CVE-2023-4522
