CVE,"Impact Score (1-10, 10 being the worst)",Keyword,Description,Last Modified,Link
CVE-2020-1243,5.9,Virtual Machine,"<p>A denial of service vulnerability exists when Microsoft Hyper-V on a host server fails to properly validate specific malicious data from a user on a guest operating system.</p><p>To exploit the vulnerability, an attacker who already has a privileged account on a guest operating system, running as a virtual machine, could run a specially crafted application.</p><p>The security update addresses the vulnerability by resolving the conditions where Hyper-V would fail to handle these requests.</p>",2023-12-31T20:16:02.387,https://cve.circl.lu/cve/CVE-2020-1243
CVE-2021-27075,4.0,Virtual Machine,Azure Virtual Machine Information Disclosure Vulnerability,2023-12-29T17:16:05.550,https://cve.circl.lu/cve/CVE-2021-27075
CVE-2020-1510,3.6,Win32k,"<p>An information disclosure vulnerability exists when the win32k component improperly provides kernel information. An attacker who successfully exploited the vulnerability could obtain information to further compromise the user’s system.</p><p>To exploit this vulnerability, an attacker would have to log on to an affected system and run a specially crafted application.</p><p>The security update addresses the vulnerability by correcting how win32k handles objects in memory.</p>",2024-01-04T02:15:16.540,https://cve.circl.lu/cve/CVE-2020-1510
CVE-2020-0941,3.6,Win32k,"<p>An information disclosure vulnerability exists when the win32k component improperly provides kernel information. An attacker who successfully exploited the vulnerability could obtain information to further compromise the user’s system.</p><p>To exploit the vulnerability, an attacker would have to either log on locally to an affected system, or convince a locally authenticated user to execute a specially crafted application.</p><p>The security update addresses the vulnerability by correcting how win32k handles objects in memory.</p>",2023-12-31T22:15:48.410,https://cve.circl.lu/cve/CVE-2020-0941
CVE-2020-1152,4.7,Win32k,"<p>An elevation of privilege vulnerability exists when Windows improperly handles calls to Win32k.sys. An attacker who successfully exploited the vulnerability could gain elevated privileges on a targeted system.</p><p>To exploit the vulnerability, an attacker would have to log on to an affected system and run a specially crafted script or application.</p><p>The update addresses the vulnerability by correcting how Windows handles calls to Win32k.</p>",2023-12-31T22:15:58.210,https://cve.circl.lu/cve/CVE-2020-1152
CVE-2020-1245,5.9,Win32k,"<p>An elevation of privilege vulnerability exists in Windows when the Win32k component fails to properly handle objects in memory. An attacker who successfully exploited this vulnerability could run arbitrary code in kernel mode. An attacker could then install programs; view, change, or delete data; or create new accounts with full user rights.</p><p>To exploit this vulnerability, an attacker would first have to log on to the system. An attacker could then run a specially crafted application that could exploit the vulnerability and take control of an affected system.</p><p>The update addresses this vulnerability by correcting how Win32k handles objects in memory.</p>",2023-12-31T22:16:00.747,https://cve.circl.lu/cve/CVE-2020-1245
CVE-2020-1250,3.6,Win32k,"<p>An information disclosure vulnerability exists when the win32k component improperly provides kernel information. An attacker who successfully exploited the vulnerability could obtain information to further compromise the user’s system.</p><p>To exploit this vulnerability, an attacker would have to log on to an affected system and run a specially crafted application.</p><p>The security update addresses the vulnerability by correcting how win32k handles objects in memory.</p>",2023-12-31T22:16:00.960,https://cve.circl.lu/cve/CVE-2020-1250
CVE-2020-1337,5.9,Windows,"<p>An elevation of privilege vulnerability exists when the Windows Print Spooler service improperly allows arbitrary writing to the file system. An attacker who successfully exploited this vulnerability could run arbitrary code with elevated system privileges. An attacker could then install programs; view, change, or delete data; or create new accounts with full user rights.</p><p>To exploit this vulnerability, an attacker would have to log on to an affected system and run a specially crafted script or application.</p><p>The update addresses the vulnerability by correcting how the Windows Print Spooler Component writes to the file system.</p>",2024-01-04T02:15:09.277,https://cve.circl.lu/cve/CVE-2020-1337
CVE-2020-1339,5.9,Windows,"<p>A remote code execution vulnerability exists when Windows Media Audio Codec improperly handles objects. An attacker who successfully exploited the vulnerability could take control of an affected system.</p><p>There are multiple ways an attacker could exploit the vulnerability, such as by convincing a user to open a specially crafted document, or by convincing a user to visit a malicious webpage.</p><p>The security update addresses the vulnerability by correcting how Windows Media Audio Codec handles objects.</p>",2024-01-04T02:15:09.493,https://cve.circl.lu/cve/CVE-2020-1339
CVE-2020-1377,5.9,Windows,<p>An elevation of privilege vulnerability exists when the Windows Kernel API improperly handles registry objects in memory. An attacker who successfully exploited the vulnerability could gain elevated privileges on a targeted system.</p><p>A locally authenticated attacker could exploit this vulnerability by running a specially crafted application.</p><p>The security update addresses the vulnerability by helping to ensure that the Windows Kernel API properly handles objects in memory.</p>,2024-01-04T02:15:09.683,https://cve.circl.lu/cve/CVE-2020-1377
CVE-2020-1378,5.9,Windows,<p>An elevation of privilege vulnerability exists when the Windows Kernel API improperly handles registry objects in memory. An attacker who successfully exploited the vulnerability could gain elevated privileges on a targeted system.</p><p>A locally authenticated attacker could exploit this vulnerability by running a specially crafted application.</p><p>The security update addresses the vulnerability by helping to ensure that the Windows Kernel API properly handles objects in memory.</p>,2024-01-04T02:15:09.907,https://cve.circl.lu/cve/CVE-2020-1378
CVE-2020-1379,3.6,Windows,"<p>A memory corruption vulnerability exists when Windows Media Foundation improperly handles objects in memory. An attacker who successfully exploited the vulnerability could install programs; view, change, or delete data; or create new accounts with full user rights.</p><p>There are multiple ways an attacker could exploit the vulnerability, such as by convincing a user to open a specially crafted document, or by convincing a user to visit a malicious webpage.</p><p>The security update addresses the vulnerability by correcting how Windows Media Foundation handles objects in memory.</p>",2024-01-04T02:15:10.103,https://cve.circl.lu/cve/CVE-2020-1379
CVE-2023-3080,2.7,WordPress,"The WP Mail Catcher plugin for WordPress is vulnerable to Stored Cross-Site Scripting via an email subject in versions up to, and including, 2.1.2 due to insufficient input sanitization and output escaping. This makes it possible for unauthenticated attackers to inject arbitrary web scripts in pages that will execute whenever a user accesses an injected page.",2024-01-02T16:28:55.030,https://cve.circl.lu/cve/CVE-2023-3080
CVE-2020-1198,4.0,XSS,"<p>A cross-site-scripting (XSS) vulnerability exists when Microsoft SharePoint Server does not properly sanitize a specially crafted web request to an affected SharePoint server. An authenticated attacker could exploit the vulnerability by sending a specially crafted request to an affected SharePoint server.</p><p>The attacker who successfully exploited the vulnerability could then perform cross-site scripting attacks on affected systems and run script in the security context of the current user. The attacks could allow the attacker to read content that the attacker is not authorized to read, use the victim's identity to take actions on the SharePoint site on behalf of the user, such as change permissions and delete content, and inject malicious content in the browser of the user.</p><p>The security update addresses the vulnerability by helping to ensure that SharePoint Server properly sanitizes web requests.</p>",2023-12-31T22:15:59.300,https://cve.circl.lu/cve/CVE-2020-1198
CVE-2020-1227,2.5,XSS,"<p>A cross-site-scripting (XSS) vulnerability exists when Microsoft SharePoint Server does not properly sanitize a specially crafted web request to an affected SharePoint server. An authenticated attacker could exploit the vulnerability by sending a specially crafted request to an affected SharePoint server.</p><p>The attacker who successfully exploited the vulnerability could then perform cross-site scripting attacks on affected systems and run script in the security context of the current user. The attacks could allow the attacker to read content that the attacker is not authorized to read, use the victim's identity to take actions on the SharePoint site on behalf of the user, such as change permissions and delete content, and inject malicious content in the browser of the user.</p><p>The security update addresses the vulnerability by helping to ensure that SharePoint Server properly sanitizes web requests.</p>",2023-12-31T22:16:00.387,https://cve.circl.lu/cve/CVE-2020-1227
CVE-2020-1345,4.0,XSS,"<p>A cross-site-scripting (XSS) vulnerability exists when Microsoft SharePoint Server does not properly sanitize a specially crafted web request to an affected SharePoint server. An authenticated attacker could exploit the vulnerability by sending a specially crafted request to an affected SharePoint server.</p><p>The attacker who successfully exploited the vulnerability could then perform cross-site scripting attacks on affected systems and run script in the security context of the current user. The attacks could allow the attacker to read content that the attacker is not authorized to read, use the victim's identity to take actions on the SharePoint site on behalf of the user, such as change permissions and delete content, and inject malicious content in the browser of the user.</p><p>The security update addresses the vulnerability by helping to ensure that SharePoint Server properly sanitizes web requests.</p>",2023-12-31T22:16:02.857,https://cve.circl.lu/cve/CVE-2020-1345
CVE-2023-39912,3.6,Zoho,Zoho ManageEngine ADManager Plus before 7203 allows Help Desk Technician users to read arbitrary files on the machine where this product is installed.,2024-01-01T06:15:08.007,https://cve.circl.lu/cve/CVE-2023-39912
CVE-2022-43391,3.6,Zyxel,"A buffer overflow vulnerability in the parameter of the CGI program in Zyxel NR7101 firmware prior to V1.15(ACCC.3)C0, which could allow an authenticated attacker to cause denial-of-service (DoS) conditions by sending a crafted HTTP request.",2023-12-29T07:15:08.013,https://cve.circl.lu/cve/CVE-2022-43391
CVE-2022-43392,3.6,Zyxel,"A buffer overflow vulnerability in the parameter of web server in Zyxel NR7101 firmware prior to V1.15(ACCC.3)C0, which could allow an authenticated attacker to cause denial-of-service (DoS) conditions by sending a crafted authorization request.",2023-12-29T07:15:09.660,https://cve.circl.lu/cve/CVE-2022-43392
CVE-2022-45854,1.4,Zyxel,"An improper check for unusual conditions in Zyxel NWA110AX firmware verisons prior to 6.50(ABTG.0)C0, which could allow a LAN attacker to cause a temporary denial-of-service (DoS) by sending crafted VLAN frames if the MAC address of the vulnerable AP were intercepted by the attacker.",2023-12-29T07:15:10.010,https://cve.circl.lu/cve/CVE-2022-45854
CVE-2023-43314,3.6,Zyxel,** UNSUPPORTED WHEN ASSIGNED **The buffer overflow vulnerability in the Zyxel PMG2005-T20B firmware version V1.00(ABNK.2)b11_C0 could allow an unauthenticated attacker to cause a denial of service condition via a crafted uid.,2023-12-29T08:15:36.570,https://cve.circl.lu/cve/CVE-2023-43314
