CVE,"Impact Score (1-10, 10 being the worst)",Keyword,Description,Last Modified,Link
CVE-2020-1498,5.9,Excel,"<p>A remote code execution vulnerability exists in Microsoft Excel software when the software fails to properly handle objects in memory. An attacker who successfully exploited the vulnerability could run arbitrary code in the context of the current user. If the current user is logged on with administrative user rights, an attacker could take control of the affected system. An attacker could then install programs; view, change, or delete data; or create new accounts with full user rights. Users whose accounts are configured to have fewer user rights on the system could be less impacted than users who operate with administrative user rights.</p><p>Exploitation of the vulnerability requires that a user open a specially crafted file with an affected version of Microsoft Excel. In an email attack scenario, an attacker could exploit the vulnerability by sending the specially crafted file to the user and convincing the user to open the file. In a web-based attack scenario, an attacker could host a website (or leverage a compromised website that accepts or hosts user-provided content) containing a specially crafted file designed to exploit the vulnerability. An attacker would have no way to force users to visit the website. Instead, an attacker would have to convince users to click a link, typically by way of an enticement in an email or instant message, and then convince them to open the specially crafted file.</p><p>The security update addresses the vulnerability by correcting how Microsoft Excel handles objects in memory.</p>",2024-01-04T02:15:15.440,https://cve.circl.lu/cve/CVE-2020-1498
CVE-2020-16875,6.0,Exchange,<p>A remote code execution vulnerability exists in Microsoft Exchange server due to improper validation of cmdlet arguments.</p><p>An attacker who successfully exploited the vulnerability could run arbitrary code in the context of the System user. Exploitation of the vulnerability requires an authenticated user in a certain Exchange role to be compromised.</p><p>The security update addresses the vulnerability by correcting how Microsoft Exchange handles cmdlet arguments.</p>,2023-12-31T22:15:52.447,https://cve.circl.lu/cve/CVE-2020-16875
CVE-2020-16969,3.7,Exchange,"<p>An information disclosure vulnerability exists in how Microsoft Exchange validates tokens when handling certain messages. An attacker who successfully exploited the vulnerability could use this to gain further information from a user.</p><p>To exploit the vulnerability, an attacker could include specially crafted OWA messages that could be loaded, without warning or filtering, from the attacker-controlled URL. This callback vector provides an information disclosure tactic used in web beacons and other types of tracking systems.</p><p>The security update corrects the way that Exchange handles these token validations.</p>",2023-12-31T20:15:59.407,https://cve.circl.lu/cve/CVE-2020-16969
CVE-2020-17083,3.7,Exchange,Microsoft Exchange Server Remote Code Execution Vulnerability,2023-12-31T19:15:28.283,https://cve.circl.lu/cve/CVE-2020-17083
CVE-2020-17084,6.0,Exchange,Microsoft Exchange Server Remote Code Execution Vulnerability,2023-12-31T19:15:28.470,https://cve.circl.lu/cve/CVE-2020-17084
CVE-2020-17085,5.5,Exchange,Microsoft Exchange Server Denial of Service Vulnerability,2023-12-31T19:15:28.650,https://cve.circl.lu/cve/CVE-2020-17085
CVE-2020-1470,5.9,Exploit,"<p>An elevation of privilege vulnerability exists when the Windows Work Folders Service improperly handles memory.</p><p>To exploit this vulnerability, an attacker would first have to gain execution on the victim system. An attacker could then run a specially crafted application to elevate privileges.</p><p>The security update addresses the vulnerability by correcting how the Windows Work Folders Service handles memory.</p>",2024-01-04T02:15:11.820,https://cve.circl.lu/cve/CVE-2020-1470
CVE-2020-1484,5.9,Exploit,"<p>An elevation of privilege vulnerability exists when the Windows Work Folders Service improperly handles memory.</p><p>To exploit this vulnerability, an attacker would first have to gain execution on the victim system. An attacker could then run a specially crafted application to elevate privileges.</p><p>The security update addresses the vulnerability by correcting how the Windows Work Folders Service handles memory.</p>",2024-01-04T02:15:13.837,https://cve.circl.lu/cve/CVE-2020-1484
CVE-2020-1488,5.9,Exploit,"<p>An elevation of privilege vulnerability exists when the Windows AppX Deployment Extensions improperly performs privilege management, resulting in access to system files.</p><p>To exploit this vulnerability, an authenticated attacker would need to run a specially crafted application to elevate privileges.</p><p>The security update addresses the vulnerability by correcting how AppX Deployment Extensions manages privileges.</p>",2024-01-04T02:15:14.507,https://cve.circl.lu/cve/CVE-2020-1488
CVE-2020-1489,5.9,Exploit,"<p>An elevation of privilege vulnerability exists when the Windows CSC Service improperly handles memory.</p><p>To exploit this vulnerability, an attacker would first have to gain execution on the victim system. An attacker could then run a specially crafted application to elevate privileges.</p><p>The security update addresses the vulnerability by correcting how the Windows CSC Service handles memory.</p>",2024-01-04T02:15:14.693,https://cve.circl.lu/cve/CVE-2020-1489
CVE-2020-1513,5.9,Exploit,"<p>An elevation of privilege vulnerability exists when the Windows CSC Service improperly handles memory.</p><p>To exploit this vulnerability, an attacker would first have to gain execution on the victim system. An attacker could then run a specially crafted application to elevate privileges.</p><p>The security update addresses the vulnerability by correcting how the Windows CSC Service handles memory.</p>",2024-01-04T02:15:17.200,https://cve.circl.lu/cve/CVE-2020-1513
CVE-2021-27091,5.9,Endpoint,RPC Endpoint Mapper Service Elevation of Privilege Vulnerability,2023-12-29T20:16:00.400,https://cve.circl.lu/cve/CVE-2021-27091
CVE-2021-45967,5.9,Endpoint,"An issue was discovered in Pascom Cloud Phone System before 7.20.x. A configuration error between NGINX and a backend Tomcat server leads to a path traversal in the Tomcat server, exposing unintended endpoints.",2024-01-03T18:55:26.920,https://cve.circl.lu/cve/CVE-2021-45967
CVE-2022-25153,5.9,Endpoint,"The ITarian Endpoint Manage Communication Client, prior to version 6.43.41148.21120, is compiled using insecure OpenSSL settings. Due to this setting, a malicious actor with low privileges access to a system can escalate his privileges to SYSTEM abusing an insecure openssl.conf lookup.",2024-01-02T19:15:09.293,https://cve.circl.lu/cve/CVE-2022-25153
CVE-2022-45052,3.6,Endpoint,"A Local File Inclusion vulnerability has been found in Axiell Iguana CMS. Due to insufficient neutralisation of user input on the url parameter on the Proxy.type.php endpoint, external users are capable of accessing files on the server.",2024-01-02T19:15:10.030,https://cve.circl.lu/cve/CVE-2022-45052
CVE-2019-15592,1.4,GitLab,GitLab 12.2.2 and below contains a security vulnerability that allows a guest user in a private project to see the merge request ID associated to an issue via the activity timeline.,2024-01-03T18:55:45.153,https://cve.circl.lu/cve/CVE-2019-15592
CVE-2023-6051,3.6,GitLab,"An issue has been discovered in GitLab CE/EE affecting all versions before 16.4.4, all versions starting from 16.5 before 16.5.4, all versions starting from 16.6 before 16.6.2. File integrity may be compromised when source code or installation packages are pulled from a specific tag.",2024-01-02T09:15:07.310,https://cve.circl.lu/cve/CVE-2023-6051
CVE-2015-1239,3.6,Google,"Double free vulnerability in the j2k_read_ppm_v3 function in OpenJPEG before r2997, as used in PDFium in Google Chrome, allows remote attackers to cause a denial of service (process crash) via a crafted PDF.",2023-12-29T18:05:05.527,https://cve.circl.lu/cve/CVE-2015-1239
CVE-2023-6348,5.9,Google,Type Confusion in Spellcheck in Google Chrome prior to 119.0.6045.199 allowed a remote attacker who had compromised the renderer process to potentially exploit heap corruption via a crafted HTML page. (Chromium security severity: High),2024-01-03T17:15:11.823,https://cve.circl.lu/cve/CVE-2023-6348
CVE-2020-0890,4.0,Hyper-V,"<p>A denial of service vulnerability exists when Microsoft Hyper-V on a host server fails to properly validate specific malicious data from a user on a guest operating system.</p><p>To exploit the vulnerability, an attacker who already has a privileged account on a guest operating system, running as a virtual machine, could run a specially crafted application.</p><p>The security update addresses the vulnerability by resolving the conditions where Hyper-V would fail to handle these requests.</p>",2023-12-31T22:15:46.697,https://cve.circl.lu/cve/CVE-2020-0890
CVE-2020-0904,4.0,Hyper-V,"<p>A denial of service vulnerability exists when Microsoft Hyper-V on a host server fails to properly validate specific malicious data from a user on a guest operating system.</p><p>To exploit the vulnerability, an attacker who already has a privileged account on a guest operating system, running as a virtual machine, could run a specially crafted application.</p><p>The security update addresses the vulnerability by resolving the conditions where Hyper-V would fail to handle these requests.</p>",2023-12-31T22:15:46.877,https://cve.circl.lu/cve/CVE-2020-0904
CVE-2020-16891,6.0,Hyper-V,"<p>A remote code execution vulnerability exists when Windows Hyper-V on a host server fails to properly validate input from an authenticated user on a guest operating system. To exploit the vulnerability, an attacker could run a specially crafted application on a guest operating system that could cause the Hyper-V host operating system to execute arbitrary code.</p><p>An attacker who successfully exploited the vulnerability could execute arbitrary code on the host operating system.</p><p>The security update addresses the vulnerability by correcting how Hyper-V validates guest operating system user input.</p>",2023-12-31T20:15:47.797,https://cve.circl.lu/cve/CVE-2020-16891
CVE-2020-1047,5.9,Hyper-V,"<p>An elevation of privilege vulnerability exists when Windows Hyper-V on a host server fails to properly handle objects in memory. An attacker who successfully exploited these vulnerabilities could gain elevated privileges on a target operating system.</p><p>This vulnerability by itself does not allow arbitrary code to be run.  However, this vulnerability could be used in conjunction with one or more vulnerabilities (e.g. a remote code execution vulnerability and another elevation of privilege) that could take advantage of the elevated privileges when running.</p><p>The update addresses the vulnerabilities by correcting how Windows Hyper-V handles objects in memory.</p>",2023-12-31T20:16:01.757,https://cve.circl.lu/cve/CVE-2020-1047
CVE-2020-1080,6.0,Hyper-V,"<p>An elevation of privilege vulnerability exists when Windows Hyper-V on a host server fails to properly handle objects in memory. An attacker who successfully exploited these vulnerabilities could gain elevated privileges on a target operating system.</p><p>This vulnerability by itself does not allow arbitrary code to be run.  However, this vulnerability could be used in conjunction with one or more vulnerabilities (e.g. a remote code execution vulnerability and another elevation of privilege) that could take advantage of the elevated privileges when running.</p><p>The update addresses the vulnerabilities by correcting how Windows Hyper-V handles objects in memory.</p>",2023-12-31T20:16:02.003,https://cve.circl.lu/cve/CVE-2020-1080
CVE-2021-24087,5.9,IoT,Azure IoT CLI extension Elevation of Privilege Vulnerability,2023-12-29T23:15:29.310,https://cve.circl.lu/cve/CVE-2021-24087
CVE-2020-16971,5.2,Java,Azure SDK for Java Security Feature Bypass Vulnerability,2023-12-31T18:15:46.853,https://cve.circl.lu/cve/CVE-2020-16971
CVE-2020-17159,5.9,Java,Visual Studio Code Java Extension Pack Remote Code Execution Vulnerability,2023-12-30T00:15:18.027,https://cve.circl.lu/cve/CVE-2020-17159
CVE-2021-27084,5.9,Java,Visual Studio Code Java Extension Pack Remote Code Execution Vulnerability,2023-12-29T17:16:06.947,https://cve.circl.lu/cve/CVE-2021-27084
CVE-2023-40338,1.4,Jenkins,"Jenkins Folders Plugin 6.846.v23698686f0f6 and earlier displays an error message that includes an absolute path of a log file when attempting to access the Scan Organization Folder Log if no logs are available, exposing information about the Jenkins controller file system.",2024-01-02T19:53:57.583,https://cve.circl.lu/cve/CVE-2023-40338
CVE-2021-24109,5.9,Kubernetes,Microsoft Azure Kubernetes Service Elevation of Privilege Vulnerability,2023-12-29T17:15:58.583,https://cve.circl.lu/cve/CVE-2021-24109
CVE-2023-5408,5.9,Kubernetes,A privilege escalation flaw was found in the node restriction admission plugin of the kubernetes api server of OpenShift. A remote attacker who modifies the node role label could steer workloads from the control plane and etcd nodes onto different worker nodes and gain broader access to the cluster.,2023-12-30T12:15:43.933,https://cve.circl.lu/cve/CVE-2023-5408
CVE-2014-3182,10.0,Linux,Array index error in the logi_dj_raw_event function in drivers/hid/hid-logitech-dj.c in the Linux kernel before 3.16.2 allows physically proximate attackers to execute arbitrary code or cause a denial of service (invalid kfree) via a crafted device that provides a malformed REPORT_TYPE_NOTIF_DEVICE_UNPAIRED value.,2023-12-29T15:41:33.040,https://cve.circl.lu/cve/CVE-2014-3182
CVE-2014-3183,10.0,Linux,Heap-based buffer overflow in the logi_dj_ll_raw_request function in drivers/hid/hid-logitech-dj.c in the Linux kernel before 3.16.2 allows physically proximate attackers to cause a denial of service (system crash) or possibly execute arbitrary code via a crafted device that specifies a large report size for an LED report.,2023-12-29T15:42:53.263,https://cve.circl.lu/cve/CVE-2014-3183
CVE-2020-16995,5.9,Linux,"<p>An elevation of privilege vulnerability exists in Network Watcher Agent virtual machine extension for Linux. An attacker who successfully exploited this vulnerability could execute code with elevated privileges.</p><p>To exploit this vulnerability, an attacker would have to be present as a user on the affected virtual machine.</p><p>The security update addresses this vulnerability by correcting how Network Watcher Agent virtual machine extension for Linux executes with elevated privileges.</p>",2023-12-31T20:16:01.050,https://cve.circl.lu/cve/CVE-2020-16995
CVE-2023-35001,5.9,Linux,Linux Kernel nftables Out-Of-Bounds Read/Write Vulnerability; nft_byteorder poorly handled vm register contents when CAP_NET_ADMIN is in any user or network namespace,2023-12-29T16:03:16.633,https://cve.circl.lu/cve/CVE-2023-35001
CVE-2023-3610,5.9,Linux,A use-after-free vulnerability in the Linux kernel's netfilter: nf_tables component can be exploited to achieve local privilege escalation.Flaw in the error handling of bound chains causes a use-after-free in the abort path of NFT_MSG_NEWRULE. The vulnerability requires CAP_NET_ADMIN to be triggered.We recommend upgrading past commit 4bedf9eee016286c835e3d8fa981ddece5338795.,2023-12-29T16:05:32.897,https://cve.circl.lu/cve/CVE-2023-3610
CVE-2020-1455,3.4,Management,"<p>A denial of service vulnerability exists when Microsoft SQL Server Management Studio (SSMS) improperly handles files. An attacker could exploit the vulnerability to trigger a denial of service.</p><p>To exploit the vulnerability, an attacker would first require execution on the victim system.</p><p>The security update addresses the vulnerability by ensuring Microsoft SQL Server Management Studio properly handles files.</p>",2024-01-04T02:15:10.823,https://cve.circl.lu/cve/CVE-2020-1455
CVE-2020-1475,5.9,Management,"<p>An elevation of privilege vulnerability exists in the way that the srmsvc.dll handles objects in memory. An attacker who successfully exploited the vulnerability could execute code with elevated permissions.</p><p>To exploit the vulnerability, a locally authenticated attacker could run a specially crafted application.</p><p>The security update addresses the vulnerability by ensuring the srmsvc.dll properly handles objects in memory.</p>",2024-01-04T02:15:12.683,https://cve.circl.lu/cve/CVE-2020-1475
CVE-2020-1517,5.9,Management,"<p>An elevation of privilege vulnerability exists when the Windows File Server Resource Management Service improperly handles memory.</p><p>To exploit this vulnerability, an attacker would first have to gain execution on the victim system. An attacker could then run a specially crafted application to elevate privileges.</p><p>The security update addresses the vulnerability by correcting how the Windows File Server Resource Management Service handles memory.</p>",2024-01-04T02:15:17.827,https://cve.circl.lu/cve/CVE-2020-1517
CVE-2020-1518,5.9,Management,"<p>An elevation of privilege vulnerability exists when the Windows File Server Resource Management Service improperly handles memory.</p><p>To exploit this vulnerability, an attacker would first have to gain execution on the victim system. An attacker could then run a specially crafted application to elevate privileges.</p><p>The security update addresses the vulnerability by correcting how the Windows File Server Resource Management Service handles memory.</p>",2024-01-04T02:15:18.037,https://cve.circl.lu/cve/CVE-2020-1518
CVE-2020-1483,3.6,Microsoft,"<p>A remote code execution vulnerability exists in Microsoft Outlook when the software fails to properly handle objects in memory. An attacker who successfully exploited the vulnerability could run arbitrary code in the context of the current user. If the current user is logged on with administrative user rights, an attacker could take control of the affected system. An attacker could then install programs; view, change, or delete data; or create new accounts with full user rights. Users whose accounts are configured to have fewer user rights on the system could be less impacted than users who operate with administrative user rights.</p><p>Exploitation of the vulnerability requires that a user open a specially crafted file with an affected version of Microsoft Outlook software. In an email attack scenario, an attacker could exploit the vulnerability by sending the specially crafted file to the user and convincing the user to open the file. In a web-based attack scenario, an attacker could host a website (or leverage a compromised website that accepts or hosts user-provided content) that contains a specially crafted file designed to exploit the vulnerability. An attacker would have no way to force users to visit the website. Instead, an attacker would have to convince users to click a link, typically by way of an enticement in an email or instant message, and then convince them to open the specially crafted file.</p><p>Note that where severity is indicated as Critical in the Affected Products table, the Preview Pane is an attack vector.</p><p>The security update addresses the vulnerability by correcting how Outlook handles objects in memory.</p>",2024-01-04T02:15:13.657,https://cve.circl.lu/cve/CVE-2020-1483
CVE-2021-26700,5.9,NPM,Visual Studio Code npm-script Extension Remote Code Execution Vulnerability,2023-12-29T17:16:00.217,https://cve.circl.lu/cve/CVE-2021-26700
CVE-2018-6197,3.6,NULL Pointer,w3m through 0.5.3 is prone to a NULL pointer dereference flaw in formUpdateBuffer in form.c.,2023-12-29T18:38:04.570,https://cve.circl.lu/cve/CVE-2018-6197
CVE-2023-46728,3.6,NULL Pointer,"Squid is a caching proxy for the Web supporting HTTP, HTTPS, FTP, and more. Due to a NULL pointer dereference bug Squid is vulnerable to a Denial of Service attack against Squid's Gopher gateway. The gopher protocol is always available and enabled in Squid prior to Squid 6.0.1. Responses triggering this bug are possible to be received from any gopher server, even those without malicious intent. Gopher support has been removed in Squid version 6.0.1. Users are advised to upgrade. Users unable to upgrade should reject all gopher URL requests.",2023-12-29T03:15:10.917,https://cve.circl.lu/cve/CVE-2023-46728
CVE-2023-49936,3.6,NULL Pointer,"An issue was discovered in SchedMD Slurm 22.05.x, 23.02.x, and 23.11.x. A NULL pointer dereference leads to denial of service. The fixed versions are 22.05.11, 23.02.7, and 23.11.1.",2024-01-03T03:15:09.927,https://cve.circl.lu/cve/CVE-2023-49936
CVE-2020-1493,3.6,Outlook,"<p>An information disclosure vulnerability exists when attaching files to Outlook messages. This vulnerability could potentially allow users to share attached files such that they are accessible by anonymous users where they should be restricted to specific users.</p><p>To exploit this vulnerability, an attacker would have to attach a file as a link to an email. The email could then be shared with individuals that should not have access to the files, ignoring the default organizational setting.</p><p>The security update addresses the vulnerability by correcting how Outlook handles file attachment links.</p>",2024-01-04T02:15:15.050,https://cve.circl.lu/cve/CVE-2020-1493
CVE-2020-16947,5.9,Outlook,"<p>A remote code execution vulnerability exists in Microsoft Outlook software when the software fails to properly handle objects in memory. An attacker who successfully exploited the vulnerability could run arbitrary code in the context of the targeted user. If the targeted user is logged on with administrative user rights, an attacker could take control of the affected system. An attacker could then install programs; view, change, or delete data; or create new accounts with full user rights. Users whose accounts are configured to have fewer user rights on the system could be less impacted than users who operate with administrative user rights.</p><p>Exploitation of the vulnerability requires that a user open a specially crafted file with an affected version of Microsoft Outlook software. In an email attack scenario, an attacker could exploit the vulnerability by sending the specially crafted file to the user and convincing the user to open the file. In a web-based attack scenario, an attacker could host a website (or leverage a compromised website that accepts or hosts user-provided content) that contains a specially crafted file designed to exploit the vulnerability. An attacker would have no way to force users to visit the website. Instead, an attacker would have to convince users to click a link, typically by way of an enticement in an email or instant message, and then convince them to open the specially crafted file.</p><p>Note that where severity is indicated as Critical in the Affected Products table, the Preview Pane is an attack vector.</p><p>The security update addresses the vulnerability by correcting how Outlook handles objects in memory.</p>",2023-12-31T20:15:56.870,https://cve.circl.lu/cve/CVE-2020-16947
CVE-2020-16949,3.6,Outlook,<p>A denial of service vulnerability exists in Microsoft Outlook software when the software fails to properly handle objects in memory. An attacker who successfully exploited the vulnerability could cause a remote denial of service against a system.</p><p>Exploitation of the vulnerability requires that a specially crafted email be sent to a vulnerable Outlook server.</p><p>The security update addresses the vulnerability by correcting how Microsoft Outlook handles objects in memory.</p>,2023-12-31T20:15:57.330,https://cve.circl.lu/cve/CVE-2020-16949
CVE-2020-17119,3.6,Outlook,Microsoft Outlook Information Disclosure Vulnerability,2023-12-30T00:15:14.580,https://cve.circl.lu/cve/CVE-2020-17119
CVE-2020-1563,5.9,Office,"<p>A remote code execution vulnerability exists in Microsoft Office software when the software fails to properly handle objects in memory. An attacker who successfully exploited the vulnerability could run arbitrary code in the context of the current user. If the current user is logged on with administrative user rights, an attacker could take control of the affected system. An attacker could then install programs; view, change, or delete data; or create new accounts with full user rights. Users whose accounts are configured to have fewer user rights on the system could be less impacted than users who operate with administrative user rights.</p><p>Exploitation of the vulnerability requires that a user open a specially crafted file with an affected version of Microsoft Office. In an email attack scenario, an attacker could exploit the vulnerability by sending the specially crafted file to the user and convincing the user to open the file.</p><p>The security update addresses the vulnerability by correcting how Microsoft Office handles objects in memory.</p>",2024-01-04T02:15:25.687,https://cve.circl.lu/cve/CVE-2020-1563
