CVE,"Impact Score (1-10, 10 being the worst)",Keyword,Description,Last Modified,Link
CVE-2020-1046,5.9,.NET Framework,"<p>A remote code execution vulnerability exists when Microsoft .NET Framework processes input. An attacker who successfully exploited this vulnerability could take control of an affected system.</p><p>To exploit the vulnerability, an attacker would need to be able to upload a specially crafted file to a web application.</p><p>The security update addresses the vulnerability by correcting how .NET Framework processes input.</p>",2024-01-04T02:15:08.990,https://cve.circl.lu/cve/CVE-2020-1046
CVE-2020-16937,3.6,.NET Framework,"<p>An information disclosure vulnerability exists when the .NET Framework improperly handles objects in memory. An attacker who successfully exploited the vulnerability could disclose contents of an affected system's memory.</p><p>To exploit the vulnerability, an authenticated attacker would need to run a specially crafted application.</p><p>The update addresses the vulnerability by correcting how the .NET Framework handles objects in memory.</p>",2023-12-31T20:15:54.980,https://cve.circl.lu/cve/CVE-2020-16937
CVE-2021-24111,3.6,.NET Framework,.NET Framework Denial of Service Vulnerability,2023-12-29T17:15:58.967,https://cve.circl.lu/cve/CVE-2021-24111
CVE-2018-1311,5.9,Apache,"The Apache Xerces-C 3.0.0 to 3.2.3 XML parser contains a use-after-free error triggered during the scanning of external DTDs. This flaw has not been addressed in the maintained version of the library and has no current mitigation other than to disable DTD processing. This can be accomplished via the DOM using a standard parser feature, or via SAX using the XERCES_DISABLE_DTD environment variable.",2023-12-31T14:15:41.450,https://cve.circl.lu/cve/CVE-2018-1311
CVE-2023-25690,5.9,Apache,"Some mod_proxy configurations on Apache HTTP Server versions 2.4.0 through 2.4.55 allow a HTTP Request Smuggling attack.Configurations are affected when mod_proxy is enabled along with some form of RewriteRule or ProxyPassMatch in which a non-specific pattern matches some portion of the user-supplied request-target (URL) data and is then re-inserted into the proxied request-target using variable substitution. For example, something like:RewriteEngine onRewriteRule ""^/here/(.*)"" ""http://example.com:8080/elsewhere?$1""; [P]ProxyPassReverse /here/ http://example.com:8080/Request splitting/smuggling could result in bypass of access controls in the proxy server, proxying unintended URLs to existing origin servers, and cache poisoning. Users are recommended to update to at least version 2.4.56 of Apache HTTP Server.",2024-01-02T16:15:11.563,https://cve.circl.lu/cve/CVE-2023-25690
CVE-2022-47502,5.9,Apache,"Apache OpenOffice documents can contain links that call internal macros with arbitrary arguments. Several URI Schemes are defined for this purpose.Links can be activated by clicks, or by automatic document events.The execution of such links must be subject to user approval.In the affected versions of OpenOffice, approval for certain links is not   requested; when activated, such links could therefore result in arbitrary script execution.",2024-01-03T12:15:23.040,https://cve.circl.lu/cve/CVE-2022-47502
CVE-2023-49070,5.9,Apache,Pre-auth RCE in Apache Ofbiz 18.12.09.It's due to XML-RPC no longer maintained still present.This issue affects Apache OFBiz: before 18.12.10. Users are recommended to upgrade to version 18.12.10,2023-12-29T18:15:39.103,https://cve.circl.lu/cve/CVE-2023-49070
CVE-2020-16904,1.4,Azure,<p>An elevation of privilege vulnerability exists in the way Azure Functions validate access keys.</p><p>An unauthenticated attacker who successfully exploited this vulnerability could invoke an HTTP Function without proper authorization.</p><p>This security update addresses the vulnerability by correctly validating access keys used to access HTTP Functions.</p>,2023-12-31T20:15:49.857,https://cve.circl.lu/cve/CVE-2020-16904
CVE-2020-16970,6.0,Azure,Azure Sphere Unsigned Code Execution Vulnerability,2023-12-31T19:15:10.623,https://cve.circl.lu/cve/CVE-2020-16970
CVE-2020-16981,5.9,Azure,Azure Sphere Elevation of Privilege Vulnerability,2023-12-31T19:15:11.027,https://cve.circl.lu/cve/CVE-2020-16981
CVE-2020-16982,5.9,Azure,Azure Sphere Unsigned Code Execution Vulnerability,2023-12-31T19:15:11.310,https://cve.circl.lu/cve/CVE-2020-16982
CVE-2020-16983,5.5,Azure,Azure Sphere Tampering Vulnerability,2023-12-31T19:15:11.507,https://cve.circl.lu/cve/CVE-2020-16983
CVE-2020-1476,3.6,ASP.NET,"<p>An elevation of privilege vulnerability exists when ASP.NET or .NET web applications running on IIS improperly allow access to cached files. An attacker who successfully exploited this vulnerability could gain access to restricted files.</p><p>To exploit this vulnerability, an attacker would need to send a specially crafted request to an affected server.</p><p>The update addresses the vulnerability by changing how ASP.NET and .NET handle requests.</p>",2024-01-04T02:15:12.890,https://cve.circl.lu/cve/CVE-2020-1476
CVE-2020-1597,3.6,ASP.NET,"<p>A denial of service vulnerability exists when ASP.NET Core improperly handles web requests. An attacker who successfully exploited this vulnerability could cause a denial of service against an ASP.NET Core web application. The vulnerability can be exploited remotely, without authentication.</p><p>A remote unauthenticated attacker could exploit this vulnerability by issuing specially crafted requests to the ASP.NET Core application.</p><p>The update addresses the vulnerability by correcting how the ASP.NET Core web application handles web requests.</p>",2024-01-04T02:15:28.820,https://cve.circl.lu/cve/CVE-2020-1597
CVE-2020-1045,3.6,ASP.NET,<p>A security feature bypass vulnerability exists in the way Microsoft ASP.NET Core parses encoded cookie names.</p><p>The ASP.NET Core cookie parser decodes entire cookie strings which could allow a malicious attacker to set a second cookie with the name being percent encoded.</p><p>The security update addresses the vulnerability by fixing the way the ASP.NET Core cookie parser handles encoded names.</p>,2023-12-31T22:15:55.070,https://cve.circl.lu/cve/CVE-2020-1045
CVE-2020-1460,4.7,ASP.NET,"<p>A remote code execution vulnerability exists in Microsoft SharePoint Server when it fails to properly identify and filter unsafe ASP.Net web controls. An authenticated attacker who successfully exploited the vulnerability could use a specially crafted page to perform actions in the security context of the SharePoint application pool process.</p><p>To exploit the vulnerability, an authenticated user must create and invoke a specially crafted page on an affected version of Microsoft SharePoint Server.</p><p>The security update addresses the vulnerability by correcting how Microsoft SharePoint Server handles processing of created content.</p>",2023-12-31T22:16:03.760,https://cve.circl.lu/cve/CVE-2020-1460
CVE-2021-1723,3.6,ASP.NET,ASP.NET Core and Visual Studio Denial of Service Vulnerability,2023-12-29T17:15:53.777,https://cve.circl.lu/cve/CVE-2021-1723
CVE-2020-0664,3.6,Active Directory,"<p>An information disclosure vulnerability exists when Active Directory integrated DNS (ADIDNS) mishandles objects in memory. An authenticated attacker who successfully exploited this vulnerability would be able to read sensitive information about the target system.</p><p>To exploit this condition, an authenticated attacker would need to send a specially crafted request to the AD|DNS service. Note that the information disclosure vulnerability by itself would not be sufficient for an attacker to compromise a system. However, an attacker could combine this vulnerability with additional vulnerabilities to further exploit the system.</p><p>The update addresses the vulnerability by correcting how Active Directory integrated DNS (ADIDNS) handles objects in memory.</p>",2023-12-31T22:15:43.880,https://cve.circl.lu/cve/CVE-2020-0664
CVE-2020-0718,5.9,Active Directory,"<p>A remote code execution vulnerability exists when Active Directory integrated DNS (ADIDNS) mishandles objects in memory. An authenticated attacker who successfully exploited the vulnerability could run arbitrary code in the context of the Local System Account</p><p>To exploit the vulnerability, an authenticated attacker could send malicious requests to an Active Directory integrated DNS (ADIDNS) server.</p><p>The update addresses the vulnerability by correcting how Active Directory integrated DNS (ADIDNS) handles objects in memory.</p>",2023-12-31T22:15:44.047,https://cve.circl.lu/cve/CVE-2020-0718
CVE-2020-0761,5.9,Active Directory,"<p>A remote code execution vulnerability exists when Active Directory integrated DNS (ADIDNS) mishandles objects in memory. An authenticated attacker who successfully exploited the vulnerability could run arbitrary code in the context of the Local System Account</p><p>To exploit the vulnerability, an authenticated attacker could send malicious requests to an Active Directory integrated DNS (ADIDNS) server.</p><p>The update addresses the vulnerability by correcting how Active Directory integrated DNS (ADIDNS) handles objects in memory.</p>",2023-12-31T22:15:44.220,https://cve.circl.lu/cve/CVE-2020-0761
CVE-2020-0837,3.4,Active Directory,"<p>An elevation of privilege vulnerability exists when Active Directory Federation Services (ADFS) improperly handles multi-factor authentication requests. An attacker who successfully exploited this vulnerability could bypass some, but not all, of the authentication factors.</p><p>To exploit this vulnerability, an attacker could send a specially crafted authentication request.</p><p>This security update corrects how ADFS handles multi-factor authentication requests.</p>",2023-12-31T22:15:45.240,https://cve.circl.lu/cve/CVE-2020-0837
CVE-2020-0856,3.6,Active Directory,"<p>An information disclosure vulnerability exists when Active Directory integrated DNS (ADIDNS) mishandles objects in memory. An authenticated attacker who successfully exploited this vulnerability would be able to read sensitive information about the target system.</p><p>To exploit this condition, an authenticated attacker would need to send a specially crafted request to the AD|DNS service. Note that the information disclosure vulnerability by itself would not be sufficient for an attacker to compromise a system. However, an attacker could combine this vulnerability with additional vulnerabilities to further exploit the system.</p><p>The update addresses the vulnerability by correcting how Active Directory integrated DNS (ADIDNS) handles objects in memory.</p>",2023-12-31T22:15:45.757,https://cve.circl.lu/cve/CVE-2020-0856
CVE-2023-4380,3.4,Ansible,"A logic flaw exists in Ansible Automation platform. Whenever a private project is created with incorrect credentials, they are logged in plaintext. This flaw allows an attacker to retrieve the credentials from the log, resulting in the loss of confidentiality, integrity, and availability.",2024-01-01T23:15:08.460,https://cve.circl.lu/cve/CVE-2023-4380
CVE-2023-5764,5.9,Ansible,A template injection flaw was found in Ansible where a user's controller internal templating operations may remove the unsafe designation from template data. This issue could allow an attacker to use a specially crafted file to introduce code injection when supplying templating data.,2024-01-01T21:15:24.487,https://cve.circl.lu/cve/CVE-2023-5764
CVE-2023-50428,1.4,Bitcoin,"In Bitcoin Core through 26.0 and Bitcoin Knots before 25.1.knots20231115, datacarrier size limits can be bypassed by obfuscating data as code (e.g., with OP_FALSE OP_IF), as exploited in the wild by Inscriptions in 2022 and 2023. NOTE: although this is a vulnerability from the perspective of the Bitcoin Knots project, some others consider it ""not a bug.""",2024-01-04T17:15:08.690,https://cve.circl.lu/cve/CVE-2023-50428
CVE-2022-2389,1.4,CSRF,"The Abandoned Cart Recovery for WooCommerce, Follow Up Emails, Newsletter Builder & Marketing Automation By Autonami WordPress plugin before 2.1.2 does not have authorisation and CSRF checks in one of its AJAX action, allowing any authenticated users, such as subscriber to create automations",2024-01-04T15:17:19.940,https://cve.circl.lu/cve/CVE-2022-2389
CVE-2020-0782,5.9,Cryptograph,"<p>An elevation of privilege vulnerability exists when the Windows Cryptographic Catalog Services improperly handle objects in memory. An attacker who successfully exploited this vulnerability could modify the cryptographic catalog.</p><p>To exploit this vulnerability, an attacker would first have to log on to the system. An attacker could then run a specially crafted application that could exploit the vulnerability and take control of an affected system.</p><p>The security update addresses the vulnerability by addressing how the Windows Cryptographic Catalog Services handle objects in memory.</p>",2023-12-31T22:15:44.553,https://cve.circl.lu/cve/CVE-2020-0782
CVE-2020-17147,5.8,CRM,Dynamics CRM Webclient Cross-site Scripting Vulnerability,2023-12-30T00:15:17.023,https://cve.circl.lu/cve/CVE-2020-17147
CVE-2020-0951,5.9,Defender,"<p>A security feature bypass vulnerability exists in Windows Defender Application Control (WDAC) which could allow an attacker to bypass WDAC enforcement. An attacker who successfully exploited this vulnerability could execute PowerShell commands that would be blocked by WDAC.</p><p>To exploit the vulnerability, an attacker need administrator access on a local machine where PowerShell is running. The attacker could then connect to a PowerShell session and send commands to execute arbitrary code.</p><p>The update addresses the vulnerability by correcting how PowerShell commands are validated when WDAC protection is enabled.</p>",2023-12-31T22:15:48.593,https://cve.circl.lu/cve/CVE-2020-0951
CVE-2020-17090,3.6,Defender,Microsoft Defender for Endpoint Security Feature Bypass Vulnerability,2023-12-31T19:15:29.437,https://cve.circl.lu/cve/CVE-2020-17090
CVE-2021-1647,5.9,Defender,Microsoft Defender Remote Code Execution Vulnerability,2023-12-29T17:15:50.933,https://cve.circl.lu/cve/CVE-2021-1647
CVE-2021-24092,5.9,Defender,Microsoft Defender Elevation of Privilege Vulnerability,2023-12-29T17:15:57.120,https://cve.circl.lu/cve/CVE-2021-24092
CVE-2021-1645,3.6,Docker,Windows Docker Information Disclosure Vulnerability,2023-12-29T23:15:11.920,https://cve.circl.lu/cve/CVE-2021-1645
CVE-2020-1182,5.2,Dynamics 365,<p>A remote code execution vulnerability exists in Microsoft Dynamics 365 for Finance and Operations (on-premises) version 10.0.11. An attacker who successfully exploited this vulnerability could gain remote code execution via server-side script execution on the victim server.</p><p>An authenticated attacker with privileges to import and export data could exploit this vulnerability by sending a specially crafted file to a vulnerable Dynamics server.</p><p>The security update addresses the vulnerability by correcting how Microsoft Dynamics 365 for Finance and Operations (on-premises) version 10.0.11 handles user input.</p>,2024-01-04T02:15:09.087,https://cve.circl.lu/cve/CVE-2020-1182
CVE-2020-1591,2.7,Dynamics 365,"<p>A cross site scripting vulnerability exists when Microsoft Dynamics 365 (on-premises) does not properly sanitize a specially crafted web request to an affected Dynamics server. An authenticated attacker could exploit the vulnerability by sending a specially crafted request to an affected Dynamics server.</p><p>The attacker who successfully exploited the vulnerability could then perform cross-site scripting attacks on affected systems and run script in the security context of the current authenticated user. These attacks could allow the attacker to read content that the attacker is not authorized to read, use the victim's identity to take actions within Dynamics Server on behalf of the user, such as change permissions and delete content, and inject malicious content in the browser of the user.</p><p>The security update addresses the vulnerability by helping to ensure that Dynamics Server properly sanitizes web requests.</p>",2024-01-04T02:15:28.740,https://cve.circl.lu/cve/CVE-2020-1591
CVE-2020-16857,4.7,Dynamics 365,<p>A remote code execution vulnerability exists in Microsoft Dynamics 365 for Finance and Operations (on-premises) version 10.0.11. An attacker who successfully exploited this vulnerability could gain remote code execution via server-side script execution on the victim server.</p><p>An authenticated attacker with privileges to import and export data could exploit this vulnerability by sending a specially crafted file to a vulnerable Dynamics server.</p><p>The security update addresses the vulnerability by correcting how Microsoft Dynamics 365 for Finance and Operations (on-premises) version 10.0.11 handles user input.</p>,2023-12-31T22:15:50.427,https://cve.circl.lu/cve/CVE-2020-16857
CVE-2020-16858,2.7,Dynamics 365,"<p>A cross site scripting vulnerability exists when Microsoft Dynamics 365 (on-premises) does not properly sanitize a specially crafted web request to an affected Dynamics server. An authenticated attacker could exploit the vulnerability by sending a specially crafted request to an affected Dynamics server.</p><p>The attacker who successfully exploited the vulnerability could then perform cross-site scripting attacks on affected systems and run script in the security context of the current authenticated user. These attacks could allow the attacker to read content that the attacker is not authorized to read, use the victim's identity to take actions within Dynamics Server on behalf of the user, such as change permissions and delete content, and inject malicious content in the browser of the user.</p><p>The security update addresses the vulnerability by helping to ensure that Dynamics Server properly sanitizes web requests.</p>",2023-12-31T22:15:50.603,https://cve.circl.lu/cve/CVE-2020-16858
CVE-2020-16859,2.7,Dynamics 365,"<p>A cross site scripting vulnerability exists when Microsoft Dynamics 365 (on-premises) does not properly sanitize a specially crafted web request to an affected Dynamics server. An authenticated attacker could exploit the vulnerability by sending a specially crafted request to an affected Dynamics server.</p><p>The attacker who successfully exploited the vulnerability could then perform cross-site scripting attacks on affected systems and run script in the security context of the current authenticated user. These attacks could allow the attacker to read content that the attacker is not authorized to read, use the victim's identity to take actions within Dynamics Server on behalf of the user, such as change permissions and delete content, and inject malicious content in the browser of the user.</p><p>The security update addresses the vulnerability by helping to ensure that Dynamics Server properly sanitizes web requests.</p>",2023-12-31T22:15:50.800,https://cve.circl.lu/cve/CVE-2020-16859
CVE-2023-31417,3.6,Elasticsearch,"Elasticsearch generally filters out sensitive information and credentials before logging to the audit log. It was found that this filtering was not applied when requests to Elasticsearch use certain deprecated URIs for APIs. The impact of this flaw is that sensitive information such as passwords and tokens might be printed in cleartext in Elasticsearch audit logs. Note that audit logging is disabled by default and needs to be explicitly enabled and even when audit logging is enabled, request bodies that could contain sensitive information are not printed to the audit log unless explicitly configured.",2024-01-03T19:02:34.430,https://cve.circl.lu/cve/CVE-2023-31417
CVE-2020-1494,5.9,Excel,"<p>A remote code execution vulnerability exists in Microsoft Excel software when the software fails to properly handle objects in memory. An attacker who successfully exploited the vulnerability could run arbitrary code in the context of the current user. If the current user is logged on with administrative user rights, an attacker could take control of the affected system. An attacker could then install programs; view, change, or delete data; or create new accounts with full user rights. Users whose accounts are configured to have fewer user rights on the system could be less impacted than users who operate with administrative user rights.</p><p>Exploitation of the vulnerability requires that a user open a specially crafted file with an affected version of Microsoft Excel. In an email attack scenario, an attacker could exploit the vulnerability by sending the specially crafted file to the user and convincing the user to open the file. In a web-based attack scenario, an attacker could host a website (or leverage a compromised website that accepts or hosts user-provided content) containing a specially crafted file designed to exploit the vulnerability. An attacker would have no way to force users to visit the website. Instead, an attacker would have to convince users to click a link, typically by way of an enticement in an email or instant message, and then convince them to open the specially crafted file.</p><p>The security update addresses the vulnerability by correcting how Microsoft Excel handles objects in memory.</p>",2024-01-04T02:15:15.137,https://cve.circl.lu/cve/CVE-2020-1494
CVE-2020-1495,5.9,Excel,"<p>A remote code execution vulnerability exists in Microsoft Excel software when the software fails to properly handle objects in memory. An attacker who successfully exploited the vulnerability could run arbitrary code in the context of the current user. If the current user is logged on with administrative user rights, an attacker could take control of the affected system. An attacker could then install programs; view, change, or delete data; or create new accounts with full user rights. Users whose accounts are configured to have fewer user rights on the system could be less impacted than users who operate with administrative user rights.</p><p>Exploitation of the vulnerability requires that a user open a specially crafted file with an affected version of Microsoft Excel. In an email attack scenario, an attacker could exploit the vulnerability by sending the specially crafted file to the user and convincing the user to open the file. In a web-based attack scenario, an attacker could host a website (or leverage a compromised website that accepts or hosts user-provided content) containing a specially crafted file designed to exploit the vulnerability. An attacker would have no way to force users to visit the website. Instead, an attacker would have to convince users to click a link, typically by way of an enticement in an email or instant message, and then convince them to open the specially crafted file.</p><p>The security update addresses the vulnerability by correcting how Microsoft Excel handles objects in memory.</p>",2024-01-04T02:15:15.213,https://cve.circl.lu/cve/CVE-2020-1495
CVE-2020-1496,5.9,Excel,"<p>A remote code execution vulnerability exists in Microsoft Excel software when the software fails to properly handle objects in memory. An attacker who successfully exploited the vulnerability could run arbitrary code in the context of the current user. If the current user is logged on with administrative user rights, an attacker could take control of the affected system. An attacker could then install programs; view, change, or delete data; or create new accounts with full user rights. Users whose accounts are configured to have fewer user rights on the system could be less impacted than users who operate with administrative user rights.</p><p>Exploitation of the vulnerability requires that a user open a specially crafted file with an affected version of Microsoft Excel. In an email attack scenario, an attacker could exploit the vulnerability by sending the specially crafted file to the user and convincing the user to open the file. In a web-based attack scenario, an attacker could host a website (or leverage a compromised website that accepts or hosts user-provided content) containing a specially crafted file designed to exploit the vulnerability. An attacker would have no way to force users to visit the website. Instead, an attacker would have to convince users to click a link, typically by way of an enticement in an email or instant message, and then convince them to open the specially crafted file.</p><p>The security update addresses the vulnerability by correcting how Microsoft Excel handles objects in memory.</p>",2024-01-04T02:15:15.290,https://cve.circl.lu/cve/CVE-2020-1496
CVE-2020-1497,3.6,Excel,"<p>An information disclosure vulnerability exists when Microsoft Excel improperly discloses the contents of its memory. An attacker who exploited the vulnerability could use the information to compromise the user’s computer or data.</p><p>To exploit the vulnerability, an attacker could craft a special document file and then convince the user to open it. An attacker must know the memory address location where the object was created.</p><p>The update addresses the vulnerability by changing the way certain Excel functions handle objects in memory.</p>",2024-01-04T02:15:15.367,https://cve.circl.lu/cve/CVE-2020-1497
