CVE,"Impact Score (1-10, 10 being the worst)",Keyword,Description,Last Modified,Link
CVE-2020-1573,3.6,Office,"<p>A cross-site-scripting (XSS) vulnerability exists when Microsoft SharePoint Server does not properly sanitize a specially crafted web request to an affected SharePoint server. An authenticated attacker could exploit the vulnerability by sending a specially crafted request to an affected SharePoint server.</p><p>The attacker who successfully exploited the vulnerability could then perform cross-site scripting attacks on affected systems and run script in the security context of the current user. The attacks could allow the attacker to read content that the attacker is not authorized to read, use the victim's identity to take actions on the SharePoint site on behalf of the user, such as change permissions and delete content, and inject malicious content in the browser of the user.</p><p>The security update addresses the vulnerability by helping to ensure that SharePoint Server properly sanitizes web requests.</p>",2024-01-04T02:15:27.123,https://cve.circl.lu/cve/CVE-2020-1573
CVE-2020-1580,2.7,Office,"<p>A cross-site-scripting (XSS) vulnerability exists when Microsoft SharePoint Server does not properly sanitize a specially crafted web request to an affected SharePoint server. An authenticated attacker could exploit the vulnerability by sending a specially crafted request to an affected SharePoint server.</p><p>The attacker who successfully exploited the vulnerability could then perform cross-site scripting attacks on affected systems and run script in the security context of the current user. The attacks could allow the attacker to read content that the attacker is not authorized to read, use the victim's identity to take actions on the SharePoint site on behalf of the user, such as change permissions and delete content, and inject malicious content in the browser of the user.</p><p>The security update addresses the vulnerability by helping to ensure that SharePoint Server properly sanitizes web requests.</p>",2024-01-04T02:15:27.827,https://cve.circl.lu/cve/CVE-2020-1580
CVE-2020-1581,5.9,Office,<p>An elevation of privilege vulnerability exists in the way that Microsoft Office Click-to-Run (C2R) components handle objects in memory. An attacker who successfully exploited the vulnerability could elevate privileges. The attacker would need to already have the ability to execute code on the system.</p><p>An attacker could exploit this vulnerability by running a specially crafted application on the victim system.</p><p>The security update addresses the vulnerability by correcting how Microsoft Office Click-to-Run (C2R) components handle objects in memory.</p>,2024-01-04T02:15:27.913,https://cve.circl.lu/cve/CVE-2020-1581
CVE-2020-16855,3.6,Office,"<p>An information disclosure vulnerability exists when Microsoft Office software reads out of bound memory due to an uninitialized variable, which could disclose the contents of memory. An attacker who successfully exploited the vulnerability could view out of bound memory.</p><p>Exploitation of the vulnerability requires that a user open a specially crafted file with an affected version of Microsoft Office software.</p><p>The security update addresses the vulnerability by properly initializing the affected variable.</p>",2023-12-31T22:15:50.080,https://cve.circl.lu/cve/CVE-2020-16855
CVE-2020-16851,5.2,OneDrive,"<p>An elevation of privilege vulnerability exists when the OneDrive for Windows Desktop application improperly handles symbolic links. An attacker who successfully exploited this vulnerability could overwrite a targeted file with an elevated status.</p><p>To exploit this vulnerability, an attacker would first have to log on to the system. An attacker could then run a specially crafted application that could exploit the vulnerability and delete a targeted file with an elevated status.</p><p>The update addresses this vulnerability by correcting where the OneDrive updater performs file writes while running with elevation.</p>",2023-12-31T22:15:49.367,https://cve.circl.lu/cve/CVE-2020-16851
CVE-2020-16852,5.2,OneDrive,"<p>An elevation of privilege vulnerability exists when the OneDrive for Windows Desktop application improperly handles symbolic links. An attacker who successfully exploited this vulnerability could overwrite a targeted file with an elevated status.</p><p>To exploit this vulnerability, an attacker would first have to log on to the system. An attacker could then run a specially crafted application that could exploit the vulnerability and delete a targeted file with an elevated status.</p><p>The update addresses this vulnerability by correcting where the OneDrive updater performs file writes while running with elevation.</p>",2023-12-31T22:15:49.553,https://cve.circl.lu/cve/CVE-2020-16852
CVE-2020-16853,5.2,OneDrive,"<p>An elevation of privilege vulnerability exists when the OneDrive for Windows Desktop application improperly handles symbolic links. An attacker who successfully exploited this vulnerability could overwrite a targeted file with an elevated status.</p><p>To exploit this vulnerability, an attacker would first have to log on to the system. An attacker could then run a specially crafted application that could exploit the vulnerability and delete a targeted file with an elevated status.</p><p>The update addresses this vulnerability by correcting where the OneDrive updater performs file writes while running with elevation.</p>",2023-12-31T22:15:49.723,https://cve.circl.lu/cve/CVE-2020-16853
CVE-2020-17073,5.9,Orchestrator,Windows Update Orchestrator Service Elevation of Privilege Vulnerability,2023-12-31T19:15:26.583,https://cve.circl.lu/cve/CVE-2020-17073
CVE-2020-17074,5.9,Orchestrator,Windows Update Orchestrator Service Elevation of Privilege Vulnerability,2023-12-31T19:15:26.790,https://cve.circl.lu/cve/CVE-2020-17074
CVE-2020-17076,5.9,Orchestrator,Windows Update Orchestrator Service Elevation of Privilege Vulnerability,2023-12-31T19:15:27.170,https://cve.circl.lu/cve/CVE-2020-17076
CVE-2023-29197,3.6,PHP,"guzzlehttp/psr7 is a PSR-7 HTTP message library implementation in PHP. Affected versions are subject to improper header parsing. An attacker could sneak in a newline (\n) into both the header names and values. While the specification states that \r\n\r\n is used to terminate the header list, many servers in the wild will also accept \n\n. This is a follow-up to CVE-2022-24775 where the fix was incomplete. The issue has been patched in versions 1.9.1 and 2.4.5. There are no known workarounds for this vulnerability. Users are advised to upgrade.",2024-01-01T01:15:20.317,https://cve.circl.lu/cve/CVE-2023-29197
CVE-2020-17124,5.9,Powerpoint,Microsoft PowerPoint Remote Code Execution Vulnerability,2023-12-31T18:15:48.470,https://cve.circl.lu/cve/CVE-2020-17124
CVE-2021-27056,5.9,Powerpoint,Microsoft PowerPoint Remote Code Execution Vulnerability,2023-12-29T17:16:03.677,https://cve.circl.lu/cve/CVE-2021-27056
CVE-2020-16977,5.9,Python,"<p>A remote code execution vulnerability exists in Visual Studio Code when the Python extension loads a Jupyter notebook file. An attacker who successfully exploited the vulnerability could run arbitrary code in the context of the current user. If the current user is logged on with administrative user rights, an attacker could take control of the affected system. An attacker could then install programs; view, change, or delete data; or create new accounts with full user rights.</p><p>To exploit this vulnerability, an attacker would need to convince a target to open a specially crafted file in Visual Studio Code with the Python extension installed.</p><p>The update addresses the vulnerability by modifying the way Visual Studio Code Python extension renders notebook content.</p>",2023-12-31T20:16:00.517,https://cve.circl.lu/cve/CVE-2020-16977
CVE-2023-27043,1.4,Python,"The email module of Python through 3.11.3 incorrectly parses e-mail addresses that contain a special character. The wrong portion of an RFC2822 header is identified as the value of the addr-spec. In some applications, an attacker can bypass a protection mechanism in which application access is granted only after verifying receipt of e-mail to a specific domain (e.g., only @company.example.com addresses may be used for signup). This occurs in email/_parseaddr.py in recent versions of Python.",2024-01-04T03:15:09.500,https://cve.circl.lu/cve/CVE-2023-27043
CVE-2021-27082,5.9,Quantum,Quantum Development Kit for Visual Studio Code Remote Code Execution Vulnerability,2023-12-29T17:16:06.610,https://cve.circl.lu/cve/CVE-2021-27082
CVE-2020-1466,5.9,RDP,"<p>A denial of service vulnerability exists in Windows Remote Desktop Gateway (RD Gateway) when an attacker connects to the target system using RDP and sends specially crafted requests. An attacker who successfully exploited this vulnerability could cause the RD Gateway service on the target system to stop responding.</p><p>To exploit this vulnerability, an attacker would need to run a specially crafted application against a server which provides RD Gateway services.</p><p>The update addresses the vulnerability by correcting how RD Gateway handles connection requests.</p>",2024-01-04T02:15:11.393,https://cve.circl.lu/cve/CVE-2020-1466
CVE-2020-16863,3.6,RDP,"<p>A denial of service vulnerability exists in Windows Remote Desktop Service when an attacker connects to the target system using RDP and sends specially crafted requests. An attacker who successfully exploited this vulnerability could cause the Remote Desktop Service on the target system to stop responding.</p><p>To exploit this vulnerability, an attacker would need to run a specially crafted application against a server which provides Remote Desktop Service.</p><p>The update addresses the vulnerability by correcting how Remote Desktop Service handles connection requests.</p>",2023-12-31T20:15:46.297,https://cve.circl.lu/cve/CVE-2020-16863
CVE-2020-16896,3.6,RDP,"<p>An information disclosure vulnerability exists in Remote Desktop Protocol (RDP) when an attacker connects to the target system using RDP and sends specially crafted requests. An attacker who successfully exploited this vulnerability could obtain information to further compromise the user’s system.</p><p>To exploit this vulnerability, an attacker would need to run a specially crafted application against a server which provides Remote Desktop Protocol (RDP) services.</p><p>The update addresses the vulnerability by correcting how RDP handles connection requests.</p>",2023-12-31T20:15:48.590,https://cve.circl.lu/cve/CVE-2020-16896
CVE-2020-16927,3.6,RDP,"<p>A denial of service vulnerability exists in Remote Desktop Protocol (RDP) when an attacker connects to the target system using RDP and sends specially crafted requests. An attacker who successfully exploited this vulnerability could cause the RDP service on the target system to stop responding.</p><p>To exploit this vulnerability, an attacker would need to run a specially crafted application against a server which provides Remote Desktop Protocol (RDP) services.</p><p>The update addresses the vulnerability by correcting how RDP handles connection requests.</p>",2023-12-31T20:15:53.157,https://cve.circl.lu/cve/CVE-2020-16927
CVE-2020-14297,3.6,Red Hat,"A flaw was discovered in Wildfly's EJB Client as shipped with Red Hat JBoss EAP 7, where some specific EJB transaction objects may get accumulated over the time and can cause services to slow down and eventaully unavailable. An attacker can take advantage and cause denial of service attack and make services unavailable.",2023-12-29T17:55:26.820,https://cve.circl.lu/cve/CVE-2020-14297
CVE-2020-16997,4.0,Remote Desktop,Remote Desktop Protocol Server Information Disclosure Vulnerability,2023-12-31T19:15:13.837,https://cve.circl.lu/cve/CVE-2020-16997
CVE-2020-1512,5.9,Repository,<p>An information disclosure vulnerability exists when the Windows State Repository Service improperly handles objects in memory. An attacker who successfully exploited this vulnerability could obtain information to further compromise the user’s system.</p><p>An attacker could exploit this vulnerability by running a specially crafted application on the victim system.</p><p>The update addresses the vulnerability by correcting the way the Windows State Repository Service handles objects in memory.</p>,2024-01-04T02:15:16.940,https://cve.circl.lu/cve/CVE-2020-1512
CVE-2020-0914,3.6,Repository,<p>An information disclosure vulnerability exists when the Windows State Repository Service improperly handles objects in memory. An attacker who successfully exploited this vulnerability could obtain information to further compromise the user’s system.</p><p>An attacker could exploit this vulnerability by running a specially crafted application on the victim system.</p><p>The update addresses the vulnerability by correcting the way the Windows State Repository Service handles objects in memory.</p>,2023-12-31T22:15:47.610,https://cve.circl.lu/cve/CVE-2020-0914
CVE-2020-1044,1.4,Repo,"<p>A security feature bypass vulnerability exists in SQL Server Reporting Services (SSRS) when the server improperly validates attachments uploaded to reports. An attacker who successfully exploited this vulnerability could upload file types that were disallowed by an administrator.</p><p>To exploit the vulnerability, an authenticated attacker would need to send a specially crafted request to an affected SSRS server.</p><p>The update addresses the vulnerability by modifying how SSRS validates attachment uploads.</p>",2023-12-31T22:15:54.873,https://cve.circl.lu/cve/CVE-2020-1044
CVE-2021-1636,5.9,SQL,Microsoft SQL Elevation of Privilege Vulnerability,2023-12-29T17:15:49.923,https://cve.circl.lu/cve/CVE-2021-1636
CVE-2022-29822,5.9,SQL,"Due to improper parameter filtering in the Feathers js library, which may ultimately lead to SQL injection",2024-01-02T19:15:09.407,https://cve.circl.lu/cve/CVE-2022-29822
CVE-2022-2422,5.9,SQL,"Due to improper input validation in the Feathers js library, it is possible to perform a SQL injection attack on the back-end database, in case the feathers-sequelize package is used.",2024-01-02T19:15:09.690,https://cve.circl.lu/cve/CVE-2022-2422
CVE-2023-46724,3.6,SSL," Squid is a caching proxy for the Web. Due to an Improper Validation of Specified Index bug, Squid versions 3.3.0.1 through 5.9 and 6.0 prior to 6.4 compiled using `--with-openssl` are vulnerable to a Denial of Service attack against SSL Certificate validation. This problem allows a remote server to perform Denial of Service against Squid Proxy by initiating a TLS Handshake with a specially crafted SSL Certificate in a server certificate chain. This attack is limited to HTTPS and SSL-Bump. This bug is fixed in Squid version 6.4. In addition, patches addressing this problem for the stable releases can be found in Squid's patch archives. Those who you use a prepackaged version of Squid should refer to the package vendor for availability information on updated packages.",2023-12-29T03:15:10.793,https://cve.circl.lu/cve/CVE-2023-46724
CVE-2020-1499,2.5,SharePoint,"<p>A spoofing vulnerability exists when Microsoft SharePoint Server does not properly sanitize a specially crafted web request to an affected SharePoint server. An authenticated attacker could exploit the vulnerability by sending a specially crafted request to an affected SharePoint server.</p><p>The attacker who successfully exploited the vulnerability could then perform cross-site scripting attacks on affected systems and run script in the security context of the current user. These attacks could allow the attacker to read content that the attacker is not authorized to read, use the victim's identity to take actions on the SharePoint site on behalf of the user, such as change permissions and delete content, and inject malicious content in the browser of the user.</p><p>The security update addresses the vulnerability by helping to ensure that SharePoint Server properly sanitizes web requests.</p>",2024-01-04T02:15:15.577,https://cve.circl.lu/cve/CVE-2020-1499
CVE-2020-1500,2.5,SharePoint,"<p>A spoofing vulnerability exists when Microsoft SharePoint Server does not properly sanitize a specially crafted web request to an affected SharePoint server. An authenticated attacker could exploit the vulnerability by sending a specially crafted request to an affected SharePoint server.</p><p>The attacker who successfully exploited the vulnerability could then perform cross-site scripting attacks on affected systems and run script in the security context of the current user. These attacks could allow the attacker to read content that the attacker is not authorized to read, use the victim's identity to take actions on the SharePoint site on behalf of the user, such as change permissions and delete content, and inject malicious content in the browser of the user.</p><p>The security update addresses the vulnerability by helping to ensure that SharePoint Server properly sanitizes web requests.</p>",2024-01-04T02:15:15.660,https://cve.circl.lu/cve/CVE-2020-1500
CVE-2020-1501,2.5,SharePoint,"<p>A spoofing vulnerability exists when Microsoft SharePoint Server does not properly sanitize a specially crafted web request to an affected SharePoint server. An authenticated attacker could exploit the vulnerability by sending a specially crafted request to an affected SharePoint server.</p><p>The attacker who successfully exploited the vulnerability could then perform cross-site scripting attacks on affected systems and run script in the security context of the current user. These attacks could allow the attacker to read content that the attacker is not authorized to read, use the victim's identity to take actions on the SharePoint site on behalf of the user, such as change permissions and delete content, and inject malicious content in the browser of the user.</p><p>The security update addresses the vulnerability by helping to ensure that SharePoint Server properly sanitizes web requests.</p>",2024-01-04T02:15:15.727,https://cve.circl.lu/cve/CVE-2020-1501
CVE-2020-1505,3.6,SharePoint,"<p>An information disclosure vulnerability exists when Microsoft SharePoint Server fails to properly handle objects in memory. An attacker who successfully exploited this vulnerability could obtain information to further compromise the user’s system.</p><p>To exploit the vulnerability, an attacker would have to log on to an affected system and run a specially crafted application.</p><p>The security update addresses the vulnerability by correcting how Microsoft SharePoint Server handles objects in memory.</p>",2024-01-04T02:15:16.163,https://cve.circl.lu/cve/CVE-2020-1505
CVE-2023-3961,5.9,Samba,"A path traversal vulnerability was identified in Samba when processing client pipe names connecting to Unix domain sockets within a private directory. Samba typically uses this mechanism to connect SMB clients to remote procedure call (RPC) services like SAMR LSA or SPOOLSS, which Samba initiates on demand. However, due to inadequate sanitization of incoming client pipe names, allowing a client to send a pipe name containing Unix directory traversal characters (../). This could result in SMB clients connecting as root to Unix domain sockets outside the private directory. If an attacker or client managed to send a pipe name resolving to an external service using an existing Unix domain socket, it could potentially lead to unauthorized access to the service and consequential adverse events, including compromise or service crashes.",2024-01-02T21:15:08.913,https://cve.circl.lu/cve/CVE-2023-3961
CVE-2023-4154,3.6,Samba,"A design flaw was found in Samba's DirSync control implementation, which exposes passwords and secrets in Active Directory to privileged users and Read-Only Domain Controllers (RODCs). This flaw allows RODCs and users possessing the GET_CHANGES right to access all attributes, including sensitive secrets and passwords. Even in a default setup, RODC DC accounts, which should only replicate some passwords, can gain access to all domain secrets, including the vital krbtgt, effectively eliminating the RODC / DC distinction. Furthermore, the vulnerability fails to account for error conditions (fail open), like out-of-memory situations, potentially granting access to secret attributes, even under low-privileged attacker influence.",2023-12-29T05:15:08.850,https://cve.circl.lu/cve/CVE-2023-4154
CVE-2020-1596,4.2,TLS,"<p>A information disclosure vulnerability exists when TLS components use weak hash algorithms. An attacker who successfully exploited this vulnerability could obtain information to further compromise a users's encrypted transmission channel.</p><p>To exploit the vulnerability, an attacker would have to conduct a man-in-the-middle attack.</p><p>The update addresses the vulnerability by correcting how TLS components use hash algorithms.</p>",2023-12-31T22:16:07.280,https://cve.circl.lu/cve/CVE-2020-1596
CVE-2023-27990,2.7,VPN,"The cross-site scripting (XSS) vulnerability in Zyxel ATP series firmware versions 4.32 through 5.35, USG FLEX series firmware versions 4.50 through 5.35, USG FLEX 50(W) firmware versions 4.16 through 5.35, USG20(W)-VPN firmware versions 4.16 through 5.35, and VPN series firmware versions 4.30 through 5.35, which could allow an authenticated attacker with administrator privileges to store malicious scripts in a vulnerable device. A successful XSS attack could then result in the stored malicious scripts being executed when the user visits the Logs page of the GUI on the device.",2023-12-29T07:15:10.510,https://cve.circl.lu/cve/CVE-2023-27990
CVE-2020-0604,5.9,Visual Studio,"<p>A remote code execution vulnerability exists in Visual Studio Code when it process environment variables after opening a project. An attacker who successfully exploited the vulnerability could run arbitrary code in the context of the current user. If the current user is logged on with administrative user rights, an attacker could take control of the affected system. An attacker could then install programs; view, change, or delete data; or create new accounts with full user rights.</p><p>To exploit this vulnerability, an attacker would need to convince a target to clone a repository and open it in Visual Studio Code. Attacker-specified code would execute when the target opened the integrated terminal.</p><p>The update address the vulnerability by modifying the way Visual Studio Code handles environment variables.</p>",2024-01-04T02:15:08.693,https://cve.circl.lu/cve/CVE-2020-0604
CVE-2020-16856,5.9,Visual Studio,"<p>A remote code execution vulnerability exists in Visual Studio when it improperly handles objects in memory. An attacker who successfully exploited the vulnerability could run arbitrary code in the context of the current user. If the current user is logged on with administrative user rights, an attacker could take control of the affected system. An attacker could then install programs; view, change, or delete data; or create new accounts with full user rights. Users whose accounts are configured to have fewer user rights on the system could be less impacted than users who operate with administrative user rights.</p><p>To exploit the vulnerability, an attacker would have to convince a user to open a specially crafted file with an affected version of Visual Studio.</p><p>The update addresses the vulnerability by correcting how Visual Studio handles objects in memory.</p>",2023-12-31T22:15:50.253,https://cve.circl.lu/cve/CVE-2020-16856
CVE-2020-16874,5.9,Visual Studio,"<p>A remote code execution vulnerability exists in Visual Studio when it improperly handles objects in memory. An attacker who successfully exploited the vulnerability could run arbitrary code in the context of the current user. If the current user is logged on with administrative user rights, an attacker could take control of the affected system. An attacker could then install programs; view, change, or delete data; or create new accounts with full user rights. Users whose accounts are configured to have fewer user rights on the system could be less impacted than users who operate with administrative user rights.</p><p>To exploit the vulnerability, an attacker would have to convince a user to open a specially crafted file with an affected version of Visual Studio.</p><p>The update addresses the vulnerability by correcting how Visual Studio handles objects in memory.</p>",2023-12-31T22:15:52.270,https://cve.circl.lu/cve/CVE-2020-16874
CVE-2020-16881,5.9,Visual Studio,"<p>A remote code execution vulnerability exists in Visual Studio Code when a user is tricked into opening a malicious 'package.json' file. An attacker who successfully exploited the vulnerability could run arbitrary code in the context of the current user. If the current user is logged on with administrative user rights, an attacker could take control of the affected system. An attacker could then install programs; view, change, or delete data; or create new accounts with full user rights.</p><p>To exploit this vulnerability, an attacker would need to convince a target to clone a repository and open it in Visual Studio Code. Attacker-specified code would execute when the target opens the malicious 'package.json' file.</p><p>The update address the vulnerability by modifying the way Visual Studio Code handles JSON files.</p>",2023-12-31T22:15:53.010,https://cve.circl.lu/cve/CVE-2020-16881
