CVE,"Impact Score (1-10, 10 being the worst)",Keyword,Description,Last Modified,Link
CVE-2016-6786,5.9,Debian,"kernel/events/core.c in the performance subsystem in the Linux kernel before 4.0 mismanages locks during certain migrations, which allows local users to gain privileges via a crafted application, aka Android internal bug 30955111.",2023-06-07T12:46:00.657,https://cve.circl.lu/cve/CVE-2016-6786
CVE-2016-6787,5.9,Debian,"kernel/events/core.c in the performance subsystem in the Linux kernel before 4.0 mismanages locks during certain migrations, which allows local users to gain privileges via a crafted application, aka Android internal bug 31095224.",2023-06-07T12:46:14.750,https://cve.circl.lu/cve/CVE-2016-6787
CVE-2017-1000112,5.9,Debian,"Linux kernel: Exploitable memory corruption due to UFO to non-UFO path switch. When building a UFO packet with MSG_MORE __ip_append_data() calls ip_ufo_append_data() to append. However in between two send() calls, the append path can be switched from UFO to non-UFO one, which leads to a memory corruption. In case UFO packet lengths exceeds MTU, copy = maxfraglen - skb->len becomes negative on the non-UFO path and the branch to allocate new skb is taken. This triggers fragmentation and computation of fraggap = skb_prev->len - maxfraglen. Fraggap can exceed MTU, causing copy = datalen - transhdrlen - fraggap to become negative. Subsequently skb_copy_and_csum_bits() writes out-of-bounds. A similar issue is present in IPv6 code. The bug was introduced in e89e9cf539a2 (""[IPv4/IPv6]: UFO Scatter-gather approach"") on Oct 18 2005.",2023-06-07T12:46:19.047,https://cve.circl.lu/cve/CVE-2017-1000112
CVE-2023-33457,NA,EMC,"In Sogou Workflow v0.10.6, memcpy a negtive size in URIParser::parse , may cause buffer-overflow and crash.",2023-06-06T18:34:03.700,https://cve.circl.lu/cve/CVE-2023-33457
CVE-2023-1390,3.6,Exchange,"A remote denial of service vulnerability was found in the Linux kernel’s TIPC kernel module. The while loop in tipc_link_xmit() hits an unknown state while attempting to parse SKBs, which are not in the queue. Sending two small UDP packets to a system with a UDP bearer results in the CPU utilization for the system to instantly spike to 100%, causing a denial of service condition.",2023-06-07T12:46:27.957,https://cve.circl.lu/cve/CVE-2023-1390
CVE-2023-32342,3.6,Exchange,"IBM GSKit could allow a remote attacker to obtain sensitive information, caused by a timing-based side channel in the RSA Decryption implementation. By sending an overly large number of trial messages for decryption, an attacker could exploit this vulnerability to obtain sensitive information.  IBM X-Force ID:  255828.",2023-06-06T18:18:41.097,https://cve.circl.lu/cve/CVE-2023-32342
CVE-2023-26277,5.9,Exchange,IBM QRadar WinCollect Agent 10.0 though 10.1.3 could allow a local user to execute commands on the system due to execution with unnecessary privileges.  IBM X-Force ID:  248156.,2023-06-07T17:23:07.940,https://cve.circl.lu/cve/CVE-2023-26277
CVE-2023-26278,5.9,Exchange,IBM QRadar WinCollect Agent 10.0 through 10.1.3 could allow a local authenticated attacker to gain elevated privileges on the system.  IBM X-Force ID:  248158.,2023-06-07T18:12:56.727,https://cve.circl.lu/cve/CVE-2023-26278
CVE-2023-22862,3.6,Exchange,"IBM Aspera Connect 4.2.5 and IBM Aspera Cargo 4.2.5 transmits authentication credentials, but it uses an insecure method that is susceptible to unauthorized interception and/or retrieval.  IBM X-Force ID:  244107.",2023-06-05T13:03:03.327,https://cve.circl.lu/cve/CVE-2023-22862
CVE-2015-8660,5.9,Exploit,"The ovl_setattr function in fs/overlayfs/inode.c in the Linux kernel through 4.3.3 attempts to merge distinct setattr operations, which allows local users to bypass intended access restrictions and modify the attributes of arbitrary overlay files via a crafted application.",2023-06-07T12:44:34.670,https://cve.circl.lu/cve/CVE-2015-8660
CVE-2020-16009,5.9,Exploit,Inappropriate implementation in V8 in Google Chrome prior to 86.0.4240.183 allowed a remote attacker to potentially exploit heap corruption via a crafted HTML page.,2023-06-06T13:59:53.593,https://cve.circl.lu/cve/CVE-2020-16009
CVE-2021-21741,5.9,Exploit,"There is a command execution vulnerability in a ZTE conference management system. As some services are enabled by default, the attacker could exploit this vulnerability to execute arbitrary commands by sending specific serialization command.",2023-06-05T22:15:10.770,https://cve.circl.lu/cve/CVE-2021-21741
CVE-2021-32862,2.7,Exploit,"The GitHub Security Lab discovered sixteen ways to exploit a cross-site scripting vulnerability in nbconvert. When using nbconvert to generate an HTML version of a user-controllable notebook, it is possible to inject arbitrary HTML which may lead to cross-site scripting (XSS) vulnerabilities if these HTML notebooks are served by a web server (eg: nbviewer).",2023-06-03T16:15:09.107,https://cve.circl.lu/cve/CVE-2021-32862
CVE-2023-30851,3.6,Endpoint,"Cilium is a networking, observability, and security solution with an eBPF-based dataplane. This issue only impacts users who have a HTTP policy that applies to multiple `toEndpoints` AND have an allow-all rule in place that affects only one of those endpoints. In such cases, a wildcard rule will be appended to the set of HTTP rules, which could cause bypass of HTTP policies. This issue has been patched in Cilium 1.11.16, 1.12.9, and 1.13.2.",2023-06-01T20:35:42.710,https://cve.circl.lu/cve/CVE-2023-30851
CVE-2023-32681,4.0,Endpoint,"Requests is a HTTP library. Since Requests 2.3.0, Requests has been leaking Proxy-Authorization headers to destination servers when redirected to an HTTPS endpoint. This is a product of how we use `rebuild_proxies` to reattach the `Proxy-Authorization` header to requests. For HTTP connections sent through the tunnel, the proxy will identify the header in the request itself and remove it prior to forwarding to the destination server. However when sent over HTTPS, the `Proxy-Authorization` header must be sent in the CONNECT request as the proxy has no visibility into the tunneled request. This results in Requests forwarding proxy credentials to the destination server unintentionally, allowing a malicious actor to potentially exfiltrate sensitive information. This issue has been patched in version 2.31.0.",2023-06-04T03:15:09.763,https://cve.circl.lu/cve/CVE-2023-32681
CVE-2023-33247,3.6,Endpoint,Talend Data Catalog remote harvesting server before 8.0-20230413 contains a /upgrade endpoint that allows an unauthenticated WAR file to be deployed on the server. (A mitigation is that the remote harvesting server should be behind a firewall that only allows access to the Talend Data Catalog server.),2023-06-02T18:18:58.370,https://cve.circl.lu/cve/CVE-2023-33247
CVE-2023-32319,3.6,Endpoint,"Nextcloud server is an open source personal cloud implementation. Missing brute-force protection on the WebDAV endpoints via the basic auth header allowed to brute-force user credentials when the provided user name was not an email address. Users from version 24.0.0 onward are affected. This issue has been addressed in releases 24.0.11, 25.0.5 and 26.0.0. Users are advised to upgrade. There are no known workarounds for this vulnerability.",2023-06-03T02:58:54.227,https://cve.circl.lu/cve/CVE-2023-32319
CVE-2023-33291,5.2,Endpoint,"In ebankIT 6, the public endpoints /public/token/Email/generate and /public/token/SMS/generate allow generation of OTP messages to any e-mail address or phone number without validation. (It cannot be exploited with e-mail addresses or phone numbers that are registered in the application.)",2023-06-03T04:27:48.593,https://cve.circl.lu/cve/CVE-2023-33291
CVE-2023-22918,3.6,Firewall,"A post-authentication information exposure vulnerability in the CGI program of Zyxel ATP series firmware versions 4.32 through 5.35, USG FLEX series firmware versions 4.50 through 5.35, USG FLEX 50(W) firmware versions 4.16 through 5.35, USG20(W)-VPN firmware versions 4.16 through 5.35, VPN series firmware versions 4.30 through 5.35, NWA110AX firmware version 6.50(ABTG.2) and earlier versions, WAC500 firmware version 6.50(ABVS.0) and earlier versions, and WAX510D firmware version 6.50(ABTF.2) and earlier versions, which could allow a remote authenticated attacker to retrieve encrypted information of the administrator on an affected device.",2023-06-07T18:20:46.193,https://cve.circl.lu/cve/CVE-2023-22918
CVE-2023-27990,2.7,Firewall,"The XSS vulnerability in Zyxel ATP series firmware versions 4.32 through 5.35, USG FLEX series firmware versions 4.50 through 5.35, USG FLEX 50(W) firmware versions 4.16 through 5.35, USG20(W)-VPN firmware versions 4.16 through 5.35, and VPN series firmware versions 4.30 through 5.35, which could allow an authenticated attacker with administrator privileges to store malicious scripts in a vulnerable device. A successful XSS attack could then result in the stored malicious scripts being executed when the user visits the Logs page of the GUI on the device.",2023-06-07T18:20:46.193,https://cve.circl.lu/cve/CVE-2023-27990
CVE-2023-27991,5.9,Firewall,"The post-authentication command injection vulnerability in the CLI command of Zyxel ATP series firmware versions 4.32 through 5.35, USG FLEX series firmware versions 4.50 through 5.35, USG FLEX 50(W) firmware versions 4.16 through 5.35, USG20(W)-VPN firmware versions 4.16 through 5.35, and VPN series firmware versions 4.30 through 5.35, which could allow an authenticated attacker to execute some OS commands remotely.",2023-06-07T18:20:46.193,https://cve.circl.lu/cve/CVE-2023-27991
CVE-2023-28771,5.9,Firewall,"Improper error message handling in Zyxel ZyWALL/USG series firmware versions 4.60 through 4.73, VPN series firmware versions 4.60 through 5.35, USG FLEX series firmware versions 4.60 through 5.35, and ATP series firmware versions 4.60 through 5.35, which could allow an unauthenticated attacker to execute some OS commands remotely by sending crafted packets to an affected device.",2023-06-07T18:20:46.193,https://cve.circl.lu/cve/CVE-2023-28771
CVE-2023-33009,5.9,Firewall,"A buffer overflow vulnerability in the notification function in Zyxel ATP series firmware versions 4.32 through 5.36 Patch 1, USG FLEX series firmware versions 4.50 through 5.36 Patch 1, USG FLEX 50(W) firmware versions 4.25 through 5.36 Patch 1, USG20(W)-VPN firmware versions 4.25 through 5.36 Patch 1, VPN series firmware versions 4.30 through 5.36 Patch 1, ZyWALL/USG series firmware versions 4.25 through 4.73 Patch 1, could allow an unauthenticated attacker to cause denial-of-service (DoS) conditions and even a remote code execution on an affected device.",2023-06-07T18:20:46.193,https://cve.circl.lu/cve/CVE-2023-33009
CVE-2023-1872,5.9,GIS,A use-after-free vulnerability in the Linux Kernel io_uring system can be exploited to achieve local privilege escalation.The io_file_get_fixed function lacks the presence of ctx->uring_lock which can lead to a Use-After-Free vulnerability due a race condition with fixed files getting unregistered.We recommend upgrading past commit da24142b1ef9fd5d36b76e36bab328a5b27523e8.,2023-06-01T14:15:10.420,https://cve.circl.lu/cve/CVE-2023-1872
CVE-2023-26930,3.6,GIS,** DISPUTED ** Buffer Overflow vulnerability found in XPDF v.4.04 allows an attacker to cause a Denial of Service via the PDFDoc malloc in the pdftotext.cc function. NOTE: Vendor states “it's an expected abort on out-of-memory error.”,2023-06-02T14:15:09.370,https://cve.circl.lu/cve/CVE-2023-26930
CVE-2022-42225,2.7,GIS,"Jumpserver 2.10.0 <= version <= 2.26.0 contains multiple stored XSS vulnerabilities because of improper filtering of user input, which can execute any javascript under admin's permission.",2023-06-01T14:15:41.747,https://cve.circl.lu/cve/CVE-2022-42225
CVE-2021-3782,4.7,GitLab,"An internal reference count is held on the buffer pool, incremented every time a new buffer is created from the pool. The reference count is maintained as an int; on LP64 systems this can cause the reference count to overflow if the client creates a large number of wl_shm buffer objects, or if it can coerce the server to create a large number of external references to the buffer storage. With the reference count overflowing, a use-after-free can be constructed on the wl_shm_pool tracking structure, where values may be incremented or decremented; it may also be possible to construct a limited oracle to leak 4 bytes of server-side memory to the attacking client at a time.",2023-06-01T17:57:41.023,https://cve.circl.lu/cve/CVE-2021-3782
CVE-2023-28484,3.6,GitLab,"In libxml2 before 2.10.4, parsing of certain invalid XSD schemas can lead to a NULL pointer dereference and subsequently a segfault. This occurs in xmlSchemaFixupComplexType in xmlschemas.c.",2023-06-01T14:15:11.220,https://cve.circl.lu/cve/CVE-2023-28484
CVE-2023-29469,3.6,GitLab,"An issue was discovered in libxml2 before 2.10.4. When hashing empty dict strings in a crafted XML document, xmlDictComputeFastKey in dict.c can produce non-deterministic values, leading to various logic and memory errors, such as a double free. This behavior occurs because there is an attempt to use the first byte of an empty string, and any value is possible (not solely the '\0' value).",2023-06-01T14:15:11.423,https://cve.circl.lu/cve/CVE-2023-29469
CVE-2023-1204,1.4,GitLab,"An issue has been discovered in GitLab CE/EE affecting all versions starting from 10.1 before 15.10.8, all versions starting from 15.11 before 15.11.7, all versions starting from 16.0 before 16.0.2. A user could use an unverified email as a public email and commit email by sending a specifically crafted request on user update settings.",2023-06-06T20:15:09.283,https://cve.circl.lu/cve/CVE-2023-1204
CVE-2023-32700,5.9,GitLab,LuaTeX before 1.17.0 allows execution of arbitrary shell commands when compiling a TeX file obtained from an untrusted source. This occurs because luatex-core.lua lets the original io.popen be accessed. This also affects TeX Live before 2023 r66984 and MiKTeX before 23.5.,2023-06-04T03:15:09.877,https://cve.circl.lu/cve/CVE-2023-32700
CVE-2023-32691,3.6,Golang,"gost (GO Simple Tunnel) is a simple tunnel written in golang. Sensitive secrets such as passwords, token and API keys should be compared only using a constant-time comparison function. Untrusted input, sourced from a HTTP header, is compared directly with a secret. Since this comparison is not secure, an attacker can mount a side-channel timing attack to guess the password. As a workaround, this can be easily fixed using a constant time comparing function such as `crypto/subtle`'s `ConstantTimeCompare`. ",2023-06-05T17:37:04.097,https://cve.circl.lu/cve/CVE-2023-32691
CVE-2023-26131,2.7,Golang,"All versions of the package github.com/xyproto/algernon/engine; all versions of the package github.com/xyproto/algernon/themes are vulnerable to Cross-site Scripting (XSS) via the themes.NoPage(filename, theme) function due to improper user input sanitization. Exploiting this vulnerability is possible when a file/resource is not found.",2023-06-07T14:08:43.840,https://cve.circl.lu/cve/CVE-2023-26131
CVE-2020-10732,2.5,Google,A flaw was found in the Linux kernel's implementation of Userspace core dumps. This flaw allows an attacker with a local account to crash a trivial program and exfiltrate private kernel data.,2023-06-06T13:46:20.090,https://cve.circl.lu/cve/CVE-2020-10732
CVE-2021-25748,3.6,Google,"A security issue was discovered in ingress-nginx where a user that can create or update ingress objects can use a newline character to bypass the sanitization of the `spec.rules[].http.paths[].path` field of an Ingress object (in the `networking.k8s.io` or `extensions` API group) to obtain the credentials of the ingress-nginx controller. In the default configuration, that credential has access to all secrets in the cluster.",2023-06-01T20:44:14.080,https://cve.circl.lu/cve/CVE-2021-25748
CVE-2021-25749,5.9,Google,Windows workloads can run as ContainerAdministrator even when those workloads set the runAsNonRoot option to true.,2023-06-01T13:14:23.137,https://cve.circl.lu/cve/CVE-2021-25749
CVE-2023-34111,5.2,Grafana,The `Release PR Merged` workflow in the github repo taosdata/grafanaplugin is subject to a command injection vulnerability which allows for arbitrary code execution within the github action context due to the insecure usage of `${{ github.event.pull_request.title }}` in a bash command within the GitHub workflow. Attackers can inject malicious commands which will be executed by the workflow. This happens because `${{ github.event.pull_request.title }}` is directly passed to bash command on like 25 of the workflow. This may allow an attacker to gain access to secrets which the github action has access to or to otherwise make use of the compute resources.,2023-06-06T18:33:59.493,https://cve.circl.lu/cve/CVE-2023-34111
CVE-2023-2183,1.4,Grafana,"Grafana is an open-source platform for monitoring and observability. The option to send a test alert is not available from the user panel UI for users having the Viewer role. It is still possible for a user with the Viewer role to send a test alert using the API as the API does not check access to this function.This might enable malicious users to abuse the functionality by sending multiple alert messages to e-mail and Slack, spamming users, prepare Phishing attack or block SMTP server.Users may upgrade to version 9.5.3, 9.4.12, 9.3.15, 9.2.19 and 8.5.26 to receive a fix.",2023-06-07T02:45:20.120,https://cve.circl.lu/cve/CVE-2023-2183
CVE-2023-2801,3.6,Grafana,"Grafana is an open-source platform for monitoring and observability. Using public dashboards users can query multiple distinct data sources using mixed queries. However such query has a possibility of crashing a Grafana instance.The only feature that uses mixed queries at the moment is public dashboards, but it's also possible to cause this by calling the query API directly.This might enable malicious users to crash Grafana instances through that endpoint.Users may upgrade to version 9.4.12 and 9.5.3 to receive a fix.",2023-06-07T02:45:20.120,https://cve.circl.lu/cve/CVE-2023-2801
CVE-2023-33381,NA,GPT,A command injection vulnerability was found in the ping functionality of the MitraStar GPT-2741GNAC router (firmware version AR_g5.8_110WVN0b7_2). The vulnerability allows an authenticated user to execute arbitrary OS commands by sending specially crafted input to the router via the ping function.,2023-06-06T12:50:56.083,https://cve.circl.lu/cve/CVE-2023-33381
CVE-2014-2014,2.9,GitHub,"imapsync before 1.584, when running with the --tls option, attempts a cleartext login when a certificate verification failure occurs, which allows remote attackers to obtain credentials by sniffing the network.",2023-06-07T13:59:55.603,https://cve.circl.lu/cve/CVE-2014-2014
CVE-2014-0177,4.9,GitHub,The am function in lib/hub/commands.rb in hub before 1.12.1 allows local users to overwrite arbitrary files via a symlink attack on a temporary patch file.,2023-06-06T14:02:25.683,https://cve.circl.lu/cve/CVE-2014-0177
CVE-2016-4558,5.9,GitHub,"The BPF subsystem in the Linux kernel before 4.5.5 mishandles reference counts, which allows local users to cause a denial of service (use-after-free) or possibly have unspecified other impact via a crafted application on (1) a system with more than 32 Gb of memory, related to the program reference count or (2) a 1 Tb system, related to the map reference count.",2023-06-07T12:45:02.130,https://cve.circl.lu/cve/CVE-2016-4558
CVE-2023-1297,3.6,HashiCorp,"Consul and Consul Enterprise's cluster peering implementation contained a flaw whereby a peer cluster with service of the same name as a local service could corrupt Consul state, resulting in denial of service. This vulnerability was resolved in Consul 1.14.5, and 1.15.3",2023-06-05T13:03:17.903,https://cve.circl.lu/cve/CVE-2023-1297
CVE-2023-2816,5.8,HashiCorp,"Consul and Consul Enterprise allowed any user with service:write permissions to use Envoy extensions configured via service-defaults to patch remote proxy instances that target the configured service, regardless of whether the user has permission to modify the service(s) corresponding to those modified proxies.",2023-06-05T13:03:17.903,https://cve.circl.lu/cve/CVE-2023-2816
CVE-2022-35751,6.0,Hyper-V,Windows Hyper-V Elevation of Privilege Vulnerability,2023-06-07T21:08:04.577,https://cve.circl.lu/cve/CVE-2022-35751
CVE-2010-4605,9.2,IBM,"Unspecified vulnerability in the backup-archive client in IBM Tivoli Storage Manager (TSM) 5.3.x before 5.3.6.10, 5.4.x before 5.4.3.4, 5.5.x before 5.5.3, 6.1.x before 6.1.4, and 6.2.x before 6.2.2 on Unix and Linux allows local users to overwrite arbitrary files via unknown vectors.",2023-06-06T19:14:10.453,https://cve.circl.lu/cve/CVE-2010-4605
CVE-2022-28699,5.9,Intel,Improper input validation for some Intel(R) NUC BIOS firmware may allow a privileged user to potentially enable escalation of privilege via local access.,2023-06-01T17:28:51.810,https://cve.circl.lu/cve/CVE-2022-28699
CVE-2022-31477,3.6,Intel,Improper initialization for some Intel(R) NUC BIOS firmware may allow a privileged user to potentially enable information disclosure via local access.,2023-06-01T17:15:43.273,https://cve.circl.lu/cve/CVE-2022-31477
CVE-2022-32577,5.2,Intel,Improper input validation in BIOS Firmware for some Intel(R) NUC Kits before version PY0081 may allow a privileged user to potentially enable information disclosure or denial of service via local access,2023-06-01T17:20:20.193,https://cve.circl.lu/cve/CVE-2022-32577
CVE-2023-2706,5.9,Intel,"The OTP Login Woocommerce & Gravity Forms plugin for WordPress is vulnerable to authentication bypass. This is due to the fact that when generating OTP codes for users to use in order to login via phone number, the plugin returns these codes in an AJAX response. This makes it possible for unauthenticated attackers to obtain login codes for administrators. This does require an attacker have access to the phone number configured for an account, which can be obtained via social engineering or reconnaissance.",2023-06-05T22:15:12.110,https://cve.circl.lu/cve/CVE-2023-2706
CVE-2023-24817,3.6,IoT,"RIOT-OS, an operating system for Internet of Things (IoT) devices, contains a network stack with the ability to process 6LoWPAN frames. Prior to version 2023.04, an attacker can send a crafted frame to the device resulting in an integer underflow and out of bounds access in the packet buffer. Triggering the access at the right time will corrupt other packets or the allocator metadata. Corrupting a pointer will lead to denial of service. This issue is fixed in version 2023.04. As a workaround, disable SRH in the network stack.",2023-06-07T19:10:07.593,https://cve.circl.lu/cve/CVE-2023-24817
CVE-2023-24825,3.6,IoT,"RIOT-OS, an operating system for Internet of Things (IoT) devices, contains a network stack with the ability to process 6LoWPAN frames. Prior to version 2023.04, an attacker can send a crafted frame to the device to trigger a NULL pointer dereference leading to denial of service. This issue is fixed in version 2023.04. There are no known workarounds.",2023-06-07T14:53:24.207,https://cve.circl.lu/cve/CVE-2023-24825
CVE-2023-24826,3.6,IoT,"RIOT-OS, an operating system for Internet of Things (IoT) devices, contains a network stack with the ability to process 6LoWPAN frames. Prior to version 2023.04, an attacker can send crafted frames to the device to trigger the usage of an uninitialized object leading to denial of service. This issue is fixed in version 2023.04. As a workaround, disable fragment forwarding or SFR.",2023-06-06T16:15:39.177,https://cve.circl.lu/cve/CVE-2023-24826
CVE-2023-33973,3.6,IoT,"RIOT-OS, an operating system for Internet of Things (IoT) devices, contains a network stack with the ability to process 6LoWPAN frames. In versions 2023.01 and prior, an attacker can send a crafted frame which is forwarded by the device. During encoding of the packet a NULL pointer dereference occurs. This crashes the device leading to denial of service. A patch is available at pull request 19678. There are no known workarounds.",2023-06-06T16:35:11.990,https://cve.circl.lu/cve/CVE-2023-33973
CVE-2023-28344,4.2,Insight,"An issue was discovered in Faronics Insight 10.0.19045 on Windows. The Insight Teacher Console application allows unauthenticated attackers to view constantly updated screenshots of student desktops and to submit falsified screenshots on behalf of students. Attackers are able to view screenshots of student desktops without their consent. These screenshots may potentially contain sensitive/personal data. Attackers can also rapidly submit falsified images, hiding the actual contents of student desktops from the Teacher Console.",2023-06-06T18:18:18.793,https://cve.circl.lu/cve/CVE-2023-28344
CVE-2023-28345,3.6,Insight,"An issue was discovered in Faronics Insight 10.0.19045 on Windows. The Insight Teacher Console application exposes the teacher's Console password in cleartext via an API endpoint accessible from localhost. Attackers with physical access to the Teacher Console can open a web browser, navigate to the affected endpoint and obtain the teacher's password. This enables them to log into the Teacher Console and begin trivially attacking student machines.",2023-06-06T18:31:21.130,https://cve.circl.lu/cve/CVE-2023-28345
