CVE,"Impact Score (1-10, 10 being the worst)",Keyword,Description,Last Modified,Link
CVE-2023-28346,5.2,Insight,"An issue was discovered in Faronics Insight 10.0.19045 on Windows. It is possible for a remote attacker to communicate with the private API endpoints exposed at /login, /consoleSettings, /console, etc. despite Virtual Host Routing being used to block this access. Remote attackers can interact with private pages on the web server, enabling them to perform privileged actions such as logging into the console and changing console settings if they have valid credentials.",2023-06-06T18:32:37.623,https://cve.circl.lu/cve/CVE-2023-28346
CVE-2023-28347,6.0,Insight,"An issue was discovered in Faronics Insight 10.0.19045 on Windows. It is possible for an attacker to create a proof-of-concept script that functions similarly to a Student Console, providing unauthenticated attackers with the ability to exploit XSS vulnerabilities within the Teacher Console application and achieve remote code execution as NT AUTHORITY/SYSTEM on all connected Student Consoles and the Teacher Console in a Zero Click manner.",2023-06-06T18:33:13.453,https://cve.circl.lu/cve/CVE-2023-28347
CVE-2023-28348,5.2,Insight,"An issue was discovered in Faronics Insight 10.0.19045 on Windows. A suitably positioned attacker could perform a man-in-the-middle attack on either a connected student or teacher, enabling them to intercept student keystrokes or modify executable files being sent from teachers to students.",2023-06-06T18:33:49.077,https://cve.circl.lu/cve/CVE-2023-28348
CVE-2023-20868,2.7,Java,NSX-T contains a reflected cross-site scripting vulnerability due to a lack of input validation. A remote attacker can inject HTML or JavaScript to redirect to malicious pages.,2023-06-02T19:18:23.130,https://cve.circl.lu/cve/CVE-2023-20868
CVE-2023-33255,2.7,Java,"An issue was discovered in Papaya Viewer 4a42701. User-supplied input in form of DICOM or NIFTI images can be loaded into the Papaya web application without any kind of sanitization. This allows injection of arbitrary JavaScript code into image metadata, which is executed when that metadata is displayed in the Papaya web application",2023-06-02T16:07:11.097,https://cve.circl.lu/cve/CVE-2023-33255
CVE-2023-33187,3.6,Java,"Highlight is an open source, full-stack monitoring platform. Highlight may record passwords on customer deployments when a password html input is switched to `type=""text""` via a javascript ""Show Password"" button. This differs from the expected behavior which always obfuscates `type=""password""` inputs. A customer may assume that switching to `type=""text""` would also not record this input; hence, they would not add additional `highlight-mask` css-class obfuscation to this part of the DOM, resulting in unintentional recording of a password value when a `Show Password` button is used. This issue was patched in version 6.0.0.This patch tracks changes to the `type` attribute of an input to ensure an input that used to be a `type=""password""` continues to be obfuscated. ",2023-06-05T13:50:24.813,https://cve.circl.lu/cve/CVE-2023-33187
CVE-2023-32072,2.7,Jenkins,"Tuleap is an open source tool for end to end traceability of application and system developments. Tuleap Community Edition prior to version 14.8.99.60 and Tuleap Enterprise edition prior to 14.8-3 and 14.7-7, the logs of the triggered Jenkins job URLs are not properly escaped. A malicious Git administrator can setup a malicious Jenkins hook to make a victim, also a Git administrator, execute uncontrolled code. Tuleap Community Edition 14.8.99.60, Tuleap Enterprise Edition 14.8-3, and Tuleap Enterprise Edition 14.7-7 contain a patch for this issue.",2023-06-05T15:42:16.773,https://cve.circl.lu/cve/CVE-2023-32072
CVE-2023-34218,5.9,JetBrains,In JetBrains TeamCity before 2023.05 bypass of permission checks allowing to perform admin actions was possible,2023-06-06T20:02:39.667,https://cve.circl.lu/cve/CVE-2023-34218
CVE-2023-34219,1.4,JetBrains,In JetBrains TeamCity before 2023.05 improper permission checks allowed users without appropriate permissions to edit Build Configuration settings via REST API,2023-06-02T19:17:09.593,https://cve.circl.lu/cve/CVE-2023-34219
CVE-2023-34220,2.7,JetBrains,In JetBrains TeamCity before 2023.05 stored XSS in the Commit Status Publisher window was possible,2023-06-02T19:17:30.173,https://cve.circl.lu/cve/CVE-2023-34220
CVE-2023-34221,2.7,JetBrains,In JetBrains TeamCity before 2023.05 stored XSS in the Show Connection page was possible,2023-06-02T19:17:36.690,https://cve.circl.lu/cve/CVE-2023-34221
CVE-2023-34222,2.7,JetBrains,In JetBrains TeamCity before 2023.05 possible XSS in the Plugin Vendor URL was possible,2023-06-02T19:17:48.040,https://cve.circl.lu/cve/CVE-2023-34222
CVE-2023-30285,3.6,Jira,An issue in Deviniti Issue Sync Synchronization v3.5.2 for Jira allows attackers to obtain the login credentials of a user via a crafted request sent to /rest/synchronizer/1.0/technicalUser.,2023-06-07T13:46:38.393,https://cve.circl.lu/cve/CVE-2023-30285
CVE-2023-21514,5.9,JavaScript,Improper scheme validation from InstantPlay Deeplink in Galaxy Store prior to version 4.5.49.8 allows attackers to execute javascript API to install APK from Galaxy Store.,2023-06-03T03:34:16.450,https://cve.circl.lu/cve/CVE-2023-21514
CVE-2023-1944,5.9,Kubernetes,This vulnerability enables ssh access to minikube container using a default password.,2023-06-01T16:00:34.877,https://cve.circl.lu/cve/CVE-2023-1944
CVE-2023-33191,5.9,Kubernetes,Kyverno is a policy engine designed for Kubernetes. Kyverno seccomp control can be circumvented. Users of the podSecurity `validate.podSecurity` subrule in Kyverno 1.9.2 and 1.9.3 are vulnerable. This issue was patched in version 1.9.4.,2023-06-05T16:44:08.867,https://cve.circl.lu/cve/CVE-2023-33191
CVE-2022-4569,5.9,Lenovo,A local privilege escalation vulnerability in the ThinkPad Hybrid USB-C with USB-A Dock Firmware Update Tool could allow an attacker with local access to execute code with elevated privileges during the package upgrade or installation.,2023-06-06T12:50:56.083,https://cve.circl.lu/cve/CVE-2022-4569
CVE-2022-48181,5.9,Lenovo,An ErrorMessage driver stack-based buffer overflow vulnerability in BIOS of some ThinkPad models could allow an attacker with local access to elevate their privileges and execute arbitrary code.,2023-06-06T12:50:56.083,https://cve.circl.lu/cve/CVE-2022-48181
CVE-2022-48188,5.9,Lenovo,A buffer overflow vulnerability in the SecureBootDXE BIOS driver of some Lenovo Desktop and ThinkStation models could allow an attacker with local access to elevate their privileges to execute arbitrary code.,2023-06-06T12:50:56.083,https://cve.circl.lu/cve/CVE-2022-48188
CVE-2017-17442,2.7,Management,"In BlackBerry UEM Management Console version 12.7.1 and earlier, a reflected cross-site scripting vulnerability that could allow an attacker to execute script commands in the context of the affected UEM Management Console account by crafting a malicious link and then persuading a user with legitimate access to the Management Console to click on the malicious link.",2023-06-07T19:15:09.113,https://cve.circl.lu/cve/CVE-2017-17442
CVE-2022-3214,5.9,Management,"Delta Industrial Automation's DIAEnergy, an industrial energy management system, is vulnerable to CWE-798, Use of Hard-coded Credentials. Versions prior to 1.9.03.009 have this vulnerability. Executable files could be uploaded to certain directories using hard-coded bearer authorization, allowing remote code execution.",2023-06-05T23:15:09.853,https://cve.circl.lu/cve/CVE-2022-3214
CVE-2023-0455,5.9,Management,Unrestricted Upload of File with Dangerous Type in GitHub repository unilogies/bumsys prior to v1.0.3-beta.,2023-06-01T17:15:09.687,https://cve.circl.lu/cve/CVE-2023-0455
CVE-2023-2808,1.4,Mattermost,"Mattermost fails to normalize UTF confusable characters when determining if a preview should be generated for a hyperlink, allowing an attacker to trigger link preview on a disallowed domain using a specially crafted link.",2023-06-05T16:33:44.327,https://cve.circl.lu/cve/CVE-2023-2808
CVE-2023-30846,3.6,Microsoft,"typed-rest-client is a library for Node Rest and Http Clients with typings for use with TypeScript. Users of the typed-rest-client library version 1.7.3 or lower are vulnerable to leak authentication data to 3rd parties. The flow of the vulnerability is as follows: First, send any request with `BasicCredentialHandler`, `BearerCredentialHandler` or `PersonalAccessTokenCredentialHandler`. Second, the target host may return a redirection (3xx), with a link to a second host. Third, the next request will use the credentials to authenticate with the second host, by setting the `Authorization` header. The expected behavior is that the next request will *NOT* set the `Authorization` header. The problem was fixed in version 1.8.0. There are no known workarounds.",2023-06-01T14:15:12.120,https://cve.circl.lu/cve/CVE-2023-30846
CVE-2022-35743,5.9,Microsoft,Microsoft Windows Support Diagnostic Tool (MSDT) Remote Code Execution Vulnerability,2023-06-07T17:45:47.143,https://cve.circl.lu/cve/CVE-2022-35743
CVE-2022-35744,5.9,Microsoft,Windows Point-to-Point Protocol (PPP) Remote Code Execution Vulnerability,2023-06-08T01:44:43.797,https://cve.circl.lu/cve/CVE-2022-35744
CVE-2023-33967,5.9,MySQL,EaseProbe is a tool that can do health/status checking. An SQL injection issue was discovered in EaseProbe before 2.1.0 when using MySQL/PostgreSQL data checking. This problem has been fixed in v2.1.0.,2023-06-07T17:58:21.197,https://cve.circl.lu/cve/CVE-2023-33967
CVE-2022-46703,3.6,MacOS,"A logic issue was addressed with improved restrictions. This issue is fixed in iOS 15.7.2 and iPadOS 15.7.2, macOS Ventura 13.1, iOS 16.2 and iPadOS 16.2. An app may be able to read sensitive location information",2023-06-06T23:15:09.300,https://cve.circl.lu/cve/CVE-2022-46703
CVE-2022-47015,3.6,MariaDB,MariaDB Server before 10.3.34 thru 10.9.3 is vulnerable to Denial of Service. It is possible for function spider_db_mbase::print_warnings to dereference a null pointer.,2023-06-04T10:15:09.127,https://cve.circl.lu/cve/CVE-2022-47015
CVE-2023-33962,2.7,Malware,"JStachio is a  type-safe Java Mustache templating engine. Prior to version 1.0.1, JStachio fails to escape single quotes `'` in HTML, allowing an attacker to inject malicious code. This vulnerability can be exploited by an attacker to execute arbitrary JavaScript code in the context of other users visiting pages that use this template engine. This can lead to various consequences, including session hijacking, defacement of web pages, theft of sensitive information, or even the propagation of malware.Version 1.0.1 contains a patch for this issue. To mitigate this vulnerability, the template engine should properly escape special characters, including single quotes. Common practice is to escape `'` as `&#39`. As a workaround, users can avoid this issue by using only double quotes `""` for HTML attributes.",2023-06-06T20:53:25.557,https://cve.circl.lu/cve/CVE-2023-33962
CVE-2023-29539,NA,Malware,"When handling the filename directive in the Content-Disposition header, the filename would be truncated if the filename contained a NULL character. This could have led to reflected file download attacks potentially tricking users to install malware. This vulnerability affects Firefox < 112, Focus for Android < 112, Firefox ESR < 102.10, Firefox for Android < 112, and Thunderbird < 102.10.",2023-06-02T18:10:03.083,https://cve.circl.lu/cve/CVE-2023-29539
CVE-2023-23754,2.7,MFA,An issue was discovered in Joomla! 4.2.0 through 4.3.1. Lack of input validation caused an open redirect and XSS issue within the new mfa selection screen.,2023-06-06T18:07:07.163,https://cve.circl.lu/cve/CVE-2023-23754
CVE-2023-23755,3.6,MFA,An issue was discovered in Joomla! 4.2.0 through 4.3.1. The lack of rate limiting allowed brute force attacks against MFA methods.,2023-06-06T18:12:24.850,https://cve.circl.lu/cve/CVE-2023-23755
CVE-2023-34239,3.4,Machine Learning,Gradio is an open-source Python library that is used to build machine learning and data science. Due to a lack of path filtering Gradio does not properly restrict file access to users. Additionally Gradio does not properly restrict the what URLs are proxied. These issues have been addressed in version 3.34.0. Users are advised to upgrade. There are no known workarounds for this vulnerability.,2023-06-08T00:15:09.997,https://cve.circl.lu/cve/CVE-2023-34239
CVE-2023-29738,5.9,MDR,An issue found in Wave Animated Keyboard Emoji v.1.70.7 for Android allows a local attacker to cause code execution and escalation of Privileges via the database files.,2023-06-06T20:52:47.427,https://cve.circl.lu/cve/CVE-2023-29738
CVE-2023-29739,5.9,MDR,An issue found in Alarm Clock for Heavy Sleepers v.5.3.2 for Android allows unauthorized apps to cause escalation of privilege attacks by manipulating the component.,2023-06-06T20:47:25.873,https://cve.circl.lu/cve/CVE-2023-29739
CVE-2023-29740,3.6,MDR,An issue found in Alarm Clock for Heavy Sleepers v.5.3.2 for Android allows unauthorized apps to cause a denial of service attack by manipulating the database.,2023-06-06T20:47:41.763,https://cve.circl.lu/cve/CVE-2023-29740
CVE-2023-24329,3.6,MFT,An issue in the urllib.parse component of Python before 3.11.4 allows attackers to bypass blocklisting methods by supplying a URL that starts with blank characters.,2023-06-07T22:15:09.460,https://cve.circl.lu/cve/CVE-2023-24329
CVE-2023-0430,NA,Mozilla,Certificate OCSP revocation status was not checked when verifying S/Mime signatures. Mail signed with a revoked certificate would be displayed as having a valid signature. Thunderbird versions from 68 to 102.7.0 were affected by this bug. This vulnerability affects Thunderbird < 102.7.1.,2023-06-02T18:10:24.877,https://cve.circl.lu/cve/CVE-2023-0430
CVE-2023-0547,NA,Mozilla,"OCSP revocation status of recipient certificates was not checked when sending S/Mime encrypted email, and revoked certificates would be accepted. Thunderbird versions from 68 to 102.9.1 were affected by this bug. This vulnerability affects Thunderbird < 102.10.",2023-06-02T18:10:24.877,https://cve.circl.lu/cve/CVE-2023-0547
CVE-2023-0616,NA,Mozilla,"If a MIME email combines OpenPGP and OpenPGP MIME data in a certain way Thunderbird repeatedly attempts to process and display the message, which could cause Thunderbird's user interface to lock up and no longer respond to the user's actions. An attacker could send a crafted message with this structure to attempt a DoS attack. This vulnerability affects Thunderbird < 102.8.",2023-06-02T18:10:24.877,https://cve.circl.lu/cve/CVE-2023-0616
CVE-2023-0767,NA,Mozilla,"An attacker could construct a PKCS 12 cert bundle in such a way that could allow for arbitrary memory writes via PKCS 12 Safe Bag attributes being mishandled. This vulnerability affects Firefox < 110, Thunderbird < 102.8, and Firefox ESR < 102.8.",2023-06-02T18:10:24.877,https://cve.circl.lu/cve/CVE-2023-0767
CVE-2023-1945,NA,Mozilla,Unexpected data returned from the Safe Browsing API could have led to memory corruption and a potentially exploitable crash. This vulnerability affects Thunderbird < 102.10 and Firefox ESR < 102.10.,2023-06-02T18:10:24.877,https://cve.circl.lu/cve/CVE-2023-1945
CVE-2023-33532,NA,Netgear,"There is a command injection vulnerability in the Netgear R6250 router with Firmware Version 1.0.4.48. If an attacker gains web management privileges, they can inject commands into the post request parameters, thereby gaining shell privileges.",2023-06-06T18:34:03.700,https://cve.circl.lu/cve/CVE-2023-33532
CVE-2023-33533,NA,Netgear,"Netgear D6220 with Firmware Version 1.0.0.80, D8500 with Firmware Version 1.0.3.60, R6700 with Firmware Version 1.0.2.26, and R6900 with Firmware Version 1.0.2.26 are vulnerable to Command Injection. If an attacker gains web management privileges, they can inject commands into the post request parameters, gaining shell privileges.",2023-06-06T18:34:03.700,https://cve.circl.lu/cve/CVE-2023-33533
CVE-2023-32074,5.9,Nextcloud,user_oidc app is an OpenID Connect user backend for Nextcloud. Authentication can be broken/bypassed in user_oidc app. It is recommended that the Nextcloud user_oidc app is upgraded to 1.3.2,2023-06-01T17:58:20.773,https://cve.circl.lu/cve/CVE-2023-32074
CVE-2023-32318,5.9,Nextcloud,Nextcloud server provides a home for data. A regression in the session handling between Nextcloud Server and the Nextcloud Text app prevented a correct destruction of the session on logout if cookies were not cleared manually. After successfully authenticating with any other account the previous session would be continued and the attacker would be authenticated as the previously logged in user. It is recommended that the Nextcloud Server is upgraded to 25.0.6 or 26.0.1.,2023-06-02T12:57:32.097,https://cve.circl.lu/cve/CVE-2023-32318
CVE-2023-31128,5.9,Nextcloud,"NextCloud Cookbook is a recipe library app. Prior to commit a46d9855 on the `master` branch and commit 489bb744 on the `main-0.9.x` branch, the `pull-checks.yml` workflow is vulnerable to command injection attacks because of using an untrusted `github.head_ref` field. The `github.head_ref` value is an attacker-controlled value. Assigning the value to `zzz"";echo${IFS}""hello"";#` can lead to command injection. Since the permission is not restricted, the attacker has a write-access to the repository. This issue is fixed in commit a46d9855 on the `master` branch and commit 489bb744 on the `main-0.9.x` branch. There is no risk for the user of the app within the NextCloud server. This only affects the main repository and possible forks of it. Those who have forked the NextCloud Cookbook repository should make sure their forks are on the latest version to prevent code injection attacks and similar.",2023-06-05T14:15:52.127,https://cve.circl.lu/cve/CVE-2023-31128
CVE-2023-33184,1.4,Nextcloud,"Nextcloud Mail is a mail app in Nextcloud. A blind SSRF attack allowed to send GET requests to services running in the same web server. It is recommended that the Mail app is update to version 3.02, 2.2.5 or 1.15.3.",2023-06-02T18:52:18.290,https://cve.circl.lu/cve/CVE-2023-33184
CVE-2023-33977,5.2,Nginx,"Kiwi TCMS is an open source test management system for both manual and automated testing. Kiwi TCMS allows users to upload attachments to test plans, test cases, etc. Earlier versions of Kiwi TCMS had introduced upload validators in order to prevent potentially dangerous files from being uploaded and Content-Security-Policy definition to prevent cross-site-scripting attacks. The upload validation checks were not 100% robust which left the possibility to circumvent them and upload a potentially dangerous file which allows execution of arbitrary JavaScript in the browser. Additionally we've discovered that Nginx's `proxy_pass` directive will strip some headers negating protections built into Kiwi TCMS when served behind a reverse proxy. This issue has been addressed in version 12.4. Users are advised to upgrade. Users unable to upgrade who are serving Kiwi TCMS behind a reverse proxy should make sure that additional header values are still passed to the client browser. If they aren't redefining them inside the proxy configuration.",2023-06-07T02:45:15.873,https://cve.circl.lu/cve/CVE-2023-33977
CVE-2023-26127,5.9,Node.js,"All versions of the package n158 are vulnerable to Command Injection due to improper input sanitization in the 'module.exports' function.**Note:**To execute the code snippet and potentially exploit the vulnerability, the attacker needs to have the ability to run Node.js code within the target environment. This typically requires some level of access to the system or application hosting the Node.js environment.",2023-06-02T18:15:59.693,https://cve.circl.lu/cve/CVE-2023-26127
CVE-2023-26128,5.9,Node.js,"All versions of the package keep-module-latest are vulnerable to Command Injection due to missing input sanitization or other checks and sandboxes being employed to the installModule function.**Note:**To execute the code snippet and potentially exploit the vulnerability, the attacker needs to have the ability to run Node.js code within the target environment. This typically requires some level of access to the system or application hosting the Node.js environment.",2023-06-02T18:22:59.677,https://cve.circl.lu/cve/CVE-2023-26128
CVE-2023-26129,5.9,Node.js,"All versions of the package bwm-ng are vulnerable to Command Injection due to improper input sanitization in the 'check' function in the bwm-ng.js file. **Note:**To execute the code snippet and potentially exploit the vulnerability, the attacker needs to have the ability to run Node.js code within the target environment. This typically requires some level of access to the system or application hosting the Node.js environment.",2023-06-02T18:45:29.203,https://cve.circl.lu/cve/CVE-2023-26129
CVE-2023-32695,3.6,Node.js,"socket.io parser is a socket.io encoder and decoder written in JavaScript complying with version 5 of socket.io-protocol. A specially crafted Socket.IO packet can trigger an uncaught exception on the Socket.IO server, thus killing the Node.js process. A patch has been released in version 4.2.3.",2023-06-05T15:54:48.487,https://cve.circl.lu/cve/CVE-2023-32695
CVE-2023-32689,3.6,Node.js,"Parse Server is an open source backend that can be deployed to any infrastructure that can run Node.js. Versions prior to 5.4.4 and 6.1.1 are vulnerable to a phishing attack vulnerability that involves a user uploading malicious files. A malicious user could upload an HTML file to Parse Server via its public API. That HTML file would then be accessible at the internet domain at which Parse Server is hosted. The URL of the the uploaded HTML could be shared for phishing attacks. The HTML page may seem legitimate because it is served under the internet domain where Parse Server is hosted, which may be the same as a company's official website domain.An additional security issue arises when the Parse JavaScript SDK is used. The SDK stores sessions in the internet browser's local storage, which usually restricts data access depending on the internet domain. A malicious HTML file could contain a script that retrieves the user's session token from local storage and then share it with the attacker.The fix included in versions 5.4.4 and 6.1.1 adds a new Parse Server option `fileUpload.fileExtensions` to restrict file upload on Parse Server by file extension. It is recommended to restrict file upload for HTML file extensions, which this fix disables by default. If an app requires upload of files with HTML file extensions, the option can be set to `['.*']` or another custom value to override the default.",2023-06-06T20:08:00.527,https://cve.circl.lu/cve/CVE-2023-32689
CVE-2023-0508,1.4,NPM,"An issue has been discovered in GitLab CE/EE affecting all versions starting from 15.4 before 15.10.8, all versions starting from 15.11 before 15.11.7, all versions starting from 16.0 before 16.0.2. Open redirection was possible via HTTP response splitting in the NPM package API.",2023-06-07T17:28:57.443,https://cve.circl.lu/cve/CVE-2023-0508
CVE-2023-1667,3.6,NULL Pointer,A NULL pointer dereference was found In libssh during re-keying with algorithm guessing. This issue may allow an authenticated client to cause a denial of service.,2023-06-06T15:02:27.610,https://cve.circl.lu/cve/CVE-2023-1667
CVE-2023-33946,1.4,OAuth,"The Object module in Liferay Portal 7.4.3.4 through 7.4.3.48, and Liferay DXP 7.4 before update 49 does properly isolate objects in difference virtual instances, which allows remote authenticated users in one virtual instance to view objects in a different virtual instance via OAuth 2 scope administration page.",2023-06-01T17:04:51.023,https://cve.circl.lu/cve/CVE-2023-33946
CVE-2023-34224,2.7,OAuth,In JetBrains TeamCity before 2023.05 open redirect during oAuth configuration was possible,2023-06-02T19:19:03.420,https://cve.circl.lu/cve/CVE-2023-34224
CVE-2022-35742,3.6,Outlook,Microsoft Outlook Denial of Service Vulnerability,2023-06-07T18:20:13.760,https://cve.circl.lu/cve/CVE-2022-35742
CVE-2023-0950,5.9,Office,"Improper Validation of Array Index vulnerability in the spreadsheet component of The Document Foundation LibreOffice allows an attacker to craft a spreadsheet document that will cause an array index underflow when loaded. In the affected versions of LibreOffice certain malformed spreadsheet formulas, such as AGGREGATE, could be created with less parameters passed to the formula interpreter than it expected, leading to an array index underflow, in which case there is a risk that arbitrary code could be executed. This issue affects: The Document Foundation LibreOffice 7.4 versions prior to 7.4.6; 7.5 versions prior to 7.5.1.",2023-06-07T17:42:02.760,https://cve.circl.lu/cve/CVE-2023-0950
CVE-2023-2255,1.4,Office,"Improper access control in editor components of The Document Foundation LibreOffice allowed an attacker to craft a document that would cause external links to be loaded without prompt. In the affected versions of LibreOffice documents that used ""floating frames"" linked to external files, would load the contents of those frames without prompting the user for permission to do so. This was inconsistent with the treatment of other linked content in LibreOffice. This issue affects: The Document Foundation LibreOffice 7.4 versions prior to 7.4.7; 7.5 versions prior to 7.5.3.",2023-06-01T17:34:36.870,https://cve.circl.lu/cve/CVE-2023-2255
