CVE,"Impact Score (1-10, 10 being the worst)",Keyword,Description,Last Modified,Link
CVE-2022-30130,1.4,.NET Framework,.NET Framework Denial of Service Vulnerability,2023-06-05T19:15:09.593,https://cve.circl.lu/cve/CVE-2022-30130
CVE-2023-33185,2.5,AWS,"Django-SES is a drop-in mail backend for Django. The django_ses library implements a mail backend for Django using AWS Simple Email Service. The library exports the `SESEventWebhookView class` intended to receive signed requests from AWS to handle email bounces, subscriptions, etc. These requests are signed by AWS and are verified by django_ses, however the verification of this signature was found to be flawed as it allowed users to specify arbitrary public certificates. This issue was patched in version 3.5.0.",2023-06-06T18:09:12.467,https://cve.circl.lu/cve/CVE-2023-33185
CVE-2023-33234,5.9,Airflow,"Arbitrary code execution in Apache Airflow CNCF Kubernetes provider version 5.0.0 allows user to change xcom sidecar image and resources via Airflow connection.In order to exploit this weakness, a user would already need elevated permissions (Op or Admin) to change the connection object in this manner.  Operators should upgrade to provider version 7.0.0 which has removed the vulnerability.",2023-06-05T16:45:22.593,https://cve.circl.lu/cve/CVE-2023-33234
CVE-2023-33248,5.5,Amazon,"Amazon Alexa software version 8960323972 on Echo Dot 2nd generation and 3rd generation devices potentially allows attackers to deliver security-relevant commands via an audio signal between 16 and 22 kHz (often outside the range of human adult hearing). Commands at these frequencies are essentially never spoken by authorized actors, but a substantial fraction of the commands are successful.",2023-06-01T17:20:32.917,https://cve.circl.lu/cve/CVE-2023-33248
CVE-2023-28937,NA,Amazon,"DataSpider Servista version 4.4 and earlier uses a hard-coded cryptographic key. DataSpider Servista is data integration software. ScriptRunner and ScriptRunner for Amazon SQS are used to start the configured processes on DataSpider Servista. The cryptographic key is embedded in ScriptRunner and ScriptRunner for Amazon SQS, which is common to all users. If an attacker who can gain access to a target DataSpider Servista instance and obtain a Launch Settings file of ScriptRunner and/or ScriptRunner for Amazon SQS, the attacker may perform operations with the user privilege encrypted in the file.",2023-06-01T13:00:30.717,https://cve.circl.lu/cve/CVE-2023-28937
CVE-2020-8908,1.4,Apache,"A temp directory creation vulnerability exists in all versions of Guava, allowing an attacker with access to the machine to potentially access data in a temporary directory created by the Guava API com.google.common.io.Files.createTempDir(). By default, on unix-like systems, the created directory is world-readable (readable by an attacker with access to the system). The method in question has been marked @Deprecated in versions 30.0 and later and should not be used. For Android developers, we recommend choosing a temporary directory API provided by Android, such as context.getCacheDir(). For other Java developers, we recommend migrating to the Java 7 API java.nio.file.Files.createTempDirectory() which explicitly configures permissions of 700, or configuring the Java runtime's java.io.tmpdir system property to point to a location whose permissions are appropriately configured.",2023-06-06T10:15:09.257,https://cve.circl.lu/cve/CVE-2020-8908
CVE-2023-30771,5.9,Apache,"Incorrect Authorization vulnerability in Apache Software Foundation Apache IoTDB.This issue affects the iotdb-web-workbench component on 0.13.3. iotdb-web-workbench is an optional component of IoTDB, providing a web console of the database.This problem is fixed from version 0.13.4 of iotdb-web-workbench onwards.",2023-06-06T14:03:55.963,https://cve.circl.lu/cve/CVE-2023-30771
CVE-2023-32315,3.6,Apache,"Openfire is an XMPP server licensed under the Open Source Apache License. Openfire's administrative console, a web-based application, was found to be vulnerable to a path traversal attack via the setup environment. This permitted an unauthenticated user to use the unauthenticated Openfire Setup Environment in an already configured Openfire environment to access restricted pages in the Openfire Admin Console reserved for administrative users. This vulnerability affects all versions of Openfire that have been released since April 2015, starting with version 3.10.0. The problem has been patched in Openfire release 4.7.5 and 4.6.8, and further improvements will be included in the yet-to-be released first version on the 4.8 branch (which is expected to be version 4.8.0). Users are advised to upgrade. If an Openfire upgrade isn’t available for a specific release, or isn’t quickly actionable, users may see the linked github advisory (GHSA-gw42-f939-fhvm) for mitigation advice.",2023-06-03T03:57:06.817,https://cve.circl.lu/cve/CVE-2023-32315
CVE-2019-19791,5.9,Apache,"In LemonLDAP::NG (aka lemonldap-ng) before 2.0.7, the default Apache HTTP Server configuration does not properly restrict access to SOAP/REST endpoints (when some LemonLDAP::NG setup options are used). For example, an attacker can insert index.fcgi/index.fcgi into a URL to bypass a Require directive.",2023-06-05T16:34:43.737,https://cve.circl.lu/cve/CVE-2019-19791
CVE-2023-30601,5.9,Apache,"Privilege escalation when enabling FQL/Audit logs allows user with JMX access to run arbitrary commands as the user running Apache CassandraThis issue affects Apache Cassandra: from 4.0.0 through 4.0.9, from 4.1.0 through 4.1.1.WORKAROUNDThe vulnerability requires nodetool/JMX access to be exploitable, disable access for any non-trusted users.MITIGATIONUpgrade to 4.0.10 or 4.1.2 and leave the new FQL/Auditlog configuration property allow_nodetool_archive_command as false.",2023-06-05T16:41:46.257,https://cve.circl.lu/cve/CVE-2023-30601
CVE-2022-42837,5.9,Apple,"An issue existed in the parsing of URLs. This issue was addressed with improved input validation. This issue is fixed in iOS 16.2 and iPadOS 16.2, macOS Ventura 13.1, iOS 15.7.2 and iPadOS 15.7.2, watchOS 9.2. A remote user may be able to cause unexpected app termination or arbitrary code execution.",2023-06-08T00:15:09.373,https://cve.circl.lu/cve/CVE-2022-42837
CVE-2022-42855,5.2,Apple,"A logic issue was addressed with improved state management. This issue is fixed in tvOS 16.2, macOS Monterey 12.6.2, macOS Ventura 13.1, iOS 15.7.2 and iPadOS 15.7.2, iOS 16.2 and iPadOS 16.2. An app may be able to use arbitrary entitlements.",2023-06-06T23:15:08.950,https://cve.circl.lu/cve/CVE-2022-42855
CVE-2022-46705,1.4,Apple,"A spoofing issue existed in the handling of URLs. This issue was addressed with improved input validation. This issue is fixed in iOS 16.2 and iPadOS 16.2, macOS Ventura 13.1, Safari 16.2. Visiting a malicious website may lead to address bar spoofing.",2023-06-08T00:15:09.470,https://cve.circl.lu/cve/CVE-2022-46705
CVE-2023-23520,3.6,Apple,"A race condition was addressed with additional validation. This issue is fixed in macOS Ventura 13.2, iOS 16.3 and iPadOS 16.3. A user may be able to read arbitrary files as root.",2023-06-08T00:15:09.570,https://cve.circl.lu/cve/CVE-2023-23520
CVE-2022-23121,5.9,Apple,This vulnerability allows remote attackers to execute arbitrary code on affected installations of Netatalk. Authentication is not required to exploit this vulnerability. The specific flaw exists within the parse_entries function. The issue results from the lack of proper error handling when parsing AppleDouble entries. An attacker can leverage this vulnerability to execute code in the context of root. Was ZDI-CAN-15819.,2023-06-01T20:15:09.343,https://cve.circl.lu/cve/CVE-2022-23121
CVE-2023-22504,3.6,Atlassian,"Affected versions of Atlassian Confluence Server allow remote attackers who have read permissions to a page, but not write permissions, to upload attachments via a Broken Access Control vulnerability in the attachments feature.",2023-06-07T14:15:09.810,https://cve.circl.lu/cve/CVE-2023-22504
CVE-2023-33287,2.7,Atlassian,A stored cross-site scripting (XSS) vulnerability in the Inline Table Editing application before 3.8.0 for Confluence allows attackers to store and execute arbitrary JavaScript via a crafted payload injected into the tables.,2023-06-08T01:26:27.440,https://cve.circl.lu/cve/CVE-2023-33287
CVE-2022-33646,5.9,Azure,Azure Batch Node Agent Elevation of Privilege Vulnerability,2023-06-01T02:15:09.343,https://cve.circl.lu/cve/CVE-2022-33646
CVE-2023-22648,5.9,Azure,"A Improper Privilege Management vulnerability in SUSE Rancher causes permission changes in Azure AD not to be reflected to users while they are logged in the Rancher UI. This would cause the users to retain their previous permissions in Rancher, even if they change groups on Azure AD, for example, to a lower privileged group, or are removed from a group, thus retaining their access to Rancher instead of losing it.This issue affects Rancher: from >= 2.6.7 before < 2.6.13, from >= 2.7.0 before < 2.7.4.",2023-06-01T14:01:50.967,https://cve.circl.lu/cve/CVE-2023-22648
CVE-2023-34362,NA,Azure,"In Progress MOVEit Transfer before 2021.0.6 (13.0.6), 2021.1.4 (13.1.4), 2022.0.4 (14.0.4), 2022.1.5 (14.1.5), and 2023.0.1 (15.0.1), a SQL injection vulnerability has been found in the MOVEit Transfer web application that could allow an unauthenticated attacker to gain access to MOVEit Transfer's database. Depending on the database engine being used (MySQL, Microsoft SQL Server, or Azure SQL), an attacker may be able to infer information about the structure and contents of the database, and execute SQL statements that alter or delete database elements. NOTE: this is exploited in the wild in May and June 2023; exploitation of unpatched systems can occur via HTTP or HTTPS. All versions (e.g., 2020.0 and 2019x) before the five explicitly mentioned versions are affected, including older unsupported versions.",2023-06-05T05:15:09.987,https://cve.circl.lu/cve/CVE-2023-34362
CVE-2022-21216,5.9,Atom,Insufficient granularity of access control in out-of-band management in some Intel(R) Atom and Intel Xeon Scalable Processors may allow a privileged user to potentially enable escalation of privilege via adjacent network access.,2023-06-01T14:15:09.700,https://cve.circl.lu/cve/CVE-2022-21216
CVE-2023-33211,2.7,Atom,Auth. (admin+) Stored Cross-Site Scripting (XSS) vulnerability in André Bräkling WP-Matomo Integration (WP-Piwik) plugin <= 1.0.27 versions.,2023-06-01T03:53:38.500,https://cve.circl.lu/cve/CVE-2023-33211
CVE-2023-33719,NA,Atom,mp4v2 v2.1.3 was discovered to contain a memory leak via MP4SdpAtom::Read() at atom_sdp.cpp,2023-06-01T13:00:30.717,https://cve.circl.lu/cve/CVE-2023-33719
CVE-2023-33297,3.6,Bitcoin,"Bitcoin Core before 24.1, when debug mode is not used, allows attackers to cause a denial of service (CPU consumption) because draining the inventory-to-send queue is inefficient, as exploited in the wild in May 2023.",2023-06-01T06:15:13.677,https://cve.circl.lu/cve/CVE-2023-33297
CVE-2023-2868,5.9,Barracuda,"A remote command injection vulnerability exists in the Barracuda Email Security Gateway (appliance form factor only) product effecting versions 5.1.3.001-9.2.0.006. The vulnerability arises out of a failure to comprehensively sanitize the processing of .tar file (tape archives). The vulnerability stems from incomplete input validation of a user-supplied .tar file as it pertains to the names of the files contained within the archive. As a consequence, a remote attacker can specifically format these file names in a particular manner that will result in remotely executing a system command through Perl's qx operator with the privileges of the Email Security Gateway product. This issue was fixed as part of BNSF-36456 patch. This patch was automatically applied to all customer appliances.",2023-06-01T20:14:55.053,https://cve.circl.lu/cve/CVE-2023-2868
CVE-2018-20967,5.9,CSRF,The wp-ultimate-csv-importer plugin before 5.6.1 for WordPress has CSRF.,2023-06-06T18:43:33.990,https://cve.circl.lu/cve/CVE-2018-20967
CVE-2022-47149,5.9,CSRF,Cross-Site Request Forgery (CSRF) vulnerability in Pretty Links plugin <= 1.4 versions.,2023-06-01T12:11:59.867,https://cve.circl.lu/cve/CVE-2022-47149
CVE-2022-45815,5.9,CSRF,Cross-Site Request Forgery (CSRF) vulnerability in StylemixThemes GDPR Compliance & Cookie Consent plugin <= 1.2 versions.,2023-06-01T13:06:36.570,https://cve.circl.lu/cve/CVE-2022-45815
CVE-2022-46810,5.9,CSRF,Cross-Site Request Forgery (CSRF) vulnerability in VillaTheme Thank You Page Customizer for WooCommerce – Increase Your Sales plugin <= 1.0.13 versions.,2023-06-01T13:06:50.170,https://cve.circl.lu/cve/CVE-2022-46810
CVE-2022-46814,5.9,CSRF,Cross-Site Request Forgery (CSRF) vulnerability in Pierre Lebedel Kodex Posts likes plugin <= 2.4.3 versions.,2023-06-01T13:11:17.623,https://cve.circl.lu/cve/CVE-2022-46814
CVE-2023-2283,2.5,Cryptograph,"A vulnerability was found in libssh, where the authentication check of the connecting client can be bypassed in the`pki_verify_data_signature` function in memory allocation problems. This issue may happen if there is insufficient memory or the memory usage is limited. The problem is caused by the return value `rc,` which is initialized to SSH_ERROR and later rewritten to save the return value of the function call `pki_key_check_hash_compatible.` The value of the variable is not changed between this point and the cryptographic verification. Therefore any error between them calls `goto error` returning SSH_OK.",2023-06-06T14:54:27.843,https://cve.circl.lu/cve/CVE-2023-2283
CVE-2023-2650,3.6,Cryptograph,"Issue summary: Processing some specially crafted ASN.1 object identifiers ordata containing them may be very slow.Impact summary: Applications that use OBJ_obj2txt() directly, or use any ofthe OpenSSL subsystems OCSP, PKCS7/SMIME, CMS, CMP/CRMF or TS with no messagesize limit may experience notable to very long delays when processing thosemessages, which may lead to a Denial of Service.An OBJECT IDENTIFIER is composed of a series of numbers - sub-identifiers -most of which have no size limit.  OBJ_obj2txt() may be used to translatean ASN.1 OBJECT IDENTIFIER given in DER encoding form (using the OpenSSLtype ASN1_OBJECT) to its canonical numeric text form, which are thesub-identifiers of the OBJECT IDENTIFIER in decimal form, separated byperiods.When one of the sub-identifiers in the OBJECT IDENTIFIER is very large(these are sizes that are seen as absurdly large, taking up tens or hundredsof KiBs), the translation to a decimal number in text may take a very longtime.  The time complexity is O(n^2) with 'n' being the size of thesub-identifiers in bytes (*).With OpenSSL 3.0, support to fetch cryptographic algorithms using names /identifiers in string form was introduced.  This includes using OBJECTIDENTIFIERs in canonical numeric text form as identifiers for fetchingalgorithms.Such OBJECT IDENTIFIERs may be received through the ASN.1 structureAlgorithmIdentifier, which is commonly used in multiple protocols to specifywhat cryptographic algorithm should be used to sign or verify, encrypt ordecrypt, or digest passed data.Applications that call OBJ_obj2txt() directly with untrusted data areaffected, with any version of OpenSSL.  If the use is for the mere purposeof display, the severity is considered low.In OpenSSL 3.0 and newer, this affects the subsystems OCSP, PKCS7/SMIME,CMS, CMP/CRMF or TS.  It also impacts anything that processes X.509certificates, including simple things like verifying its signature.The impact on TLS is relatively low, because all versions of OpenSSL have a100KiB limit on the peer's certificate chain.  Additionally, this onlyimpacts clients, or servers that have explicitly enabled clientauthentication.In OpenSSL 1.1.1 and 1.0.2, this only affects displaying diverse objects,such as X.509 certificates.  This is assumed to not happen in such a waythat it would cause a Denial of Service, so these versions are considerednot affected by this issue in such a way that it would be cause for concern,and the severity is therefore considered low.",2023-06-05T17:42:12.797,https://cve.circl.lu/cve/CVE-2023-2650
CVE-2023-2987,5.9,Cryptograph,"The Wordapp plugin for WordPress is vulnerable to authorization bypass due to an use of insufficiently unique cryptographic signature on the 'wa_pdx_op_config_set' function in versions up to, and including, 1.5.0. This makes it possible for unauthenticated attackers to the plugin to change the 'validation_token' in the plugin config, providing access to the plugin's remote control functionalities, such as creating an admin access URL, which can be used for privilege escalation.",2023-06-06T16:14:17.600,https://cve.circl.lu/cve/CVE-2023-2987
CVE-2023-32690,3.6,Cryptograph,"libspdm is a sample implementation that follows the DMTF SPDM specifications. Prior to versions 2.3.3 and 3.0, following a successful CAPABILITIES response, a libspdm Requester stores the Responder's CTExponent into its context without validation. If the Requester sends a request message that requires a cryptography operation by the Responder, such as CHALLENGE, libspdm will calculate the timeout value using the Responder's unvalidated CTExponent.A patch is available in version 2.3.3. A workaround is also available. After completion of VCA, the Requester can check the value of the Responder's CTExponent. If it greater than or equal to 64, then the Requester can stop communication with the Responder.",2023-06-01T17:29:59.710,https://cve.circl.lu/cve/CVE-2023-32690
CVE-2023-34094,3.6,ChatGPT,"ChuanhuChatGPT is a graphical user interface for ChatGPT and many large language models. A vulnerability in versions 20230526 and prior allows unauthorized access to the config.json file of the privately deployed ChuanghuChatGPT project, when authentication is not configured. The attacker can exploit this vulnerability to steal the API keys in the configuration file. The vulnerability has been fixed in commit bfac445. As a workaround, setting up access authentication can help mitigate the vulnerability.",2023-06-02T18:10:24.877,https://cve.circl.lu/cve/CVE-2023-34094
CVE-2023-25976,5.9,CRM,"Cross-Site Request Forgery (CSRF) vulnerability in CRM Perks Integration for Contact Form 7 and Zoho CRM, Bigin plugin <= 1.2.2 versions.",2023-06-01T03:42:16.540,https://cve.circl.lu/cve/CVE-2023-25976
CVE-2023-2925,2.7,CRM,"A vulnerability, which was classified as problematic, was found in Webkul krayin crm 1.2.4. This affects an unknown part of the file /admin/contacts/organizations/edit/2 of the component Edit Person Page. The manipulation of the argument Organization leads to cross site scripting. It is possible to initiate the attack remotely. The exploit has been disclosed to the public and may be used. The associated identifier of this vulnerability is VDB-230079. NOTE: The vendor was contacted early about this disclosure but did not respond in any way.",2023-06-03T03:59:10.540,https://cve.circl.lu/cve/CVE-2023-2925
CVE-2023-33311,2.7,CRM,Auth. (contributor+) Stored Cross-Site Scripting (XSS) vulnerability in CRM Perks Contact Form Entries plugin <= 1.3.0 versions.,2023-06-01T03:53:43.727,https://cve.circl.lu/cve/CVE-2023-33311
CVE-2023-2836,2.7,CRM,"The CRM Perks Forms plugin for WordPress is vulnerable to Stored Cross-Site Scripting via form settings in versions up to, and including, 1.1.1 due to insufficient input sanitization and output escaping. This makes it possible for authenticated attackers, with administrator-level permissions and above, to inject arbitrary web scripts in pages that will execute whenever a user accesses an injected page. This only affects multi-site installations and installations where unfiltered_html has been disabled.",2023-06-06T16:33:29.050,https://cve.circl.lu/cve/CVE-2023-2836
CVE-2023-33735,5.9,D-Link,D-Link DIR-846 v1.00A52 was discovered to contain a remote command execution (RCE) vulnerability via the tomography_ping_address parameter in the /HNAP1 interface.,2023-06-07T02:29:41.367,https://cve.circl.lu/cve/CVE-2023-33735
CVE-2023-33781,NA,D-Link,An issue in D-Link DIR-842V2 v1.0.3 allows attackers to execute arbitrary commands via importing a crafted file.,2023-06-07T02:45:10.733,https://cve.circl.lu/cve/CVE-2023-33781
CVE-2023-33782,NA,D-Link,D-Link DIR-842V2 v1.0.3 was discovered to contain a command injection vulnerability via the iperf3 diagnostics function.,2023-06-07T02:45:10.733,https://cve.circl.lu/cve/CVE-2023-33782
CVE-2023-25542,5.9,Dell,"Dell Trusted Device Agent, versions prior to 5.3.0, contain(s) an improper installation permissions vulnerability. An unauthenticated local attacker could potentially exploit this vulnerability, leading to escalated privileges.",2023-06-06T07:15:08.807,https://cve.circl.lu/cve/CVE-2023-25542
CVE-2023-23693,6.0,Dell,"Dell VxRail, versions prior to 7.0.450, contains an OS command injection Vulnerability in DCManager command-line utility. A local high privileged attacker could potentially exploit this vulnerability, leading to the execution of arbitrary OS commands on the application's underlying OS, with the privileges of the vulnerable application. Exploitation may lead to a system take over by an attacker.",2023-06-01T20:44:56.407,https://cve.circl.lu/cve/CVE-2023-23693
CVE-2023-23694,5.9,Dell,"Dell VxRail versions earlier than 7.0.450, contain(s) an OS command injection vulnerability in VxRail Manager. A local authenticated attacker could potentially exploit this vulnerability, leading to the execution of arbitrary OS commands on the application's underlying OS, with the privileges of the vulnerable application. Exploitation may lead to a system take over by an attacker.",2023-06-05T14:15:09.860,https://cve.circl.lu/cve/CVE-2023-23694
CVE-2023-28079,5.9,Dell,"PowerPath for Windows, versions 7.0, 7.1 & 7.2 contains Insecure File and Folder Permissions vulnerability. A regular user (non-admin) can exploit the weak folder and file permissions to escalate privileges and execute arbitrary code in the context of NT AUTHORITY\SYSTEM.",2023-06-06T14:23:31.040,https://cve.circl.lu/cve/CVE-2023-28079
CVE-2023-28080,5.9,Dell,"PowerPath for Windows, versions 7.0, 7.1 & 7.2 contains DLL Hijacking Vulnerabilities. A regular user (non-admin) can exploit these issues to potentially escalate privileges and execute arbitrary code in the context of NT AUTHORITY\SYSTEM.",2023-06-06T14:23:10.780,https://cve.circl.lu/cve/CVE-2023-28080
CVE-2023-2954,2.7,Django,Cross-site Scripting (XSS) - Stored in GitHub repository liangliangyy/djangoblog prior to master.,2023-06-02T19:21:18.230,https://cve.circl.lu/cve/CVE-2023-2954
CVE-2023-32696,5.9,Docker,"CKAN is an open-source data management system for powering data hubs and data portals. Prior to versions 2.9.9 and 2.10.1, the `ckan` user (equivalent to www-data) owned code and configuration files in the docker container and the `ckan` user had the permissions to use sudo. These issues allowed for code execution or privilege escalation if an arbitrary file write bug was available. Versions 2.9.9, 2.9.9-dev, 2.10.1, and 2.10.1-dev contain a patch.",2023-06-06T00:53:59.340,https://cve.circl.lu/cve/CVE-2023-32696
CVE-2023-34108,5.9,Docker,"mailcow is a mail server suite based on Dovecot, Postfix and other open source software, that provides a modern web UI for user/server administration. A vulnerability has been discovered in mailcow which allows an attacker to manipulate internal Dovecot variables by using specially crafted passwords during the authentication process. The issue arises from the behavior of the `passwd-verify.lua` script, which is responsible for verifying user passwords during login attempts. Upon a successful login, the script returns a response in the format of ""password=<valid-password>"", indicating the successful authentication. By crafting a password with additional key-value pairs appended to it, an attacker can manipulate the returned string and influence the internal behavior of Dovecot. For example, using the password ""123 mail_crypt_save_version=0"" would cause the `passwd-verify.lua` script to return the string ""password=123 mail_crypt_save_version=0"". Consequently, Dovecot will interpret this string and set the internal variables accordingly, leading to unintended consequences. This vulnerability can be exploited by an authenticated attacker who has the ability to set their own password. Successful exploitation of this vulnerability could result in unauthorized access to user accounts, bypassing security controls, or other malicious activities. This issue has been patched in version `2023-05a`. Users are advised to upgrade. There are no known workarounds for this vulnerability.",2023-06-07T20:24:12.193,https://cve.circl.lu/cve/CVE-2023-34108
CVE-2023-30253,5.9,Dolibarr,Dolibarr before 17.0.1 allows remote code execution by an authenticated user via an uppercase manipulation: <?PHP instead of <?php in injected data.,2023-06-05T14:26:28.600,https://cve.circl.lu/cve/CVE-2023-30253
CVE-2005-1513,2.9,Debian,"Integer overflow in the stralloc_readyplus function in qmail, when running on 64 bit platforms with a large amount of virtual memory, allows remote attackers to cause a denial of service and possibly execute arbitrary code via a large SMTP request.",2023-06-08T00:15:09.153,https://cve.circl.lu/cve/CVE-2005-1513
CVE-2015-8543,5.9,Debian,"The networking implementation in the Linux kernel through 4.3.3, as used in Android and other products, does not validate protocol identifiers for certain protocol families, which allows local users to cause a denial of service (NULL function pointer dereference and system crash) or possibly gain privileges by leveraging CLONE_NEWUSER support to execute a crafted SOCK_RAW application.",2023-06-07T12:47:10.247,https://cve.circl.lu/cve/CVE-2015-8543
