CVE,"Impact Score (1-10, 10 being the worst)",Keyword,Description,Last Modified,Link
CVE-2023-34088,2.7,Office,"Collabora Online is a collaborative online office suite. A stored cross-site scripting (XSS) vulnerability was found in Collabora Online prior to versions 22.05.13, 21.11.9.1, and 6.4.27. An attacker could create a document with an XSS payload as a document name. Later, if an administrator opened the admin console and navigated to the history page, the document name was injected as unescaped HTML and executed as a script inside the context of the admin console. The administrator JSON web token (JWT) used for the websocket connection could be leaked through this flaw. Users should upgrade to Collabora Online 22.05.13 or higher; Collabora Online 21.11.9.1 or higher; Collabora Online 6.4.27 or higher to receive a patch.",2023-06-08T01:43:01.050,https://cve.circl.lu/cve/CVE-2023-34088
CVE-2023-3029,1.4,Office,A vulnerability has been found in Guangdong Pythagorean OA Office System up to 4.50.31 and classified as problematic. This vulnerability affects unknown code of the file /note/index/delete. The manipulation of the argument id leads to cross-site request forgery. The attack can be initiated remotely. The exploit has been disclosed to the public and may be used. VDB-230458 is the identifier assigned to this vulnerability.,2023-06-01T13:00:30.717,https://cve.circl.lu/cve/CVE-2023-3029
CVE-2023-3035,1.4,Office,A vulnerability has been found in Guangdong Pythagorean OA Office System up to 4.50.31 and classified as problematic. Affected by this vulnerability is an unknown functionality of the component Schedule Handler. The manipulation of the argument description leads to cross site scripting. The attack can be launched remotely. The exploit has been disclosed to the public and may be used. The associated identifier of this vulnerability is VDB-230467.,2023-06-01T17:29:59.710,https://cve.circl.lu/cve/CVE-2023-3035
CVE-2023-2530,NA,Orchestration,A privilege escalation allowing remote code execution was discovered in the orchestration service.,2023-06-07T20:24:12.193,https://cve.circl.lu/cve/CVE-2023-2530
CVE-2023-0527,2.7,PHP,"A vulnerability was found in PHPGurukul Online Security Guards Hiring System 1.0 and classified as problematic. Affected by this issue is some unknown functionality of the file search-request.php. The manipulation of the argument searchdata with the input ""><script>alert(document.domain)</script> leads to cross site scripting. The attack may be launched remotely. The exploit has been disclosed to the public and may be used. The identifier of this vulnerability is VDB-219596.",2023-06-01T17:15:09.777,https://cve.circl.lu/cve/CVE-2023-0527
CVE-2023-2704,5.9,PHP,"The BP Social Connect plugin for WordPress is vulnerable to authentication bypass in versions up to, and including, 1.5. This is due to insufficient verification on the user being supplied during a Facebook login through the plugin. This makes it possible for unauthenticated attackers to log in as any existing user on the site, such as an administrator, if they have access to the email.",2023-06-05T22:15:11.877,https://cve.circl.lu/cve/CVE-2023-2704
CVE-2023-25598,2.7,PHP,"A vulnerability in the conferencing component of Mitel MiVoice Connect through 19.3 SP2 and 20.x, 21.x, and 22.x through 22.24.1500.0 could allow an unauthenticated attacker to conduct a reflected cross-site scripting (XSS) attack due to insufficient validation for the home.php page. A successful exploit could allow an attacker to execute arbitrary scripts.",2023-06-01T02:08:29.597,https://cve.circl.lu/cve/CVE-2023-25598
CVE-2023-25599,4.0,PHP,"A vulnerability in the conferencing component of Mitel MiVoice Connect through 19.3 SP2 and 20.x, 21.x, and 22.x through 22.24.1500.0 could allow an unauthenticated attacker to conduct a reflected cross-site scripting (XSS) attack due to insufficient validation for the test_presenter.php page. A successful exploit could allow an attacker to execute arbitrary scripts.",2023-06-01T15:25:56.043,https://cve.circl.lu/cve/CVE-2023-25599
CVE-2023-27043,1.4,Python,"The email module of Python through 3.11.3 incorrectly parses e-mail addresses that contain a special character. The wrong portion of an RFC2822 header is identified as the value of the addr-spec. In some applications, an attacker can bypass a protection mechanism in which application access is granted only after verifying receipt of e-mail to a specific domain (e.g., only @company.example.com addresses may be used for signup). This occurs in email/_parseaddr.py in recent versions of Python.",2023-06-01T14:15:11.143,https://cve.circl.lu/cve/CVE-2023-27043
CVE-2023-33175,3.6,Python,ToUI is a Python package for creating user interfaces (websites and desktop apps) from HTML. ToUI is using Flask-Caching (SimpleCache) to store user variables. Websites that use `Website.user_vars` property. It affects versions 2.0.1 to 2.4.0. This issue has been patched in version 2.4.1.,2023-06-07T17:21:24.507,https://cve.circl.lu/cve/CVE-2023-33175
CVE-2023-32682,2.5,Python,"Synapse is a Matrix protocol homeserver written in Python with the Twisted framework. In affected versions it may be possible for a deactivated user to login when using uncommon configurations. This only applies if any of the following are true: 1. JSON Web Tokens are enabled for login via the `jwt_config.enabled` configuration setting. 2. The local password database is enabled via the `password_config.enabled` and `password_config.localdb_enabled` configuration settings *and* a user's password is updated via an admin API after a user is deactivated. Note that the local password database is enabled by default, but it is uncommon to set a user's password after they've been deactivated. Installations that are configured to only allow login via Single Sign-On (SSO) via CAS, SAML or OpenID Connect (OIDC); or via an external password provider (e.g. LDAP) are not affected. If not using JSON Web Tokens, ensure that deactivated users do not have a password set. This issue has been addressed in version 1.85.0. Users are advised to upgrade.",2023-06-07T02:45:20.120,https://cve.circl.lu/cve/CVE-2023-32682
CVE-2023-32683,1.4,Python,"Synapse is a Matrix protocol homeserver written in Python with the Twisted framework. A discovered oEmbed or image URL can bypass the `url_preview_url_blacklist` setting potentially allowing server side request forgery or bypassing network policies. Impact is limited to IP addresses allowed by the `url_preview_ip_range_blacklist` setting (by default this only allows public IPs) and by the limited information returned to the client: 1. For discovered oEmbed URLs, any non-JSON response or a JSON response which includes non-oEmbed information is discarded. 2. For discovered image URLs, any non-image response is discarded. Systems which have URL preview disabled (via the `url_preview_enabled` setting) or have not configured a `url_preview_url_blacklist` are not affected. This issue has been addressed in version 1.85.0. Users are advised to upgrade. User unable to upgrade may also disable URL previews.",2023-06-07T02:45:20.120,https://cve.circl.lu/cve/CVE-2023-32683
CVE-2023-28370,2.7,Phishing,Open redirect vulnerability in Tornado versions 6.3.1 and earlier allows a remote unauthenticated attacker to redirect a user to an arbitrary web site and conduct a phishing attack by having user access a specially crafted URL.,2023-06-01T13:04:56.703,https://cve.circl.lu/cve/CVE-2023-28370
CVE-2023-28705,2.7,Phishing,"Openfind Mail2000 has insufficient filtering special characters of email content of its content filtering function. A remote attacker can exploit this vulnerability using phishing emails that contain malicious web pages injected with JavaScript. When users access the system and open the email, it triggers an XSS (Reflected Cross-site scripting) attack.",2023-06-02T12:48:49.093,https://cve.circl.lu/cve/CVE-2023-28705
CVE-2019-25150,5.9,Phishing,"The Email Templates plugin for WordPress is vulnerable to HTML Injection in versions up to, and including, 1.3. This makes it possible for attackers to present phishing forms or conduct cross-site request forgery attacks against site administrators.",2023-06-07T02:45:10.733,https://cve.circl.lu/cve/CVE-2019-25150
CVE-2015-9306,2.7,RDP,The wp-ultimate-csv-importer plugin before 3.8.1 for WordPress has XSS.,2023-06-06T18:43:33.990,https://cve.circl.lu/cve/CVE-2015-9306
CVE-2022-0360,2.7,RDP,"The Easy Drag And drop All Import : WP Ultimate CSV Importer WordPress plugin before 6.4.3 does not sanitise and escaped imported comments, which could allow high privilege users to import malicious ones (either intentionnaly or not) and lead to Stored Cross-Site Scripting issues",2023-06-07T02:43:44.747,https://cve.circl.lu/cve/CVE-2022-0360
CVE-2021-25019,2.7,RDP,"The SEO Plugin by Squirrly SEO WordPress plugin before 11.1.12 does not escape the type parameter before outputting it back in an attribute in an admin page, leading to a Reflected Cross-Site Scripting",2023-06-07T02:42:47.690,https://cve.circl.lu/cve/CVE-2021-25019
CVE-2022-1977,5.9,RDP,"The Import Export All WordPress Images, Users & Post Types WordPress plugin before 6.5.3 does not fully validate the file to be imported via an URL before making an HTTP request to it, which could allow high privilege users such as admin to perform Blind SSRF attacks",2023-06-07T15:06:55.573,https://cve.circl.lu/cve/CVE-2022-1977
CVE-2018-8065,3.6,Rapid7,An issue was discovered in the web server in Flexense SyncBreeze Enterprise 10.6.24. There is a user mode write access violation on the syncbrs.exe memory region that can be triggered by rapidly sending a variety of HTTP requests with long HTTP header values or long URIs.,2023-06-01T17:15:09.540,https://cve.circl.lu/cve/CVE-2018-8065
CVE-2013-4279,2.9,Red Hat,"imapsync 1.564 and earlier performs a release check by default, which sends sensitive information (imapsync, operating system, and Perl version) to the developer's site.",2023-06-07T13:59:55.603,https://cve.circl.lu/cve/CVE-2013-4279
CVE-2023-28856,3.6,Redis,"Redis is an open source, in-memory database that persists on disk. Authenticated users can use the `HINCRBYFLOAT` command to create an invalid hash field that will crash Redis on access in affected versions. This issue has been addressed in in versions 7.0.11, 6.2.12, and 6.0.19. Users are advised to upgrade. There are no known workarounds for this issue.",2023-06-01T14:15:11.300,https://cve.circl.lu/cve/CVE-2023-28856
CVE-2023-2929,5.9,Remote Desktop,Out of bounds write in Swiftshader in Google Chrome prior to 114.0.5735.90 allowed a remote attacker to potentially exploit heap corruption via a crafted HTML page. (Chromium security severity: High),2023-06-04T04:15:09.337,https://cve.circl.lu/cve/CVE-2023-2929
CVE-2023-2931,5.9,Remote Desktop,Use after free in PDF in Google Chrome prior to 114.0.5735.90 allowed a remote attacker to potentially exploit heap corruption via a crafted PDF file. (Chromium security severity: High),2023-06-04T04:15:10.447,https://cve.circl.lu/cve/CVE-2023-2931
CVE-2023-2932,5.9,Remote Desktop,Use after free in PDF in Google Chrome prior to 114.0.5735.90 allowed a remote attacker to potentially exploit heap corruption via a crafted PDF file. (Chromium security severity: High),2023-06-04T04:15:10.767,https://cve.circl.lu/cve/CVE-2023-2932
CVE-2023-2933,5.9,Remote Desktop,Use after free in PDF in Google Chrome prior to 114.0.5735.90 allowed a remote attacker to potentially exploit heap corruption via a crafted PDF file. (Chromium security severity: High),2023-06-04T04:15:11.473,https://cve.circl.lu/cve/CVE-2023-2933
CVE-2023-32758,3.6,Repository,"giturlparse (aka git-url-parse) through 1.2.2, as used in Semgrep 1.5.2 through 1.24.1, is vulnerable to ReDoS (Regular Expression Denial of Service) if parsing untrusted URLs. This might be relevant if Semgrep is analyzing an untrusted package (for example, to check whether it accesses any Git repository at an http:// URL), and that package's author placed a ReDoS attack payload in a URL used by the package.",2023-06-06T18:15:10.883,https://cve.circl.lu/cve/CVE-2023-32758
CVE-2023-2942,5.2,Repository,Improper Input Validation in GitHub repository openemr/openemr prior to 7.0.1.,2023-06-01T03:55:35.047,https://cve.circl.lu/cve/CVE-2023-2942
CVE-2023-2943,5.9,Repository,Code Injection in GitHub repository openemr/openemr prior to 7.0.1.,2023-06-01T03:45:56.243,https://cve.circl.lu/cve/CVE-2023-2943
CVE-2023-27536,3.6,Repo,An authentication bypass vulnerability exists libcurl <8.0.0 in the connection reuse feature which can reuse previously established connections with incorrect user permissions due to a failure to check for changes in the CURLOPT_GSSAPI_DELEGATION option. This vulnerability affects krb5/kerberos/negotiate/GSSAPI transfers and could potentially result in unauthorized access to sensitive information. The safest option is to not reuse connections if the CURLOPT_GSSAPI_DELEGATION option has been changed.,2023-06-06T20:34:24.683,https://cve.circl.lu/cve/CVE-2023-27536
CVE-2023-29218,3.6,Repo,"** DISPUTED ** The Twitter Recommendation Algorithm through ec83d01 allows attackers to cause a denial of service (reduction of reputation score) by arranging for multiple Twitter accounts to coordinate negative signals regarding a target account, such as unfollowing, muting, blocking, and reporting, as exploited in the wild in March and April 2023. NOTE: Vendor states that allowing users to unfollow, mute, block, and report tweets and accounts and the impact of these negative engagements on Twitter’s ranking algorithm is a conscious design decision, rather than a security vulnerability.",2023-06-02T15:15:09.120,https://cve.circl.lu/cve/CVE-2023-29218
CVE-2022-3243,5.9,SQL,"The Import all XML, CSV & TXT WordPress plugin before 6.5.8 does not properly sanitise and escape imported data before using them back SQL statements, leading to SQL injection exploitable by high privilege users such as admin",2023-06-07T15:06:18.073,https://cve.circl.lu/cve/CVE-2022-3243
CVE-2023-33945,5.9,SQL,"SQL injection vulnerability in the upgrade process for SQL Server in Liferay Portal 7.3.1 through 7.4.3.17, and Liferay DXP 7.3 before update 6, and 7.4 before update 18 allows attackers to execute arbitrary SQL commands via the name of a database table's primary key index. This vulnerability is only exploitable when chained with other attacks. To exploit this vulnerability, the attacker must modify the database and wait for the application to be upgraded.",2023-06-02T16:16:26.753,https://cve.circl.lu/cve/CVE-2023-33945
CVE-2023-2851,5.9,SQL,"** UNSUPPPORTED WHEN ASSIGNED ** Improper Neutralization of Special Elements used in an SQL Command ('SQL Injection') vulnerability in AGT Tech Ceppatron allows Command Line Execution through SQL Injection, SQL Injection.This issue affects all versions of the sofware also EOS when CVE-ID assigned.",2023-06-01T17:25:44.113,https://cve.circl.lu/cve/CVE-2023-2851
CVE-2023-33279,5.9,SQL,"In the Store Commander scfixmyprestashop module through 2023-05-09 for PrestaShop, sensitive SQL calls can be executed with a trivial HTTP request and exploited to forge a blind SQL injection.",2023-06-01T17:56:19.410,https://cve.circl.lu/cve/CVE-2023-33279
CVE-2023-2951,5.2,SQL,A vulnerability classified as critical has been found in code-projects Bus Dispatch and Information System 1.0. Affected is an unknown function of the file delete_bus.php. The manipulation of the argument busid leads to sql injection. It is possible to launch the attack remotely. The exploit has been disclosed to the public and may be used. The identifier of this vulnerability is VDB-230112.,2023-06-01T03:52:51.403,https://cve.circl.lu/cve/CVE-2023-2951
CVE-2023-2804,3.6,SSL,"A heap-based buffer overflow issue was discovered in libjpeg-turbo in h2v2_merged_upsample_internal() function of jdmrgext.c file. The vulnerability can only be exploited with 12-bit data precision for which the range of the sample data type exceeds the valid sample range, hence, an attacker could craft a 12-bit lossless JPEG image that contains out-of-range 12-bit samples. An application attempting to decompress such image using merged upsampling would lead to segmentation fault or buffer overflows, causing an application to crash.",2023-06-06T13:40:34.820,https://cve.circl.lu/cve/CVE-2023-2804
CVE-2023-29631,5.9,SSL,PrestaShop jmsslider 1.6.0 is vulnerable to Incorrect Access Control via ajax_jmsslider.php.,2023-06-06T12:50:56.083,https://cve.circl.lu/cve/CVE-2023-29631
CVE-2020-29547,3.6,STARTTLS,"An issue was discovered in Citadel through webcit-926. Meddler-in-the-middle attackers can pipeline commands after POP3 STLS, IMAP STARTTLS, or SMTP STARTTLS commands, injecting cleartext commands into an encrypted user session. This can lead to credential disclosure.",2023-06-05T16:37:54.740,https://cve.circl.lu/cve/CVE-2020-29547
CVE-2021-37845,1.4,STARTTLS,"An issue was discovered in Citadel through webcit-932. A meddler-in-the-middle attacker can fixate their own session during the cleartext phase before a STARTTLS command (a violation of ""The STARTTLS command is only valid in non-authenticated state."" in RFC2595). This potentially allows an attacker to cause a victim's e-mail messages to be stored into an attacker's IMAP mailbox, but depends on details of the victim's client behavior.",2023-06-05T16:40:08.417,https://cve.circl.lu/cve/CVE-2021-37845
CVE-2023-28322,5.2,SUSE,"An information disclosure vulnerability exists in curl <v8.1.0 when doing HTTP(S) transfers, libcurl might erroneously use the read callback (`CURLOPT_READFUNCTION`) to ask for data to send, even when the `CURLOPT_POSTFIELDS` option has been set, if the same handle previously wasused to issue a `PUT` request which used that callback. This flaw may surprise the application and cause it to misbehave and either send off the wrong data or use memory after free or similar in the second transfer. The problem exists in the logic for a reused handle when it is (expected to be) changed from a PUT to a POST.",2023-06-07T04:15:10.370,https://cve.circl.lu/cve/CVE-2023-28322
CVE-2023-32307,3.6,SIP,"Sofia-SIP is an open-source SIP User-Agent library, compliant with the IETF RFC3261 specification.Referring to [GHSA-8599-x7rq-fr54](https://github.com/freeswitch/sofia-sip/security/advisories/GHSA-8599-x7rq-fr54), several other potential heap-over-flow and integer-overflow in stun_parse_attr_error_code and stun_parse_attr_uint32 were found because the lack of attributes length check when Sofia-SIP handles STUN packets. The previous patch of [GHSA-8599-x7rq-fr54](https://github.com/freeswitch/sofia-sip/security/advisories/GHSA-8599-x7rq-fr54) fixed the vulnerability when attr_type did not match the enum value, but there are also vulnerabilities in the handling of other valid cases. The OOB read and integer-overflow made by attacker may lead to crash, high consumption of memory or even other more serious consequences. These issue have been addressed in version 1.13.15. Users are advised to upgrade.",2023-06-02T18:15:09.533,https://cve.circl.lu/cve/CVE-2023-32307
CVE-2023-28319,3.6,SSH,"A use after free vulnerability exists in curl <v8.1.0 in the way libcurl offers a feature to verify an SSH server's public key using a SHA 256 hash. When this check fails, libcurl would free the memory for the fingerprint before it returns an error message containing the (now freed) hash. This flaw risks inserting sensitive heap-based data into the error message that might be shown to users or otherwise get leaked and revealed.",2023-06-02T18:19:19.607,https://cve.circl.lu/cve/CVE-2023-28319
CVE-2022-24630,5.9,SSH,An issue was discovered in AudioCodes Device Manager Express through 7.8.20002.47752. BrowseFiles.php allows a ?cmd=ssh POST request with an ssh_command field that is executed.,2023-06-02T03:05:28.773,https://cve.circl.lu/cve/CVE-2022-24630
CVE-2023-0461,5.9,TLS,"There is a use-after-free vulnerability in the Linux Kernel which can be exploited to achieve local privilege escalation. To reach the vulnerability kernel configuration flag CONFIG_TLS or CONFIG_XFRM_ESPINTCP has to be configured, but the operation does not require any privilege.There is a use-after-free bug of icsk_ulp_data of a struct inet_connection_sock.When CONFIG_TLS is enabled, user can install a tls context (struct tls_context) on a connected tcp socket. The context is not cleared if this socket is disconnected and reused as a listener. If a new socket is created from the listener, the context is inherited and vulnerable.The setsockopt TCP_ULP operation does not require any privilege.We recommend upgrading past commit 2c02d41d71f90a5168391b6a5f2954112ba2307c",2023-06-06T19:16:28.137,https://cve.circl.lu/cve/CVE-2023-0461
CVE-2023-28321,3.6,TLS,"An improper certificate validation vulnerability exists in curl <v8.1.0 in the way it supports matching of wildcard patterns when listed as ""Subject Alternative Name"" in TLS server certificates. curl can be built to use its own name matching function for TLS rather than one provided by a TLS library. This private wildcard matching function would match IDN (International Domain Name) hosts incorrectly and could as a result accept patterns that otherwise should mismatch. IDN hostnames are converted to puny code before used for certificate checks. Puny coded names always start with `xn--` and should not be allowed to pattern match, but the wildcard check in curl could still check for `x*`, which would match even though the IDN name most likely contained nothing even resembling an `x`.",2023-06-07T04:15:10.037,https://cve.circl.lu/cve/CVE-2023-28321
CVE-2023-2923,5.9,Tenda,A vulnerability classified as critical was found in Tenda AC6 US_AC6V1.0BR_V15.03.05.19. Affected by this vulnerability is the function fromDhcpListClient. The manipulation leads to stack-based buffer overflow. The attack can be launched remotely. The exploit has been disclosed to the public and may be used. The identifier VDB-230077 was assigned to this vulnerability. NOTE: The vendor was contacted early about this disclosure but did not respond in any way.,2023-06-03T03:57:06.737,https://cve.circl.lu/cve/CVE-2023-2923
CVE-2023-33669,NA,Tenda,Tenda AC8V4.0-V16.03.34.06 was discovered to contain a stack overflow via the timeZone parameter in the sub_44db3c function.,2023-06-02T20:58:57.383,https://cve.circl.lu/cve/CVE-2023-33669
CVE-2023-33670,NA,Tenda,Tenda AC8V4.0-V16.03.34.06 was discovered to contain a stack overflow via the time parameter in the sub_4a79ec function.,2023-06-02T20:58:57.383,https://cve.circl.lu/cve/CVE-2023-33670
CVE-2023-33671,NA,Tenda,Tenda AC8V4.0-V16.03.34.06 was discovered to contain a stack overflow via the deviceId parameter in the saveParentControlInfo function.,2023-06-02T20:58:57.383,https://cve.circl.lu/cve/CVE-2023-33671
CVE-2023-33672,NA,Tenda,Tenda AC8V4.0-V16.03.34.06 was discovered to contain a stack overflow via the shareSpeed parameter in the fromSetWifiGusetBasic function.,2023-06-02T20:58:57.383,https://cve.circl.lu/cve/CVE-2023-33672
CVE-2021-31693,4.0,VMware,"The 10Web Photo Gallery plugin through 1.5.68 for WordPress allows XSS via album_gallery_id_0, bwg_album_search_0, and type_0 for bwg_frontend_data. NOTE: other parameters are covered by CVE-2021-24291, CVE-2021-25041, and CVE-2021-46889. NOTE: VMware information, previously connected to this CVE ID because of a typo, is at CVE-2022-31693.",2023-06-07T16:15:09.247,https://cve.circl.lu/cve/CVE-2021-31693
CVE-2023-20877,5.9,VMware,VMware Aria Operations contains a privilege escalation vulnerability. An authenticated malicious user with ReadOnly privileges can perform code execution leading to privilege escalation.,2023-06-02T14:45:40.740,https://cve.circl.lu/cve/CVE-2023-20877
CVE-2023-20878,5.9,VMware,VMware Aria Operations contains a deserialization vulnerability. A malicious actor with administrative privileges can execute arbitrary commands and disrupt the system.,2023-06-02T14:44:42.060,https://cve.circl.lu/cve/CVE-2023-20878
CVE-2023-20879,5.9,VMware,VMware Aria Operations contains a Local privilege escalation vulnerability. A malicious actor with administrative privileges in the Aria Operations application can gain root access to the underlying operating system.,2023-06-02T14:45:32.940,https://cve.circl.lu/cve/CVE-2023-20879
CVE-2023-32348,1.4,VPN,"Teltonika’s Remote Management System versions prior to 4.10.0 contain a virtual private network (VPN) hub feature for cross-device communication that uses OpenVPN. It connects new devices in a manner that allows the new device to communicate with all Teltonika devices connected to the VPN. The OpenVPN server also allows users to route through it. An attacker could route a connection to a remote server through the OpenVPN server, enabling them to scan and access data from other Teltonika devices connected to the VPN.",2023-06-01T14:26:59.373,https://cve.circl.lu/cve/CVE-2023-32348
CVE-2023-22970,5.9,VS Code,"Bottles before 51.0 mishandles YAML load, which allows remote code execution via a crafted file.",2023-06-01T19:26:48.843,https://cve.circl.lu/cve/CVE-2023-22970
CVE-2023-32766,NA,VS Code,Gitpod before 2022.11.3 allows XSS because redirection can occur for some protocols outside of the trusted set of three (vscode: vscode-insiders: jetbrains-gateway:).,2023-06-05T16:42:43.303,https://cve.circl.lu/cve/CVE-2023-32766
